120,2048,confidence,<praw.reddit.Reddit object at 0x7f2244aead90>,,infertility,"Use this thread to share anything not necessarily related to infertility. Rant or rave, bitch, moan, share something funny, anything goes!",t2_6l4z3,False,,0,False,Thursday Off Topic Thread,[],r/infertility,False,0,,0,,,False,t3_2wezwj,False,dark,1.0,,public,3,0,{},,,False,[],,False,False,,{},,False,3,,True,self,False,,[],{},,True,,1424368935.0,text,0,,,text,self.infertility,False,"<!-- SC_OFF --><div class=""md""><p>Use this thread to share anything not necessarily related to infertility. Rant or rave, bitch, moan, share something funny, anything goes!</p>
</div><!-- SC_ON -->",,,,,True,False,False,False,False,[],[],False,False,False,False,,[],False,,,moderator,t5_2saej,,,,2wezwj,True,,AutoModerator,,80,True,no_ads,False,[],False,,/r/infertility/comments/2wezwj/thursday_off_topic_thread/,no_ads,False,https://www.reddit.com/r/infertility/comments/2wezwj/thursday_off_topic_thread/,25375,1424340135.0,0,,False,False,{}
121,2048,confidence,<praw.reddit.Reddit object at 0x7f2244aead90>,,infertility,"So over the this TTC period of my life my period has been fairly regular with a few exceptions. I usually know it's coming because I can't sleep the night before due to extreme gasinous and I spot for one day prior. Right now I am anxiously awaiting my next cycle so I can start my FET process. I was supposed to get my period Monday and I did start spotting Monday. I also had trouble sleeping the night before but it was a bit different. I kept waking up extremely hot and sweaty. I initially attributed it due to the fact that temperatures are warming up a bit where I live. Well it's Wednesday night and I am still spotting and still having night sweats. Last night I did have a short period of normal sleep due to exhaustion. I am so tired the past couple nights I can barely function. 

Desperate, I turned to Dr. Google. 

Besides a bunch of diseases and whatnot, my symptoms could mean a. Perimenopause and possible b. Early pregnancy. Now, the only way it could be early pregnancy is if I ovulated late and if I ovulated late it would be very early pregnancy. But premenopause? That has me freaked the fuck out. From what I read it could just be a shift in hormones too and I'm thinking that's my case, that this period is just more messed up than usual, but what the hell?! I can't help but think of all the scenarios from the extremely good to extremely bad and I hate it so god damn much. I refuse to test until I am at least a week late and I hate that I am actually considering I could be pregnant, that my hopes are actually a bit raised. 

If anyone has any insight on night sweats or what I am going through I would appreciate it. From today's off topic I know I am not alone with having to go through the turmoil of a period that is late. Gaaaaaah. 

TL;DR: Night Sweats. Late period. WTF. 

Edit: so my period is a master troll just like some mentioned. Got it today! I'm angry and relieved at the same time. Looking forward to my FET too. 
",t2_l1nlo,False,,0,False,I was Stupid and I turned to Dr. Google.,[],r/infertility,False,0,,0,,,False,t3_2wej3a,False,dark,1.0,,public,3,0,{},,,False,[],,False,False,,{},,False,3,,False,self,1424369241.0,,[],{},,True,,1424354202.0,text,0,,,text,self.infertility,False,"<!-- SC_OFF --><div class=""md""><p>So over the this TTC period of my life my period has been fairly regular with a few exceptions. I usually know it&#39;s coming because I can&#39;t sleep the night before due to extreme gasinous and I spot for one day prior. Right now I am anxiously awaiting my next cycle so I can start my FET process. I was supposed to get my period Monday and I did start spotting Monday. I also had trouble sleeping the night before but it was a bit different. I kept waking up extremely hot and sweaty. I initially attributed it due to the fact that temperatures are warming up a bit where I live. Well it&#39;s Wednesday night and I am still spotting and still having night sweats. Last night I did have a short period of normal sleep due to exhaustion. I am so tired the past couple nights I can barely function. </p>

<p>Desperate, I turned to Dr. Google. </p>

<p>Besides a bunch of diseases and whatnot, my symptoms could mean a. Perimenopause and possible b. Early pregnancy. Now, the only way it could be early pregnancy is if I ovulated late and if I ovulated late it would be very early pregnancy. But premenopause? That has me freaked the fuck out. From what I read it could just be a shift in hormones too and I&#39;m thinking that&#39;s my case, that this period is just more messed up than usual, but what the hell?! I can&#39;t help but think of all the scenarios from the extremely good to extremely bad and I hate it so god damn much. I refuse to test until I am at least a week late and I hate that I am actually considering I could be pregnant, that my hopes are actually a bit raised. </p>

<p>If anyone has any insight on night sweats or what I am going through I would appreciate it. From today&#39;s off topic I know I am not alone with having to go through the turmoil of a period that is late. Gaaaaaah. </p>

<p>TL;DR: Night Sweats. Late period. WTF. </p>

<p>Edit: so my period is a master troll just like some mentioned. Got it today! I&#39;m angry and relieved at the same time. Looking forward to my FET too. </p>
</div><!-- SC_ON -->",,,,,True,False,False,False,False,[],[],False,False,False,False,,[],False,,,,t5_2saej,,,,2wej3a,True,,revangelfire,,17,True,no_ads,False,[],False,,/r/infertility/comments/2wej3a/i_was_stupid_and_i_turned_to_dr_google/,no_ads,False,https://www.reddit.com/r/infertility/comments/2wej3a/i_was_stupid_and_i_turned_to_dr_google/,25375,1424325402.0,0,,False,False,{}
122,2048,confidence,<praw.reddit.Reddit object at 0x7f2244aead90>,,infertility,"Anyone else have a partner who feels this way?

My husband made me so sad when he said that if we do IVF, he feels like he's just providing the ingredients and that's it. Someone else is making the baby (I.E. the lab). I'm trying to convince him that no, it's still our sperm and egg, it's still out of love, but he just feels like an outsider. I think in his mind, he feels like he isn't involved at all..because if it does work, I at least get those 9 months to ""grow"" and bond with the baby. I've never heard this side of the argument before. Is this a normal way to think? Will he regret our future child if it comes from a petri dish? Now that I've heard what he thinks, I can't help but think.. is he right? ",t2_iug8b,False,,0,False,IVF: Husband thinks he's an outsider.,[],r/infertility,False,0,,0,,,False,t3_2wczgz,False,dark,1.0,,public,2,0,{},,,False,[],,False,False,,{},,False,2,,False,self,False,,[],{},,True,,1424325960.0,text,0,,,text,self.infertility,False,"<!-- SC_OFF --><div class=""md""><p>Anyone else have a partner who feels this way?</p>

<p>My husband made me so sad when he said that if we do IVF, he feels like he&#39;s just providing the ingredients and that&#39;s it. Someone else is making the baby (I.E. the lab). I&#39;m trying to convince him that no, it&#39;s still our sperm and egg, it&#39;s still out of love, but he just feels like an outsider. I think in his mind, he feels like he isn&#39;t involved at all..because if it does work, I at least get those 9 months to &quot;grow&quot; and bond with the baby. I&#39;ve never heard this side of the argument before. Is this a normal way to think? Will he regret our future child if it comes from a petri dish? Now that I&#39;ve heard what he thinks, I can&#39;t help but think.. is he right? </p>
</div><!-- SC_ON -->",,,,,True,False,False,False,False,[],[],False,False,False,False,Severe MFI etc. Surprise BFP. Baby boy born Dec 2015,[],False,,,,t5_2saej,,,,2wczgz,True,,healthylurker,,19,True,no_ads,False,[],False,dark,/r/infertility/comments/2wczgz/ivf_husband_thinks_hes_an_outsider/,no_ads,False,https://www.reddit.com/r/infertility/comments/2wczgz/ivf_husband_thinks_hes_an_outsider/,25375,1424297160.0,0,,False,False,{}
123,2048,confidence,<praw.reddit.Reddit object at 0x7f2244aead90>,,infertility,I'll be in and out for the next few hours. http://webchat.snoonet.org/infertility,t2_gn455,False,,0,False,Chat anyone?,[],r/infertility,False,0,,0,,,False,t3_2wctyh,False,dark,0.75,,public,2,0,{},,,False,[],,False,False,,{},,False,2,,False,self,False,,[],{},,True,,1424323626.0,text,0,,,text,self.infertility,False,"<!-- SC_OFF --><div class=""md""><p>I&#39;ll be in and out for the next few hours. <a href=""http://webchat.snoonet.org/infertility"">http://webchat.snoonet.org/infertility</a></p>
</div><!-- SC_ON -->",,,,,True,False,False,False,False,[],[],False,False,False,False,FET soon,[],False,,,,t5_2saej,,,,2wctyh,True,,waterfall444,,8,True,no_ads,False,[],False,dark,/r/infertility/comments/2wctyh/chat_anyone/,no_ads,False,https://www.reddit.com/r/infertility/comments/2wctyh/chat_anyone/,25375,1424294826.0,0,,False,False,{}
124,2048,confidence,<praw.reddit.Reddit object at 0x7f2244aead90>,,infertility,"I've been churning over the costs and emotional issues around donor IVF, and ruminating like hell, and a friend just gave me a smackdown.

She reminded me that I've never been one to hesitate or shy away from trouble and that me at my best self jumps into the big risks feet first. I've never been one to get deterred by worry about the little stuff, or even the big stuff, or because even if I do worry about it, I go for it anyway and just work it all out as I go. I know how to make hard decisions and be okay with them. Me at my best self does not fear failure or difficulty or trouble.

So, here we go. Me at my best self needs to make a comeback, because my best self can handle shit. With a lot of bitching and complaining and cursing along the way, sure, but that's how I handle shit. With motherfuckers.

I'm not saying we'll never give up, because frankly, maybe we will need to. And, it's I know that it's totally likely that none of this will work and we may end up spending a shit ton of money and ending up with nothing. 

But it was good to remember that this has never stopped me before, so why should it stop me now?

I know everyone has to make different choices and has a different path in all of this... but man, did I need this reminder. Fuck this process, whatever happens, it's not going to beat me.",t2_fqj3k,False,,0,False,A much needed kick in the ass,[],r/infertility,False,0,,0,,,False,t3_2wco39,False,dark,0.94,,public,12,0,{},,,False,[],,False,False,,{},,False,12,,False,self,False,,[],{},,True,,1424321103.0,text,0,,,text,self.infertility,True,"<!-- SC_OFF --><div class=""md""><p>I&#39;ve been churning over the costs and emotional issues around donor IVF, and ruminating like hell, and a friend just gave me a smackdown.</p>

<p>She reminded me that I&#39;ve never been one to hesitate or shy away from trouble and that me at my best self jumps into the big risks feet first. I&#39;ve never been one to get deterred by worry about the little stuff, or even the big stuff, or because even if I do worry about it, I go for it anyway and just work it all out as I go. I know how to make hard decisions and be okay with them. Me at my best self does not fear failure or difficulty or trouble.</p>

<p>So, here we go. Me at my best self needs to make a comeback, because my best self can handle shit. With a lot of bitching and complaining and cursing along the way, sure, but that&#39;s how I handle shit. With motherfuckers.</p>

<p>I&#39;m not saying we&#39;ll never give up, because frankly, maybe we will need to. And, it&#39;s I know that it&#39;s totally likely that none of this will work and we may end up spending a shit ton of money and ending up with nothing. </p>

<p>But it was good to remember that this has never stopped me before, so why should it stop me now?</p>

<p>I know everyone has to make different choices and has a different path in all of this... but man, did I need this reminder. Fuck this process, whatever happens, it&#39;s not going to beat me.</p>
</div><!-- SC_ON -->",,,,,True,False,False,False,False,[],[],False,False,False,False,38 DOR IVF My motherfucking ovaries are special snowflakes,[],False,,,,t5_2saej,,,,2wco39,True,,sonalogy,,6,True,no_ads,False,[],False,dark,/r/infertility/comments/2wco39/a_much_needed_kick_in_the_ass/,no_ads,False,https://www.reddit.com/r/infertility/comments/2wco39/a_much_needed_kick_in_the_ass/,25375,1424292303.0,0,,False,False,{}
125,2048,confidence,<praw.reddit.Reddit object at 0x7f2244aead90>,,infertility,[deleted],,False,,0,False,Money Factor,[],r/infertility,False,0,,0,,,False,t3_2wc70o,False,dark,0.84,,public,4,0,{},,,False,[],,False,False,,{},,False,4,,,default,False,,,{},,True,,1424313830.0,text,0,,,,self.infertility,False,"<!-- SC_OFF --><div class=""md""><p>[deleted]</p>
</div><!-- SC_ON -->",,,,,True,False,False,False,False,[],[],False,False,False,False,,[],False,,,,t5_2saej,,,,2wc70o,False,,,,55,True,no_ads,False,[],,dark,/r/infertility/comments/2wc70o/money_factor/,no_ads,False,https://www.reddit.com/r/infertility/comments/2wc70o/money_factor/,25375,1424285030.0,0,,False,False,{}
126,2048,confidence,<praw.reddit.Reddit object at 0x7f2244aead90>,,infertility,"My doctor is going to put me on Letrazole, I guess. But not until I meet with an RE. There's another couple thousand down the tubes I'm sure (ha, see what I did there?)
Why do they want to put me on Letrazole if I'm getting pregnant on Clomid? I'm just not keeping pregnancies. I don't see any benefits of Letrazole/Femara that Clomid doesn't do already. Except that Letrazole/Femara may potentially raise the rate of birth defects. Sounds like a blast. Can't wait to get started.",,False,,0,False,"Fine, I'll schedule with an RE.",[],r/infertility,False,0,,0,,,False,t3_2wbqeo,False,dark,0.5,,public,0,0,{},,,False,[],,False,False,,{},,False,0,,,self,False,,,{},,True,,1424306496.0,text,0,,,,self.infertility,True,"<!-- SC_OFF --><div class=""md""><p>My doctor is going to put me on Letrazole, I guess. But not until I meet with an RE. There&#39;s another couple thousand down the tubes I&#39;m sure (ha, see what I did there?)
Why do they want to put me on Letrazole if I&#39;m getting pregnant on Clomid? I&#39;m just not keeping pregnancies. I don&#39;t see any benefits of Letrazole/Femara that Clomid doesn&#39;t do already. Except that Letrazole/Femara may potentially raise the rate of birth defects. Sounds like a blast. Can&#39;t wait to get started.</p>
</div><!-- SC_ON -->",,,,,True,True,False,False,False,[],[],False,False,False,False,,[],False,,,,t5_2saej,,,,2wbqeo,True,,,,22,True,no_ads,False,[],,dark,/r/infertility/comments/2wbqeo/fine_ill_schedule_with_an_re/,no_ads,False,https://www.reddit.com/r/infertility/comments/2wbqeo/fine_ill_schedule_with_an_re/,25375,1424277696.0,0,,False,False,{}
127,2048,confidence,<praw.reddit.Reddit object at 0x7f2244aead90>,,infertility,"http://www.advancedfertility.com/fertility-treatment-costs.htm

This is from a hospital in Chicago, but the treatments I've gone through fit this pretty well.

Anyone can downvote the shit out of this, but I wish someone had shared this when I got started so I knew what was ahead of me.",,False,,0,False,The price of pregnancy. Looks about spot-on to me.,[],r/infertility,False,0,,0,,,False,t3_2wbq42,False,dark,0.9,,public,23,0,{},,,False,[],,False,False,,{},,False,23,,,self,1424279123.0,,,{},,True,,1424306354.0,text,0,,,,self.infertility,False,"<!-- SC_OFF --><div class=""md""><p><a href=""http://www.advancedfertility.com/fertility-treatment-costs.htm"">http://www.advancedfertility.com/fertility-treatment-costs.htm</a></p>

<p>This is from a hospital in Chicago, but the treatments I&#39;ve gone through fit this pretty well.</p>

<p>Anyone can downvote the shit out of this, but I wish someone had shared this when I got started so I knew what was ahead of me.</p>
</div><!-- SC_ON -->",,,,,True,False,False,False,False,[],[],False,False,False,False,,[],False,,,,t5_2saej,,,,2wbq42,True,,,,46,True,no_ads,False,[],,dark,/r/infertility/comments/2wbq42/the_price_of_pregnancy_looks_about_spoton_to_me/,no_ads,False,https://www.reddit.com/r/infertility/comments/2wbq42/the_price_of_pregnancy_looks_about_spoton_to_me/,25375,1424277554.0,0,,False,False,{}
128,2048,confidence,<praw.reddit.Reddit object at 0x7f2244aead90>,,infertility,[deleted],,False,,0,False,Looks like Femara is next. Higher rate of birth defects?,[],r/infertility,False,0,,0,,,False,t3_2wbpdc,False,dark,1.0,,public,1,0,{},,,False,[],,False,False,,{},,False,1,,,default,False,,,{},,True,,1424306012.0,text,0,,,,self.infertility,False,"<!-- SC_OFF --><div class=""md""><p>[deleted]</p>
</div><!-- SC_ON -->",,,,,True,True,False,False,False,[],[],False,False,False,False,,[],False,,,,t5_2saej,,,,2wbpdc,False,,,,0,True,no_ads,False,[],,dark,/r/infertility/comments/2wbpdc/looks_like_femara_is_next_higher_rate_of_birth/,no_ads,False,https://www.reddit.com/r/infertility/comments/2wbpdc/looks_like_femara_is_next_higher_rate_of_birth/,25375,1424277212.0,0,,False,False,{}
129,2048,confidence,<praw.reddit.Reddit object at 0x7f2244aead90>,,infertility,"Has anyone sought therapy for everything they're going through?  I feel like likely I've hit tidal wave after tidal wave of emotions and I just can't sort it all out.  I started researching therapists in my area that specialize in infertility but I was wondering what y'all experienced, if anything.  You don't have to go into gritty details, just whatever you feel like sharing.  Thanks and much love! <3

**UPDATE:** Thanks SO MUCH to everyone that weighed in and gave advice, shared stories, etc.  I really appreciate it!!  I've loved having this group as an awesome sounding board.  :)  I have my intake appt today so we'll see how that goes and if she's someone I want to keep seeing.  I'll keep y'all posted!!",t2_ivw2a,False,,0,False,Therapy?,[],r/infertility,False,0,,0,,,False,t3_2wb3a2,False,dark,0.81,,public,3,0,{},,,False,[],,False,False,,{},,False,3,,False,self,1424346784.0,,[],{},,True,,1424293682.0,text,0,,,text,self.infertility,True,"<!-- SC_OFF --><div class=""md""><p>Has anyone sought therapy for everything they&#39;re going through?  I feel like likely I&#39;ve hit tidal wave after tidal wave of emotions and I just can&#39;t sort it all out.  I started researching therapists in my area that specialize in infertility but I was wondering what y&#39;all experienced, if anything.  You don&#39;t have to go into gritty details, just whatever you feel like sharing.  Thanks and much love! &lt;3</p>

<p><strong>UPDATE:</strong> Thanks SO MUCH to everyone that weighed in and gave advice, shared stories, etc.  I really appreciate it!!  I&#39;ve loved having this group as an awesome sounding board.  :)  I have my intake appt today so we&#39;ll see how that goes and if she&#39;s someone I want to keep seeing.  I&#39;ll keep y&#39;all posted!!</p>
</div><!-- SC_ON -->",,,,,True,False,False,False,False,[],[],False,False,False,False,Hard to get pregnant after a hysto.,[],False,,,,t5_2saej,,,,2wb3a2,True,,nhmejia,,50,True,no_ads,False,[],False,dark,/r/infertility/comments/2wb3a2/therapy/,no_ads,False,https://www.reddit.com/r/infertility/comments/2wb3a2/therapy/,25375,1424264882.0,0,,False,False,{}
130,2048,confidence,<praw.reddit.Reddit object at 0x7f2244aead90>,,infertility,"Use this thread to share anything not necessarily related to infertility. Rant or rave, bitch, moan, share something funny, anything goes!",t2_6l4z3,False,,0,False,Wednesday Off Topic Thread,[],r/infertility,False,0,,0,,,False,t3_2waqzl,False,dark,1.0,,public,2,0,{},,,False,[],,False,False,,{},,False,2,,True,self,False,,[],{},,True,,1424282535.0,text,0,,,text,self.infertility,False,"<!-- SC_OFF --><div class=""md""><p>Use this thread to share anything not necessarily related to infertility. Rant or rave, bitch, moan, share something funny, anything goes!</p>
</div><!-- SC_ON -->",,,,,True,False,False,False,False,[],[],False,False,False,False,,[],False,,,moderator,t5_2saej,,,,2waqzl,True,,AutoModerator,,90,True,no_ads,False,[],False,,/r/infertility/comments/2waqzl/wednesday_off_topic_thread/,no_ads,False,https://www.reddit.com/r/infertility/comments/2waqzl/wednesday_off_topic_thread/,25375,1424253735.0,0,,False,False,{}
131,2048,confidence,<praw.reddit.Reddit object at 0x7f2244aead90>,,infertility,[deleted],,False,,0,False,PCOS and OPKs and Femara?,[],r/infertility,False,0,,0,,,False,t3_2w9ztp,False,dark,1.0,,public,2,0,{},,,False,[],,False,False,,{},,False,2,,,default,False,,,{},,True,,1424262097.0,text,0,,,,self.infertility,False,"<!-- SC_OFF --><div class=""md""><p>[deleted]</p>
</div><!-- SC_ON -->",,,,,True,False,False,False,False,[],[],False,False,False,False,,[],False,,,,t5_2saej,,,,2w9ztp,False,,,,11,True,no_ads,False,[],,dark,/r/infertility/comments/2w9ztp/pcos_and_opks_and_femara/,no_ads,False,https://www.reddit.com/r/infertility/comments/2w9ztp/pcos_and_opks_and_femara/,25375,1424233297.0,0,,False,False,{}
132,2048,confidence,<praw.reddit.Reddit object at 0x7f2244aead90>,,infertility,"I am in the middle of my first FET cycle and they have me on minivelle estrogen patches.  I haven't had any endo pain since my lap in October, but I am starting to have some of the same stabbing pains I used to have in the rectal region and lower back.  I suspect it is the estrogen patches and I really hope that it will go away after this FET cycle.  Has anybody else noticed this that has a history of endo with an FET cycle?  I am concerned the estrogen is causing the endo to come back and my lap would have been pointless...",t2_c31zz,False,,0,False,Endo pain or something else with estrogen patches??,[],r/infertility,False,0,,0,,,False,t3_2w9pnv,False,dark,1.0,,public,3,0,{},,d70f54ce-930e-11e4-8710-22000b26873e,False,[],,False,False,,{},,False,3,,False,self,False,,[],{},,True,,1424256757.0,text,0,,,text,self.infertility,False,"<!-- SC_OFF --><div class=""md""><p>I am in the middle of my first FET cycle and they have me on minivelle estrogen patches.  I haven&#39;t had any endo pain since my lap in October, but I am starting to have some of the same stabbing pains I used to have in the rectal region and lower back.  I suspect it is the estrogen patches and I really hope that it will go away after this FET cycle.  Has anybody else noticed this that has a history of endo with an FET cycle?  I am concerned the estrogen is causing the endo to come back and my lap would have been pointless...</p>
</div><!-- SC_ON -->",,,,,True,False,False,False,False,[],[],False,False,False,False,"32, Endo + MFI + RPL, 3 IVF",[],False,,,,t5_2saej,,,,2w9pnv,True,,wookielegs,,4,True,no_ads,False,[],False,dark,/r/infertility/comments/2w9pnv/endo_pain_or_something_else_with_estrogen_patches/,no_ads,False,https://www.reddit.com/r/infertility/comments/2w9pnv/endo_pain_or_something_else_with_estrogen_patches/,25375,1424227957.0,0,,False,False,{}
133,2048,confidence,<praw.reddit.Reddit object at 0x7f2244aead90>,,infertility,[deleted],,False,,0,False,Tuesday evening chat...,[],r/infertility,False,0,,0,,,False,t3_2w9eva,False,dark,1.0,,public,1,0,{},,,False,[],,False,False,,{},,False,1,,,default,False,,,{},,True,,1424251441.0,text,0,,,,self.infertility,False,"<!-- SC_OFF --><div class=""md""><p>[deleted]</p>
</div><!-- SC_ON -->",,,,,True,True,False,False,True,[],[],False,False,False,False,,[],False,,,,t5_2saej,,,,2w9eva,False,,,,0,True,no_ads,False,[],,dark,/r/infertility/comments/2w9eva/tuesday_evening_chat/,no_ads,False,https://www.reddit.com/r/infertility/comments/2w9eva/tuesday_evening_chat/,25375,1424222641.0,0,,False,False,{}
