,comment_limit,comment_sort,_reddit,approved_at_utc,subreddit,selftext,author_fullname,saved,mod_reason_title,gilded,clicked,title,link_flair_richtext,subreddit_name_prefixed,hidden,pwls,link_flair_css_class,downs,thumbnail_height,top_awarded_type,hide_score,name,quarantine,link_flair_text_color,upvote_ratio,author_flair_background_color,subreddit_type,ups,total_awards_received,media_embed,thumbnail_width,author_flair_template_id,is_original_content,user_reports,secure_media,is_reddit_media_domain,is_meta,category,secure_media_embed,link_flair_text,can_mod_post,score,approved_by,author_premium,thumbnail,edited,author_flair_css_class,author_flair_richtext,gildings,content_categories,is_self,mod_note,created,link_flair_type,wls,removed_by_category,banned_by,author_flair_type,domain,allow_live_comments,selftext_html,likes,suggested_sort,banned_at_utc,view_count,archived,no_follow,is_crosspostable,pinned,over_18,all_awardings,awarders,media_only,can_gild,spoiler,locked,author_flair_text,treatment_tags,visited,removed_by,num_reports,distinguished,subreddit_id,mod_reason_by,removal_reason,link_flair_background_color,id,is_robot_indexable,report_reasons,author,discussion_type,num_comments,send_replies,whitelist_status,contest_mode,mod_reports,author_patreon_flair,author_flair_text_color,permalink,parent_whitelist_status,stickied,url,subreddit_subscribers,created_utc,num_crossposts,media,is_video,_fetched,_comments_by_id
0,2048,confidence,<praw.reddit.Reddit object at 0x7f2244aead90>,,infertility,"Use this thread to share anything not necessarily related to infertility. Rant or rave, bitch, moan, share something funny, anything goes!",t2_6l4z3,False,,0,False,Wednesday Off Topic Thread,[],r/infertility,False,0,,0,,,False,t3_2xw6gp,False,dark,0.75,,public,2,0,{},,,False,[],,False,False,,{},,False,2,,True,self,False,,[],{},,True,,1425492137.0,text,0,,,text,self.infertility,False,"<!-- SC_OFF --><div class=""md""><p>Use this thread to share anything not necessarily related to infertility. Rant or rave, bitch, moan, share something funny, anything goes!</p>
</div><!-- SC_ON -->",,,,,True,False,False,False,False,[],[],False,False,False,False,,[],False,,,moderator,t5_2saej,,,,2xw6gp,True,,AutoModerator,,114,True,no_ads,False,[],False,,/r/infertility/comments/2xw6gp/wednesday_off_topic_thread/,no_ads,False,https://www.reddit.com/r/infertility/comments/2xw6gp/wednesday_off_topic_thread/,25375,1425463337.0,0,,False,False,{}
1,2048,confidence,<praw.reddit.Reddit object at 0x7f2244aead90>,,infertility,"I just had my third miscarriage in the last 7 months. I have no health issues so the doctors really don't have an idea of what is going on, and it feels like I'm prying teeth to get them to run any sort of tests. I'm 23, I have been off of birth control for 13 months and we have been actively TTC for 7 months. My husband is military and we live overseas, so the combination of those two things makes it difficult to get a fertility consult anytime soon (~4 months waiting period). I was wondering at what point while TTC or after how many miscarriages did you start to look into IVF or other treatments? I really know nothing about it, but we have the option to pay out of pocket and go to a local doctor for this and I am considering it. Thanks for your input.",,False,,0,False,The idea of infertility is new to me and I am looking for advice...,[],r/infertility,False,0,,0,,,False,t3_2xuwyv,False,dark,0.67,,public,2,0,{},,,False,[],,False,False,,{},,False,2,,,self,False,,,{},,True,,1425462713.0,text,0,,,,self.infertility,False,"<!-- SC_OFF --><div class=""md""><p>I just had my third miscarriage in the last 7 months. I have no health issues so the doctors really don&#39;t have an idea of what is going on, and it feels like I&#39;m prying teeth to get them to run any sort of tests. I&#39;m 23, I have been off of birth control for 13 months and we have been actively TTC for 7 months. My husband is military and we live overseas, so the combination of those two things makes it difficult to get a fertility consult anytime soon (~4 months waiting period). I was wondering at what point while TTC or after how many miscarriages did you start to look into IVF or other treatments? I really know nothing about it, but we have the option to pay out of pocket and go to a local doctor for this and I am considering it. Thanks for your input.</p>
</div><!-- SC_ON -->",,,,,True,False,False,False,False,[],[],False,False,False,False,,[],False,,,,t5_2saej,,,,2xuwyv,True,,,,15,True,no_ads,False,[],,dark,/r/infertility/comments/2xuwyv/the_idea_of_infertility_is_new_to_me_and_i_am/,no_ads,False,https://www.reddit.com/r/infertility/comments/2xuwyv/the_idea_of_infertility_is_new_to_me_and_i_am/,25375,1425433913.0,0,,False,False,{}
2,2048,confidence,<praw.reddit.Reddit object at 0x7f2244aead90>,,infertility,"This is a repost from another subreddit. But I thought I'd try my luck here to see if I could get any insight into what's happening.

My husband and I did our first IVF this month and second beta came back great yesterday. Numbers were doubling like they're supposed to. I was just about to relax and begin enjoying this ride for once when I started to bleed pretty heavily that night. It started around 6:00pm and I immediately rushed out of the house like a bat out of hell trying to figure out what to do. I called the doctor (already left for the day), I called my husband (he didn't know what to do), and finally ended up sobbing in the parking lot of a nail salon.

My doctor called me back about 15 minutes later and told me it could be a few different things (Implantation bleeding into a blood vessel, residual bleeding from the transfer that's emerging because everything down there is filling with blood vessels for the baby, and of course, there's always M/C on the table).

We're right in the timeline for implantation bleeding, but this was heavy and dark and I passed what looked like tissue this morning. Not to mention the cramping. It's gotten better since this morning, but I still have dark red blood that fills up a pantyliner. I mean, it's literally like I'm on my period with a moderate flow. Sometimes it lessens, but a few hours later it usually cramps and bleeds again. 

I worry that my body is forcing this baby out of me and there's nothing I can do but wait. Every time I move my heart just sinks because I feel either another cramp, or I can tell there's more bleeding. I called the nurse again this morning and she told me the same thing. She tried to reassure me that she's seen worse and women go on to have healthy pregnancies, but I just don't know. She said there's no reason for me to brace for the worst just yet, especially since that second Beta was good. That Beta is sort of the last glimmer of hope left on the table. But I'm skeptical.

I go back in for another Beta in the morning to see if I'm still doubling normally. Has anyone ever experienced this kind of thing this early on? With either a good or bad outcome? Just looking for answers. ",t2_eqnz0,False,,0,False,"Positive Beta, and then heavy bleeding 12 hours later (possible Trigger warning)",[],r/infertility,False,0,,0,,,False,t3_2xunfx,False,dark,0.58,,public,2,0,{},,,False,[],,False,False,,{},,False,2,,False,self,False,,[],{},,True,,1425458083.0,text,0,,,text,self.infertility,False,"<!-- SC_OFF --><div class=""md""><p>This is a repost from another subreddit. But I thought I&#39;d try my luck here to see if I could get any insight into what&#39;s happening.</p>

<p>My husband and I did our first IVF this month and second beta came back great yesterday. Numbers were doubling like they&#39;re supposed to. I was just about to relax and begin enjoying this ride for once when I started to bleed pretty heavily that night. It started around 6:00pm and I immediately rushed out of the house like a bat out of hell trying to figure out what to do. I called the doctor (already left for the day), I called my husband (he didn&#39;t know what to do), and finally ended up sobbing in the parking lot of a nail salon.</p>

<p>My doctor called me back about 15 minutes later and told me it could be a few different things (Implantation bleeding into a blood vessel, residual bleeding from the transfer that&#39;s emerging because everything down there is filling with blood vessels for the baby, and of course, there&#39;s always M/C on the table).</p>

<p>We&#39;re right in the timeline for implantation bleeding, but this was heavy and dark and I passed what looked like tissue this morning. Not to mention the cramping. It&#39;s gotten better since this morning, but I still have dark red blood that fills up a pantyliner. I mean, it&#39;s literally like I&#39;m on my period with a moderate flow. Sometimes it lessens, but a few hours later it usually cramps and bleeds again. </p>

<p>I worry that my body is forcing this baby out of me and there&#39;s nothing I can do but wait. Every time I move my heart just sinks because I feel either another cramp, or I can tell there&#39;s more bleeding. I called the nurse again this morning and she told me the same thing. She tried to reassure me that she&#39;s seen worse and women go on to have healthy pregnancies, but I just don&#39;t know. She said there&#39;s no reason for me to brace for the worst just yet, especially since that second Beta was good. That Beta is sort of the last glimmer of hope left on the table. But I&#39;m skeptical.</p>

<p>I go back in for another Beta in the morning to see if I&#39;m still doubling normally. Has anyone ever experienced this kind of thing this early on? With either a good or bad outcome? Just looking for answers. </p>
</div><!-- SC_ON -->",,,,,True,False,False,False,False,[],[],False,False,False,False,MFI | 3 failed IUIs | 1st IVF fail | 1 MC | IVF #2 in progress! ,[],False,,,,t5_2saej,,,,2xunfx,True,,151pkm,,11,True,no_ads,False,[],False,dark,/r/infertility/comments/2xunfx/positive_beta_and_then_heavy_bleeding_12_hours/,no_ads,False,https://www.reddit.com/r/infertility/comments/2xunfx/positive_beta_and_then_heavy_bleeding_12_hours/,25375,1425429283.0,0,,False,False,{}
3,2048,confidence,<praw.reddit.Reddit object at 0x7f2244aead90>,,infertility,[deleted],,False,,0,False,Husband seeking guidance....,[],r/infertility,False,0,,0,,,False,t3_2xuggz,False,dark,0.92,,public,10,0,{},,,False,[],,False,False,,{},,False,10,,,default,False,,,{},,True,,1425454711.0,text,0,,,,self.infertility,False,"<!-- SC_OFF --><div class=""md""><p>[deleted]</p>
</div><!-- SC_ON -->",,,,,True,False,False,False,False,[],[],False,False,False,False,,[],False,,,,t5_2saej,,,,2xuggz,False,,,,10,True,no_ads,False,[],,dark,/r/infertility/comments/2xuggz/husband_seeking_guidance/,no_ads,False,https://www.reddit.com/r/infertility/comments/2xuggz/husband_seeking_guidance/,25375,1425425911.0,0,,False,False,{}
4,2048,confidence,<praw.reddit.Reddit object at 0x7f2244aead90>,,infertility,"So last night I went to order my second 2 week kit of lupron from Freedom, as I will need it Friday. Well shit. I should've read that pharmacist AMA closer because, as I'm sure most of you know, it is on manufacturer back order! So I fly into panic mode and call all the major pharmacies in the area that are still open and nobody has it. Not even at the warehouse or anything. This morning I called a compounding pharmacy not far from where I live thinking maybe they could compound it for me. The lady on the phone says-oh, we actually have that in stock! So I put in my order and went about my day. Tonight I went to pick it up and as she was ringing me up I asked her what the damage was? She said....*drum roll please*.....***$20***!!! I said-um, are you sure?? Because Freedom said my insurance didn't cover it and it cost me like $150 or $200 dollars. She said that my insurance covered it and winked at me and told me to take it while I could. So I ran out the door!

Next best part?! I opened up the pharmacy bag when I got home and there was not one, but **TWO BOXES**!!!! I kept laughing and exclaiming to my husband but he doesn't quite get it. I knew you guys would understand my amazement!!! 

AWESOME SAUCE!",t2_4c2rk,False,,0,False,Guys! You'll never guess what happened!!,[],r/infertility,False,0,,0,,,False,t3_2xueoc,False,dark,0.98,,public,47,0,{},,,False,[],,False,False,,{},,False,47,,False,self,False,,[],{},,True,,1425453893.0,text,0,,,text,self.infertility,False,"<!-- SC_OFF --><div class=""md""><p>So last night I went to order my second 2 week kit of lupron from Freedom, as I will need it Friday. Well shit. I should&#39;ve read that pharmacist AMA closer because, as I&#39;m sure most of you know, it is on manufacturer back order! So I fly into panic mode and call all the major pharmacies in the area that are still open and nobody has it. Not even at the warehouse or anything. This morning I called a compounding pharmacy not far from where I live thinking maybe they could compound it for me. The lady on the phone says-oh, we actually have that in stock! So I put in my order and went about my day. Tonight I went to pick it up and as she was ringing me up I asked her what the damage was? She said....<em>drum roll please</em>.....<strong><em>$20</em></strong>!!! I said-um, are you sure?? Because Freedom said my insurance didn&#39;t cover it and it cost me like $150 or $200 dollars. She said that my insurance covered it and winked at me and told me to take it while I could. So I ran out the door!</p>

<p>Next best part?! I opened up the pharmacy bag when I got home and there was not one, but <strong>TWO BOXES</strong>!!!! I kept laughing and exclaiming to my husband but he doesn&#39;t quite get it. I knew you guys would understand my amazement!!! </p>

<p>AWESOME SAUCE!</p>
</div><!-- SC_ON -->",,,,,True,False,False,False,False,[],[],False,False,False,False,5th and final FET ,[],False,,,,t5_2saej,,,,2xueoc,True,,fairy_kisses112,,12,True,no_ads,False,[],False,dark,/r/infertility/comments/2xueoc/guys_youll_never_guess_what_happened/,no_ads,False,https://www.reddit.com/r/infertility/comments/2xueoc/guys_youll_never_guess_what_happened/,25375,1425425093.0,0,,False,False,{}
5,2048,confidence,<praw.reddit.Reddit object at 0x7f2244aead90>,,infertility,[deleted],,False,,0,False,Tuesday Chat,[],r/infertility,False,0,,0,,,False,t3_2xu9xu,False,dark,0.67,,public,1,0,{},,,False,[],,False,False,,{},,False,1,,,default,False,,,{},,True,,1425451737.0,text,0,,,,self.infertility,False,"<!-- SC_OFF --><div class=""md""><p>[deleted]</p>
</div><!-- SC_ON -->",,,,,True,True,False,False,True,[],[],False,False,False,False,,[],False,,,,t5_2saej,,,,2xu9xu,False,,,,0,True,no_ads,False,[],,dark,/r/infertility/comments/2xu9xu/tuesday_chat/,no_ads,False,https://www.reddit.com/r/infertility/comments/2xu9xu/tuesday_chat/,25375,1425422937.0,0,,False,False,{}
6,2048,confidence,<praw.reddit.Reddit object at 0x7f2244aead90>,,infertility,"I've hesitated to post here at all because we haven't been TTC that long, but we elected not to tell most of our friends and family that we're trying so I've been feeling quite isolated lately, and didn't really know where else I could vent. 

I've been off of birth control for about a year, but my husband and I have only been trying in earnest since November.  I went to the doctor in February after several 70+ day cycles, and was diagnosed with PCOS after seeing that both my ovaries are full of small cysts. My husband's SA came back perfect; so all of the issues are with me. 

My OBGYN started me on provera (taking pill 8 today) and femara.   

I'm praying that the drugs will work because if they don't we have an added struggle that there's no RE's in the entire state, so IUI or IVF would require us to travel outside of Alaska to seek treatment (taking vacation time and money that we don't necessarily have right now). 

I've pretty much had to stop going on Facebook all together because I can't scroll through more than 5 posts without seeing a picture of a friends baby bump, newborn or toddler.  And the icing on the cake is, I can't even stand to talk to my sister because she starts every conversation these days with ""When are you going to have a baby?"" She doesn't know we're trying, so it's not her fault.  I tried to explain to her (without giving her all the details) that I found out it would be difficult for us to conceive and to please stop bring it up constantly, so now she starts every conversation off asking me ""how are you doooing?"" as if I'm on my death bed or something. I feel guilty but I've ignored her calls for the past 4 days (we usually talk every day) but I just can't handle it right now. 

Anyway, I suppose this is mostly just a vent, but that's my story.  Thank you for taking the time to read it.  I wouldn't wish infertility on my worst enemy, but it's comforting to know I'm not alone. ",t2_lcl6b,False,,0,False,New to infertility and feeling frustrated already,[],r/infertility,False,0,,0,,,False,t3_2xu7cv,False,dark,0.6,,public,1,0,{},,,False,[],,False,False,,{},,False,1,,False,self,False,,[],{},,True,,1425450576.0,text,0,,,text,self.infertility,False,"<!-- SC_OFF --><div class=""md""><p>I&#39;ve hesitated to post here at all because we haven&#39;t been TTC that long, but we elected not to tell most of our friends and family that we&#39;re trying so I&#39;ve been feeling quite isolated lately, and didn&#39;t really know where else I could vent. </p>

<p>I&#39;ve been off of birth control for about a year, but my husband and I have only been trying in earnest since November.  I went to the doctor in February after several 70+ day cycles, and was diagnosed with PCOS after seeing that both my ovaries are full of small cysts. My husband&#39;s SA came back perfect; so all of the issues are with me. </p>

<p>My OBGYN started me on provera (taking pill 8 today) and femara.   </p>

<p>I&#39;m praying that the drugs will work because if they don&#39;t we have an added struggle that there&#39;s no RE&#39;s in the entire state, so IUI or IVF would require us to travel outside of Alaska to seek treatment (taking vacation time and money that we don&#39;t necessarily have right now). </p>

<p>I&#39;ve pretty much had to stop going on Facebook all together because I can&#39;t scroll through more than 5 posts without seeing a picture of a friends baby bump, newborn or toddler.  And the icing on the cake is, I can&#39;t even stand to talk to my sister because she starts every conversation these days with &quot;When are you going to have a baby?&quot; She doesn&#39;t know we&#39;re trying, so it&#39;s not her fault.  I tried to explain to her (without giving her all the details) that I found out it would be difficult for us to conceive and to please stop bring it up constantly, so now she starts every conversation off asking me &quot;how are you doooing?&quot; as if I&#39;m on my death bed or something. I feel guilty but I&#39;ve ignored her calls for the past 4 days (we usually talk every day) but I just can&#39;t handle it right now. </p>

<p>Anyway, I suppose this is mostly just a vent, but that&#39;s my story.  Thank you for taking the time to read it.  I wouldn&#39;t wish infertility on my worst enemy, but it&#39;s comforting to know I&#39;m not alone. </p>
</div><!-- SC_ON -->",,,,,True,True,False,False,False,[],[],False,False,False,False,"TTC #1, PCOS",[],False,,,,t5_2saej,,,,2xu7cv,True,,eliza-jay,,8,True,no_ads,False,[],False,dark,/r/infertility/comments/2xu7cv/new_to_infertility_and_feeling_frustrated_already/,no_ads,False,https://www.reddit.com/r/infertility/comments/2xu7cv/new_to_infertility_and_feeling_frustrated_already/,25375,1425421776.0,0,,False,False,{}
7,2048,confidence,<praw.reddit.Reddit object at 0x7f2244aead90>,,infertility,"Anyone with MFI have the DNA fragmentation test?  We came back as ""borderline"".  After 2 failed IVF's, 2 failed IUIs we got pregnant naturally but I miscarried at 5 weeks, new RE thinks this could be why. ",t2_jpogg,False,,0,False,Sperm DNA Fragmentation Test,[],r/infertility,False,0,,0,,,False,t3_2xu0i1,False,dark,0.67,,public,1,0,{},,,False,[],,False,False,,{},,False,1,,False,self,False,,[],{},,True,,1425447560.0,text,0,,,text,self.infertility,False,"<!-- SC_OFF --><div class=""md""><p>Anyone with MFI have the DNA fragmentation test?  We came back as &quot;borderline&quot;.  After 2 failed IVF&#39;s, 2 failed IUIs we got pregnant naturally but I miscarried at 5 weeks, new RE thinks this could be why. </p>
</div><!-- SC_ON -->",,,,,True,True,False,False,False,[],[],False,False,False,False,"40-TTC#1, Severe MFI, Failed IVF, Failed IUI, 1 Miscarriage",[],False,,,,t5_2saej,,,,2xu0i1,True,,motherofdragoons,,5,True,no_ads,False,[],False,dark,/r/infertility/comments/2xu0i1/sperm_dna_fragmentation_test/,no_ads,False,https://www.reddit.com/r/infertility/comments/2xu0i1/sperm_dna_fragmentation_test/,25375,1425418760.0,0,,False,False,{}
8,2048,confidence,<praw.reddit.Reddit object at 0x7f2244aead90>,,infertility,[deleted],,False,,0,False,Cross Post from another thread: Did you get treated via IUI and have a successful pregnancy?,[],r/infertility,False,0,,0,,,False,t3_2xtdw7,False,dark,1.0,,public,1,0,{},,,False,[],,False,False,,{},,False,1,,,default,False,,,{},,True,,1425438116.0,text,0,,,,self.infertility,False,"<!-- SC_OFF --><div class=""md""><p>[deleted]</p>
</div><!-- SC_ON -->",,,,,True,True,False,False,False,[],[],False,False,False,False,,[],False,,,,t5_2saej,,,,2xtdw7,False,,,,1,True,no_ads,False,[],,dark,/r/infertility/comments/2xtdw7/cross_post_from_another_thread_did_you_get/,no_ads,False,https://www.reddit.com/r/infertility/comments/2xtdw7/cross_post_from_another_thread_did_you_get/,25375,1425409316.0,0,,False,False,{}
9,2048,confidence,<praw.reddit.Reddit object at 0x7f2244aead90>,,infertility,"After a few months off (I needed it) I'll be resuming treatment next cycle.  First cycle with injectibles along with the usual monitored IUI and femara.  

My mom texted me today and asked me if I had considered giving up gluten to help.  I've tried things like cinnamon and pineapple core in the past, so I'm not adverse to trying things on my own, but gluten would be a hard one for me to give up, especially when mood swings kick in and I want to feed my feelings.  

I plan to ask my RE when I see her in a few weeks, but I wondered if anyone had tried this, talked about it or knew if it had any merit.  ",t2_dcvca,False,,0,False,Gluten & Infertility?,[],r/infertility,False,0,,0,,,False,t3_2xt1x6,False,dark,0.54,,public,1,0,{},,,False,[],,False,False,,{},,False,1,,False,self,False,,[],{},,True,,1425433055.0,text,0,,,text,self.infertility,True,"<!-- SC_OFF --><div class=""md""><p>After a few months off (I needed it) I&#39;ll be resuming treatment next cycle.  First cycle with injectibles along with the usual monitored IUI and femara.  </p>

<p>My mom texted me today and asked me if I had considered giving up gluten to help.  I&#39;ve tried things like cinnamon and pineapple core in the past, so I&#39;m not adverse to trying things on my own, but gluten would be a hard one for me to give up, especially when mood swings kick in and I want to feed my feelings.  </p>

<p>I plan to ask my RE when I see her in a few weeks, but I wondered if anyone had tried this, talked about it or knew if it had any merit.  </p>
</div><!-- SC_ON -->",,,,,True,True,False,False,False,[],[],False,False,False,False,,[],False,,,,t5_2saej,,,,2xt1x6,True,,fawnhollow,,57,True,no_ads,False,[],False,,/r/infertility/comments/2xt1x6/gluten_infertility/,no_ads,False,https://www.reddit.com/r/infertility/comments/2xt1x6/gluten_infertility/,25375,1425404255.0,0,,False,False,{}
