43,2048,confidence,<praw.reddit.Reddit object at 0x7f2244aead90>,,infertility,"So as if I don't struggle with not having kids already, a new dark thought has pushed its way into my mind, and won't let go. My 88 year old grandmother recently had a heart attack, and though she is doing okay, the family is beginning to have to consider her care as her health will probably not return to what it was before and she will probably no longer be able to live alone. She has two children, my mom and my uncle. My mom will bend over backwards to give my grandmother the best life she can. While I know my uncle cares about his mother, he went on a rant the other day about how he worked hard to get to where he is today (which I give him, he's very dedicated to his job and has truly earned all the luxuries he has) but that he shouldn't have to spend this time of his life caring for a parent, and isn't going to. He's not even going to put money towards her care; once her money runs out, she can go to the county run facility and live off someone else. I don't know who exactly runs the facility or where the money comes from, but as I understand it it's like charity care. My mom wouldn't let this happen, so it's not really a big deal, though we are all pretty disgusted that my uncle could be so selfish. So there's been a lot of discussions lately about caring for your parents in their old age.

Suddenly the other day the thought hit me that if I don't have children, who will be there to help me? I imagined a scenario where my husband had passed away before me, and I was so alone. This was such a big, black thought that it really upset me, and I haven't been able to let it go.

Now, I'm certainly not saying that I want to have kids just so there'll be someone to take care of me when I'm old, please don't get me wrong. I guess I'm just seeing part of what ""family"" means to me, and I'm just mourning the loss of the idea of ""a family of my own"" and what I thought that would be like. I expected the sense of loss and disappointment, and am expecting that they will fade with time (at least I sure hope they do!). However I can only see this feeling of being alone as growing as I grow older. It's like this big black hole that I'm being sucked into, and I can't stop it or do anything about it.

Has anybody else ever felt this way, and how did you deal with it? Thanks for reading this far, and sorry for the wall of text!",t2_3ynen,False,,0,False,"Struggling with a whole new sense of loss, anybody else ever feel this way? (wall of text incoming...)",[],r/infertility,False,0,,0,,,False,t3_2xebqp,False,dark,0.81,,public,6,0,{},,,False,[],,False,False,,{},,False,6,,False,self,False,,[],{},,True,,1425102267.0,text,0,,,text,self.infertility,False,"<!-- SC_OFF --><div class=""md""><p>So as if I don&#39;t struggle with not having kids already, a new dark thought has pushed its way into my mind, and won&#39;t let go. My 88 year old grandmother recently had a heart attack, and though she is doing okay, the family is beginning to have to consider her care as her health will probably not return to what it was before and she will probably no longer be able to live alone. She has two children, my mom and my uncle. My mom will bend over backwards to give my grandmother the best life she can. While I know my uncle cares about his mother, he went on a rant the other day about how he worked hard to get to where he is today (which I give him, he&#39;s very dedicated to his job and has truly earned all the luxuries he has) but that he shouldn&#39;t have to spend this time of his life caring for a parent, and isn&#39;t going to. He&#39;s not even going to put money towards her care; once her money runs out, she can go to the county run facility and live off someone else. I don&#39;t know who exactly runs the facility or where the money comes from, but as I understand it it&#39;s like charity care. My mom wouldn&#39;t let this happen, so it&#39;s not really a big deal, though we are all pretty disgusted that my uncle could be so selfish. So there&#39;s been a lot of discussions lately about caring for your parents in their old age.</p>

<p>Suddenly the other day the thought hit me that if I don&#39;t have children, who will be there to help me? I imagined a scenario where my husband had passed away before me, and I was so alone. This was such a big, black thought that it really upset me, and I haven&#39;t been able to let it go.</p>

<p>Now, I&#39;m certainly not saying that I want to have kids just so there&#39;ll be someone to take care of me when I&#39;m old, please don&#39;t get me wrong. I guess I&#39;m just seeing part of what &quot;family&quot; means to me, and I&#39;m just mourning the loss of the idea of &quot;a family of my own&quot; and what I thought that would be like. I expected the sense of loss and disappointment, and am expecting that they will fade with time (at least I sure hope they do!). However I can only see this feeling of being alone as growing as I grow older. It&#39;s like this big black hole that I&#39;m being sucked into, and I can&#39;t stop it or do anything about it.</p>

<p>Has anybody else ever felt this way, and how did you deal with it? Thanks for reading this far, and sorry for the wall of text!</p>
</div><!-- SC_ON -->",,,,,True,False,False,False,False,[],[],False,False,False,False,I don't even know anymore...,[],False,,,,t5_2saej,,,,2xebqp,True,,ezach4381,,7,True,no_ads,False,[],False,dark,/r/infertility/comments/2xebqp/struggling_with_a_whole_new_sense_of_loss_anybody/,no_ads,False,https://www.reddit.com/r/infertility/comments/2xebqp/struggling_with_a_whole_new_sense_of_loss_anybody/,25375,1425073467.0,0,,False,False,{}
44,2048,confidence,<praw.reddit.Reddit object at 0x7f2244aead90>,,infertility,[deleted],,False,,0,False,[Off-topic][cross-post] Advice from a dying Redditor,[],r/infertility,False,0,,0,,,False,t3_2xdw35,False,dark,0.73,,public,9,0,{},,,False,[],,False,False,,{},,False,9,,,default,False,,,{},,True,,1425095260.0,text,0,,,,self.infertility,False,"<!-- SC_OFF --><div class=""md""><p>[deleted]</p>
</div><!-- SC_ON -->",,,,,True,False,False,False,False,[],[],False,False,False,False,,[],False,,,,t5_2saej,,,,2xdw35,False,,,,6,True,no_ads,False,[],,dark,/r/infertility/comments/2xdw35/offtopiccrosspost_advice_from_a_dying_redditor/,no_ads,False,https://www.reddit.com/r/infertility/comments/2xdw35/offtopiccrosspost_advice_from_a_dying_redditor/,25375,1425066460.0,0,,False,False,{}
45,2048,confidence,<praw.reddit.Reddit object at 0x7f2244aead90>,,infertility,"I have some issues with what I'll just call ""hormonal rage"". I have PMDD and usually my issues have been right before my period. I am on my 3rd round of Clomid right now and am raging pretty hard. Its a HUGE detriment on my marriage. (first 2 rounds I had no issues - same dose).

- Does anyone else experience this? I will be ok and then if something sets me off I just FLY into a blind rage. Its pretty terrible and I hate it. 

Secondly, I am supposed to start progesterone supplements after my trigger this cycle. I have heard some people say they had issues with moods on them and I am TERRIFIED that this is going to continue/get worse through the next 2 weeks of this cycle. Almost to the point where I don't even want to take them (they are a 'can't hurt' add on.)

What have been your experience with progesterone suppositories and mood? I will probably ask the nurse before I trigger, but Id like to hear what anyone else's experience has been. (I had originally thought my PMDD was from lack of progesterone, but who knows.)",t2_bd7jv,False,,0,False,Hormonal Rage,[],r/infertility,False,0,,0,,,False,t3_2xdtli,False,dark,0.8,,public,3,0,{},,,False,[],,False,False,,{},,False,3,,False,self,False,,[],{},,True,,1425094128.0,text,0,,,text,self.infertility,False,"<!-- SC_OFF --><div class=""md""><p>I have some issues with what I&#39;ll just call &quot;hormonal rage&quot;. I have PMDD and usually my issues have been right before my period. I am on my 3rd round of Clomid right now and am raging pretty hard. Its a HUGE detriment on my marriage. (first 2 rounds I had no issues - same dose).</p>

<ul>
<li>Does anyone else experience this? I will be ok and then if something sets me off I just FLY into a blind rage. Its pretty terrible and I hate it. </li>
</ul>

<p>Secondly, I am supposed to start progesterone supplements after my trigger this cycle. I have heard some people say they had issues with moods on them and I am TERRIFIED that this is going to continue/get worse through the next 2 weeks of this cycle. Almost to the point where I don&#39;t even want to take them (they are a &#39;can&#39;t hurt&#39; add on.)</p>

<p>What have been your experience with progesterone suppositories and mood? I will probably ask the nurse before I trigger, but Id like to hear what anyone else&#39;s experience has been. (I had originally thought my PMDD was from lack of progesterone, but who knows.)</p>
</div><!-- SC_ON -->",,,,,True,False,False,False,False,[],[],False,False,False,False,"37, unexplained. Done everything but IVF. 1 CP.",[],False,,,,t5_2saej,,,,2xdtli,True,,deltarefund,,22,True,no_ads,False,[],False,dark,/r/infertility/comments/2xdtli/hormonal_rage/,no_ads,False,https://www.reddit.com/r/infertility/comments/2xdtli/hormonal_rage/,25375,1425065328.0,0,,False,False,{}
46,2048,confidence,<praw.reddit.Reddit object at 0x7f2244aead90>,,infertility,"I just want to blow up! I want to say, ""Do you know what I'd give for that?"" Of course I know that there are challenges, of course I would probably say the same thing about parenting being difficult if I had kids...but I just get so upset with people who say that crap! What do you do to calm the rage? ",t2_djmcx,False,,0,False,Rage vent: how to calm the F*** down when friends complain about how difficult being a parent is...,[],r/infertility,False,0,,0,,,False,t3_2xdaun,False,dark,0.7,,public,8,0,{},,,False,[],,False,False,,{},,False,8,,False,self,False,,[],{},,True,,1425086068.0,text,0,,,text,self.infertility,False,"<!-- SC_OFF --><div class=""md""><p>I just want to blow up! I want to say, &quot;Do you know what I&#39;d give for that?&quot; Of course I know that there are challenges, of course I would probably say the same thing about parenting being difficult if I had kids...but I just get so upset with people who say that crap! What do you do to calm the rage? </p>
</div><!-- SC_ON -->",,,,,True,False,False,False,False,[],[],False,False,False,False,"PCOS, Endo, and one ovary left. Zero hope.",[],False,,,,t5_2saej,,,,2xdaun,True,,Gryffindorktastic,,10,True,no_ads,False,[],False,dark,/r/infertility/comments/2xdaun/rage_vent_how_to_calm_the_f_down_when_friends/,no_ads,False,https://www.reddit.com/r/infertility/comments/2xdaun/rage_vent_how_to_calm_the_f_down_when_friends/,25375,1425057268.0,0,,False,False,{}
47,2048,confidence,<praw.reddit.Reddit object at 0x7f2244aead90>,,infertility,"im not sure if I belong in this subreddit although I suppose I do now. I went for my HSG today where they check your tubes and they have said that it looks like my one remaining tube is blocked. I think deep down I was expecting it so it wasn't a huge shock but I don't see my fertility doc again until May so now I'm just sort of in limbo wondering what happens next. 

I assume IVF is the next step. I am in the UK and neither myself or my husband have any children so hopefully I will get a couple of tries on the NHS. I will have to lose some weight before then to qualify (they mentioned this at my last appointment) is there a subreddit on here for people trying to lose weight for fertility reasons?

I'm sorry if this is a bit rambling I'm just feeling a little lost today. I am also sorry if I don't reply straight away to anyone kind enough to answer I keep going and having a bit of a cry which is silly as I suspected this was the problem all along so I should feel relived we are lucky enough to have an answer.

So I guess my questions are is there a weight loss for fertility place or thread and what happens now they know my tube is blocked? ",t2_hagn6,False,,0,False,Feeling a little lost,[],r/infertility,False,0,,0,,,False,t3_2xd06v,False,dark,0.75,,public,2,0,{},,,False,[],,False,False,,{},,False,2,,False,self,False,,[],{},,True,,1425081140.0,text,0,,,text,self.infertility,False,"<!-- SC_OFF --><div class=""md""><p>im not sure if I belong in this subreddit although I suppose I do now. I went for my HSG today where they check your tubes and they have said that it looks like my one remaining tube is blocked. I think deep down I was expecting it so it wasn&#39;t a huge shock but I don&#39;t see my fertility doc again until May so now I&#39;m just sort of in limbo wondering what happens next. </p>

<p>I assume IVF is the next step. I am in the UK and neither myself or my husband have any children so hopefully I will get a couple of tries on the NHS. I will have to lose some weight before then to qualify (they mentioned this at my last appointment) is there a subreddit on here for people trying to lose weight for fertility reasons?</p>

<p>I&#39;m sorry if this is a bit rambling I&#39;m just feeling a little lost today. I am also sorry if I don&#39;t reply straight away to anyone kind enough to answer I keep going and having a bit of a cry which is silly as I suspected this was the problem all along so I should feel relived we are lucky enough to have an answer.</p>

<p>So I guess my questions are is there a weight loss for fertility place or thread and what happens now they know my tube is blocked? </p>
</div><!-- SC_ON -->",,,,,True,False,False,False,False,[],[],False,False,False,False,,[],False,,,,t5_2saej,,,,2xd06v,True,,PM_YOUR_LIFE_STORY_,,7,True,no_ads,False,[],False,,/r/infertility/comments/2xd06v/feeling_a_little_lost/,no_ads,False,https://www.reddit.com/r/infertility/comments/2xd06v/feeling_a_little_lost/,25375,1425052340.0,0,,False,False,{}
48,2048,confidence,<praw.reddit.Reddit object at 0x7f2244aead90>,,infertility,"Theoretical question for me at this point because we have more stuff we are willing to do for a while yet.

But I turn 38 in a few months, and my husband is 44. I know he's starting to do the math and wonder how old is too old. I mean, realistically, there's an age at which I am just not going to want to chase down toddlers, and will just move into cronedom. 

A friend of mine who is dealing with secondary infertility has a hard limit in her mind of 40. She's 39.

I know it's very individual, but I wonder about people's thought on aging out of this process.

edit: I should say, I made this sound like it's all about my husband, but it's me too. Not so much a medical question but a stage of life thing.",t2_fqj3k,False,,0,False,Who's old? At what age do you stop?,[],r/infertility,False,0,,0,,,False,t3_2xcz9k,False,dark,0.75,,public,4,0,{},,,False,[],,False,False,,{},,False,4,,False,self,1425054055.0,,[],{},,True,,1425080673.0,text,0,,,text,self.infertility,True,"<!-- SC_OFF --><div class=""md""><p>Theoretical question for me at this point because we have more stuff we are willing to do for a while yet.</p>

<p>But I turn 38 in a few months, and my husband is 44. I know he&#39;s starting to do the math and wonder how old is too old. I mean, realistically, there&#39;s an age at which I am just not going to want to chase down toddlers, and will just move into cronedom. </p>

<p>A friend of mine who is dealing with secondary infertility has a hard limit in her mind of 40. She&#39;s 39.</p>

<p>I know it&#39;s very individual, but I wonder about people&#39;s thought on aging out of this process.</p>

<p>edit: I should say, I made this sound like it&#39;s all about my husband, but it&#39;s me too. Not so much a medical question but a stage of life thing.</p>
</div><!-- SC_ON -->",,,,,True,False,False,False,False,[],[],False,False,False,False,38 DOR IVF My motherfucking ovaries are special snowflakes,[],False,,,,t5_2saej,,,,2xcz9k,True,,sonalogy,,69,True,no_ads,False,[],False,dark,/r/infertility/comments/2xcz9k/whos_old_at_what_age_do_you_stop/,no_ads,False,https://www.reddit.com/r/infertility/comments/2xcz9k/whos_old_at_what_age_do_you_stop/,25375,1425051873.0,0,,False,False,{}
49,2048,confidence,<praw.reddit.Reddit object at 0x7f2244aead90>,,infertility,[removed],t2_jxfu1,False,,0,False,What is Hypospermia?,[],r/infertility,False,0,,0,,,False,t3_2xcyni,False,dark,0.33,,public,0,0,{},,,False,[],,False,False,,{},,False,0,,False,default,False,,[],{},,True,,1425080355.0,text,0,,,text,self.infertility,False,"<!-- SC_OFF --><div class=""md""><p>[removed]</p>
</div><!-- SC_ON -->",,,,,True,True,False,False,False,[],[],False,False,False,False,,[],False,,,,t5_2saej,,,,2xcyni,False,,hakimdilshad,,0,True,no_ads,False,[],False,,/r/infertility/comments/2xcyni/what_is_hypospermia/,no_ads,False,https://www.reddit.com/r/infertility/comments/2xcyni/what_is_hypospermia/,25375,1425051555.0,0,,False,False,{}
50,2048,confidence,<praw.reddit.Reddit object at 0x7f2244aead90>,,infertility,"Yesterday Mr.Medtech told me that if IVF doesn't work we are done.  He doesn't want to try donor sperm, eggs, embryos, or adoption.  He wants to get on with our lives, travel and not dwell on what we couldn't have.

Now comes the decision, do we do the pay-as-you-go route or the multi-cycle plan.  My feeling is if this is the end, I want as many chances as possible.  Problem is if it works on the first shot we lost money, if we have to do two FETs, we save money. 

Why can't my insurance cover this so I don't have to make this choice?!?!?!?!

Edit: Thank you all for weighing in!  You are such an amazing and supportive community.",t2_dkn0k,False,,0,False,Decisions on cycle plan options,[],r/infertility,False,0,,0,,,False,t3_2xcyio,False,dark,0.78,,public,5,0,{},,,False,[],,False,False,,{},,False,5,,False,self,1425240291.0,,[],{},,True,,1425080278.0,text,0,,,text,self.infertility,False,"<!-- SC_OFF --><div class=""md""><p>Yesterday Mr.Medtech told me that if IVF doesn&#39;t work we are done.  He doesn&#39;t want to try donor sperm, eggs, embryos, or adoption.  He wants to get on with our lives, travel and not dwell on what we couldn&#39;t have.</p>

<p>Now comes the decision, do we do the pay-as-you-go route or the multi-cycle plan.  My feeling is if this is the end, I want as many chances as possible.  Problem is if it works on the first shot we lost money, if we have to do two FETs, we save money. </p>

<p>Why can&#39;t my insurance cover this so I don&#39;t have to make this choice?!?!?!?!</p>

<p>Edit: Thank you all for weighing in!  You are such an amazing and supportive community.</p>
</div><!-- SC_ON -->",,,,,True,False,False,False,False,[],[],False,False,False,False,"32, MFI, 3 IUI/2IVF/2FET/1MMC",[],False,,,,t5_2saej,,,,2xcyio,True,,medtech07,,18,True,no_ads,False,[],False,dark,/r/infertility/comments/2xcyio/decisions_on_cycle_plan_options/,no_ads,False,https://www.reddit.com/r/infertility/comments/2xcyio/decisions_on_cycle_plan_options/,25375,1425051478.0,0,,False,False,{}
51,2048,confidence,<praw.reddit.Reddit object at 0x7f2244aead90>,,infertility,[deleted],,False,,0,False,Anti-depressants and IVF,[],r/infertility,False,0,,0,,,False,t3_2xcy31,False,dark,0.67,,public,1,0,{},,,False,[],,False,False,,{},,False,1,,,default,False,,,{},,True,,1425080050.0,text,0,,,,self.infertility,False,"<!-- SC_OFF --><div class=""md""><p>[deleted]</p>
</div><!-- SC_ON -->",,,,,True,True,False,False,False,[],[],False,False,False,False,,[],False,,,,t5_2saej,,,,2xcy31,False,,,,10,True,no_ads,False,[],,dark,/r/infertility/comments/2xcy31/antidepressants_and_ivf/,no_ads,False,https://www.reddit.com/r/infertility/comments/2xcy31/antidepressants_and_ivf/,25375,1425051250.0,0,,False,False,{}
52,2048,confidence,<praw.reddit.Reddit object at 0x7f2244aead90>,,infertility,"Use this thread to share anything not necessarily related to infertility. Rant or rave, bitch, moan, share something funny, anything goes!",t2_6l4z3,False,,0,False,Friday Off Topic Thread,[],r/infertility,False,0,,0,,,False,t3_2xc760,False,dark,0.67,,public,1,0,{},,,False,[],,False,False,,{},,False,1,,True,self,False,,[],{},,True,,1425060133.0,text,0,,,text,self.infertility,False,"<!-- SC_OFF --><div class=""md""><p>Use this thread to share anything not necessarily related to infertility. Rant or rave, bitch, moan, share something funny, anything goes!</p>
</div><!-- SC_ON -->",,,,,True,True,False,False,False,[],[],False,False,False,False,,[],False,,,moderator,t5_2saej,,,,2xc760,True,,AutoModerator,,103,True,no_ads,False,[],False,,/r/infertility/comments/2xc760/friday_off_topic_thread/,no_ads,False,https://www.reddit.com/r/infertility/comments/2xc760/friday_off_topic_thread/,25375,1425031333.0,0,,False,False,{}
53,2048,confidence,<praw.reddit.Reddit object at 0x7f2244aead90>,,infertility,"So I am curious about two things.  I was supposed to start my endometrin 3xs/day today before my transfer on the 3rd and I somehow spaced it and only have done 2 suppositories.  I also started my PIO shot of 1ML.  Could the missed dose cause problems?  Also have you heard of an RE prescribing Endometrin and PIO shots?  I have only heard of them prescribing one or the other.  

I also would like to say that I had my first IVIg treatment yesterday and I was very concerned about the side effects, but I had no side effects at all!!  I really hope this helps lower my Nk activity and balance my T cells. ",t2_c31zz,False,,0,False,Endometrin and PIO shots during FET? IVIg update.,[],r/infertility,False,0,,0,,,False,t3_2xbqtt,False,dark,0.86,,public,5,0,{},,d70f54ce-930e-11e4-8710-22000b26873e,False,[],,False,False,,{},,False,5,,False,self,False,,[],{},,True,,1425045972.0,text,0,,,text,self.infertility,True,"<!-- SC_OFF --><div class=""md""><p>So I am curious about two things.  I was supposed to start my endometrin 3xs/day today before my transfer on the 3rd and I somehow spaced it and only have done 2 suppositories.  I also started my PIO shot of 1ML.  Could the missed dose cause problems?  Also have you heard of an RE prescribing Endometrin and PIO shots?  I have only heard of them prescribing one or the other.  </p>

<p>I also would like to say that I had my first IVIg treatment yesterday and I was very concerned about the side effects, but I had no side effects at all!!  I really hope this helps lower my Nk activity and balance my T cells. </p>
</div><!-- SC_ON -->",,,,,True,False,False,False,False,[],[],False,False,False,False,"32, Endo + MFI + RPL, 3 IVF",[],False,,,,t5_2saej,,,,2xbqtt,True,,wookielegs,,10,True,no_ads,False,[],False,dark,/r/infertility/comments/2xbqtt/endometrin_and_pio_shots_during_fet_ivig_update/,no_ads,False,https://www.reddit.com/r/infertility/comments/2xbqtt/endometrin_and_pio_shots_during_fet_ivig_update/,25375,1425017172.0,0,,False,False,{}
54,2048,confidence,<praw.reddit.Reddit object at 0x7f2244aead90>,,infertility,"I know this subject is so little in the grand scheme of things here but I really am torn about what to do:

I had an ultrasound today since I had some severe abdominal pain with my last cycle. My RE wanted to check things out and see if it was okay to continue with another cycle of letrozole (7.5mg). So based on the ultrasound, it would be absolutely fine to go ahead with another month. But they said that if I wanted to skip a month solely based on my symptoms last month, that that was reasonable.

I'm just not sure if I should skip or not. I had one day of moderate to severe pain for about 5 hours. After that, I've only had little twinges of pain - intermittent, fairly mild. So I'm not sure if these are good enough reasons for me to skip a month. My RE says that skipping a month could help or it could do nothing for the next months symptoms.

What are your thoughts and experiences?",t2_cjbvh,False,,0,False,Advice Needed: Skip a month or no?,[],r/infertility,False,0,,0,,,False,t3_2xbcvz,False,dark,0.83,,public,4,0,{},,,False,[],,False,False,,{},,False,4,,False,self,False,,[],{},,True,,1425037879.0,text,0,,,text,self.infertility,False,"<!-- SC_OFF --><div class=""md""><p>I know this subject is so little in the grand scheme of things here but I really am torn about what to do:</p>

<p>I had an ultrasound today since I had some severe abdominal pain with my last cycle. My RE wanted to check things out and see if it was okay to continue with another cycle of letrozole (7.5mg). So based on the ultrasound, it would be absolutely fine to go ahead with another month. But they said that if I wanted to skip a month solely based on my symptoms last month, that that was reasonable.</p>

<p>I&#39;m just not sure if I should skip or not. I had one day of moderate to severe pain for about 5 hours. After that, I&#39;ve only had little twinges of pain - intermittent, fairly mild. So I&#39;m not sure if these are good enough reasons for me to skip a month. My RE says that skipping a month could help or it could do nothing for the next months symptoms.</p>

<p>What are your thoughts and experiences?</p>
</div><!-- SC_ON -->",,,,,True,False,False,False,False,[],[],False,False,False,False,,[],False,,,,t5_2saej,,,,2xbcvz,True,,KatieLaw16,,5,True,no_ads,False,[],False,,/r/infertility/comments/2xbcvz/advice_needed_skip_a_month_or_no/,no_ads,False,https://www.reddit.com/r/infertility/comments/2xbcvz/advice_needed_skip_a_month_or_no/,25375,1425009079.0,0,,False,False,{}
