82,2048,confidence,<praw.reddit.Reddit object at 0x7f2244aead90>,,infertility,"Welcome to the Infertility Results thread!

Here you have the option of posting the outcome of your cycle (be it positive or negative) in a way that is sensitive to the emotional needs of our unique community. 

**For the sake of members who are struggling with negative results and the difficult feelings that come with them, we request that all pregnancy announcements be shared *only* in this thread.** For the next stage of your journey, you may be interested in posting your story on /r/whatworkedforme/ and we encourage you to continue to share your progress at our sister community, /r/InfertilityBabies/. Of course, you are always encouraged to share your non-pregnancy-related infertility experiences (and continue to support other community members) here on /r/infertility.

Negative results are also welcome here, though they need not be confined to this thread. Members with questionable results who want immediate support, and those who need their follow-up questions to be open to greater and faster readership are, as always, welcome to post freely on the main board.

We are not banning any kind of post, either here or on the main board, but rather we see this as an opportunity for members to continue to share with those who are following their journey, but do so in a way that respects the feelings and wishes of those for whom individual results posts would be burdensome. As always, please refer to the sidebar where you will find our subreddit guidelines and a short list of other related subreddits and resources you may find useful throughout your journey.",t2_6dcf0,False,,0,False,Results 2/22 to 2/28,[],r/infertility,False,0,,0,,,False,t3_2wzvy7,False,dark,0.92,,public,10,0,{},,,False,[],,False,False,,{},,False,10,,False,self,False,,[],{},,True,,1424820485.0,text,0,,,text,self.infertility,False,"<!-- SC_OFF --><div class=""md""><p>Welcome to the Infertility Results thread!</p>

<p>Here you have the option of posting the outcome of your cycle (be it positive or negative) in a way that is sensitive to the emotional needs of our unique community. </p>

<p><strong>For the sake of members who are struggling with negative results and the difficult feelings that come with them, we request that all pregnancy announcements be shared <em>only</em> in this thread.</strong> For the next stage of your journey, you may be interested in posting your story on <a href=""/r/whatworkedforme/"">/r/whatworkedforme/</a> and we encourage you to continue to share your progress at our sister community, <a href=""/r/InfertilityBabies/"">/r/InfertilityBabies/</a>. Of course, you are always encouraged to share your non-pregnancy-related infertility experiences (and continue to support other community members) here on <a href=""/r/infertility"">/r/infertility</a>.</p>

<p>Negative results are also welcome here, though they need not be confined to this thread. Members with questionable results who want immediate support, and those who need their follow-up questions to be open to greater and faster readership are, as always, welcome to post freely on the main board.</p>

<p>We are not banning any kind of post, either here or on the main board, but rather we see this as an opportunity for members to continue to share with those who are following their journey, but do so in a way that respects the feelings and wishes of those for whom individual results posts would be burdensome. As always, please refer to the sidebar where you will find our subreddit guidelines and a short list of other related subreddits and resources you may find useful throughout your journey.</p>
</div><!-- SC_ON -->",,,,,True,False,False,False,False,[],[],False,False,False,False,"Since 2010. 7 early mcs. 3 IUI, 2 IVF, 2 FET",[],False,,,moderator,t5_2saej,,,,2wzvy7,True,,Vexwyf,,63,False,no_ads,False,[],False,dark,/r/infertility/comments/2wzvy7/results_222_to_228/,no_ads,False,https://www.reddit.com/r/infertility/comments/2wzvy7/results_222_to_228/,25375,1424791685.0,0,,False,False,{}
83,2048,confidence,<praw.reddit.Reddit object at 0x7f2244aead90>,,infertility,http://webchat.snoonet.org/infertility,t2_gn455,False,,0,False,Anyone want to chat? Snow day here....,[],r/infertility,False,0,,0,,,False,t3_2wzszi,False,dark,0.67,,public,1,0,{},,,False,[],,False,False,,{},,False,1,,False,self,False,,[],{},,True,,1424819018.0,text,0,,,text,self.infertility,False,"<!-- SC_OFF --><div class=""md""><p><a href=""http://webchat.snoonet.org/infertility"">http://webchat.snoonet.org/infertility</a></p>
</div><!-- SC_ON -->",,,,,True,True,False,False,False,[],[],False,False,False,False,FET soon,[],False,,,,t5_2saej,,,,2wzszi,True,,waterfall444,,1,True,no_ads,False,[],False,dark,/r/infertility/comments/2wzszi/anyone_want_to_chat_snow_day_here/,no_ads,False,https://www.reddit.com/r/infertility/comments/2wzszi/anyone_want_to_chat_snow_day_here/,25375,1424790218.0,0,,False,False,{}
84,2048,confidence,<praw.reddit.Reddit object at 0x7f2244aead90>,,infertility,"Due to being anovulatory most of the time I have fairly well tracked cycles.  Clomid, ultrasounds, trigger, IUI (if I don't surge early - which can happen) etc.  

I'm on day 13 of my cycle, DAY 13!  My Wondfo's are giving me that look like I'm going to get a positive LH surge later today.  Right after I just spent the entire night praying to the porcelain gods to make my stomach feel better and to take the ache from my body... and my fever is peaking (temping was out as soon as my temp showed itself to be 101).  

So if it follows previous cycles I should call in and ask if they can do the ultrasound and possible trigger this afternoon instead of tomorrow if they want to beat my body... but I'm currently laying on the couch with a bowl on the ground 'just in case'.  UG... 

I had such a hard time with the clomid this cycle, terrible headaches, bloating... and other side effects I've never had... I really don't want to cancel because of the stupid flu!  I had my flu shot... damn it all to hell.  ",t2_4zx3n,False,,0,False,The flu... right now? Of course...,[],r/infertility,False,0,,0,,,False,t3_2wzpwb,False,dark,0.75,,public,4,0,{},,,False,[],,False,False,,{},,False,4,,False,self,False,,[],{},,True,,1424817383.0,text,0,,,text,self.infertility,False,"<!-- SC_OFF --><div class=""md""><p>Due to being anovulatory most of the time I have fairly well tracked cycles.  Clomid, ultrasounds, trigger, IUI (if I don&#39;t surge early - which can happen) etc.  </p>

<p>I&#39;m on day 13 of my cycle, DAY 13!  My Wondfo&#39;s are giving me that look like I&#39;m going to get a positive LH surge later today.  Right after I just spent the entire night praying to the porcelain gods to make my stomach feel better and to take the ache from my body... and my fever is peaking (temping was out as soon as my temp showed itself to be 101).  </p>

<p>So if it follows previous cycles I should call in and ask if they can do the ultrasound and possible trigger this afternoon instead of tomorrow if they want to beat my body... but I&#39;m currently laying on the couch with a bowl on the ground &#39;just in case&#39;.  UG... </p>

<p>I had such a hard time with the clomid this cycle, terrible headaches, bloating... and other side effects I&#39;ve never had... I really don&#39;t want to cancel because of the stupid flu!  I had my flu shot... damn it all to hell.  </p>
</div><!-- SC_ON -->",,,,,True,False,False,False,False,[],[],False,False,False,False,on the IUI train,[],False,,,,t5_2saej,,,,2wzpwb,True,,pang0lin,,13,True,no_ads,False,[],False,dark,/r/infertility/comments/2wzpwb/the_flu_right_now_of_course/,no_ads,False,https://www.reddit.com/r/infertility/comments/2wzpwb/the_flu_right_now_of_course/,25375,1424788583.0,0,,False,False,{}
85,2048,confidence,<praw.reddit.Reddit object at 0x7f2244aead90>,,infertility,"Use this thread to share anything not necessarily related to infertility. Rant or rave, bitch, moan, share something funny, anything goes!",t2_6l4z3,False,,0,False,Tuesday Off Topic Thread,[],r/infertility,False,0,,0,,,False,t3_2wz4t8,False,dark,0.75,,public,2,0,{},,,False,[],,False,False,,{},,False,2,,True,self,False,,[],{},,True,,1424800937.0,text,0,,,text,self.infertility,False,"<!-- SC_OFF --><div class=""md""><p>Use this thread to share anything not necessarily related to infertility. Rant or rave, bitch, moan, share something funny, anything goes!</p>
</div><!-- SC_ON -->",,,,,True,False,False,False,False,[],[],False,False,False,False,,[],False,,,moderator,t5_2saej,,,,2wz4t8,True,,AutoModerator,,61,True,no_ads,False,[],False,,/r/infertility/comments/2wz4t8/tuesday_off_topic_thread/,no_ads,False,https://www.reddit.com/r/infertility/comments/2wz4t8/tuesday_off_topic_thread/,25375,1424772137.0,0,,False,False,{}
86,2048,confidence,<praw.reddit.Reddit object at 0x7f2244aead90>,,infertility,"Stupid. I shouldn't have had my hopes up,  it was just a fluke that it'd been delayed this long, but damnit I was on like day 47 of this cycle- even if it was only a glimmer of hope it still hurts. Just my body saying ""yep you're still broken- oh,  you thought you might be pregnant?  Lol psych, got you!!""
  
fuck this shit.",t2_48bc2,False,,0,False,I got my fucking period,[],r/infertility,False,0,,0,,,False,t3_2wyarn,False,dark,0.83,,public,7,0,{},,d70f54ce-930e-11e4-8710-22000b26873e,False,[],,False,False,,{},,False,7,,False,self,False,,[],{},,True,,1424779042.0,text,0,,,text,self.infertility,False,"<!-- SC_OFF --><div class=""md""><p>Stupid. I shouldn&#39;t have had my hopes up,  it was just a fluke that it&#39;d been delayed this long, but damnit I was on like day 47 of this cycle- even if it was only a glimmer of hope it still hurts. Just my body saying &quot;yep you&#39;re still broken- oh,  you thought you might be pregnant?  Lol psych, got you!!&quot;</p>

<p>fuck this shit.</p>
</div><!-- SC_ON -->",,,,,True,False,False,False,False,[],[],False,False,False,False,"no ovaries due to dermoid cysts. 1 miscarriage, 1 success",[],False,,,,t5_2saej,,,,2wyarn,True,,comosedicedouchebag,,7,True,no_ads,False,[],False,dark,/r/infertility/comments/2wyarn/i_got_my_fucking_period/,no_ads,False,https://www.reddit.com/r/infertility/comments/2wyarn/i_got_my_fucking_period/,25375,1424750242.0,0,,False,False,{}
87,2048,confidence,<praw.reddit.Reddit object at 0x7f2244aead90>,,infertility,"tl;dr I have an appointment with a RE on 3-31 and don't really know what to expect. 

A little background on me: irregular periods as a teenager, some suspension that I had PCOS, my endocrinologist put me on metformin.  Eventually I went on birth control pills for a couple of years.  When I went off of them I didn't have a period on my own for a year.  Went back on pills, then got a mirena.  No period with mirena, got it removed in October.  Had some withdrawl bleeding, then two months later a very light period.  Lots of spotting, then another light period, followed by constant spotting and now a really heavy period. We've been having unprotected sex since the end of December, but not super frequently (3 times last month).

With the non-stop spotting I went to my OB/GYN.  Given the possible PCOS in my past, he's eager to send me to a RE.  I was expecting to have to try for a year before I got a referral, but apparently not.  I thought they were officially referring me because of menstrual problems, but today the nurse called to tell me they had scheduled the appointment and was talking about insurance coverage for infertility.  Would they really label me ""infertile"" when we haven't even really been trying and I recently got a mirena removed?  They told me I could go back on the pill to regulate my periods, or if I want to get pregnant I can go to the endocrinologist.  Is this normal?  It seems like we're moving really fast.  On the other hand, if I truly am infertile, I guess it's good to get started sooner rather than later.

At this upcoming appointment, what kinds of tests should I expect them to do?  They said today they'd do an ultrasound.  I'm assuming also some blood work?  Is it likely that they'll want to test my husband's semen?  Will they really bill my insurance for infertility and not menstrual irregularities?

I told my sister we were not using contraception because I was excited and she's my best friend.  My mom guessed that was the case because I was asking her some questions about her health history, then tricked my sister into confirming it by acting like I had told her. She knows I'm going to an endocrinologist.  She said told my sister that it's God's plan that I can't get pregnant because we're atheists and until we're not in rebellion against God we shouldn't have a baby.  I'm feeling emotionally overwhelmed already and this is the first cycle we're even really trying :(",t2_86s66,False,,0,False,Intro and some questions,[],r/infertility,False,0,,0,,,False,t3_2wy5y4,False,dark,0.67,,public,1,0,{},,,False,[],,False,False,,{},,False,1,,False,self,False,,[],{},,True,,1424776500.0,text,0,,,text,self.infertility,False,"<!-- SC_OFF --><div class=""md""><p>tl;dr I have an appointment with a RE on 3-31 and don&#39;t really know what to expect. </p>

<p>A little background on me: irregular periods as a teenager, some suspension that I had PCOS, my endocrinologist put me on metformin.  Eventually I went on birth control pills for a couple of years.  When I went off of them I didn&#39;t have a period on my own for a year.  Went back on pills, then got a mirena.  No period with mirena, got it removed in October.  Had some withdrawl bleeding, then two months later a very light period.  Lots of spotting, then another light period, followed by constant spotting and now a really heavy period. We&#39;ve been having unprotected sex since the end of December, but not super frequently (3 times last month).</p>

<p>With the non-stop spotting I went to my OB/GYN.  Given the possible PCOS in my past, he&#39;s eager to send me to a RE.  I was expecting to have to try for a year before I got a referral, but apparently not.  I thought they were officially referring me because of menstrual problems, but today the nurse called to tell me they had scheduled the appointment and was talking about insurance coverage for infertility.  Would they really label me &quot;infertile&quot; when we haven&#39;t even really been trying and I recently got a mirena removed?  They told me I could go back on the pill to regulate my periods, or if I want to get pregnant I can go to the endocrinologist.  Is this normal?  It seems like we&#39;re moving really fast.  On the other hand, if I truly am infertile, I guess it&#39;s good to get started sooner rather than later.</p>

<p>At this upcoming appointment, what kinds of tests should I expect them to do?  They said today they&#39;d do an ultrasound.  I&#39;m assuming also some blood work?  Is it likely that they&#39;ll want to test my husband&#39;s semen?  Will they really bill my insurance for infertility and not menstrual irregularities?</p>

<p>I told my sister we were not using contraception because I was excited and she&#39;s my best friend.  My mom guessed that was the case because I was asking her some questions about her health history, then tricked my sister into confirming it by acting like I had told her. She knows I&#39;m going to an endocrinologist.  She said told my sister that it&#39;s God&#39;s plan that I can&#39;t get pregnant because we&#39;re atheists and until we&#39;re not in rebellion against God we shouldn&#39;t have a baby.  I&#39;m feeling emotionally overwhelmed already and this is the first cycle we&#39;re even really trying :(</p>
</div><!-- SC_ON -->",,,,,True,True,False,False,False,[],[],False,False,False,False,,[],False,,,,t5_2saej,,,,2wy5y4,True,,justcurious12345,,19,True,no_ads,False,[],False,dark,/r/infertility/comments/2wy5y4/intro_and_some_questions/,no_ads,False,https://www.reddit.com/r/infertility/comments/2wy5y4/intro_and_some_questions/,25375,1424747700.0,0,,False,False,{}
88,2048,confidence,<praw.reddit.Reddit object at 0x7f2244aead90>,,infertility,I'll be around on and off all day,t2_gn455,False,,0,False,Monday chat?,[],r/infertility,False,0,,0,,,False,t3_2wwcv4,False,dark,0.8,,public,3,0,{},,,False,[],,False,False,,{},,False,3,,False,self,False,,[],{},,True,,1424746796.0,text,0,,,text,self.infertility,False,"<!-- SC_OFF --><div class=""md""><p>I&#39;ll be around on and off all day</p>
</div><!-- SC_ON -->",,,,,True,False,False,False,False,[],[],False,False,False,False,FET soon,[],False,,,,t5_2saej,,,,2wwcv4,True,,waterfall444,,9,True,no_ads,False,[],False,dark,/r/infertility/comments/2wwcv4/monday_chat/,no_ads,False,https://www.reddit.com/r/infertility/comments/2wwcv4/monday_chat/,25375,1424717996.0,0,,False,False,{}
89,2048,confidence,<praw.reddit.Reddit object at 0x7f2244aead90>,,infertility,"Hey all.

So I am staring down the barrel of my third (and most likely final) IUI, and they are talking about just repeating my protocol from last cycle (lowest dose of Femara, CD3-7, with ultrasound on CD10 and Ovidrel trigger/IUI).  I only developed one follicle on Femara last cycle.  My husband's sperm is consistently ""outstanding"" according to SAs and post-wash counts, so I am very frustrated with the thought of going through another IUI all for nothing.

All of the research I have found says the best results for IUIs occur with 2-3 mature follicles at the time of trigger.  If I am going to go through the hassle of missing work (when my office is incredibly short-staffed and my boss gives me shit about taking sick time) I don't want it to be for nothing.

Is it reasonable to insist on some type of modified protocol at this point, or an adjusted dosage to see if I can respond better this cycle? I don't want to go through the hassle of switching practices (to a FAR more inconvenient location, with an unknown RE) to move onto IVF until I feel that I have exhausted every avenue under the RE I adore.  And doing IVF will necessitate missing SO much work, and everyone at work will be angry with me.

Other than that, I have been reading some stuff about how more than three IUIs is reasonable to try if the issue has been anovulatory PCOS and sperm counts are good - should I try more than three IUIs? My insurance will pay for up to 6 total.  I can keep doing IUIs through my current RE.

All of this just feels so hopeless.  Finding quality, peer-reviewed research on PCOS and fertility treatments other than just Clomid is near impossible, and honestly what research there is clearly means nothing because I had the best odds possible on my last Clomid cycle with IUI (three follicles, post-wash sperm count over 50 million) and got my period early to boot.

I feel like I am standing on the edge of a gigantic pit of despair and the ground is crumbling beneath me.",t2_6h9ib,False,,0,False,Any point to IUIs with only one follicle?,[],r/infertility,False,0,,0,,,False,t3_2wvom2,False,dark,0.6,,public,1,0,{},,,False,[],,False,False,,{},,False,1,,False,self,False,,[],{},,True,,1424735598.0,text,0,,,text,self.infertility,True,"<!-- SC_OFF --><div class=""md""><p>Hey all.</p>

<p>So I am staring down the barrel of my third (and most likely final) IUI, and they are talking about just repeating my protocol from last cycle (lowest dose of Femara, CD3-7, with ultrasound on CD10 and Ovidrel trigger/IUI).  I only developed one follicle on Femara last cycle.  My husband&#39;s sperm is consistently &quot;outstanding&quot; according to SAs and post-wash counts, so I am very frustrated with the thought of going through another IUI all for nothing.</p>

<p>All of the research I have found says the best results for IUIs occur with 2-3 mature follicles at the time of trigger.  If I am going to go through the hassle of missing work (when my office is incredibly short-staffed and my boss gives me shit about taking sick time) I don&#39;t want it to be for nothing.</p>

<p>Is it reasonable to insist on some type of modified protocol at this point, or an adjusted dosage to see if I can respond better this cycle? I don&#39;t want to go through the hassle of switching practices (to a FAR more inconvenient location, with an unknown RE) to move onto IVF until I feel that I have exhausted every avenue under the RE I adore.  And doing IVF will necessitate missing SO much work, and everyone at work will be angry with me.</p>

<p>Other than that, I have been reading some stuff about how more than three IUIs is reasonable to try if the issue has been anovulatory PCOS and sperm counts are good - should I try more than three IUIs? My insurance will pay for up to 6 total.  I can keep doing IUIs through my current RE.</p>

<p>All of this just feels so hopeless.  Finding quality, peer-reviewed research on PCOS and fertility treatments other than just Clomid is near impossible, and honestly what research there is clearly means nothing because I had the best odds possible on my last Clomid cycle with IUI (three follicles, post-wash sperm count over 50 million) and got my period early to boot.</p>

<p>I feel like I am standing on the edge of a gigantic pit of despair and the ground is crumbling beneath me.</p>
</div><!-- SC_ON -->",,,,,True,True,False,False,False,[],[],False,False,False,False,PCOS,[],False,,,,t5_2saej,,,,2wvom2,True,,septicidal,,36,True,no_ads,False,[],False,dark,/r/infertility/comments/2wvom2/any_point_to_iuis_with_only_one_follicle/,no_ads,False,https://www.reddit.com/r/infertility/comments/2wvom2/any_point_to_iuis_with_only_one_follicle/,25375,1424706798.0,0,,False,False,{}
90,2048,confidence,<praw.reddit.Reddit object at 0x7f2244aead90>,,infertility,"So my transfer was yesterday.  Saturday, we'd gotten the  encouraging news that 3 of our donor embryos were able to be biopsied for PGS, with two more still in the running.  I figured that, with a 27-year-old donor, PGS was kind of belt and suspenders, but let's just be safe.

Fuck was I wrong as I've been wrong time again through this whole fucking ordeal.  3 of our 4 donor egg embryos tested chromosomally abnormal.  Fuck. My. Life.  Those are the kind of results I hoped for with my own shitty 40-year-old eggs, but for a donor in her 20s, something like 70% should have been normal statistically speaking. I'm not sure if they ended up being able to test the 5th and haven't heard anything more from them about it, so I'm assuming it degenerated.

So we transferred the single normal embryo.  The doctor was like ""it only takes one ..."" but please spare me that fucking bullshit.  I've had this fluid in my uterus all cycle, and although it appeared to be gone yesterday after having been suctioned out earlier in the week, I am afraid it could have compromised this cycle and now in a week I will be back at square fucking one when my beta's negative.  

Sorry for the rant, but I just really expected that a 1:2 donor cycle would leave me with a transfer and at least one healthy embryo to freeze.  What the fuck, was I Adolf Hitler in a past life or something?

UPDATE: the 5th embryo was able to be biopsied for PGS, but results will take 10-14 days.  Got to hope it tests normal.",t2_egbus,False,,0,False,Transfer & PGS Turmoil,[],r/infertility,False,0,,0,,,False,t3_2wvm1c,False,dark,1.0,,public,13,0,{},,,False,[],,False,False,,{},,False,13,,False,self,1424873961.0,,[],{},,True,,1424734234.0,text,0,,,text,self.infertility,False,"<!-- SC_OFF --><div class=""md""><p>So my transfer was yesterday.  Saturday, we&#39;d gotten the  encouraging news that 3 of our donor embryos were able to be biopsied for PGS, with two more still in the running.  I figured that, with a 27-year-old donor, PGS was kind of belt and suspenders, but let&#39;s just be safe.</p>

<p>Fuck was I wrong as I&#39;ve been wrong time again through this whole fucking ordeal.  3 of our 4 donor egg embryos tested chromosomally abnormal.  Fuck. My. Life.  Those are the kind of results I hoped for with my own shitty 40-year-old eggs, but for a donor in her 20s, something like 70% should have been normal statistically speaking. I&#39;m not sure if they ended up being able to test the 5th and haven&#39;t heard anything more from them about it, so I&#39;m assuming it degenerated.</p>

<p>So we transferred the single normal embryo.  The doctor was like &quot;it only takes one ...&quot; but please spare me that fucking bullshit.  I&#39;ve had this fluid in my uterus all cycle, and although it appeared to be gone yesterday after having been suctioned out earlier in the week, I am afraid it could have compromised this cycle and now in a week I will be back at square fucking one when my beta&#39;s negative.  </p>

<p>Sorry for the rant, but I just really expected that a 1:2 donor cycle would leave me with a transfer and at least one healthy embryo to freeze.  What the fuck, was I Adolf Hitler in a past life or something?</p>

<p>UPDATE: the 5th embryo was able to be biopsied for PGS, but results will take 10-14 days.  Got to hope it tests normal.</p>
</div><!-- SC_ON -->",,,,,True,False,False,False,False,[],[],False,False,False,False,"41F, 1 m/c, 7 IUI, 4 IVF, 4DIVF, Awaiting GC + DE",[],False,,,,t5_2saej,,,,2wvm1c,True,,mrstreymcdougal,,35,True,no_ads,False,[],False,dark,/r/infertility/comments/2wvm1c/transfer_pgs_turmoil/,no_ads,False,https://www.reddit.com/r/infertility/comments/2wvm1c/transfer_pgs_turmoil/,25375,1424705434.0,0,,False,False,{}
