165,2048,confidence,<praw.reddit.Reddit object at 0x7f2244aead90>,,infertility,"Edit: Just Vivelle-dot now. Follistim has been claimed.

I have 300 IU Follistim and two boxes of Vivelle dot patches(0.1 mg each, 16 patches total) for anyone who wants them. 

The Follistim expiration date is April 2016.
The Vivelle dot expiration date is March 2016.

If anyone lives near Cleveland then we can meet, but most likely I'll ship them. If anyone has any pointers on how to ship Follistim I'd appreciate it. I guess I can just ship it with an ice pack or two.",t2_ik1wr,False,,0,False,Extra Follistim and Vivelle dot,[],r/infertility,False,0,,0,,,False,t3_48j4rm,False,dark,0.67,,public,1,0,{},,,False,[],,False,False,,{},,False,1,,False,self,1456934436.0,,[],{},,True,,1456901867.0,text,0,,,text,self.infertility,False,"<!-- SC_OFF --><div class=""md""><p>Edit: Just Vivelle-dot now. Follistim has been claimed.</p>

<p>I have 300 IU Follistim and two boxes of Vivelle dot patches(0.1 mg each, 16 patches total) for anyone who wants them. </p>

<p>The Follistim expiration date is April 2016.
The Vivelle dot expiration date is March 2016.</p>

<p>If anyone lives near Cleveland then we can meet, but most likely I&#39;ll ship them. If anyone has any pointers on how to ship Follistim I&#39;d appreciate it. I guess I can just ship it with an ice pack or two.</p>
</div><!-- SC_ON -->",,,,,True,True,False,False,False,[],[],False,False,False,False,IVF/PGD for Huntington's Disease. FET#2 04/10/15,[],False,,,,t5_2saej,,,,48j4rm,True,,SamJamsBun,,4,True,no_ads,False,[],False,dark,/r/infertility/comments/48j4rm/extra_follistim_and_vivelle_dot/,no_ads,False,https://www.reddit.com/r/infertility/comments/48j4rm/extra_follistim_and_vivelle_dot/,25375,1456873067.0,0,,False,False,{},,,,
166,2048,confidence,<praw.reddit.Reddit object at 0x7f2244aead90>,,infertility,"I realize this has probably made the rounds here at one point or another, but I just read it for the first time and thought it was perfect (other than the fact that it did not mention pregnancy announcements or people giving their unwanted opinions on fertility treatment). It's a great resource to pass on to friends and family that may not be providing the support you need while struggling with infertility. I'm kind of considering ""outing"" myself on social media by posting this article... Maybe it would get people to STFU a little ;-) 

[Infertility Etiquette for Family and Friends](http://www.resolve.org/support/for-family--friends/infertility-etiquette.html)",t2_at2qd,False,,0,False,Infertility Etiquette,[],r/infertility,False,0,,0,,,False,t3_48irlc,False,dark,0.95,,public,42,0,{},,,False,[],,False,False,,{},,False,42,,False,self,1456876717.0,,[],{},,True,,1456897162.0,text,0,,,text,self.infertility,False,"<!-- SC_OFF --><div class=""md""><p>I realize this has probably made the rounds here at one point or another, but I just read it for the first time and thought it was perfect (other than the fact that it did not mention pregnancy announcements or people giving their unwanted opinions on fertility treatment). It&#39;s a great resource to pass on to friends and family that may not be providing the support you need while struggling with infertility. I&#39;m kind of considering &quot;outing&quot; myself on social media by posting this article... Maybe it would get people to STFU a little ;-) </p>

<p><a href=""http://www.resolve.org/support/for-family--friends/infertility-etiquette.html"">Infertility Etiquette for Family and Friends</a></p>
</div><!-- SC_ON -->",,,,,True,False,False,False,False,[],[],False,False,False,False,"30, severe MFI (due to cancer surgery)/PCOS/IVF1 2015/FET1 2016",[],False,,,,t5_2saej,,,,48irlc,True,,DrXia,,35,True,no_ads,False,[],False,dark,/r/infertility/comments/48irlc/infertility_etiquette/,no_ads,False,https://www.reddit.com/r/infertility/comments/48irlc/infertility_etiquette/,25375,1456868362.0,0,,False,False,{},self,"{'images': [{'source': {'url': 'https://external-preview.redd.it/7OuPKL5jjah49fc2iaWMgVi7dhTdAtWott8e__OEDiY.jpg?auto=webp&s=824c5ce35238f7b4cb78a4e17b76418d06e889c5', 'width': 145, 'height': 80}, 'resolutions': [{'url': 'https://external-preview.redd.it/7OuPKL5jjah49fc2iaWMgVi7dhTdAtWott8e__OEDiY.jpg?width=108&crop=smart&auto=webp&s=38498e96547a44a421e8615b0cee2b0854e96af2', 'width': 108, 'height': 59}], 'variants': {}, 'id': 'pJ14eMXshtq-w0w2GC7U47P0rOOPYwNqVZsEb0FRc1w'}], 'enabled': False}",,
167,2048,confidence,<praw.reddit.Reddit object at 0x7f2244aead90>,,infertility,[deleted],,False,,0,False,Calcium Ionophor for improved fertilization rates?,[],r/infertility,False,0,,0,,,False,t3_48ij0g,False,dark,1.0,,public,2,0,{},,,False,[],,False,False,,{},,False,2,,,default,False,,,{},,True,,1456894123.0,text,0,,,,self.infertility,False,"<!-- SC_OFF --><div class=""md""><p>[deleted]</p>
</div><!-- SC_ON -->",,,,,True,False,False,False,False,[],[],False,False,False,False,,[],False,,,,t5_2saej,,,,48ij0g,False,,,,0,True,no_ads,False,[],,dark,/r/infertility/comments/48ij0g/calcium_ionophor_for_improved_fertilization_rates/,no_ads,False,https://www.reddit.com/r/infertility/comments/48ij0g/calcium_ionophor_for_improved_fertilization_rates/,25375,1456865323.0,0,,False,False,{},,,,
168,2048,confidence,<praw.reddit.Reddit object at 0x7f2244aead90>,,infertility,"I just applied for ARC Fertility's refund program. I'm kind of old and I have mild DOR, so no idea if they'll want to gamble on me. We're hoping to do the 2- or 3 cycle plan.

For people that did get accepted to the refund program, what was your diagnosis, and how much did it add to your cost? It takes a week to get your answer, and I'd love to hear some ballpark figures in the meantime, if anyone wants to share.

Thanks!",t2_9rbj0,False,,0,False,ARC Fertility refund dealie,[],r/infertility,False,0,,0,,,False,t3_48i6ff,False,dark,0.84,,public,4,0,{},,,False,[],,False,False,,{},,False,4,,False,self,False,,[],{},,True,,1456889625.0,text,0,,,text,self.infertility,False,"<!-- SC_OFF --><div class=""md""><p>I just applied for ARC Fertility&#39;s refund program. I&#39;m kind of old and I have mild DOR, so no idea if they&#39;ll want to gamble on me. We&#39;re hoping to do the 2- or 3 cycle plan.</p>

<p>For people that did get accepted to the refund program, what was your diagnosis, and how much did it add to your cost? It takes a week to get your answer, and I&#39;d love to hear some ballpark figures in the meantime, if anyone wants to share.</p>

<p>Thanks!</p>
</div><!-- SC_ON -->",,,,,True,False,False,False,False,[],[],False,False,False,False,"36, DOR/MFI/FML, 1 early loss, IVF+PICSI",[],False,,,,t5_2saej,,,,48i6ff,True,,duppyconquerer,,5,True,no_ads,False,[],False,dark,/r/infertility/comments/48i6ff/arc_fertility_refund_dealie/,no_ads,False,https://www.reddit.com/r/infertility/comments/48i6ff/arc_fertility_refund_dealie/,25375,1456860825.0,0,,False,False,{},,,,
169,2048,confidence,<praw.reddit.Reddit object at 0x7f2244aead90>,,infertility,"To the vocal coworker at lunch: It's nice that some random person you know went through many adversities and was able to conceive but your anecdote has nothing to do with my situation. So please don't be dismissive of my plight. 

/rant",t2_uaswk,False,,0,False,"""Anything is possible!!!"" Ugh, just shut up.",[],r/infertility,False,0,,0,,,False,t3_48i4lt,False,dark,0.87,,public,15,0,{},,,False,[],,False,False,,{},,False,15,,False,self,False,,[],{},,True,,1456888975.0,text,0,,,text,self.infertility,False,"<!-- SC_OFF --><div class=""md""><p>To the vocal coworker at lunch: It&#39;s nice that some random person you know went through many adversities and was able to conceive but your anecdote has nothing to do with my situation. So please don&#39;t be dismissive of my plight. </p>

<p>/rant</p>
</div><!-- SC_ON -->",,,,,True,False,False,False,False,[],[],False,False,False,False,,[],False,,,,t5_2saej,,,,48i4lt,True,,Hamtorosaur,,37,True,no_ads,False,[],False,,/r/infertility/comments/48i4lt/anything_is_possible_ugh_just_shut_up/,no_ads,False,https://www.reddit.com/r/infertility/comments/48i4lt/anything_is_possible_ugh_just_shut_up/,25375,1456860175.0,0,,False,False,{},,,,
170,2048,confidence,<praw.reddit.Reddit object at 0x7f2244aead90>,,infertility,"It's a comedy called ""How to Buy a Baby"" and so far they just have this teaser

https://www.youtube.com/watch?v=sLqSlmok9KA",t2_5ta0j,False,,0,False,"Hope it's ok to post this here, some friends of mine are starting to produce a webseries about infertility and I figured this subreddit would probably be the target demographic for it",[],r/infertility,False,0,,0,,,False,t3_48hqdk,False,dark,0.96,,public,53,0,{},,,False,[],,False,False,,{},,False,53,,False,self,False,,[],{},,True,,1456884344.0,text,0,,,text,self.infertility,False,"<!-- SC_OFF --><div class=""md""><p>It&#39;s a comedy called &quot;How to Buy a Baby&quot; and so far they just have this teaser</p>

<p><a href=""https://www.youtube.com/watch?v=sLqSlmok9KA"">https://www.youtube.com/watch?v=sLqSlmok9KA</a></p>
</div><!-- SC_ON -->",,,,,True,False,False,False,False,[],[],False,False,False,False,,[],False,,,,t5_2saej,,,,48hqdk,True,,sinewave89,,57,True,no_ads,False,[],False,,/r/infertility/comments/48hqdk/hope_its_ok_to_post_this_here_some_friends_of/,no_ads,False,https://www.reddit.com/r/infertility/comments/48hqdk/hope_its_ok_to_post_this_here_some_friends_of/,25375,1456855544.0,0,,False,False,{},self,"{'images': [{'source': {'url': 'https://external-preview.redd.it/caAynyX6o0rvt_lZT3HxZUoXiWGXR5RK3OTXZYASz0k.jpg?auto=webp&s=819e0e4783c6eca9b68e49904e1e1e5d3c2dbd0e', 'width': 480, 'height': 360}, 'resolutions': [{'url': 'https://external-preview.redd.it/caAynyX6o0rvt_lZT3HxZUoXiWGXR5RK3OTXZYASz0k.jpg?width=108&crop=smart&auto=webp&s=4ce8aec538e6f061b28cea01e14855cb3c93ea28', 'width': 108, 'height': 81}, {'url': 'https://external-preview.redd.it/caAynyX6o0rvt_lZT3HxZUoXiWGXR5RK3OTXZYASz0k.jpg?width=216&crop=smart&auto=webp&s=ac857f25a18a749289d3be43f87b60b0552431e3', 'width': 216, 'height': 162}, {'url': 'https://external-preview.redd.it/caAynyX6o0rvt_lZT3HxZUoXiWGXR5RK3OTXZYASz0k.jpg?width=320&crop=smart&auto=webp&s=f475dd395cbe6f5423b1d9b3a9aeb40241fbb52c', 'width': 320, 'height': 240}], 'variants': {}, 'id': 'fNdygCz6jfQukPktGTwUAmk3y3VGMG_vYKOpX65PLu8'}], 'enabled': False}",,
171,2048,confidence,<praw.reddit.Reddit object at 0x7f2244aead90>,,infertility,"With my new cycle starting tomorrow, my doctor has ordered a test to check my AMH. The paper states within first 14 days of cycle. Is there a preferred day of cycle to get it tested? Like cycle day 1 or cycle day 3, etc?",t2_hktpl,False,,0,False,Best day to get blood draw for AMH?,[],r/infertility,False,0,,0,,,False,t3_48hlju,False,dark,1.0,,public,1,0,{},,,False,[],,False,False,,{},,False,1,,False,self,False,,[],{},,True,,1456882772.0,text,0,,,text,self.infertility,False,"<!-- SC_OFF --><div class=""md""><p>With my new cycle starting tomorrow, my doctor has ordered a test to check my AMH. The paper states within first 14 days of cycle. Is there a preferred day of cycle to get it tested? Like cycle day 1 or cycle day 3, etc?</p>
</div><!-- SC_ON -->",,,,,True,True,False,False,False,[],[],False,False,False,False,"34f, unexplained",[],False,,,,t5_2saej,,,,48hlju,True,,tiredone905,,6,False,no_ads,False,[],False,dark,/r/infertility/comments/48hlju/best_day_to_get_blood_draw_for_amh/,no_ads,False,https://www.reddit.com/r/infertility/comments/48hlju/best_day_to_get_blood_draw_for_amh/,25375,1456853972.0,0,,False,False,{},,,,
172,2048,confidence,<praw.reddit.Reddit object at 0x7f2244aead90>,,infertility,"First- if you grew up on Full House- they are doing a great job keeping the spirit of the old show while updating it. It is really good! (Cheesy, family-friendly, but just what you'd expect). The first episode is very nostalgic. A few episodes later.... SPOILER ALERT!!!!! A character talks briefly about infertility and it was nice. I mean- I cried my eyes out but it was well done. ",t2_qn7h5,False,,0,False,Anyone watching Fuller House?,[],r/infertility,False,0,,0,,,False,t3_48h0ds,False,dark,0.78,,public,5,0,{},,d70f54ce-930e-11e4-8710-22000b26873e,False,[],,False,False,,{},,False,5,,False,self,False,,[],{},,True,,1456875651.0,text,0,,,text,self.infertility,False,"<!-- SC_OFF --><div class=""md""><p>First- if you grew up on Full House- they are doing a great job keeping the spirit of the old show while updating it. It is really good! (Cheesy, family-friendly, but just what you&#39;d expect). The first episode is very nostalgic. A few episodes later.... SPOILER ALERT!!!!! A character talks briefly about infertility and it was nice. I mean- I cried my eyes out but it was well done. </p>
</div><!-- SC_ON -->",,,,,True,False,False,False,False,[],[],False,False,False,False,"36F, DOR & MF, upcoming DE cycle",[],False,,,,t5_2saej,,,,48h0ds,True,,MBel312,,18,True,no_ads,False,[],False,dark,/r/infertility/comments/48h0ds/anyone_watching_fuller_house/,no_ads,False,https://www.reddit.com/r/infertility/comments/48h0ds/anyone_watching_fuller_house/,25375,1456846851.0,0,,False,False,{},,,,
173,2048,confidence,<praw.reddit.Reddit object at 0x7f2244aead90>,,infertility,"Hola! I was finally diagnosed with PCOS after a year of trying with no results. I had a high insulin level so my doc put me on Metformin (500mg 3 times a day) to try and help with PCOS symptoms and the insulin problem before we go to Clomid since we weren't in dire need to get pregnant right away, what's a couple more months, ya know? 12 is already down the drain.

So, my question is, if you were put on Metformin, what were your results/symptoms etc. She told me to slowly work up to 3 a day, so I started with one, then two, then got up to 3 in a week. I was perfectly fine with one and two, but three has been absolute hell. I constantly feel like I'm going to throw up, I've had almost constant headaches and I'm just generally cranky (provably from feeling like straight up garbage).

I don't know if I can do this for two more months.
",t2_c6oja,False,,0,False,Experiences with Metformin? (x-post from infertilitysucks),[],r/infertility,False,0,,0,,,False,t3_48gy2g,False,dark,1.0,,public,6,0,{},,,False,[],,False,False,,{},,False,6,,False,self,False,,[],{},,True,,1456874798.0,text,0,,,text,self.infertility,False,"<!-- SC_OFF --><div class=""md""><p>Hola! I was finally diagnosed with PCOS after a year of trying with no results. I had a high insulin level so my doc put me on Metformin (500mg 3 times a day) to try and help with PCOS symptoms and the insulin problem before we go to Clomid since we weren&#39;t in dire need to get pregnant right away, what&#39;s a couple more months, ya know? 12 is already down the drain.</p>

<p>So, my question is, if you were put on Metformin, what were your results/symptoms etc. She told me to slowly work up to 3 a day, so I started with one, then two, then got up to 3 in a week. I was perfectly fine with one and two, but three has been absolute hell. I constantly feel like I&#39;m going to throw up, I&#39;ve had almost constant headaches and I&#39;m just generally cranky (provably from feeling like straight up garbage).</p>

<p>I don&#39;t know if I can do this for two more months.</p>
</div><!-- SC_ON -->",,,,,True,False,False,False,False,[],[],False,False,False,False,25 | TTC #1 Since 2014 | PCOS,[],False,,,,t5_2saej,,,,48gy2g,True,,Kelikea,,20,True,no_ads,False,[],False,dark,/r/infertility/comments/48gy2g/experiences_with_metformin_xpost_from/,no_ads,False,https://www.reddit.com/r/infertility/comments/48gy2g/experiences_with_metformin_xpost_from/,25375,1456845998.0,0,,False,False,{},,,,
174,2048,confidence,<praw.reddit.Reddit object at 0x7f2244aead90>,,infertility,"FINALLY started my period today thanks to Provera. We're on round one of treatment for our second kiddo. I start my Femara Thursday CD3 and ultrasound CD 12 I believe.

It's so funny - when we were going through this the first time I had no expectation of anything. Every failed cycle, although depressing in its own way, was like an adventure. New drugs. Ultrasounds. Experimenting with what worked for my body alongside my RE... For some reason now - I just have this sense of ""oh it'll work the first time guaranteed."" Like - how stupid am I? It didn't take the first 6 times we did it the first time. Why would it work off the bat now? I've already bought white onesies and socks and a few necessities. It's like a sense of entitlement without the right to be entitled. 

I've not told any friends about our TTC journey. No one knows we're going for #2. I feel embarrassed for myself jumping the gun on actually purchasing things. As if I were already pregnant. What if this takes a year+? 

Sorry. I'm being weird. Hormonal rambling from the girl who doesn't get a period but once a year (induced) and obviously doesn't know how to deal like the rest of the women on the planet. *sigh* ",t2_pjswg,False,,0,False,CD 1! Thanks Provera.... (PCOS journey for #2!),[],r/infertility,False,0,,0,,,False,t3_48gj7i,False,dark,0.99,,public,6,0,{},,,False,[],,False,False,,{},,False,6,,False,self,False,,[],{},,True,,1456869657.0,text,0,,,text,self.infertility,False,"<!-- SC_OFF --><div class=""md""><p>FINALLY started my period today thanks to Provera. We&#39;re on round one of treatment for our second kiddo. I start my Femara Thursday CD3 and ultrasound CD 12 I believe.</p>

<p>It&#39;s so funny - when we were going through this the first time I had no expectation of anything. Every failed cycle, although depressing in its own way, was like an adventure. New drugs. Ultrasounds. Experimenting with what worked for my body alongside my RE... For some reason now - I just have this sense of &quot;oh it&#39;ll work the first time guaranteed.&quot; Like - how stupid am I? It didn&#39;t take the first 6 times we did it the first time. Why would it work off the bat now? I&#39;ve already bought white onesies and socks and a few necessities. It&#39;s like a sense of entitlement without the right to be entitled. </p>

<p>I&#39;ve not told any friends about our TTC journey. No one knows we&#39;re going for #2. I feel embarrassed for myself jumping the gun on actually purchasing things. As if I were already pregnant. What if this takes a year+? </p>

<p>Sorry. I&#39;m being weird. Hormonal rambling from the girl who doesn&#39;t get a period but once a year (induced) and obviously doesn&#39;t know how to deal like the rest of the women on the planet. <em>sigh</em> </p>
</div><!-- SC_ON -->",,,,,True,False,False,False,False,[],[],False,False,False,False,,[],False,,,,t5_2saej,,,,48gj7i,True,,TheTaylorSomebody,,6,True,no_ads,False,[],False,,/r/infertility/comments/48gj7i/cd_1_thanks_provera_pcos_journey_for_2/,no_ads,False,https://www.reddit.com/r/infertility/comments/48gj7i/cd_1_thanks_provera_pcos_journey_for_2/,25375,1456840857.0,0,,False,False,{},,,,
175,2048,confidence,<praw.reddit.Reddit object at 0x7f2244aead90>,,infertility,[deleted],,False,,0,False,My letter published,[],r/infertility,False,0,,0,,,False,t3_48g57j,False,dark,0.97,,public,25,0,{},,,False,[],,False,False,,{},,False,25,,,default,1456843318.0,,,{},,True,,1456865081.0,text,0,,,,self.infertility,False,"<!-- SC_OFF --><div class=""md""><p>[deleted]</p>
</div><!-- SC_ON -->",,,,,True,False,False,False,False,[],[],False,False,False,False,,[],False,,,,t5_2saej,,,,48g57j,False,,,,21,True,no_ads,False,[],,dark,/r/infertility/comments/48g57j/my_letter_published/,no_ads,False,https://www.reddit.com/r/infertility/comments/48g57j/my_letter_published/,25375,1456836281.0,0,,False,False,{},,,,
176,2048,confidence,<praw.reddit.Reddit object at 0x7f2244aead90>,,infertility,[removed],t2_sn6ev,False,,0,False,IVF Egg Donation Surrogacy Package in Tbilisi Georgia,[],r/infertility,False,0,,0,,,False,t3_48fulw,False,dark,1.0,,public,1,0,{},,,False,[],,False,False,,{},,False,1,,False,default,False,,[],{},,True,,1456861057.0,text,0,,,text,self.infertility,False,"<!-- SC_OFF --><div class=""md""><p>[removed]</p>
</div><!-- SC_ON -->",,,,,True,True,False,False,False,[],[],False,False,False,False,,[],False,,,,t5_2saej,,,,48fulw,False,,Medicaleads,,0,True,no_ads,False,[],False,,/r/infertility/comments/48fulw/ivf_egg_donation_surrogacy_package_in_tbilisi/,no_ads,False,https://www.reddit.com/r/infertility/comments/48fulw/ivf_egg_donation_surrogacy_package_in_tbilisi/,25375,1456832257.0,0,,False,False,{},,,,
177,2048,confidence,<praw.reddit.Reddit object at 0x7f2244aead90>,,infertility,"Use this thread to share anything not necessarily related to infertility. Rant or rave, bitch, moan, share something funny, anything goes!",t2_6l4z3,False,,0,False,Tuesday Off Topic Thread,[],r/infertility,False,0,,0,,,False,t3_48flc6,False,dark,0.81,,public,3,0,{},,,False,[],,False,False,,{},,False,3,,True,self,False,,[],{},,True,,1456855344.0,text,0,,,text,self.infertility,False,"<!-- SC_OFF --><div class=""md""><p>Use this thread to share anything not necessarily related to infertility. Rant or rave, bitch, moan, share something funny, anything goes!</p>
</div><!-- SC_ON -->",,,,,True,False,False,False,False,[],[],False,False,False,False,,[],False,,,moderator,t5_2saej,,,,48flc6,True,,AutoModerator,,147,False,no_ads,False,[],False,,/r/infertility/comments/48flc6/tuesday_off_topic_thread/,no_ads,False,https://www.reddit.com/r/infertility/comments/48flc6/tuesday_off_topic_thread/,25375,1456826544.0,0,,False,False,{},,,,
178,2048,confidence,<praw.reddit.Reddit object at 0x7f2244aead90>,,infertility,"Bizarre question I know, and completely un-infertility-related but I was checking some dates last night and realised that our lovely furry girl came into heat during each of my 3 ICSI cycles and wondered if anyone else had this happen.  It was 7 months from her previous season to my first cycle, 8 months to my 2nd treatment cycle then 6 months so no regularity at all.  I just found it fascinating and thought i'd ask the question!!!",t2_i3e3v,False,,0,False,Anyone been through treatment with an intact female dog in the house??,[],r/infertility,False,0,,0,,,False,t3_48fasx,False,dark,0.6,,public,1,0,{},,d70f54ce-930e-11e4-8710-22000b26873e,False,[],,False,False,,{},,False,1,,False,self,False,,[],{},,True,,1456849721.0,text,0,,,text,self.infertility,False,"<!-- SC_OFF --><div class=""md""><p>Bizarre question I know, and completely un-infertility-related but I was checking some dates last night and realised that our lovely furry girl came into heat during each of my 3 ICSI cycles and wondered if anyone else had this happen.  It was 7 months from her previous season to my first cycle, 8 months to my 2nd treatment cycle then 6 months so no regularity at all.  I just found it fascinating and thought i&#39;d ask the question!!!</p>
</div><!-- SC_ON -->",,,,,True,True,False,False,False,[],[],False,False,False,False,"45F, 2MC/1CP with both own and donor eggs but still trying",[],False,,,,t5_2saej,,,,48fasx,True,,trixylix,,2,True,no_ads,False,[],False,dark,/r/infertility/comments/48fasx/anyone_been_through_treatment_with_an_intact/,no_ads,False,https://www.reddit.com/r/infertility/comments/48fasx/anyone_been_through_treatment_with_an_intact/,25375,1456820921.0,0,,False,False,{},,,,
