,comment_limit,comment_sort,_reddit,approved_at_utc,subreddit,selftext,author_fullname,saved,mod_reason_title,gilded,clicked,title,link_flair_richtext,subreddit_name_prefixed,hidden,pwls,link_flair_css_class,downs,thumbnail_height,top_awarded_type,hide_score,name,quarantine,link_flair_text_color,upvote_ratio,author_flair_background_color,subreddit_type,ups,total_awards_received,media_embed,thumbnail_width,author_flair_template_id,is_original_content,user_reports,secure_media,is_reddit_media_domain,is_meta,category,secure_media_embed,link_flair_text,can_mod_post,score,approved_by,author_premium,thumbnail,edited,author_flair_css_class,author_flair_richtext,gildings,content_categories,is_self,mod_note,created,link_flair_type,wls,removed_by_category,banned_by,author_flair_type,domain,allow_live_comments,selftext_html,likes,suggested_sort,banned_at_utc,view_count,archived,no_follow,is_crosspostable,pinned,over_18,all_awardings,awarders,media_only,can_gild,spoiler,locked,author_flair_text,treatment_tags,visited,removed_by,num_reports,distinguished,subreddit_id,mod_reason_by,removal_reason,link_flair_background_color,id,is_robot_indexable,report_reasons,author,discussion_type,num_comments,send_replies,whitelist_status,contest_mode,mod_reports,author_patreon_flair,author_flair_text_color,permalink,parent_whitelist_status,stickied,url,subreddit_subscribers,created_utc,num_crossposts,media,is_video,_fetched,_comments_by_id,post_hint,preview,url_overridden_by_dest,collections
0,2048,confidence,<praw.reddit.Reddit object at 0x7f2244aead90>,,infertility,"Welcome to the Infertility Results thread!

Here you have the option of posting the outcome of your cycle (be it positive or negative) in a way that is sensitive to the emotional needs of our unique community.

For the sake of members who are struggling with negative results and the difficult feelings that come with them, we request that all pregnancy announcements be shared only in this thread. 

For the next stage of your journey, you may be interested in posting your story on /r/whatworkedforme and we encourage you to continue to share your progress at our sister community, /r/InfertilityBabies. Of course, you are always encouraged to share your non-pregnancy-related infertility experiences (and continue to support other community members) here on /r/infertility.

Negative results are also welcome here, though they need not be confined to this thread. Members with questionable results who want immediate support, and those who need their follow-up questions to be open to greater and faster readership are, as always, welcome to post freely on the main board.

We are not banning any kind of post, either here or on the main board, but rather we see this as an opportunity for members to continue to share with those who are following their journey, but do so in a way that respects the feelings and wishes of those for whom individual results posts would be burdensome. As always, please refer to the sidebar where you will find our subreddit guidelines and a short list of other related subreddits and resources you may find useful throughout your journey.",t2_6dcf0,False,,0,False,Results 3/13 to 3/19,[],r/infertility,False,0,,0,,,False,t3_4a8m4t,False,dark,0.75,,public,2,0,{},,,False,[],,False,False,,{},,False,2,,False,self,False,,[],{},,True,,1457910540.0,text,0,,,text,self.infertility,False,"<!-- SC_OFF --><div class=""md""><p>Welcome to the Infertility Results thread!</p>

<p>Here you have the option of posting the outcome of your cycle (be it positive or negative) in a way that is sensitive to the emotional needs of our unique community.</p>

<p>For the sake of members who are struggling with negative results and the difficult feelings that come with them, we request that all pregnancy announcements be shared only in this thread. </p>

<p>For the next stage of your journey, you may be interested in posting your story on <a href=""/r/whatworkedforme"">/r/whatworkedforme</a> and we encourage you to continue to share your progress at our sister community, <a href=""/r/InfertilityBabies"">/r/InfertilityBabies</a>. Of course, you are always encouraged to share your non-pregnancy-related infertility experiences (and continue to support other community members) here on <a href=""/r/infertility"">/r/infertility</a>.</p>

<p>Negative results are also welcome here, though they need not be confined to this thread. Members with questionable results who want immediate support, and those who need their follow-up questions to be open to greater and faster readership are, as always, welcome to post freely on the main board.</p>

<p>We are not banning any kind of post, either here or on the main board, but rather we see this as an opportunity for members to continue to share with those who are following their journey, but do so in a way that respects the feelings and wishes of those for whom individual results posts would be burdensome. As always, please refer to the sidebar where you will find our subreddit guidelines and a short list of other related subreddits and resources you may find useful throughout your journey.</p>
</div><!-- SC_ON -->",,,,,True,False,False,False,False,[],[],False,False,False,False,"Since 2010. 7 early mcs. 3 IUI, 2 IVF, 2 FET",[],False,,,moderator,t5_2saej,,,,4a8m4t,True,,Vexwyf,,70,False,no_ads,False,[],False,dark,/r/infertility/comments/4a8m4t/results_313_to_319/,no_ads,False,https://www.reddit.com/r/infertility/comments/4a8m4t/results_313_to_319/,25375,1457881740.0,0,,False,False,{},,,,
1,2048,confidence,<praw.reddit.Reddit object at 0x7f2244aead90>,,infertility,"I am so sick and tired of this all. I seriously feel like I'm at the end of my rope. 5 1/2 years is way too long to be stuck in this endless cycle of hope and then being let down.  My husbands crazy (absolutely f-ing crazy) 18 year old sister just announced she's pregnant.  She was 12 when we started trying to conceive. 12. She can't even take care of herself, let alone take care of another human being.  This world is a cruel place :( ",t2_mpkah,False,,0,False,So done with infertility,[],r/infertility,False,0,,0,,,False,t3_4a8g24,False,dark,0.92,,public,9,0,{},,,False,[],,False,False,,{},,False,9,,False,self,False,,[],{},,True,,1457907274.0,text,0,,,text,self.infertility,False,"<!-- SC_OFF --><div class=""md""><p>I am so sick and tired of this all. I seriously feel like I&#39;m at the end of my rope. 5 1/2 years is way too long to be stuck in this endless cycle of hope and then being let down.  My husbands crazy (absolutely f-ing crazy) 18 year old sister just announced she&#39;s pregnant.  She was 12 when we started trying to conceive. 12. She can&#39;t even take care of herself, let alone take care of another human being.  This world is a cruel place :( </p>
</div><!-- SC_ON -->",,,,,True,False,False,False,False,[],[],False,False,False,False,,[],False,,,,t5_2saej,,,,4a8g24,True,,IDreamofPanqueques,,7,True,no_ads,False,[],False,,/r/infertility/comments/4a8g24/so_done_with_infertility/,no_ads,False,https://www.reddit.com/r/infertility/comments/4a8g24/so_done_with_infertility/,25375,1457878474.0,0,,False,False,{},,,,
2,2048,confidence,<praw.reddit.Reddit object at 0x7f2244aead90>,,infertility,"Use this thread to share anything not necessarily related to infertility. Rant or rave, bitch, moan, share something funny, anything goes!",t2_6l4z3,False,,0,False,Sunday Off Topic Thread,[],r/infertility,False,0,,0,,,False,t3_4a7v6s,False,dark,1.0,,public,3,0,{},,,False,[],,False,False,,{},,False,3,,True,self,False,,[],{},,True,,1457892131.0,text,0,,,text,self.infertility,False,"<!-- SC_OFF --><div class=""md""><p>Use this thread to share anything not necessarily related to infertility. Rant or rave, bitch, moan, share something funny, anything goes!</p>
</div><!-- SC_ON -->",,,,,True,False,False,False,False,[],[],False,False,False,False,,[],False,,,moderator,t5_2saej,,,,4a7v6s,True,,AutoModerator,,23,False,no_ads,False,[],False,,/r/infertility/comments/4a7v6s/sunday_off_topic_thread/,no_ads,False,https://www.reddit.com/r/infertility/comments/4a7v6s/sunday_off_topic_thread/,25375,1457863331.0,0,,False,False,{},,,,
3,2048,confidence,<praw.reddit.Reddit object at 0x7f2244aead90>,,infertility,[deleted],,False,,0,False,Anyone try Red Clover herb yet for fertility?,[],r/infertility,False,0,,0,,,False,t3_4a790s,False,dark,0.25,,public,0,0,{},,,False,[],,False,False,,{},,False,0,,,default,False,,,{},,True,,1457876496.0,text,0,,,,self.infertility,False,"<!-- SC_OFF --><div class=""md""><p>[deleted]</p>
</div><!-- SC_ON -->",,,,,True,True,False,False,False,[],[],False,False,False,False,,[],False,,,,t5_2saej,,,,4a790s,False,,,,3,True,no_ads,False,[],,dark,/r/infertility/comments/4a790s/anyone_try_red_clover_herb_yet_for_fertility/,no_ads,False,https://www.reddit.com/r/infertility/comments/4a790s/anyone_try_red_clover_herb_yet_for_fertility/,25375,1457847696.0,0,,False,False,{},,,,
4,2048,confidence,<praw.reddit.Reddit object at 0x7f2244aead90>,,infertility,"I posted on Wednesday when I was first diagnosed with bi-lateral tubal disease, with the left tube being completely blown and the right showing sever damage, but not entirely unserviceable (for lack of a better term).  Prognosis is IVF is only option and husband is extremely resistant to the idea and is working on accepting a child free life. I've tried to talk about it a couple times, but I can tell we are both grieving in very different ways, so I've decided not to push the issue for awhile.

I have however, made an appointment to have a 30 min phone conversation with a clinic about the specifics of donating my eggs and a second opinion appointment with an IVF clinic to confirm that IVF is the ONLY option.  Unfortunately, both appointments are well into the future, so now I wait.

In the mean time, I am still taking my temperature every morning and I'm approaching CD10, when I would usually start using OPKs.  I'm torn between having more information ""just in case"" and ""what's the point"".  Because of the PCOS, I've only ovulated once in the last eight months, which happened to be last month (although it was CD30), so I'm curious if it will happen again.  Plus the denial part of me keeps reminding me that there is a boost to fertility after an HSG, so I should keep trying.  What do you all think?  Do any of you all who have been told IVF is only option still temp and use OPKs? 

We also have a follow up appointment on Monday with the RE who diagnosed me to ask all the questions.  I need to write down all my questions, but I know I want o ask if I should 1) get on metaformin to lower my testosterone, despite my tubes being busted and 2) the nitty gritty of IVF and 3) Donating my eggs.  I think that if my husband can have the mysteries of IVF removed, it might change his mind.  Any specific questions any of you all wish you had asked at one of your early RE appointments that I should ask?

Finally, I am really stuck in a rut right now.  I was diagnosed mid-day wed. and have yet to go back into the office.  I completely skipped work after the diagnosis and Thursday and I worked form home on friday.  I'm forcing myself to go to an agility trial this whole weekend, but I keep saying ""my give a shit is broken"". We are failing miserably so far and I just don't care.  

Plus I know I will have to go back to work tomorrow.  I'm hoping most people will just ask if I'm ""feeling better"", so I can just get by with ""yes"", but I know my manager will ask me what is up.  Plus I've been dodging my mother for about 3 weeks (we usually talk every week), so I know I have to tell her soon. How do you get out of the rut of self pity, envy, jealousy, and all the other terrible emotions that surface the second I see a child or pregnant woman? I feel like a shell of myself is going through the motions of my life. :-(

Sorry for the ramble, I have a lot of things rolling around in my brain right now and they aren't all coming out eloquently. This is the first time since Wednesday I've had enough energy to type anything.  I've opened my alien blue app probably 100 times with the intent to post and then started crying and closed it without even browsing my front page. I've only been here for a short time, but all your responses to my first post were so much appreciated, I am already so thankful for this community.",t2_llmz7,False,,0,False,Trying to emotionally recover from diagnosis,[],r/infertility,False,0,,0,,,False,t3_4a6xs5,False,dark,1.0,,public,8,0,{},,d70f54ce-930e-11e4-8710-22000b26873e,False,[],,False,False,,{},,False,8,,False,self,False,,[],{},,True,,1457870120.0,text,0,,,text,self.infertility,False,"<!-- SC_OFF --><div class=""md""><p>I posted on Wednesday when I was first diagnosed with bi-lateral tubal disease, with the left tube being completely blown and the right showing sever damage, but not entirely unserviceable (for lack of a better term).  Prognosis is IVF is only option and husband is extremely resistant to the idea and is working on accepting a child free life. I&#39;ve tried to talk about it a couple times, but I can tell we are both grieving in very different ways, so I&#39;ve decided not to push the issue for awhile.</p>

<p>I have however, made an appointment to have a 30 min phone conversation with a clinic about the specifics of donating my eggs and a second opinion appointment with an IVF clinic to confirm that IVF is the ONLY option.  Unfortunately, both appointments are well into the future, so now I wait.</p>

<p>In the mean time, I am still taking my temperature every morning and I&#39;m approaching CD10, when I would usually start using OPKs.  I&#39;m torn between having more information &quot;just in case&quot; and &quot;what&#39;s the point&quot;.  Because of the PCOS, I&#39;ve only ovulated once in the last eight months, which happened to be last month (although it was CD30), so I&#39;m curious if it will happen again.  Plus the denial part of me keeps reminding me that there is a boost to fertility after an HSG, so I should keep trying.  What do you all think?  Do any of you all who have been told IVF is only option still temp and use OPKs? </p>

<p>We also have a follow up appointment on Monday with the RE who diagnosed me to ask all the questions.  I need to write down all my questions, but I know I want o ask if I should 1) get on metaformin to lower my testosterone, despite my tubes being busted and 2) the nitty gritty of IVF and 3) Donating my eggs.  I think that if my husband can have the mysteries of IVF removed, it might change his mind.  Any specific questions any of you all wish you had asked at one of your early RE appointments that I should ask?</p>

<p>Finally, I am really stuck in a rut right now.  I was diagnosed mid-day wed. and have yet to go back into the office.  I completely skipped work after the diagnosis and Thursday and I worked form home on friday.  I&#39;m forcing myself to go to an agility trial this whole weekend, but I keep saying &quot;my give a shit is broken&quot;. We are failing miserably so far and I just don&#39;t care.  </p>

<p>Plus I know I will have to go back to work tomorrow.  I&#39;m hoping most people will just ask if I&#39;m &quot;feeling better&quot;, so I can just get by with &quot;yes&quot;, but I know my manager will ask me what is up.  Plus I&#39;ve been dodging my mother for about 3 weeks (we usually talk every week), so I know I have to tell her soon. How do you get out of the rut of self pity, envy, jealousy, and all the other terrible emotions that surface the second I see a child or pregnant woman? I feel like a shell of myself is going through the motions of my life. :-(</p>

<p>Sorry for the ramble, I have a lot of things rolling around in my brain right now and they aren&#39;t all coming out eloquently. This is the first time since Wednesday I&#39;ve had enough energy to type anything.  I&#39;ve opened my alien blue app probably 100 times with the intent to post and then started crying and closed it without even browsing my front page. I&#39;ve only been here for a short time, but all your responses to my first post were so much appreciated, I am already so thankful for this community.</p>
</div><!-- SC_ON -->",,,,,True,False,False,False,False,[],[],False,False,False,False,32F/FETs/Tubeless/PCOS/Questionable Uterus,[],False,,,,t5_2saej,,,,4a6xs5,True,,Gizmos_Human,,17,True,no_ads,False,[],False,dark,/r/infertility/comments/4a6xs5/trying_to_emotionally_recover_from_diagnosis/,no_ads,False,https://www.reddit.com/r/infertility/comments/4a6xs5/trying_to_emotionally_recover_from_diagnosis/,25375,1457841320.0,0,,False,False,{},,,,
5,2048,confidence,<praw.reddit.Reddit object at 0x7f2244aead90>,,infertility,"Friday I went for my follicle scan. I had a nice sized follicle in my right ovary and all appeared well. ... Well today I triggered and we decided to have sex (every time we have sex my husband sings ""It's business time"" from Flight of the Concords over and over...). So I noticed right when we started that I could feel a painful sensation right over my right ovary. It hurt. Like there was a lot of pressure when penetration would occur. I had him go slow and eventually it stopped and all was fine and well, but it was extremely strange and initially unpleasant. Is this normal? I don't remember this last time I ovulated... Three+ years ago... Ha. What gives? 

",t2_pjswg,False,,0,False,So this was new... And odd...,[],r/infertility,False,0,,0,,,False,t3_4a6xqq,False,dark,0.75,,public,2,0,{},,,False,[],,False,False,,{},,False,2,,False,self,False,,[],{},,True,,1457870097.0,text,0,,,text,self.infertility,False,"<!-- SC_OFF --><div class=""md""><p>Friday I went for my follicle scan. I had a nice sized follicle in my right ovary and all appeared well. ... Well today I triggered and we decided to have sex (every time we have sex my husband sings &quot;It&#39;s business time&quot; from Flight of the Concords over and over...). So I noticed right when we started that I could feel a painful sensation right over my right ovary. It hurt. Like there was a lot of pressure when penetration would occur. I had him go slow and eventually it stopped and all was fine and well, but it was extremely strange and initially unpleasant. Is this normal? I don&#39;t remember this last time I ovulated... Three+ years ago... Ha. What gives? </p>
</div><!-- SC_ON -->",,,,,True,False,False,False,False,[],[],False,False,False,False,,[],False,,,,t5_2saej,,,,4a6xqq,True,,TheTaylorSomebody,,16,True,no_ads,False,[],False,,/r/infertility/comments/4a6xqq/so_this_was_new_and_odd/,no_ads,False,https://www.reddit.com/r/infertility/comments/4a6xqq/so_this_was_new_and_odd/,25375,1457841297.0,0,,False,False,{},,,,
6,2048,confidence,<praw.reddit.Reddit object at 0x7f2244aead90>,,infertility,"My husband and I started trying over eight years ago, and have been going through failed ivf for over three years. Today yet another friend posted a pregnancy photo. I'm happy for her but I am just so tired of seeing it. In the last year, six friends have announced/had babies all of whom would have been in high school when we started trying! High School! They have now all finished graduate school and have been working for years. I thought it was hard when my niece had an accidental pregnancy at 20, and then a planned pregnancy at 22. I'm sure it's just the stress and hormone shots but I my have reached my breaking point... Again. Thanks for listening. I have wonderful supportive friends and family, but no one really gets it. ",t2_835l4,False,,0,False,Rant,[],r/infertility,False,0,,0,,,False,t3_4a6viw,False,dark,0.87,,public,12,0,{},,,False,[],,False,False,,{},,False,12,,False,self,False,,[],{},,True,,1457868910.0,text,0,,,text,self.infertility,False,"<!-- SC_OFF --><div class=""md""><p>My husband and I started trying over eight years ago, and have been going through failed ivf for over three years. Today yet another friend posted a pregnancy photo. I&#39;m happy for her but I am just so tired of seeing it. In the last year, six friends have announced/had babies all of whom would have been in high school when we started trying! High School! They have now all finished graduate school and have been working for years. I thought it was hard when my niece had an accidental pregnancy at 20, and then a planned pregnancy at 22. I&#39;m sure it&#39;s just the stress and hormone shots but I my have reached my breaking point... Again. Thanks for listening. I have wonderful supportive friends and family, but no one really gets it. </p>
</div><!-- SC_ON -->",,,,,True,False,False,False,False,[],[],False,False,False,False,"PCOS; 8 years of IUI, IVF; zero luck",[],False,,,,t5_2saej,,,,4a6viw,True,,speechcookie,,16,True,no_ads,False,[],False,dark,/r/infertility/comments/4a6viw/rant/,no_ads,False,https://www.reddit.com/r/infertility/comments/4a6viw/rant/,25375,1457840110.0,0,,False,False,{},,,,
7,2048,confidence,<praw.reddit.Reddit object at 0x7f2244aead90>,,infertility,"So my doctor gave me clomid for this cycle! She actually gave me 6 months (I'm not going to do 6 months without going to a re but at least it's a start) I started taking it on day 5 of my period.  Well, I have thankfully not had any side effects yet. I was wondering what symptoms you may have experienced and on what day they started.... just want to prepare for the worst. Thanks so much!",t2_dr8r9,False,,0,False,Clomid experience (female),[],r/infertility,False,0,,0,,,False,t3_4a6soo,False,dark,1.0,,public,1,0,{},,d70f54ce-930e-11e4-8710-22000b26873e,False,[],,False,False,,{},,False,1,,False,self,False,,[],{},,True,,1457867441.0,text,0,,,text,self.infertility,False,"<!-- SC_OFF --><div class=""md""><p>So my doctor gave me clomid for this cycle! She actually gave me 6 months (I&#39;m not going to do 6 months without going to a re but at least it&#39;s a start) I started taking it on day 5 of my period.  Well, I have thankfully not had any side effects yet. I was wondering what symptoms you may have experienced and on what day they started.... just want to prepare for the worst. Thanks so much!</p>
</div><!-- SC_ON -->",,,,,True,True,False,False,False,[],[],False,False,False,False,29F |PCOS|IVF #2,[],False,,,,t5_2saej,,,,4a6soo,True,,MolinasMitt,,16,True,no_ads,False,[],False,dark,/r/infertility/comments/4a6soo/clomid_experience_female/,no_ads,False,https://www.reddit.com/r/infertility/comments/4a6soo/clomid_experience_female/,25375,1457838641.0,0,,False,False,{},,,,
8,2048,confidence,<praw.reddit.Reddit object at 0x7f2244aead90>,,infertility,"I finally got my medical records from the ob/gyn I was seeing last year. While going through my lab results from December, I noticed some abnormal values that weren't mentioned to me at the time.

MCV 92.8

MCH 34.6 (high)

MCHC 37.3 (high)

RDW 11.1 (low)

I had a brief moment of panic, remembering that abnormalities with Vitamin B12 and such can indicate MTHFR, but then Dr. Google showed that I had my values backwards and that this looks more like anemia. My question is, each of these values is only one or two points outside the ""normal"" range, so is this ""maybe a small deal,"" ""nothing to worry about,"" or ""yeah, that could be contributing to why I'm not getting pregnant""?

Also, from what I've read on the internet this afternoon, I'm getting conflicting forms of anemia, like if RDW is low, then it's iron-deficiency, but if MCH is high then it's not iron, it's hereditary or megaloblastic. 

We're saving to see an RE later this year, so I'll bring up these concerns then, but I just need something to quiet my brain down so I can sleep.",t2_99xuv,False,,0,False,Questions about anemia?,[],r/infertility,False,0,,0,,,False,t3_4a6nfe,False,dark,1.0,,public,1,0,{},,,False,[],,False,False,,{},,False,1,,False,self,False,,[],{},,True,,1457864738.0,text,0,,,text,self.infertility,False,"<!-- SC_OFF --><div class=""md""><p>I finally got my medical records from the ob/gyn I was seeing last year. While going through my lab results from December, I noticed some abnormal values that weren&#39;t mentioned to me at the time.</p>

<p>MCV 92.8</p>

<p>MCH 34.6 (high)</p>

<p>MCHC 37.3 (high)</p>

<p>RDW 11.1 (low)</p>

<p>I had a brief moment of panic, remembering that abnormalities with Vitamin B12 and such can indicate MTHFR, but then Dr. Google showed that I had my values backwards and that this looks more like anemia. My question is, each of these values is only one or two points outside the &quot;normal&quot; range, so is this &quot;maybe a small deal,&quot; &quot;nothing to worry about,&quot; or &quot;yeah, that could be contributing to why I&#39;m not getting pregnant&quot;?</p>

<p>Also, from what I&#39;ve read on the internet this afternoon, I&#39;m getting conflicting forms of anemia, like if RDW is low, then it&#39;s iron-deficiency, but if MCH is high then it&#39;s not iron, it&#39;s hereditary or megaloblastic. </p>

<p>We&#39;re saving to see an RE later this year, so I&#39;ll bring up these concerns then, but I just need something to quiet my brain down so I can sleep.</p>
</div><!-- SC_ON -->",,,,,True,True,False,False,False,[],[],False,False,False,False,"endo, ttc #1 since 2014",[],False,,,,t5_2saej,,,,4a6nfe,True,,lettuceeatcake,,3,True,no_ads,False,[],False,dark,/r/infertility/comments/4a6nfe/questions_about_anemia/,no_ads,False,https://www.reddit.com/r/infertility/comments/4a6nfe/questions_about_anemia/,25375,1457835938.0,0,,False,False,{},,,,
