80,2048,confidence,<praw.reddit.Reddit object at 0x7f2244aead90>,,infertility,"Hello all. I just found out I may have PCOS. This has been a complete surprise as I have
never had symptoms to even suggest I have this. I will be seeing a specialist at an IVF clinic in a couple of weeks. I am very new to this so I'm going in blind. My husband and I have been TTC for almost a year. What questions should I be asking this doctor and what should I expect?

As I have recently found out about having PCOS, I am very sensitive to the ""why don't you have kids?"" Question. I will be attending a cousins wedding next month and all my nosey opinionated family I have not seen in a couple of years will be there. What is the best way to answer this intrusive question? I would like to hear of some of your experiences.",t2_j5vvk,False,,0,False,The dreaded question.,[],r/infertility,False,0,,0,,,False,t3_49igmh,False,dark,1.0,,public,5,0,{},,,False,[],,False,False,,{},,False,5,,False,self,False,,[],{},,True,,1457472293.0,text,0,,,text,self.infertility,False,"<!-- SC_OFF --><div class=""md""><p>Hello all. I just found out I may have PCOS. This has been a complete surprise as I have
never had symptoms to even suggest I have this. I will be seeing a specialist at an IVF clinic in a couple of weeks. I am very new to this so I&#39;m going in blind. My husband and I have been TTC for almost a year. What questions should I be asking this doctor and what should I expect?</p>

<p>As I have recently found out about having PCOS, I am very sensitive to the &quot;why don&#39;t you have kids?&quot; Question. I will be attending a cousins wedding next month and all my nosey opinionated family I have not seen in a couple of years will be there. What is the best way to answer this intrusive question? I would like to hear of some of your experiences.</p>
</div><!-- SC_ON -->",,,,,True,False,False,False,False,[],[],False,False,False,False,,[],False,,,,t5_2saej,,,,49igmh,True,,PanicPicnic,,13,True,no_ads,False,[],False,,/r/infertility/comments/49igmh/the_dreaded_question/,no_ads,False,https://www.reddit.com/r/infertility/comments/49igmh/the_dreaded_question/,25375,1457443493.0,0,,False,False,{},,,,
81,2048,confidence,<praw.reddit.Reddit object at 0x7f2244aead90>,,infertility,"Use this thread to share anything not necessarily related to infertility. Rant or rave, bitch, moan, share something funny, anything goes!",t2_6l4z3,False,,0,False,Tuesday Off Topic Thread,[],r/infertility,False,0,,0,,,False,t3_49hule,False,dark,1.0,,public,2,0,{},,,False,[],,False,False,,{},,False,2,,True,self,False,,[],{},,True,,1457460129.0,text,0,,,text,self.infertility,False,"<!-- SC_OFF --><div class=""md""><p>Use this thread to share anything not necessarily related to infertility. Rant or rave, bitch, moan, share something funny, anything goes!</p>
</div><!-- SC_ON -->",,,,,True,False,False,False,False,[],[],False,False,False,False,,[],False,,,moderator,t5_2saej,,,,49hule,True,,AutoModerator,,138,False,no_ads,False,[],False,,/r/infertility/comments/49hule/tuesday_off_topic_thread/,no_ads,False,https://www.reddit.com/r/infertility/comments/49hule/tuesday_off_topic_thread/,25375,1457431329.0,0,,False,False,{},,,,
82,2048,confidence,<praw.reddit.Reddit object at 0x7f2244aead90>,,infertility,[removed],t2_sn6ev,False,,0,False,Fertility Treatment Prices Worldwide,[],r/infertility,False,0,,0,,,False,t3_49hu5x,False,dark,1.0,,public,1,0,{},,,False,[],,False,False,,{},,False,1,,False,default,False,,[],{},,True,,1457459840.0,text,0,,,text,self.infertility,False,"<!-- SC_OFF --><div class=""md""><p>[removed]</p>
</div><!-- SC_ON -->",,,,,True,True,False,False,False,[],[],False,False,False,False,,[],False,,,,t5_2saej,,,,49hu5x,False,,Medicaleads,,0,True,no_ads,False,[],False,,/r/infertility/comments/49hu5x/fertility_treatment_prices_worldwide/,no_ads,False,https://www.reddit.com/r/infertility/comments/49hu5x/fertility_treatment_prices_worldwide/,25375,1457431040.0,0,,False,False,{},,,,
83,2048,confidence,<praw.reddit.Reddit object at 0x7f2244aead90>,,infertility,"Hi so im Hellopandaemma and ive been trying for two years to get pregnant and stay pregnant. I have had two mmc which were only discovered at the 12 weeks scans and the last one which was Feb 2015 really screwed me up in that the removal of tissue is the worst thing to ever happen and really traumatised me.
Since then there has been nada I think my body just gave up. My GP has been fantastic got me in touch with the gynaecologist back in November who had a look at me and told me that everything looked good and if I wasn't pregnant by February 2016 she would refer to infertility specialists. So I have my first appointment 30th March.

Partner has had a SA done and everything came back good for him. I'm getting my 21 day progesterone done tomorrow.

I'm scared it will never happen but I'm also glad that living in  the UK I don't have the high costs that come with having to do this and hopeful that I will get there soon     ",t2_d69cl,False,,0,False,Didn't think I would be part of this club,[],r/infertility,False,0,,0,,,False,t3_49hmcv,False,dark,1.0,,public,1,0,{},,,False,[],,False,False,,{},,False,1,,False,self,False,,[],{},,True,,1457455158.0,text,0,,,text,self.infertility,False,"<!-- SC_OFF --><div class=""md""><p>Hi so im Hellopandaemma and ive been trying for two years to get pregnant and stay pregnant. I have had two mmc which were only discovered at the 12 weeks scans and the last one which was Feb 2015 really screwed me up in that the removal of tissue is the worst thing to ever happen and really traumatised me.
Since then there has been nada I think my body just gave up. My GP has been fantastic got me in touch with the gynaecologist back in November who had a look at me and told me that everything looked good and if I wasn&#39;t pregnant by February 2016 she would refer to infertility specialists. So I have my first appointment 30th March.</p>

<p>Partner has had a SA done and everything came back good for him. I&#39;m getting my 21 day progesterone done tomorrow.</p>

<p>I&#39;m scared it will never happen but I&#39;m also glad that living in  the UK I don&#39;t have the high costs that come with having to do this and hopeful that I will get there soon     </p>
</div><!-- SC_ON -->",,,,,True,True,False,False,False,[],[],False,False,False,False,,[],False,,,,t5_2saej,,,,49hmcv,True,,Hellopandaemma,,6,True,no_ads,False,[],False,,/r/infertility/comments/49hmcv/didnt_think_i_would_be_part_of_this_club/,no_ads,False,https://www.reddit.com/r/infertility/comments/49hmcv/didnt_think_i_would_be_part_of_this_club/,25375,1457426358.0,0,,False,False,{},,,,
84,2048,confidence,<praw.reddit.Reddit object at 0x7f2244aead90>,,infertility,"I feel like such a liar or a faker most of my life when I'm around others. The reality is that 80% of the time I'm not ok, but I don't feel like I can just say that to anyone because it leads to questions and awkward conversation.

I know I'm socially withdrawing because it's too hard to feel so fake, and I know withdrawing won't help as I end up just feeling lonely, but I feel lonely in a group of people with all this rubbish anyways.

I just feel like it's a lose lose situation. I used to have real life infertility friends where I could be real but FML I am the last of the 5 without kids now so that's fun. ",t2_bch9f,False,,0,False,How do you remain authentic and yet keep it together in front of others?,[],r/infertility,False,0,,0,,,False,t3_49grg0,False,dark,1.0,,public,3,0,{},,,False,[],,False,False,,{},,False,3,,False,self,False,,[],{},,True,,1457440403.0,text,0,,,text,self.infertility,False,"<!-- SC_OFF --><div class=""md""><p>I feel like such a liar or a faker most of my life when I&#39;m around others. The reality is that 80% of the time I&#39;m not ok, but I don&#39;t feel like I can just say that to anyone because it leads to questions and awkward conversation.</p>

<p>I know I&#39;m socially withdrawing because it&#39;s too hard to feel so fake, and I know withdrawing won&#39;t help as I end up just feeling lonely, but I feel lonely in a group of people with all this rubbish anyways.</p>

<p>I just feel like it&#39;s a lose lose situation. I used to have real life infertility friends where I could be real but FML I am the last of the 5 without kids now so that&#39;s fun. </p>
</div><!-- SC_ON -->",,,,,True,False,False,False,False,[],[],False,False,False,False,,[],False,,,,t5_2saej,,,,49grg0,True,,pinksultana,,9,True,no_ads,False,[],False,,/r/infertility/comments/49grg0/how_do_you_remain_authentic_and_yet_keep_it/,no_ads,False,https://www.reddit.com/r/infertility/comments/49grg0/how_do_you_remain_authentic_and_yet_keep_it/,25375,1457411603.0,0,,False,False,{},,,,
85,2048,confidence,<praw.reddit.Reddit object at 0x7f2244aead90>,,infertility,"We've been TTC for 18 months and are set to start our first round of IUI with clomid.  We're previously done 1 round of IUI without clomid (RE from old city... don't even get me started on how pointless that was).  New RE says from the day I start meds I can't exercise ... at all.  The only thing they'll let me do is walk on a treadmill with no incline.  Exercise ban ends either when there's a neg test or if positive then when they detect a fetal heartbeat.  Ummm... what?  Has anyone else experienced this with their REs? What's the logic? I feel like I'd be more understanding if I just knew WHY I can't exercise.  Help?  

Follow Up: Alright so went in for my baseline ultrasound today and asked the tech.  Here's what she said: 1) we want you to avoid torsion and 2) there's a possibility that you could have an ectopic pregnancy.  hmmm I may just have a brief discussion with the physician husband tonight and figure out if we can come up with something reasonable.  My personal opinion is that they're trying to be as conservative as possible and do whatever they can to make my uterus as friendly and receptive as possible. ",t2_w6t5y,False,,0,False,RE Says No Exercise At All?,[],r/infertility,False,0,,0,,,False,t3_49gjog,False,dark,1.0,,public,1,0,{},,,False,[],,False,False,,{},,False,1,,False,self,1457464399.0,,[],{},,True,,1457437325.0,text,0,,,text,self.infertility,False,"<!-- SC_OFF --><div class=""md""><p>We&#39;ve been TTC for 18 months and are set to start our first round of IUI with clomid.  We&#39;re previously done 1 round of IUI without clomid (RE from old city... don&#39;t even get me started on how pointless that was).  New RE says from the day I start meds I can&#39;t exercise ... at all.  The only thing they&#39;ll let me do is walk on a treadmill with no incline.  Exercise ban ends either when there&#39;s a neg test or if positive then when they detect a fetal heartbeat.  Ummm... what?  Has anyone else experienced this with their REs? What&#39;s the logic? I feel like I&#39;d be more understanding if I just knew WHY I can&#39;t exercise.  Help?  </p>

<p>Follow Up: Alright so went in for my baseline ultrasound today and asked the tech.  Here&#39;s what she said: 1) we want you to avoid torsion and 2) there&#39;s a possibility that you could have an ectopic pregnancy.  hmmm I may just have a brief discussion with the physician husband tonight and figure out if we can come up with something reasonable.  My personal opinion is that they&#39;re trying to be as conservative as possible and do whatever they can to make my uterus as friendly and receptive as possible. </p>
</div><!-- SC_ON -->",,,,,True,True,False,False,False,[],[],False,False,False,False,36 | unexplained | TTC 2 years | 6 IUIs | starting IVF #1,[],False,,,,t5_2saej,,,,49gjog,True,,lusterbee,,15,True,no_ads,False,[],False,dark,/r/infertility/comments/49gjog/re_says_no_exercise_at_all/,no_ads,False,https://www.reddit.com/r/infertility/comments/49gjog/re_says_no_exercise_at_all/,25375,1457408525.0,0,,False,False,{},,,,
86,2048,confidence,<praw.reddit.Reddit object at 0x7f2244aead90>,,infertility,[deleted],,False,,0,False,Possible early menopause (30F),[],r/infertility,False,0,,0,,,False,t3_49g1r7,False,dark,1.0,,public,1,0,{},,,False,[],,False,False,,{},,False,1,,,default,False,,,{},,True,,1457430259.0,text,0,,,,self.infertility,False,"<!-- SC_OFF --><div class=""md""><p>[deleted]</p>
</div><!-- SC_ON -->",,,,,True,True,False,False,False,[],[],False,False,False,False,,[],False,,,,t5_2saej,,,,49g1r7,False,,,,6,True,no_ads,False,[],,dark,/r/infertility/comments/49g1r7/possible_early_menopause_30f/,no_ads,False,https://www.reddit.com/r/infertility/comments/49g1r7/possible_early_menopause_30f/,25375,1457401459.0,0,,False,False,{},,,,
87,2048,confidence,<praw.reddit.Reddit object at 0x7f2244aead90>,,infertility,"A friend of mine with severe endo posted this article on facebook. I shared it to my wall as a sort of ""coming out""...

What do you guys think?

[Tired of being sensitive to my infertile friend](https://yetanotherbitterinfertile.wordpress.com/2013/05/16/tired-of-being-sensitive-to-my-infertile-friend/)",t2_6f5un,False,,0,False,"""Tired of being sensitive to my infertile friend...""",[],r/infertility,False,0,,0,,,False,t3_49g0zx,False,dark,0.95,,public,40,0,{},,,False,[],,False,False,,{},,False,40,,False,self,False,,[],{},,True,,1457429963.0,text,0,,,text,self.infertility,False,"<!-- SC_OFF --><div class=""md""><p>A friend of mine with severe endo posted this article on facebook. I shared it to my wall as a sort of &quot;coming out&quot;...</p>

<p>What do you guys think?</p>

<p><a href=""https://yetanotherbitterinfertile.wordpress.com/2013/05/16/tired-of-being-sensitive-to-my-infertile-friend/"">Tired of being sensitive to my infertile friend</a></p>
</div><!-- SC_ON -->",,,,,True,False,False,False,False,[],[],False,False,False,False,"28F, PCOS",[],False,,,,t5_2saej,,,,49g0zx,True,,jacknstephen,,15,True,no_ads,False,[],False,dark,/r/infertility/comments/49g0zx/tired_of_being_sensitive_to_my_infertile_friend/,no_ads,False,https://www.reddit.com/r/infertility/comments/49g0zx/tired_of_being_sensitive_to_my_infertile_friend/,25375,1457401163.0,0,,False,False,{},self,"{'images': [{'source': {'url': 'https://external-preview.redd.it/cUDVmg7mPJz5lsx6IQhkynEL4OpyGLzi5_jFPp01oW0.jpg?auto=webp&s=a41e880b22f1899d368a4748e35998997d15798d', 'width': 200, 'height': 200}, 'resolutions': [{'url': 'https://external-preview.redd.it/cUDVmg7mPJz5lsx6IQhkynEL4OpyGLzi5_jFPp01oW0.jpg?width=108&crop=smart&auto=webp&s=64cee231d9e7e53938bcbd7c85ae602298fc9a44', 'width': 108, 'height': 108}], 'variants': {}, 'id': 'rErOQhabtTVAGi4DxJ_4yOFXrK_HFU23_-P3OtN0DOw'}], 'enabled': False}",,
88,2048,confidence,<praw.reddit.Reddit object at 0x7f2244aead90>,,infertility,"Hi everyone!

Husband and I have just passed the two year mark on TTC. In that time, we've had one pregnancy that ended in miscarriage at 7 weeks, and a whole lot of nothing else. I am, officially, SO FUCKING SICK OF TRYING TO GET PREGNANT. 

After a second SA last October, Husband has been on Clomid to get him up from low/low-normal to (hopefully!) normal. Even with the Clomid, timed intercourse wasn't doing it for us. The RE said that we were great candidates for IUI, BUT I had to lose over 60 pounds first! AND I ACTUALLY DID IT!!!11!ONE!!

And now we are preparing for our first ever IUI! Tonight, I take my first Letrozole and next Monday is our follicular ultrasound. I'm a little scared of the Letrozole side effects, so please tell me what to expect.

Husband and I agreed to (up to) three IUIs before we give up on TTC and adopt. Here's to being done trying to get pregnant, one way or another! ",t2_ja06e,False,,0,False,"Introduction: I guess I ""officially qualify"" now *Trigger-Loss*",[],r/infertility,False,0,,0,,,False,t3_49fwdy,False,dark,0.92,,public,10,0,{},,,False,[],,False,False,,{},,False,10,,False,self,False,,[],{},,True,,1457428154.0,text,0,,,text,self.infertility,False,"<!-- SC_OFF --><div class=""md""><p>Hi everyone!</p>

<p>Husband and I have just passed the two year mark on TTC. In that time, we&#39;ve had one pregnancy that ended in miscarriage at 7 weeks, and a whole lot of nothing else. I am, officially, SO FUCKING SICK OF TRYING TO GET PREGNANT. </p>

<p>After a second SA last October, Husband has been on Clomid to get him up from low/low-normal to (hopefully!) normal. Even with the Clomid, timed intercourse wasn&#39;t doing it for us. The RE said that we were great candidates for IUI, BUT I had to lose over 60 pounds first! AND I ACTUALLY DID IT!!!11!ONE!!</p>

<p>And now we are preparing for our first ever IUI! Tonight, I take my first Letrozole and next Monday is our follicular ultrasound. I&#39;m a little scared of the Letrozole side effects, so please tell me what to expect.</p>

<p>Husband and I agreed to (up to) three IUIs before we give up on TTC and adopt. Here&#39;s to being done trying to get pregnant, one way or another! </p>
</div><!-- SC_ON -->",,,,,True,False,False,False,False,[],[],False,False,False,False,Trying since February 2014. Two losses,[],False,,,,t5_2saej,,,,49fwdy,True,,GaveTheMouseACookie,,52,True,no_ads,False,[],False,dark,/r/infertility/comments/49fwdy/introduction_i_guess_i_officially_qualify_now/,no_ads,False,https://www.reddit.com/r/infertility/comments/49fwdy/introduction_i_guess_i_officially_qualify_now/,25375,1457399354.0,0,,False,False,{},,,,
89,2048,confidence,<praw.reddit.Reddit object at 0x7f2244aead90>,,infertility,[deleted],,False,,0,False,"Oh crikey, one more thing to worry about: Conflicts of interest...",[],r/infertility,False,0,,0,,,False,t3_49fn8t,False,dark,1.0,,public,1,0,{},,,False,[],,False,False,,{},,False,1,,,default,1532115141.0,,,{},,True,,1457424696.0,text,0,,,,self.infertility,False,"<!-- SC_OFF --><div class=""md""><p>[deleted]</p>
</div><!-- SC_ON -->",,,,,True,True,False,False,False,[],[],False,False,False,False,,[],False,,,,t5_2saej,,,,49fn8t,False,,,,10,True,no_ads,False,[],,dark,/r/infertility/comments/49fn8t/oh_crikey_one_more_thing_to_worry_about_conflicts/,no_ads,False,https://www.reddit.com/r/infertility/comments/49fn8t/oh_crikey_one_more_thing_to_worry_about_conflicts/,25375,1457395896.0,0,,False,False,{},,,,
90,2048,confidence,<praw.reddit.Reddit object at 0x7f2244aead90>,,infertility,"Can someone please explain to me what a trigger shot is and what it does? I mean, I know it's HCG but I can't figure out why it's used or what it does, despite googling it. Maybe I'm tired/too frustrated that this cycle didn't work and just can't understand what google says right now, I don't know. 

Is this something that would benefit me? Should I ask for it on my next cycle? Thanks. 

Background: 

Trying since July 2014. Pcos. Do not ovulate on my own. Seeing a RE. Sperms are ok, only a little low on the motility but ruled a non-issue by a urologist and our RE. Pretty sure I have low progesterone. [Chart if it matters](http://www.fertilityfriend.com/home/5384b2).

Letrozole cycle 1 was 5mg, positive opk on cd19, temp rise cd20, positive hpt cd30, ended in a chemical on cd36. 

Letrozole cycle 2 was 5mg. No positive opk, no temp rise, period came on it's own cd37. Not sure what was up.

Letrozole cycle 3 was 7.5mg, positive opk cd17, temp rise cd19, currently spotting waiting for period to come. ",t2_nb3cq,False,,0,False,ELI5: Trigger shots,[],r/infertility,False,0,,0,,,False,t3_49fbn8,False,dark,1.0,,public,2,0,{},,,False,[],,False,False,,{},,False,2,,False,self,False,,[],{},,True,,1457420273.0,text,0,,,text,self.infertility,False,"<!-- SC_OFF --><div class=""md""><p>Can someone please explain to me what a trigger shot is and what it does? I mean, I know it&#39;s HCG but I can&#39;t figure out why it&#39;s used or what it does, despite googling it. Maybe I&#39;m tired/too frustrated that this cycle didn&#39;t work and just can&#39;t understand what google says right now, I don&#39;t know. </p>

<p>Is this something that would benefit me? Should I ask for it on my next cycle? Thanks. </p>

<p>Background: </p>

<p>Trying since July 2014. Pcos. Do not ovulate on my own. Seeing a RE. Sperms are ok, only a little low on the motility but ruled a non-issue by a urologist and our RE. Pretty sure I have low progesterone. <a href=""http://www.fertilityfriend.com/home/5384b2"">Chart if it matters</a>.</p>

<p>Letrozole cycle 1 was 5mg, positive opk on cd19, temp rise cd20, positive hpt cd30, ended in a chemical on cd36. </p>

<p>Letrozole cycle 2 was 5mg. No positive opk, no temp rise, period came on it&#39;s own cd37. Not sure what was up.</p>

<p>Letrozole cycle 3 was 7.5mg, positive opk cd17, temp rise cd19, currently spotting waiting for period to come. </p>
</div><!-- SC_ON -->",,,,,True,False,False,False,False,[],[],False,False,False,False,TTC#1 since July'14. PCOS. 1 CP. Letrozole Cycle #3,[],False,,,,t5_2saej,,,,49fbn8,True,,givemeteapls,,22,True,no_ads,False,[],False,dark,/r/infertility/comments/49fbn8/eli5_trigger_shots/,no_ads,False,https://www.reddit.com/r/infertility/comments/49fbn8/eli5_trigger_shots/,25375,1457391473.0,0,,False,False,{},self,"{'images': [{'source': {'url': 'https://external-preview.redd.it/Zba10qcGb84SCGd-BBb944jE-WHSP1pfZRYovNOp4kE.jpg?auto=webp&s=ced9b69c8d2e76a5da354123c46c786a6500dad7', 'width': 704, 'height': 571}, 'resolutions': [{'url': 'https://external-preview.redd.it/Zba10qcGb84SCGd-BBb944jE-WHSP1pfZRYovNOp4kE.jpg?width=108&crop=smart&auto=webp&s=358b88bbea01daece17b443cb843a7ceea826fee', 'width': 108, 'height': 87}, {'url': 'https://external-preview.redd.it/Zba10qcGb84SCGd-BBb944jE-WHSP1pfZRYovNOp4kE.jpg?width=216&crop=smart&auto=webp&s=5cff472c357b2c3fafb007ea6188a4d8db4ea794', 'width': 216, 'height': 175}, {'url': 'https://external-preview.redd.it/Zba10qcGb84SCGd-BBb944jE-WHSP1pfZRYovNOp4kE.jpg?width=320&crop=smart&auto=webp&s=64b14e251d1efb3ac6d0381ca27c9ee5968789e2', 'width': 320, 'height': 259}, {'url': 'https://external-preview.redd.it/Zba10qcGb84SCGd-BBb944jE-WHSP1pfZRYovNOp4kE.jpg?width=640&crop=smart&auto=webp&s=0ade1341cff9cf98984ca9333008bf464e94c1eb', 'width': 640, 'height': 519}], 'variants': {}, 'id': 'gt9WGp48DoBuU1eJ_9GteVrc279IOdBM66Dq50ybn6I'}], 'enabled': False}",,
91,2048,confidence,<praw.reddit.Reddit object at 0x7f2244aead90>,,infertility,"So we saw the RE today to go over our tests we had this cycle and go over the plan going forward. Husband has low morphology, but otherwise good numbers. I have high-ish FSH (13) and he told me my AMH came back at 0.954, with AFC at 13 this cycle. He thinks there's no concern about DOR with these numbers and we've got plenty of time. 

Does anyone else have something similar? What did your RE think? I'm still more concerned than he is.

So the plan is to do monitored natural cycle with TI until my insurance coverage for the new job, which thankfully covers infertilty treatments (thanks IL!), which will be 2 1/2 months. He wants to do no stims, but trigger shots and then supplement with progesterone. If that doesn't work we'll move to clomid + iui when insurance kicks in, then injectable + iui and then talk ivf. We'll have a couple of rounds of each to test it out. The whole thing seems like forever long and waiting. I'm not expecting anything to be different (positive tests) until we start on iui, so we're just waiting...",t2_vfhv2,False,,0,False,OK Here's the plan,[],r/infertility,False,0,,0,,,False,t3_49f6gg,False,dark,1.0,,public,2,0,{},,d70f54ce-930e-11e4-8710-22000b26873e,False,[],,False,False,,{},,False,2,,False,self,False,,[],{},,True,,1457418452.0,text,0,,,text,self.infertility,False,"<!-- SC_OFF --><div class=""md""><p>So we saw the RE today to go over our tests we had this cycle and go over the plan going forward. Husband has low morphology, but otherwise good numbers. I have high-ish FSH (13) and he told me my AMH came back at 0.954, with AFC at 13 this cycle. He thinks there&#39;s no concern about DOR with these numbers and we&#39;ve got plenty of time. </p>

<p>Does anyone else have something similar? What did your RE think? I&#39;m still more concerned than he is.</p>

<p>So the plan is to do monitored natural cycle with TI until my insurance coverage for the new job, which thankfully covers infertilty treatments (thanks IL!), which will be 2 1/2 months. He wants to do no stims, but trigger shots and then supplement with progesterone. If that doesn&#39;t work we&#39;ll move to clomid + iui when insurance kicks in, then injectable + iui and then talk ivf. We&#39;ll have a couple of rounds of each to test it out. The whole thing seems like forever long and waiting. I&#39;m not expecting anything to be different (positive tests) until we start on iui, so we&#39;re just waiting...</p>
</div><!-- SC_ON -->",,,,,True,False,False,False,False,[],[],False,False,False,False,"36F|DOR|failed IUI, failed IVF, moving to DE",[],False,,,,t5_2saej,,,,49f6gg,True,,JessieBooBoo,,1,True,no_ads,False,[],False,dark,/r/infertility/comments/49f6gg/ok_heres_the_plan/,no_ads,False,https://www.reddit.com/r/infertility/comments/49f6gg/ok_heres_the_plan/,25375,1457389652.0,0,,False,False,{},,,,
92,2048,confidence,<praw.reddit.Reddit object at 0x7f2244aead90>,,infertility,[removed],t2_w8hkx,False,,0,False,"[Advice] Friend is struggling with infertility, I'm struggling with the friendship",[],r/infertility,False,0,,0,,,False,t3_49etgh,False,dark,1.0,,public,1,0,{},,,False,[],,False,False,,{},,False,1,,False,default,False,,[],{},,True,,1457413882.0,text,0,,,text,self.infertility,False,"<!-- SC_OFF --><div class=""md""><p>[removed]</p>
</div><!-- SC_ON -->",,,,,True,True,False,False,False,[],[],False,False,False,False,,[],False,,,,t5_2saej,,,,49etgh,False,,friend_of_sad,,1,True,no_ads,False,[],False,,/r/infertility/comments/49etgh/advice_friend_is_struggling_with_infertility_im/,no_ads,False,https://www.reddit.com/r/infertility/comments/49etgh/advice_friend_is_struggling_with_infertility_im/,25375,1457385082.0,0,,False,False,{},,,,
