227,2048,confidence,<praw.reddit.Reddit object at 0x7f2244aead90>,,infertility,"I havent had a period since November, when i had my polypectomy. I talked to my RE two weeks ago, he gave me some provera to jump start my period. I didnt take a pregnancy test, because it wasnt possible to conceive naturally. 

My flow started on Saturday afternoon, not slow like normal, it was gushing. Literally, i put in a tampon and it completely ignored it, flooding through overnight pads in no time. This continued for a few days, and wednesday night, i passed about 15 large blood clots (bigger than my thumb) in a row, and then i wiped before putting in a new tampon, and there was this little lump sitting there. Clear-ish, with blood in it and what looked like veins. I didnt think anything of it. I flushed it.

Today i told my mom about it and she said it sounded like a miscarriage, she'd had four of them. My sister agreed, so i went to my doctor and they confirmed it. I lost our first baby, before i even knew i was pregnant. I cant stop crying. I cant stop wondering what caused it, if it was the pills, or something i ate or drank, or if it was just a spontaneous miscarriage for no reason.

Im sorry to be a downer, but this really sucks. I cant even describe the pain. We've been trying for 19 months. I was 5 weeks, maybe 6, they're not sure. Apparently i ovulated on my own, but really late so since i wasnt tracking, there's no real way to know. My heart hurts

Ive felt like a failure for months. I felt broken, because i couldnt provide a family for my husband. I didnt know it was possible to feel like even more of a failure. But i do. Im just numb, in shock. ",t2_o2riz,False,,0,False,"Im out, before i even knew i was in (Trigger)",[],r/infertility,False,0,,0,,,False,t3_47rxmy,False,dark,1.0,,public,13,0,{},,d70f54ce-930e-11e4-8710-22000b26873e,False,[],,False,False,,{},,False,13,,False,self,1456527547.0,,[],{},,True,,1456555947.0,text,0,,,text,self.infertility,False,"<!-- SC_OFF --><div class=""md""><p>I havent had a period since November, when i had my polypectomy. I talked to my RE two weeks ago, he gave me some provera to jump start my period. I didnt take a pregnancy test, because it wasnt possible to conceive naturally. </p>

<p>My flow started on Saturday afternoon, not slow like normal, it was gushing. Literally, i put in a tampon and it completely ignored it, flooding through overnight pads in no time. This continued for a few days, and wednesday night, i passed about 15 large blood clots (bigger than my thumb) in a row, and then i wiped before putting in a new tampon, and there was this little lump sitting there. Clear-ish, with blood in it and what looked like veins. I didnt think anything of it. I flushed it.</p>

<p>Today i told my mom about it and she said it sounded like a miscarriage, she&#39;d had four of them. My sister agreed, so i went to my doctor and they confirmed it. I lost our first baby, before i even knew i was pregnant. I cant stop crying. I cant stop wondering what caused it, if it was the pills, or something i ate or drank, or if it was just a spontaneous miscarriage for no reason.</p>

<p>Im sorry to be a downer, but this really sucks. I cant even describe the pain. We&#39;ve been trying for 19 months. I was 5 weeks, maybe 6, they&#39;re not sure. Apparently i ovulated on my own, but really late so since i wasnt tracking, there&#39;s no real way to know. My heart hurts</p>

<p>Ive felt like a failure for months. I felt broken, because i couldnt provide a family for my husband. I didnt know it was possible to feel like even more of a failure. But i do. Im just numb, in shock. </p>
</div><!-- SC_ON -->",,,,,True,False,False,False,False,[],[],False,False,False,False,"30F, TTC 5.5 years, 1 MC, 1 Chemical, PCOS/MTHFR/MFI",[],False,,,,t5_2saej,,,,47rxmy,True,,anonymous2278,,15,True,no_ads,False,[],False,dark,/r/infertility/comments/47rxmy/im_out_before_i_even_knew_i_was_in_trigger/,no_ads,False,https://www.reddit.com/r/infertility/comments/47rxmy/im_out_before_i_even_knew_i_was_in_trigger/,25375,1456527147.0,0,,False,False,{},,,,
228,2048,confidence,<praw.reddit.Reddit object at 0x7f2244aead90>,,infertility,"Hi guys,

For those of you who have taken lovenox (or clexane) when in your transfer cycle did you start it?

I am heterogeneous for PAI-1, and my RE said if I wanted to, I could start lovenox if I ever get a positive beta again (he said that he wasn't sure it would do me any good, or was necessary, but I was pushing him to suggest a change to my protocol out of desperation and he said he was okay with lovenox mostly because it wouldn't hurt and might help me psychologically and theoretically could actually help prevent miscarriage).

Meanwhile, the miscarriage specialist I am consulting with is testing my ANA this weekend, and if it is abnormal, he wants me to start Lovenox the day of my transfer (Wednesday).

So, conflicting opinions as when to start. Others who have taken it, can I ask when you took it and what, if anything, it was prescribed for? Could Lovenox negatively impact implantation as far as anyone is aware? ",t2_hmmgi,False,,0,False,Lovenox question for those who have taken it,[],r/infertility,False,0,,0,,,False,t3_47rxjk,False,dark,0.86,,public,5,0,{},,,False,[],,False,False,,{},,False,5,,False,self,False,,[],{},,True,,1456555922.0,text,0,,,text,self.infertility,False,"<!-- SC_OFF --><div class=""md""><p>Hi guys,</p>

<p>For those of you who have taken lovenox (or clexane) when in your transfer cycle did you start it?</p>

<p>I am heterogeneous for PAI-1, and my RE said if I wanted to, I could start lovenox if I ever get a positive beta again (he said that he wasn&#39;t sure it would do me any good, or was necessary, but I was pushing him to suggest a change to my protocol out of desperation and he said he was okay with lovenox mostly because it wouldn&#39;t hurt and might help me psychologically and theoretically could actually help prevent miscarriage).</p>

<p>Meanwhile, the miscarriage specialist I am consulting with is testing my ANA this weekend, and if it is abnormal, he wants me to start Lovenox the day of my transfer (Wednesday).</p>

<p>So, conflicting opinions as when to start. Others who have taken it, can I ask when you took it and what, if anything, it was prescribed for? Could Lovenox negatively impact implantation as far as anyone is aware? </p>
</div><!-- SC_ON -->",,,,,True,False,False,False,False,[],[],False,False,False,False,,[],False,,,,t5_2saej,,,,47rxjk,True,,amelioratia,,9,True,no_ads,False,[],False,,/r/infertility/comments/47rxjk/lovenox_question_for_those_who_have_taken_it/,no_ads,False,https://www.reddit.com/r/infertility/comments/47rxjk/lovenox_question_for_those_who_have_taken_it/,25375,1456527122.0,0,,False,False,{},,,,
229,2048,confidence,<praw.reddit.Reddit object at 0x7f2244aead90>,,infertility,What was good this week? What was bad?,t2_6l4z3,False,,0,False,Pros and Cons,[],r/infertility,False,0,,0,,,False,t3_47rneb,False,dark,0.67,,public,1,0,{},,,False,[],,False,False,,{},,False,1,,True,self,False,,[],{},,True,,1456552935.0,text,0,,,text,self.infertility,False,"<!-- SC_OFF --><div class=""md""><p>What was good this week? What was bad?</p>
</div><!-- SC_ON -->",,,,,True,True,False,False,False,[],[],False,False,False,False,,[],False,,,moderator,t5_2saej,,,,47rneb,True,,AutoModerator,,5,False,no_ads,False,[],False,,/r/infertility/comments/47rneb/pros_and_cons/,no_ads,False,https://www.reddit.com/r/infertility/comments/47rneb/pros_and_cons/,25375,1456524135.0,0,,False,False,{},,,,
230,2048,confidence,<praw.reddit.Reddit object at 0x7f2244aead90>,,infertility,"I allowed myself to get excited and hopeful and I shouldn't have. My period was supposed to come Wednesday and as of lunchtime today I didn't have it so I thought there could be a chance that I might be pregnant. Stupid hope. I just got my period. So, once again, not pregnant. My RE said if this second round of IUI didn't work, he wants me to come in for a saline sonogram and assess my polyps and fibroids and see what our next steps should be. Instead, I just want to quit. I hate this so much. I hate everything now. I am just so angry and unhappy all the time.",t2_u8efl,False,,0,False,I want to quit,[],r/infertility,False,0,,0,,,False,t3_47rm42,False,dark,0.81,,public,3,0,{},,,False,[],,False,False,,{},,False,3,,False,self,False,,[],{},,True,,1456552550.0,text,0,,,text,self.infertility,False,"<!-- SC_OFF --><div class=""md""><p>I allowed myself to get excited and hopeful and I shouldn&#39;t have. My period was supposed to come Wednesday and as of lunchtime today I didn&#39;t have it so I thought there could be a chance that I might be pregnant. Stupid hope. I just got my period. So, once again, not pregnant. My RE said if this second round of IUI didn&#39;t work, he wants me to come in for a saline sonogram and assess my polyps and fibroids and see what our next steps should be. Instead, I just want to quit. I hate this so much. I hate everything now. I am just so angry and unhappy all the time.</p>
</div><!-- SC_ON -->",,,,,True,False,False,False,False,[],[],False,False,False,False,,[],False,,,,t5_2saej,,,,47rm42,True,,sugarflywithme,,12,True,no_ads,False,[],False,,/r/infertility/comments/47rm42/i_want_to_quit/,no_ads,False,https://www.reddit.com/r/infertility/comments/47rm42/i_want_to_quit/,25375,1456523750.0,0,,False,False,{},,,,
231,2048,confidence,<praw.reddit.Reddit object at 0x7f2244aead90>,,infertility,"Were all those cycles medicated?  My RE says no more that three medicated IUIs, but I hear so many women talking about being on their 5th or 6th cycle.  I'm just wondering how that works?  ",t2_rwya4,False,,0,False,Question for women who've done 5 or 6 IUI's,[],r/infertility,False,0,,0,,,False,t3_47rdkm,False,dark,1.0,,public,2,0,{},,,False,[],,False,False,,{},,False,2,,False,self,False,,[],{},,True,,1456550196.0,text,0,,,text,self.infertility,False,"<!-- SC_OFF --><div class=""md""><p>Were all those cycles medicated?  My RE says no more that three medicated IUIs, but I hear so many women talking about being on their 5th or 6th cycle.  I&#39;m just wondering how that works?  </p>
</div><!-- SC_ON -->",,,,,True,False,False,False,False,[],[],False,False,False,False,,[],False,,,,t5_2saej,,,,47rdkm,True,,pantone108,,13,True,no_ads,False,[],False,,/r/infertility/comments/47rdkm/question_for_women_whove_done_5_or_6_iuis/,no_ads,False,https://www.reddit.com/r/infertility/comments/47rdkm/question_for_women_whove_done_5_or_6_iuis/,25375,1456521396.0,0,,False,False,{},,,,
232,2048,confidence,<praw.reddit.Reddit object at 0x7f2244aead90>,,infertility,"For women like me (unexplained, over 35, ttc for 1.5 yrs), I know IUI has it's best chances in the first three rounds, or so my RE tells me.  I managed to keep it together through the first two failed cycles, I was disappointed, but I felt like it could still happen.  Now that I'm just about to start my 3rd IUI cycle, I find myself struggling to stay positive and terrified of another negative outcome.  If this cycle fails, then on to IVF, which has better odds, but can still fail.  I know this sounds weird, but I'm just so scared that if I can't turn my negative attitude around, then i'm ruining my chances.  I'd love to hear anyones else's thoughts on this.  

Some history: 
My first cycle was okay; 2 follicles, 20+ mill sperm count.  Everything else was perfect.  Fail.

Second cycle was even better; 4 follicles, double the sperm count, everything else perfect (again).  Fail.",t2_rwya4,False,,0,False,Starting IUI Cycle number 3 and terrified,[],r/infertility,False,0,,0,,,False,t3_47r9kz,False,dark,1.0,,public,3,0,{},,,False,[],,False,False,,{},,False,3,,False,self,False,,[],{},,True,,1456548891.0,text,0,,,text,self.infertility,False,"<!-- SC_OFF --><div class=""md""><p>For women like me (unexplained, over 35, ttc for 1.5 yrs), I know IUI has it&#39;s best chances in the first three rounds, or so my RE tells me.  I managed to keep it together through the first two failed cycles, I was disappointed, but I felt like it could still happen.  Now that I&#39;m just about to start my 3rd IUI cycle, I find myself struggling to stay positive and terrified of another negative outcome.  If this cycle fails, then on to IVF, which has better odds, but can still fail.  I know this sounds weird, but I&#39;m just so scared that if I can&#39;t turn my negative attitude around, then i&#39;m ruining my chances.  I&#39;d love to hear anyones else&#39;s thoughts on this.  </p>

<p>Some history: 
My first cycle was okay; 2 follicles, 20+ mill sperm count.  Everything else was perfect.  Fail.</p>

<p>Second cycle was even better; 4 follicles, double the sperm count, everything else perfect (again).  Fail.</p>
</div><!-- SC_ON -->",,,,,True,False,False,False,False,[],[],False,False,False,False,,[],False,,,,t5_2saej,,,,47r9kz,True,,pantone108,,4,True,no_ads,False,[],False,,/r/infertility/comments/47r9kz/starting_iui_cycle_number_3_and_terrified/,no_ads,False,https://www.reddit.com/r/infertility/comments/47r9kz/starting_iui_cycle_number_3_and_terrified/,25375,1456520091.0,0,,False,False,{},,,,
233,2048,confidence,<praw.reddit.Reddit object at 0x7f2244aead90>,,infertility,"A while ago this was a big news item when they announced that they would be seeking a volunteer for the first uterus transplant to be performed.  It was a bit controversial as the recipient could only use it for a limited amount of time and would need to be on anti rejection medication while attempting IVF.  

Today I got an e-mail notifying me of an update in this story.  (Thanks NY Times!)  The first ever uterus transplant has been performed in Celeveland OH.  

http://www.cnn.com/2016/02/26/health/first-uterus-transplant/
http://www.nytimes.com/2016/02/26/health/uterus-transplant-cleveland-clinic.html",t2_ni5qz,False,,0,False,1st uterus transplant has been completed,[],r/infertility,False,0,,0,,,False,t3_47qwbd,False,dark,1.0,,public,11,0,{},,d70f54ce-930e-11e4-8710-22000b26873e,False,[],,False,False,,{},,False,11,,True,self,False,,[],{},,True,,1456545062.0,text,0,,,text,self.infertility,False,"<!-- SC_OFF --><div class=""md""><p>A while ago this was a big news item when they announced that they would be seeking a volunteer for the first uterus transplant to be performed.  It was a bit controversial as the recipient could only use it for a limited amount of time and would need to be on anti rejection medication while attempting IVF.  </p>

<p>Today I got an e-mail notifying me of an update in this story.  (Thanks NY Times!)  The first ever uterus transplant has been performed in Celeveland OH.  </p>

<p><a href=""http://www.cnn.com/2016/02/26/health/first-uterus-transplant/"">http://www.cnn.com/2016/02/26/health/first-uterus-transplant/</a>
<a href=""http://www.nytimes.com/2016/02/26/health/uterus-transplant-cleveland-clinic.html"">http://www.nytimes.com/2016/02/26/health/uterus-transplant-cleveland-clinic.html</a></p>
</div><!-- SC_ON -->",,,,,True,False,False,False,False,[],[],False,False,False,False,36 yrs | POF | Lupus + MTS | 4 failed DIVF,[],False,,,,t5_2saej,,,,47qwbd,True,,Whisgo,,3,True,no_ads,False,[],False,dark,/r/infertility/comments/47qwbd/1st_uterus_transplant_has_been_completed/,no_ads,False,https://www.reddit.com/r/infertility/comments/47qwbd/1st_uterus_transplant_has_been_completed/,25375,1456516262.0,0,,False,False,{},self,"{'images': [{'source': {'url': 'https://external-preview.redd.it/llc5WEaQWOj3WgxiLNur3tSQUeXsejeRVLZf3F4o4zs.jpg?auto=webp&s=2f62f9da6f067f759339a7ca3e484a4ab9431b69', 'width': 460, 'height': 259}, 'resolutions': [{'url': 'https://external-preview.redd.it/llc5WEaQWOj3WgxiLNur3tSQUeXsejeRVLZf3F4o4zs.jpg?width=108&crop=smart&auto=webp&s=2ac8fa7534549e19af968f0bedcb168ad39d6a4c', 'width': 108, 'height': 60}, {'url': 'https://external-preview.redd.it/llc5WEaQWOj3WgxiLNur3tSQUeXsejeRVLZf3F4o4zs.jpg?width=216&crop=smart&auto=webp&s=7f9f6834b2df811ada2c847f8ae0a907c8154e5b', 'width': 216, 'height': 121}, {'url': 'https://external-preview.redd.it/llc5WEaQWOj3WgxiLNur3tSQUeXsejeRVLZf3F4o4zs.jpg?width=320&crop=smart&auto=webp&s=64fccc078fd8fc5800c0847652b06125d969c95b', 'width': 320, 'height': 180}], 'variants': {}, 'id': 'pKKIRqYYMZNWtyu4w0KWrH0Hdg3Wo3rBryi07Oz0-es'}], 'enabled': False}",,
234,2048,confidence,<praw.reddit.Reddit object at 0x7f2244aead90>,,infertility,"I'm new to Reddit. I've had varicocele surgery, but my varicocele is .. back. So, now I'm worried because the pain is starting to get worse again. Please help!",t2_vlpma,False,,0,False,Varicocele Help,[],r/infertility,False,0,,0,,,False,t3_47qnnd,False,dark,0.67,,public,1,0,{},,,False,[],,False,False,,{},,False,1,,False,self,False,,[],{},,True,,1456542666.0,text,0,,,text,self.infertility,True,"<!-- SC_OFF --><div class=""md""><p>I&#39;m new to Reddit. I&#39;ve had varicocele surgery, but my varicocele is .. back. So, now I&#39;m worried because the pain is starting to get worse again. Please help!</p>
</div><!-- SC_ON -->",,,,,True,True,False,False,False,[],[],False,False,False,False,,[],False,,,,t5_2saej,,,,47qnnd,True,,BABOON_GOD,,6,True,no_ads,False,[],False,,/r/infertility/comments/47qnnd/varicocele_help/,no_ads,False,https://www.reddit.com/r/infertility/comments/47qnnd/varicocele_help/,25375,1456513866.0,0,,False,False,{},,,,
235,2048,confidence,<praw.reddit.Reddit object at 0x7f2244aead90>,,infertility,"For a variety of reasons, I'd like to explore going on antidepressants.  I realize that it's a big no-no while trying to conceive but at this point, I'd rather feel good than have a baby.  Infertility is taking such a toll on me, I feel like I'll never lose enough weight for my RE to prescribe ovulation inducing drugs (which I realize is understandable so no lectures please).  Anyway, I'm having trouble coping and today especially I'm on the verge of tears. Therapy hasn't improved my situation and I would like to try something new like antidepressants.

Have any of you taken anti-depressants while ""trying?""  Thanks in advance.

**Edit: Thank you all for your replies.  I made an appointment for a little over two months from now to see a GP who can prescribe me antidepressants.  Unfortunately, that was the earliest appointment available but I'm calling frequently to see if there's been a cancellation and if I can get in earlier.**",t2_cid9f,False,,0,False,Antidepressants,[],r/infertility,False,0,,0,,,False,t3_47pydh,False,dark,1.0,,public,6,0,{},,d70f54ce-930e-11e4-8710-22000b26873e,False,[],,False,False,,{},,False,6,,False,self,1456526614.0,,[],{},,True,,1456535175.0,text,0,,,text,self.infertility,True,"<!-- SC_OFF --><div class=""md""><p>For a variety of reasons, I&#39;d like to explore going on antidepressants.  I realize that it&#39;s a big no-no while trying to conceive but at this point, I&#39;d rather feel good than have a baby.  Infertility is taking such a toll on me, I feel like I&#39;ll never lose enough weight for my RE to prescribe ovulation inducing drugs (which I realize is understandable so no lectures please).  Anyway, I&#39;m having trouble coping and today especially I&#39;m on the verge of tears. Therapy hasn&#39;t improved my situation and I would like to try something new like antidepressants.</p>

<p>Have any of you taken anti-depressants while &quot;trying?&quot;  Thanks in advance.</p>

<p><strong>Edit: Thank you all for your replies.  I made an appointment for a little over two months from now to see a GP who can prescribe me antidepressants.  Unfortunately, that was the earliest appointment available but I&#39;m calling frequently to see if there&#39;s been a cancellation and if I can get in earlier.</strong></p>
</div><!-- SC_ON -->",,,,,True,False,False,False,False,[],[],False,False,False,False,"31F, Severe PCOS (AMH is 40 ng/mL)",[],False,,,,t5_2saej,,,,47pydh,True,,lilballsofsunshine,,14,True,no_ads,False,[],False,dark,/r/infertility/comments/47pydh/antidepressants/,no_ads,False,https://www.reddit.com/r/infertility/comments/47pydh/antidepressants/,25375,1456506375.0,0,,False,False,{},,,,
236,2048,confidence,<praw.reddit.Reddit object at 0x7f2244aead90>,,infertility,"I have lots of friends and family who are supportive of us in general, and in our IF journey. However, we live far away and so we call, text or Skype to stay in touch. I found that recently I've been avoiding keeping in touch with people because every time we talk it seems that my IF is this giant elephant in the room, or that they think I'm calling because I'm pregnant. Just one more reason this can be so isolating.. And it doesn't help that I'm pretty introverted anyway.",,False,,0,False,DAE avoid talking to friends/family so you don't have to talk about infertility?,[],r/infertility,False,0,,0,,,False,t3_47pwpb,False,dark,1.0,,public,4,0,{},,,False,[],,False,False,,{},,False,4,,,self,False,,,{},,True,,1456534621.0,text,0,,,,self.infertility,False,"<!-- SC_OFF --><div class=""md""><p>I have lots of friends and family who are supportive of us in general, and in our IF journey. However, we live far away and so we call, text or Skype to stay in touch. I found that recently I&#39;ve been avoiding keeping in touch with people because every time we talk it seems that my IF is this giant elephant in the room, or that they think I&#39;m calling because I&#39;m pregnant. Just one more reason this can be so isolating.. And it doesn&#39;t help that I&#39;m pretty introverted anyway.</p>
</div><!-- SC_ON -->",,,,,True,False,False,False,False,[],[],False,False,False,False,,[],False,,,,t5_2saej,,,,47pwpb,True,,,,12,True,no_ads,False,[],,dark,/r/infertility/comments/47pwpb/dae_avoid_talking_to_friendsfamily_so_you_dont/,no_ads,False,https://www.reddit.com/r/infertility/comments/47pwpb/dae_avoid_talking_to_friendsfamily_so_you_dont/,25375,1456505821.0,0,,False,False,{},,,,
237,2048,confidence,<praw.reddit.Reddit object at 0x7f2244aead90>,,infertility,"Hi All, I'm not sure if this is the right sub Reddit for me, I lurk and post a bit in TTC but honestly it's not the best fit (I'm just torturing myself, I was drawn there because I have in common that I want a child but cannot have one, but since I can't actively TTC I don't know why I'm there)

My boyfriend and I desperately want a family, as far as we know we're both fertile, however in our case it makes no difference.

I have a rare liver disease and my doctors have told me I'm too sick to carry a child. Basically there are weak varicose veins through my liver and oesophagus and in late pregnancy the additional blood flow through the liver would be too dangerous (the veins will rupture and I would be in grave danger and would likely lose the baby anyway).

I don't know how to come to terms with this, or where I can find support.

Thanks all X 

Is there anyone in a similar situation?

I'm very sorry if this is the wrong place, is there anywhere else? ",t2_kl5hu,False,,0,False,"I'm not sure if I'm in the right sub Reddit, hi anyway",[],r/infertility,False,0,,0,,,False,t3_47p1xk,False,dark,0.9,,public,7,0,{},,,False,[],,False,False,,{},,False,7,,False,self,False,,[],{},,True,,1456522927.0,text,0,,,text,self.infertility,False,"<!-- SC_OFF --><div class=""md""><p>Hi All, I&#39;m not sure if this is the right sub Reddit for me, I lurk and post a bit in TTC but honestly it&#39;s not the best fit (I&#39;m just torturing myself, I was drawn there because I have in common that I want a child but cannot have one, but since I can&#39;t actively TTC I don&#39;t know why I&#39;m there)</p>

<p>My boyfriend and I desperately want a family, as far as we know we&#39;re both fertile, however in our case it makes no difference.</p>

<p>I have a rare liver disease and my doctors have told me I&#39;m too sick to carry a child. Basically there are weak varicose veins through my liver and oesophagus and in late pregnancy the additional blood flow through the liver would be too dangerous (the veins will rupture and I would be in grave danger and would likely lose the baby anyway).</p>

<p>I don&#39;t know how to come to terms with this, or where I can find support.</p>

<p>Thanks all X </p>

<p>Is there anyone in a similar situation?</p>

<p>I&#39;m very sorry if this is the wrong place, is there anywhere else? </p>
</div><!-- SC_ON -->",,,,,True,False,False,False,False,[],[],False,False,False,False,,[],False,,,,t5_2saej,,,,47p1xk,True,,RobotPixie,,14,True,no_ads,False,[],False,,/r/infertility/comments/47p1xk/im_not_sure_if_im_in_the_right_sub_reddit_hi/,no_ads,False,https://www.reddit.com/r/infertility/comments/47p1xk/im_not_sure_if_im_in_the_right_sub_reddit_hi/,25375,1456494127.0,0,,False,False,{},,,,
238,2048,confidence,<praw.reddit.Reddit object at 0x7f2244aead90>,,infertility,"Use this thread to share anything not necessarily related to infertility. Rant or rave, bitch, moan, share something funny, anything goes!",t2_6l4z3,False,,0,False,Friday Off Topic Thread,[],r/infertility,False,0,,0,,,False,t3_47oe3d,False,dark,1.0,,public,2,0,{},,,False,[],,False,False,,{},,False,2,,True,self,False,,[],{},,True,,1456509746.0,text,0,,,text,self.infertility,False,"<!-- SC_OFF --><div class=""md""><p>Use this thread to share anything not necessarily related to infertility. Rant or rave, bitch, moan, share something funny, anything goes!</p>
</div><!-- SC_ON -->",,,,,True,False,False,False,False,[],[],False,False,False,False,,[],False,,,moderator,t5_2saej,,,,47oe3d,True,,AutoModerator,,174,False,no_ads,False,[],False,,/r/infertility/comments/47oe3d/friday_off_topic_thread/,no_ads,False,https://www.reddit.com/r/infertility/comments/47oe3d/friday_off_topic_thread/,25375,1456480946.0,0,,False,False,{},,,,
