158,2048,confidence,<praw.reddit.Reddit object at 0x7f2244aead90>,,infertility,"Hi ladies and gents,

I was wondering what other ""boards and websites"" you guys visit for infertility support?

I am single and going this journey on my own. My biggest source of infertility support is online.    I visit ivf.ca on a regular basis, but it is pretty quiet. I was wondering where else people visit to get support? 

Thanks, 

Canyouhelpmeottawa?


",t2_bp6vn,False,,0,False,Hang outs and boards,[],r/infertility,False,0,,0,,,False,t3_4o584v,False,dark,0.72,,public,3,0,{},,,False,[],,False,False,,{},,False,3,,False,self,False,,[],{},,True,,1465987952.0,text,0,,,text,self.infertility,False,"<!-- SC_OFF --><div class=""md""><p>Hi ladies and gents,</p>

<p>I was wondering what other &quot;boards and websites&quot; you guys visit for infertility support?</p>

<p>I am single and going this journey on my own. My biggest source of infertility support is online.    I visit ivf.ca on a regular basis, but it is pretty quiet. I was wondering where else people visit to get support? </p>

<p>Thanks, </p>

<p>Canyouhelpmeottawa?</p>
</div><!-- SC_ON -->",,,,,True,False,False,False,False,[],[],False,False,False,False,who highjacked MY FUCKING STORK?!?!?!?,[],False,,,,t5_2saej,,,,4o584v,True,,Canyouhelpmeottawa,,10,True,no_ads,False,[],False,dark,/r/infertility/comments/4o584v/hang_outs_and_boards/,no_ads,False,https://www.reddit.com/r/infertility/comments/4o584v/hang_outs_and_boards/,25375,1465959152.0,0,,False,False,{},,
159,2048,confidence,<praw.reddit.Reddit object at 0x7f2244aead90>,,infertility,"Had my first IUI this cycle that is ending in a chemical. I've had two chemicals with timed intercourse. I'm terrified the issue is my eggs, because everything else seems to check out fine so far.

What should our next step be? I'm thinking an RPL and karyotyping. Then I want to move on to IVF, since it's clear that IUI is not solving our issue. Husband wants to get extensive reproductive immunology work up done before IVF, but I'm not sure if it's worth it. What would you do? If anyone has been in this situation, I'd love to hear what steps you took.",t2_xvp9z,False,,0,False,3 CPs - what's next?,[],r/infertility,False,0,,0,,,False,t3_4o4ngb,False,dark,1.0,,public,1,0,{},,,False,[],,False,False,,{},,False,1,,False,self,False,,[],{},,True,,1465979635.0,text,0,,,text,self.infertility,False,"<!-- SC_OFF --><div class=""md""><p>Had my first IUI this cycle that is ending in a chemical. I&#39;ve had two chemicals with timed intercourse. I&#39;m terrified the issue is my eggs, because everything else seems to check out fine so far.</p>

<p>What should our next step be? I&#39;m thinking an RPL and karyotyping. Then I want to move on to IVF, since it&#39;s clear that IUI is not solving our issue. Husband wants to get extensive reproductive immunology work up done before IVF, but I&#39;m not sure if it&#39;s worth it. What would you do? If anyone has been in this situation, I&#39;d love to hear what steps you took.</p>
</div><!-- SC_ON -->",,,,,True,True,False,False,False,[],[],False,False,False,False,"29F,poor embryo qual,FET#2",[],False,,,,t5_2saej,,,,4o4ngb,True,,baileycoraline,,6,True,no_ads,False,[],False,dark,/r/infertility/comments/4o4ngb/3_cps_whats_next/,no_ads,False,https://www.reddit.com/r/infertility/comments/4o4ngb/3_cps_whats_next/,25375,1465950835.0,0,,False,False,{},,
160,2048,confidence,<praw.reddit.Reddit object at 0x7f2244aead90>,,infertility,"My ENT told me to start using Flonase.  The package insert says this drug is Category C.  I've emailed my clinic asking their opinion on it, but I was wondering what you all think.  ",t2_irpgz,False,,0,False,Anyone here use Flonase?,[],r/infertility,False,0,,0,,,False,t3_4o4kru,False,dark,1.0,,public,2,0,{},,d70f54ce-930e-11e4-8710-22000b26873e,False,[],,False,False,,{},,False,2,,False,self,False,,[],{},,True,,1465978590.0,text,0,,,text,self.infertility,False,"<!-- SC_OFF --><div class=""md""><p>My ENT told me to start using Flonase.  The package insert says this drug is Category C.  I&#39;ve emailed my clinic asking their opinion on it, but I was wondering what you all think.  </p>
</div><!-- SC_ON -->",,,,,True,False,False,False,False,[],[],False,False,False,False,TTC: Oct '14 | Unexp | 2IUI | IVF 1ER 1Xfer ,[],False,,,,t5_2saej,,,,4o4kru,True,,hockeypup,,4,True,no_ads,False,[],False,dark,/r/infertility/comments/4o4kru/anyone_here_use_flonase/,no_ads,False,https://www.reddit.com/r/infertility/comments/4o4kru/anyone_here_use_flonase/,25375,1465949790.0,0,,False,False,{},,
161,2048,confidence,<praw.reddit.Reddit object at 0x7f2244aead90>,,infertility,"Blah. 

Pretty much what I expected. 

My only options are IVF with donor eggs (either fresh or through their bank) or do another fresh cycle  myself. And since I am 43, meds would be started at the max dosage  and they'd require PGS, which starts at 5500. So at least 25k. 

They haven't had much luck with people wanting to  donate embryos, most of their donor embryo cycles are known donor.  He didn't  sound like a huge fan of it. 

We could try IUI if we wanted but we'd need to redo all the bloodwork and SA to see if it would even be worth it. My AMH was still good a year ago, but age is still an issue. 

So it looks like either adoption or be happy with the one we have.",t2_cczv4,False,,0,False,Finally had my followup from my miscarriage,[],r/infertility,False,0,,0,,,False,t3_4o4fqr,False,dark,0.99,,public,8,0,{},,,False,[],,False,False,,{},,False,8,,False,self,False,,[],{},,True,,1465976683.0,text,0,,,text,self.infertility,True,"<!-- SC_OFF --><div class=""md""><p>Blah. </p>

<p>Pretty much what I expected. </p>

<p>My only options are IVF with donor eggs (either fresh or through their bank) or do another fresh cycle  myself. And since I am 43, meds would be started at the max dosage  and they&#39;d require PGS, which starts at 5500. So at least 25k. </p>

<p>They haven&#39;t had much luck with people wanting to  donate embryos, most of their donor embryo cycles are known donor.  He didn&#39;t  sound like a huge fan of it. </p>

<p>We could try IUI if we wanted but we&#39;d need to redo all the bloodwork and SA to see if it would even be worth it. My AMH was still good a year ago, but age is still an issue. </p>

<p>So it looks like either adoption or be happy with the one we have.</p>
</div><!-- SC_ON -->",,,,,True,False,False,False,False,[],[],False,False,False,False,,[],False,,,,t5_2saej,,,,4o4fqr,True,,hazelowl,,14,True,no_ads,False,[],False,dark,/r/infertility/comments/4o4fqr/finally_had_my_followup_from_my_miscarriage/,no_ads,False,https://www.reddit.com/r/infertility/comments/4o4fqr/finally_had_my_followup_from_my_miscarriage/,25375,1465947883.0,0,,False,False,{},,
162,2048,confidence,<praw.reddit.Reddit object at 0x7f2244aead90>,,infertility,"I've been really down in the dumps lately. The lupron has been giving me killer headaches and my emotional state has been terrible. I've been so discouraged that I almost wanted to give up before we even started. Today I finally feel a glimmer of hope again. I had my suppression check and everything looks good to go. My lining was super thin (1.4mm) which they said indicated good suppression. Seems scary thin to me, but apparently that's a good thing at this stage. My estradiol was 24 which they said they looked for under 50 to indicate good suppression. And the best news of all, I have 8 micro follicles on one side and 10 on the other!! I have borderline low AMH so I've been wondering how I will respond to a stims. I know I have a long way to go before those 18 micro follicles become a good number of mature follicles, but it's better news than I expected. The plan now is I lower my lupron dose starting tomorrow and then I start gonal-F and menopur on Saturday. My next monitoring appointment is next Wednesday. I really hope everything goes smoothly! I'm starting to get just the slightest bit excited. I don't want to get my hopes up too much though. Anybody else starting stims this week? I like having a cycle buddy. ",t2_je9v9,False,,0,False,Feelling slightly better today after successful first step of IVF #1: suppression check was all good,[],r/infertility,False,0,,0,,,False,t3_4o48ef,False,dark,0.81,,public,6,0,{},,,False,[],,False,False,,{},,False,6,,False,self,False,,[],{},,True,,1465973990.0,text,0,,,text,self.infertility,False,"<!-- SC_OFF --><div class=""md""><p>I&#39;ve been really down in the dumps lately. The lupron has been giving me killer headaches and my emotional state has been terrible. I&#39;ve been so discouraged that I almost wanted to give up before we even started. Today I finally feel a glimmer of hope again. I had my suppression check and everything looks good to go. My lining was super thin (1.4mm) which they said indicated good suppression. Seems scary thin to me, but apparently that&#39;s a good thing at this stage. My estradiol was 24 which they said they looked for under 50 to indicate good suppression. And the best news of all, I have 8 micro follicles on one side and 10 on the other!! I have borderline low AMH so I&#39;ve been wondering how I will respond to a stims. I know I have a long way to go before those 18 micro follicles become a good number of mature follicles, but it&#39;s better news than I expected. The plan now is I lower my lupron dose starting tomorrow and then I start gonal-F and menopur on Saturday. My next monitoring appointment is next Wednesday. I really hope everything goes smoothly! I&#39;m starting to get just the slightest bit excited. I don&#39;t want to get my hopes up too much though. Anybody else starting stims this week? I like having a cycle buddy. </p>
</div><!-- SC_ON -->",,,,,True,False,False,False,False,[],[],False,False,False,False,,[],False,,,,t5_2saej,,,,4o48ef,True,,allbustnoballs,,6,True,no_ads,False,[],False,,/r/infertility/comments/4o48ef/feelling_slightly_better_today_after_successful/,no_ads,False,https://www.reddit.com/r/infertility/comments/4o48ef/feelling_slightly_better_today_after_successful/,25375,1465945190.0,0,,False,False,{},,
163,2048,confidence,<praw.reddit.Reddit object at 0x7f2244aead90>,,infertility,"Hello out there. This is my first post, ever. I don't have facebook and have shared my infertility issues with only a couple people in my life. I hope I follow all the rules right and am in the right place.

Brief as can be about me - I'm a 38 year old woman who's been trying for 6 1/2 years to conceive. I've had 2 chemical miscarriages and D&Cs. One after Christmas 2011, and one the day before Thanksgiving 2012. I had an early labor due to dilated cervix at exactly 23 weeks in 2013 to my loving son who lived for 52 days. Last year my husband and I began IVF after we didn't have any luck with all the other fertility treatments. Up to today I've had 4 retrievals and 2 failed transfers. The last 2 retrievals have come up empty. PGD tested abnormal both times for the single embryo that makes it to day 5. My primary diagnosis is low follicle count. 

Alright so where's some sort of good in all this? We still have 2 healthy frozen embryos. My husband and I love each other and are still together after an infant loss and infertility. We have health insurance that pays for meds and procedures, although we are reaching our max annual amount of fertility coverage since we've done so many procedures this calendar year. I've got 1 major procedure be it retrieval or transfer left in my insurance allowance. I'm coming close to facing I may have to pay out of pocket for the remainder of this year and I would like to share what my options are. Oh, options are a good thing too. 

Where I'm at right now - I'm meeting with my doctor today in a couple hours to discuss next steps. I can either do a retrieval, which I've already come to terms would be my last one. I'm ok with that. I can also throw caution to the wind, let the chips fall where they may and implant my last two and be done. Weâ€™ve only implanted one at a time because Iâ€™m very high risk now so my doctor is against implanting 2, but with 1 procedure left Iâ€™m giving serious thought to implanting 2. The option that seems more responsible/smart is another retrieval because eggs expire. I canâ€™t even think that far out right now if or not Iâ€™d implant frozen on day 5 or fresh (if I have any) on day 6. Part of me wants to never give up on having my own baby and part of me also feels like itâ€™s down to the wire decision making time. Listening to my intuition isnâ€™t that easy when there are so many possibilities. Not to mention going through IVF Iâ€™ve experienced ANYTHING can happen! I batted 100% my first 2 retrievals with 4 healthy embryos total. Science is not a guarantee. 

More than anything I wanted to share with other people some of my story and hope in any capacity I can be of help to others. We're a tribe of our own. 
",t2_yqco8,False,,0,False,"Hello, I'm new here.",[],r/infertility,False,0,,0,,,False,t3_4o3ze4,False,dark,0.91,,public,15,0,{},,,False,[],,False,False,,{},,False,15,,False,self,False,,[],{},,True,,1465970736.0,text,0,,,text,self.infertility,False,"<!-- SC_OFF --><div class=""md""><p>Hello out there. This is my first post, ever. I don&#39;t have facebook and have shared my infertility issues with only a couple people in my life. I hope I follow all the rules right and am in the right place.</p>

<p>Brief as can be about me - I&#39;m a 38 year old woman who&#39;s been trying for 6 1/2 years to conceive. I&#39;ve had 2 chemical miscarriages and D&amp;Cs. One after Christmas 2011, and one the day before Thanksgiving 2012. I had an early labor due to dilated cervix at exactly 23 weeks in 2013 to my loving son who lived for 52 days. Last year my husband and I began IVF after we didn&#39;t have any luck with all the other fertility treatments. Up to today I&#39;ve had 4 retrievals and 2 failed transfers. The last 2 retrievals have come up empty. PGD tested abnormal both times for the single embryo that makes it to day 5. My primary diagnosis is low follicle count. </p>

<p>Alright so where&#39;s some sort of good in all this? We still have 2 healthy frozen embryos. My husband and I love each other and are still together after an infant loss and infertility. We have health insurance that pays for meds and procedures, although we are reaching our max annual amount of fertility coverage since we&#39;ve done so many procedures this calendar year. I&#39;ve got 1 major procedure be it retrieval or transfer left in my insurance allowance. I&#39;m coming close to facing I may have to pay out of pocket for the remainder of this year and I would like to share what my options are. Oh, options are a good thing too. </p>

<p>Where I&#39;m at right now - I&#39;m meeting with my doctor today in a couple hours to discuss next steps. I can either do a retrieval, which I&#39;ve already come to terms would be my last one. I&#39;m ok with that. I can also throw caution to the wind, let the chips fall where they may and implant my last two and be done. Weâ€™ve only implanted one at a time because Iâ€™m very high risk now so my doctor is against implanting 2, but with 1 procedure left Iâ€™m giving serious thought to implanting 2. The option that seems more responsible/smart is another retrieval because eggs expire. I canâ€™t even think that far out right now if or not Iâ€™d implant frozen on day 5 or fresh (if I have any) on day 6. Part of me wants to never give up on having my own baby and part of me also feels like itâ€™s down to the wire decision making time. Listening to my intuition isnâ€™t that easy when there are so many possibilities. Not to mention going through IVF Iâ€™ve experienced ANYTHING can happen! I batted 100% my first 2 retrievals with 4 healthy embryos total. Science is not a guarantee. </p>

<p>More than anything I wanted to share with other people some of my story and hope in any capacity I can be of help to others. We&#39;re a tribe of our own. </p>
</div><!-- SC_ON -->",,,,,True,False,False,False,False,[],[],False,False,False,False,,[],False,,,,t5_2saej,,,,4o3ze4,True,,mummatobee,,9,True,no_ads,False,[],False,,/r/infertility/comments/4o3ze4/hello_im_new_here/,no_ads,False,https://www.reddit.com/r/infertility/comments/4o3ze4/hello_im_new_here/,25375,1465941936.0,0,,False,False,{},,
164,2048,confidence,<praw.reddit.Reddit object at 0x7f2244aead90>,,infertility,Edit: Thanks for the clarification folks.,t2_794pg,False,,0,False,"WTF doesn't seem to mean the same thing here as it does elsewhere, and it isn't on the list of acronyms. Someone want to clue me in please?",[],r/infertility,False,0,,0,,,False,t3_4o3yxz,False,dark,0.84,,public,8,0,{},,d70f54ce-930e-11e4-8710-22000b26873e,False,[],,False,False,,{},,False,8,,False,self,1465944322.0,,[],{},,True,,1465970569.0,text,0,,,text,self.infertility,True,"<!-- SC_OFF --><div class=""md""><p>Edit: Thanks for the clarification folks.</p>
</div><!-- SC_ON -->",,,,,True,False,False,False,False,[],[],False,False,False,False,"36, trying since 07/2008, one miscarriage.  PCOS",[],False,,,,t5_2saej,,,,4o3yxz,True,,Celt42,,9,True,no_ads,False,[],False,dark,/r/infertility/comments/4o3yxz/wtf_doesnt_seem_to_mean_the_same_thing_here_as_it/,no_ads,False,https://www.reddit.com/r/infertility/comments/4o3yxz/wtf_doesnt_seem_to_mean_the_same_thing_here_as_it/,25375,1465941769.0,0,,False,False,{},,
165,2048,confidence,<praw.reddit.Reddit object at 0x7f2244aead90>,,infertility,"Caremark/CVS won't allow insurance to cover Lupron with a FET.  Mayo Clinic won't do the FET without Lupron.  WTF?  

Is it possible to do FET without Lupron?  Doctor's office said no, so I'm trying to figure out what I'm missing here.

TLDR - Caremark wants me to be sterile.  ",t2_9zhje,False,,0,False,FET without Lupron?,[],r/infertility,False,0,,0,,,False,t3_4o3pfb,False,dark,0.75,,public,4,0,{},,,False,[],,False,False,,{},,False,4,,False,self,False,,[],{},,True,,1465967346.0,text,0,,,text,self.infertility,False,"<!-- SC_OFF --><div class=""md""><p>Caremark/CVS won&#39;t allow insurance to cover Lupron with a FET.  Mayo Clinic won&#39;t do the FET without Lupron.  WTF?  </p>

<p>Is it possible to do FET without Lupron?  Doctor&#39;s office said no, so I&#39;m trying to figure out what I&#39;m missing here.</p>

<p>TLDR - Caremark wants me to be sterile.  </p>
</div><!-- SC_ON -->",,,,,True,False,False,False,False,[],[],False,False,False,False,"36, TTC #1, 2 MCs, ET #4 Nov 2017",[],False,,,,t5_2saej,,,,4o3pfb,True,,Centinela,,16,True,no_ads,False,[],False,dark,/r/infertility/comments/4o3pfb/fet_without_lupron/,no_ads,False,https://www.reddit.com/r/infertility/comments/4o3pfb/fet_without_lupron/,25375,1465938546.0,0,,False,False,{},,
166,2048,confidence,<praw.reddit.Reddit object at 0x7f2244aead90>,,infertility,"**update below**
So we have an appt tomorrow to make sure all is ok after my D&C and talk about our next IVF steps for cycle 3. 

I think I'm going to push pretty hard to do FETs with PGS moving forward, because I want to do everything possible to reduce the chances of another miscarriage. 
We are also going to do genetic testing on me and my husband, and in a couple weeks we'll have results back from the MC testing, so we should know why that happened. So we'll have a lot more info for this round.

But now I'm also wondering if I should push to check if there is some kind of uterine implantation issue. We had 3 3-day embryos and then 3 5-day embryos implanted across the two fresh cycles, and one 5-day worked. Considering we have MFI and no known issues on my side, shouldn't at least one more have implanted? I mean, even just to get a slight beta rise, not necessarily a viable pregnancy. 
Has anyone discussed anything regarding implantation issues/rates before?

I do have (controlled) autoimmune hypothyroid, so maybe there is something immunological going on..

My thinking is FET might help implantation - based on what I've read of the uterus being more receptive when not hopped up on the stims. The fact that we never had anything make it to freeze is definitely worrying too.

Anything else you guys think I should ask?
Has anyone been told FETs aren't a good option for them for some reason?

**Update** 

Two good things - all looks ok post D&C, and we found out we had more frozen sperm meaning no biopsy needed for my husband. (cue very happy husband)

Husband got blood drawn for karyotyping. I have to wait a month before blood draw for mine to make sure all pregnancy hormones are gone.
I'll also do a repeat loss panel, even though I had just the one loss. Taking no chances! My thinking is since I might not have luck with freezing and PGS, I'll do all the pre-testing I can.

Two Bad things - 
Since I have to wait to do the RLP/Karyotyping and then wait again for results, I might not get to start again with my second period. Hopefully the timing will work out.

Also, I forgot my list of questions I made from your responses below.  Doc did say he'd recommend same fresh transfer protocol as last time, unless one of these tests shows something. So I'm guessing he doesn't think we'll have an easy time making it to freeze. But obviously I need a clear answer on that. When we go back for miscarriage results in a few weeks, I'm going to delve into more about our options for frozen, etc. If we end up having all normal test results, including those done from the mc, then I'm ok with a fresh transfer again.
",t2_nldy0,False,,0,False,WTF appointment tomorrow. What to bring up?,[],r/infertility,False,0,,0,,,False,t3_4o3oul,False,dark,0.99,,public,7,0,{},,d70f54ce-930e-11e4-8710-22000b26873e,False,[],,False,False,,{},,False,7,,False,self,1466024004.0,,[],{},,True,,1465967164.0,text,0,,,text,self.infertility,True,"<!-- SC_OFF --><div class=""md""><p><strong>update below</strong>
So we have an appt tomorrow to make sure all is ok after my D&amp;C and talk about our next IVF steps for cycle 3. </p>

<p>I think I&#39;m going to push pretty hard to do FETs with PGS moving forward, because I want to do everything possible to reduce the chances of another miscarriage. 
We are also going to do genetic testing on me and my husband, and in a couple weeks we&#39;ll have results back from the MC testing, so we should know why that happened. So we&#39;ll have a lot more info for this round.</p>

<p>But now I&#39;m also wondering if I should push to check if there is some kind of uterine implantation issue. We had 3 3-day embryos and then 3 5-day embryos implanted across the two fresh cycles, and one 5-day worked. Considering we have MFI and no known issues on my side, shouldn&#39;t at least one more have implanted? I mean, even just to get a slight beta rise, not necessarily a viable pregnancy. 
Has anyone discussed anything regarding implantation issues/rates before?</p>

<p>I do have (controlled) autoimmune hypothyroid, so maybe there is something immunological going on..</p>

<p>My thinking is FET might help implantation - based on what I&#39;ve read of the uterus being more receptive when not hopped up on the stims. The fact that we never had anything make it to freeze is definitely worrying too.</p>

<p>Anything else you guys think I should ask?
Has anyone been told FETs aren&#39;t a good option for them for some reason?</p>

<p><strong>Update</strong> </p>

<p>Two good things - all looks ok post D&amp;C, and we found out we had more frozen sperm meaning no biopsy needed for my husband. (cue very happy husband)</p>

<p>Husband got blood drawn for karyotyping. I have to wait a month before blood draw for mine to make sure all pregnancy hormones are gone.
I&#39;ll also do a repeat loss panel, even though I had just the one loss. Taking no chances! My thinking is since I might not have luck with freezing and PGS, I&#39;ll do all the pre-testing I can.</p>

<p>Two Bad things - 
Since I have to wait to do the RLP/Karyotyping and then wait again for results, I might not get to start again with my second period. Hopefully the timing will work out.</p>

<p>Also, I forgot my list of questions I made from your responses below.  Doc did say he&#39;d recommend same fresh transfer protocol as last time, unless one of these tests shows something. So I&#39;m guessing he doesn&#39;t think we&#39;ll have an easy time making it to freeze. But obviously I need a clear answer on that. When we go back for miscarriage results in a few weeks, I&#39;m going to delve into more about our options for frozen, etc. If we end up having all normal test results, including those done from the mc, then I&#39;m ok with a fresh transfer again.</p>
</div><!-- SC_ON -->",,,,,True,False,False,False,False,[],[],False,False,False,False,"39F | MFI | 11 IVF -> 7 transfers, 1 MC, 1 CP",[],False,,,,t5_2saej,,,,4o3oul,True,,traipsingalong,,22,True,no_ads,False,[],False,dark,/r/infertility/comments/4o3oul/wtf_appointment_tomorrow_what_to_bring_up/,no_ads,False,https://www.reddit.com/r/infertility/comments/4o3oul/wtf_appointment_tomorrow_what_to_bring_up/,25375,1465938364.0,0,,False,False,{},,
