219,2048,confidence,<praw.reddit.Reddit object at 0x7f2244aead90>,,infertility,"http://www.themarysue.com/daisy-ridley-endometriosis/

I'm glad more celebs are speaking up. I can't help but think that if these problems are treated sooner, then less women will be in infertility, land of suck.",t2_jxi65,False,,0,False,Daisy Ridley opens up about PCOS and endo on Instagram,[],r/infertility,False,0,,0,,,False,t3_4nidom,False,dark,1.0,,public,24,0,{},,d70f54ce-930e-11e4-8710-22000b26873e,False,[],,False,False,,{},,False,24,,False,self,False,,[],{},,True,,1465620599.0,text,0,,,text,self.infertility,False,"<!-- SC_OFF --><div class=""md""><p><a href=""http://www.themarysue.com/daisy-ridley-endometriosis/"">http://www.themarysue.com/daisy-ridley-endometriosis/</a></p>

<p>I&#39;m glad more celebs are speaking up. I can&#39;t help but think that if these problems are treated sooner, then less women will be in infertility, land of suck.</p>
</div><!-- SC_ON -->",,,,,True,False,False,False,False,[],[],False,False,False,False,"37, TTC #1, 4 laps, 3 failed IUI, endo.",[],False,,,,t5_2saej,,,,4nidom,True,,centernova,,7,True,no_ads,False,[],False,dark,/r/infertility/comments/4nidom/daisy_ridley_opens_up_about_pcos_and_endo_on/,no_ads,False,https://www.reddit.com/r/infertility/comments/4nidom/daisy_ridley_opens_up_about_pcos_and_endo_on/,25375,1465591799.0,0,,False,False,{},self,"{'images': [{'source': {'url': 'https://external-preview.redd.it/nvphQOiTtZvMfj-98pCECzieTZPVOsYUEnjvMm4NPh0.jpg?auto=webp&s=76eac7ea9534587d3027fc2d6b0700415cb431a7', 'width': 296, 'height': 300}, 'resolutions': [{'url': 'https://external-preview.redd.it/nvphQOiTtZvMfj-98pCECzieTZPVOsYUEnjvMm4NPh0.jpg?width=108&crop=smart&auto=webp&s=bf05ce843527e3af55608119d71e1b9a0d83f71b', 'width': 108, 'height': 109}, {'url': 'https://external-preview.redd.it/nvphQOiTtZvMfj-98pCECzieTZPVOsYUEnjvMm4NPh0.jpg?width=216&crop=smart&auto=webp&s=8460fe00d205ec5b6323434bfec2b63db884d8f6', 'width': 216, 'height': 218}], 'variants': {}, 'id': 'vDMuk861S5C5qqSk_TRDdbPPQUiuu-pVwQ6SComv9k0'}], 'enabled': False}"
220,2048,confidence,<praw.reddit.Reddit object at 0x7f2244aead90>,,infertility,"We're in the legal process of getting 8 high-quality embryos transferred to our possession.  I'm so excited.  The kids will even kind of look like us (they'll know their origin, but I won't have to explain it to every nosy neighbor ever). I'm taking some time off from treatment and will likely pursue an August transfer.


But god, I feel like lately once a week in my local IF group, someone has been getting a positive beta, or worse, having a miracle pregnancy right before starting IVF.  It's hard.  I just want it to be my turn already.  We're so close, and we're still so far away.",t2_ielxg,False,,0,False,I just feel like my turn is still so far away,[],r/infertility,False,0,,0,,,False,t3_4nib5i,False,dark,1.0,,public,10,0,{},,,False,[],,False,False,,{},,False,10,,False,self,False,,[],{},,True,,1465619641.0,text,0,,,text,self.infertility,False,"<!-- SC_OFF --><div class=""md""><p>We&#39;re in the legal process of getting 8 high-quality embryos transferred to our possession.  I&#39;m so excited.  The kids will even kind of look like us (they&#39;ll know their origin, but I won&#39;t have to explain it to every nosy neighbor ever). I&#39;m taking some time off from treatment and will likely pursue an August transfer.</p>

<p>But god, I feel like lately once a week in my local IF group, someone has been getting a positive beta, or worse, having a miracle pregnancy right before starting IVF.  It&#39;s hard.  I just want it to be my turn already.  We&#39;re so close, and we&#39;re still so far away.</p>
</div><!-- SC_ON -->",,,,,True,False,False,False,False,[],[],False,False,False,False,MFI+DOR | 1 Failed IVF | Donor embryo FETs,[],False,,,,t5_2saej,,,,4nib5i,True,,GIMME_ALL_THE_BABIES,,11,True,no_ads,False,[],False,dark,/r/infertility/comments/4nib5i/i_just_feel_like_my_turn_is_still_so_far_away/,no_ads,False,https://www.reddit.com/r/infertility/comments/4nib5i/i_just_feel_like_my_turn_is_still_so_far_away/,25375,1465590841.0,0,,False,False,{},,
221,2048,confidence,<praw.reddit.Reddit object at 0x7f2244aead90>,,infertility,So monitoring appointment #3 for IVF #1 was craptastic this morning. I'm on a microdose lupron protocol with 200 units gonal per day with 20 units low dose hcg per day and 20 units micro lupron 2x a day. This would be stim day 8 so I was hoping to see my other smaller follicles finally make an appearance but no same one large follicle on my right ovary and a larger one on my left. I have two small ones on my right and 4 smalls on my left. Estrogen has been rising slowly and was 92 on day 4 and 295 on day 6 when my dominants started making an appearance. Still waiting on bloodwork from today. Plus my blood draw this morning was gushy and dribbled down my arm like a horror movie. They called back and want me to carry on with the same meds until sunday. Part of me thinks they don't want to cancel because then they're out all that monitoring money. Then if I go to retrieval they can just conveniently leave me out of their over 35 stats because I'm DOR and shit. I never believe that a business has your best interests as a priority. I'm really worried that if I carry on to retrieval I won't have any quality eggs.,t2_qvj5f,False,,0,False,IVF #1 might be cancelled due to a pig follicle,[],r/infertility,False,0,,0,,,False,t3_4ni66z,False,dark,0.67,,public,3,0,{},,,False,[],,False,False,,{},,False,3,,False,self,False,,[],{},,True,,1465617877.0,text,0,,,text,self.infertility,True,"<!-- SC_OFF --><div class=""md""><p>So monitoring appointment #3 for IVF #1 was craptastic this morning. I&#39;m on a microdose lupron protocol with 200 units gonal per day with 20 units low dose hcg per day and 20 units micro lupron 2x a day. This would be stim day 8 so I was hoping to see my other smaller follicles finally make an appearance but no same one large follicle on my right ovary and a larger one on my left. I have two small ones on my right and 4 smalls on my left. Estrogen has been rising slowly and was 92 on day 4 and 295 on day 6 when my dominants started making an appearance. Still waiting on bloodwork from today. Plus my blood draw this morning was gushy and dribbled down my arm like a horror movie. They called back and want me to carry on with the same meds until sunday. Part of me thinks they don&#39;t want to cancel because then they&#39;re out all that monitoring money. Then if I go to retrieval they can just conveniently leave me out of their over 35 stats because I&#39;m DOR and shit. I never believe that a business has your best interests as a priority. I&#39;m really worried that if I carry on to retrieval I won&#39;t have any quality eggs.</p>
</div><!-- SC_ON -->",,,,,True,False,False,False,False,[],[],False,False,False,False,,[],False,,,,t5_2saej,,,,4ni66z,True,,mrschubbybottoms,,5,True,no_ads,False,[],False,,/r/infertility/comments/4ni66z/ivf_1_might_be_cancelled_due_to_a_pig_follicle/,no_ads,False,https://www.reddit.com/r/infertility/comments/4ni66z/ivf_1_might_be_cancelled_due_to_a_pig_follicle/,25375,1465589077.0,0,,False,False,{},,
222,2048,confidence,<praw.reddit.Reddit object at 0x7f2244aead90>,,infertility,[deleted],,False,,0,False,Ovidrel questions,[],r/infertility,False,0,,0,,,False,t3_4nhyqj,False,dark,1.0,,public,2,0,{},,,False,[],,False,False,,{},,False,2,,,default,False,,,{},,True,,1465615273.0,text,0,,,,self.infertility,False,"<!-- SC_OFF --><div class=""md""><p>[deleted]</p>
</div><!-- SC_ON -->",,,,,True,False,False,False,False,[],[],False,False,False,False,,[],False,,,,t5_2saej,,,,4nhyqj,False,,,,4,True,no_ads,False,[],,dark,/r/infertility/comments/4nhyqj/ovidrel_questions/,no_ads,False,https://www.reddit.com/r/infertility/comments/4nhyqj/ovidrel_questions/,25375,1465586473.0,0,,False,False,{},,
223,2048,confidence,<praw.reddit.Reddit object at 0x7f2244aead90>,,infertility,[deleted],,False,,0,False,Bad ovulation pain with Letrozole/Femara?,[],r/infertility,False,0,,0,,,False,t3_4nhscd,False,dark,1.0,,public,3,0,{},,,False,[],,False,False,,{},,False,3,,,default,False,,,{},,True,,1465613023.0,text,0,,,,self.infertility,False,"<!-- SC_OFF --><div class=""md""><p>[deleted]</p>
</div><!-- SC_ON -->",,,,,True,False,False,False,False,[],[],False,False,False,False,,[],False,,,,t5_2saej,,,,4nhscd,False,,,,16,True,no_ads,False,[],,dark,/r/infertility/comments/4nhscd/bad_ovulation_pain_with_letrozolefemara/,no_ads,False,https://www.reddit.com/r/infertility/comments/4nhscd/bad_ovulation_pain_with_letrozolefemara/,25375,1465584223.0,0,,False,False,{},,
224,2048,confidence,<praw.reddit.Reddit object at 0x7f2244aead90>,,infertility,"I don't normally get my periods unless on birth control.  Obviously I'm not on birth control right now as I'm trying to battle my infertility. 

I just finished my first month of Femara.  Doc said I made two follicles and to expect ovulation on day 13-14.  Ovulation strips showed negative results from day 10-22 (still had sex just in case obviously) 

It's now day 32 and I am not pregnant - which I expected - but what I am confused about now is what happens if I don't get my period again?  If I were on BC, I would have expected it on Monday (it's Friday now)   I'm supposed to take Femara on days 3-7 of my cycle but what if my cycle doesn't start up again?  Normally if I'm not on bc it would not.  Does Femara help in that regard?  
",,False,,0,False,I dont think my first round of Femara worked. Not sure what the next step is.,[],r/infertility,False,0,,0,,,False,t3_4nghuk,False,dark,1.0,,public,3,0,{},,,False,[],,False,False,,{},,False,3,,,self,False,,,{},,True,,1465597133.0,text,0,,,,self.infertility,False,"<!-- SC_OFF --><div class=""md""><p>I don&#39;t normally get my periods unless on birth control.  Obviously I&#39;m not on birth control right now as I&#39;m trying to battle my infertility. </p>

<p>I just finished my first month of Femara.  Doc said I made two follicles and to expect ovulation on day 13-14.  Ovulation strips showed negative results from day 10-22 (still had sex just in case obviously) </p>

<p>It&#39;s now day 32 and I am not pregnant - which I expected - but what I am confused about now is what happens if I don&#39;t get my period again?  If I were on BC, I would have expected it on Monday (it&#39;s Friday now)   I&#39;m supposed to take Femara on days 3-7 of my cycle but what if my cycle doesn&#39;t start up again?  Normally if I&#39;m not on bc it would not.  Does Femara help in that regard?  </p>
</div><!-- SC_ON -->",,,,,True,False,False,False,False,[],[],False,False,False,False,,[],False,,,,t5_2saej,,,,4nghuk,True,,,,14,True,no_ads,False,[],,dark,/r/infertility/comments/4nghuk/i_dont_think_my_first_round_of_femara_worked_not/,no_ads,False,https://www.reddit.com/r/infertility/comments/4nghuk/i_dont_think_my_first_round_of_femara_worked_not/,25375,1465568333.0,0,,False,False,{},,
225,2048,confidence,<praw.reddit.Reddit object at 0x7f2244aead90>,,infertility,"I have a grade teammate. Let's say her name is Sam. Sam is pregnant with her third child and her second ""accident."" She's about 18 weeks along, and the pregnancy is complicated because here at school she was exposed to Fifth Disease, was not immune, and it is affecting her baby girl. 

Now, I'm not going to deny that Sam is in a very stressful, anxiety-inducing, and emotional situation in which she needs support. But Sam is constantly asking *me* for favors, help, a shoulder to lean on, a sounding board to vent to. 

There are only four of us on my team, and our other two teachers are male. Sam knows every intimate detail of my own struggle and all about Ethan. She came to my house - pregnant - when he died to offer condolences (which was sweet? But hopefully you're seeing a pattern here.) She knows I'm in the middle of a wait after IVF which has me feeling hyper-emotional and borderline insane. She knows that her own complicated pregnancy is super-triggering me. But I don't blame her for being unable to see beyond herself when she runs into my room literally ten minutes ago asking ""I called my doctor and he's going to talk to me this morning to go over all my charts. If he calls when kids are in the room, can you help cover for a few minutes?"" 

I can't cause her any more stress by being the bitch who tells her to please just leave me alone to deal with my own shit. But, to use my new favorite catch-phrase, I just can't be her emotional tampon right now. She left the room and tears welled up in my eyes because...everything. 

Any advice? There's a week left in the school year. My plan right now is to just suck it up and deal, unless you guys have a better idea that doesn't make me look heartless. ",t2_8qcwd,False,,0,False,Advice on handling a co-worker.,[],r/infertility,False,0,,0,,,False,t3_4ng29a,False,dark,0.84,,public,12,0,{},,d70f54ce-930e-11e4-8710-22000b26873e,False,[],,False,False,,{},,False,12,,False,self,False,,[],{},,True,,1465590723.0,text,0,,,text,self.infertility,False,"<!-- SC_OFF --><div class=""md""><p>I have a grade teammate. Let&#39;s say her name is Sam. Sam is pregnant with her third child and her second &quot;accident.&quot; She&#39;s about 18 weeks along, and the pregnancy is complicated because here at school she was exposed to Fifth Disease, was not immune, and it is affecting her baby girl. </p>

<p>Now, I&#39;m not going to deny that Sam is in a very stressful, anxiety-inducing, and emotional situation in which she needs support. But Sam is constantly asking <em>me</em> for favors, help, a shoulder to lean on, a sounding board to vent to. </p>

<p>There are only four of us on my team, and our other two teachers are male. Sam knows every intimate detail of my own struggle and all about Ethan. She came to my house - pregnant - when he died to offer condolences (which was sweet? But hopefully you&#39;re seeing a pattern here.) She knows I&#39;m in the middle of a wait after IVF which has me feeling hyper-emotional and borderline insane. She knows that her own complicated pregnancy is super-triggering me. But I don&#39;t blame her for being unable to see beyond herself when she runs into my room literally ten minutes ago asking &quot;I called my doctor and he&#39;s going to talk to me this morning to go over all my charts. If he calls when kids are in the room, can you help cover for a few minutes?&quot; </p>

<p>I can&#39;t cause her any more stress by being the bitch who tells her to please just leave me alone to deal with my own shit. But, to use my new favorite catch-phrase, I just can&#39;t be her emotional tampon right now. She left the room and tears welled up in my eyes because...everything. </p>

<p>Any advice? There&#39;s a week left in the school year. My plan right now is to just suck it up and deal, unless you guys have a better idea that doesn&#39;t make me look heartless. </p>
</div><!-- SC_ON -->",,,,,True,False,False,False,False,[],[],False,False,False,False,"Lost Ethan @22 wks, 3 EPs, IVF in 2016, FET #2 underway",[],False,,,,t5_2saej,,,,4ng29a,True,,MackieMouse,,21,True,no_ads,False,[],False,dark,/r/infertility/comments/4ng29a/advice_on_handling_a_coworker/,no_ads,False,https://www.reddit.com/r/infertility/comments/4ng29a/advice_on_handling_a_coworker/,25375,1465561923.0,0,,False,False,{},,
226,2048,confidence,<praw.reddit.Reddit object at 0x7f2244aead90>,,infertility,"I'm still toiling away with daily visits to the RE to check my lining and labs for this FET. My lining is only an 8 and they prefer 10, my lead follicle is 23 mm and ready to pop at any minute, but depending on my labs they may just have me trigger with HCG which will help the lining. We'll see.  

Anyhow, usually when you are called back and you de-pants it's only a minute or two before the doctor comes in. My clinic is a pretty well-oiled machine. However, today it took about 10-12 minutes before the doctor came in, and the room was unusually cold. My mind started to wander and I started trying to estimate how many times I have been twanded in my life. I'm estimating 33: 4 cycles of IVF x 6 twandings each on average, 2 diagnostic scans (one from my RE and one from a second opinion), 4 so far from this FET, and let's say 3 from Femara monitoring or miscellaneous. I am sure I am nowhere near the record for lifetime twandings, but I wonder what it is? ",t2_pxlq3,False,,0,False,Twanding record?,[],r/infertility,False,0,,0,,,False,t3_4ng09g,False,dark,0.91,,public,8,0,{},,,False,[],,False,False,,{},,False,8,,False,self,False,,[],{},,True,,1465589785.0,text,0,,,text,self.infertility,False,"<!-- SC_OFF --><div class=""md""><p>I&#39;m still toiling away with daily visits to the RE to check my lining and labs for this FET. My lining is only an 8 and they prefer 10, my lead follicle is 23 mm and ready to pop at any minute, but depending on my labs they may just have me trigger with HCG which will help the lining. We&#39;ll see.  </p>

<p>Anyhow, usually when you are called back and you de-pants it&#39;s only a minute or two before the doctor comes in. My clinic is a pretty well-oiled machine. However, today it took about 10-12 minutes before the doctor came in, and the room was unusually cold. My mind started to wander and I started trying to estimate how many times I have been twanded in my life. I&#39;m estimating 33: 4 cycles of IVF x 6 twandings each on average, 2 diagnostic scans (one from my RE and one from a second opinion), 4 so far from this FET, and let&#39;s say 3 from Femara monitoring or miscellaneous. I am sure I am nowhere near the record for lifetime twandings, but I wonder what it is? </p>
</div><!-- SC_ON -->",,,,,True,False,False,False,False,[],[],False,False,False,False,"38F TTC 5 yrs, recurrent implantation failure",[],False,,,,t5_2saej,,,,4ng09g,True,,PhillyGrrl,,30,True,no_ads,False,[],False,dark,/r/infertility/comments/4ng09g/twanding_record/,no_ads,False,https://www.reddit.com/r/infertility/comments/4ng09g/twanding_record/,25375,1465560985.0,0,,False,False,{},,
227,2048,confidence,<praw.reddit.Reddit object at 0x7f2244aead90>,,infertility,[deleted],,False,,0,False,Finally a BFP after FET. Hcg questions and concerns?,[],r/infertility,False,0,,0,,,False,t3_4nfrt5,False,dark,0.29,,public,0,0,{},,,False,[],,False,False,,{},,False,0,,,default,False,,,{},,True,,1465585178.0,text,0,,,,self.infertility,False,"<!-- SC_OFF --><div class=""md""><p>[deleted]</p>
</div><!-- SC_ON -->",,,,,True,True,False,False,False,[],[],False,False,False,False,,[],False,,,,t5_2saej,,,,4nfrt5,False,,,,3,True,no_ads,False,[],,dark,/r/infertility/comments/4nfrt5/finally_a_bfp_after_fet_hcg_questions_and_concerns/,no_ads,False,https://www.reddit.com/r/infertility/comments/4nfrt5/finally_a_bfp_after_fet_hcg_questions_and_concerns/,25375,1465556378.0,0,,False,False,{},,
228,2048,confidence,<praw.reddit.Reddit object at 0x7f2244aead90>,,infertility,"Use this thread to share anything not necessarily related to infertility. Rant or rave, bitch, moan, share something funny, anything goes!",t2_6l4z3,False,,0,False,Friday Off Topic Thread,[],r/infertility,False,0,,0,,,False,t3_4nfm4j,False,dark,0.8,,public,3,0,{},,,False,[],,False,False,,{},,False,3,,True,self,False,,[],{},,True,,1465581763.0,text,0,,,text,self.infertility,False,"<!-- SC_OFF --><div class=""md""><p>Use this thread to share anything not necessarily related to infertility. Rant or rave, bitch, moan, share something funny, anything goes!</p>
</div><!-- SC_ON -->",,,,,True,False,False,False,False,[],[],False,False,False,False,,[],False,,,moderator,t5_2saej,,,,4nfm4j,True,,AutoModerator,,271,False,no_ads,False,[],False,,/r/infertility/comments/4nfm4j/friday_off_topic_thread/,no_ads,False,https://www.reddit.com/r/infertility/comments/4nfm4j/friday_off_topic_thread/,25375,1465552963.0,0,,False,False,{},,
229,2048,confidence,<praw.reddit.Reddit object at 0x7f2244aead90>,,infertility,"After having two cycles cancelled, I finally have made it to egg pickup stage! Next Tuesday I get to go under anesthetic!

I have eight follicles that look promising.

To be honest, I was convinced that this cycle was a goner too. I saw the fertility counsellor associated with my clinic on Tuesday, who told me that she thought my RE was always too optimistic and that having two cycles in a row cancelled must mean there was something wrong.

So there's a lot of excitement, a lot of fear, a lot of oh my god this is going to cost how much?, and a whole lot of uncertainty.

Wish me luck!",t2_g82z2,False,,0,False,First egg retrieval on Tuesday- excited and scared!,[],r/infertility,False,0,,0,,,False,t3_4nfh8p,False,dark,0.86,,public,5,0,{},,d70f54ce-930e-11e4-8710-22000b26873e,False,[],,False,False,,{},,False,5,,False,self,False,,[],{},,True,,1465578582.0,text,0,,,text,self.infertility,False,"<!-- SC_OFF --><div class=""md""><p>After having two cycles cancelled, I finally have made it to egg pickup stage! Next Tuesday I get to go under anesthetic!</p>

<p>I have eight follicles that look promising.</p>

<p>To be honest, I was convinced that this cycle was a goner too. I saw the fertility counsellor associated with my clinic on Tuesday, who told me that she thought my RE was always too optimistic and that having two cycles in a row cancelled must mean there was something wrong.</p>

<p>So there&#39;s a lot of excitement, a lot of fear, a lot of oh my god this is going to cost how much?, and a whole lot of uncertainty.</p>

<p>Wish me luck!</p>
</div><!-- SC_ON -->",,,,,True,False,False,False,False,[],[],False,False,False,False,"39, single, Aussie, 2 MCs, 1CP, close to retirement",[],False,,,,t5_2saej,,,,4nfh8p,True,,daybeforetheday,,7,True,no_ads,False,[],False,dark,/r/infertility/comments/4nfh8p/first_egg_retrieval_on_tuesday_excited_and_scared/,no_ads,False,https://www.reddit.com/r/infertility/comments/4nfh8p/first_egg_retrieval_on_tuesday_excited_and_scared/,25375,1465549782.0,0,,False,False,{},,
230,2048,confidence,<praw.reddit.Reddit object at 0x7f2244aead90>,,infertility,[deleted],,False,,0,False,"My first (and thus far, only) experience with an infertility clinic.",[],r/infertility,False,0,,0,,,False,t3_4nedqr,False,dark,0.5,,public,0,0,{},,,False,[],,False,False,,{},,False,0,,,default,1465529580.0,,,{},,True,,1465556208.0,text,0,,,,self.infertility,False,"<!-- SC_OFF --><div class=""md""><p>[deleted]</p>
</div><!-- SC_ON -->",,,,,True,True,False,False,False,[],[],False,False,False,False,,[],False,,,,t5_2saej,,,,4nedqr,False,,,,9,True,no_ads,False,[],,dark,/r/infertility/comments/4nedqr/my_first_and_thus_far_only_experience_with_an/,no_ads,False,https://www.reddit.com/r/infertility/comments/4nedqr/my_first_and_thus_far_only_experience_with_an/,25375,1465527408.0,0,,False,False,{},,
231,2048,confidence,<praw.reddit.Reddit object at 0x7f2244aead90>,,infertility,"I had my baseline today. The nurse called me this afternoon to tell me my FSH was 13, they would like to see it under 10, my AFC is 10, they would like to see greater than 10, my Estrogen was normal (60s?). I was so frustrated by the way she said the normals, it was as if I could change it if I tried harder. Sorry lady, my ovaries are lacking on the eggs, we know this, my RE seems to not care at all, so I'm trying to go with it as well. 

Also weird is she was very adamant about me getting my trigger shot filled by my next appointment, which is Tuesday. Last time they didn't have me come in again until CD10, this will be CD8. I didn't trigger before until CD15. I'm doing a natural cycle with trigger shot, but this just seems weird to me right now.",t2_vfhv2,False,,0,False,We're on our way for IUI #1,[],r/infertility,False,0,,0,,,False,t3_4ne7hc,False,dark,0.81,,public,3,0,{},,d70f54ce-930e-11e4-8710-22000b26873e,False,[],,False,False,,{},,False,3,,False,self,False,,[],{},,True,,1465553433.0,text,0,,,text,self.infertility,False,"<!-- SC_OFF --><div class=""md""><p>I had my baseline today. The nurse called me this afternoon to tell me my FSH was 13, they would like to see it under 10, my AFC is 10, they would like to see greater than 10, my Estrogen was normal (60s?). I was so frustrated by the way she said the normals, it was as if I could change it if I tried harder. Sorry lady, my ovaries are lacking on the eggs, we know this, my RE seems to not care at all, so I&#39;m trying to go with it as well. </p>

<p>Also weird is she was very adamant about me getting my trigger shot filled by my next appointment, which is Tuesday. Last time they didn&#39;t have me come in again until CD10, this will be CD8. I didn&#39;t trigger before until CD15. I&#39;m doing a natural cycle with trigger shot, but this just seems weird to me right now.</p>
</div><!-- SC_ON -->",,,,,True,False,False,False,False,[],[],False,False,False,False,"36F|DOR|failed IUI, failed IVF, moving to DE",[],False,,,,t5_2saej,,,,4ne7hc,True,,JessieBooBoo,,3,True,no_ads,False,[],False,dark,/r/infertility/comments/4ne7hc/were_on_our_way_for_iui_1/,no_ads,False,https://www.reddit.com/r/infertility/comments/4ne7hc/were_on_our_way_for_iui_1/,25375,1465524633.0,0,,False,False,{},,
