76,2048,confidence,<praw.reddit.Reddit object at 0x7f2244aead90>,,infertility,"When we first had our WTF appointment after our 4th failed IUI, the Dr. recommended two-cycle IVF because he felt I wouldn't produce a whole lot of follicles/eggs in one cycle. We were on board with that. We got our pricing for IVF + retrieval + misc. ($14,600 with PGS and $10,200 without PGS).

I understood 2-cycle IVF to be a month of stims/retrieval, one month off, 2nd month of stims/retrieval and then FET. We could store any (hopefully) left over embryos.

Anyway, I realized the pricing given to us only included one anesthesia fee, thus making it only for one retrieval. I emailed financial and asked them how much a ""two-cycle IVF"" would cost (as we are interested in banking embryos for later use). 

The response emailed back was ""Two-cycle batching would be $24,250.00."" There was no itemized list provided.

My initial reaction is WTF?! Why is it more than double?! And so before I email back in my frustrated state and before I say something I regret to them or make myself look stupid... I just want to know, is two cycle batching the same thing as two cycle IVF? Is this a normal price?",t2_hktpl,False,,0,False,What is 2-cycle batching?,[],r/infertility,False,0,,0,,,False,t3_4p2cw9,False,dark,1.0,,public,2,0,{},,,False,[],,False,False,,{},,False,2,,False,self,False,,[],{},,True,,1466504550.0,text,0,,,text,self.infertility,False,"<!-- SC_OFF --><div class=""md""><p>When we first had our WTF appointment after our 4th failed IUI, the Dr. recommended two-cycle IVF because he felt I wouldn&#39;t produce a whole lot of follicles/eggs in one cycle. We were on board with that. We got our pricing for IVF + retrieval + misc. ($14,600 with PGS and $10,200 without PGS).</p>

<p>I understood 2-cycle IVF to be a month of stims/retrieval, one month off, 2nd month of stims/retrieval and then FET. We could store any (hopefully) left over embryos.</p>

<p>Anyway, I realized the pricing given to us only included one anesthesia fee, thus making it only for one retrieval. I emailed financial and asked them how much a &quot;two-cycle IVF&quot; would cost (as we are interested in banking embryos for later use). </p>

<p>The response emailed back was &quot;Two-cycle batching would be $24,250.00.&quot; There was no itemized list provided.</p>

<p>My initial reaction is WTF?! Why is it more than double?! And so before I email back in my frustrated state and before I say something I regret to them or make myself look stupid... I just want to know, is two cycle batching the same thing as two cycle IVF? Is this a normal price?</p>
</div><!-- SC_ON -->",,,,,True,False,False,False,False,[],[],False,False,False,False,"34f, unexplained",[],False,,,,t5_2saej,,,,4p2cw9,True,,tiredone905,,5,False,no_ads,False,[],False,dark,/r/infertility/comments/4p2cw9/what_is_2cycle_batching/,no_ads,False,https://www.reddit.com/r/infertility/comments/4p2cw9/what_is_2cycle_batching/,25375,1466475750.0,0,,False,False,{},,
77,2048,confidence,<praw.reddit.Reddit object at 0x7f2244aead90>,,infertility,[deleted],,False,,0,False,Chat,[],r/infertility,False,0,,0,,,False,t3_4p278a,False,dark,1.0,,public,1,0,{},,,False,[],,False,False,,{},,False,1,,,default,False,,,{},,True,,1466502267.0,text,0,,,,self.infertility,False,"<!-- SC_OFF --><div class=""md""><p>[deleted]</p>
</div><!-- SC_ON -->",,,,,True,True,False,False,False,[],[],False,False,False,False,,[],False,,,,t5_2saej,,,,4p278a,False,,,,0,True,no_ads,False,[],,dark,/r/infertility/comments/4p278a/chat/,no_ads,False,https://www.reddit.com/r/infertility/comments/4p278a/chat/,25375,1466473467.0,0,,False,False,{},,
78,2048,confidence,<praw.reddit.Reddit object at 0x7f2244aead90>,,infertility,"Several time, I have called my insurance, and specifically verified that my marital status is not a barrier to coverage.  *Several* times.  And today, I get a letter specifically denying coverage of IF treatment because I'm not married.  Fuck every last person at BCBS.  Fuck whoever there thinks they can be the morality police.  And fuck having to wait till they open tomorrow to call and get some answers.",t2_irpgz,False,,0,False,Fuck insurance.,[],r/infertility,False,0,,0,,,False,t3_4p25yu,False,dark,0.78,,public,5,0,{},,d70f54ce-930e-11e4-8710-22000b26873e,False,[],,False,False,,{},Blind Rage,False,5,,False,self,False,,[],{},,True,,1466501754.0,text,0,,,text,self.infertility,True,"<!-- SC_OFF --><div class=""md""><p>Several time, I have called my insurance, and specifically verified that my marital status is not a barrier to coverage.  <em>Several</em> times.  And today, I get a letter specifically denying coverage of IF treatment because I&#39;m not married.  Fuck every last person at BCBS.  Fuck whoever there thinks they can be the morality police.  And fuck having to wait till they open tomorrow to call and get some answers.</p>
</div><!-- SC_ON -->",,,,,True,False,False,False,False,[],[],False,False,False,False,TTC: Oct '14 | Unexp | 2IUI | IVF 1ER 1Xfer ,[],False,,,,t5_2saej,,,,4p25yu,True,,hockeypup,,22,True,no_ads,False,[],False,dark,/r/infertility/comments/4p25yu/fuck_insurance/,no_ads,False,https://www.reddit.com/r/infertility/comments/4p25yu/fuck_insurance/,25375,1466472954.0,0,,False,False,{},,
79,2048,confidence,<praw.reddit.Reddit object at 0x7f2244aead90>,,infertility,"Fuck MFI. Fuck an economy and a lack of medical coverage for IF that this afternoon has made me and my husband ever having a science baby a confirmed casino jackpot of chance. Fuck everyone who sneezes and gets pregnant. Fuck the way I have become defined and isolated by a condition that is not my fault. Fuck letting go of my dreams. Fuck the lack of control over adopting. Fuck crying on overstuffed trains with no air conditioning that are stalled for like the third time today. Fuck everyone who laid us off and lied about helping us get work and withheld paychecks over the last six years. Fuck how many beautiful people on this forum suffer and deserve to be parents while alleged human creatures get to pump unwanted kids out like cotton candy. Fuck having to console my wonderful, miserable husband who doesn't deserve this when I get home, when all I want to do is scream and punch in walls and go far away and forget babies exist. Fuck all of it with a rabid, fiery rake.

Thank you.

ETA: I can't believe I forgot the biggest stars of this whole  thing! An extra-special, rancid fuck-you to the doctors who ignored our concerns and let us fall through the cracks time and time again. Not only did your commitment to not giving a damn shake my beliefs about health care, but also my beliefs about humanity.",t2_tg9w7,False,,0,False,"And now, a gentle soliloquy. (Spoiler alert: it's not gentle.) (NSFW language)",[],r/infertility,False,0,,0,,,False,t3_4p1z3d,False,dark,0.96,,public,25,0,{},,,False,[],,False,False,,{},,False,25,,False,nsfw,1466541999.0,,[],{},,True,,1466498922.0,text,0,,,text,self.infertility,False,"<!-- SC_OFF --><div class=""md""><p>Fuck MFI. Fuck an economy and a lack of medical coverage for IF that this afternoon has made me and my husband ever having a science baby a confirmed casino jackpot of chance. Fuck everyone who sneezes and gets pregnant. Fuck the way I have become defined and isolated by a condition that is not my fault. Fuck letting go of my dreams. Fuck the lack of control over adopting. Fuck crying on overstuffed trains with no air conditioning that are stalled for like the third time today. Fuck everyone who laid us off and lied about helping us get work and withheld paychecks over the last six years. Fuck how many beautiful people on this forum suffer and deserve to be parents while alleged human creatures get to pump unwanted kids out like cotton candy. Fuck having to console my wonderful, miserable husband who doesn&#39;t deserve this when I get home, when all I want to do is scream and punch in walls and go far away and forget babies exist. Fuck all of it with a rabid, fiery rake.</p>

<p>Thank you.</p>

<p>ETA: I can&#39;t believe I forgot the biggest stars of this whole  thing! An extra-special, rancid fuck-you to the doctors who ignored our concerns and let us fall through the cracks time and time again. Not only did your commitment to not giving a damn shake my beliefs about health care, but also my beliefs about humanity.</p>
</div><!-- SC_ON -->",,,,,True,False,False,False,True,[],[],False,False,False,False,"MFI, TTC #1 since 2010, low AMH/Prog, ""mature"" ugh",[],False,,,,t5_2saej,,,,4p1z3d,True,,crystalclearcanvas,,28,True,no_ads,False,[],False,dark,/r/infertility/comments/4p1z3d/and_now_a_gentle_soliloquy_spoiler_alert_its_not/,no_ads,False,https://www.reddit.com/r/infertility/comments/4p1z3d/and_now_a_gentle_soliloquy_spoiler_alert_its_not/,25375,1466470122.0,0,,False,False,{},,
80,2048,confidence,<praw.reddit.Reddit object at 0x7f2244aead90>,,infertility,[deleted],,False,,0,False,"And now, a gentle soliloquy. (Spoiler: It's not gentle.)",[],r/infertility,False,0,,0,,,False,t3_4p1xl2,False,dark,1.0,,public,1,0,{},,,False,[],,False,False,,{},,False,1,,,default,False,,,{},,True,,1466498298.0,text,0,,,,self.infertility,False,"<!-- SC_OFF --><div class=""md""><p>[deleted]</p>
</div><!-- SC_ON -->",,,,,True,True,False,False,False,[],[],False,False,False,False,,[],False,,,,t5_2saej,,,,4p1xl2,False,,,,0,True,no_ads,False,[],,dark,/r/infertility/comments/4p1xl2/and_now_a_gentle_soliloquy_spoiler_its_not_gentle/,no_ads,False,https://www.reddit.com/r/infertility/comments/4p1xl2/and_now_a_gentle_soliloquy_spoiler_its_not_gentle/,25375,1466469498.0,0,,False,False,{},,
81,2048,confidence,<praw.reddit.Reddit object at 0x7f2244aead90>,,infertility,"Hey everyone,

Just doing a quick intro since, like the title says, I guess I belong here now more than I belong over on /r/TryingForABaby.

I'm 28 and my husband is 31. We've been TTC#1 now since January 2015 and ""actively"" TTC (temping, charting, OPKs, checking cm/cervical position and all that) since August 2015. So not quite a year of ""actively"" trying just yet. Since we started TTC we've had 4 early losses. At this point I'm just waiting for my RE consult July 5th where I'll hopefully get the ball rolling on IF/RPL testing.

I was going to wait till I'd seen the RE and hopefully gotten to a diagnosis before I posted here. I keep feeling like I'm jumping the gun a little on moving over to /r/infertility since I don't have an official IF diagnosis and since I haven't started testing/treatment yet I don't really understand what the ladies here are going through just yet. So if I'm posting this too soon and I should wait longer before joining this community please feel free to tell me that! And if that is the case I'll just lurk for now and learn what I can about everything coming up with testing and such.",t2_ppci0,False,,0,False,I guess I belong here now,[],r/infertility,False,0,,0,,,False,t3_4p0hr8,False,dark,0.82,,public,11,0,{},,,False,[],,False,False,,{},,False,11,,False,self,False,,[],{},,True,,1466479506.0,text,0,,,text,self.infertility,False,"<!-- SC_OFF --><div class=""md""><p>Hey everyone,</p>

<p>Just doing a quick intro since, like the title says, I guess I belong here now more than I belong over on <a href=""/r/TryingForABaby"">/r/TryingForABaby</a>.</p>

<p>I&#39;m 28 and my husband is 31. We&#39;ve been TTC#1 now since January 2015 and &quot;actively&quot; TTC (temping, charting, OPKs, checking cm/cervical position and all that) since August 2015. So not quite a year of &quot;actively&quot; trying just yet. Since we started TTC we&#39;ve had 4 early losses. At this point I&#39;m just waiting for my RE consult July 5th where I&#39;ll hopefully get the ball rolling on IF/RPL testing.</p>

<p>I was going to wait till I&#39;d seen the RE and hopefully gotten to a diagnosis before I posted here. I keep feeling like I&#39;m jumping the gun a little on moving over to <a href=""/r/infertility"">/r/infertility</a> since I don&#39;t have an official IF diagnosis and since I haven&#39;t started testing/treatment yet I don&#39;t really understand what the ladies here are going through just yet. So if I&#39;m posting this too soon and I should wait longer before joining this community please feel free to tell me that! And if that is the case I&#39;ll just lurk for now and learn what I can about everything coming up with testing and such.</p>
</div><!-- SC_ON -->",,,,,True,False,False,False,False,[],[],False,False,False,False,28 | TTC#1 1/2015. | RPL | Endo | APS | MTHFR | Hypothyroidism,[],False,,,,t5_2saej,,,,4p0hr8,True,,whenwillthewaitend,,31,True,no_ads,False,[],False,dark,/r/infertility/comments/4p0hr8/i_guess_i_belong_here_now/,no_ads,False,https://www.reddit.com/r/infertility/comments/4p0hr8/i_guess_i_belong_here_now/,25375,1466450706.0,0,,False,False,{},,
82,2048,confidence,<praw.reddit.Reddit object at 0x7f2244aead90>,,infertility,"So, I'm two weeks into birth control at the top of my antagonist protocol for IVF w/ICSI.  I have a few more days on it and then my RE wants me to stop and wait for my period.  Now, he said that the purpose of BCP was to rest my ovaries for the overstimulation shitstorm (not his words) to come.  I have experienced bigger, sore breasts, LOTS of cervical fluid during my normal fertile period (CD11-16), and today I can feel both my ovaries being sore as well.  Last week I went in for a twatwanding and he said my ovaries were strong willed and I had follicles (or a follicle, I can't remember).  I go back in on Wednesday morning for another twatwanding to see if everything is ""quiet"".  I'm afraid my strong willed ovaries are not chilling the fuck out like they should.  I begin stimming injections on Saturday.

My question to those who have used BCP to start their IVF cycle:

Does anything I'm describing sound normal and could I still be able to proceed?  What if, despite BCP, my body didn't calm down enough?  Can anyone relate?  Am I freaking out over nothing?  Dr. Google has all kinds of varying answers.....",t2_x79zq,False,,0,False,Questions about BCP,[],r/infertility,False,0,,0,,,False,t3_4p0hgs,False,dark,1.0,,public,3,0,{},,d70f54ce-930e-11e4-8710-22000b26873e,False,[],,False,False,,{},,False,3,,False,self,False,,[],{},,True,,1466479404.0,text,0,,,text,self.infertility,False,"<!-- SC_OFF --><div class=""md""><p>So, I&#39;m two weeks into birth control at the top of my antagonist protocol for IVF w/ICSI.  I have a few more days on it and then my RE wants me to stop and wait for my period.  Now, he said that the purpose of BCP was to rest my ovaries for the overstimulation shitstorm (not his words) to come.  I have experienced bigger, sore breasts, LOTS of cervical fluid during my normal fertile period (CD11-16), and today I can feel both my ovaries being sore as well.  Last week I went in for a twatwanding and he said my ovaries were strong willed and I had follicles (or a follicle, I can&#39;t remember).  I go back in on Wednesday morning for another twatwanding to see if everything is &quot;quiet&quot;.  I&#39;m afraid my strong willed ovaries are not chilling the fuck out like they should.  I begin stimming injections on Saturday.</p>

<p>My question to those who have used BCP to start their IVF cycle:</p>

<p>Does anything I&#39;m describing sound normal and could I still be able to proceed?  What if, despite BCP, my body didn&#39;t calm down enough?  Can anyone relate?  Am I freaking out over nothing?  Dr. Google has all kinds of varying answers.....</p>
</div><!-- SC_ON -->",,,,,True,False,False,False,False,[],[],False,False,False,False,"36F, MFI, Clomid+IUI (Fail) IVF+ICSI, 4 FETs, 2 MCs",[],False,,,,t5_2saej,,,,4p0hgs,True,,ImHereReluctantly,,2,True,no_ads,False,[],False,dark,/r/infertility/comments/4p0hgs/questions_about_bcp/,no_ads,False,https://www.reddit.com/r/infertility/comments/4p0hgs/questions_about_bcp/,25375,1466450604.0,0,,False,False,{},,
83,2048,confidence,<praw.reddit.Reddit object at 0x7f2244aead90>,,infertility,"For those who saw my previous post, I'm sad to report that 15 days maxed out on Estrace (4 mg/ 3 times per day vaginally) did NOTHING for my lining. Less than nothing, actually - my triple stripe was gone and I had fluid in my uterus. 

I am now on provera to bring on my period  and the next cycle will be letrozole/femara plus low-dose stims, with cetrotide to inhibit ovulation and HSG to trigger.

This doesn't seem to be a very common protocol, but my ""best"" linings (6mm) have been with letrozole. 

If anyone has experience with this protocol, I would love to hear how you did!

Thanks for sharing.

EDIT: This is for a frozen embroyo transfer - specifically to get my lining to a decent number. We will not be doing an egg retrieval, IUI or timed intercourse.
",,False,,0,False,thin lining - new protocol! Letrozole/femara + injectables,[],r/infertility,False,0,,0,,,False,t3_4p08d4,False,dark,1.0,,public,1,0,{},,,False,[],,False,False,,{},,False,1,,,self,1466456155.0,,,{},,True,,1466476460.0,text,0,,,,self.infertility,False,"<!-- SC_OFF --><div class=""md""><p>For those who saw my previous post, I&#39;m sad to report that 15 days maxed out on Estrace (4 mg/ 3 times per day vaginally) did NOTHING for my lining. Less than nothing, actually - my triple stripe was gone and I had fluid in my uterus. </p>

<p>I am now on provera to bring on my period  and the next cycle will be letrozole/femara plus low-dose stims, with cetrotide to inhibit ovulation and HSG to trigger.</p>

<p>This doesn&#39;t seem to be a very common protocol, but my &quot;best&quot; linings (6mm) have been with letrozole. </p>

<p>If anyone has experience with this protocol, I would love to hear how you did!</p>

<p>Thanks for sharing.</p>

<p>EDIT: This is for a frozen embroyo transfer - specifically to get my lining to a decent number. We will not be doing an egg retrieval, IUI or timed intercourse.</p>
</div><!-- SC_ON -->",,,,,True,True,False,False,False,[],[],False,False,False,False,,[],False,,,,t5_2saej,,,,4p08d4,True,,,,11,True,no_ads,False,[],,dark,/r/infertility/comments/4p08d4/thin_lining_new_protocol_letrozolefemara/,no_ads,False,https://www.reddit.com/r/infertility/comments/4p08d4/thin_lining_new_protocol_letrozolefemara/,25375,1466447660.0,0,,False,False,{},,
84,2048,confidence,<praw.reddit.Reddit object at 0x7f2244aead90>,,infertility,"I was thinking I could just chill this week and not worry, now that stimming is over and IUI has been done.

Nope.

Can't test out the trigger like I thought, because according to my nurse it only stays in your system for 36 hours.  Plus, it looks like my HPTs are counterfeit, so I've ordered more (and left a bad review on Amazon for the ones I previously bought - including pictures that don't match the pictures the seller posted).

So, please, someone talk me down.

My pre-trigger Estrogen was 700, so that's good, right?  And, surely, failed triggers are pretty rare?  

It's going to be a long two weeks...

Edit: Why the downvote? :(",t2_irpgz,False,,0,False,Losing my mind!,[],r/infertility,False,0,,0,,,False,t3_4p066x,False,dark,0.83,,public,4,0,{},,d70f54ce-930e-11e4-8710-22000b26873e,False,[],,False,False,,{},,False,4,,False,self,1466452202.0,,[],{},,True,,1466475749.0,text,0,,,text,self.infertility,False,"<!-- SC_OFF --><div class=""md""><p>I was thinking I could just chill this week and not worry, now that stimming is over and IUI has been done.</p>

<p>Nope.</p>

<p>Can&#39;t test out the trigger like I thought, because according to my nurse it only stays in your system for 36 hours.  Plus, it looks like my HPTs are counterfeit, so I&#39;ve ordered more (and left a bad review on Amazon for the ones I previously bought - including pictures that don&#39;t match the pictures the seller posted).</p>

<p>So, please, someone talk me down.</p>

<p>My pre-trigger Estrogen was 700, so that&#39;s good, right?  And, surely, failed triggers are pretty rare?  </p>

<p>It&#39;s going to be a long two weeks...</p>

<p>Edit: Why the downvote? :(</p>
</div><!-- SC_ON -->",,,,,True,False,False,False,False,[],[],False,False,False,False,TTC: Oct '14 | Unexp | 2IUI | IVF 1ER 1Xfer ,[],False,,,,t5_2saej,,,,4p066x,True,,hockeypup,,10,True,no_ads,False,[],False,dark,/r/infertility/comments/4p066x/losing_my_mind/,no_ads,False,https://www.reddit.com/r/infertility/comments/4p066x/losing_my_mind/,25375,1466446949.0,0,,False,False,{},,
85,2048,confidence,<praw.reddit.Reddit object at 0x7f2244aead90>,,infertility,"I just left my first IVF monitoring after 4 days of stims. Gonal-f 300 the fist two days then added in 75 of menopur the next two days. I only had 6 tiny - ass follicles. How many did you have? When I was doing the injectable cycle, I had twice as many follicles and they were bugger after only 3 days of 150 Gonal-f. 

WTF?",t2_kl9je,False,,0,False,How many follicles at your first IVF monitoring?,[],r/infertility,False,0,,0,,,False,t3_4ozycz,False,dark,0.81,,public,3,0,{},,,False,[],,False,False,,{},,False,3,,False,self,False,,[],{},,True,,1466473280.0,text,0,,,text,self.infertility,True,"<!-- SC_OFF --><div class=""md""><p>I just left my first IVF monitoring after 4 days of stims. Gonal-f 300 the fist two days then added in 75 of menopur the next two days. I only had 6 tiny - ass follicles. How many did you have? When I was doing the injectable cycle, I had twice as many follicles and they were bugger after only 3 days of 150 Gonal-f. </p>

<p>WTF?</p>
</div><!-- SC_ON -->",,,,,True,False,False,False,False,[],[],False,False,False,False,Endo|DOR|Barren Bitch|Senior Class,[],False,,,,t5_2saej,,,,4ozycz,True,,LadyLatitude,,65,True,no_ads,False,[],False,dark,/r/infertility/comments/4ozycz/how_many_follicles_at_your_first_ivf_monitoring/,no_ads,False,https://www.reddit.com/r/infertility/comments/4ozycz/how_many_follicles_at_your_first_ivf_monitoring/,25375,1466444480.0,0,,False,False,{},,
86,2048,confidence,<praw.reddit.Reddit object at 0x7f2244aead90>,,infertility,"I'm posting this again because I don't want a few people to show up this weekend when several of us have to back out.

I made a poll on doodle [here](http://doodle.com/poll/m6dgyh6yqi6rqwvm) to try to figure out when the best time is.

Also suggested was an earlier morning, maybe we can do breakfast? I'm not going to change the poll because there's already so many options, but maybe we can pick a day that morning works for most people and move it up to 9 instead of 11?

Edit: ok, I deleted all the tags, since they're apparently not working anyway.
How does everyone feel about Sunday August 7th at 9am for breakfast... somewhere? That looks like it's the first day that everyone who has filled it out has said they can make it.",t2_vfhv2,False,,0,False,Chicago meetup change,[],r/infertility,False,0,,0,,,False,t3_4ozjjh,False,dark,1.0,,public,3,0,{},,d70f54ce-930e-11e4-8710-22000b26873e,False,[],,False,False,,{},,False,3,,False,self,1466453577.0,,[],{},,True,,1466468449.0,text,0,,,text,self.infertility,False,"<!-- SC_OFF --><div class=""md""><p>I&#39;m posting this again because I don&#39;t want a few people to show up this weekend when several of us have to back out.</p>

<p>I made a poll on doodle <a href=""http://doodle.com/poll/m6dgyh6yqi6rqwvm"">here</a> to try to figure out when the best time is.</p>

<p>Also suggested was an earlier morning, maybe we can do breakfast? I&#39;m not going to change the poll because there&#39;s already so many options, but maybe we can pick a day that morning works for most people and move it up to 9 instead of 11?</p>

<p>Edit: ok, I deleted all the tags, since they&#39;re apparently not working anyway.
How does everyone feel about Sunday August 7th at 9am for breakfast... somewhere? That looks like it&#39;s the first day that everyone who has filled it out has said they can make it.</p>
</div><!-- SC_ON -->",,,,,True,False,False,False,False,[],[],False,False,False,False,"36F|DOR|failed IUI, failed IVF, moving to DE",[],False,,,,t5_2saej,,,,4ozjjh,True,,JessieBooBoo,,8,True,no_ads,False,[],False,dark,/r/infertility/comments/4ozjjh/chicago_meetup_change/,no_ads,False,https://www.reddit.com/r/infertility/comments/4ozjjh/chicago_meetup_change/,25375,1466439649.0,0,,False,False,{},self,"{'images': [{'source': {'url': 'https://external-preview.redd.it/KW64v-7UHn_SOaxPx60dKLp_4yePm8Bw7E2lmSDOT2o.jpg?auto=webp&s=07552c75d0b11b08acbb723a84066e29c8decb40', 'width': 300, 'height': 200}, 'resolutions': [{'url': 'https://external-preview.redd.it/KW64v-7UHn_SOaxPx60dKLp_4yePm8Bw7E2lmSDOT2o.jpg?width=108&crop=smart&auto=webp&s=1f1ff89d08650f9085ec9d995acb3086156d0971', 'width': 108, 'height': 72}, {'url': 'https://external-preview.redd.it/KW64v-7UHn_SOaxPx60dKLp_4yePm8Bw7E2lmSDOT2o.jpg?width=216&crop=smart&auto=webp&s=e290eefd78204afae5991e894577510c884c0daf', 'width': 216, 'height': 144}], 'variants': {}, 'id': '64Pacqoywiz0zndaN7otf2PcLyzMWpbk3OCbPUQj9xI'}], 'enabled': False}"
