,comment_limit,comment_sort,_reddit,approved_at_utc,subreddit,selftext,author_fullname,saved,mod_reason_title,gilded,clicked,title,link_flair_richtext,subreddit_name_prefixed,hidden,pwls,link_flair_css_class,downs,thumbnail_height,top_awarded_type,hide_score,name,quarantine,link_flair_text_color,upvote_ratio,author_flair_background_color,subreddit_type,ups,total_awards_received,media_embed,thumbnail_width,author_flair_template_id,is_original_content,user_reports,secure_media,is_reddit_media_domain,is_meta,category,secure_media_embed,link_flair_text,can_mod_post,score,approved_by,author_premium,thumbnail,edited,author_flair_css_class,author_flair_richtext,gildings,content_categories,is_self,mod_note,created,link_flair_type,wls,removed_by_category,banned_by,author_flair_type,domain,allow_live_comments,selftext_html,likes,suggested_sort,banned_at_utc,view_count,archived,no_follow,is_crosspostable,pinned,over_18,all_awardings,awarders,media_only,can_gild,spoiler,locked,author_flair_text,treatment_tags,visited,removed_by,num_reports,distinguished,subreddit_id,mod_reason_by,removal_reason,link_flair_background_color,id,is_robot_indexable,report_reasons,author,discussion_type,num_comments,send_replies,whitelist_status,contest_mode,mod_reports,author_patreon_flair,author_flair_text_color,permalink,parent_whitelist_status,stickied,url,subreddit_subscribers,created_utc,num_crossposts,media,is_video,_fetched,_comments_by_id,post_hint,preview
0,2048,confidence,<praw.reddit.Reddit object at 0x7f2244aead90>,,infertility,"I'm on my 8dp2dt and I'm running a 99.9Â° fever with sweats, chills and the worst headache I've ever had. I just took some extra-strength Tylenol.

Should I be worried? My bloodwork isn't until this Thurs (6/30). Should I call the on-cal Dr?

This is my first ET and 2nd IVF round - it's new territory. Thank you!

**Edit** I called on-call and he said to continue taking Tylenol. To not take any of my prescription migraine medicine or any type of sudefed. Then, if I still have it, go to the ER. So, I went to bed and I woke up with a headache. ðŸ˜“ The fever is gone but my head is just killing me. I'm going to call again and then see. Thank you!",t2_g594w,False,,0,False,Low-grade Fever post ET,[],r/infertility,False,0,,0,,,False,t3_4pu48u,False,dark,0.57,,public,1,0,{},,d70f54ce-930e-11e4-8710-22000b26873e,False,[],,False,False,,{},,False,1,,False,self,1466941230.0,,[],{},,True,,1466913675.0,text,0,,,text,self.infertility,False,"<!-- SC_OFF --><div class=""md""><p>I&#39;m on my 8dp2dt and I&#39;m running a 99.9Â° fever with sweats, chills and the worst headache I&#39;ve ever had. I just took some extra-strength Tylenol.</p>

<p>Should I be worried? My bloodwork isn&#39;t until this Thurs (6/30). Should I call the on-cal Dr?</p>

<p>This is my first ET and 2nd IVF round - it&#39;s new territory. Thank you!</p>

<p><strong>Edit</strong> I called on-call and he said to continue taking Tylenol. To not take any of my prescription migraine medicine or any type of sudefed. Then, if I still have it, go to the ER. So, I went to bed and I woke up with a headache. ðŸ˜“ The fever is gone but my head is just killing me. I&#39;m going to call again and then see. Thank you!</p>
</div><!-- SC_ON -->",,,,,True,True,False,False,False,[],[],False,False,False,False,"46, 5 IVF donor egg failed, at a loss",[],False,,,,t5_2saej,,,,4pu48u,True,,Chibicai,,5,True,no_ads,False,[],False,dark,/r/infertility/comments/4pu48u/lowgrade_fever_post_et/,no_ads,False,https://www.reddit.com/r/infertility/comments/4pu48u/lowgrade_fever_post_et/,25375,1466884875.0,0,,False,False,{},,
1,2048,confidence,<praw.reddit.Reddit object at 0x7f2244aead90>,,infertility,"Use this thread to share anything not necessarily related to infertility. Rant or rave, bitch, moan, share something funny, anything goes!",t2_6l4z3,False,,0,False,Saturday Off Topic Thread,[],r/infertility,False,0,,0,,,False,t3_4prx2f,False,dark,0.84,,public,4,0,{},,,False,[],,False,False,,{},,False,4,,True,self,False,,[],{},,True,,1466877758.0,text,0,,,text,self.infertility,False,"<!-- SC_OFF --><div class=""md""><p>Use this thread to share anything not necessarily related to infertility. Rant or rave, bitch, moan, share something funny, anything goes!</p>
</div><!-- SC_ON -->",,,,,True,False,False,False,False,[],[],False,False,False,False,,[],False,,,moderator,t5_2saej,,,,4prx2f,True,,AutoModerator,,155,False,no_ads,False,[],False,,/r/infertility/comments/4prx2f/saturday_off_topic_thread/,no_ads,False,https://www.reddit.com/r/infertility/comments/4prx2f/saturday_off_topic_thread/,25375,1466848958.0,0,,False,False,{},,
2,2048,confidence,<praw.reddit.Reddit object at 0x7f2244aead90>,,infertility,"After 6 unexplained losses (5 miscarriages and a stillbirth) I started 100mg of Clomid on CD3 and Estradoil on CD8.  On CD12, I had 3 follicles on my right ovary (sizes 26, 21 & 16) and one on my left (size 10). My husband and I had sex that evening and then again on CD14.  Plan is to continue our escapade for the next two days. OPKs have been all over the place, but I'm going to keep testing and hope to get a strong positive.

So, I guess I'm asking if our chances are good.  I have no problem getting pregnant, just can't keep a pregnancy going.  Is there anything else I can do to help to get a baby to stick?  As of today, my ovaries are very tender, so I'm hoping that is a good sign.",t2_cjbdg,False,,0,False,First time on Clomid (100mg),[],r/infertility,False,0,,0,,,False,t3_4pro1d,False,dark,0.67,,public,2,0,{},,,False,[],,False,False,,{},,False,2,,False,self,False,,[],{},,True,,1466871534.0,text,0,,,text,self.infertility,False,"<!-- SC_OFF --><div class=""md""><p>After 6 unexplained losses (5 miscarriages and a stillbirth) I started 100mg of Clomid on CD3 and Estradoil on CD8.  On CD12, I had 3 follicles on my right ovary (sizes 26, 21 &amp; 16) and one on my left (size 10). My husband and I had sex that evening and then again on CD14.  Plan is to continue our escapade for the next two days. OPKs have been all over the place, but I&#39;m going to keep testing and hope to get a strong positive.</p>

<p>So, I guess I&#39;m asking if our chances are good.  I have no problem getting pregnant, just can&#39;t keep a pregnancy going.  Is there anything else I can do to help to get a baby to stick?  As of today, my ovaries are very tender, so I&#39;m hoping that is a good sign.</p>
</div><!-- SC_ON -->",,,,,True,False,False,False,False,[],[],False,False,False,False,,[],False,,,,t5_2saej,,,,4pro1d,True,,chrislbraman,,5,True,no_ads,False,[],False,,/r/infertility/comments/4pro1d/first_time_on_clomid_100mg/,no_ads,False,https://www.reddit.com/r/infertility/comments/4pro1d/first_time_on_clomid_100mg/,25375,1466842734.0,0,,False,False,{},,
3,2048,confidence,<praw.reddit.Reddit object at 0x7f2244aead90>,,infertility,[removed],,False,,0,False,Who much have you spent so far on infertility issues if you will?,[],r/infertility,False,0,,0,,,False,t3_4prk3z,False,dark,1.0,,public,1,0,{},,,False,[],,False,False,,{},,False,1,,,default,False,,,{},,True,,1466868945.0,text,0,,,,self.infertility,False,"<!-- SC_OFF --><div class=""md""><p>[removed]</p>
</div><!-- SC_ON -->",,,,,True,True,False,False,False,[],[],False,False,False,False,,[],False,,,,t5_2saej,,,,4prk3z,False,,,,0,True,no_ads,False,[],,dark,/r/infertility/comments/4prk3z/who_much_have_you_spent_so_far_on_infertility/,no_ads,False,https://www.reddit.com/r/infertility/comments/4prk3z/who_much_have_you_spent_so_far_on_infertility/,25375,1466840145.0,0,,False,False,{},,
4,2048,confidence,<praw.reddit.Reddit object at 0x7f2244aead90>,,infertility,"We were called in at 8:00 AM on a Tuesaday for a transfer. My SO/wife and I came in at 7:45 AM and filled out the paperwork and were escorted to the OR waiting room so SO can change and I can put my ""Gown"" on. We sat there for 4 hours while my SO's Valium wore out and nobody came in to give us updates as to what was going on. I walked out, found a nurse and asked her to explain why we were waiting four hours without anyone giving us information on what is going on. The transfer took ten minutes after that. Awesome. We had a miscarriage six weeks later and had a follow up, with our RE and waited another hour and a half to talk to him about it for another ten minutes. Can you say we are insane mode. $153,000 in and at least no golden placards in our name above one of their doors inside the clinic.",t2_441zz,False,,0,False,What has the longest you and your SO waited for a procedure?,[],r/infertility,False,0,,0,,,False,t3_4pr9w3,False,dark,0.57,,public,1,0,{},,d70f54ce-930e-11e4-8710-22000b26873e,False,[],,False,False,,{},,False,1,,False,self,1466914674.0,,[],{},,True,,1466862910.0,text,0,,,text,self.infertility,False,"<!-- SC_OFF --><div class=""md""><p>We were called in at 8:00 AM on a Tuesaday for a transfer. My SO/wife and I came in at 7:45 AM and filled out the paperwork and were escorted to the OR waiting room so SO can change and I can put my &quot;Gown&quot; on. We sat there for 4 hours while my SO&#39;s Valium wore out and nobody came in to give us updates as to what was going on. I walked out, found a nurse and asked her to explain why we were waiting four hours without anyone giving us information on what is going on. The transfer took ten minutes after that. Awesome. We had a miscarriage six weeks later and had a follow up, with our RE and waited another hour and a half to talk to him about it for another ten minutes. Can you say we are insane mode. $153,000 in and at least no golden placards in our name above one of their doors inside the clinic.</p>
</div><!-- SC_ON -->",,,,,True,True,False,False,False,[],[],False,False,False,False,Husband . 46 12 IVF in and 4 miss.,[],False,,,,t5_2saej,,,,4pr9w3,True,,drew1111,,12,True,no_ads,False,[],False,dark,/r/infertility/comments/4pr9w3/what_has_the_longest_you_and_your_so_waited_for_a/,no_ads,False,https://www.reddit.com/r/infertility/comments/4pr9w3/what_has_the_longest_you_and_your_so_waited_for_a/,25375,1466834110.0,0,,False,False,{},,
5,2048,confidence,<praw.reddit.Reddit object at 0x7f2244aead90>,,infertility,"Throughout my childhood I was the victim of rape spanning anywhere from 5 - 14 years (I am unsure of when it all began). 
Post abuse I moved to the city to live with extended family and began a series of long term relationships where I had largely unprotected sex believing myself to be infertile, though never tested for it. 
Now in my early 20s I have met an incredible man who I have been with for some time and although we are unsure if we actually want children in our future I am beginning to wonder if I am infertile or wether I have just not gotten pregnant during the 10+ years of having unprotected sex.

Because I am unsure of wether I actually want to have children of my own given my upbringing and past trauma etc, I don't really want to spend a lot of money in tests trying to figure it all out

Health wise I am very healthy, eat a good diet of largely whole foods and for the majority have been alcohol and drug free- with the exception of smoking weed over the past year which I have since quit. Weight is within normal range, periods are regular and normal and ever since the abuse I have had regular tests for various women's issues and sexually transmitted illnesses of which I have never had any problems and have always been cleared on all accounts.

If anyone could give me any advice in this area it would be highly appreciated. Thank you in advanced for your time and goodluck to all those going through a tough time.",t2_ywuka,False,,0,False,(23F) Possibly infertile - rape victim,[],r/infertility,False,0,,0,,,False,t3_4pq4c5,False,dark,0.4,,public,0,0,{},,,False,[],,False,False,,{},,False,0,,False,self,False,,[],{},,True,,1466843462.0,text,0,,,text,self.infertility,False,"<!-- SC_OFF --><div class=""md""><p>Throughout my childhood I was the victim of rape spanning anywhere from 5 - 14 years (I am unsure of when it all began). 
Post abuse I moved to the city to live with extended family and began a series of long term relationships where I had largely unprotected sex believing myself to be infertile, though never tested for it. 
Now in my early 20s I have met an incredible man who I have been with for some time and although we are unsure if we actually want children in our future I am beginning to wonder if I am infertile or wether I have just not gotten pregnant during the 10+ years of having unprotected sex.</p>

<p>Because I am unsure of wether I actually want to have children of my own given my upbringing and past trauma etc, I don&#39;t really want to spend a lot of money in tests trying to figure it all out</p>

<p>Health wise I am very healthy, eat a good diet of largely whole foods and for the majority have been alcohol and drug free- with the exception of smoking weed over the past year which I have since quit. Weight is within normal range, periods are regular and normal and ever since the abuse I have had regular tests for various women&#39;s issues and sexually transmitted illnesses of which I have never had any problems and have always been cleared on all accounts.</p>

<p>If anyone could give me any advice in this area it would be highly appreciated. Thank you in advanced for your time and goodluck to all those going through a tough time.</p>
</div><!-- SC_ON -->",,,,,True,True,False,False,False,[],[],False,False,False,False,,[],False,,,,t5_2saej,,,,4pq4c5,True,,RainShallPass,,5,True,no_ads,False,[],False,,/r/infertility/comments/4pq4c5/23f_possibly_infertile_rape_victim/,no_ads,False,https://www.reddit.com/r/infertility/comments/4pq4c5/23f_possibly_infertile_rape_victim/,25375,1466814662.0,0,,False,False,{},,
6,2048,confidence,<praw.reddit.Reddit object at 0x7f2244aead90>,,infertility,"Hi! Longtime reddit lurker, but this is my first post here. My husband and I have been TTC for right at 2 years now. I had my third IUI this week, and am now in that weird ""maybe pregnant/maybe not"" limbo for 10 more days. I was diagnosed with PCOS last summer, and have been taking Femara and Pregnyl trigger shots, but no luck so far. Just wanted to introduce myself and say hi! ",t2_wja3n,False,,0,False,New(ish),[],r/infertility,False,0,,0,,,False,t3_4ppww7,False,dark,1.0,,public,3,0,{},,,False,[],,False,False,,{},,False,3,,False,self,1466820972.0,,[],{},,True,,1466840452.0,text,0,,,text,self.infertility,False,"<!-- SC_OFF --><div class=""md""><p>Hi! Longtime reddit lurker, but this is my first post here. My husband and I have been TTC for right at 2 years now. I had my third IUI this week, and am now in that weird &quot;maybe pregnant/maybe not&quot; limbo for 10 more days. I was diagnosed with PCOS last summer, and have been taking Femara and Pregnyl trigger shots, but no luck so far. Just wanted to introduce myself and say hi! </p>
</div><!-- SC_ON -->",,,,,True,False,False,False,False,[],[],False,False,False,False,28F | unexplained | TTC since 6/14 | 5 IUIs | 1 IVF | FET Jan 23,[],False,,,,t5_2saej,,,,4ppww7,True,,tarheelteacher,,10,True,no_ads,False,[],False,dark,/r/infertility/comments/4ppww7/newish/,no_ads,False,https://www.reddit.com/r/infertility/comments/4ppww7/newish/,25375,1466811652.0,0,,False,False,{},,
7,2048,confidence,<praw.reddit.Reddit object at 0x7f2244aead90>,,infertility,What was good this week? What was bad?,t2_6l4z3,False,,0,False,Pros and Cons,[],r/infertility,False,0,,0,,,False,t3_4pphcp,False,dark,0.75,,public,2,0,{},,,False,[],,False,False,,{},,False,2,,True,self,False,,[],{},,True,,1466834542.0,text,0,,,text,self.infertility,False,"<!-- SC_OFF --><div class=""md""><p>What was good this week? What was bad?</p>
</div><!-- SC_ON -->",,,,,True,False,False,False,False,[],[],False,False,False,False,,[],False,,,moderator,t5_2saej,,,,4pphcp,True,,AutoModerator,,52,False,no_ads,False,[],False,,/r/infertility/comments/4pphcp/pros_and_cons/,no_ads,False,https://www.reddit.com/r/infertility/comments/4pphcp/pros_and_cons/,25375,1466805742.0,0,,False,False,{},,
8,2048,confidence,<praw.reddit.Reddit object at 0x7f2244aead90>,,infertility,[deleted],,False,,0,False,"I owe you an apology, and I will do better from now on.",[],r/infertility,False,0,,0,,,False,t3_4ppend,False,dark,0.11,,public,0,0,{},,,False,[],,False,False,,{},,False,0,,,default,False,,,{},,True,,1466833551.0,text,0,,,,self.infertility,False,"<!-- SC_OFF --><div class=""md""><p>[deleted]</p>
</div><!-- SC_ON -->",,,,,True,True,False,False,False,[],[],False,False,False,False,,[],False,,,,t5_2saej,,,,4ppend,False,,,,9,True,no_ads,False,[],,dark,/r/infertility/comments/4ppend/i_owe_you_an_apology_and_i_will_do_better_from/,no_ads,False,https://www.reddit.com/r/infertility/comments/4ppend/i_owe_you_an_apology_and_i_will_do_better_from/,25375,1466804751.0,0,,False,False,{},,
9,2048,confidence,<praw.reddit.Reddit object at 0x7f2244aead90>,,infertility,"Everything looked good for IVF3- 8-11 great looking follicles all ready to go and a bunch of smaller ones.  I wake up from anesthesia and the nurse tells me they got 5 eggs.  Again.  Every fucking retrieval I have done I have gotten 5 fucking eggs. With an AMH of 2.5 and FSH of 6. FIVE.  Five.  Fuck Five.  4 fertilized, 2 made it to day 2, and 1 made it to blast/biopsy/freeze.  Just to review, I got a single blast from my first two cycles too.  Is there a glitch in the matrix?  What is this fuckery?

I have great FSH, AMH, estradiol but my ovaries act like DOR ovaries.  Seriously.  What. The. Fuck.  So my single blast is on ice, biopsy frozen and waiting.  I'm doing one more IVF cycle and then I am done with my ovaries.  Fuck my lying bullshit ""everything looks fine on paper"" ovaries.  Official diagnosis:  Bullshit Ovary Syndrome.  

And yeah, I'm pissed.  I'm angry to have had to endure IVF 3 times and am going to do it again.  But I'm also happy to be getting to the end.  I have to believe this is getting to the end, that donor eggs will work, that I am closer to a successful pregnancy than I ever have been.  I know sometimes they don't but right now I *have* to believe that our problem is Bullshit Ovary Syndrome, not problems with my uterus.  I feel like I have to give my ovaries a chance with a DOR-friendly protocol instead of expecting them to act in accordance with their medical test results, and after that, I can leave them to rot.  Fuck you, ovaries.  Fuck you.  I'm looking forward to moving on, moving forward, doing something that will result in a pregnancy and healthy baby.  

So I'm on a one cycle break.  Then back to bcp, then stimming.  Whatever we get to blast (who wants to bet on five eggs retrieved and one blast?) will be biopsied, combined with my one frozen blast's biopsy, tested, and froze for a future FET.  I don't know the protocol yet, setting up an appointment with the RE to discuss, but I'm thinking estrogen priming and/or micro dose lupron.  It'll be interesting to see what the RE thinks.  He was so confidence he could get me pregnant easily...  

I'm grateful I get to do IVF.  I'm grateful I have a blast frozen (I know we all say 'it only takes one' but we all know it often takes way more than one and only having one makes everything much much more stressful.).  I'm grateful I have a supportive family and wonderful partner. I'm grateful I am open to donor eggs. I'm fucking pissed as fuck to have gone through everything I've been through for the past 3 years to get here.  Ideal candidate each fucking step, fail fail fail, FUCK.  

Imma gonna go do some yoga.  ",t2_crx8n,False,,0,False,Little update in which I say 'fuck my ovaries'.,[],r/infertility,False,0,,0,,,False,t3_4pp5br,False,dark,0.86,,public,5,0,{},,d70f54ce-930e-11e4-8710-22000b26873e,False,[],,False,False,,{},,False,5,,False,self,1466801709.0,,[],{},,True,,1466830260.0,text,0,,,text,self.infertility,False,"<!-- SC_OFF --><div class=""md""><p>Everything looked good for IVF3- 8-11 great looking follicles all ready to go and a bunch of smaller ones.  I wake up from anesthesia and the nurse tells me they got 5 eggs.  Again.  Every fucking retrieval I have done I have gotten 5 fucking eggs. With an AMH of 2.5 and FSH of 6. FIVE.  Five.  Fuck Five.  4 fertilized, 2 made it to day 2, and 1 made it to blast/biopsy/freeze.  Just to review, I got a single blast from my first two cycles too.  Is there a glitch in the matrix?  What is this fuckery?</p>

<p>I have great FSH, AMH, estradiol but my ovaries act like DOR ovaries.  Seriously.  What. The. Fuck.  So my single blast is on ice, biopsy frozen and waiting.  I&#39;m doing one more IVF cycle and then I am done with my ovaries.  Fuck my lying bullshit &quot;everything looks fine on paper&quot; ovaries.  Official diagnosis:  Bullshit Ovary Syndrome.  </p>

<p>And yeah, I&#39;m pissed.  I&#39;m angry to have had to endure IVF 3 times and am going to do it again.  But I&#39;m also happy to be getting to the end.  I have to believe this is getting to the end, that donor eggs will work, that I am closer to a successful pregnancy than I ever have been.  I know sometimes they don&#39;t but right now I <em>have</em> to believe that our problem is Bullshit Ovary Syndrome, not problems with my uterus.  I feel like I have to give my ovaries a chance with a DOR-friendly protocol instead of expecting them to act in accordance with their medical test results, and after that, I can leave them to rot.  Fuck you, ovaries.  Fuck you.  I&#39;m looking forward to moving on, moving forward, doing something that will result in a pregnancy and healthy baby.  </p>

<p>So I&#39;m on a one cycle break.  Then back to bcp, then stimming.  Whatever we get to blast (who wants to bet on five eggs retrieved and one blast?) will be biopsied, combined with my one frozen blast&#39;s biopsy, tested, and froze for a future FET.  I don&#39;t know the protocol yet, setting up an appointment with the RE to discuss, but I&#39;m thinking estrogen priming and/or micro dose lupron.  It&#39;ll be interesting to see what the RE thinks.  He was so confidence he could get me pregnant easily...  </p>

<p>I&#39;m grateful I get to do IVF.  I&#39;m grateful I have a blast frozen (I know we all say &#39;it only takes one&#39; but we all know it often takes way more than one and only having one makes everything much much more stressful.).  I&#39;m grateful I have a supportive family and wonderful partner. I&#39;m grateful I am open to donor eggs. I&#39;m fucking pissed as fuck to have gone through everything I&#39;ve been through for the past 3 years to get here.  Ideal candidate each fucking step, fail fail fail, FUCK.  </p>

<p>Imma gonna go do some yoga.  </p>
</div><!-- SC_ON -->",,,,,True,False,False,False,False,[],[],False,False,False,False,"1MC, 2 CP,  4IVF, FET next",[],False,,,,t5_2saej,,,,4pp5br,True,,salty-lemons,,13,True,no_ads,False,[],False,dark,/r/infertility/comments/4pp5br/little_update_in_which_i_say_fuck_my_ovaries/,no_ads,False,https://www.reddit.com/r/infertility/comments/4pp5br/little_update_in_which_i_say_fuck_my_ovaries/,25375,1466801460.0,0,,False,False,{},,
10,2048,confidence,<praw.reddit.Reddit object at 0x7f2244aead90>,,infertility,"Hey, anyone in the Houston-area interested in a face-to-face meet up of some kind?  Reply below or PM me!",t2_glfxo,False,,0,False,Any interest in a Houston-area meet-up?,[],r/infertility,False,0,,0,,,False,t3_4poycg,False,dark,0.83,,public,4,0,{},,,False,[],,False,False,,{},,False,4,,False,self,False,,[],{},,True,,1466827884.0,text,0,,,text,self.infertility,False,"<!-- SC_OFF --><div class=""md""><p>Hey, anyone in the Houston-area interested in a face-to-face meet up of some kind?  Reply below or PM me!</p>
</div><!-- SC_ON -->",,,,,True,False,False,False,False,[],[],False,False,False,False,,[],False,,,,t5_2saej,,,,4poycg,True,,Carnelian96,,7,True,no_ads,False,[],False,,/r/infertility/comments/4poycg/any_interest_in_a_houstonarea_meetup/,no_ads,False,https://www.reddit.com/r/infertility/comments/4poycg/any_interest_in_a_houstonarea_meetup/,25375,1466799084.0,0,,False,False,{},,
11,2048,confidence,<praw.reddit.Reddit object at 0x7f2244aead90>,,infertility,Anybody doing the endometriosis diet? I've been doing it the last couple months. Just curious if anyone else is giving it a try,t2_yjj3r,False,,0,False,Endometriosis diet,[],r/infertility,False,0,,0,,,False,t3_4pocg0,False,dark,0.25,,public,0,0,{},,,False,[],,False,False,,{},,False,0,,False,self,False,,[],{},,True,,1466820910.0,text,0,,,text,self.infertility,False,"<!-- SC_OFF --><div class=""md""><p>Anybody doing the endometriosis diet? I&#39;ve been doing it the last couple months. Just curious if anyone else is giving it a try</p>
</div><!-- SC_ON -->",,,,,True,True,False,False,False,[],[],False,False,False,False,,[],False,,,,t5_2saej,,,,4pocg0,True,,crystalballer1,,5,True,no_ads,False,[],False,,/r/infertility/comments/4pocg0/endometriosis_diet/,no_ads,False,https://www.reddit.com/r/infertility/comments/4pocg0/endometriosis_diet/,25375,1466792110.0,0,,False,False,{},,
12,2048,confidence,<praw.reddit.Reddit object at 0x7f2244aead90>,,infertility,[deleted],,False,,0,False,"Question about billing at the RE's office, is this normal?",[],r/infertility,False,0,,0,,,False,t3_4pnvhp,False,dark,0.67,,public,1,0,{},,,False,[],,False,False,,{},,False,1,,,default,1466787135.0,,,{},,True,,1466815706.0,text,0,,,,self.infertility,False,"<!-- SC_OFF --><div class=""md""><p>[deleted]</p>
</div><!-- SC_ON -->",,,,,True,True,False,False,False,[],[],False,False,False,False,,[],False,,,,t5_2saej,,,,4pnvhp,False,,,,7,True,no_ads,False,[],,dark,/r/infertility/comments/4pnvhp/question_about_billing_at_the_res_office_is_this/,no_ads,False,https://www.reddit.com/r/infertility/comments/4pnvhp/question_about_billing_at_the_res_office_is_this/,25375,1466786906.0,0,,False,False,{},,
