133,2048,confidence,<praw.reddit.Reddit object at 0x7f2244aead90>,,infertility,[deleted],[],False,,0,False,Really struggling with my best friend,[],r/infertility,False,0,,0,,,False,t3_5zfzb3,False,dark,0.96,,public,18,0,{},,,False,,False,False,,{},,False,18,,default,,False,,{},,True,,1489564952.0,text,0,,,self.infertility,False,"<!-- SC_OFF --><div class=""md""><p>[deleted]</p>
</div><!-- SC_ON -->",,,,,True,False,False,False,False,[],[],False,False,False,False,,[],False,,,,t5_2saej,,,,5zfzb3,False,,,,33,True,no_ads,False,[],dark,/r/infertility/comments/5zfzb3/really_struggling_with_my_best_friend/,no_ads,False,https://www.reddit.com/r/infertility/comments/5zfzb3/really_struggling_with_my_best_friend/,25375,1489536152.0,0,,False,False,{},,,,,,,,,
134,2048,confidence,<praw.reddit.Reddit object at 0x7f2244aead90>,,infertility,"So I have a friend who is about my age, also a step monster bit had severe endo. I try not to ask too many questions about her ""struggle"" so I was surprised how  open she was in our stepparenting group about using Donor eggs, even saying how much (trigger) LO looks like the Donor. You can see the faces of the other Stepmonsters- most of them struggle to ""Blend families"" or just moved in with a guy with kids and have bumps - if it wasn't for her I'd quit that group. 

That wasn't a possibility I even thought of. 

For those of you that are going that route, what brought you to that decision? Was hubby on board? 

",[],False,,0,False,Donor Eggs,[],r/infertility,False,0,,0,,,False,t3_5zfxb5,False,dark,1.0,,public,1,0,{},,,False,,False,False,,{},,False,1,,self,,False,,{},,True,,1489564392.0,text,0,,,self.infertility,False,"<!-- SC_OFF --><div class=""md""><p>So I have a friend who is about my age, also a step monster bit had severe endo. I try not to ask too many questions about her &quot;struggle&quot; so I was surprised how  open she was in our stepparenting group about using Donor eggs, even saying how much (trigger) LO looks like the Donor. You can see the faces of the other Stepmonsters- most of them struggle to &quot;Blend families&quot; or just moved in with a guy with kids and have bumps - if it wasn&#39;t for her I&#39;d quit that group. </p>

<p>That wasn&#39;t a possibility I even thought of. </p>

<p>For those of you that are going that route, what brought you to that decision? Was hubby on board? </p>
</div><!-- SC_ON -->",,,,,True,True,False,False,False,[],[],False,False,False,False,,[],False,,,,t5_2saej,,,,5zfxb5,True,,RockyBalboa64,,17,True,no_ads,False,[],,/r/infertility/comments/5zfxb5/donor_eggs/,no_ads,False,https://www.reddit.com/r/infertility/comments/5zfxb5/donor_eggs/,25375,1489535592.0,0,,False,False,{},t2_15ye9z,False,[],text,False,,,,
135,2048,confidence,<praw.reddit.Reddit object at 0x7f2244aead90>,,infertility,[deleted],[],False,,0,False,What's the worst way anyone's ever announced their pregnancy to you?,[],r/infertility,False,0,,0,,,False,t3_5zfj41,False,dark,1.0,,public,18,0,{},,,False,,False,False,,{},,False,18,,default,,1489624501.0,,{},,True,,1489560292.0,text,0,deleted,,self.infertility,False,"<!-- SC_OFF --><div class=""md""><p>[deleted]</p>
</div><!-- SC_ON -->",,,,,True,False,False,False,False,[],[],False,False,False,False,,[],False,,,,t5_2saej,,,,5zfj41,False,,,,97,True,no_ads,False,[],dark,/r/infertility/comments/5zfj41/whats_the_worst_way_anyones_ever_announced_their/,no_ads,False,https://www.reddit.com/r/infertility/comments/5zfj41/whats_the_worst_way_anyones_ever_announced_their/,25375,1489531492.0,0,,False,False,{},,,,,,,,,
136,2048,confidence,<praw.reddit.Reddit object at 0x7f2244aead90>,,infertility,"My IVF coordinator has been a ding dong and I've just let it go.  I'm a pretty informed patient (in no small part due to you all! *thank you!*)  So last night I realized she screwed up the math on my mid cycle meds refill when they increased my dosages and I will run out after tonight.  So I send her a message and also confirmed that the vmail I got after Sunday's Day 8 u/s and labs did NOT say to start my cetrotide, so I DID NOT start my cetrotide (as per previous post my E2 is really low and I stimmed 12 days last time).  I had asked her about the cetrotide on Day 6 because I had started it Day 6 last cycle and she seemed annoyed and said ""if we don't tell you to start, don't start.""  Clearly today's message  got an ""oh shit"" on their side because I got a call back instantly (never happens) with instructions to start it RIGHT NOW.  I'm at fucking work!  I've been worried about not starting it because I'll be fucking pissed if I go through a cycle and they screw up on instructions causing me to lose eggs.  Isn't this stuff, like, her WHOLE JOB?!  So now I have to bail out of work so I can go home to inject.  WTF.


Update: I did not ovulate according to Wednesday U/S so this cycle is still on track.  I must have scared them a bit because I just got the lab results and they did P4 to make sure I hadn't ovulated :)",[],False,,0,False,How hard is it!! (rant),[],r/infertility,False,0,,0,,,False,t3_5zegz5,False,dark,1.0,,public,9,0,{},,d70f54ce-930e-11e4-8710-22000b26873e,False,,False,False,,{},,False,9,,self,,1489618731.0,,{},,True,,1489549998.0,text,0,,,self.infertility,False,"<!-- SC_OFF --><div class=""md""><p>My IVF coordinator has been a ding dong and I&#39;ve just let it go.  I&#39;m a pretty informed patient (in no small part due to you all! <em>thank you!</em>)  So last night I realized she screwed up the math on my mid cycle meds refill when they increased my dosages and I will run out after tonight.  So I send her a message and also confirmed that the vmail I got after Sunday&#39;s Day 8 <a href=""/u/s"">u/s</a> and labs did NOT say to start my cetrotide, so I DID NOT start my cetrotide (as per previous post my E2 is really low and I stimmed 12 days last time).  I had asked her about the cetrotide on Day 6 because I had started it Day 6 last cycle and she seemed annoyed and said &quot;if we don&#39;t tell you to start, don&#39;t start.&quot;  Clearly today&#39;s message  got an &quot;oh shit&quot; on their side because I got a call back instantly (never happens) with instructions to start it RIGHT NOW.  I&#39;m at fucking work!  I&#39;ve been worried about not starting it because I&#39;ll be fucking pissed if I go through a cycle and they screw up on instructions causing me to lose eggs.  Isn&#39;t this stuff, like, her WHOLE JOB?!  So now I have to bail out of work so I can go home to inject.  WTF.</p>

<p>Update: I did not ovulate according to Wednesday U/S so this cycle is still on track.  I must have scared them a bit because I just got the lab results and they did P4 to make sure I hadn&#39;t ovulated :)</p>
</div><!-- SC_ON -->",,,,,True,False,False,False,False,[],[],False,False,False,False,44F| Lots of IVF,[],False,,,,t5_2saej,,,,5zegz5,True,,dawndilioso,,16,True,no_ads,False,[],dark,/r/infertility/comments/5zegz5/how_hard_is_it_rant/,no_ads,False,https://www.reddit.com/r/infertility/comments/5zegz5/how_hard_is_it_rant/,25375,1489521198.0,0,,False,False,{},t2_14rwut,False,[],text,False,,,,
137,2048,confidence,<praw.reddit.Reddit object at 0x7f2244aead90>,,infertility,"So, I think this basically comes down to a personal decision, but I'd love to get some opinions. 

We've done one round of IVF and ended up with 4 good blasts. We transferred 1, which ended in CP. Now, the dilemma... do we do another FET, or another round of IVF to bank more embryos?? We've paid for a shared risk program, which includes multiple rounds of IVF and unlimited FETs. So cost isn't *really* an issue (although the cost of meds wasn't included, so meds for IVF are significantly higher than FET). 

I haven't even spoken to my doctor, so I'm not sure if this is even an option, or if with the Shared Risk program you need to transfer all embryos before being allowed to do another IVF cycle. 

Ideally, we want to have 2 children, so I want to have some leftover embryos if/when we're ever successful...

My husband thinks we should do one more transfer, and if that doesn't work, then do another round of IVF. I'm inclined to agree with him, but we are both open to being persuaded in the other direction. Help!",[],False,,0,False,Advice on more IVF vs. FET?,[],r/infertility,False,0,,0,,,False,t3_5ze2qq,False,dark,1.0,,public,5,0,{},,,False,,False,False,,{},,False,5,,self,,False,,{},,True,,1489546312.0,text,0,,,self.infertility,False,"<!-- SC_OFF --><div class=""md""><p>So, I think this basically comes down to a personal decision, but I&#39;d love to get some opinions. </p>

<p>We&#39;ve done one round of IVF and ended up with 4 good blasts. We transferred 1, which ended in CP. Now, the dilemma... do we do another FET, or another round of IVF to bank more embryos?? We&#39;ve paid for a shared risk program, which includes multiple rounds of IVF and unlimited FETs. So cost isn&#39;t <em>really</em> an issue (although the cost of meds wasn&#39;t included, so meds for IVF are significantly higher than FET). </p>

<p>I haven&#39;t even spoken to my doctor, so I&#39;m not sure if this is even an option, or if with the Shared Risk program you need to transfer all embryos before being allowed to do another IVF cycle. </p>

<p>Ideally, we want to have 2 children, so I want to have some leftover embryos if/when we&#39;re ever successful...</p>

<p>My husband thinks we should do one more transfer, and if that doesn&#39;t work, then do another round of IVF. I&#39;m inclined to agree with him, but we are both open to being persuaded in the other direction. Help!</p>
</div><!-- SC_ON -->",,,,,True,False,False,False,False,[],[],False,False,False,False,32 | MFI | 1 IVF  | 1 CP | FET #2 5/5,[],False,,,,t5_2saej,,,,5ze2qq,True,,whaddagoodgirl,,18,True,no_ads,False,[],dark,/r/infertility/comments/5ze2qq/advice_on_more_ivf_vs_fet/,no_ads,False,https://www.reddit.com/r/infertility/comments/5ze2qq/advice_on_more_ivf_vs_fet/,25375,1489517512.0,0,,False,False,{},t2_6huvy,False,[],text,False,,,,
138,2048,confidence,<praw.reddit.Reddit object at 0x7f2244aead90>,,infertility,"I'm not sure if this is the right sub to post this so please let me know if it isn't and I will delete the post.  I have been seeing an RE since august and have had two miscarriages - one conceived without assistance and the second was medicated and IUI.  I have been annoyed with my RE for a while now; it's a huge facility, I rarely speak to my doctor and the nurses seem to have no idea what is going on and I've been given wrong information in the past.  A little bit of background before I get to my question - the successful cycle that ended in miscarriage I was triggered on day nine with the IUI on day eleven.  I have asked that we move the ultrasound and bloodwork in my next cycles up a day to correspond with the successful cycle's timing and have had resistance from the nurse. We ended up doing two cycles with the normal timing that were unsuccessful.  This cycle I really pushed to be seen a day early on day nine and was excited to find out that I had two follicles that were large (16 and 22, lining was at 10.33) and the nurse told me I should trigger that night. This is where my distrust comes in - I get a call from a different nurse (this is normal) that afternoon with my bloodwork results and the nurse says not to trigger that night but the next. I asked her why the delay and she responded - because of the snow storm we are moving some patients back a day and since it isn't necesssry for you to have the IUI on Wednesday, we are moving it to Thursday.  I was kind of shocked and just said ok and went with it.  After I hung up I started thinking about how not ok her reasoning was so I called her back and asked about the reasoning again to which she responded that my LH levels were at 3 so I wasn't surging which is the real reason to push the procedure back by a day.  I don't know if I believe her or not and have no idea about the actual science behind the timing.  Does anyone know if an LH level of three on day nine with two large follicles indicates I should trigger with Ovidrel on day nine or wait until day ten?  Sorry for the long post!  This cycle may be a loss but I am trying to decide whether to find another practice. Also, I've been cramping all day so wonder if I am ovulating in my own today (and my IUI isn't until Thursday ugh).  Thank you!  ",[],False,,0,False,I think my RE moved my IUI appointment because of the snow storm and then made up an excuse but can't be sure! This brings me to my question about LH levels before the Ovidrel trigger shot.,[],r/infertility,False,0,,0,,,False,t3_5zdv9e,False,dark,0.67,,public,2,0,{},,,False,,False,False,,{},,False,2,,self,,False,,{},,True,,1489544406.0,text,0,,,self.infertility,True,"<!-- SC_OFF --><div class=""md""><p>I&#39;m not sure if this is the right sub to post this so please let me know if it isn&#39;t and I will delete the post.  I have been seeing an RE since august and have had two miscarriages - one conceived without assistance and the second was medicated and IUI.  I have been annoyed with my RE for a while now; it&#39;s a huge facility, I rarely speak to my doctor and the nurses seem to have no idea what is going on and I&#39;ve been given wrong information in the past.  A little bit of background before I get to my question - the successful cycle that ended in miscarriage I was triggered on day nine with the IUI on day eleven.  I have asked that we move the ultrasound and bloodwork in my next cycles up a day to correspond with the successful cycle&#39;s timing and have had resistance from the nurse. We ended up doing two cycles with the normal timing that were unsuccessful.  This cycle I really pushed to be seen a day early on day nine and was excited to find out that I had two follicles that were large (16 and 22, lining was at 10.33) and the nurse told me I should trigger that night. This is where my distrust comes in - I get a call from a different nurse (this is normal) that afternoon with my bloodwork results and the nurse says not to trigger that night but the next. I asked her why the delay and she responded - because of the snow storm we are moving some patients back a day and since it isn&#39;t necesssry for you to have the IUI on Wednesday, we are moving it to Thursday.  I was kind of shocked and just said ok and went with it.  After I hung up I started thinking about how not ok her reasoning was so I called her back and asked about the reasoning again to which she responded that my LH levels were at 3 so I wasn&#39;t surging which is the real reason to push the procedure back by a day.  I don&#39;t know if I believe her or not and have no idea about the actual science behind the timing.  Does anyone know if an LH level of three on day nine with two large follicles indicates I should trigger with Ovidrel on day nine or wait until day ten?  Sorry for the long post!  This cycle may be a loss but I am trying to decide whether to find another practice. Also, I&#39;ve been cramping all day so wonder if I am ovulating in my own today (and my IUI isn&#39;t until Thursday ugh).  Thank you!  </p>
</div><!-- SC_ON -->",,,,,True,False,False,False,False,[],[],False,False,False,False,,[],False,,,,t5_2saej,,,,5zdv9e,True,,N123hopeful,,14,True,no_ads,False,[],,/r/infertility/comments/5zdv9e/i_think_my_re_moved_my_iui_appointment_because_of/,no_ads,False,https://www.reddit.com/r/infertility/comments/5zdv9e/i_think_my_re_moved_my_iui_appointment_because_of/,25375,1489515606.0,0,,False,False,{},t2_13xfqv,False,[],text,False,,,,
139,2048,confidence,<praw.reddit.Reddit object at 0x7f2244aead90>,,infertility,"I read somewhere that most employers who add IVF coverage do so because someone asks. I've been nervous because it's so personal, but today I sent an email finally! You know if this had to do with men's healthcare it would be covered. If there's insurance coverage for boners, I'd like insurance coverage for making babies please! That is all :)",[],False,,0,False,Today I asked my employer about adding IVF coverage :),[],r/infertility,False,0,,0,,,False,t3_5zdgtk,False,dark,0.88,,public,28,0,{},,d70f54ce-930e-11e4-8710-22000b26873e,False,,False,False,,{},,False,28,,self,,False,,{},,True,,1489540750.0,text,0,,,self.infertility,False,"<!-- SC_OFF --><div class=""md""><p>I read somewhere that most employers who add IVF coverage do so because someone asks. I&#39;ve been nervous because it&#39;s so personal, but today I sent an email finally! You know if this had to do with men&#39;s healthcare it would be covered. If there&#39;s insurance coverage for boners, I&#39;d like insurance coverage for making babies please! That is all :)</p>
</div><!-- SC_ON -->",,,,,True,False,False,False,False,[],[],False,False,False,False,"36, DOR, endo, & MFI, donor eggs, general disaster",[],False,,,,t5_2saej,,,,5zdgtk,True,,JuiceBoxedFox,,32,True,no_ads,False,[],dark,/r/infertility/comments/5zdgtk/today_i_asked_my_employer_about_adding_ivf/,no_ads,False,https://www.reddit.com/r/infertility/comments/5zdgtk/today_i_asked_my_employer_about_adding_ivf/,25375,1489511950.0,0,,False,False,{},t2_ev7ql,False,[],text,False,,,,
140,2048,confidence,<praw.reddit.Reddit object at 0x7f2244aead90>,,infertility,"Hi, sorry if this a dumb question. This is my first round of clomid. I know I'm supposed to take it on day 3. But what is Day 3? I saw spotting last night, was yesterday day one? Or is Day one a red blood day? ",[],False,,0,False,"Clomid, what is day 3?",[],r/infertility,False,0,,0,,,False,t3_5zcof8,False,dark,1.0,,public,3,0,{},,,False,,False,False,,{},,False,3,,self,,False,,{},,True,,1489533223.0,text,0,,,self.infertility,False,"<!-- SC_OFF --><div class=""md""><p>Hi, sorry if this a dumb question. This is my first round of clomid. I know I&#39;m supposed to take it on day 3. But what is Day 3? I saw spotting last night, was yesterday day one? Or is Day one a red blood day? </p>
</div><!-- SC_ON -->",,,,,True,False,False,False,False,[],[],False,False,False,False,,[],False,,,,t5_2saej,,,,5zcof8,True,,notquiteacharm,,11,True,no_ads,False,[],,/r/infertility/comments/5zcof8/clomid_what_is_day_3/,no_ads,False,https://www.reddit.com/r/infertility/comments/5zcof8/clomid_what_is_day_3/,25375,1489504423.0,0,,False,False,{},t2_p42y8,False,[],text,False,,,,
141,2048,confidence,<praw.reddit.Reddit object at 0x7f2244aead90>,,infertility,"Use this thread to share anything not necessarily related to infertility. Rant or rave, bitch, moan, share something funny, anything goes!",[],False,,0,False,Tuesday Off Topic Thread,[],r/infertility,False,0,,0,,,False,t3_5zb9q9,False,dark,1.0,,public,2,0,{},,,False,,False,False,,{},,False,2,,self,,False,,{},,True,,1489514608.0,text,0,,,self.infertility,False,"<!-- SC_OFF --><div class=""md""><p>Use this thread to share anything not necessarily related to infertility. Rant or rave, bitch, moan, share something funny, anything goes!</p>
</div><!-- SC_ON -->",,,,,True,False,False,False,False,[],[],False,False,False,False,,[],False,,,moderator,t5_2saej,,,,5zb9q9,True,,AutoModerator,,305,False,no_ads,False,[],,/r/infertility/comments/5zb9q9/tuesday_off_topic_thread/,no_ads,False,https://www.reddit.com/r/infertility/comments/5zb9q9/tuesday_off_topic_thread/,25375,1489485808.0,0,,False,False,{},t2_6l4z3,True,[],text,False,,,,
