,comment_limit,comment_sort,_reddit,approved_at_utc,subreddit,selftext,user_reports,saved,mod_reason_title,gilded,clicked,title,link_flair_richtext,subreddit_name_prefixed,hidden,pwls,link_flair_css_class,downs,thumbnail_height,top_awarded_type,hide_score,name,quarantine,link_flair_text_color,upvote_ratio,author_flair_background_color,subreddit_type,ups,total_awards_received,media_embed,thumbnail_width,author_flair_template_id,is_original_content,secure_media,is_reddit_media_domain,is_meta,category,secure_media_embed,link_flair_text,can_mod_post,score,approved_by,thumbnail,author_cakeday,edited,author_flair_css_class,gildings,content_categories,is_self,mod_note,created,link_flair_type,wls,removed_by_category,banned_by,domain,allow_live_comments,selftext_html,likes,suggested_sort,banned_at_utc,view_count,archived,no_follow,is_crosspostable,pinned,over_18,all_awardings,awarders,media_only,can_gild,spoiler,locked,author_flair_text,treatment_tags,visited,removed_by,num_reports,distinguished,subreddit_id,mod_reason_by,removal_reason,link_flair_background_color,id,is_robot_indexable,report_reasons,author,discussion_type,num_comments,send_replies,whitelist_status,contest_mode,mod_reports,author_flair_text_color,permalink,parent_whitelist_status,stickied,url,subreddit_subscribers,created_utc,num_crossposts,media,is_video,_fetched,_comments_by_id,author_fullname,author_premium,author_flair_richtext,author_flair_type,author_patreon_flair,post_hint,preview,url_overridden_by_dest,collections
0,2048,confidence,<praw.reddit.Reddit object at 0x7f2244aead90>,,infertility,[deleted],[],False,,0,False,"Insurance coverage and buying donor sperm. Also, I hate my insurance company for being dicks.",[],r/infertility,False,0,,0,,,False,t3_6138zj,False,dark,1.0,,public,4,0,{},,,False,,False,False,,{},,False,4,,default,True,False,,{},,True,,1490318747.0,text,0,,,self.infertility,False,"<!-- SC_OFF --><div class=""md""><p>[deleted]</p>
</div><!-- SC_ON -->",,,,,True,False,False,False,False,[],[],False,False,False,False,,[],False,,,,t5_2saej,,,,6138zj,False,,,,9,True,no_ads,False,[],dark,/r/infertility/comments/6138zj/insurance_coverage_and_buying_donor_sperm_also_i/,no_ads,False,https://www.reddit.com/r/infertility/comments/6138zj/insurance_coverage_and_buying_donor_sperm_also_i/,25375,1490289947.0,0,,False,False,{},,,,,,,,,
1,2048,confidence,<praw.reddit.Reddit object at 0x7f2244aead90>,,infertility,[deleted],[],False,,0,False,The matched me with someone!,[],r/infertility,False,0,,0,,,False,t3_6129nr,False,dark,0.99,,public,14,0,{},,,False,,False,False,,{},,False,14,,default,,False,,{},,True,,1490309054.0,text,0,deleted,,self.infertility,False,"<!-- SC_OFF --><div class=""md""><p>[deleted]</p>
</div><!-- SC_ON -->",,,,,True,False,False,False,False,[],[],False,False,False,False,,[],False,,,,t5_2saej,,,,6129nr,False,,,,12,True,no_ads,False,[],dark,/r/infertility/comments/6129nr/the_matched_me_with_someone/,no_ads,False,https://www.reddit.com/r/infertility/comments/6129nr/the_matched_me_with_someone/,25375,1490280254.0,0,,False,False,{},,,,,,,,,
2,2048,confidence,<praw.reddit.Reddit object at 0x7f2244aead90>,,infertility,[deleted],[],False,,0,False,PSA: Canadians! IF treatments are tax deductible and you can now claim any unclaimed previous costs up to 10 years retroactively,[],r/infertility,False,0,,0,,,False,t3_6127xw,False,dark,0.97,,public,24,0,{},,,False,,False,False,,{},,False,24,,default,,False,,{},,True,,1490308550.0,text,0,,,self.infertility,False,"<!-- SC_OFF --><div class=""md""><p>[deleted]</p>
</div><!-- SC_ON -->",,,,,True,False,False,False,False,[],[],False,False,False,False,,[],False,,,,t5_2saej,,,,6127xw,False,,,,21,True,no_ads,False,[],dark,/r/infertility/comments/6127xw/psa_canadians_if_treatments_are_tax_deductible/,no_ads,False,https://www.reddit.com/r/infertility/comments/6127xw/psa_canadians_if_treatments_are_tax_deductible/,25375,1490279750.0,0,,False,False,{},,,,,,,,,
3,2048,confidence,<praw.reddit.Reddit object at 0x7f2244aead90>,,infertility,[deleted],[],False,,0,False,"I've recently had it confirmed that I'm infertile, but I'm struggling to understand the ins-and-outs of my doctor's explanation. Can someone help?",[],r/infertility,False,0,,0,,,False,t3_61128k,False,dark,1.0,,public,7,0,{},,,False,,False,False,,{},,False,7,,default,,False,,{},,True,,1490294041.0,text,0,,,self.infertility,False,"<!-- SC_OFF --><div class=""md""><p>[deleted]</p>
</div><!-- SC_ON -->",,,,,True,False,False,False,False,[],[],False,False,False,False,,[],False,,,,t5_2saej,,,,61128k,False,,,,15,True,no_ads,False,[],dark,/r/infertility/comments/61128k/ive_recently_had_it_confirmed_that_im_infertile/,no_ads,False,https://www.reddit.com/r/infertility/comments/61128k/ive_recently_had_it_confirmed_that_im_infertile/,25375,1490265241.0,0,,False,False,{},,,,,,,,,
4,2048,confidence,<praw.reddit.Reddit object at 0x7f2244aead90>,,infertility,"I don't think I am breaking any rules but here goes I need to vent- on Monday this week I got a positive beta after FET and found out yesterday the number hadn't budged so I stopped all meds and I am waiting to miscarry or get a heavy peorid whatever the hell you want to consider this 

I found out at work yesterday in the early am so I left quickly, went home and cried and cried and cried 

I am trying to pick myself back up and go back to work today but it still fucking hurts and I'm sad and angry and all the other spectrum of emotions right now

This sucks, infertility sucks - I wish I didn't want kids. I wish my unexplained infertility would be more explained. I wish I didn't work with a bunch of woman with babies. I wish they didn't always talk about them and force me to fake smile. Fuck
I hate the bitterness and jealousy and the fact that I can't even go on social media without getting a pit in my stomach.

I hate the fact that I don't know if any of this will ever work

I'm a damn train wreck today but I'll be better tmrw - hopefully...maybe 

*thanks for the support everyone - I'm not much of a journaler but venting on here is just as good for me :/",[],False,,0,False,Back to work today (early loss),[],r/infertility,False,0,,0,,,False,t3_6111om,False,dark,0.91,,public,8,0,{},,,False,,False,False,,{},,False,8,,self,,1490285607.0,,{},,True,,1490293767.0,text,0,,,self.infertility,True,"<!-- SC_OFF --><div class=""md""><p>I don&#39;t think I am breaking any rules but here goes I need to vent- on Monday this week I got a positive beta after FET and found out yesterday the number hadn&#39;t budged so I stopped all meds and I am waiting to miscarry or get a heavy peorid whatever the hell you want to consider this </p>

<p>I found out at work yesterday in the early am so I left quickly, went home and cried and cried and cried </p>

<p>I am trying to pick myself back up and go back to work today but it still fucking hurts and I&#39;m sad and angry and all the other spectrum of emotions right now</p>

<p>This sucks, infertility sucks - I wish I didn&#39;t want kids. I wish my unexplained infertility would be more explained. I wish I didn&#39;t work with a bunch of woman with babies. I wish they didn&#39;t always talk about them and force me to fake smile. Fuck
I hate the bitterness and jealousy and the fact that I can&#39;t even go on social media without getting a pit in my stomach.</p>

<p>I hate the fact that I don&#39;t know if any of this will ever work</p>

<p>I&#39;m a damn train wreck today but I&#39;ll be better tmrw - hopefully...maybe </p>

<p>*thanks for the support everyone - I&#39;m not much of a journaler but venting on here is just as good for me :/</p>
</div><!-- SC_ON -->",,,,,True,False,False,False,False,[],[],False,False,False,False,31 'unexplained' IVF #1 lol no luck..IVF #2 coming soon,[],False,,,,t5_2saej,,,,6111om,True,,Jw168679,,35,True,no_ads,False,[],dark,/r/infertility/comments/6111om/back_to_work_today_early_loss/,no_ads,False,https://www.reddit.com/r/infertility/comments/6111om/back_to_work_today_early_loss/,25375,1490264967.0,0,,False,False,{},t2_138tx9,False,[],text,False,,,,
5,2048,confidence,<praw.reddit.Reddit object at 0x7f2244aead90>,,infertility,"Use this thread to share anything not necessarily related to infertility. Rant or rave, bitch, moan, share something funny, anything goes!",[],False,,0,False,Thursday Off Topic Thread,[],r/infertility,False,0,,0,,,False,t3_610zet,False,dark,1.0,,public,3,0,{},,,False,,False,False,,{},,False,3,,self,,False,,{},,True,,1490292619.0,text,0,,,self.infertility,False,"<!-- SC_OFF --><div class=""md""><p>Use this thread to share anything not necessarily related to infertility. Rant or rave, bitch, moan, share something funny, anything goes!</p>
</div><!-- SC_ON -->",,,,,True,False,False,False,False,[],[],False,False,False,False,,[],False,,,moderator,t5_2saej,,,,610zet,True,,AutoModerator,,227,False,no_ads,False,[],,/r/infertility/comments/610zet/thursday_off_topic_thread/,no_ads,False,https://www.reddit.com/r/infertility/comments/610zet/thursday_off_topic_thread/,25375,1490263819.0,0,,False,False,{},t2_6l4z3,True,[],text,False,,,,
6,2048,confidence,<praw.reddit.Reddit object at 0x7f2244aead90>,,infertility,"So after our first IVF, which failed, the doctor is suggesting we get blood work to test for chromosome issues as well as a sperm fragmentation test. The blood work is free and the other only $400. I'm a bit annoyed that these simple (but long waiting result) tests weren't done prior to our first cycle. Why not eliminate all issues, especially since it's fairly inexpensive prior to the ten thousand dollars and weeks of preparation? 


So my suggestion to anyone starting is to request these done first. We don't know the results yet and won't for a long time, but imagine if it is chromosomes, we wouldn't have done IVF at all because it just would never work. 


I'm a bit annoyed over here.


Also if it is sperm fragmentation, does anyone have any experience with this? Was your SO able to make lifestyle changes that helped create ""normal"" sperm afterwards? I don't know enough about it. Thanks. :)",[],False,,0,False,Asking for more tests before IVF,[],r/infertility,False,0,,0,,,False,t3_60zrxf,False,dark,1.0,,public,1,0,{},,,False,,False,False,,{},,False,1,,self,,False,,{},,True,,1490271590.0,text,0,,,self.infertility,False,"<!-- SC_OFF --><div class=""md""><p>So after our first IVF, which failed, the doctor is suggesting we get blood work to test for chromosome issues as well as a sperm fragmentation test. The blood work is free and the other only $400. I&#39;m a bit annoyed that these simple (but long waiting result) tests weren&#39;t done prior to our first cycle. Why not eliminate all issues, especially since it&#39;s fairly inexpensive prior to the ten thousand dollars and weeks of preparation? </p>

<p>So my suggestion to anyone starting is to request these done first. We don&#39;t know the results yet and won&#39;t for a long time, but imagine if it is chromosomes, we wouldn&#39;t have done IVF at all because it just would never work. </p>

<p>I&#39;m a bit annoyed over here.</p>

<p>Also if it is sperm fragmentation, does anyone have any experience with this? Was your SO able to make lifestyle changes that helped create &quot;normal&quot; sperm afterwards? I don&#39;t know enough about it. Thanks. :)</p>
</div><!-- SC_ON -->",,,,,True,True,False,False,False,[],[],False,False,False,False,,[],False,,,,t5_2saej,,,,60zrxf,True,,,,19,True,no_ads,False,[],dark,/r/infertility/comments/60zrxf/asking_for_more_tests_before_ivf/,no_ads,False,https://www.reddit.com/r/infertility/comments/60zrxf/asking_for_more_tests_before_ivf/,25375,1490242790.0,0,,False,False,{},,,,,,,,,
7,2048,confidence,<praw.reddit.Reddit object at 0x7f2244aead90>,,infertility,"Hello,

I'm passing on 1+ boxes of Crinone, courtesy of me and u/ImHereReluctantly. Would prefer local and we can figure out a handoff, but I'll ship it UPS or something too, just worried about it getting too hot and melting. Maybe I'm overthinking it. Anyway, PM me if interested. Thanks.

Edit: This has been claimed!",[],False,,0,False,"Crinone in Austin, TX",[],r/infertility,False,0,,0,,,False,t3_60z0me,False,dark,1.0,,public,3,0,{},,,False,,False,False,,{},,False,3,,self,,1490314104.0,,{},,True,,1490262200.0,text,0,,,self.infertility,False,"<!-- SC_OFF --><div class=""md""><p>Hello,</p>

<p>I&#39;m passing on 1+ boxes of Crinone, courtesy of me and <a href=""/u/ImHereReluctantly"">u/ImHereReluctantly</a>. Would prefer local and we can figure out a handoff, but I&#39;ll ship it UPS or something too, just worried about it getting too hot and melting. Maybe I&#39;m overthinking it. Anyway, PM me if interested. Thanks.</p>

<p>Edit: This has been claimed!</p>
</div><!-- SC_ON -->",,,,,True,False,False,False,False,[],[],False,False,False,False,,[],False,,,,t5_2saej,,,,60z0me,True,,njen,,1,True,no_ads,False,[],,/r/infertility/comments/60z0me/crinone_in_austin_tx/,no_ads,False,https://www.reddit.com/r/infertility/comments/60z0me/crinone_in_austin_tx/,25375,1490233400.0,0,,False,False,{},t2_5xbsj,False,[],text,False,,,,
8,2048,confidence,<praw.reddit.Reddit object at 0x7f2244aead90>,,infertility,"I was told when I was 16 that it was very likely that I would have fertility problems/infertility after problems with my ovaries. I didn't think much of it at the time but as time has gone by it's weighed on me more and more. I also suffer from severe depression. When things are good, I'm optimistic or accepting, but when things are bad, I get fertility/baby envy in full force.

I started dating a guy who I knew has a kid (who does not live close for reasons I will not disclose for sake of anonymity). We met during a good time, I really liked him and was very confident in myself, especially after coming to terms with a friend's child being​ born after being pretty petty about it for a while.

Things have gotten serious and I was happy to talk about his kid with him, I even helped him pick out presents for her. He's even told her about me and she is super happy for him.

But lately I've had another bad bout of depression and the kid thing has been irritating me. He's also recently put up some pictures of her so every time I stay over I see her stupid face looking at me all the time (not to mention pictures of his ex and stepkid, his old, perfect little family staring at me...)

I've mentioned my insecurities about my infertility to him before, and I know he would be nothing less than perfect if I brought it up to him, but I'm afraid to bring it up. I hate that I'm petty about this. I hate the thoughts that come into my head. I am so scared to admit that him having a kid makes me mad, resent him even (sometimes). I know it will be easier when this depression passes but right now it hurts.

I don't know what kind of advice I'm looking for. Maybe I just need to vent and talk to someone about it.

Thank you for reading.",[],False,,0,False,Dating a parent/feeling petty AF (advice/vent),[],r/infertility,False,0,,0,,,False,t3_60yuik,False,dark,0.66,,public,2,0,{},,,False,,False,False,,{},,False,2,,self,,False,,{},,True,,1490260213.0,text,0,,,self.infertility,False,"<!-- SC_OFF --><div class=""md""><p>I was told when I was 16 that it was very likely that I would have fertility problems/infertility after problems with my ovaries. I didn&#39;t think much of it at the time but as time has gone by it&#39;s weighed on me more and more. I also suffer from severe depression. When things are good, I&#39;m optimistic or accepting, but when things are bad, I get fertility/baby envy in full force.</p>

<p>I started dating a guy who I knew has a kid (who does not live close for reasons I will not disclose for sake of anonymity). We met during a good time, I really liked him and was very confident in myself, especially after coming to terms with a friend&#39;s child being​ born after being pretty petty about it for a while.</p>

<p>Things have gotten serious and I was happy to talk about his kid with him, I even helped him pick out presents for her. He&#39;s even told her about me and she is super happy for him.</p>

<p>But lately I&#39;ve had another bad bout of depression and the kid thing has been irritating me. He&#39;s also recently put up some pictures of her so every time I stay over I see her stupid face looking at me all the time (not to mention pictures of his ex and stepkid, his old, perfect little family staring at me...)</p>

<p>I&#39;ve mentioned my insecurities about my infertility to him before, and I know he would be nothing less than perfect if I brought it up to him, but I&#39;m afraid to bring it up. I hate that I&#39;m petty about this. I hate the thoughts that come into my head. I am so scared to admit that him having a kid makes me mad, resent him even (sometimes). I know it will be easier when this depression passes but right now it hurts.</p>

<p>I don&#39;t know what kind of advice I&#39;m looking for. Maybe I just need to vent and talk to someone about it.</p>

<p>Thank you for reading.</p>
</div><!-- SC_ON -->",,,,,True,False,False,False,False,[],[],False,False,False,False,,[],False,,,,t5_2saej,,,,60yuik,True,,maybadingo8urbb,,4,True,no_ads,False,[],,/r/infertility/comments/60yuik/dating_a_parentfeeling_petty_af_advicevent/,no_ads,False,https://www.reddit.com/r/infertility/comments/60yuik/dating_a_parentfeeling_petty_af_advicevent/,25375,1490231413.0,0,,False,False,{},t2_16f2q4,False,[],text,False,,,,
