202,2048,confidence,<praw.reddit.Reddit object at 0x7f2244aead90>,,infertility,"I don't have my official protocol yet, but i talked to the nurse for a few minutes yesterday about meds.  I wanted to get a handle on costs because we're totally OOP (and I have a high deductible health plan that doesn't pay for anything until I meet the deductible- so even meds that are covered like estrogen will be OOP until I spend another $800 then co-pays kick in depending on the tier of med) and we're seriously very tapped out financially after IVF.  So I was a little bummed to hear from the nurse that I might be looking at about $1,000 worth of meds.  Is this normal?  


Here is what she said I'd need:



* bcp - have them and they are free anyway w/ insurance for 3 weeks-- starting tomorrow.



* Lupron 2 week kit which she said is about $500.  Is this real/accurate?  I looked on GoodRx and found that you can get the kit at Walmart (appears the same dose/strength) for $185.  Has anyone done this and not gone through a specialty pharmacy?  I'm planning to (because I have to do this financially...) go to Walmart this weekend and ask them about availability/process for getting this med since it's somewhat specialty.  Just wanted to see if anyone has been there done that with a retail pharmacy.



* Vivelle dots- nurse said these were ""quite expensive"" and I don't know how many I need.  What's common?  First of all I see there is a generic available- is the generic just as good?  It does not appear to be a TON cheaper, but every bit helps.   For an 8 count of the dots, GoodRX says I can get this at Walgreens for $38 (again, any experience with a retail pharmacy having this product in stock or being able to get it for you? - that's the generic)  My insurance says 90 for generic (8 dots) and 120 for brand name.   Another question on the patches- where do you place these on your body?  The nurse also said that insurance will sometimes cover this, but not at the doses they require so it will be out of pocket.  So that makes me think 8 dots is not going to last me a cycle


* Estrace oral tablets - I have these ""in stock"" at home from previous cycles and I know they are cheap even if I need to buy more.


* prometrium tablets (used vaginally)- I have these ""in stock"" also from previous months/my recent loss.  If I need more, I know there is a GoodRx coupon to get me a discount as my insurance seems to treat this med like some high tier specialty thing-- even the generic version.


* Crinone gel- this was the big one I was not expecting. (why both crinone and prometrium tabs)  I assumed PIO which is expensive too, but cheaper I think- this is like $20 a day no?  I see a $150 off or $15 total copay coupon online that I will try my best to use with my insurance (with insurance it's supposed to be only $15 and it seems like my insurance will cover this-- any experience with insurance covering it when they don't cover any infertility stuff?)  And I suppose if I need to drop $500 on this stuff, it will at least go against my deductible if I can use a network pharmacy.   Any experience getting this one off the shelf/ordered through a local retail pharmacy or do you need to go mail order specialty?


* steroid, antibiotic, etc.  - insurance should cover this, but I know doxycycline is used and I was on that for sinus infection- that is not cheap (when you have the type of prescription plan I have-- I had to use a GoodRx coupon for that too)



Sorry for all the maybe lame/newbie questions.  With IVF meds (and I did injectables in the past), it was always straight forward -- had to get them at mail order places. Now it seems like I have more choice and I want to find the best cost savings I can.  The nurse took total control of my IVF scripts and I now have like $1,000 worth of meds sitting in my cabinet at home because she didn't account for overfill (I would have ordered less and assumed overfill...reordered if needed) and she gave me no chance to shop around for prices- now granted I had literally 2 days to order/get my meds but they did the same thing with my IUI meds and I had to ask them to NOT send things without allowing me to pick the pharmacy because I had First Steps/Compassionate Care discounts that some places did not take.",[],False,,0,False,FET Protocol/Meds Questions,[],r/infertility,False,0,,0,,,False,t3_5y9wt4,False,dark,0.8,,public,3,0,{},,d70f54ce-930e-11e4-8710-22000b26873e,False,,False,False,,{},,False,3,,self,,1489000547.0,,{},,True,,1489029116.0,text,0,,,self.infertility,True,"<!-- SC_OFF --><div class=""md""><p>I don&#39;t have my official protocol yet, but i talked to the nurse for a few minutes yesterday about meds.  I wanted to get a handle on costs because we&#39;re totally OOP (and I have a high deductible health plan that doesn&#39;t pay for anything until I meet the deductible- so even meds that are covered like estrogen will be OOP until I spend another $800 then co-pays kick in depending on the tier of med) and we&#39;re seriously very tapped out financially after IVF.  So I was a little bummed to hear from the nurse that I might be looking at about $1,000 worth of meds.  Is this normal?  </p>

<p>Here is what she said I&#39;d need:</p>

<ul>
<li><p>bcp - have them and they are free anyway w/ insurance for 3 weeks-- starting tomorrow.</p></li>
<li><p>Lupron 2 week kit which she said is about $500.  Is this real/accurate?  I looked on GoodRx and found that you can get the kit at Walmart (appears the same dose/strength) for $185.  Has anyone done this and not gone through a specialty pharmacy?  I&#39;m planning to (because I have to do this financially...) go to Walmart this weekend and ask them about availability/process for getting this med since it&#39;s somewhat specialty.  Just wanted to see if anyone has been there done that with a retail pharmacy.</p></li>
<li><p>Vivelle dots- nurse said these were &quot;quite expensive&quot; and I don&#39;t know how many I need.  What&#39;s common?  First of all I see there is a generic available- is the generic just as good?  It does not appear to be a TON cheaper, but every bit helps.   For an 8 count of the dots, GoodRX says I can get this at Walgreens for $38 (again, any experience with a retail pharmacy having this product in stock or being able to get it for you? - that&#39;s the generic)  My insurance says 90 for generic (8 dots) and 120 for brand name.   Another question on the patches- where do you place these on your body?  The nurse also said that insurance will sometimes cover this, but not at the doses they require so it will be out of pocket.  So that makes me think 8 dots is not going to last me a cycle</p></li>
<li><p>Estrace oral tablets - I have these &quot;in stock&quot; at home from previous cycles and I know they are cheap even if I need to buy more.</p></li>
<li><p>prometrium tablets (used vaginally)- I have these &quot;in stock&quot; also from previous months/my recent loss.  If I need more, I know there is a GoodRx coupon to get me a discount as my insurance seems to treat this med like some high tier specialty thing-- even the generic version.</p></li>
<li><p>Crinone gel- this was the big one I was not expecting. (why both crinone and prometrium tabs)  I assumed PIO which is expensive too, but cheaper I think- this is like $20 a day no?  I see a $150 off or $15 total copay coupon online that I will try my best to use with my insurance (with insurance it&#39;s supposed to be only $15 and it seems like my insurance will cover this-- any experience with insurance covering it when they don&#39;t cover any infertility stuff?)  And I suppose if I need to drop $500 on this stuff, it will at least go against my deductible if I can use a network pharmacy.   Any experience getting this one off the shelf/ordered through a local retail pharmacy or do you need to go mail order specialty?</p></li>
<li><p>steroid, antibiotic, etc.  - insurance should cover this, but I know doxycycline is used and I was on that for sinus infection- that is not cheap (when you have the type of prescription plan I have-- I had to use a GoodRx coupon for that too)</p></li>
</ul>

<p>Sorry for all the maybe lame/newbie questions.  With IVF meds (and I did injectables in the past), it was always straight forward -- had to get them at mail order places. Now it seems like I have more choice and I want to find the best cost savings I can.  The nurse took total control of my IVF scripts and I now have like $1,000 worth of meds sitting in my cabinet at home because she didn&#39;t account for overfill (I would have ordered less and assumed overfill...reordered if needed) and she gave me no chance to shop around for prices- now granted I had literally 2 days to order/get my meds but they did the same thing with my IUI meds and I had to ask them to NOT send things without allowing me to pick the pharmacy because I had First Steps/Compassionate Care discounts that some places did not take.</p>
</div><!-- SC_ON -->",,,,,True,False,False,False,False,[],[],False,False,False,False,"38, tubal/endo, 3 losses, FET#3- Feb21",[],False,,,,t5_2saej,,,,5y9wt4,True,,foreverblessed17,,26,True,no_ads,False,[],dark,/r/infertility/comments/5y9wt4/fet_protocolmeds_questions/,no_ads,False,https://www.reddit.com/r/infertility/comments/5y9wt4/fet_protocolmeds_questions/,25375,1489000316.0,0,,False,False,{},t2_10ueif,False,[],text,False,,,,
203,2048,confidence,<praw.reddit.Reddit object at 0x7f2244aead90>,,infertility,"Hello. I've been reading this forum for some time as we work thru this shitty process. I am 41 and have been struggling since age 36. We tried half assedly for a year and then seriously for another 8 months until a dr visit revealed a large mass on my ovary.  They thought it was the big c so immediately operated and it was a Dermoid and a big mess of endo (stage 4 endo). Healed from that and tried 3 months and straight to ivf where I did three cycles over the next year and failed all. Did not even make it to retrieval as I would barely respond to meds.  

Then we made the decision to do donor egg (husband has no issues) and waited a year for a donor to become available. (Big NYC clinic). This was actually not terrible as I was able to recover mentally and grieve the loss. By the time we got the donor I was ready! She is perfect and is very similar to me in appearance and some other traits.  We do the process and I end up failing that too. We have 7 embryos frozen so that's great - the donor was a rockstar and so was my husband. It's just me. First the lining wasn't triple striped then the dr saw little pockets or cysts in my lining so he cancelled me. Dr did try to aspirate but he still didn't like how it looked.  He says this just happens but I am wondering wtf because I had a mock cycle 8 months ago that was fine and a normal saline sonogram right at the beginning of the cycle. 

They are inducing a period and doing another saline sono after that and if that is okay we try again with me. It also always seemed my estrogen was never building up fast enough despite the patches. And towards the end my progesterone was low. And my thyroid is borderline at 2.5. All these issues I didn't know I had. 

I am very upset because I was sold on donor as a slam dunk and my stupid body failed the ""easy"" part. Has anyone had a bad lining and then was ok for the next cycle? I am worried this is something bad but my dr says it's not cancer etc.  

Could stress affect it? I have an ill family member and there was a lot of stress and sleepless nights around that. My nurse said there is nothing I did to cause this but I wonder.  I also had wine a few times. If I am allowed to proceed I will not do that and will eat better, do more yoga and accupuncture. Does anyone have any other suggestions for what I could do to help this along?

Thanks in advance ",[],False,,0,False,Donor egg / lining problems,[],r/infertility,False,0,,0,,,False,t3_5y9i01,False,dark,1.0,,public,2,0,{},,,False,,False,False,,{},,False,2,,self,,False,,{},,True,,1489025246.0,text,0,,,self.infertility,False,"<!-- SC_OFF --><div class=""md""><p>Hello. I&#39;ve been reading this forum for some time as we work thru this shitty process. I am 41 and have been struggling since age 36. We tried half assedly for a year and then seriously for another 8 months until a dr visit revealed a large mass on my ovary.  They thought it was the big c so immediately operated and it was a Dermoid and a big mess of endo (stage 4 endo). Healed from that and tried 3 months and straight to ivf where I did three cycles over the next year and failed all. Did not even make it to retrieval as I would barely respond to meds.  </p>

<p>Then we made the decision to do donor egg (husband has no issues) and waited a year for a donor to become available. (Big NYC clinic). This was actually not terrible as I was able to recover mentally and grieve the loss. By the time we got the donor I was ready! She is perfect and is very similar to me in appearance and some other traits.  We do the process and I end up failing that too. We have 7 embryos frozen so that&#39;s great - the donor was a rockstar and so was my husband. It&#39;s just me. First the lining wasn&#39;t triple striped then the dr saw little pockets or cysts in my lining so he cancelled me. Dr did try to aspirate but he still didn&#39;t like how it looked.  He says this just happens but I am wondering wtf because I had a mock cycle 8 months ago that was fine and a normal saline sonogram right at the beginning of the cycle. </p>

<p>They are inducing a period and doing another saline sono after that and if that is okay we try again with me. It also always seemed my estrogen was never building up fast enough despite the patches. And towards the end my progesterone was low. And my thyroid is borderline at 2.5. All these issues I didn&#39;t know I had. </p>

<p>I am very upset because I was sold on donor as a slam dunk and my stupid body failed the &quot;easy&quot; part. Has anyone had a bad lining and then was ok for the next cycle? I am worried this is something bad but my dr says it&#39;s not cancer etc.  </p>

<p>Could stress affect it? I have an ill family member and there was a lot of stress and sleepless nights around that. My nurse said there is nothing I did to cause this but I wonder.  I also had wine a few times. If I am allowed to proceed I will not do that and will eat better, do more yoga and accupuncture. Does anyone have any other suggestions for what I could do to help this along?</p>

<p>Thanks in advance </p>
</div><!-- SC_ON -->",,,,,True,False,False,False,False,[],[],False,False,False,False,"41, two cancelled ivf cycles, 1 cancelled de transfer, doing fet",[],False,,,,t5_2saej,,,,5y9i01,True,,Catface202020,,11,True,no_ads,False,[],dark,/r/infertility/comments/5y9i01/donor_egg_lining_problems/,no_ads,False,https://www.reddit.com/r/infertility/comments/5y9i01/donor_egg_lining_problems/,25375,1488996446.0,0,,False,False,{},t2_15zzji,False,[],text,False,,,,
204,2048,confidence,<praw.reddit.Reddit object at 0x7f2244aead90>,,infertility,"Hey friends! I literally can not find this question anywhere, so forgive me if it's obvious. I just started femara yesterday, day 3 of my cycle. What I'm wondering is if femara will make my period stop? I normally have a 5 day period, and it's already slowing down like crazy. Will I finish out this period? Or does femara stop it in its tracks to get growing a follicle? Thanks for the help!",[],False,,0,False,Femara question,[],r/infertility,False,0,,0,,,False,t3_5y97ff,False,dark,1.0,,public,1,0,{},,,False,,False,False,,{},,False,1,,self,,False,,{},,True,,1489022408.0,text,0,,,self.infertility,False,"<!-- SC_OFF --><div class=""md""><p>Hey friends! I literally can not find this question anywhere, so forgive me if it&#39;s obvious. I just started femara yesterday, day 3 of my cycle. What I&#39;m wondering is if femara will make my period stop? I normally have a 5 day period, and it&#39;s already slowing down like crazy. Will I finish out this period? Or does femara stop it in its tracks to get growing a follicle? Thanks for the help!</p>
</div><!-- SC_ON -->",,,,,True,True,False,False,False,[],[],False,False,False,False,"24, 2yrs, 3rd cycle femara+ovidrel+progest, IUI #1 in July",[],False,,,,t5_2saej,,,,5y97ff,True,,ksperry,,5,True,no_ads,False,[],dark,/r/infertility/comments/5y97ff/femara_question/,no_ads,False,https://www.reddit.com/r/infertility/comments/5y97ff/femara_question/,25375,1488993608.0,0,,False,False,{},t2_hfm8p,False,[],text,False,,,,
205,2048,confidence,<praw.reddit.Reddit object at 0x7f2244aead90>,,infertility,"So I've been wondering lately, after I had my daughter, I started losing my hair; just strands here and there. Then after her passing, it was worse. Clumps and clumps, fistfuls of hair. Which I keep getting blamed on stress. Which is always the answer I get for every ailment I have anymore. Which I think is BS. But I've been seeing my RE and she did some bloodwork to test for MTHFR and I didn't get results which I'm waiting on, but I did get a prescription called in for Folgard I believe it is, so I at least have a deficiency in Folate and Vitamin B12 and B9. On top of my various other deficiencies including Vitamin D, and high Homocysteine levels. The more I think about it - I'm wondering if this is all correlating and if anyone else with a mutation (and who has more specifics to their condition than I have) can give me some insight? 

I'm not sure as to what I can do to fix the problem. Even though I'm taking the prenatals and the supplements, it's not helping much. I don't think anything OTC will help much. So I'm not sure what to even start with at this point. ",[],False,,0,False,MTHFR Mutations and Hair Loss?,[],r/infertility,False,0,,0,,,False,t3_5y8z46,False,dark,0.83,,public,4,0,{},,,False,,False,False,,{},,False,4,,self,,False,,{},,True,,1489020293.0,text,0,,,self.infertility,False,"<!-- SC_OFF --><div class=""md""><p>So I&#39;ve been wondering lately, after I had my daughter, I started losing my hair; just strands here and there. Then after her passing, it was worse. Clumps and clumps, fistfuls of hair. Which I keep getting blamed on stress. Which is always the answer I get for every ailment I have anymore. Which I think is BS. But I&#39;ve been seeing my RE and she did some bloodwork to test for MTHFR and I didn&#39;t get results which I&#39;m waiting on, but I did get a prescription called in for Folgard I believe it is, so I at least have a deficiency in Folate and Vitamin B12 and B9. On top of my various other deficiencies including Vitamin D, and high Homocysteine levels. The more I think about it - I&#39;m wondering if this is all correlating and if anyone else with a mutation (and who has more specifics to their condition than I have) can give me some insight? </p>

<p>I&#39;m not sure as to what I can do to fix the problem. Even though I&#39;m taking the prenatals and the supplements, it&#39;s not helping much. I don&#39;t think anything OTC will help much. So I&#39;m not sure what to even start with at this point. </p>
</div><!-- SC_ON -->",,,,,True,False,False,False,False,[],[],False,False,False,False,,[],False,,,,t5_2saej,,,,5y8z46,True,,vegaholicx7,,19,True,no_ads,False,[],,/r/infertility/comments/5y8z46/mthfr_mutations_and_hair_loss/,no_ads,False,https://www.reddit.com/r/infertility/comments/5y8z46/mthfr_mutations_and_hair_loss/,25375,1488991493.0,0,,False,False,{},t2_15v7xl,False,[],text,False,,,,
206,2048,confidence,<praw.reddit.Reddit object at 0x7f2244aead90>,,infertility,[deleted],[],False,,0,False,Has anyone gone to the McGill Reproductive Centre in Montreal before?,[],r/infertility,False,0,,0,,,False,t3_5y8he7,False,dark,1.0,,public,2,0,{},,,False,,False,False,,{},,False,2,,default,,False,,{},,True,,1489015393.0,text,0,deleted,,self.infertility,False,"<!-- SC_OFF --><div class=""md""><p>[deleted]</p>
</div><!-- SC_ON -->",,,,,True,False,False,False,False,[],[],False,False,False,False,,[],False,,,,t5_2saej,,,,5y8he7,False,,,,0,True,no_ads,False,[],dark,/r/infertility/comments/5y8he7/has_anyone_gone_to_the_mcgill_reproductive_centre/,no_ads,False,https://www.reddit.com/r/infertility/comments/5y8he7/has_anyone_gone_to_the_mcgill_reproductive_centre/,25375,1488986593.0,0,,False,False,{},,,,,,,,,
207,2048,confidence,<praw.reddit.Reddit object at 0x7f2244aead90>,,infertility,"Although I am currently on my second medicated cycle with letrozole, I've reached a point where I am thinking a lot more in terms of what I will do when this month doesn't work out, rather than holding out hope that it will. This is cycle 31 (I think..) for us, but we are just getting into infertility treatment, and I appreciate how much I don't know. 

Just a week ago my husband accepted a job offer with a company that offers infertility treatment as a part of their healthcare coverage. I cannot overstate how lucky we feel to have the opportunity to have this with where we live in the US. He is receiving a set of onboarding materials, which includes our healthcare coverage options in the next couple of days. Of course we will be looking at the infertility coverage parts, what I am hoping some of you might be able to help with is what to look for. Are there certain elements we should be looking for or things that might not be worth it? Anything in the fine print that might make a difference or questions we should call and ask the insurance provider about? 

My working assumption is that it won't be simple, and I am worried about making the wrong choices because I did not know what to look for or ask. Thank you for any direction, experience, or advice you can offer!",[],False,,0,False,Infertility insurance coverage - I know there is a lot I don't know,[],r/infertility,False,0,,0,,,False,t3_5y85dc,False,dark,1.0,,public,6,0,{},,d70f54ce-930e-11e4-8710-22000b26873e,False,,False,False,,{},,False,6,,self,,False,,{},,True,,1489011732.0,text,0,,,self.infertility,False,"<!-- SC_OFF --><div class=""md""><p>Although I am currently on my second medicated cycle with letrozole, I&#39;ve reached a point where I am thinking a lot more in terms of what I will do when this month doesn&#39;t work out, rather than holding out hope that it will. This is cycle 31 (I think..) for us, but we are just getting into infertility treatment, and I appreciate how much I don&#39;t know. </p>

<p>Just a week ago my husband accepted a job offer with a company that offers infertility treatment as a part of their healthcare coverage. I cannot overstate how lucky we feel to have the opportunity to have this with where we live in the US. He is receiving a set of onboarding materials, which includes our healthcare coverage options in the next couple of days. Of course we will be looking at the infertility coverage parts, what I am hoping some of you might be able to help with is what to look for. Are there certain elements we should be looking for or things that might not be worth it? Anything in the fine print that might make a difference or questions we should call and ask the insurance provider about? </p>

<p>My working assumption is that it won&#39;t be simple, and I am worried about making the wrong choices because I did not know what to look for or ask. Thank you for any direction, experience, or advice you can offer!</p>
</div><!-- SC_ON -->",,,,,True,False,False,False,False,[],[],False,False,False,False,"36F, TTC 3+yrs, RPL, 2 IVF, FET 1 now",[],False,,,,t5_2saej,,,,5y85dc,True,,impetuousraven,,15,True,no_ads,False,[],dark,/r/infertility/comments/5y85dc/infertility_insurance_coverage_i_know_there_is_a/,no_ads,False,https://www.reddit.com/r/infertility/comments/5y85dc/infertility_insurance_coverage_i_know_there_is_a/,25375,1488982932.0,0,,False,False,{},t2_wmn36,False,[],text,False,,,,
208,2048,confidence,<praw.reddit.Reddit object at 0x7f2244aead90>,,infertility,https://youtu.be/ga0P6mc_V7E,[],False,,0,False,Our clinic where we are undergoing our IVF put up this video for Women's Day. Thought it's nice to share here.,[],r/infertility,False,0,,0,,,False,t3_5y7es3,False,dark,0.86,,public,5,0,{},,,False,,False,False,,{},,False,5,,self,,False,,{},,True,,1489001516.0,text,0,,,self.infertility,False,"<!-- SC_OFF --><div class=""md""><p><a href=""https://youtu.be/ga0P6mc_V7E"">https://youtu.be/ga0P6mc_V7E</a></p>
</div><!-- SC_ON -->",,,,,True,False,False,False,False,[],[],False,False,False,False,,[],False,,,,t5_2saej,,,,5y7es3,True,,cricket_hater,,1,True,no_ads,False,[],,/r/infertility/comments/5y7es3/our_clinic_where_we_are_undergoing_our_ivf_put_up/,no_ads,False,https://www.reddit.com/r/infertility/comments/5y7es3/our_clinic_where_we_are_undergoing_our_ivf_put_up/,25375,1488972716.0,0,,False,False,{},t2_7fyft,False,[],text,False,self,"{'images': [{'source': {'url': 'https://external-preview.redd.it/0HHHbk5VCk-oi-1ooBBDgYnAiO6JBEm66X0cpFZj7yM.jpg?auto=webp&s=044f69aa77404a297b5216dce42c6a366b108c2a', 'width': 480, 'height': 360}, 'resolutions': [{'url': 'https://external-preview.redd.it/0HHHbk5VCk-oi-1ooBBDgYnAiO6JBEm66X0cpFZj7yM.jpg?width=108&crop=smart&auto=webp&s=88dc3651362485330cd9c20d22f75121fa0854a8', 'width': 108, 'height': 81}, {'url': 'https://external-preview.redd.it/0HHHbk5VCk-oi-1ooBBDgYnAiO6JBEm66X0cpFZj7yM.jpg?width=216&crop=smart&auto=webp&s=95c7bf8d0a62bfa02629b2a61c9f22ed35e2e167', 'width': 216, 'height': 162}, {'url': 'https://external-preview.redd.it/0HHHbk5VCk-oi-1ooBBDgYnAiO6JBEm66X0cpFZj7yM.jpg?width=320&crop=smart&auto=webp&s=bb104633e87403baf6ea76cd8aea285bbe74970d', 'width': 320, 'height': 240}], 'variants': {}, 'id': 'jr_vn9hvbhWAGGv7Masef_0rY-S5xS6OOAV9-RRC458'}], 'enabled': False}",,
