71,2048,confidence,<praw.reddit.Reddit object at 0x7f2244aead90>,,infertility,"I have an appointment with RE on Monday to start our plan for  Clomid/Femara since my prolactin went down (and is hopefully staying in the right range!!). I have a couple of questions if you wonderful people do not mind: 

1. I have read that Femara has slightly higher success rates than Clomid due to better endometrial development. However, is it bad to skip Clomid and go to Femara first?

2. I want to go fully monitored during the cycle. From researching, I think that means ultrasound CD10-12, then trigger shot, then blood work on CD21? Am I missing anything? I just want to make sure I go to the RE fairly educated on my options.

Thank you all very much!",[],False,,0,False,Monitoring with Clomid/Femara,[],r/infertility,False,0,,0,,,False,t3_605709,False,dark,0.86,,public,5,0,{},,,False,,False,False,,{},,False,5,,self,,False,,{},,True,,1489886291.0,text,0,,,self.infertility,True,"<!-- SC_OFF --><div class=""md""><p>I have an appointment with RE on Monday to start our plan for  Clomid/Femara since my prolactin went down (and is hopefully staying in the right range!!). I have a couple of questions if you wonderful people do not mind: </p>

<ol>
<li><p>I have read that Femara has slightly higher success rates than Clomid due to better endometrial development. However, is it bad to skip Clomid and go to Femara first?</p></li>
<li><p>I want to go fully monitored during the cycle. From researching, I think that means ultrasound CD10-12, then trigger shot, then blood work on CD21? Am I missing anything? I just want to make sure I go to the RE fairly educated on my options.</p></li>
</ol>

<p>Thank you all very much!</p>
</div><!-- SC_ON -->",,,,,True,False,False,False,False,[],[],False,False,False,False,,[],False,,,,t5_2saej,,,,605709,True,,helpplease187,,24,True,no_ads,False,[],,/r/infertility/comments/605709/monitoring_with_clomidfemara/,no_ads,False,https://www.reddit.com/r/infertility/comments/605709/monitoring_with_clomidfemara/,25375,1489857491.0,0,,False,False,{},t2_13s6pb,False,[],text,False,,,,
72,2048,confidence,<praw.reddit.Reddit object at 0x7f2244aead90>,,infertility,[removed],[],False,,0,False,4 Risk Determinants of Infertility | Dr. Garima Tyagi,[],r/infertility,False,0,,0,,,False,t3_603oz8,False,dark,1.0,,public,1,0,{},,,False,,False,False,,{},,False,1,,default,,False,,{},,True,,1489865961.0,text,0,,,self.infertility,False,"<!-- SC_OFF --><div class=""md""><p>[removed]</p>
</div><!-- SC_ON -->",,,,,True,True,False,False,False,[],[],False,False,False,False,,[],False,,,,t5_2saej,,,,603oz8,False,,drgarimatyagi,,0,True,no_ads,False,[],,/r/infertility/comments/603oz8/4_risk_determinants_of_infertility_dr_garima_tyagi/,no_ads,False,https://www.reddit.com/r/infertility/comments/603oz8/4_risk_determinants_of_infertility_dr_garima_tyagi/,25375,1489837161.0,0,,False,False,{},t2_1528cu,False,[],text,False,,,,
73,2048,confidence,<praw.reddit.Reddit object at 0x7f2244aead90>,,infertility,"Use this thread to share anything not necessarily related to infertility. Rant or rave, bitch, moan, share something funny, anything goes!",[],False,,0,False,Saturday Off Topic Thread,[],r/infertility,False,0,,0,,,False,t3_603fev,False,dark,1.0,,public,4,0,{},,,False,,False,False,,{},,False,4,,self,,False,,{},,True,,1489860554.0,text,0,,,self.infertility,False,"<!-- SC_OFF --><div class=""md""><p>Use this thread to share anything not necessarily related to infertility. Rant or rave, bitch, moan, share something funny, anything goes!</p>
</div><!-- SC_ON -->",,,,,True,False,False,False,False,[],[],False,False,False,False,,[],False,,,moderator,t5_2saej,,,,603fev,True,,AutoModerator,,293,False,no_ads,False,[],,/r/infertility/comments/603fev/saturday_off_topic_thread/,no_ads,False,https://www.reddit.com/r/infertility/comments/603fev/saturday_off_topic_thread/,25375,1489831754.0,0,,False,False,{},t2_6l4z3,True,[],text,False,,,,
74,2048,confidence,<praw.reddit.Reddit object at 0x7f2244aead90>,,infertility,"I'm just wondering if it would be worth testing this early on? I'm slowly going insane with waiting I think but I don't want to test if there's a high chance of it being negative. Also, I've read that with implantation you don't always spot which I'm hoping is right, I think I felt implantation as the stabby pains woke me up at 3am (if it even was that) but I'm not having any kind of spotting. Only period type cramps all the way through so I'm unsure whether this is even going to work. 

I just read the post back and realised it's a rambled mess, I'm sorry I'm emotionally all over the place right now.",[],False,,0,False,5dp 5dt to early to test?,[],r/infertility,False,0,,0,,,False,t3_603alw,False,dark,0.67,,public,1,0,{},,,False,,False,False,,{},,False,1,,self,,False,,{},,True,,1489857589.0,text,0,,,self.infertility,True,"<!-- SC_OFF --><div class=""md""><p>I&#39;m just wondering if it would be worth testing this early on? I&#39;m slowly going insane with waiting I think but I don&#39;t want to test if there&#39;s a high chance of it being negative. Also, I&#39;ve read that with implantation you don&#39;t always spot which I&#39;m hoping is right, I think I felt implantation as the stabby pains woke me up at 3am (if it even was that) but I&#39;m not having any kind of spotting. Only period type cramps all the way through so I&#39;m unsure whether this is even going to work. </p>

<p>I just read the post back and realised it&#39;s a rambled mess, I&#39;m sorry I&#39;m emotionally all over the place right now.</p>
</div><!-- SC_ON -->",,,,,True,True,False,False,False,[],[],False,False,False,False,,[],False,,,,t5_2saej,,,,603alw,True,,Nichard,,22,True,no_ads,False,[],,/r/infertility/comments/603alw/5dp_5dt_to_early_to_test/,no_ads,False,https://www.reddit.com/r/infertility/comments/603alw/5dp_5dt_to_early_to_test/,25375,1489828789.0,0,,False,False,{},t2_bls7x,False,[],text,False,,,,
75,2048,confidence,<praw.reddit.Reddit object at 0x7f2244aead90>,,infertility,"Vent Sesh Ahead: ""The one in which I tell another person's story.""  (Trigger Warning: There's probably lots of them in this post, I'm sorry!)

My best friend in the world has seen me in good, bad, and everything in between. We both moved to a new neighborhood in the summer before 8th grade, bonded over being ""the new kids"", and have been thick as theives ever since. When we were younger and the whole world lay ahead of us so perfectly planned, we were going to stick together - we planned to buy houses near each other, make sure each other's guys were ""the one"", help each other plan our weddings, and eventually have families at the same time so our kids could grow up with built-in best friends like their moms.

The house part worked out according to plan. 

Then the married part worked out according to plan (or so we thought at the time). 

Then the other shoe dropped... her soldier husband got sent to an active war zone. We sat together and held hands while we watched every news report. We watched stupid movies to distract her. We sat on her sofa and cried together worried about him. 

Then, miraculously, he came home unscathed. He was home for about 4 minutes when he got orders that he'd have to go back in a few months...and that's where our plans began to unravel. 

It's now almost 6 years later, and they have two beautiful kids, a warm and inviting home, great jobs, and a strong future together. 

What do I have to show for the last 6 years? I get to go sit at their dinner table from time to time and love on her babies. That's what I spent the last 4 hours doing (because I refuse to let my health steal another single drop of joy from my life), and if that wasn't enough, the period tracker app my OBGYN asked me to install on my last visit (cuz, ya know, I try to ignore the glaring monthly reminder of what I don't have, and she says that's bad for my medical records) just sent me a push notification that says ""Your chances of pregnancy drop significantly tomorrow."" Gee, thanks for the reminder! *sarcasm*

*cue the wine straight from the bottle and the uncontrollable sobbing*",[],False,,0,False,"""Your chances of pregnancy drop significantly tomorrow.""",[],r/infertility,False,0,,0,,,False,t3_602jhc,False,dark,1.0,,public,7,0,{},,d70f54ce-930e-11e4-8710-22000b26873e,False,,False,False,,{},,False,7,,self,,False,,{},,True,,1489842072.0,text,0,,,self.infertility,True,"<!-- SC_OFF --><div class=""md""><p>Vent Sesh Ahead: &quot;The one in which I tell another person&#39;s story.&quot;  (Trigger Warning: There&#39;s probably lots of them in this post, I&#39;m sorry!)</p>

<p>My best friend in the world has seen me in good, bad, and everything in between. We both moved to a new neighborhood in the summer before 8th grade, bonded over being &quot;the new kids&quot;, and have been thick as theives ever since. When we were younger and the whole world lay ahead of us so perfectly planned, we were going to stick together - we planned to buy houses near each other, make sure each other&#39;s guys were &quot;the one&quot;, help each other plan our weddings, and eventually have families at the same time so our kids could grow up with built-in best friends like their moms.</p>

<p>The house part worked out according to plan. </p>

<p>Then the married part worked out according to plan (or so we thought at the time). </p>

<p>Then the other shoe dropped... her soldier husband got sent to an active war zone. We sat together and held hands while we watched every news report. We watched stupid movies to distract her. We sat on her sofa and cried together worried about him. </p>

<p>Then, miraculously, he came home unscathed. He was home for about 4 minutes when he got orders that he&#39;d have to go back in a few months...and that&#39;s where our plans began to unravel. </p>

<p>It&#39;s now almost 6 years later, and they have two beautiful kids, a warm and inviting home, great jobs, and a strong future together. </p>

<p>What do I have to show for the last 6 years? I get to go sit at their dinner table from time to time and love on her babies. That&#39;s what I spent the last 4 hours doing (because I refuse to let my health steal another single drop of joy from my life), and if that wasn&#39;t enough, the period tracker app my OBGYN asked me to install on my last visit (cuz, ya know, I try to ignore the glaring monthly reminder of what I don&#39;t have, and she says that&#39;s bad for my medical records) just sent me a push notification that says &quot;Your chances of pregnancy drop significantly tomorrow.&quot; Gee, thanks for the reminder! <em>sarcasm</em></p>

<p><em>cue the wine straight from the bottle and the uncontrollable sobbing</em></p>
</div><!-- SC_ON -->",,,,,True,False,False,False,False,[],[],False,False,False,False,"31F / 5MC, 0 Fertility, 0 Sense of Humour...",[],False,,,,t5_2saej,,,,602jhc,True,,OrneryPanduhh,,28,True,no_ads,False,[],dark,/r/infertility/comments/602jhc/your_chances_of_pregnancy_drop_significantly/,no_ads,False,https://www.reddit.com/r/infertility/comments/602jhc/your_chances_of_pregnancy_drop_significantly/,25375,1489813272.0,0,,False,False,{},t2_166byo,False,[],text,False,,,,
76,2048,confidence,<praw.reddit.Reddit object at 0x7f2244aead90>,,infertility,"So... talking about initiatives.... 

I've been wondering if there is interest in this community to create a regular or semi-regular science-focused thread?

I'm thinking something were we could have a different 'theme' each week (?) and people could post any research they have found on that topic.
My proposal would be that the research would have to be peer-reviewed in a major scientific journal and the person posting that paper should provide a link and if it's behind a pay-wall (or even if it isn't) provide the key points (the summarised data and any conclusions) of the paper.

I know a bunch of us are scientists (or almost scientists, you know those medical Drs out there.... nudge nudge) so for me I know I've found a lot of solace in reading the sources.

The idea would also be that this could be a resource so maybe we could collect which topics have been discussed previously and the threads wouldn't have to ever 'die' but be available for new people coming in for example.

Of course this would be a community-based effort and would not replace the expert opinion of your RE, that's not the point.

Thoughts? Ideas? Suggestions? Modifications? Potential issues you see? Format suggestions?
",[],False,,0,False,'Science' thread,[],r/infertility,False,0,,0,,,False,t3_602bp8,False,dark,1.0,,public,39,0,{},,d70f54ce-930e-11e4-8710-22000b26873e,False,,False,False,,{},,False,39,,self,,False,,{},,True,,1489838581.0,text,0,,,self.infertility,False,"<!-- SC_OFF --><div class=""md""><p>So... talking about initiatives.... </p>

<p>I&#39;ve been wondering if there is interest in this community to create a regular or semi-regular science-focused thread?</p>

<p>I&#39;m thinking something were we could have a different &#39;theme&#39; each week (?) and people could post any research they have found on that topic.
My proposal would be that the research would have to be peer-reviewed in a major scientific journal and the person posting that paper should provide a link and if it&#39;s behind a pay-wall (or even if it isn&#39;t) provide the key points (the summarised data and any conclusions) of the paper.</p>

<p>I know a bunch of us are scientists (or almost scientists, you know those medical Drs out there.... nudge nudge) so for me I know I&#39;ve found a lot of solace in reading the sources.</p>

<p>The idea would also be that this could be a resource so maybe we could collect which topics have been discussed previously and the threads wouldn&#39;t have to ever &#39;die&#39; but be available for new people coming in for example.</p>

<p>Of course this would be a community-based effort and would not replace the expert opinion of your RE, that&#39;s not the point.</p>

<p>Thoughts? Ideas? Suggestions? Modifications? Potential issues you see? Format suggestions?</p>
</div><!-- SC_ON -->",,,,,True,False,False,False,False,[],[],False,False,False,False,"39, unicorn uterus, 4 IVFs no embryos",[],False,,,,t5_2saej,,,,602bp8,True,,ttcnerd,,44,True,no_ads,False,[],dark,/r/infertility/comments/602bp8/science_thread/,no_ads,False,https://www.reddit.com/r/infertility/comments/602bp8/science_thread/,25375,1489809781.0,0,,False,False,{},t2_wta02,False,[],text,False,,,,
77,2048,confidence,<praw.reddit.Reddit object at 0x7f2244aead90>,,infertility,"I'm currently healing from my last egg retrieval. They got 34 eggs, 21 were mature, and we have 15 embryos cooking. I should be thrilled, but after two pregnancy losses and how sick I'm feeling from this cycle, I'm just fucking tired. SO many pregnancy announcements and new babies going on.. I'm sick of the whole thing. Has anyone else ever felt like this? I really never want to do another egg retrieval ever again. ",[],False,,0,False,"IVF, full cycle number 3.. tired",[],r/infertility,False,0,,0,,,False,t3_601z02,False,dark,1.0,,public,2,0,{},,,False,,False,False,,{},,False,2,,self,,False,,{},,True,,1489833385.0,text,0,,,self.infertility,False,"<!-- SC_OFF --><div class=""md""><p>I&#39;m currently healing from my last egg retrieval. They got 34 eggs, 21 were mature, and we have 15 embryos cooking. I should be thrilled, but after two pregnancy losses and how sick I&#39;m feeling from this cycle, I&#39;m just fucking tired. SO many pregnancy announcements and new babies going on.. I&#39;m sick of the whole thing. Has anyone else ever felt like this? I really never want to do another egg retrieval ever again. </p>
</div><!-- SC_ON -->",,,,,True,False,False,False,False,[],[],False,False,False,False,,[],False,,,,t5_2saej,,,,601z02,True,,headislead,,24,True,no_ads,False,[],,/r/infertility/comments/601z02/ivf_full_cycle_number_3_tired/,no_ads,False,https://www.reddit.com/r/infertility/comments/601z02/ivf_full_cycle_number_3_tired/,25375,1489804585.0,0,,False,False,{},t2_eeq1o,False,[],text,False,,,,
