216,2048,confidence,<praw.reddit.Reddit object at 0x7f2244aead90>,,infertility,"As the title states, I am pretty worried about my upcoming FET and could use some advice/reassurances even though I haven't been posting on here in a long time.

In preparation for this FET, I was on birth control pills. The nurse made it very clear that I wasn't supposed to start the estrace until day 1 of my cycle. Monday, before bed, I had some bright red spotting. I figured this signaled the start of my period especially since I had been off BCPs for 4 days. I took the first estrace Tuesday morning. Since then though, I haven't really gotten a full flow. I worried I took the estrace too soon. I called the nurse today and she said it was fine, but I'm not certain I explained everything well enough. I did read an old post on here about someone going directly from BCPs to estrace without a withdrawal bleed, so maybe I am ok?  

Thank you for reading. I am just so nervous I have already screwed this cycle up. ",t2_wvmxb,False,,0,False,Worried about Upcoming FET,[],r/infertility,False,0,,0,,,False,t3_6ej5y3,False,dark,0.72,,public,3,0,{},,,False,[],,False,False,,{},,False,3,,False,self,False,,[],{},,True,,1496305392.0,text,0,,,text,self.infertility,False,"<!-- SC_OFF --><div class=""md""><p>As the title states, I am pretty worried about my upcoming FET and could use some advice/reassurances even though I haven&#39;t been posting on here in a long time.</p>

<p>In preparation for this FET, I was on birth control pills. The nurse made it very clear that I wasn&#39;t supposed to start the estrace until day 1 of my cycle. Monday, before bed, I had some bright red spotting. I figured this signaled the start of my period especially since I had been off BCPs for 4 days. I took the first estrace Tuesday morning. Since then though, I haven&#39;t really gotten a full flow. I worried I took the estrace too soon. I called the nurse today and she said it was fine, but I&#39;m not certain I explained everything well enough. I did read an old post on here about someone going directly from BCPs to estrace without a withdrawal bleed, so maybe I am ok?  </p>

<p>Thank you for reading. I am just so nervous I have already screwed this cycle up. </p>
</div><!-- SC_ON -->",,,,,True,False,False,False,False,[],[],False,False,False,False,"34 Unexplained, IUIs. IVF. 1 FET",[],False,,,,t5_2saej,,,,6ej5y3,True,,BooksandSandwiches,,10,True,no_ads,False,[],False,dark,/r/infertility/comments/6ej5y3/worried_about_upcoming_fet/,no_ads,False,https://www.reddit.com/r/infertility/comments/6ej5y3/worried_about_upcoming_fet/,25375,1496276592.0,0,,False,False,{},,,
217,2048,confidence,<praw.reddit.Reddit object at 0x7f2244aead90>,,infertility,[deleted],,False,,0,False,Never ending parade of ovarian cysts and what to do,[],r/infertility,False,0,,0,,,False,t3_6eilvd,False,dark,0.99,,public,8,0,{},,,False,[],,False,False,,{},,False,8,,,default,False,,,{},,True,,1496299586.0,text,0,,,,self.infertility,False,"<!-- SC_OFF --><div class=""md""><p>[deleted]</p>
</div><!-- SC_ON -->",,,,,True,False,False,False,False,[],[],False,False,False,False,,[],False,,,,t5_2saej,,,,6eilvd,False,,,,21,True,no_ads,False,[],,dark,/r/infertility/comments/6eilvd/never_ending_parade_of_ovarian_cysts_and_what_to/,no_ads,False,https://www.reddit.com/r/infertility/comments/6eilvd/never_ending_parade_of_ovarian_cysts_and_what_to/,25375,1496270786.0,0,,False,False,{},,,
218,2048,confidence,<praw.reddit.Reddit object at 0x7f2244aead90>,,infertility,"So we had genetic panels done through 23andme, and since [last month's FDA ruling](https://www.fda.gov/newsevents/newsroom/pressannouncements/ucm551185.htm) allowing them to release more medical results, I learned I am a carrier of the above variant. I submitted more blood to the Alpha-1 registry, to narrow down my genotype. I'm still waiting to hear back on that.

I've had some weird liver enzyme results from bloodwork previously, but no doctor has ever really attempted to explain it to me. Nobody has seemed particularly concerned about it, either. The deficiency seems relatively common, and of most concern to smokers. I'm asymptomatic, although I've had erythema nodosum in the past, and possibly panniculitis, although til now, I've written them off as hives.

But now I'm wondering if it's playing a part in my infertility. I found one study (https://www.ncbi.nlm.nih.gov/pubmed/8540927) but it seems to be a case study of one patient. Really, it's only confused me more, especially this bit: ""Patients with non-ZZ genotypes or who are heterozygotes may have favorable pregnancy outcomes."" 

Another study says A1AT deficiency is more prevalent in twins (I'm a twin!) and their parents, and that the variant can actually ENHANCE fertility. https://www.ncbi.nlm.nih.gov/pubmed/3495719

Does anyone know more about this? Once I've heard back from the registry, I intend to make use of their offer of genetic counselling... And I'll bring it up to the RE at my appointment in two weeks. I'd also love to read full texts of the papers, if anyone can point me to a way to access them, I'd appreciate it.",t2_z7va2,False,,0,False,Alpha-1 antitrypsin deficiency,[],r/infertility,False,0,,0,,,False,t3_6eibjj,False,dark,0.72,,public,3,0,{},,,False,[],,False,False,,{},,False,3,,False,self,False,,[],{},,True,,1496296773.0,text,0,,,text,self.infertility,False,"<!-- SC_OFF --><div class=""md""><p>So we had genetic panels done through 23andme, and since <a href=""https://www.fda.gov/newsevents/newsroom/pressannouncements/ucm551185.htm"">last month&#39;s FDA ruling</a> allowing them to release more medical results, I learned I am a carrier of the above variant. I submitted more blood to the Alpha-1 registry, to narrow down my genotype. I&#39;m still waiting to hear back on that.</p>

<p>I&#39;ve had some weird liver enzyme results from bloodwork previously, but no doctor has ever really attempted to explain it to me. Nobody has seemed particularly concerned about it, either. The deficiency seems relatively common, and of most concern to smokers. I&#39;m asymptomatic, although I&#39;ve had erythema nodosum in the past, and possibly panniculitis, although til now, I&#39;ve written them off as hives.</p>

<p>But now I&#39;m wondering if it&#39;s playing a part in my infertility. I found one study (<a href=""https://www.ncbi.nlm.nih.gov/pubmed/8540927"">https://www.ncbi.nlm.nih.gov/pubmed/8540927</a>) but it seems to be a case study of one patient. Really, it&#39;s only confused me more, especially this bit: &quot;Patients with non-ZZ genotypes or who are heterozygotes may have favorable pregnancy outcomes.&quot; </p>

<p>Another study says A1AT deficiency is more prevalent in twins (I&#39;m a twin!) and their parents, and that the variant can actually ENHANCE fertility. <a href=""https://www.ncbi.nlm.nih.gov/pubmed/3495719"">https://www.ncbi.nlm.nih.gov/pubmed/3495719</a></p>

<p>Does anyone know more about this? Once I&#39;ve heard back from the registry, I intend to make use of their offer of genetic counselling... And I&#39;ll bring it up to the RE at my appointment in two weeks. I&#39;d also love to read full texts of the papers, if anyone can point me to a way to access them, I&#39;d appreciate it.</p>
</div><!-- SC_ON -->",,,,,True,False,False,False,False,[],[],False,False,False,False,,[],False,,,,t5_2saej,,,,6eibjj,True,,pangolin_of_fortune,,2,True,no_ads,False,[],False,,/r/infertility/comments/6eibjj/alpha1_antitrypsin_deficiency/,no_ads,False,https://www.reddit.com/r/infertility/comments/6eibjj/alpha1_antitrypsin_deficiency/,25375,1496267973.0,0,,False,False,{},,,
219,2048,confidence,<praw.reddit.Reddit object at 0x7f2244aead90>,,infertility,"OK so long & short of it........ My husband and I have been TTC for 16 months. We know at least part of the problem is my husband has very low motility and low testosterone. In Feb of this month I had my testosterone checked at my OBGYN with a blood test, my Testosterone, total was 30ng/dL and my free was 2.9 pg/mL. Obviously those are both great numbers. We were in the very beginning of the TEST EVERYTHING phase. I have hashimoto's thyroid disease so we knew my numbers might be wonky anyways, but they were great. 

Flash forward 
1) I am seeing a compound pharmacist who test my testosterone with a saliva test (on day 20 of my cycle) and I have gone up to 62 pg/mL. This number is still in the normal range but I am over weight (192lbs & 5' tall) and the compound pharmacist really thinks I have PCOS.

2) My husband is on clomid and his numbers have greatly improved. We just completed our second cycle of IUI. Because we are going to a fertility doctor I KNOW i have ovulated. Blood work & transvaginal ultrasound have confirmed that I have ovulated both months. Also both times I have gotten the IUI the doctor has blown away at how textbook my cervix looks and has commented that next time she would like to have students come and look at my amazing beautiful cervix. My FSH is 5.77 & my ANTI MULLERIAN is 3.30. My doctor's fully believe I have healthy eggs & I'm ovulating.

My question is do i have PCOS!?!?!!?!??!!? My testosterone has doubled in a little more than 3 months. Could this be from different collection methods (blood work vs. saliva collection)? My weight has stayed the same this whole time, but my synthroid dose has been increased (50-88mg). I do have other PCOS symptoms but they are also thyroid symptoms. I am so confused, annoyed, crazed.... you know normal TTC shit. ",t2_292eo0q,False,,0,False,The struggle to understand the numbers!?! Do I have PCOS?!?,[],r/infertility,False,0,,0,,,False,t3_6ehq3w,False,dark,1.0,,public,2,0,{},,,False,[],,False,False,,{},,False,2,,False,self,False,,[],{},,True,,1496291264.0,text,0,,,text,self.infertility,False,"<!-- SC_OFF --><div class=""md""><p>OK so long &amp; short of it........ My husband and I have been TTC for 16 months. We know at least part of the problem is my husband has very low motility and low testosterone. In Feb of this month I had my testosterone checked at my OBGYN with a blood test, my Testosterone, total was 30ng/dL and my free was 2.9 pg/mL. Obviously those are both great numbers. We were in the very beginning of the TEST EVERYTHING phase. I have hashimoto&#39;s thyroid disease so we knew my numbers might be wonky anyways, but they were great. </p>

<p>Flash forward 
1) I am seeing a compound pharmacist who test my testosterone with a saliva test (on day 20 of my cycle) and I have gone up to 62 pg/mL. This number is still in the normal range but I am over weight (192lbs &amp; 5&#39; tall) and the compound pharmacist really thinks I have PCOS.</p>

<p>2) My husband is on clomid and his numbers have greatly improved. We just completed our second cycle of IUI. Because we are going to a fertility doctor I KNOW i have ovulated. Blood work &amp; transvaginal ultrasound have confirmed that I have ovulated both months. Also both times I have gotten the IUI the doctor has blown away at how textbook my cervix looks and has commented that next time she would like to have students come and look at my amazing beautiful cervix. My FSH is 5.77 &amp; my ANTI MULLERIAN is 3.30. My doctor&#39;s fully believe I have healthy eggs &amp; I&#39;m ovulating.</p>

<p>My question is do i have PCOS!?!?!!?!??!!? My testosterone has doubled in a little more than 3 months. Could this be from different collection methods (blood work vs. saliva collection)? My weight has stayed the same this whole time, but my synthroid dose has been increased (50-88mg). I do have other PCOS symptoms but they are also thyroid symptoms. I am so confused, annoyed, crazed.... you know normal TTC shit. </p>
</div><!-- SC_ON -->",,,,,True,False,False,False,False,[],[],False,False,False,False,,[],False,,,,t5_2saej,,,,6ehq3w,True,,thepants5584,,5,True,no_ads,False,[],False,,/r/infertility/comments/6ehq3w/the_struggle_to_understand_the_numbers_do_i_have/,no_ads,False,https://www.reddit.com/r/infertility/comments/6ehq3w/the_struggle_to_understand_the_numbers_do_i_have/,25375,1496262464.0,0,,False,False,{},,,
220,2048,confidence,<praw.reddit.Reddit object at 0x7f2244aead90>,,infertility,[deleted],,False,,0,False,I was just hired to work at a fertility clinic as an IVF nurse the day before my own appointment to an RE for the first time,[],r/infertility,False,0,,0,,,False,t3_6ehcry,False,dark,0.93,,public,27,0,{},,,False,[],,False,False,,{},,False,27,,,default,1496260037.0,,,{},,True,,1496288045.0,text,0,,,,self.infertility,False,"<!-- SC_OFF --><div class=""md""><p>[deleted]</p>
</div><!-- SC_ON -->",,,,,True,False,False,False,False,[],[],False,False,False,False,,[],False,,,,t5_2saej,,,,6ehcry,False,,,,16,True,no_ads,False,[],,dark,/r/infertility/comments/6ehcry/i_was_just_hired_to_work_at_a_fertility_clinic_as/,no_ads,False,https://www.reddit.com/r/infertility/comments/6ehcry/i_was_just_hired_to_work_at_a_fertility_clinic_as/,25375,1496259245.0,0,,False,False,{},,,
221,2048,confidence,<praw.reddit.Reddit object at 0x7f2244aead90>,,infertility,"This is our last egg retrieval (#5) and we will be transferring to a gestational surrogate after 15 Failed Transfers and 1 miscarriage with triplets. 

I want something as a memory if this doesn't work out. We have decided to move on. BIG UGH. Is that a bad idea? ",t2_wm57g,False,,0,False,Anyone filmed their IVF journey?,[],r/infertility,False,0,,0,,,False,t3_6eh8ws,False,dark,0.8,,public,3,0,{},,,False,[],,False,False,,{},,False,3,,False,self,False,,[],{},,True,,1496287100.0,text,0,,,text,self.infertility,False,"<!-- SC_OFF --><div class=""md""><p>This is our last egg retrieval (#5) and we will be transferring to a gestational surrogate after 15 Failed Transfers and 1 miscarriage with triplets. </p>

<p>I want something as a memory if this doesn&#39;t work out. We have decided to move on. BIG UGH. Is that a bad idea? </p>
</div><!-- SC_ON -->",,,,,True,False,False,False,False,[],[],False,False,False,False,,[],False,,,,t5_2saej,,,,6eh8ws,True,,burninggoodfood,,5,True,no_ads,False,[],False,,/r/infertility/comments/6eh8ws/anyone_filmed_their_ivf_journey/,no_ads,False,https://www.reddit.com/r/infertility/comments/6eh8ws/anyone_filmed_their_ivf_journey/,25375,1496258300.0,0,,False,False,{},,,
222,2048,confidence,<praw.reddit.Reddit object at 0x7f2244aead90>,,infertility,"Use this thread to share anything not necessarily related to infertility. Rant or rave, bitch, moan, share something funny, anything goes!",t2_6l4z3,False,,0,False,Wednesday Afternoon Off Topic Thread,[],r/infertility,False,0,,0,,,False,t3_6egyj0,False,dark,1.0,,public,5,0,{},,,False,[],,False,False,,{},,False,5,,True,self,False,,[],{},,True,,1496284563.0,text,0,,,text,self.infertility,False,"<!-- SC_OFF --><div class=""md""><p>Use this thread to share anything not necessarily related to infertility. Rant or rave, bitch, moan, share something funny, anything goes!</p>
</div><!-- SC_ON -->",,,,,True,False,False,False,False,[],[],False,False,False,False,,[],False,,,moderator,t5_2saej,,,,6egyj0,True,,AutoModerator,,206,False,no_ads,False,[],False,,/r/infertility/comments/6egyj0/wednesday_afternoon_off_topic_thread/,no_ads,False,https://www.reddit.com/r/infertility/comments/6egyj0/wednesday_afternoon_off_topic_thread/,25375,1496255763.0,0,,False,False,{},,,
223,2048,confidence,<praw.reddit.Reddit object at 0x7f2244aead90>,,infertility,"I went in for my cycle day 4 blood work today and I just received a call from my doctor saying that my Estrogen is only at 111 so they are upping my dosage of Gonal-F to 300 daily.  They are hoping that should get things moving a bit quicker so I can be more on schedule.  I was hoping my estrogen level would be higher since I have been stimming for 4 days now.  

Has anyone else had any success with levels in this area?
",t2_172kui,False,,0,False,Estrogen only 111...WTF,[],r/infertility,False,0,,0,,,False,t3_6egoqy,False,dark,1.0,,public,3,0,{},,,False,[],,False,False,,{},,False,3,,False,self,False,,[],{},,True,,1496282184.0,text,0,,,text,self.infertility,False,"<!-- SC_OFF --><div class=""md""><p>I went in for my cycle day 4 blood work today and I just received a call from my doctor saying that my Estrogen is only at 111 so they are upping my dosage of Gonal-F to 300 daily.  They are hoping that should get things moving a bit quicker so I can be more on schedule.  I was hoping my estrogen level would be higher since I have been stimming for 4 days now.  </p>

<p>Has anyone else had any success with levels in this area?</p>
</div><!-- SC_ON -->",,,,,True,False,False,False,False,[],[],False,False,False,False,,[],False,,,,t5_2saej,,,,6egoqy,True,,OverTheFNHorizon,,15,True,no_ads,False,[],False,,/r/infertility/comments/6egoqy/estrogen_only_111wtf/,no_ads,False,https://www.reddit.com/r/infertility/comments/6egoqy/estrogen_only_111wtf/,25375,1496253384.0,0,,False,False,{},,,
224,2048,confidence,<praw.reddit.Reddit object at 0x7f2244aead90>,,infertility,"I've taken progesterone to induce a bleed several times, but it's only worked twice. On those two occasions, the bleed started within 3-4 days of starting the 10-day course of progesterone, not 7-10 days after stopping the progesterone like the doctor said would happen. 

When I told my Dr., she said ""oh, your body was ready."" (?) When I told the nurse, she seemed very confused that it happened.

Any ideas why the bleed starts so soon? ",t2_2pnjdi1,False,,0,False,Why does progesterone work immediately?,[],r/infertility,False,0,,0,,,False,t3_6egdg7,False,dark,1.0,,public,3,0,{},,,False,[],,False,False,,{},,False,3,,False,self,False,,[],{},,True,,1496279443.0,text,0,,,text,self.infertility,False,"<!-- SC_OFF --><div class=""md""><p>I&#39;ve taken progesterone to induce a bleed several times, but it&#39;s only worked twice. On those two occasions, the bleed started within 3-4 days of starting the 10-day course of progesterone, not 7-10 days after stopping the progesterone like the doctor said would happen. </p>

<p>When I told my Dr., she said &quot;oh, your body was ready.&quot; (?) When I told the nurse, she seemed very confused that it happened.</p>

<p>Any ideas why the bleed starts so soon? </p>
</div><!-- SC_ON -->",,,,,True,False,False,False,False,[],[],False,False,False,False,,[],False,,,,t5_2saej,,,,6egdg7,True,,USRNM17,,4,True,no_ads,False,[],False,,/r/infertility/comments/6egdg7/why_does_progesterone_work_immediately/,no_ads,False,https://www.reddit.com/r/infertility/comments/6egdg7/why_does_progesterone_work_immediately/,25375,1496250643.0,0,,False,False,{},,,
225,2048,confidence,<praw.reddit.Reddit object at 0x7f2244aead90>,,infertility,"I'm heading into my first IVF cycle and not excited about getting stuck every other day / every day. I'm lucky to have prominent veins, but my last IUI cycle needed a lot of monitoring appointments (slow follicles...) and by the end of it all, my arm was tender and bruised.

Is there any way to make this less terrible / help heal faster? 

Do you switch arms every time, or go as long as you can in one arm before switching to the other which is fresh?

I know I'll probably just have to suck it up and deal... but if there are any tips I'm not aware of, I'd be happy to hear them!",t2_15a6sk,False,,0,False,Strategies for frequent blood draws?,[],r/infertility,False,0,,0,,,False,t3_6eg87h,False,dark,0.99,,public,8,0,{},,,False,[],,False,False,,{},,False,8,,False,self,False,,[],{},,True,,1496278170.0,text,0,,,text,self.infertility,False,"<!-- SC_OFF --><div class=""md""><p>I&#39;m heading into my first IVF cycle and not excited about getting stuck every other day / every day. I&#39;m lucky to have prominent veins, but my last IUI cycle needed a lot of monitoring appointments (slow follicles...) and by the end of it all, my arm was tender and bruised.</p>

<p>Is there any way to make this less terrible / help heal faster? </p>

<p>Do you switch arms every time, or go as long as you can in one arm before switching to the other which is fresh?</p>

<p>I know I&#39;ll probably just have to suck it up and deal... but if there are any tips I&#39;m not aware of, I&#39;d be happy to hear them!</p>
</div><!-- SC_ON -->",,,,,True,False,False,False,False,[],[],False,False,False,False,,[],False,,,,t5_2saej,,,,6eg87h,True,,shadow728,,21,True,no_ads,False,[],False,,/r/infertility/comments/6eg87h/strategies_for_frequent_blood_draws/,no_ads,False,https://www.reddit.com/r/infertility/comments/6eg87h/strategies_for_frequent_blood_draws/,25375,1496249370.0,0,,False,False,{},,,
226,2048,confidence,<praw.reddit.Reddit object at 0x7f2244aead90>,,infertility,[deleted],,False,,0,False,RE recommendations in NYC?,[],r/infertility,False,0,,0,,,False,t3_6eg2d6,False,dark,0.84,,public,4,0,{},,,False,[],,False,False,,{},,False,4,,,default,False,,,{},,True,,1496276703.0,text,0,,,,self.infertility,False,"<!-- SC_OFF --><div class=""md""><p>[deleted]</p>
</div><!-- SC_ON -->",,,,,True,False,False,False,False,[],[],False,False,False,False,,[],False,,,,t5_2saej,,,,6eg2d6,False,,,,17,True,no_ads,False,[],,dark,/r/infertility/comments/6eg2d6/re_recommendations_in_nyc/,no_ads,False,https://www.reddit.com/r/infertility/comments/6eg2d6/re_recommendations_in_nyc/,25375,1496247903.0,0,,False,False,{},,,
227,2048,confidence,<praw.reddit.Reddit object at 0x7f2244aead90>,,infertility,[deleted],,False,,0,False,Journal Club Wednesday Topic: DE,[],r/infertility,False,0,,0,,,False,t3_6eg00h,False,dark,1.0,,public,2,0,{},,,False,[],,False,False,,{},,False,2,,,default,False,,,{},,True,,1496276132.0,text,0,,,,self.infertility,False,"<!-- SC_OFF --><div class=""md""><p>[deleted]</p>
</div><!-- SC_ON -->",,,,,True,False,False,False,False,[],[],False,False,False,False,,[],False,,,,t5_2saej,,,,6eg00h,False,,,,4,True,no_ads,False,[],,dark,/r/infertility/comments/6eg00h/journal_club_wednesday_topic_de/,no_ads,False,https://www.reddit.com/r/infertility/comments/6eg00h/journal_club_wednesday_topic_de/,25375,1496247332.0,0,,False,False,{},,,
