76,2048,confidence,<praw.reddit.Reddit object at 0x7f2244aead90>,,infertility,"Sorry but I saw this article (http://www.sciencealert.com/one-of-the-physicists-behind-the-higgs-boson-has-made-an-algorithm-to-replace-the-pill) on Facebook today and made a comment that it wasn't all that reliable if you have any type of hormonal imbalance. Of course some bitchy woman starts telling me I don't know anything about science and I'm stupid and it's a very reliable method.  Pissed me off.  Maybe she should try to get pregnant for over 2 years using BBT and come to realize that she has PCOS and BBT is worthless and then she can call me stupid and tell me how reliable it is.

I hate how people are so stupid.  Sorry rant.  It's just so insensitive, lots of women have hormonal imbalances that cause BBT to be relatively worthless.  It's not some crazy notion.",t2_w8fgh,False,,0,False,Rant - BBT,[],r/infertility,False,0,,0,,,False,t3_6g41iu,False,dark,0.81,,public,6,0,{},,,False,[],,False,False,,{},,False,6,,False,self,False,,[],{},,True,,1496986575.0,text,0,,,text,self.infertility,True,"<!-- SC_OFF --><div class=""md""><p>Sorry but I saw this article (<a href=""http://www.sciencealert.com/one-of-the-physicists-behind-the-higgs-boson-has-made-an-algorithm-to-replace-the-pill"">http://www.sciencealert.com/one-of-the-physicists-behind-the-higgs-boson-has-made-an-algorithm-to-replace-the-pill</a>) on Facebook today and made a comment that it wasn&#39;t all that reliable if you have any type of hormonal imbalance. Of course some bitchy woman starts telling me I don&#39;t know anything about science and I&#39;m stupid and it&#39;s a very reliable method.  Pissed me off.  Maybe she should try to get pregnant for over 2 years using BBT and come to realize that she has PCOS and BBT is worthless and then she can call me stupid and tell me how reliable it is.</p>

<p>I hate how people are so stupid.  Sorry rant.  It&#39;s just so insensitive, lots of women have hormonal imbalances that cause BBT to be relatively worthless.  It&#39;s not some crazy notion.</p>
</div><!-- SC_ON -->",,,,,True,False,False,False,False,[],[],False,False,False,False,"31, PCOS, HYPO, Clomid Cycle #1 2/26/16, Femara #1 3/31/16",[],False,,,,t5_2saej,,,,6g41iu,True,,CadenceofLife,,30,True,no_ads,False,[],False,dark,/r/infertility/comments/6g41iu/rant_bbt/,no_ads,False,https://www.reddit.com/r/infertility/comments/6g41iu/rant_bbt/,25375,1496957775.0,0,,False,False,{},self,"{'images': [{'source': {'url': 'https://external-preview.redd.it/VP6cgE5328DdiA9kxOLEYeUqlfdbldGrU2A5b4jnA00.jpg?auto=webp&s=5f40b5555d3bf3fe4ccffe41f3ab47726fe75026', 'width': 1024, 'height': 415}, 'resolutions': [{'url': 'https://external-preview.redd.it/VP6cgE5328DdiA9kxOLEYeUqlfdbldGrU2A5b4jnA00.jpg?width=108&crop=smart&auto=webp&s=331c5353d130ff6aec41f13572824c7495236155', 'width': 108, 'height': 43}, {'url': 'https://external-preview.redd.it/VP6cgE5328DdiA9kxOLEYeUqlfdbldGrU2A5b4jnA00.jpg?width=216&crop=smart&auto=webp&s=ad9eed72bb75d44861b332a2c126263ed086b23d', 'width': 216, 'height': 87}, {'url': 'https://external-preview.redd.it/VP6cgE5328DdiA9kxOLEYeUqlfdbldGrU2A5b4jnA00.jpg?width=320&crop=smart&auto=webp&s=afddb3fbc9c6e3c5efc980336753157d86c027c4', 'width': 320, 'height': 129}, {'url': 'https://external-preview.redd.it/VP6cgE5328DdiA9kxOLEYeUqlfdbldGrU2A5b4jnA00.jpg?width=640&crop=smart&auto=webp&s=d7c25ed1fa35dc13df6dce9fb8ccff92d0fd3f96', 'width': 640, 'height': 259}, {'url': 'https://external-preview.redd.it/VP6cgE5328DdiA9kxOLEYeUqlfdbldGrU2A5b4jnA00.jpg?width=960&crop=smart&auto=webp&s=10605769545ab4fa1c09c27c8210874ea55848b1', 'width': 960, 'height': 389}], 'variants': {}, 'id': 'NRDKOjuHW4D1EHXSz5GdwsWFrPCE6FBE2s2N5iGEsvw'}], 'enabled': False}",
77,2048,confidence,<praw.reddit.Reddit object at 0x7f2244aead90>,,infertility,[deleted],,False,,0,False,TIL: we barren bitches have our own gang sign,[],r/infertility,False,0,,0,,,False,t3_6g4075,False,dark,1.0,,public,1,0,{},,,False,[],,False,False,,{},,False,1,,,default,False,,,{},,True,,1496986219.0,text,0,,,,self.infertility,False,"<!-- SC_OFF --><div class=""md""><p>[deleted]</p>
</div><!-- SC_ON -->",,,,,True,True,False,False,False,[],[],False,False,False,False,,[],False,,,,t5_2saej,,,,6g4075,False,,,,0,True,no_ads,False,[],,dark,/r/infertility/comments/6g4075/til_we_barren_bitches_have_our_own_gang_sign/,no_ads,False,https://www.reddit.com/r/infertility/comments/6g4075/til_we_barren_bitches_have_our_own_gang_sign/,25375,1496957419.0,0,,False,False,{},,,
78,2048,confidence,<praw.reddit.Reddit object at 0x7f2244aead90>,,infertility,"Anyone know the cheapest place to get it? 

Also I have a BUNCH (7 unopened unexpired 10 ml vials) of PIO in sesame oil if anyone wants it. Apparently I've built up a severe allergy. :-(

ETA: i mistakenly wrote 50 ml vials when it's actually 10 ml vials. ",t2_uo0t7,False,,0,False,PIO in ethyl oleate?,[],r/infertility,False,0,,0,,,False,t3_6g3ic0,False,dark,0.71,,public,4,0,{},,,False,[],,False,False,,{},Medications,False,4,,False,self,1496954260.0,,[],{},,True,,1496981626.0,text,0,,,text,self.infertility,False,"<!-- SC_OFF --><div class=""md""><p>Anyone know the cheapest place to get it? </p>

<p>Also I have a BUNCH (7 unopened unexpired 10 ml vials) of PIO in sesame oil if anyone wants it. Apparently I&#39;ve built up a severe allergy. :-(</p>

<p>ETA: i mistakenly wrote 50 ml vials when it&#39;s actually 10 ml vials. </p>
</div><!-- SC_ON -->",,,,,True,False,False,False,False,[],[],False,False,False,False,I collect full Sharps containers,[],False,,,,t5_2saej,,,,6g3ic0,True,,kakavl,,18,True,no_ads,False,[],False,dark,/r/infertility/comments/6g3ic0/pio_in_ethyl_oleate/,no_ads,False,https://www.reddit.com/r/infertility/comments/6g3ic0/pio_in_ethyl_oleate/,25375,1496952826.0,0,,False,False,{},,,
79,2048,confidence,<praw.reddit.Reddit object at 0x7f2244aead90>,,infertility,[deleted],,False,,0,False,"Article: Khloe Kardashian Reveals She ""Fake Tried"" to Get Pregnant During Marriage to Lamar Odom",[],r/infertility,False,0,,0,,,False,t3_6g3hyt,False,dark,0.77,,public,7,0,{},,,False,[],,False,False,,{},,False,7,,,default,False,,,{},,True,,1496981536.0,text,0,,,,self.infertility,False,"<!-- SC_OFF --><div class=""md""><p>[deleted]</p>
</div><!-- SC_ON -->",,,,,True,False,False,False,False,[],[],False,False,False,False,,[],False,,,,t5_2saej,,,,6g3hyt,False,,,,15,True,no_ads,False,[],,dark,/r/infertility/comments/6g3hyt/article_khloe_kardashian_reveals_she_fake_tried/,no_ads,False,https://www.reddit.com/r/infertility/comments/6g3hyt/article_khloe_kardashian_reveals_she_fake_tried/,25375,1496952736.0,0,,False,False,{},,,
80,2048,confidence,<praw.reddit.Reddit object at 0x7f2244aead90>,,infertility,[deleted],,False,,0,False,Insurance problem,[],r/infertility,False,0,,0,,,False,t3_6g3cit,False,dark,1.0,,public,8,0,{},,,False,[],,False,False,,{},,False,8,,,default,False,,,{},,True,,1496980138.0,text,0,deleted,,,self.infertility,True,"<!-- SC_OFF --><div class=""md""><p>[deleted]</p>
</div><!-- SC_ON -->",,,,,True,False,False,False,False,[],[],False,False,False,False,,[],False,,,,t5_2saej,,,,6g3cit,False,,,,12,True,no_ads,False,[],,dark,/r/infertility/comments/6g3cit/insurance_problem/,no_ads,False,https://www.reddit.com/r/infertility/comments/6g3cit/insurance_problem/,25375,1496951338.0,0,,False,False,{},,,
81,2048,confidence,<praw.reddit.Reddit object at 0x7f2244aead90>,,infertility,"Use this thread to share anything not necessarily related to infertility. Rant or rave, bitch, moan, share something funny, anything goes!",t2_6l4z3,False,,0,False,Thursday Afternoon Off Topic Thread,[],r/infertility,False,0,,0,,,False,t3_6g2v05,False,dark,1.0,,public,5,0,{},,,False,[],,False,False,,{},,False,5,,True,self,False,,[],{},,True,,1496975749.0,text,0,,,text,self.infertility,False,"<!-- SC_OFF --><div class=""md""><p>Use this thread to share anything not necessarily related to infertility. Rant or rave, bitch, moan, share something funny, anything goes!</p>
</div><!-- SC_ON -->",,,,,True,False,False,False,False,[],[],False,False,False,False,,[],False,,,moderator,t5_2saej,,,,6g2v05,True,,AutoModerator,,123,False,no_ads,False,[],False,,/r/infertility/comments/6g2v05/thursday_afternoon_off_topic_thread/,no_ads,False,https://www.reddit.com/r/infertility/comments/6g2v05/thursday_afternoon_off_topic_thread/,25375,1496946949.0,0,,False,False,{},,,
82,2048,confidence,<praw.reddit.Reddit object at 0x7f2244aead90>,,infertility,"Hello everyone

This is a question to UK redditers. My partner and I are both 40 and have been infertile for a couple of years. We have recently approached our GP to get help, but they turned us down.
They keep saying as we are overage according to the policy of the local CCG, which means we are overage ONLY for IVF, they can't help.
We told them that we understand that we can't be included in government funded IVF, but we wanted to know what the cause of our infertility is and we thought we should have been assessed as other treatments might be available.
No matter what we said, the surgery simply turned us down.
Is there anybody out there who has an idea what we  can do now? 
note, I have already made complaints at NHS, local CCG, etc, but no one seems to think that medical negligence has happened, therefore, we can't be helped. This is insane, and I would never believe this could happen in a ""western"" country.
Any help would be appreciated.",t2_15wrmm,False,,0,False,Infertility issues (in the UK) but GP would not want to see us,[],r/infertility,False,0,,0,,,False,t3_6g23lk,False,dark,0.93,,public,11,0,{},,,False,[],,False,False,,{},,False,11,,False,self,False,,[],{},,True,,1496968859.0,text,0,,,text,self.infertility,True,"<!-- SC_OFF --><div class=""md""><p>Hello everyone</p>

<p>This is a question to UK redditers. My partner and I are both 40 and have been infertile for a couple of years. We have recently approached our GP to get help, but they turned us down.
They keep saying as we are overage according to the policy of the local CCG, which means we are overage ONLY for IVF, they can&#39;t help.
We told them that we understand that we can&#39;t be included in government funded IVF, but we wanted to know what the cause of our infertility is and we thought we should have been assessed as other treatments might be available.
No matter what we said, the surgery simply turned us down.
Is there anybody out there who has an idea what we  can do now? 
note, I have already made complaints at NHS, local CCG, etc, but no one seems to think that medical negligence has happened, therefore, we can&#39;t be helped. This is insane, and I would never believe this could happen in a &quot;western&quot; country.
Any help would be appreciated.</p>
</div><!-- SC_ON -->",,,,,True,False,False,False,False,[],[],False,False,False,False,,[],False,,,,t5_2saej,,,,6g23lk,True,,Garrya75,,6,True,no_ads,False,[],False,,/r/infertility/comments/6g23lk/infertility_issues_in_the_uk_but_gp_would_not/,no_ads,False,https://www.reddit.com/r/infertility/comments/6g23lk/infertility_issues_in_the_uk_but_gp_would_not/,25375,1496940059.0,0,,False,False,{},,,
83,2048,confidence,<praw.reddit.Reddit object at 0x7f2244aead90>,,infertility,"Hi again!

Sorry I know I've posted quite a bit lately. But I'm at a loss on how to proceed...

We have a plan (hope) for trying to get pregnant with IUI as well as femara but some of my tests aren't coming back normal.

Like I said in my other two posts, my TSH in November was 3.59 and yesterday after a retest it came back as 0.04. My free T4 was 1.8.

As many of you suggested it could have been a lab mistake and recommended a retest. I messaged my doctor and asked him what is going on because he had sent me a message saying he thought I had hyperthyroidism now not hypothyroidism which showed up on my test in November.


I had mentioned to him that I felt more symptom wise of hypothyroidism so I was fearful of a lab error and asked if I should retest or if he thought they were correct. He replied this morning saying he thinks I have either Hashimoto's thyroiditis or Graves disease. But he will not be doing any further testing for another two months. Here's a short bit of what he said for more insight:

""With regard to the blood test for TSH, I suspect that you have Hahimoto's thyroiditis or Graves disease which can cause you to have some highs and lows in your thyroid levels in the short term. There is no reason to repeat the test now, but we will follow up in two months to get a better sense of what is going on for you. 

I can refer you to a Endocrine specialist if you are interested to get more information. Just let me know. ""


I'm even more confused. From a quick Googling those are opposite diseases one is hypothyroid related and the other one is hyperthyroid related. I think it's kind of weird to leave it alone for the next two months though, right? Especially since we're staying femara tomorrow! Or am I worrying too much? Should I request to see an endocrinologist or do you feel like that one help much? What would you do if you are in my situation because I'm seriously at a loss.

Thank you for reading 

EDIT:

Thank you everyone for all of your advice! I will definitely be going to see the endocrinologist soon! Sometimes I worry that I'm over thinking things but I'm glad this isn't one of those times. Thank you for all your support  ",t2_6s68s,False,,0,False,I need help deciding what the next step should be... RE left it up to me,[],r/infertility,False,0,,0,,,False,t3_6g19ta,False,dark,0.67,,public,4,0,{},,,False,[],,False,False,,{},,False,4,,False,self,1496934223.0,,[],{},,True,,1496960802.0,text,0,,,text,self.infertility,False,"<!-- SC_OFF --><div class=""md""><p>Hi again!</p>

<p>Sorry I know I&#39;ve posted quite a bit lately. But I&#39;m at a loss on how to proceed...</p>

<p>We have a plan (hope) for trying to get pregnant with IUI as well as femara but some of my tests aren&#39;t coming back normal.</p>

<p>Like I said in my other two posts, my TSH in November was 3.59 and yesterday after a retest it came back as 0.04. My free T4 was 1.8.</p>

<p>As many of you suggested it could have been a lab mistake and recommended a retest. I messaged my doctor and asked him what is going on because he had sent me a message saying he thought I had hyperthyroidism now not hypothyroidism which showed up on my test in November.</p>

<p>I had mentioned to him that I felt more symptom wise of hypothyroidism so I was fearful of a lab error and asked if I should retest or if he thought they were correct. He replied this morning saying he thinks I have either Hashimoto&#39;s thyroiditis or Graves disease. But he will not be doing any further testing for another two months. Here&#39;s a short bit of what he said for more insight:</p>

<p>&quot;With regard to the blood test for TSH, I suspect that you have Hahimoto&#39;s thyroiditis or Graves disease which can cause you to have some highs and lows in your thyroid levels in the short term. There is no reason to repeat the test now, but we will follow up in two months to get a better sense of what is going on for you. </p>

<p>I can refer you to a Endocrine specialist if you are interested to get more information. Just let me know. &quot;</p>

<p>I&#39;m even more confused. From a quick Googling those are opposite diseases one is hypothyroid related and the other one is hyperthyroid related. I think it&#39;s kind of weird to leave it alone for the next two months though, right? Especially since we&#39;re staying femara tomorrow! Or am I worrying too much? Should I request to see an endocrinologist or do you feel like that one help much? What would you do if you are in my situation because I&#39;m seriously at a loss.</p>

<p>Thank you for reading </p>

<p>EDIT:</p>

<p>Thank you everyone for all of your advice! I will definitely be going to see the endocrinologist soon! Sometimes I worry that I&#39;m over thinking things but I&#39;m glad this isn&#39;t one of those times. Thank you for all your support  </p>
</div><!-- SC_ON -->",,,,,True,False,False,False,False,[],[],False,False,False,False,24 TTC#1 1.5 years unexplained,[],False,,,,t5_2saej,,,,6g19ta,True,,cool_crip11,,21,True,no_ads,False,[],False,dark,/r/infertility/comments/6g19ta/i_need_help_deciding_what_the_next_step_should_be/,no_ads,False,https://www.reddit.com/r/infertility/comments/6g19ta/i_need_help_deciding_what_the_next_step_should_be/,25375,1496932002.0,0,,False,False,{},,,
84,2048,confidence,<praw.reddit.Reddit object at 0x7f2244aead90>,,infertility,[deleted],,False,,0,False,Journal club Thursday Topic: POF,[],r/infertility,False,0,,0,,,False,t3_6g15ij,False,dark,1.0,,public,3,0,{},,,False,[],,False,False,,{},,False,3,,,default,False,,,{},,True,,1496959605.0,text,0,,,,self.infertility,False,"<!-- SC_OFF --><div class=""md""><p>[deleted]</p>
</div><!-- SC_ON -->",,,,,True,False,False,False,False,[],[],False,False,False,False,,[],False,,,,t5_2saej,,,,6g15ij,False,,,,5,True,no_ads,False,[],,dark,/r/infertility/comments/6g15ij/journal_club_thursday_topic_pof/,no_ads,False,https://www.reddit.com/r/infertility/comments/6g15ij/journal_club_thursday_topic_pof/,25375,1496930805.0,0,,False,False,{},,,
85,2048,confidence,<praw.reddit.Reddit object at 0x7f2244aead90>,,infertility,"Use this thread to share anything not necessarily related to infertility. Rant or rave, bitch, moan, share something funny, anything goes!",t2_6l4z3,False,,0,False,Thursday Off Topic Thread,[],r/infertility,False,0,,0,,,False,t3_6g01vl,False,dark,0.84,,public,4,0,{},,,False,[],,False,False,,{},,False,4,,True,self,False,,[],{},,True,,1496945330.0,text,0,,,text,self.infertility,False,"<!-- SC_OFF --><div class=""md""><p>Use this thread to share anything not necessarily related to infertility. Rant or rave, bitch, moan, share something funny, anything goes!</p>
</div><!-- SC_ON -->",,,,,True,False,False,False,False,[],[],False,False,False,False,,[],False,,,moderator,t5_2saej,,,,6g01vl,True,,AutoModerator,,202,False,no_ads,False,[],False,,/r/infertility/comments/6g01vl/thursday_off_topic_thread/,no_ads,False,https://www.reddit.com/r/infertility/comments/6g01vl/thursday_off_topic_thread/,25375,1496916530.0,0,,False,False,{},,,
86,2048,confidence,<praw.reddit.Reddit object at 0x7f2244aead90>,,infertility,[removed],,False,,0,False,Anyone have POS?,[],r/infertility,False,0,,0,,,False,t3_6fzsuh,False,dark,1.0,,public,1,0,{},,,False,[],,False,False,,{},,False,1,,,default,False,,,{},,True,,1496941247.0,text,0,,,,self.infertility,False,"<!-- SC_OFF --><div class=""md""><p>[removed]</p>
</div><!-- SC_ON -->",,,,,True,True,False,False,False,[],[],False,False,False,False,,[],False,,,,t5_2saej,,,,6fzsuh,False,,,,1,True,no_ads,False,[],,dark,/r/infertility/comments/6fzsuh/anyone_have_pos/,no_ads,False,https://www.reddit.com/r/infertility/comments/6fzsuh/anyone_have_pos/,25375,1496912447.0,0,,False,False,{},,,
87,2048,confidence,<praw.reddit.Reddit object at 0x7f2244aead90>,,infertility,[removed],t2_10z4yi,False,,0,False,Role of Egg Donor in Infertility Treatment,[],r/infertility,False,0,,0,,,False,t3_6fyw4j,False,dark,1.0,,public,1,0,{},,,False,[],,False,False,,{},,False,1,,False,default,False,,[],{},,True,,1496926936.0,text,0,,,text,self.infertility,False,"<!-- SC_OFF --><div class=""md""><p>[removed]</p>
</div><!-- SC_ON -->",,,,,True,True,False,False,False,[],[],False,False,False,False,,[],False,,,,t5_2saej,,,,6fyw4j,False,,fertilityjannee,,0,True,no_ads,False,[],False,,/r/infertility/comments/6fyw4j/role_of_egg_donor_in_infertility_treatment/,no_ads,False,https://www.reddit.com/r/infertility/comments/6fyw4j/role_of_egg_donor_in_infertility_treatment/,25375,1496898136.0,0,,False,False,{},,,
88,2048,confidence,<praw.reddit.Reddit object at 0x7f2244aead90>,,infertility,[removed],,False,,0,False,Investigative Radio show on IVF,[],r/infertility,False,0,,0,,,False,t3_6fylbu,False,dark,0.5,,public,0,0,{},,,False,[],,False,False,,{},,False,0,,,default,False,,,{},,True,,1496923012.0,text,0,,,,self.infertility,False,"<!-- SC_OFF --><div class=""md""><p>[removed]</p>
</div><!-- SC_ON -->",,,,,True,True,False,False,False,[],[],False,False,False,False,,[],False,,,,t5_2saej,,,,6fylbu,False,,,,1,True,no_ads,False,[],,dark,/r/infertility/comments/6fylbu/investigative_radio_show_on_ivf/,no_ads,False,https://www.reddit.com/r/infertility/comments/6fylbu/investigative_radio_show_on_ivf/,25375,1496894212.0,0,,False,False,{},,,
89,2048,confidence,<praw.reddit.Reddit object at 0x7f2244aead90>,,infertility,[removed],t2_3f1it1l,False,,0,False,"my wife was 9 weeks, just found out today that she lost the baby.",[],r/infertility,False,0,,0,,,False,t3_6fyirk,False,dark,1.0,,public,1,0,{},,,False,[],,False,False,,{},,False,1,,False,default,False,,[],{},,True,,1496922122.0,text,0,,,text,self.infertility,False,"<!-- SC_OFF --><div class=""md""><p>[removed]</p>
</div><!-- SC_ON -->",,,,,True,True,False,False,False,[],[],False,False,False,False,,[],False,,,,t5_2saej,,,,6fyirk,False,,Thedudeofalldudes1,,0,True,no_ads,False,[],False,,/r/infertility/comments/6fyirk/my_wife_was_9_weeks_just_found_out_today_that_she/,no_ads,False,https://www.reddit.com/r/infertility/comments/6fyirk/my_wife_was_9_weeks_just_found_out_today_that_she/,25375,1496893322.0,0,,False,False,{},,,
90,2048,confidence,<praw.reddit.Reddit object at 0x7f2244aead90>,,infertility,"I've been told I could go on 'any monophonic pill I wanted' for suppression so thought I'd survey people to see what pill people have been on and what you thoughts about it. Seems strange to not be given more indication than that because the dosages for the various BCP vary a lot both in doses and in ratios between 'oestrogen' like and 'progesterone' like compounds.

To start with myself: I was on Yaz for a long time (before trying, loved it) but for suppression the only time I did BCP was marvelon (hated it, I became a moody beast).

",t2_wta02,False,,0,False,Survey: What BCP were you on for suppression?,[],r/infertility,False,0,,0,,,False,t3_6fxjjo,False,dark,0.81,,public,3,0,{},,d70f54ce-930e-11e4-8710-22000b26873e,False,[],,False,False,,{},,False,3,,False,self,False,,[],{},,True,,1496910378.0,text,0,,,text,self.infertility,False,"<!-- SC_OFF --><div class=""md""><p>I&#39;ve been told I could go on &#39;any monophonic pill I wanted&#39; for suppression so thought I&#39;d survey people to see what pill people have been on and what you thoughts about it. Seems strange to not be given more indication than that because the dosages for the various BCP vary a lot both in doses and in ratios between &#39;oestrogen&#39; like and &#39;progesterone&#39; like compounds.</p>

<p>To start with myself: I was on Yaz for a long time (before trying, loved it) but for suppression the only time I did BCP was marvelon (hated it, I became a moody beast).</p>
</div><!-- SC_ON -->",,,,,True,False,False,False,False,[],[],False,False,False,False,"39, unicorn uterus, 4 IVFs no embryos",[],False,,,,t5_2saej,,,,6fxjjo,True,,ttcnerd,,23,True,no_ads,False,[],False,dark,/r/infertility/comments/6fxjjo/survey_what_bcp_were_you_on_for_suppression/,no_ads,False,https://www.reddit.com/r/infertility/comments/6fxjjo/survey_what_bcp_were_you_on_for_suppression/,25375,1496881578.0,0,,False,False,{},,,
91,2048,confidence,<praw.reddit.Reddit object at 0x7f2244aead90>,,infertility,"Hello everyone!

I thought it might be fun to pair up pen pals for anyone who's interested. Not virtual, email pen pals. Like stamps and envelopes and hmm-maybe-I-will-look-for-that-old-fountain-pen pen pals. Getting unexpected mail that isn't bills is always fun! We could send each other little notes and cards and I have an excuse to continue to buy fun stationary I don't need. Plus, you could pay extra attention to what's going on with your pen pal's treatment and support them.

Perhaps we should stick to pairing within the same country so the mail doesn't take so long? I remember when I studied abroad in Australia people would send me stuff and it literally took 3 weeks to arrive.

If you would like to participate, comment here by the end of the day Friday and I'll match everybody over the weekend.
 ** **Include your country and if you like, a few of your interests.** ** Then you can exchange addresses and do your thing!",t2_14rns3,False,,0,False,IF pen pals,[],r/infertility,False,0,,0,,,False,t3_6fxdyi,False,dark,0.97,,public,28,0,{},,,False,[],,False,False,,{},,False,28,,False,self,1496880373.0,,[],{},,True,,1496908686.0,text,0,,,text,self.infertility,False,"<!-- SC_OFF --><div class=""md""><p>Hello everyone!</p>

<p>I thought it might be fun to pair up pen pals for anyone who&#39;s interested. Not virtual, email pen pals. Like stamps and envelopes and hmm-maybe-I-will-look-for-that-old-fountain-pen pen pals. Getting unexpected mail that isn&#39;t bills is always fun! We could send each other little notes and cards and I have an excuse to continue to buy fun stationary I don&#39;t need. Plus, you could pay extra attention to what&#39;s going on with your pen pal&#39;s treatment and support them.</p>

<p>Perhaps we should stick to pairing within the same country so the mail doesn&#39;t take so long? I remember when I studied abroad in Australia people would send me stuff and it literally took 3 weeks to arrive.</p>

<p>If you would like to participate, comment here by the end of the day Friday and I&#39;ll match everybody over the weekend.
 ** <strong>Include your country and if you like, a few of your interests.</strong> ** Then you can exchange addresses and do your thing!</p>
</div><!-- SC_ON -->",,,,,True,False,False,False,False,[],[],False,False,False,False,"30F, kitchen sink FET#2 6/12, PCOS",[],False,,,,t5_2saej,,,,6fxdyi,True,,AlmightyWaffles,,110,True,no_ads,False,[],False,dark,/r/infertility/comments/6fxdyi/if_pen_pals/,no_ads,False,https://www.reddit.com/r/infertility/comments/6fxdyi/if_pen_pals/,25375,1496879886.0,0,,False,False,{},,,
