158,2048,confidence,<praw.reddit.Reddit object at 0x7f2244aead90>,,infertility,[deleted],,False,,0,False,why me,[],r/infertility,False,0,,0,,,False,t3_6f7fsv,False,dark,0.73,,public,7,0,{},,,False,[],,False,False,,{},,False,7,,,default,False,,,{},,True,,1496613238.0,text,0,,,,self.infertility,False,"<!-- SC_OFF --><div class=""md""><p>[deleted]</p>
</div><!-- SC_ON -->",,,,,True,False,False,False,False,[],[],False,False,False,False,,[],False,,,,t5_2saej,,,,6f7fsv,False,,,,10,True,no_ads,False,[],,dark,/r/infertility/comments/6f7fsv/why_me/,no_ads,False,https://www.reddit.com/r/infertility/comments/6f7fsv/why_me/,25375,1496584438.0,0,,False,False,{},,,
159,2048,confidence,<praw.reddit.Reddit object at 0x7f2244aead90>,,infertility,[removed],t2_b4h90,False,,0,False,Sperm Health Optimizer ( Male Fertility),[],r/infertility,False,0,,0,,,False,t3_6f70u3,False,dark,0.4,,public,0,0,{},,,False,[],,False,False,,{},,False,0,,False,default,False,,[],{},,True,,1496606736.0,text,0,,,text,self.infertility,False,"<!-- SC_OFF --><div class=""md""><p>[removed]</p>
</div><!-- SC_ON -->",,,,,True,True,False,False,False,[],[],False,False,False,False,,[],False,,,,t5_2saej,,,,6f70u3,False,,Mississaug,,0,True,no_ads,False,[],False,,/r/infertility/comments/6f70u3/sperm_health_optimizer_male_fertility/,no_ads,False,https://www.reddit.com/r/infertility/comments/6f70u3/sperm_health_optimizer_male_fertility/,25375,1496577936.0,0,,False,False,{},,,
160,2048,confidence,<praw.reddit.Reddit object at 0x7f2244aead90>,,infertility,"Use this thread to share anything not necessarily related to infertility. Rant or rave, bitch, moan, share something funny, anything goes!",t2_6l4z3,False,,0,False,Sunday Off Topic Thread,[],r/infertility,False,0,,0,,,False,t3_6f6ncj,False,dark,1.0,,public,6,0,{},,,False,[],,False,False,,{},,False,6,,True,self,False,,[],{},,True,,1496599742.0,text,0,,,text,self.infertility,False,"<!-- SC_OFF --><div class=""md""><p>Use this thread to share anything not necessarily related to infertility. Rant or rave, bitch, moan, share something funny, anything goes!</p>
</div><!-- SC_ON -->",,,,,True,False,False,False,False,[],[],False,False,False,False,,[],False,,,moderator,t5_2saej,,,,6f6ncj,True,,AutoModerator,,107,False,no_ads,False,[],False,,/r/infertility/comments/6f6ncj/sunday_off_topic_thread/,no_ads,False,https://www.reddit.com/r/infertility/comments/6f6ncj/sunday_off_topic_thread/,25375,1496570942.0,0,,False,False,{},,,
161,2048,confidence,<praw.reddit.Reddit object at 0x7f2244aead90>,,infertility,"Welcome to the Infertility Results thread! Here you have the option of posting the outcome of your cycle (be it positive or negative) in a way that is sensitive to the emotional needs of our unique community. **For the sake of members who are struggling with negative results and the difficult feelings that come with them, we request that all pregnancy announcements be shared only in this thread.**

For the next stage of your journey, you may be interested in posting your story on r/whatworkedforme and we encourage you to continue to share your progress at our sister community, r/InfertilityBabies. Of course, you are always encouraged to share your non-pregnancy-related infertility experiences (and continue to support other community members) here on r/infertility. Members with questionable results may wish to post on the weekly post-beta discussion thread that is stickied on the main page. We are not banning any kind of post, either here or on the main board, but rather we see this as an opportunity for members to continue to share with those who are following their journey, but do so in a way that respects the feelings and wishes of those for whom individual results posts would be burdensome.
",t2_6l4z3,False,,0,False,Weekly Results Thread 06/04 to 06/10,[],r/infertility,False,0,,0,,,False,t3_6f6h1w,False,dark,1.0,,public,7,0,{},,,False,[],,False,False,,{},,False,7,,True,self,False,,[],{},,True,,1496596052.0,text,0,,,text,self.infertility,False,"<!-- SC_OFF --><div class=""md""><p>Welcome to the Infertility Results thread! Here you have the option of posting the outcome of your cycle (be it positive or negative) in a way that is sensitive to the emotional needs of our unique community. <strong>For the sake of members who are struggling with negative results and the difficult feelings that come with them, we request that all pregnancy announcements be shared only in this thread.</strong></p>

<p>For the next stage of your journey, you may be interested in posting your story on <a href=""/r/whatworkedforme"">r/whatworkedforme</a> and we encourage you to continue to share your progress at our sister community, <a href=""/r/InfertilityBabies"">r/InfertilityBabies</a>. Of course, you are always encouraged to share your non-pregnancy-related infertility experiences (and continue to support other community members) here on <a href=""/r/infertility"">r/infertility</a>. Members with questionable results may wish to post on the weekly post-beta discussion thread that is stickied on the main page. We are not banning any kind of post, either here or on the main board, but rather we see this as an opportunity for members to continue to share with those who are following their journey, but do so in a way that respects the feelings and wishes of those for whom individual results posts would be burdensome.</p>
</div><!-- SC_ON -->",,,,,True,False,False,False,False,[],[],False,False,False,False,,[],False,,,moderator,t5_2saej,,,,6f6h1w,True,,AutoModerator,,28,False,no_ads,False,[],False,,/r/infertility/comments/6f6h1w/weekly_results_thread_0604_to_0610/,no_ads,False,https://www.reddit.com/r/infertility/comments/6f6h1w/weekly_results_thread_0604_to_0610/,25375,1496567252.0,0,,False,False,{},,,
162,2048,confidence,<praw.reddit.Reddit object at 0x7f2244aead90>,,infertility,[deleted],,False,,0,False,Journal Club Sunday Topic: Protocols,[],r/infertility,False,0,,0,,,False,t3_6f66i5,False,dark,0.9,,public,7,0,{},,,False,[],,False,False,,{},,False,7,,,default,False,,,{},,True,,1496589840.0,text,0,,,,self.infertility,False,"<!-- SC_OFF --><div class=""md""><p>[deleted]</p>
</div><!-- SC_ON -->",,,,,True,False,False,False,False,[],[],False,False,False,False,,[],False,,,,t5_2saej,,,,6f66i5,False,,,,1,True,no_ads,False,[],,dark,/r/infertility/comments/6f66i5/journal_club_sunday_topic_protocols/,no_ads,False,https://www.reddit.com/r/infertility/comments/6f66i5/journal_club_sunday_topic_protocols/,25375,1496561040.0,0,,False,False,{},,,
163,2048,confidence,<praw.reddit.Reddit object at 0x7f2244aead90>,,infertility,https://youtu.be/HxtLlByaYTc,t2_uo0t7,False,,0,False,"Archie, Jughead, Betty, and Veronica meets Pretty Little Liars - Binge worthy!!",[],r/infertility,False,0,,0,,,False,t3_6f5zdj,False,dark,0.75,,public,2,0,{},,,False,[],,False,False,,{},,False,2,,False,self,False,,[],{},,True,,1496585965.0,text,0,,,text,self.infertility,False,"<!-- SC_OFF --><div class=""md""><p><a href=""https://youtu.be/HxtLlByaYTc"">https://youtu.be/HxtLlByaYTc</a></p>
</div><!-- SC_ON -->",,,,,True,False,False,False,False,[],[],False,False,False,False,I collect full Sharps containers,[],False,,,,t5_2saej,,,,6f5zdj,True,,kakavl,,6,True,no_ads,False,[],False,dark,/r/infertility/comments/6f5zdj/archie_jughead_betty_and_veronica_meets_pretty/,no_ads,False,https://www.reddit.com/r/infertility/comments/6f5zdj/archie_jughead_betty_and_veronica_meets_pretty/,25375,1496557165.0,0,,False,False,{},self,"{'images': [{'source': {'url': 'https://external-preview.redd.it/gzEXr1V30SPkwlsxrvuArJibXe4kuczUjpg1S8gaB1g.jpg?auto=webp&s=7c99409beb75222d7b93b3a5937dd8f66b12a8e6', 'width': 480, 'height': 360}, 'resolutions': [{'url': 'https://external-preview.redd.it/gzEXr1V30SPkwlsxrvuArJibXe4kuczUjpg1S8gaB1g.jpg?width=108&crop=smart&auto=webp&s=962d4dd145eb7278482473d0321ef9e0eb22a714', 'width': 108, 'height': 81}, {'url': 'https://external-preview.redd.it/gzEXr1V30SPkwlsxrvuArJibXe4kuczUjpg1S8gaB1g.jpg?width=216&crop=smart&auto=webp&s=4e4934a5b56dc8ea5d15eb03416b8d73e84050d3', 'width': 216, 'height': 162}, {'url': 'https://external-preview.redd.it/gzEXr1V30SPkwlsxrvuArJibXe4kuczUjpg1S8gaB1g.jpg?width=320&crop=smart&auto=webp&s=086a58688d3a8384bac5486792875a191d08246e', 'width': 320, 'height': 240}], 'variants': {}, 'id': 'pn2PkKxsD9Xnkesi4WZQUVNn49Qlku-Njx0N66XEQVg'}], 'enabled': False}",
164,2048,confidence,<praw.reddit.Reddit object at 0x7f2244aead90>,,infertility,[deleted],,False,,0,False,Chafing pain post egg retrieval,[],r/infertility,False,0,,0,,,False,t3_6f55aj,False,dark,1.0,,public,1,0,{},,,False,[],,False,False,,{},,False,1,,,default,False,,,{},,True,,1496573112.0,text,0,,,,self.infertility,False,"<!-- SC_OFF --><div class=""md""><p>[deleted]</p>
</div><!-- SC_ON -->",,,,,True,True,False,False,False,[],[],False,False,False,False,,[],False,,,,t5_2saej,,,,6f55aj,False,,,,0,True,no_ads,False,[],,dark,/r/infertility/comments/6f55aj/chafing_pain_post_egg_retrieval/,no_ads,False,https://www.reddit.com/r/infertility/comments/6f55aj/chafing_pain_post_egg_retrieval/,25375,1496544312.0,0,,False,False,{},,,
165,2048,confidence,<praw.reddit.Reddit object at 0x7f2244aead90>,,infertility,"I've already emailed my doctor and will call the after hours number tomorrow if I don't hear back but thought someone here might know something - I was supposed to take 150 for two days then 75 for two days and go in for a scan Monday but tonight, day 3, I had to take my shot while out at dinner and just blanked on the lower dose in my rush to get it done in a cramped bathroom stall and took 150 again instead of 75. What do? How much did I really mess up here?

**Update** My doctor said it was totally fine! Thanks for saving me from a small freak out everyone.",t2_dyz4g,False,,0,False,Accidently took larger dose of gonal f,[],r/infertility,False,0,,0,,,False,t3_6f5331,False,dark,1.0,,public,5,0,{},,d70f54ce-930e-11e4-8710-22000b26873e,False,[],,False,False,,{},,False,5,,False,self,1496690289.0,,[],{},,True,,1496572278.0,text,0,,,text,self.infertility,True,"<!-- SC_OFF --><div class=""md""><p>I&#39;ve already emailed my doctor and will call the after hours number tomorrow if I don&#39;t hear back but thought someone here might know something - I was supposed to take 150 for two days then 75 for two days and go in for a scan Monday but tonight, day 3, I had to take my shot while out at dinner and just blanked on the lower dose in my rush to get it done in a cramped bathroom stall and took 150 again instead of 75. What do? How much did I really mess up here?</p>

<p><strong>Update</strong> My doctor said it was totally fine! Thanks for saving me from a small freak out everyone.</p>
</div><!-- SC_ON -->",,,,,True,False,False,False,False,[],[],False,False,False,False,36F | anov + MFI | 8 failed IUI's | IVF/FET ,[],False,,,,t5_2saej,,,,6f5331,True,,havalinaaa,,7,True,no_ads,False,[],False,dark,/r/infertility/comments/6f5331/accidently_took_larger_dose_of_gonal_f/,no_ads,False,https://www.reddit.com/r/infertility/comments/6f5331/accidently_took_larger_dose_of_gonal_f/,25375,1496543478.0,0,,False,False,{},,,
166,2048,confidence,<praw.reddit.Reddit object at 0x7f2244aead90>,,infertility,"To save confusion, as mentioned above I am located in Australia. Yesterday I walked into the pharmacy to buy my Gonal F and Orgalutran for my upcoming first IVF cycle, and expected to pay a miminum of $400. 
I just about sobbed into the pharmacists shoulder when she explained that they were all under PBS (Pharmaceutical Benefit's Scheme) and that the entire cost for five 900IU Gonal F pens and two 5 packs of Orgalutran was $68 in total!! 

Ive done four rounds of Ovulation Induction with Gonal F prior to now, and I've always paid a few hundred each time. I heard that it's because the meds are not covered under PBS for Ovulation Induction but they are for IVF? 

Has it happened to anyone else and did the pharmacist definitely not make a mistake? I am still in shock but so so so grateful for the savings! ",t2_ifvo4,False,,0,False,$68 for meds for first IVF cycle?!?! (AUS),[],r/infertility,False,0,,0,,,False,t3_6f4z95,False,dark,0.89,,public,13,0,{},,,False,[],,False,False,,{},,False,13,,False,self,False,,[],{},,True,,1496570841.0,text,0,,,text,self.infertility,True,"<!-- SC_OFF --><div class=""md""><p>To save confusion, as mentioned above I am located in Australia. Yesterday I walked into the pharmacy to buy my Gonal F and Orgalutran for my upcoming first IVF cycle, and expected to pay a miminum of $400. 
I just about sobbed into the pharmacists shoulder when she explained that they were all under PBS (Pharmaceutical Benefit&#39;s Scheme) and that the entire cost for five 900IU Gonal F pens and two 5 packs of Orgalutran was $68 in total!! </p>

<p>Ive done four rounds of Ovulation Induction with Gonal F prior to now, and I&#39;ve always paid a few hundred each time. I heard that it&#39;s because the meds are not covered under PBS for Ovulation Induction but they are for IVF? </p>

<p>Has it happened to anyone else and did the pharmacist definitely not make a mistake? I am still in shock but so so so grateful for the savings! </p>
</div><!-- SC_ON -->",,,,,True,False,False,False,False,[],[],False,False,False,False,,[],False,,,,t5_2saej,,,,6f4z95,True,,babushkaB,,31,True,no_ads,False,[],False,,/r/infertility/comments/6f4z95/68_for_meds_for_first_ivf_cycle_aus/,no_ads,False,https://www.reddit.com/r/infertility/comments/6f4z95/68_for_meds_for_first_ivf_cycle_aus/,25375,1496542041.0,0,,False,False,{},,,
167,2048,confidence,<praw.reddit.Reddit object at 0x7f2244aead90>,,infertility,"So I broke down and went to CVS and bought a FRER because I was convinced my negative wondfos weren't working. (13dpo...hint: they probably are correct, I'm just being crazy and really wanted this IUI to work).

I bought white castle burgers, a pregnancy test, and a bottle of wine. Let me tell you about the look on the cashiers face...
Don't judge me cashier!   I'm only going to drink the wine when my period comes!   (I'm going to eat the burgers now dammit!)

Sorry.  Just had to let you know about my new low. I'm sure it looked bad. ;)",t2_96wwf,False,,0,False,A bottle of wine and a pregnancy test.,[],r/infertility,False,0,,0,,,False,t3_6f3ogu,False,dark,0.96,,public,19,0,{},,,False,[],,False,False,,{},,False,19,,False,self,False,,[],{},,True,,1496554759.0,text,0,,,text,self.infertility,False,"<!-- SC_OFF --><div class=""md""><p>So I broke down and went to CVS and bought a FRER because I was convinced my negative wondfos weren&#39;t working. (13dpo...hint: they probably are correct, I&#39;m just being crazy and really wanted this IUI to work).</p>

<p>I bought white castle burgers, a pregnancy test, and a bottle of wine. Let me tell you about the look on the cashiers face...
Don&#39;t judge me cashier!   I&#39;m only going to drink the wine when my period comes!   (I&#39;m going to eat the burgers now dammit!)</p>

<p>Sorry.  Just had to let you know about my new low. I&#39;m sure it looked bad. ;)</p>
</div><!-- SC_ON -->",,,,,True,False,False,False,False,[],[],False,False,False,False,"39, MFI, 1 tube, ectopic 2/17, CP 7/17",[],False,,,,t5_2saej,,,,6f3ogu,True,,Amywoman,,8,True,no_ads,False,[],False,dark,/r/infertility/comments/6f3ogu/a_bottle_of_wine_and_a_pregnancy_test/,no_ads,False,https://www.reddit.com/r/infertility/comments/6f3ogu/a_bottle_of_wine_and_a_pregnancy_test/,25375,1496525959.0,0,,False,False,{},,,
168,2048,confidence,<praw.reddit.Reddit object at 0x7f2244aead90>,,infertility,"Use this thread to share anything not necessarily related to infertility. Rant or rave, bitch, moan, share something funny, anything goes!",t2_6l4z3,False,,0,False,Saturday Afternoon Off Topic Thread,[],r/infertility,False,0,,0,,,False,t3_6f2qfh,False,dark,1.0,,public,4,0,{},,,False,[],,False,False,,{},,False,4,,True,self,False,,[],{},,True,,1496543766.0,text,0,,,text,self.infertility,False,"<!-- SC_OFF --><div class=""md""><p>Use this thread to share anything not necessarily related to infertility. Rant or rave, bitch, moan, share something funny, anything goes!</p>
</div><!-- SC_ON -->",,,,,True,False,False,False,False,[],[],False,False,False,False,,[],False,,,moderator,t5_2saej,,,,6f2qfh,True,,AutoModerator,,78,False,no_ads,False,[],False,,/r/infertility/comments/6f2qfh/saturday_afternoon_off_topic_thread/,no_ads,False,https://www.reddit.com/r/infertility/comments/6f2qfh/saturday_afternoon_off_topic_thread/,25375,1496514966.0,0,,False,False,{},,,
169,2048,confidence,<praw.reddit.Reddit object at 0x7f2244aead90>,,infertility,[deleted],,False,,0,False,Trying to enjoy things,[],r/infertility,False,0,,0,,,False,t3_6f2heh,False,dark,0.94,,public,12,0,{},,,False,[],,False,False,,{},,False,12,,,default,False,,,{},,True,,1496540939.0,text,0,,,,self.infertility,False,"<!-- SC_OFF --><div class=""md""><p>[deleted]</p>
</div><!-- SC_ON -->",,,,,True,False,False,False,False,[],[],False,False,False,False,,[],False,,,,t5_2saej,,,,6f2heh,False,,,,40,True,no_ads,False,[],,dark,/r/infertility/comments/6f2heh/trying_to_enjoy_things/,no_ads,False,https://www.reddit.com/r/infertility/comments/6f2heh/trying_to_enjoy_things/,25375,1496512139.0,0,,False,False,{},,,
170,2048,confidence,<praw.reddit.Reddit object at 0x7f2244aead90>,,infertility,[deleted],,False,,0,False,Master List of IVF Pharmacies!,[],r/infertility,False,0,,0,,,False,t3_6f2gd9,False,dark,0.88,,public,6,0,{},,,False,[],,False,False,,{},,False,6,,,default,False,,,{},,True,,1496540624.0,text,0,,,,self.infertility,False,"<!-- SC_OFF --><div class=""md""><p>[deleted]</p>
</div><!-- SC_ON -->",,,,,True,False,False,False,False,[],[],False,False,False,False,,[],False,,,,t5_2saej,,,,6f2gd9,False,,,,37,True,no_ads,False,[],,dark,/r/infertility/comments/6f2gd9/master_list_of_ivf_pharmacies/,no_ads,False,https://www.reddit.com/r/infertility/comments/6f2gd9/master_list_of_ivf_pharmacies/,25375,1496511824.0,0,,False,False,{},,,
171,2048,confidence,<praw.reddit.Reddit object at 0x7f2244aead90>,,infertility,"So, status post D&C and I'm feeling fine. Looks like there was a piece left over that we just couldn't see on the ultrasound, so I'm happy that we did it even though I was hoping to avoid any sort of manipulation to my cervix and uterus. Sample was sent to pathology so maybe that will yield something interesting, although I'm not expecting anything. After this, once my HCG FINALLY gets down to 0, we'll be doing some testing on me and a follow up HSG. I'm still not expecting to find anything there, but I appreciate my doc wanting to avoid wasting another cycle/FET when there might be something fixable/explainable going on with me. I've never wanted there to be something (fixable) wrong with me more in my life LOL.

Now we just have to think about what to do after all of the diagnostics are done. We have cycles left with insurance which include a retrieval and transfer, however an FET is considered an attempt and we'd be unable to like..""bank"" the retrieval. 

My spouse really doesn't want to put me through another retrieval because of how miserable I was last time, and my doctor has made it clear that I'm at particularly high risk for OHSS. Spouse doesn't want to risk my long term health and thinks we should do an FET next, pending what the diagnostics find. He's willing to pay for the FET out of pocket to not waste the whole cycle with insurance which I think is stupid when we could use the cycles we have for their max worth and have embryos banked to do FET with after.

I personally want to do another whole cycle and see if we can bank another embryo. We currently have two on ice, PGS done. We'd want to do PGS again, but to do that we have to have $$$$ on hand to burn and we just don't have it right now and likely won't for quite some time. I imagine that we MIGHT be ready to do this again in about 6-8 months, which..depending on the timing of diagnostics and how soon my levels get back to normal and my cycle starts up again, might not even be such a long time. 

Another choice we have, again pending diagnostics and what the new HSG will reveal..is starting IUI again! My new insurance covers a LOT of IUI- like, when I called to ask questions about the coverage it didn't seem like there was a limit at all because they covered it under ""same day surgery"". Considering that it might take a long time to get our funds together to pay for PGS with the next cycle, I asked about the possibility of trying IUI again while we wait. My doctor gave me the  is concerned about my overall egg/embryo quality because of how many of my blasts were mosaic and noted that if we did get pregnant, I had a much higher chance of miscarriage. Has anyone tried this, gone ""backwards"", and had any sort of luck/good outcome? I'm not sure I really believe that the IUI will work this time after being unsuccessful before, but I also would rather get as much out of my insurance as possible.

Thoughts? personal anecdotes? General advice?",t2_ecjkp,False,,0,False,Going forward (TW: loss),[],r/infertility,False,0,,0,,,False,t3_6f2eyl,False,dark,1.0,,public,6,0,{},,d70f54ce-930e-11e4-8710-22000b26873e,False,[],,False,False,,{},,False,6,,False,self,False,,[],{},,True,,1496540203.0,text,0,,,text,self.infertility,False,"<!-- SC_OFF --><div class=""md""><p>So, status post D&amp;C and I&#39;m feeling fine. Looks like there was a piece left over that we just couldn&#39;t see on the ultrasound, so I&#39;m happy that we did it even though I was hoping to avoid any sort of manipulation to my cervix and uterus. Sample was sent to pathology so maybe that will yield something interesting, although I&#39;m not expecting anything. After this, once my HCG FINALLY gets down to 0, we&#39;ll be doing some testing on me and a follow up HSG. I&#39;m still not expecting to find anything there, but I appreciate my doc wanting to avoid wasting another cycle/FET when there might be something fixable/explainable going on with me. I&#39;ve never wanted there to be something (fixable) wrong with me more in my life LOL.</p>

<p>Now we just have to think about what to do after all of the diagnostics are done. We have cycles left with insurance which include a retrieval and transfer, however an FET is considered an attempt and we&#39;d be unable to like..&quot;bank&quot; the retrieval. </p>

<p>My spouse really doesn&#39;t want to put me through another retrieval because of how miserable I was last time, and my doctor has made it clear that I&#39;m at particularly high risk for OHSS. Spouse doesn&#39;t want to risk my long term health and thinks we should do an FET next, pending what the diagnostics find. He&#39;s willing to pay for the FET out of pocket to not waste the whole cycle with insurance which I think is stupid when we could use the cycles we have for their max worth and have embryos banked to do FET with after.</p>

<p>I personally want to do another whole cycle and see if we can bank another embryo. We currently have two on ice, PGS done. We&#39;d want to do PGS again, but to do that we have to have $$$$ on hand to burn and we just don&#39;t have it right now and likely won&#39;t for quite some time. I imagine that we MIGHT be ready to do this again in about 6-8 months, which..depending on the timing of diagnostics and how soon my levels get back to normal and my cycle starts up again, might not even be such a long time. </p>

<p>Another choice we have, again pending diagnostics and what the new HSG will reveal..is starting IUI again! My new insurance covers a LOT of IUI- like, when I called to ask questions about the coverage it didn&#39;t seem like there was a limit at all because they covered it under &quot;same day surgery&quot;. Considering that it might take a long time to get our funds together to pay for PGS with the next cycle, I asked about the possibility of trying IUI again while we wait. My doctor gave me the  is concerned about my overall egg/embryo quality because of how many of my blasts were mosaic and noted that if we did get pregnant, I had a much higher chance of miscarriage. Has anyone tried this, gone &quot;backwards&quot;, and had any sort of luck/good outcome? I&#39;m not sure I really believe that the IUI will work this time after being unsuccessful before, but I also would rather get as much out of my insurance as possible.</p>

<p>Thoughts? personal anecdotes? General advice?</p>
</div><!-- SC_ON -->",,,,,True,False,False,False,False,[],[],False,False,False,False,"PCOS, MFI, FET#1 =mc. IVF#2, FET #2 on 1/10",[],False,,,,t5_2saej,,,,6f2eyl,True,,JackManifesto,,6,True,no_ads,False,[],False,dark,/r/infertility/comments/6f2eyl/going_forward_tw_loss/,no_ads,False,https://www.reddit.com/r/infertility/comments/6f2eyl/going_forward_tw_loss/,25375,1496511403.0,0,,False,False,{},,,
