,comment_limit,comment_sort,_reddit,approved_at_utc,subreddit,selftext,author_fullname,saved,mod_reason_title,gilded,clicked,title,link_flair_richtext,subreddit_name_prefixed,hidden,pwls,link_flair_css_class,downs,thumbnail_height,top_awarded_type,hide_score,name,quarantine,link_flair_text_color,upvote_ratio,author_flair_background_color,subreddit_type,ups,total_awards_received,media_embed,thumbnail_width,author_flair_template_id,is_original_content,user_reports,secure_media,is_reddit_media_domain,is_meta,category,secure_media_embed,link_flair_text,can_mod_post,score,approved_by,author_premium,thumbnail,edited,author_flair_css_class,author_flair_richtext,gildings,content_categories,is_self,mod_note,created,link_flair_type,wls,removed_by_category,banned_by,author_flair_type,domain,allow_live_comments,selftext_html,likes,suggested_sort,banned_at_utc,view_count,archived,no_follow,is_crosspostable,pinned,over_18,all_awardings,awarders,media_only,can_gild,spoiler,locked,author_flair_text,treatment_tags,visited,removed_by,num_reports,distinguished,subreddit_id,mod_reason_by,removal_reason,link_flair_background_color,id,is_robot_indexable,report_reasons,author,discussion_type,num_comments,send_replies,whitelist_status,contest_mode,mod_reports,author_patreon_flair,author_flair_text_color,permalink,parent_whitelist_status,stickied,url,subreddit_subscribers,created_utc,num_crossposts,media,is_video,_fetched,_comments_by_id,post_hint,preview,collections
0,2048,confidence,<praw.reddit.Reddit object at 0x7f2244aead90>,,infertility,"I have a work trip planned for the day after my FET. I fly a lot for work - I am either at home for 2-3 months at a time, or away every week. I tried for a long time to plan this around IVF cycles, but gave up as it was impossible so now just book things and take the chance. My work is OK with this, it has generally worked out, and they are happy to bear the extra cost of reschedules.

This time, I am taking a day trip on Monday, and flying back Monday night for my FET on Tuesday. I really should go back on Wednesday, but I don't want to. I have had six stim cycles so far, three transfers, two of which resulted in pregnancy/miscarriage at 10 weeks. During both I flew, and I got paranoid this contributed to the miscarriage (I know it probably didn't, the first has chromosomal issues). In both cases, I got cramps during flights and I can't help connecting them.

I have checked the literature, and my Dr assures me it is safe to fly (but will write a certificate for anything I want). But I also know the airlines take people off flights as soon as they get pregnant (no waiting until 12 weeks etc).

On the other hand, my project will be MUCH easier if I am there next week, and I will feel guilty for mucking people around.

So, any thoughts? Safe or not safe? Am I being crazy? ",t2_wedmf,False,,0,False,Flying day after FET?,[],r/infertility,False,0,,0,,,False,t3_6hcdd4,False,dark,0.8,,public,3,0,{},,,False,[],,False,False,,{},,False,3,,False,self,False,,[],{},,True,,1497523908.0,text,0,,,text,self.infertility,True,"<!-- SC_OFF --><div class=""md""><p>I have a work trip planned for the day after my FET. I fly a lot for work - I am either at home for 2-3 months at a time, or away every week. I tried for a long time to plan this around IVF cycles, but gave up as it was impossible so now just book things and take the chance. My work is OK with this, it has generally worked out, and they are happy to bear the extra cost of reschedules.</p>

<p>This time, I am taking a day trip on Monday, and flying back Monday night for my FET on Tuesday. I really should go back on Wednesday, but I don&#39;t want to. I have had six stim cycles so far, three transfers, two of which resulted in pregnancy/miscarriage at 10 weeks. During both I flew, and I got paranoid this contributed to the miscarriage (I know it probably didn&#39;t, the first has chromosomal issues). In both cases, I got cramps during flights and I can&#39;t help connecting them.</p>

<p>I have checked the literature, and my Dr assures me it is safe to fly (but will write a certificate for anything I want). But I also know the airlines take people off flights as soon as they get pregnant (no waiting until 12 weeks etc).</p>

<p>On the other hand, my project will be MUCH easier if I am there next week, and I will feel guilty for mucking people around.</p>

<p>So, any thoughts? Safe or not safe? Am I being crazy? </p>
</div><!-- SC_ON -->",,,,,True,False,False,False,False,[],[],False,False,False,False,,[],False,,,,t5_2saej,,,,6hcdd4,True,,blue_bicycle35,,12,True,no_ads,False,[],False,,/r/infertility/comments/6hcdd4/flying_day_after_fet/,no_ads,False,https://www.reddit.com/r/infertility/comments/6hcdd4/flying_day_after_fet/,25375,1497495108.0,0,,False,False,{},,,
1,2048,confidence,<praw.reddit.Reddit object at 0x7f2244aead90>,,infertility,"I was gonna put this in the daily off topic, but it turned in to a novel because I suck at being concise so I made a separate post :)

Thank you all for the love, well wishes, and support for our transfer. It's killing me that we aren't telling my mom (she's pretty much my best friend), so having all of you cheer us on means the world!!  

The transfer went fairly smooth, although I think I overdid it on the water this morning. I had to pee SO BAD when we got there, and they were running about a half hour behind, so the nurse let me ""empty my bladder a little"" then checked it on the ultrasound and said ""Woah it's still really full."" By the time my RE and embryologist came in, I was in pain from having to pee so bad again so they let me run out really quick and empty some off again.  

Then, the RE had the speculum in and was nearly ready to go, and says ""Your bladder is still so full that it's pushing on the speculum. Do you want to go again? You have to be so uncomfortable"" so I jumped up and peed a third time (they gave me a cup and said fill this three times). Apparently my bladder magically refills instantaneously. It was the best pee of my life.  

He had a little trouble getting the catheter in, and the RE asked if I had a tilted uterus. I was like ""um...no...you've never said that..."" Apparently my bladder was still so full it was pushing on my uterus or something, so one nurse had to hold the ultrasound thing and one had to hold the speculum and push on it to get my uterus to become less tilted.  

Anyway, the actual transfer was surreal and went smoothly. It stuck a little in the catheter, but ended up getting out and where they wanted it in the end. They gave us pictures of our little blastocyst, too, which I think is super cool. I'm actually feeling really grateful and in awe of science today and all they can do, and that people care enough to help all of us with infertility try to have babies.    

I wore [these socks](http://www.earthtooldcity.com/product/its-a-beautiful-day-dont-fuck-it-up-mens-socks/) and my RE (thankfully!) thought they were hilarious. All the nurses bust out laughing, too. My RE was cracking up and took pictures of them, then played U2's ""Beautiful Day"" during the transfer, which got me all emotional because I love that song and because this is the closest we've gotten and because right now, at this moment, there is a little embryo in me and I want it to work so terribly bad.  

I've never seen my husband look so excited about anything, either. It was adorable. We got some Wendy's on the way home (we hardly ever eat fast food but it just sounded good), then I napped on the couch for 3 hours while he played video games.  

Today, I am hopeful. Today, life is good. And now we wait...",t2_7i7fp,False,,0,False,Our First FET,[],r/infertility,False,0,,0,,,False,t3_6hb3j0,False,dark,0.93,,public,27,0,{},,,False,[],,False,False,,{},,False,27,,False,self,1497484326.0,,[],{},,True,,1497509548.0,text,0,,,text,self.infertility,False,"<!-- SC_OFF --><div class=""md""><p>I was gonna put this in the daily off topic, but it turned in to a novel because I suck at being concise so I made a separate post :)</p>

<p>Thank you all for the love, well wishes, and support for our transfer. It&#39;s killing me that we aren&#39;t telling my mom (she&#39;s pretty much my best friend), so having all of you cheer us on means the world!!  </p>

<p>The transfer went fairly smooth, although I think I overdid it on the water this morning. I had to pee SO BAD when we got there, and they were running about a half hour behind, so the nurse let me &quot;empty my bladder a little&quot; then checked it on the ultrasound and said &quot;Woah it&#39;s still really full.&quot; By the time my RE and embryologist came in, I was in pain from having to pee so bad again so they let me run out really quick and empty some off again.  </p>

<p>Then, the RE had the speculum in and was nearly ready to go, and says &quot;Your bladder is still so full that it&#39;s pushing on the speculum. Do you want to go again? You have to be so uncomfortable&quot; so I jumped up and peed a third time (they gave me a cup and said fill this three times). Apparently my bladder magically refills instantaneously. It was the best pee of my life.  </p>

<p>He had a little trouble getting the catheter in, and the RE asked if I had a tilted uterus. I was like &quot;um...no...you&#39;ve never said that...&quot; Apparently my bladder was still so full it was pushing on my uterus or something, so one nurse had to hold the ultrasound thing and one had to hold the speculum and push on it to get my uterus to become less tilted.  </p>

<p>Anyway, the actual transfer was surreal and went smoothly. It stuck a little in the catheter, but ended up getting out and where they wanted it in the end. They gave us pictures of our little blastocyst, too, which I think is super cool. I&#39;m actually feeling really grateful and in awe of science today and all they can do, and that people care enough to help all of us with infertility try to have babies.    </p>

<p>I wore <a href=""http://www.earthtooldcity.com/product/its-a-beautiful-day-dont-fuck-it-up-mens-socks/"">these socks</a> and my RE (thankfully!) thought they were hilarious. All the nurses bust out laughing, too. My RE was cracking up and took pictures of them, then played U2&#39;s &quot;Beautiful Day&quot; during the transfer, which got me all emotional because I love that song and because this is the closest we&#39;ve gotten and because right now, at this moment, there is a little embryo in me and I want it to work so terribly bad.  </p>

<p>I&#39;ve never seen my husband look so excited about anything, either. It was adorable. We got some Wendy&#39;s on the way home (we hardly ever eat fast food but it just sounded good), then I napped on the couch for 3 hours while he played video games.  </p>

<p>Today, I am hopeful. Today, life is good. And now we wait...</p>
</div><!-- SC_ON -->",,,,,True,False,False,False,False,[],[],False,False,False,False,29F+30M|MFI|ICSI May|FET,[],False,,,,t5_2saej,,,,6hb3j0,True,,mynameismemory,,78,True,no_ads,False,[],False,dark,/r/infertility/comments/6hb3j0/our_first_fet/,no_ads,False,https://www.reddit.com/r/infertility/comments/6hb3j0/our_first_fet/,25375,1497480748.0,0,,False,False,{},self,"{'images': [{'source': {'url': 'https://external-preview.redd.it/cY0PmYVrqanUoByX-Lc2ySQMUZBNENFBNPDLrHzYZPc.jpg?auto=webp&s=8a94777c0d98ea462c7b107e4fbc531cf36d29f9', 'width': 479, 'height': 516}, 'resolutions': [{'url': 'https://external-preview.redd.it/cY0PmYVrqanUoByX-Lc2ySQMUZBNENFBNPDLrHzYZPc.jpg?width=108&crop=smart&auto=webp&s=17c694908fa94779d2052153820af624228f2bef', 'width': 108, 'height': 116}, {'url': 'https://external-preview.redd.it/cY0PmYVrqanUoByX-Lc2ySQMUZBNENFBNPDLrHzYZPc.jpg?width=216&crop=smart&auto=webp&s=a71b0d5ad5b7c76ba334bcade4d3c2294566a1c9', 'width': 216, 'height': 232}, {'url': 'https://external-preview.redd.it/cY0PmYVrqanUoByX-Lc2ySQMUZBNENFBNPDLrHzYZPc.jpg?width=320&crop=smart&auto=webp&s=65c064eea4bb7d5e09270230ecaf79a65b687d92', 'width': 320, 'height': 344}], 'variants': {}, 'id': '1nGoFe7f7lY-ABpYFQZqbI33TWDfpzY_irXNAi3K8jY'}], 'enabled': False}",
2,2048,confidence,<praw.reddit.Reddit object at 0x7f2244aead90>,,infertility,"Hi guys! 

My job is as a nurse, and we have to plan our schedules very far in advance for my job. We typically schedule 6-12 weeks out, and it can be difficult to get coverage/change shifts after that time. 

We are going to move forward with IVF, most likely starting stims last week of July. 

My question is, how ""affected"" did you feel by your stims? I know I will be on the antagonist protocol, starting with BC suppression the middle 2 weeks of July before starting with Gonal-F and then Ganirelix. My doctor anticipates I'll need about 10-12 days of stims for the retrieval, as I've responded well to the FSH for IUI cycles. 

Am I going to be able to like...work my shifts? I know this probably sounds like a silly question. Did you feel nauseated, or dizzy, or exceptionally tired while stimming? Could you imagine working 12 hour shifts with no problem, or should I ask for permission from my boss to change to only 8-hour shifts, or a limited schedule? 

I know there is no way to predict when the retrieval will be, nor is there a way to guess whether OHSS would develop. But how much recovery did you need after your ER? Similarly, how long after the average ER could you imagine needing off before returning to work a 12 hour shift in a busy ER? 

I'm basically trying to plan for something that is very difficult to plan for, and trying to decide whether I need to clue my boss in at this point or if I can somehow make this work. Any input is really appreciated!! ",t2_142poj,False,,0,False,Planning for stims,[],r/infertility,False,0,,0,,,False,t3_6ha3qn,False,dark,0.8,,public,3,0,{},,,False,[],,False,False,,{},,False,3,,False,self,False,,[],{},,True,,1497499901.0,text,0,,,text,self.infertility,False,"<!-- SC_OFF --><div class=""md""><p>Hi guys! </p>

<p>My job is as a nurse, and we have to plan our schedules very far in advance for my job. We typically schedule 6-12 weeks out, and it can be difficult to get coverage/change shifts after that time. </p>

<p>We are going to move forward with IVF, most likely starting stims last week of July. </p>

<p>My question is, how &quot;affected&quot; did you feel by your stims? I know I will be on the antagonist protocol, starting with BC suppression the middle 2 weeks of July before starting with Gonal-F and then Ganirelix. My doctor anticipates I&#39;ll need about 10-12 days of stims for the retrieval, as I&#39;ve responded well to the FSH for IUI cycles. </p>

<p>Am I going to be able to like...work my shifts? I know this probably sounds like a silly question. Did you feel nauseated, or dizzy, or exceptionally tired while stimming? Could you imagine working 12 hour shifts with no problem, or should I ask for permission from my boss to change to only 8-hour shifts, or a limited schedule? </p>

<p>I know there is no way to predict when the retrieval will be, nor is there a way to guess whether OHSS would develop. But how much recovery did you need after your ER? Similarly, how long after the average ER could you imagine needing off before returning to work a 12 hour shift in a busy ER? </p>

<p>I&#39;m basically trying to plan for something that is very difficult to plan for, and trying to decide whether I need to clue my boss in at this point or if I can somehow make this work. Any input is really appreciated!! </p>
</div><!-- SC_ON -->",,,,,True,False,False,False,False,[],[],False,False,False,False,"32F, MFI, IUIx3,1 IVF, FET",[],False,,,,t5_2saej,,,,6ha3qn,True,,lsangelz,,29,True,no_ads,False,[],False,dark,/r/infertility/comments/6ha3qn/planning_for_stims/,no_ads,False,https://www.reddit.com/r/infertility/comments/6ha3qn/planning_for_stims/,25375,1497471101.0,0,,False,False,{},,,
3,2048,confidence,<praw.reddit.Reddit object at 0x7f2244aead90>,,infertility,"Hi! 

I'm having a really rough day. First off, let me say that I am incredibly blessed and have one child from IVF. Im 31 and have unexplained infertility. 
I'm still struggling. I really still have hope I can have baby #2 naturally. I don't know why. 
It's CD 34 and still no period although I had cramping a few days ago and now nothing. I really had hoped implantation cramps. POAS this morning and negative. Sigh. I feel like I have no one to talk to that understands. 

Thanks for letting me vent. ",t2_15q8zc,False,,0,False,First post here,[],r/infertility,False,0,,0,,,False,t3_6ha2qr,False,dark,0.52,,public,1,0,{},,,False,[],,False,False,,{},,False,1,,False,self,False,,[],{},,True,,1497499644.0,text,0,,,text,self.infertility,False,"<!-- SC_OFF --><div class=""md""><p>Hi! </p>

<p>I&#39;m having a really rough day. First off, let me say that I am incredibly blessed and have one child from IVF. Im 31 and have unexplained infertility. 
I&#39;m still struggling. I really still have hope I can have baby #2 naturally. I don&#39;t know why. 
It&#39;s CD 34 and still no period although I had cramping a few days ago and now nothing. I really had hoped implantation cramps. POAS this morning and negative. Sigh. I feel like I have no one to talk to that understands. </p>

<p>Thanks for letting me vent. </p>
</div><!-- SC_ON -->",,,,,True,False,False,False,False,[],[],False,False,False,False,,[],False,,,,t5_2saej,,,,6ha2qr,True,,lisamighthavereddit,,13,True,no_ads,False,[],False,,/r/infertility/comments/6ha2qr/first_post_here/,no_ads,False,https://www.reddit.com/r/infertility/comments/6ha2qr/first_post_here/,25375,1497470844.0,0,,False,False,{},,,
4,2048,confidence,<praw.reddit.Reddit object at 0x7f2244aead90>,,infertility,"Use this thread to share anything not necessarily related to infertility. Rant or rave, bitch, moan, share something funny, anything goes!",t2_6l4z3,False,,0,False,Wednesday Afternoon Off Topic Thread,[],r/infertility,False,0,,0,,,False,t3_6h9gud,False,dark,1.0,,public,3,0,{},,,False,[],,False,False,,{},,False,3,,True,self,False,,[],{},,True,,1497494143.0,text,0,,,text,self.infertility,False,"<!-- SC_OFF --><div class=""md""><p>Use this thread to share anything not necessarily related to infertility. Rant or rave, bitch, moan, share something funny, anything goes!</p>
</div><!-- SC_ON -->",,,,,True,False,False,False,False,[],[],False,False,False,False,,[],False,,,moderator,t5_2saej,,,,6h9gud,True,,AutoModerator,,156,False,no_ads,False,[],False,,/r/infertility/comments/6h9gud/wednesday_afternoon_off_topic_thread/,no_ads,False,https://www.reddit.com/r/infertility/comments/6h9gud/wednesday_afternoon_off_topic_thread/,25375,1497465343.0,0,,False,False,{},,,
5,2048,confidence,<praw.reddit.Reddit object at 0x7f2244aead90>,,infertility,"I added too much water by accident and had to do the shot at 9 pm, not 5-6 like the NP wanted.

What should I do for the new two? Do them at 5PM or keep it at 9?",t2_16zeyt,False,,0,False,I messed up my Menopur,[],r/infertility,False,0,,0,,,False,t3_6h85vk,False,dark,0.8,,public,3,0,{},,,False,[],,False,False,,{},,False,3,,False,self,False,,[],{},,True,,1497482447.0,text,0,,,text,self.infertility,False,"<!-- SC_OFF --><div class=""md""><p>I added too much water by accident and had to do the shot at 9 pm, not 5-6 like the NP wanted.</p>

<p>What should I do for the new two? Do them at 5PM or keep it at 9?</p>
</div><!-- SC_ON -->",,,,,True,False,False,False,False,[],[],False,False,False,False,,[],False,,,,t5_2saej,,,,6h85vk,True,,unverified6,,8,True,no_ads,False,[],False,,/r/infertility/comments/6h85vk/i_messed_up_my_menopur/,no_ads,False,https://www.reddit.com/r/infertility/comments/6h85vk/i_messed_up_my_menopur/,25375,1497453647.0,0,,False,False,{},,,
6,2048,confidence,<praw.reddit.Reddit object at 0x7f2244aead90>,,infertility,[deleted],,False,,0,False,Journal Club Wednesday Topic: DE,[],r/infertility,False,0,,0,,,False,t3_6h854e,False,dark,0.76,,public,2,0,{},,,False,[],,False,False,,{},,False,2,,,default,False,,,{},,True,,1497482257.0,text,0,,,,self.infertility,False,"<!-- SC_OFF --><div class=""md""><p>[deleted]</p>
</div><!-- SC_ON -->",,,,,True,False,False,False,False,[],[],False,False,False,False,,[],False,,,,t5_2saej,,,,6h854e,False,,,,1,True,no_ads,False,[],,dark,/r/infertility/comments/6h854e/journal_club_wednesday_topic_de/,no_ads,False,https://www.reddit.com/r/infertility/comments/6h854e/journal_club_wednesday_topic_de/,25375,1497453457.0,0,,False,False,{},,,
7,2048,confidence,<praw.reddit.Reddit object at 0x7f2244aead90>,,infertility,"It's a fluff piece and I have mixed feelings on folks that might expect strangers to fund their [anything].  But I know many of us can relate. 

https://www.popsugar.com/moms/Strangers-Donating-IVF-Medicine-43630231?slide=opening-slide",t2_14rwut,False,,0,False,Infertility in media,[],r/infertility,False,0,,0,,,False,t3_6h7xgx,False,dark,0.84,,public,4,0,{},,d70f54ce-930e-11e4-8710-22000b26873e,False,[],,False,False,,{},,False,4,,False,self,False,,[],{},,True,,1497480265.0,text,0,,,text,self.infertility,False,"<!-- SC_OFF --><div class=""md""><p>It&#39;s a fluff piece and I have mixed feelings on folks that might expect strangers to fund their [anything].  But I know many of us can relate. </p>

<p><a href=""https://www.popsugar.com/moms/Strangers-Donating-IVF-Medicine-43630231?slide=opening-slide"">https://www.popsugar.com/moms/Strangers-Donating-IVF-Medicine-43630231?slide=opening-slide</a></p>
</div><!-- SC_ON -->",,,,,True,False,False,False,False,[],[],False,False,False,False,44F| Lots of IVF,[],False,,,,t5_2saej,,,,6h7xgx,True,,dawndilioso,,8,True,no_ads,False,[],False,dark,/r/infertility/comments/6h7xgx/infertility_in_media/,no_ads,False,https://www.reddit.com/r/infertility/comments/6h7xgx/infertility_in_media/,25375,1497451465.0,0,,False,False,{},self,"{'images': [{'source': {'url': 'https://external-preview.redd.it/vIIOHr7O_I7wvMTM8jFcCo080A1iIwQCGOrb_lhNqmo.jpg?auto=webp&s=3098f0da86ebff3cb7f1c12c9ac91ac46f1f9a7d', 'width': 1200, 'height': 630}, 'resolutions': [{'url': 'https://external-preview.redd.it/vIIOHr7O_I7wvMTM8jFcCo080A1iIwQCGOrb_lhNqmo.jpg?width=108&crop=smart&auto=webp&s=a16f05fd3dfacd3b4d9bddcc1bbb47d9beed792a', 'width': 108, 'height': 56}, {'url': 'https://external-preview.redd.it/vIIOHr7O_I7wvMTM8jFcCo080A1iIwQCGOrb_lhNqmo.jpg?width=216&crop=smart&auto=webp&s=632de710819e1f1f381d116927f6d76ac39a4bb3', 'width': 216, 'height': 113}, {'url': 'https://external-preview.redd.it/vIIOHr7O_I7wvMTM8jFcCo080A1iIwQCGOrb_lhNqmo.jpg?width=320&crop=smart&auto=webp&s=990811e0d4805f8282f89a8644daae834dcc37fd', 'width': 320, 'height': 168}, {'url': 'https://external-preview.redd.it/vIIOHr7O_I7wvMTM8jFcCo080A1iIwQCGOrb_lhNqmo.jpg?width=640&crop=smart&auto=webp&s=859f1937c3663a1feefcedca18385af8b990098c', 'width': 640, 'height': 336}, {'url': 'https://external-preview.redd.it/vIIOHr7O_I7wvMTM8jFcCo080A1iIwQCGOrb_lhNqmo.jpg?width=960&crop=smart&auto=webp&s=c0cbdcc863d65eebcd7fc530528ac2c6574d8243', 'width': 960, 'height': 504}, {'url': 'https://external-preview.redd.it/vIIOHr7O_I7wvMTM8jFcCo080A1iIwQCGOrb_lhNqmo.jpg?width=1080&crop=smart&auto=webp&s=b5f9fc50679cbd538a2eba108dd54bd01139b5bd', 'width': 1080, 'height': 567}], 'variants': {}, 'id': 'z6GTCvfx-BrYY3Wxz_Brlc-ek8XULZPoWmu5o7okArM'}], 'enabled': False}",
