273,2048,confidence,<praw.reddit.Reddit object at 0x7f2244aead90>,,infertility,"I don't know if anyone saw my post on /TFAB, but after lots of concerns over my fertility, we found out that it's my partner who has an issue, specifically very low sperm count and low motility. Our doctor wants to do some more blood work and another semen analysis. She said there's often variability, but that numbers won't likely jump to ""normal."" Has anyone had a second SA go well? We've been told we have a 2-5% chance of conceiving naturally. Considering we can't and won't pursue IVF, we may be completely out of options.",[],False,,0,False,Good semen analysis after bad?,[],r/infertility,False,0,,0,,,False,t3_6zgkrw,False,dark,1.0,,public,1,0,{},,,False,,False,False,,{},,False,1,,self,False,,{},,True,,1505176927.0,text,0,,,self.infertility,True,"<!-- SC_OFF --><div class=""md""><p>I don&#39;t know if anyone saw my post on /TFAB, but after lots of concerns over my fertility, we found out that it&#39;s my partner who has an issue, specifically very low sperm count and low motility. Our doctor wants to do some more blood work and another semen analysis. She said there&#39;s often variability, but that numbers won&#39;t likely jump to &quot;normal.&quot; Has anyone had a second SA go well? We&#39;ve been told we have a 2-5% chance of conceiving naturally. Considering we can&#39;t and won&#39;t pursue IVF, we may be completely out of options.</p>
</div><!-- SC_ON -->",,,,,True,True,False,False,False,[],[],False,False,False,False,"39, TTC#1, possible MFI",[],False,,,,t5_2saej,,,,6zgkrw,True,,lunalagu,,11,True,no_ads,False,[],dark,/r/infertility/comments/6zgkrw/good_semen_analysis_after_bad/,no_ads,False,https://www.reddit.com/r/infertility/comments/6zgkrw/good_semen_analysis_after_bad/,25376,1505148127.0,0,,False,False,{},t2_zk6v7u,False,[],text,False,,,
274,2048,confidence,<praw.reddit.Reddit object at 0x7f2244aead90>,,infertility,"I started writing this on the daily but it got very long, and writing felt cathartic so I decided to just make a stand alone post, and a sort of re-intro.  I've been absent the last month because of an (incredible) vacation and personal time I've needed to process some bad news, but I'm getting to the point where I'm ready to jump back into the infertility world so I've got a flair update and a diagnosis update, hooray. 

TW: Miscarriage
My husband and I have been trying over two years.  I stopped birth control in August 2015 and didn't get my period for four months.  Then I got it every two weeks.  Then finally about 6 months out it normalized.  Great, I began using OPK's, then temping, trying to figure out when I was ovulating.  Never in my life have I had a positive OPK.  Temps all over the place.  My obgyn started doing progesterone draws on CD 21 and they were always less than 1, confirming no ovulation.  So we started with an RE July 2016, and I started ovulating! My insurance covered IUI's with meds with low co-pays which seemed amazing given how shitty infertility coverage can be.  I got pregnant with my 4th IUI and was so so happy.  Still the happiest 3 weeks of my life I can remember.  At the 7 week ultrasound the pregnancy was dating behind, with no heartbeat.  A few excruciating weeks confirmed it wasn't viable, but my body wasn't picking up on that.  I had a D&C at about 11 weeks, and they confirmed the miscarriage was due to a trisomy.  

I was hopeful I had got pregnant once.  I did 4 more IUI's.  2 with injectables.  All looked pretty textbook, although I've always been a bit of a slow responder to meds.  So I've done 8 total.  I want to scream writing that out.  I just felt like something else was wrong, and asked to have my fertility labs re-tested.  

My AMH dropped from 2.69 in July 2016 to .51 in August 2017.  FUCK! My FSH went from 5.69 to 10.1.  I got this in an email message from my doctor in the middle of France on vacation and spiraled HARD.  I might have drank an entire bottle of wine that night (it was delicious, the hangover not so much).  We had already been planning to do IVF this fall, but my mindset went from ""no guarantees but it will probably work for us"" to ""are we even going to be able to do IVF?"".  The internet was not my friend, I had to stop myself from googling too much.  

Since we've been back I've talked to my doctor who made me slightly more hopeful, his opinion is that although my ovaries are in free fall IVF may still work and some reasons for hope are still my age, my high antral follicle count, and my documented good response to fertility meds.  So ok, there's that.  But his opinion is also that I've got a 6-9 month window to try to salvage whatever I can.  We've got consults set up in October, I'm trying to take this month off from worrying (yeah right) and just focus on being healthy.

Sorry for the long long post.  I would love to hear from other DOR ladies about their experiences with IVF... and also just from anyone who wants to throw all the middle fingers up at the sky at the continued bad news infertility seems to bring to some.  Oh, and happy fucking Monday!  ",[],False,,0,False,Joining the DOR club,[],r/infertility,False,0,,0,,,False,t3_6zgcfy,False,dark,0.8,,public,8,0,{},,,False,,False,False,,{},,False,8,,self,1505150632.0,,{},,True,,1505174785.0,text,0,,,self.infertility,True,"<!-- SC_OFF --><div class=""md""><p>I started writing this on the daily but it got very long, and writing felt cathartic so I decided to just make a stand alone post, and a sort of re-intro.  I&#39;ve been absent the last month because of an (incredible) vacation and personal time I&#39;ve needed to process some bad news, but I&#39;m getting to the point where I&#39;m ready to jump back into the infertility world so I&#39;ve got a flair update and a diagnosis update, hooray. </p>

<p>TW: Miscarriage
My husband and I have been trying over two years.  I stopped birth control in August 2015 and didn&#39;t get my period for four months.  Then I got it every two weeks.  Then finally about 6 months out it normalized.  Great, I began using OPK&#39;s, then temping, trying to figure out when I was ovulating.  Never in my life have I had a positive OPK.  Temps all over the place.  My obgyn started doing progesterone draws on CD 21 and they were always less than 1, confirming no ovulation.  So we started with an RE July 2016, and I started ovulating! My insurance covered IUI&#39;s with meds with low co-pays which seemed amazing given how shitty infertility coverage can be.  I got pregnant with my 4th IUI and was so so happy.  Still the happiest 3 weeks of my life I can remember.  At the 7 week ultrasound the pregnancy was dating behind, with no heartbeat.  A few excruciating weeks confirmed it wasn&#39;t viable, but my body wasn&#39;t picking up on that.  I had a D&amp;C at about 11 weeks, and they confirmed the miscarriage was due to a trisomy.  </p>

<p>I was hopeful I had got pregnant once.  I did 4 more IUI&#39;s.  2 with injectables.  All looked pretty textbook, although I&#39;ve always been a bit of a slow responder to meds.  So I&#39;ve done 8 total.  I want to scream writing that out.  I just felt like something else was wrong, and asked to have my fertility labs re-tested.  </p>

<p>My AMH dropped from 2.69 in July 2016 to .51 in August 2017.  FUCK! My FSH went from 5.69 to 10.1.  I got this in an email message from my doctor in the middle of France on vacation and spiraled HARD.  I might have drank an entire bottle of wine that night (it was delicious, the hangover not so much).  We had already been planning to do IVF this fall, but my mindset went from &quot;no guarantees but it will probably work for us&quot; to &quot;are we even going to be able to do IVF?&quot;.  The internet was not my friend, I had to stop myself from googling too much.  </p>

<p>Since we&#39;ve been back I&#39;ve talked to my doctor who made me slightly more hopeful, his opinion is that although my ovaries are in free fall IVF may still work and some reasons for hope are still my age, my high antral follicle count, and my documented good response to fertility meds.  So ok, there&#39;s that.  But his opinion is also that I&#39;ve got a 6-9 month window to try to salvage whatever I can.  We&#39;ve got consults set up in October, I&#39;m trying to take this month off from worrying (yeah right) and just focus on being healthy.</p>

<p>Sorry for the long long post.  I would love to hear from other DOR ladies about their experiences with IVF... and also just from anyone who wants to throw all the middle fingers up at the sky at the continued bad news infertility seems to bring to some.  Oh, and happy fucking Monday!  </p>
</div><!-- SC_ON -->",,,,,True,False,False,False,False,[],[],False,False,False,False,34F - ? - 8 IUI's - 1 MMC - IVF next,[],False,,,,t5_2saej,,,,6zgcfy,True,,andPeggy1,,32,True,no_ads,False,[],dark,/r/infertility/comments/6zgcfy/joining_the_dor_club/,no_ads,False,https://www.reddit.com/r/infertility/comments/6zgcfy/joining_the_dor_club/,25376,1505145985.0,0,,False,False,{},t2_16214n,False,[],text,False,,,
275,2048,confidence,<praw.reddit.Reddit object at 0x7f2244aead90>,,infertility,"I just got back a bunch of test results from a new fertility clinic that were looking into possible causes of my two early miscarriages this year following IUIs.  It took me forever to find a place that cared about this and could do private blood tests to follow up on it.

They said my protein S levels were below the low limit and everything else they checked came back normal (and TSH magically went down from 2.9 a few weeks ago to 2.0 now, although totally different testing locations). But now there's some confusion because the doctor originally thought my last miscarriage was in February, and I just informed her that it was actually in early August, and she said this could have affected the protein S test result, because the value can go down during pregnancy.  So I probably need to get it retested again in my next cycle, when I will already have to decide to do IUI instead of IVF based on this result (I made the decision that if they actually found something obviously abnormal in my tests, I would do IUI again + recommended treatment; if nothing was found, I would ask to move forward with IVF). How long after pregnancy is long enough to test this and be sure that it's truly too low??

Does anyone else have any insights about protein S deficiency or been diagnosed with this? Did you have any symptoms in your daily life that were indicative, perhaps in retrospect, that you had a problem like this? The absolute only time I may have ever had a blood clot was when I was in my early 20s, once had my arm randomly blow up to double its normal size with fluid - it was truly scary looking and like that for weeks. The first doctor I saw freaked out and thought it was vasculitis.  She made me an emergency appointment with a vascular surgeon who was convinced it was a pinched vein that required surgery. I had a CAT scan, never heard from the vascular surgeon again, and the edema went down on its own shortly after the scan.  Anyway that's the only weird thing I've ever had that could in retrospect be related to this, other than having pretty clotty periods that became much more like liquid blood while taking baby aspirin. But I figured clots during menstruation is just normal?

On one hand I'm relieved that *something* abnormal was found and that it happens to be something completely treatable, even if it's taking daily heparin injections through my entire next pregnancy, should that be so fortunate to ever happen again.  But now I also have this big question mark of whether this is THE REASON for the two miscarriages. Ugh there's just no good place to be with this.",[],False,,0,False,"Protein S deficiency, anyone?",[],r/infertility,False,0,,0,,,False,t3_6zfgl8,False,dark,1.0,,public,3,0,{},,d70f54ce-930e-11e4-8710-22000b26873e,False,,False,False,,{},,False,3,,self,False,,{},,True,,1505166128.0,text,0,,,self.infertility,False,"<!-- SC_OFF --><div class=""md""><p>I just got back a bunch of test results from a new fertility clinic that were looking into possible causes of my two early miscarriages this year following IUIs.  It took me forever to find a place that cared about this and could do private blood tests to follow up on it.</p>

<p>They said my protein S levels were below the low limit and everything else they checked came back normal (and TSH magically went down from 2.9 a few weeks ago to 2.0 now, although totally different testing locations). But now there&#39;s some confusion because the doctor originally thought my last miscarriage was in February, and I just informed her that it was actually in early August, and she said this could have affected the protein S test result, because the value can go down during pregnancy.  So I probably need to get it retested again in my next cycle, when I will already have to decide to do IUI instead of IVF based on this result (I made the decision that if they actually found something obviously abnormal in my tests, I would do IUI again + recommended treatment; if nothing was found, I would ask to move forward with IVF). How long after pregnancy is long enough to test this and be sure that it&#39;s truly too low??</p>

<p>Does anyone else have any insights about protein S deficiency or been diagnosed with this? Did you have any symptoms in your daily life that were indicative, perhaps in retrospect, that you had a problem like this? The absolute only time I may have ever had a blood clot was when I was in my early 20s, once had my arm randomly blow up to double its normal size with fluid - it was truly scary looking and like that for weeks. The first doctor I saw freaked out and thought it was vasculitis.  She made me an emergency appointment with a vascular surgeon who was convinced it was a pinched vein that required surgery. I had a CAT scan, never heard from the vascular surgeon again, and the edema went down on its own shortly after the scan.  Anyway that&#39;s the only weird thing I&#39;ve ever had that could in retrospect be related to this, other than having pretty clotty periods that became much more like liquid blood while taking baby aspirin. But I figured clots during menstruation is just normal?</p>

<p>On one hand I&#39;m relieved that <em>something</em> abnormal was found and that it happens to be something completely treatable, even if it&#39;s taking daily heparin injections through my entire next pregnancy, should that be so fortunate to ever happen again.  But now I also have this big question mark of whether this is THE REASON for the two miscarriages. Ugh there&#39;s just no good place to be with this.</p>
</div><!-- SC_ON -->",,,,,True,False,False,False,False,[],[],False,False,False,False,"38, unexplained/thrombophilia, 4 IUI (MMC 12w, 8w), 1 IVF",[],False,,,,t5_2saej,,,,6zfgl8,True,,fertthrowaway,,5,False,no_ads,False,[],dark,/r/infertility/comments/6zfgl8/protein_s_deficiency_anyone/,no_ads,False,https://www.reddit.com/r/infertility/comments/6zfgl8/protein_s_deficiency_anyone/,25376,1505137328.0,0,,False,False,{},t2_m0e5b,False,[],text,False,,,
276,2048,confidence,<praw.reddit.Reddit object at 0x7f2244aead90>,,infertility,[deleted],[],False,,0,False,Monday ACTIVE Treatment Thread,[],r/infertility,False,0,,0,,,False,t3_6zfar5,False,dark,0.5,,public,0,0,{},,,False,,False,False,,{},,False,0,,default,False,,{},,True,,1505164271.0,text,0,,,self.infertility,True,"<!-- SC_OFF --><div class=""md""><p>[deleted]</p>
</div><!-- SC_ON -->",,,,,True,False,False,False,False,[],[],False,False,False,False,,[],False,,,,t5_2saej,,,,6zfar5,False,,,,192,True,no_ads,False,[],dark,/r/infertility/comments/6zfar5/monday_active_treatment_thread/,no_ads,False,https://www.reddit.com/r/infertility/comments/6zfar5/monday_active_treatment_thread/,25376,1505135471.0,0,,False,False,{},,,,,,,,
277,2048,confidence,<praw.reddit.Reddit object at 0x7f2244aead90>,,infertility,[deleted],[],False,,0,False,Monday Relationships Thread,[],r/infertility,False,0,,0,,,False,t3_6zfamr,False,dark,0.6,,public,1,0,{},,,False,,False,False,,{},,False,1,,default,False,,{},,True,,1505164224.0,text,0,,,self.infertility,False,"<!-- SC_OFF --><div class=""md""><p>[deleted]</p>
</div><!-- SC_ON -->",,,,,True,True,False,False,False,[],[],False,False,False,False,,[],False,,,,t5_2saej,,,,6zfamr,False,,,,9,True,no_ads,False,[],dark,/r/infertility/comments/6zfamr/monday_relationships_thread/,no_ads,False,https://www.reddit.com/r/infertility/comments/6zfamr/monday_relationships_thread/,25376,1505135424.0,0,,False,False,{},,,,,,,,
278,2048,confidence,<praw.reddit.Reddit object at 0x7f2244aead90>,,infertility,"Since my RE recommended we start with unmedicated IUI with donor sperm, I've been assuming that means everything is fine on my end of things. All signs point to normal, regular ovulation. Despite a mediocre, lower-end AMH level (1.3 I believe, from memory- it was tested about 9 months ago), the RE said he wasn't terribly concerned.  He said I had my age on my side and in his opinion, age trumps AMH. Now that we've decided to pursue IVF to try to use my husband's sperm, I have to go (this morning!) to get an antral follicle count. I just realized how fearful I am they're going to scan my ovaries and see very few eggs.  I just looked at a table online that suggests I have an AMH level of a 38-40 year old...!!?! Does that mean my eggs have the quality of a 38-40 year old?! Also, I was reading that the test is usually done on cycle day 3, but my doctor wanted to combine this test with a hydrosonogram so we're doing this on day 5.  So on top of worrying about no eggs or that they'll look somehow worse than if I was actually doing this on day 3, there's the possibility a uterine polyp has returned and that will stall things by a few months because the polyp will have to be removed.  STRESSING.    ETA: So I guess I either just sensed something was awry, or at this point just expect things to go wrong because they keep going wrong... The doctor thinks there are a couple polyps in my uterus which I have to have removed before IVF.  Seriously, again???!!  My OBGYN performed a hysteroscopy this past winter to remove what she thought was going to be multiple polyps and turned out to be one (which was removed).  I'm wondering if I actually grew additional polyps in the ensuing months, or if my uterus just looks lumpy during ultrasounds...  Either way, back to the surgical table for me, and more waiting before IVF.....  ",[],False,,0,False,going for ultrasound this morning,[],r/infertility,False,0,,0,,,False,t3_6zf3pl,False,dark,1.0,,public,1,0,{},,d70f54ce-930e-11e4-8710-22000b26873e,False,,False,False,,{},,False,1,,self,1505169061.0,,{},,True,,1505162177.0,text,0,,,self.infertility,False,"<!-- SC_OFF --><div class=""md""><p>Since my RE recommended we start with unmedicated IUI with donor sperm, I&#39;ve been assuming that means everything is fine on my end of things. All signs point to normal, regular ovulation. Despite a mediocre, lower-end AMH level (1.3 I believe, from memory- it was tested about 9 months ago), the RE said he wasn&#39;t terribly concerned.  He said I had my age on my side and in his opinion, age trumps AMH. Now that we&#39;ve decided to pursue IVF to try to use my husband&#39;s sperm, I have to go (this morning!) to get an antral follicle count. I just realized how fearful I am they&#39;re going to scan my ovaries and see very few eggs.  I just looked at a table online that suggests I have an AMH level of a 38-40 year old...!!?! Does that mean my eggs have the quality of a 38-40 year old?! Also, I was reading that the test is usually done on cycle day 3, but my doctor wanted to combine this test with a hydrosonogram so we&#39;re doing this on day 5.  So on top of worrying about no eggs or that they&#39;ll look somehow worse than if I was actually doing this on day 3, there&#39;s the possibility a uterine polyp has returned and that will stall things by a few months because the polyp will have to be removed.  STRESSING.    ETA: So I guess I either just sensed something was awry, or at this point just expect things to go wrong because they keep going wrong... The doctor thinks there are a couple polyps in my uterus which I have to have removed before IVF.  Seriously, again???!!  My OBGYN performed a hysteroscopy this past winter to remove what she thought was going to be multiple polyps and turned out to be one (which was removed).  I&#39;m wondering if I actually grew additional polyps in the ensuing months, or if my uterus just looks lumpy during ultrasounds...  Either way, back to the surgical table for me, and more waiting before IVF.....  </p>
</div><!-- SC_ON -->",,,,,True,True,False,False,False,[],[],False,False,False,False,35F. Lots of IVF. ,[],False,,,,t5_2saej,,,,6zf3pl,True,,chapterthirtythree,,11,True,no_ads,False,[],dark,/r/infertility/comments/6zf3pl/going_for_ultrasound_this_morning/,no_ads,False,https://www.reddit.com/r/infertility/comments/6zf3pl/going_for_ultrasound_this_morning/,25376,1505133377.0,0,,False,False,{},t2_ixz2t6,False,[],text,False,,,
279,2048,confidence,<praw.reddit.Reddit object at 0x7f2244aead90>,,infertility,"Use this thread to share anything not necessarily related to infertility. Rant or rave, bitch, moan, share something funny, anything goes!",[],False,,0,False,Monday Off Topic Thread,[],r/infertility,False,0,,0,,,False,t3_6zegvj,False,dark,0.75,,public,2,0,{},,,False,,False,False,,{},,False,2,,self,False,,{},,True,,1505153397.0,text,0,,,self.infertility,False,"<!-- SC_OFF --><div class=""md""><p>Use this thread to share anything not necessarily related to infertility. Rant or rave, bitch, moan, share something funny, anything goes!</p>
</div><!-- SC_ON -->",,,,,True,False,False,False,False,[],[],False,False,False,False,,[],False,,,moderator,t5_2saej,,,,6zegvj,True,,AutoModerator,,81,False,no_ads,False,[],,/r/infertility/comments/6zegvj/monday_off_topic_thread/,no_ads,False,https://www.reddit.com/r/infertility/comments/6zegvj/monday_off_topic_thread/,25376,1505124597.0,0,,False,False,{},t2_6l4z3,True,[],text,False,,,
280,2048,confidence,<praw.reddit.Reddit object at 0x7f2244aead90>,,infertility,[removed],[],False,,0,False,Re-Live Your Hope to Become a Parent by HUCOG Medication,[],r/infertility,False,0,,0,,,False,t3_6zec59,False,dark,1.0,,public,1,0,{},,,False,,False,False,,{},,False,1,,default,False,,{},,True,,1505151196.0,text,0,,,self.infertility,False,"<!-- SC_OFF --><div class=""md""><p>[removed]</p>
</div><!-- SC_ON -->",,,,,True,True,False,False,False,[],[],False,False,False,False,,[],False,,,,t5_2saej,,,,6zec59,False,,bestchemiststore,,0,True,no_ads,False,[],,/r/infertility/comments/6zec59/relive_your_hope_to_become_a_parent_by_hucog/,no_ads,False,https://www.reddit.com/r/infertility/comments/6zec59/relive_your_hope_to_become_a_parent_by_hucog/,25376,1505122396.0,0,,False,False,{},t2_uefp9,False,[],text,False,,,
281,2048,confidence,<praw.reddit.Reddit object at 0x7f2244aead90>,,infertility,"So, you got a positive beta, but you aren't ready to move over to IFbabies yet? Or maybe your betas aren't rising like you were hoping?  This is a safe space for post positive beta discussions, beta hell, beta limbo, or early IF pregnancy concerns. **Note that pregnancy results should be posted in the weekly results thread.** This can be found on the main page or linked in the sticky ""Read This"" post.
",[],False,,0,False,"Weekly Post-Beta/Beta-hell Discussion - September 11, 2017",[],r/infertility,False,0,,0,,,False,t3_6ze8ye,False,dark,0.83,,public,4,0,{},,,False,,False,False,,{},,False,4,,self,False,,{},,True,,1505149721.0,text,0,,,self.infertility,False,"<!-- SC_OFF --><div class=""md""><p>So, you got a positive beta, but you aren&#39;t ready to move over to IFbabies yet? Or maybe your betas aren&#39;t rising like you were hoping?  This is a safe space for post positive beta discussions, beta hell, beta limbo, or early IF pregnancy concerns. <strong>Note that pregnancy results should be posted in the weekly results thread.</strong> This can be found on the main page or linked in the sticky &quot;Read This&quot; post.</p>
</div><!-- SC_ON -->",,,,,True,False,False,False,False,[],[],False,False,False,False,,[],False,,,moderator,t5_2saej,,,,6ze8ye,True,,AutoModerator,,49,False,no_ads,False,[],,/r/infertility/comments/6ze8ye/weekly_postbetabetahell_discussion_september_11/,no_ads,False,https://www.reddit.com/r/infertility/comments/6ze8ye/weekly_postbetabetahell_discussion_september_11/,25376,1505120921.0,0,,False,False,{},t2_6l4z3,True,[],text,False,,,
282,2048,confidence,<praw.reddit.Reddit object at 0x7f2244aead90>,,infertility,[deleted],[],False,,0,False,I Ovulate,[],r/infertility,False,0,,0,,,False,t3_6zct90,False,dark,0.56,,public,1,0,{},,,False,,False,False,,{},,False,1,,default,False,,{},,True,,1505127758.0,text,0,,,self.infertility,True,"<!-- SC_OFF --><div class=""md""><p>[deleted]</p>
</div><!-- SC_ON -->",,,,,True,True,False,False,False,[],[],False,False,False,False,,[],False,,,,t5_2saej,,,,6zct90,False,,,,2,True,no_ads,False,[],dark,/r/infertility/comments/6zct90/i_ovulate/,no_ads,False,https://www.reddit.com/r/infertility/comments/6zct90/i_ovulate/,25376,1505098958.0,0,,False,False,{},,,,,,,,
