77,2048,confidence,<praw.reddit.Reddit object at 0x7f2244aead90>,,infertility,"After a long month of waiting, my RE just called with results from my ERA/Receptiva biopsies. Apparently my diva uterus is an even bigger diva than I thought. We're talking Beyonce level here.

ERA (2nd biopsy):
My first result indicated that I was post-receptive at Day 5. My second result just came back as pre-receptive at Day 4. So it looks like I have a very narrow window of implantation that is somewhere in between the two. I know there are a few other ladies on this board who have had this kind of result. My RE said I'm his first patient he's had to give this result to, hooray! I have to say, it really doesn't feel very good to be this special.

Receptiva (1st time doing this)
My BCL-6 marker came back normal but beta-3 integrin came back absent and endometrium ""out of phase."" There were some other wonky results in there that he can't make sense of and is waiting to get the test makers on the phone, but they haven't called him back. He didn't make any interpretations for me yet, but based on the info they put on their website, I'm guessing I don't have endo, but I obviously wasn't receptive at the time of biopsy (per the ERA results).

Next steps: He recommended that I repeat the ERA yet again and this time they will do it at exactly 4.5 days of progesterone. After enduring 5 IVF cycles, he wants us to have the confidence of getting a ""receptive"" result before transferring anything else. No recommendation yet about what to do regarding the Receptiva results.

This means another few months of being in mock cycle/biopsy hell, not to mention living longer in this limbo of confusing uterine results. I know there are others out there who are in biopsy purgatory, and I just want to say: I feel your pain.

In better news, it is Friday and this means I can drink all the wine tonight. Strangely, my husband and I are sort of relieved at getting to postpone our next FET as we seriously have PTSD from our previous failures. But I am also really worried that I am getting hella old, and my picky-ass uterus is just not up to the job. :(",[],False,,0,False,2nd ERA Results / Receptiva Semi-Results,[],r/infertility,False,0,,0,,,False,t3_71uegw,False,dark,1.0,,public,7,0,{},,,False,,False,False,,{},,False,7,,self,False,,{},,True,,1506147261.0,text,0,,,self.infertility,True,"<!-- SC_OFF --><div class=""md""><p>After a long month of waiting, my RE just called with results from my ERA/Receptiva biopsies. Apparently my diva uterus is an even bigger diva than I thought. We&#39;re talking Beyonce level here.</p>

<p>ERA (2nd biopsy):
My first result indicated that I was post-receptive at Day 5. My second result just came back as pre-receptive at Day 4. So it looks like I have a very narrow window of implantation that is somewhere in between the two. I know there are a few other ladies on this board who have had this kind of result. My RE said I&#39;m his first patient he&#39;s had to give this result to, hooray! I have to say, it really doesn&#39;t feel very good to be this special.</p>

<p>Receptiva (1st time doing this)
My BCL-6 marker came back normal but beta-3 integrin came back absent and endometrium &quot;out of phase.&quot; There were some other wonky results in there that he can&#39;t make sense of and is waiting to get the test makers on the phone, but they haven&#39;t called him back. He didn&#39;t make any interpretations for me yet, but based on the info they put on their website, I&#39;m guessing I don&#39;t have endo, but I obviously wasn&#39;t receptive at the time of biopsy (per the ERA results).</p>

<p>Next steps: He recommended that I repeat the ERA yet again and this time they will do it at exactly 4.5 days of progesterone. After enduring 5 IVF cycles, he wants us to have the confidence of getting a &quot;receptive&quot; result before transferring anything else. No recommendation yet about what to do regarding the Receptiva results.</p>

<p>This means another few months of being in mock cycle/biopsy hell, not to mention living longer in this limbo of confusing uterine results. I know there are others out there who are in biopsy purgatory, and I just want to say: I feel your pain.</p>

<p>In better news, it is Friday and this means I can drink all the wine tonight. Strangely, my husband and I are sort of relieved at getting to postpone our next FET as we seriously have PTSD from our previous failures. But I am also really worried that I am getting hella old, and my picky-ass uterus is just not up to the job. :(</p>
</div><!-- SC_ON -->",,,,,True,False,False,False,False,[],[],False,False,False,False,,[],False,,,,t5_2saej,,,,71uegw,True,,,,22,True,no_ads,False,[],dark,/r/infertility/comments/71uegw/2nd_era_results_receptiva_semiresults/,no_ads,False,https://www.reddit.com/r/infertility/comments/71uegw/2nd_era_results_receptiva_semiresults/,25376,1506118461.0,0,,False,False,{},,,,,,,,
78,2048,confidence,<praw.reddit.Reddit object at 0x7f2244aead90>,,infertility,What was good this week? What was bad?,[],False,,0,False,Pros and Cons,[],r/infertility,False,0,,0,,,False,t3_71ucvy,False,dark,1.0,,public,1,0,{},,,False,,False,False,,{},,False,1,,self,False,,{},,True,,1506146830.0,text,0,,,self.infertility,False,"<!-- SC_OFF --><div class=""md""><p>What was good this week? What was bad?</p>
</div><!-- SC_ON -->",,,,,True,True,False,False,False,[],[],False,False,False,False,,[],False,,,moderator,t5_2saej,,,,71ucvy,True,,AutoModerator,,3,False,no_ads,False,[],,/r/infertility/comments/71ucvy/pros_and_cons/,no_ads,False,https://www.reddit.com/r/infertility/comments/71ucvy/pros_and_cons/,25376,1506118030.0,0,,False,False,{},t2_6l4z3,True,[],text,False,,,
79,2048,confidence,<praw.reddit.Reddit object at 0x7f2244aead90>,,infertility,"Hey guys —

My last FET cycle was cancelled due to inadequate (and shrinking?) endometrial lining. The doctor hypothesizes that my body stopped “liking” the synthetic estrogen after an extended period and the lining began to collapse as a result. My lining just barely got to 8mm for my FET cycle (and began to shrink thereafter), but my IVF retrieval cycle got my lining to 10mm. Thus, she thinks my body will respond better to my own estrogen, so I’ll be doing a mix of Gonal-F, Lupron, supplemental estrogen (in patch, cream, gel, and pill form), and vaginal viagra (to increase blood flow). 

Anyways, she said that she recommends that I do a GCSF wash, as well, so I was wondering if any of you have tried this. There aren’t a ton of studies out there, and the studies have small samples, so I just wanted to corroborate the information in the studies with perhaps some anecdotal experience. 

Thanks! ",[],False,,0,False,GCSF Wash Experience?,[],r/infertility,False,0,,0,,,False,t3_71u795,False,dark,1.0,,public,1,0,{},,,False,,False,False,,{},IVF,False,1,,self,1508790802.0,,{},,True,,1506145235.0,text,0,,,self.infertility,False,"<!-- SC_OFF --><div class=""md""><p>Hey guys —</p>

<p>My last FET cycle was cancelled due to inadequate (and shrinking?) endometrial lining. The doctor hypothesizes that my body stopped “liking” the synthetic estrogen after an extended period and the lining began to collapse as a result. My lining just barely got to 8mm for my FET cycle (and began to shrink thereafter), but my IVF retrieval cycle got my lining to 10mm. Thus, she thinks my body will respond better to my own estrogen, so I’ll be doing a mix of Gonal-F, Lupron, supplemental estrogen (in patch, cream, gel, and pill form), and vaginal viagra (to increase blood flow). </p>

<p>Anyways, she said that she recommends that I do a GCSF wash, as well, so I was wondering if any of you have tried this. There aren’t a ton of studies out there, and the studies have small samples, so I just wanted to corroborate the information in the studies with perhaps some anecdotal experience. </p>

<p>Thanks! </p>
</div><!-- SC_ON -->",,,,,True,True,False,False,False,[],[],False,False,False,False,"Unexplained, 4 Failed IUIs, IVF#1",[],False,,,,t5_2saej,,,,71u795,True,,LynsanityH,,5,True,no_ads,False,[],dark,/r/infertility/comments/71u795/gcsf_wash_experience/,no_ads,False,https://www.reddit.com/r/infertility/comments/71u795/gcsf_wash_experience/,25376,1506116435.0,0,,False,False,{},t2_hk4ok,False,[],text,False,,,
80,2048,confidence,<praw.reddit.Reddit object at 0x7f2244aead90>,,infertility,[removed],[],False,,0,False,I think I have to make a decision about my husband (not sure if this is the place to post),[],r/infertility,False,0,,0,,,False,t3_71u3jp,False,dark,1.0,,public,1,0,{},,,False,,False,False,,{},,False,1,,default,False,,{},,True,,1506144234.0,text,0,,,self.infertility,False,"<!-- SC_OFF --><div class=""md""><p>[removed]</p>
</div><!-- SC_ON -->",,,,,True,True,False,False,False,[],[],False,False,False,False,,[],False,,,,t5_2saej,,,,71u3jp,False,,,,1,True,no_ads,False,[],dark,/r/infertility/comments/71u3jp/i_think_i_have_to_make_a_decision_about_my/,no_ads,False,https://www.reddit.com/r/infertility/comments/71u3jp/i_think_i_have_to_make_a_decision_about_my/,25376,1506115434.0,0,,False,False,{},,,,,,,,
81,2048,confidence,<praw.reddit.Reddit object at 0x7f2244aead90>,,infertility,"Use this thread to share anything not necessarily related to infertility. Rant or rave, bitch, moan, share something funny, anything goes!
",[],False,,0,False,Friday Afternoon Off Topic Thread,[],r/infertility,False,0,,0,,,False,t3_71t05d,False,dark,1.0,,public,2,0,{},,,False,,False,False,,{},,False,2,,self,False,,{},,True,,1506134146.0,text,0,,,self.infertility,False,"<!-- SC_OFF --><div class=""md""><p>Use this thread to share anything not necessarily related to infertility. Rant or rave, bitch, moan, share something funny, anything goes!</p>
</div><!-- SC_ON -->",,,,,True,False,False,False,False,[],[],False,False,False,False,,[],False,,,moderator,t5_2saej,,,,71t05d,True,,AutoModerator,,151,False,no_ads,False,[],,/r/infertility/comments/71t05d/friday_afternoon_off_topic_thread/,no_ads,False,https://www.reddit.com/r/infertility/comments/71t05d/friday_afternoon_off_topic_thread/,25376,1506105346.0,0,,False,False,{},t2_6l4z3,True,[],text,False,,,
82,2048,confidence,<praw.reddit.Reddit object at 0x7f2244aead90>,,infertility,[deleted],[],False,,0,False,Advice on first steps,[],r/infertility,False,0,,0,,,False,t3_71scl5,False,dark,0.6,,public,1,0,{},,,False,,False,False,,{},,False,1,,default,1506101749.0,,{},,True,,1506128551.0,text,0,,,self.infertility,False,"<!-- SC_OFF --><div class=""md""><p>[deleted]</p>
</div><!-- SC_ON -->",,,,,True,True,False,False,False,[],[],False,False,False,False,,[],False,,,,t5_2saej,,,,71scl5,False,,,,6,True,no_ads,False,[],dark,/r/infertility/comments/71scl5/advice_on_first_steps/,no_ads,False,https://www.reddit.com/r/infertility/comments/71scl5/advice_on_first_steps/,25376,1506099751.0,0,,False,False,{},,,,,,,,
83,2048,confidence,<praw.reddit.Reddit object at 0x7f2244aead90>,,infertility,"Hi everyone, I've been reading posts off and on here for several months, but have never actually posted.  This community has provided me with comfort though, knowing there are others that can completely relate to me.  I am not ""out"" to most people in my personal life, and the few that I am out to are extremely supportive, but have not had the same experiences.  

My husband and I have been trying to conceive officially for 4 years, but have not used any sort of birth control for 5.  I have a history of cancer and became involved in a longitudinal research study about 9 years ago comparing (theoretical) fertility of women with a cancer history vs. those without it.  So I've been having follicles measured and AMH, FSH, etc. tested for a long time.  Everything has always been fine.  I've also had normal periods since age 11, even during chemotherapy.  The doctor who conducted the study is also my RE, so I've been seeing her for a long time and she knows me well.  
I had an HSG in 2014 which showed a cyst blocking one of my tubes (other one was fine).  So I had surgery to remove that.  There were still no positive pregnancy tests, my husband got tested and had good motility, but slightly low sperm count.  We tried for a while after that with clomid, and then went to IUI in 2016.  We did three IUIs which all failed.  
In December 2016 we decided to move onto IVF (I was very resistant to this, as I know someone IRL who did years of retrievals/transfers and was a basket case of course).  Stimulation went really well, I produced 19 eggs, 18 fertilized with ICSI and we ended up with 11 5 day blasts.  Literally in the recovery room after retrieval we got a call from my MIL (who only knows we haven't been able to conceive, but no details) who fell and broke both arms and had to come stay with us for several weeks. Because of course.  Our cat also got very sick and needed surgery around the same time because life is crazy.  We did a fresh transfer which resulted in a positive beta, but was low.  It dropped after two days.  We then did a FET in April which resulted in a good positive beta, but betas did not rise as they should have, and they could not find anything on the ultrasound at 6 weeks.  I was scheduled for a D&E but started bleeding the day of the procedure.  In August we decided to transfer 2 hoping that one would take.  I got a good positive beta that was increasing as it should.  1 embryo implanted and I had a missed miscarriage at 8 weeks 5 days.  I had a D&E Wednesday, and now I'm just so sad. 
I'm feeling my age, regretting not going immediately to IVF, not getting embryos tested, etc.  
Anyway, I just wanted to say hi and I'm sorry we all have to be here.  ",[],False,,0,False,Introduction,[],r/infertility,False,0,,0,,,False,t3_71rfag,False,dark,0.93,,public,14,0,{},,,False,,False,False,,{},,False,14,,self,False,,{},,True,,1506120201.0,text,0,,,self.infertility,False,"<!-- SC_OFF --><div class=""md""><p>Hi everyone, I&#39;ve been reading posts off and on here for several months, but have never actually posted.  This community has provided me with comfort though, knowing there are others that can completely relate to me.  I am not &quot;out&quot; to most people in my personal life, and the few that I am out to are extremely supportive, but have not had the same experiences.  </p>

<p>My husband and I have been trying to conceive officially for 4 years, but have not used any sort of birth control for 5.  I have a history of cancer and became involved in a longitudinal research study about 9 years ago comparing (theoretical) fertility of women with a cancer history vs. those without it.  So I&#39;ve been having follicles measured and AMH, FSH, etc. tested for a long time.  Everything has always been fine.  I&#39;ve also had normal periods since age 11, even during chemotherapy.  The doctor who conducted the study is also my RE, so I&#39;ve been seeing her for a long time and she knows me well.<br/>
I had an HSG in 2014 which showed a cyst blocking one of my tubes (other one was fine).  So I had surgery to remove that.  There were still no positive pregnancy tests, my husband got tested and had good motility, but slightly low sperm count.  We tried for a while after that with clomid, and then went to IUI in 2016.  We did three IUIs which all failed.<br/>
In December 2016 we decided to move onto IVF (I was very resistant to this, as I know someone IRL who did years of retrievals/transfers and was a basket case of course).  Stimulation went really well, I produced 19 eggs, 18 fertilized with ICSI and we ended up with 11 5 day blasts.  Literally in the recovery room after retrieval we got a call from my MIL (who only knows we haven&#39;t been able to conceive, but no details) who fell and broke both arms and had to come stay with us for several weeks. Because of course.  Our cat also got very sick and needed surgery around the same time because life is crazy.  We did a fresh transfer which resulted in a positive beta, but was low.  It dropped after two days.  We then did a FET in April which resulted in a good positive beta, but betas did not rise as they should have, and they could not find anything on the ultrasound at 6 weeks.  I was scheduled for a D&amp;E but started bleeding the day of the procedure.  In August we decided to transfer 2 hoping that one would take.  I got a good positive beta that was increasing as it should.  1 embryo implanted and I had a missed miscarriage at 8 weeks 5 days.  I had a D&amp;E Wednesday, and now I&#39;m just so sad. 
I&#39;m feeling my age, regretting not going immediately to IVF, not getting embryos tested, etc.<br/>
Anyway, I just wanted to say hi and I&#39;m sorry we all have to be here.  </p>
</div><!-- SC_ON -->",,,,,True,False,False,False,False,[],[],False,False,False,False,"35, unexplained, 3 IUIs, IVF, 1 fresh, 2 FETS",[],False,,,,t5_2saej,,,,71rfag,True,,another_humanist,,16,True,no_ads,False,[],dark,/r/infertility/comments/71rfag/introduction/,no_ads,False,https://www.reddit.com/r/infertility/comments/71rfag/introduction/,25376,1506091401.0,0,,False,False,{},t2_6rg5g,False,[],text,False,,,
84,2048,confidence,<praw.reddit.Reddit object at 0x7f2244aead90>,,infertility,"I am scheduled for a FET next Wednesday, and my fertility clinic is offering a few new things since I last was there (a lipids infusion, Prograf, and an Hcg ""wash"" -uterine injection). Is this something that other clinics are offering? I've become a little skeptical that they are not as beneficial as the clinic is suggesting. Have any of you tried these things? I've mostly made up my mind about skipping the lipid infusion and taking the prograf, but I haven't decided on the Hcg wash, any thoughts?",[],False,,0,False,"Hcg ""wash"" pre FET?",[],r/infertility,False,0,,0,,,False,t3_71rcm8,False,dark,1.0,,public,2,0,{},,,False,,False,False,,{},,False,2,,self,False,,{},,True,,1506119488.0,text,0,,,self.infertility,False,"<!-- SC_OFF --><div class=""md""><p>I am scheduled for a FET next Wednesday, and my fertility clinic is offering a few new things since I last was there (a lipids infusion, Prograf, and an Hcg &quot;wash&quot; -uterine injection). Is this something that other clinics are offering? I&#39;ve become a little skeptical that they are not as beneficial as the clinic is suggesting. Have any of you tried these things? I&#39;ve mostly made up my mind about skipping the lipid infusion and taking the prograf, but I haven&#39;t decided on the Hcg wash, any thoughts?</p>
</div><!-- SC_ON -->",,,,,True,False,False,False,False,[],[],False,False,False,False,,[],False,,,,t5_2saej,,,,71rcm8,True,,Foxyliu23,,5,True,no_ads,False,[],,/r/infertility/comments/71rcm8/hcg_wash_pre_fet/,no_ads,False,https://www.reddit.com/r/infertility/comments/71rcm8/hcg_wash_pre_fet/,25376,1506090688.0,0,,False,False,{},t2_fq9qp,False,[],text,False,,,
85,2048,confidence,<praw.reddit.Reddit object at 0x7f2244aead90>,,infertility,"Hi everyone, I just started lurking and commenting but I'm finally ready to introduce myself. Married for 5 years and had decided to start trying -- we kind of knew that there might be issues because my husband does not produce any semen when he ejaculates... like maybe one drop. We knew it would probably be an issue but we kind of decided to ignore the problem until we were ready. When we decided it was time I started doing my research and realized that it was actually going to be an issue to only have 1 drop of semen. I asked him to make an appointment with his primary care physician to get referred to a urologist. Urologist told us he couldn't do anything and that we should probably contact an infertility specialist. 

Here's where things get interesting....all of these doctors appointments and tests ect take SO LONG. I'm getting my Ph.D. in molecular biology so we decided to do some ""experiments"" in the meantime. Retrograde is when the semen goes back into the bladder instead of coming out like it's supposed to...I suspected that this was my husband's problem since he had cancer as a baby with abdominal surgery which often causes nerve damage leading to retrograde. So we went to my lab, had him ejaculate in the bathroom and then I had him pee into a cup and we looked at it under a microscope. ANDDD...there were sperm!! We did a happy dance. The sperm were in the urine, and dead :( but they were there! 

Since then, I've bought a microscope, centrifuge, pH test strips, salinity meter etc. My hope is that I can figure out how to keep the most sperm alive in the urine so that we can use them for artificial insemination, IUI or IVF. I've been working on a protocol to keep them alive and I have gotten to the point where I can see 1-2 moving/living sperm still alive even after being in the urine. 

In January, I am able to get added to my husband's insurance which covers some infertility treatment but until then I'm just optimizing this protocol, doing some artificial inseminations with the sperm I've extracted from the urine and doing testing go get ready to start fertility treatments (HSG and official SA in a few weeks). 

We haven't told anyone else what is going on yet and I'm already struggling emotionally with feeling like things are unfair and being annoyed that we are literally SO CLOSE. The sperm are there and there are lots of them but they just instantly die in the vat of toxic acid in my husband's bladder. 

I know we have a lot to be thankful for and it is still early so I'm optimistic but I'm already feeling like cutting ties with some friends who are expecting and are totally driving me nut and insensitive because I haven't told them that it's going to be a struggle for us. 

Sorry this is really long! But hello! 

",[],False,,0,False,"Saying hello -- mfi, retrograde ejaculation",[],r/infertility,False,0,,0,,,False,t3_71qkyi,False,dark,0.9,,public,16,0,{},,d70f54ce-930e-11e4-8710-22000b26873e,False,,False,False,,{},,False,16,,self,False,,{},,True,,1506111178.0,text,0,,,self.infertility,False,"<!-- SC_OFF --><div class=""md""><p>Hi everyone, I just started lurking and commenting but I&#39;m finally ready to introduce myself. Married for 5 years and had decided to start trying -- we kind of knew that there might be issues because my husband does not produce any semen when he ejaculates... like maybe one drop. We knew it would probably be an issue but we kind of decided to ignore the problem until we were ready. When we decided it was time I started doing my research and realized that it was actually going to be an issue to only have 1 drop of semen. I asked him to make an appointment with his primary care physician to get referred to a urologist. Urologist told us he couldn&#39;t do anything and that we should probably contact an infertility specialist. </p>

<p>Here&#39;s where things get interesting....all of these doctors appointments and tests ect take SO LONG. I&#39;m getting my Ph.D. in molecular biology so we decided to do some &quot;experiments&quot; in the meantime. Retrograde is when the semen goes back into the bladder instead of coming out like it&#39;s supposed to...I suspected that this was my husband&#39;s problem since he had cancer as a baby with abdominal surgery which often causes nerve damage leading to retrograde. So we went to my lab, had him ejaculate in the bathroom and then I had him pee into a cup and we looked at it under a microscope. ANDDD...there were sperm!! We did a happy dance. The sperm were in the urine, and dead :( but they were there! </p>

<p>Since then, I&#39;ve bought a microscope, centrifuge, pH test strips, salinity meter etc. My hope is that I can figure out how to keep the most sperm alive in the urine so that we can use them for artificial insemination, IUI or IVF. I&#39;ve been working on a protocol to keep them alive and I have gotten to the point where I can see 1-2 moving/living sperm still alive even after being in the urine. </p>

<p>In January, I am able to get added to my husband&#39;s insurance which covers some infertility treatment but until then I&#39;m just optimizing this protocol, doing some artificial inseminations with the sperm I&#39;ve extracted from the urine and doing testing go get ready to start fertility treatments (HSG and official SA in a few weeks). </p>

<p>We haven&#39;t told anyone else what is going on yet and I&#39;m already struggling emotionally with feeling like things are unfair and being annoyed that we are literally SO CLOSE. The sperm are there and there are lots of them but they just instantly die in the vat of toxic acid in my husband&#39;s bladder. </p>

<p>I know we have a lot to be thankful for and it is still early so I&#39;m optimistic but I&#39;m already feeling like cutting ties with some friends who are expecting and are totally driving me nut and insensitive because I haven&#39;t told them that it&#39;s going to be a struggle for us. </p>

<p>Sorry this is really long! But hello! </p>
</div><!-- SC_ON -->",,,,,True,False,False,False,False,[],[],False,False,False,False,28F. MFI |IVF/TESA| FET #3 ,[],False,,,,t5_2saej,,,,71qkyi,True,,sweetpea202,,26,True,no_ads,False,[],dark,/r/infertility/comments/71qkyi/saying_hello_mfi_retrograde_ejaculation/,no_ads,False,https://www.reddit.com/r/infertility/comments/71qkyi/saying_hello_mfi_retrograde_ejaculation/,25376,1506082378.0,0,,False,False,{},t2_box7b,False,[],text,False,,,
