,comment_limit,comment_sort,_reddit,approved_at_utc,subreddit,selftext,user_reports,saved,mod_reason_title,gilded,clicked,title,link_flair_richtext,subreddit_name_prefixed,hidden,pwls,link_flair_css_class,downs,thumbnail_height,top_awarded_type,hide_score,name,quarantine,link_flair_text_color,upvote_ratio,author_flair_background_color,subreddit_type,ups,total_awards_received,media_embed,thumbnail_width,author_flair_template_id,is_original_content,secure_media,is_reddit_media_domain,is_meta,category,secure_media_embed,link_flair_text,can_mod_post,score,approved_by,thumbnail,edited,author_flair_css_class,gildings,content_categories,is_self,mod_note,created,link_flair_type,wls,removed_by_category,banned_by,domain,allow_live_comments,selftext_html,likes,suggested_sort,banned_at_utc,view_count,archived,no_follow,is_crosspostable,pinned,over_18,all_awardings,awarders,media_only,can_gild,spoiler,locked,author_flair_text,treatment_tags,visited,removed_by,num_reports,distinguished,subreddit_id,mod_reason_by,removal_reason,link_flair_background_color,id,is_robot_indexable,report_reasons,author,discussion_type,num_comments,send_replies,whitelist_status,contest_mode,mod_reports,author_flair_text_color,permalink,parent_whitelist_status,stickied,url,subreddit_subscribers,created_utc,num_crossposts,media,is_video,_fetched,_comments_by_id,author_fullname,author_premium,author_flair_richtext,author_flair_type,author_patreon_flair,post_hint,preview,author_cakeday
0,2048,confidence,<praw.reddit.Reddit object at 0x7f2244aead90>,,infertility,[deleted],[],False,,0,False,Shout out to all my IF teammates!!,[],r/infertility,False,0,,0,,,False,t3_72pvbb,False,dark,0.9,,public,23,0,{},,,False,,False,False,,{},,False,23,,default,False,,{},,True,,1506513899.0,text,0,deleted,,self.infertility,False,"<!-- SC_OFF --><div class=""md""><p>[deleted]</p>
</div><!-- SC_ON -->",,,,,True,False,False,False,False,[],[],False,False,False,False,,[],False,,,,t5_2saej,,,,72pvbb,False,,,,2,True,no_ads,False,[],dark,/r/infertility/comments/72pvbb/shout_out_to_all_my_if_teammates/,no_ads,False,https://www.reddit.com/r/infertility/comments/72pvbb/shout_out_to_all_my_if_teammates/,25376,1506485099.0,0,,False,False,{},,,,,,,,
1,2048,confidence,<praw.reddit.Reddit object at 0x7f2244aead90>,,infertility,"Hi. I’m new here.  I’m 39 - almost 40.  I was on the pill for approximately 17 years and went off it in December 2016 as my partner and I were ready to start trying.  I had a withdrawal bleed on January 1 of this year but nothing since.  I would feel pain/cramps on either side of my abdomen during what I thought was ovulation every month.  The first few months were abnormally painful.  And I would get cramps two weeks later - I always felt like a period was coming but it never did.  I finally went to my doctor in early April.  He did blood work which he said was normal and did an ultrasound, which showed a dominant follicle.  He told me to wait and see.  I went back in late June for a follow-up.  This was the first time my hormone levels were tested. 

Results: FSH - 55.  Estriadol - 148.  Progesterone - 0.3. Testosterone- 0.76.  LH - 46.5.

My family doctor had no idea what any of this meant and sent me to a specialist clinic.

I saw the OB/specialist in early August.  For some reason my hormone test results never made it to my file.  I told her that my FSH was 55.  She told me then - without taking a second test, without doing a day 3 test, without even seeing the results - that I had POF and that I should go to a fertility doctor and look into donor eggs.  This was my first fucking appointment and I had no idea what was going on and this is what was put on me in the first 30 minutes.  She wrote me a prescription for HRT and that was it.  They took further blood tests, but she told me not to expect anything to change.  

I haven’t started the HRT because I’m not ready and partially because the first specialist told me that the estrogen would swell me up and I have a wedding to go to and I want to look good in my dress.  If my life is shit I at least want to look pretty.

I booked an appointment with a naturopath after this.  She recommended a whole lot of vitamins and some TCM herbs, which I have been taking since mid-August. 

I went back to the OB last week and half of my test results from the early August appointment had gone missing so they had to redo them.  So I had blood work done last Monday.

I got a call from the OB on Thursday saying that the results were in and that my FSH was 7.9 and that my estrogen was ok.  I was shocked, but happy.  And then on Friday my period came back!  It felt so good.  I felt like a woman again.  She also mentioned that my thyroid levels were off and that they wanted me to see an Endocrinologist.

They called me back in to the OB today.  I mentioned to the intake person/resident that I had seen the naturopath and had I had been taking the TCM herbs.  The resident, my OB and an Endo then came into the room and basically lectured me about going to a naturopath and taking herbs, told me that my period is fake and that the herbs might give me cancer and that they skewed the last blood results.  I felt like I was a kid being lectured for doing something wrong.  They want me to stop the herbs and come back again in a few weeks for a re-test.  They said that my estrogen was at an unhealthy high level.

I hate all of this. I hate being on an emotional roller coaster. I hate the way all of this makes me feel.  I wasn’t ready to have kids before now.  I finally found someone who I want to do this with and I’m being told that it can’t happen and I don’t understand.  Why do I still get cramps every month but no period?  No one will explain that.  Why did I get “ovulation” cramps every month if I wasn’t ovulating?  I don’t like my doctors.  But they are supposed to be the best in the city and the only place that specializes in POF.  I feel like they don’t listen.  They don’t explain.  The herbs are the only thing that has changed anything for me.

I don’t have anyone around who understands.  My partner thinks that the specialists are just brushing off eastern medicine. He just thinks that everything will work itself out.  My best friend has a toddler and I can barely talk to her because I’m so jealous.  I just need some help.  

Sorry if none of this makes any sense or if it’s too long or I’m too sad.  



",[],False,,0,False,New. And not okay.,[],r/infertility,False,0,,0,,,False,t3_72p3x9,False,dark,0.99,,public,10,0,{},,,False,,False,False,,{},,False,10,,self,False,,{},,True,,1506505214.0,text,0,,,self.infertility,False,"<!-- SC_OFF --><div class=""md""><p>Hi. I’m new here.  I’m 39 - almost 40.  I was on the pill for approximately 17 years and went off it in December 2016 as my partner and I were ready to start trying.  I had a withdrawal bleed on January 1 of this year but nothing since.  I would feel pain/cramps on either side of my abdomen during what I thought was ovulation every month.  The first few months were abnormally painful.  And I would get cramps two weeks later - I always felt like a period was coming but it never did.  I finally went to my doctor in early April.  He did blood work which he said was normal and did an ultrasound, which showed a dominant follicle.  He told me to wait and see.  I went back in late June for a follow-up.  This was the first time my hormone levels were tested. </p>

<p>Results: FSH - 55.  Estriadol - 148.  Progesterone - 0.3. Testosterone- 0.76.  LH - 46.5.</p>

<p>My family doctor had no idea what any of this meant and sent me to a specialist clinic.</p>

<p>I saw the OB/specialist in early August.  For some reason my hormone test results never made it to my file.  I told her that my FSH was 55.  She told me then - without taking a second test, without doing a day 3 test, without even seeing the results - that I had POF and that I should go to a fertility doctor and look into donor eggs.  This was my first fucking appointment and I had no idea what was going on and this is what was put on me in the first 30 minutes.  She wrote me a prescription for HRT and that was it.  They took further blood tests, but she told me not to expect anything to change.  </p>

<p>I haven’t started the HRT because I’m not ready and partially because the first specialist told me that the estrogen would swell me up and I have a wedding to go to and I want to look good in my dress.  If my life is shit I at least want to look pretty.</p>

<p>I booked an appointment with a naturopath after this.  She recommended a whole lot of vitamins and some TCM herbs, which I have been taking since mid-August. </p>

<p>I went back to the OB last week and half of my test results from the early August appointment had gone missing so they had to redo them.  So I had blood work done last Monday.</p>

<p>I got a call from the OB on Thursday saying that the results were in and that my FSH was 7.9 and that my estrogen was ok.  I was shocked, but happy.  And then on Friday my period came back!  It felt so good.  I felt like a woman again.  She also mentioned that my thyroid levels were off and that they wanted me to see an Endocrinologist.</p>

<p>They called me back in to the OB today.  I mentioned to the intake person/resident that I had seen the naturopath and had I had been taking the TCM herbs.  The resident, my OB and an Endo then came into the room and basically lectured me about going to a naturopath and taking herbs, told me that my period is fake and that the herbs might give me cancer and that they skewed the last blood results.  I felt like I was a kid being lectured for doing something wrong.  They want me to stop the herbs and come back again in a few weeks for a re-test.  They said that my estrogen was at an unhealthy high level.</p>

<p>I hate all of this. I hate being on an emotional roller coaster. I hate the way all of this makes me feel.  I wasn’t ready to have kids before now.  I finally found someone who I want to do this with and I’m being told that it can’t happen and I don’t understand.  Why do I still get cramps every month but no period?  No one will explain that.  Why did I get “ovulation” cramps every month if I wasn’t ovulating?  I don’t like my doctors.  But they are supposed to be the best in the city and the only place that specializes in POF.  I feel like they don’t listen.  They don’t explain.  The herbs are the only thing that has changed anything for me.</p>

<p>I don’t have anyone around who understands.  My partner thinks that the specialists are just brushing off eastern medicine. He just thinks that everything will work itself out.  My best friend has a toddler and I can barely talk to her because I’m so jealous.  I just need some help.  </p>

<p>Sorry if none of this makes any sense or if it’s too long or I’m too sad.  </p>
</div><!-- SC_ON -->",,,,,True,False,False,False,False,[],[],False,False,False,False,"40F, POI/POF",[],False,,,,t5_2saej,,,,72p3x9,True,,pixie7788,,25,True,no_ads,False,[],dark,/r/infertility/comments/72p3x9/new_and_not_okay/,no_ads,False,https://www.reddit.com/r/infertility/comments/72p3x9/new_and_not_okay/,25376,1506476414.0,0,,False,False,{},t2_c0wuycy,False,[],text,False,,,
2,2048,confidence,<praw.reddit.Reddit object at 0x7f2244aead90>,,infertility,[deleted],[],False,,0,False,Cold feet?,[],r/infertility,False,0,,0,,,False,t3_72ot8z,False,dark,1.0,,public,5,0,{},,,False,,False,False,,{},,False,5,,default,1506482639.0,,{},,True,,1506502064.0,text,0,,,self.infertility,False,"<!-- SC_OFF --><div class=""md""><p>[deleted]</p>
</div><!-- SC_ON -->",,,,,True,False,False,False,False,[],[],False,False,False,False,,[],False,,,,t5_2saej,,,,72ot8z,False,,,,24,True,no_ads,False,[],dark,/r/infertility/comments/72ot8z/cold_feet/,no_ads,False,https://www.reddit.com/r/infertility/comments/72ot8z/cold_feet/,25376,1506473264.0,0,,False,False,{},,,,,,,,
3,2048,confidence,<praw.reddit.Reddit object at 0x7f2244aead90>,,infertility,What kind of goals do we have this week? How's it going with previous goals?,[],False,,0,False,Goals Check-In!,[],r/infertility,False,0,,0,,,False,t3_72os2p,False,dark,1.0,,public,3,0,{},,d70f54ce-930e-11e4-8710-22000b26873e,False,,False,False,,{},,False,3,,self,False,,{},,True,,1506501710.0,text,0,,,self.infertility,False,"<!-- SC_OFF --><div class=""md""><p>What kind of goals do we have this week? How&#39;s it going with previous goals?</p>
</div><!-- SC_ON -->",,,,,True,False,False,False,False,[],[],False,False,False,False,"38, DOR, MFI, 4IVF, 1CP",[],False,,,,t5_2saej,,,,72os2p,True,,caresaboutstuff,,58,True,no_ads,False,[],dark,/r/infertility/comments/72os2p/goals_checkin/,no_ads,False,https://www.reddit.com/r/infertility/comments/72os2p/goals_checkin/,25376,1506472910.0,0,,False,False,{},t2_cwfgq,False,[],text,False,,,
4,2048,confidence,<praw.reddit.Reddit object at 0x7f2244aead90>,,infertility,"Hi everyone! I've been lurking around for a bit, and decided it was time to say hello. This is my first-ever Reddit post, so excuse me if I screw it up.

I'm 35, as is my husband. I stopped taking the pill in May of 2015, but we didn't start officially ""trying"" until August. After two years of no luck, I had my first appointment with an RE last week. It was pretty standard, and I have to call the first day of my next period to schedule an HSG and second sperm analysis for my husband. (He had one in August of 2016, but the RE said a lot can change in a year and wants to repeat it). He had very good results on the first analysis.

However--my lab results are slowly trickling in (they report them electronically if you opt in) and my AMH was only .23!!! I know we are very early in the process, but I've done some Googling and most of the info suggests we will be told to go right to IVF. Am I panicking, as my doctor hasn't even discussed these results with me? I'm trying not to, but I'm feeling pretty devastated. If anyone has advice, I'm all ears! 

Edit: Just wanted to say thanks for all of the great advice and information you all shared! I didn't get to respond individually to all of the comments, mainly because I was a little depressed about the results. I immediately went to ""This will never happen for us."" I've done some more research, along with the info I got here, and I'm feeling a little more hope now. I'm going to have day 3 testing this week, a second semen analysis for my husband, and then our big sit down with the RE (they will do the HSG, semen analysis, and our appointment with RE all on the same day, which makes me feel better). I'm hoping next time I post, I will have more helpful information and maybe a plan from the RE to move forward! Thank you all again for the support and help!!",[],False,,0,False,Intro/low AMH advice.,[],r/infertility,False,0,,0,,,False,t3_72og8k,False,dark,1.0,,public,3,0,{},,,False,,False,False,,{},,False,3,,self,1507418797.0,,{},,True,,1506498368.0,text,0,,,self.infertility,False,"<!-- SC_OFF --><div class=""md""><p>Hi everyone! I&#39;ve been lurking around for a bit, and decided it was time to say hello. This is my first-ever Reddit post, so excuse me if I screw it up.</p>

<p>I&#39;m 35, as is my husband. I stopped taking the pill in May of 2015, but we didn&#39;t start officially &quot;trying&quot; until August. After two years of no luck, I had my first appointment with an RE last week. It was pretty standard, and I have to call the first day of my next period to schedule an HSG and second sperm analysis for my husband. (He had one in August of 2016, but the RE said a lot can change in a year and wants to repeat it). He had very good results on the first analysis.</p>

<p>However--my lab results are slowly trickling in (they report them electronically if you opt in) and my AMH was only .23!!! I know we are very early in the process, but I&#39;ve done some Googling and most of the info suggests we will be told to go right to IVF. Am I panicking, as my doctor hasn&#39;t even discussed these results with me? I&#39;m trying not to, but I&#39;m feeling pretty devastated. If anyone has advice, I&#39;m all ears! </p>

<p>Edit: Just wanted to say thanks for all of the great advice and information you all shared! I didn&#39;t get to respond individually to all of the comments, mainly because I was a little depressed about the results. I immediately went to &quot;This will never happen for us.&quot; I&#39;ve done some more research, along with the info I got here, and I&#39;m feeling a little more hope now. I&#39;m going to have day 3 testing this week, a second semen analysis for my husband, and then our big sit down with the RE (they will do the HSG, semen analysis, and our appointment with RE all on the same day, which makes me feel better). I&#39;m hoping next time I post, I will have more helpful information and maybe a plan from the RE to move forward! Thank you all again for the support and help!!</p>
</div><!-- SC_ON -->",,,,,True,False,False,False,False,[],[],False,False,False,False,,[],False,,,,t5_2saej,,,,72og8k,True,,bad185,,21,True,no_ads,False,[],,/r/infertility/comments/72og8k/introlow_amh_advice/,no_ads,False,https://www.reddit.com/r/infertility/comments/72og8k/introlow_amh_advice/,25376,1506469568.0,0,,False,False,{},t2_12y41g,False,[],text,False,,,
5,2048,confidence,<praw.reddit.Reddit object at 0x7f2244aead90>,,infertility,"Hello all. I am 3 days away from my FET lining check. I've been on daily injections of lupron and an every 3 day delestrogen injection. But the last couple of days my boobs and mainly my nipples hurt exactly like they do after I ovulate. I'm so afraid I ovulated (even though I never ovulate on my own). 

Have any of you been on this protocol and have experience with this?  Also, I swear my CM is ever so slightly tinged brown like I'm beginning to spot... the stress/craziness is becoming real!! ",[],False,,0,False,Pre-FET medication symptoms,[],r/infertility,False,0,,0,,,False,t3_72oc3o,False,dark,0.76,,public,2,0,{},,,False,,False,False,,{},,False,2,,self,False,,{},,True,,1506497148.0,text,0,,,self.infertility,False,"<!-- SC_OFF --><div class=""md""><p>Hello all. I am 3 days away from my FET lining check. I&#39;ve been on daily injections of lupron and an every 3 day delestrogen injection. But the last couple of days my boobs and mainly my nipples hurt exactly like they do after I ovulate. I&#39;m so afraid I ovulated (even though I never ovulate on my own). </p>

<p>Have any of you been on this protocol and have experience with this?  Also, I swear my CM is ever so slightly tinged brown like I&#39;m beginning to spot... the stress/craziness is becoming real!! </p>
</div><!-- SC_ON -->",,,,,True,False,False,False,False,[],[],False,False,False,False,"29F, PCOS, MFI, IVF#1",[],False,,,,t5_2saej,,,,72oc3o,True,,notsofertilemyrtle,,4,True,no_ads,False,[],dark,/r/infertility/comments/72oc3o/prefet_medication_symptoms/,no_ads,False,https://www.reddit.com/r/infertility/comments/72oc3o/prefet_medication_symptoms/,25376,1506468348.0,0,,False,False,{},t2_114d7n,False,[],text,False,,,
6,2048,confidence,<praw.reddit.Reddit object at 0x7f2244aead90>,,infertility,"So my FET is this Thursday. I am on PIO injections and 3 pills of estradiol daily. 

For the last few days I have had minor cramping. It isn't like period cramping intensity, and doesn't last long, but it is very clearly cramp like feels. I can't imagine a cramping uterus is a good home for an embryo. 

Anyone have any experience with this? Is this indicative of something wrong, or just a response to the meds? 

I will call my RE tomorrow but I just wanted to check with you all.

Thank you!",[],False,,0,False,Mild cramping before FET,[],r/infertility,False,0,,0,,,False,t3_72ob6x,False,dark,1.0,,public,3,0,{},,d70f54ce-930e-11e4-8710-22000b26873e,False,,False,False,,{},,False,3,,self,False,,{},,True,,1506496893.0,text,0,,,self.infertility,False,"<!-- SC_OFF --><div class=""md""><p>So my FET is this Thursday. I am on PIO injections and 3 pills of estradiol daily. </p>

<p>For the last few days I have had minor cramping. It isn&#39;t like period cramping intensity, and doesn&#39;t last long, but it is very clearly cramp like feels. I can&#39;t imagine a cramping uterus is a good home for an embryo. </p>

<p>Anyone have any experience with this? Is this indicative of something wrong, or just a response to the meds? </p>

<p>I will call my RE tomorrow but I just wanted to check with you all.</p>

<p>Thank you!</p>
</div><!-- SC_ON -->",,,,,True,False,False,False,False,[],[],False,False,False,False,32F w/ 36F | 3 IUI | 1 IVF | 1 loss @ 19w | FET #2,[],False,,,,t5_2saej,,,,72ob6x,True,,LSP86,,11,True,no_ads,False,[],dark,/r/infertility/comments/72ob6x/mild_cramping_before_fet/,no_ads,False,https://www.reddit.com/r/infertility/comments/72ob6x/mild_cramping_before_fet/,25376,1506468093.0,0,,False,False,{},t2_dwd6i,False,[],text,False,,,
7,2048,confidence,<praw.reddit.Reddit object at 0x7f2244aead90>,,infertility,"My husband (38) and I (31) have been actively trying to conceive for 14 months now. I had been having incredibly painful periods for about 4 or 5 years now and after the first 6 unsuccessful months, we decided it was time to seek help to see if that was why were weren't conceiving. I went to see my OB on 2 separate occasions and she continually told me nothing was wrong with me. I'd have to wait until it had been at least a year before she could proceed any further with testing. Luckily, we were hooked up with one of the best OBs in town and she said she was almost positive I had endometriosis and scheduled me for surgery right away. 6 months ago I had a laparoscopy surgery and low and behold, I had endometriosis. She removed what she could, flushed my clogged tubes and fixed my ovary that was stuck to my abdomen. She told us that she was very optimistic that we would conceive in 6 months and if we didn't, she'd have to send us to a fertility specialist. Here we are, 6 months later, and still not pregnant. I'm utterly devastated. Our only support system is each other and I'm so thankful to at least have that. Nonetheless, we both feel completely alone in this. We're coping the best way we know how but I've never felt so hopeless, powerless and so lonely. When we do muster up the courage to open up about it, we're met with the same dismissive responses. ""Don't worry, it'll happen"" or (the worst of all) ""at least you get to try"". It makes me feel like I'm not allowed to be feel anything but happiness for having the opportunity to try to conceive. Every month is worse than the last. I'm never not thinking about children and being a parent. It's everywhere I look. It's gotten so bad that even watching my comfort shows/movies or keeping busy with my favorite activities just makes me sad. All I can think about is, I may never be able to share this with my children. I am terrified that we will never have children of our own.",[],False,,0,False,Feeling Hopeless and Alone,[],r/infertility,False,0,,0,,,False,t3_72noy6,False,dark,0.86,,public,5,0,{},,,False,,False,False,,{},,False,5,,self,False,,{},,True,,1506490870.0,text,0,,,self.infertility,False,"<!-- SC_OFF --><div class=""md""><p>My husband (38) and I (31) have been actively trying to conceive for 14 months now. I had been having incredibly painful periods for about 4 or 5 years now and after the first 6 unsuccessful months, we decided it was time to seek help to see if that was why were weren&#39;t conceiving. I went to see my OB on 2 separate occasions and she continually told me nothing was wrong with me. I&#39;d have to wait until it had been at least a year before she could proceed any further with testing. Luckily, we were hooked up with one of the best OBs in town and she said she was almost positive I had endometriosis and scheduled me for surgery right away. 6 months ago I had a laparoscopy surgery and low and behold, I had endometriosis. She removed what she could, flushed my clogged tubes and fixed my ovary that was stuck to my abdomen. She told us that she was very optimistic that we would conceive in 6 months and if we didn&#39;t, she&#39;d have to send us to a fertility specialist. Here we are, 6 months later, and still not pregnant. I&#39;m utterly devastated. Our only support system is each other and I&#39;m so thankful to at least have that. Nonetheless, we both feel completely alone in this. We&#39;re coping the best way we know how but I&#39;ve never felt so hopeless, powerless and so lonely. When we do muster up the courage to open up about it, we&#39;re met with the same dismissive responses. &quot;Don&#39;t worry, it&#39;ll happen&quot; or (the worst of all) &quot;at least you get to try&quot;. It makes me feel like I&#39;m not allowed to be feel anything but happiness for having the opportunity to try to conceive. Every month is worse than the last. I&#39;m never not thinking about children and being a parent. It&#39;s everywhere I look. It&#39;s gotten so bad that even watching my comfort shows/movies or keeping busy with my favorite activities just makes me sad. All I can think about is, I may never be able to share this with my children. I am terrified that we will never have children of our own.</p>
</div><!-- SC_ON -->",,,,,True,False,False,False,False,[],[],False,False,False,False,,[],False,,,,t5_2saej,,,,72noy6,True,,Mandar3000,,5,True,no_ads,False,[],,/r/infertility/comments/72noy6/feeling_hopeless_and_alone/,no_ads,False,https://www.reddit.com/r/infertility/comments/72noy6/feeling_hopeless_and_alone/,25376,1506462070.0,0,,False,False,{},t2_rjckr,False,[],text,False,,,
