174,2048,confidence,<praw.reddit.Reddit object at 0x7f2244aead90>,,infertility,"Sooooo, it's my nephews 2nd birthday (insert awws here) and It's cool, BUT there are 5 count them 5 pregnant women here and it pisses me off.  I'm trying to bargain with my husband to leave after the presents are opened cause what business do 2 infertile people have at a kids party? I can't take all these pregnant people here and that's all they've loudly talked about. Ugh, I hate family. At least I get to see my therapist Friday, imma need it:",[],False,,0,False,I hate birthdays,[],r/infertility,False,0,,0,,,False,t3_70prj5,False,dark,0.9,,public,15,0,{},,d70f54ce-930e-11e4-8710-22000b26873e,False,,False,False,,{},Rant,False,15,,self,False,,{},,True,,1505706533.0,text,0,,,self.infertility,False,"<!-- SC_OFF --><div class=""md""><p>Sooooo, it&#39;s my nephews 2nd birthday (insert awws here) and It&#39;s cool, BUT there are 5 count them 5 pregnant women here and it pisses me off.  I&#39;m trying to bargain with my husband to leave after the presents are opened cause what business do 2 infertile people have at a kids party? I can&#39;t take all these pregnant people here and that&#39;s all they&#39;ve loudly talked about. Ugh, I hate family. At least I get to see my therapist Friday, imma need it:</p>
</div><!-- SC_ON -->",,,,,True,False,False,False,False,[],[],False,False,False,False,"28F, PCOS, since '13, MC#1 ",[],False,,,,t5_2saej,,,,70prj5,True,,albritt9078,,47,True,no_ads,False,[],dark,/r/infertility/comments/70prj5/i_hate_birthdays/,no_ads,False,https://www.reddit.com/r/infertility/comments/70prj5/i_hate_birthdays/,25376,1505677733.0,0,,False,False,{},t2_9z2ip,False,[],text,False,,,
175,2048,confidence,<praw.reddit.Reddit object at 0x7f2244aead90>,,infertility,"Use this thread to share anything not necessarily related to infertility. Rant or rave, bitch, moan, share something funny, anything goes!",[],False,,0,False,Sunday Afternoon Off Topic Thread,[],r/infertility,False,0,,0,,,False,t3_70papz,False,dark,1.0,,public,3,0,{},,,False,,False,False,,{},,False,3,,self,False,,{},,True,,1505702147.0,text,0,,,self.infertility,False,"<!-- SC_OFF --><div class=""md""><p>Use this thread to share anything not necessarily related to infertility. Rant or rave, bitch, moan, share something funny, anything goes!</p>
</div><!-- SC_ON -->",,,,,True,False,False,False,False,[],[],False,False,False,False,,[],False,,,moderator,t5_2saej,,,,70papz,True,,AutoModerator,,45,False,no_ads,False,[],,/r/infertility/comments/70papz/sunday_afternoon_off_topic_thread/,no_ads,False,https://www.reddit.com/r/infertility/comments/70papz/sunday_afternoon_off_topic_thread/,25376,1505673347.0,0,,False,False,{},t2_6l4z3,True,[],text,False,,,
176,2048,confidence,<praw.reddit.Reddit object at 0x7f2244aead90>,,infertility,"Hi y'all,

I've got some meds that will expire before we have a chance to do another IVF cycle -- they all expire *January 2018*. Up for grabs:

* Menopur: 7 single dose vials (each vial is 75 IU)
* Gonal-F: 3 vials of GONAL-f Multi-Dose (each is 450 IU)
* Approximately 8,000 syringes, if anyone needs those

Free to a good home! I live in Oakland, or can bring them to downtown SF during the week if someone wants to pick them up there.",[],False,,0,False,Free meds -- SF Bay Area,[],r/infertility,False,0,,0,,,False,t3_70p9lj,False,dark,0.95,,public,19,0,{},,,False,,False,False,,{},,False,19,,self,False,,{},,True,,1505701863.0,text,0,,,self.infertility,False,"<!-- SC_OFF --><div class=""md""><p>Hi y&#39;all,</p>

<p>I&#39;ve got some meds that will expire before we have a chance to do another IVF cycle -- they all expire <em>January 2018</em>. Up for grabs:</p>

<ul>
<li>Menopur: 7 single dose vials (each vial is 75 IU)</li>
<li>Gonal-F: 3 vials of GONAL-f Multi-Dose (each is 450 IU)</li>
<li>Approximately 8,000 syringes, if anyone needs those</li>
</ul>

<p>Free to a good home! I live in Oakland, or can bring them to downtown SF during the week if someone wants to pick them up there.</p>
</div><!-- SC_ON -->",,,,,True,False,False,False,False,[],[],False,False,False,False,35 | 4 IUI | 2 IVF | 2 CP | ERA,[],False,,,,t5_2saej,,,,70p9lj,True,,superfuntimes5000,,6,True,no_ads,False,[],dark,/r/infertility/comments/70p9lj/free_meds_sf_bay_area/,no_ads,False,https://www.reddit.com/r/infertility/comments/70p9lj/free_meds_sf_bay_area/,25376,1505673063.0,0,,False,False,{},t2_10lrpq,True,[],text,False,,,
177,2048,confidence,<praw.reddit.Reddit object at 0x7f2244aead90>,,infertility,"Use this thread to share anything not necessarily related to infertility. Rant or rave, bitch, moan, share something funny, anything goes!",[],False,,0,False,Sunday Off Topic Thread,[],r/infertility,False,0,,0,,,False,t3_70mp9i,False,dark,0.78,,public,5,0,{},,,False,,False,False,,{},,False,5,,self,False,,{},,True,,1505671782.0,text,0,,,self.infertility,False,"<!-- SC_OFF --><div class=""md""><p>Use this thread to share anything not necessarily related to infertility. Rant or rave, bitch, moan, share something funny, anything goes!</p>
</div><!-- SC_ON -->",,,,,True,False,False,False,False,[],[],False,False,False,False,,[],False,,,moderator,t5_2saej,,,,70mp9i,True,,AutoModerator,,163,False,no_ads,False,[],,/r/infertility/comments/70mp9i/sunday_off_topic_thread/,no_ads,False,https://www.reddit.com/r/infertility/comments/70mp9i/sunday_off_topic_thread/,25376,1505642982.0,0,,False,False,{},t2_6l4z3,True,[],text,False,,,
178,2048,confidence,<praw.reddit.Reddit object at 0x7f2244aead90>,,infertility,"Welcome to the Infertility Results thread! Here you have the option of posting the outcome of your cycle (be it positive or negative) in a way that is sensitive to the emotional needs of our unique community. **For the sake of members who are struggling with negative results and the difficult feelings that come with them, we request that all pregnancy announcements be shared only in this thread.**

For the next stage of your journey, you may be interested in posting your story on r/whatworkedforme and we encourage you to continue to share your progress at our sister community, r/InfertilityBabies. Of course, you are always encouraged to share your non-pregnancy-related infertility experiences (and continue to support other community members) here on r/infertility. **Members with questionable results may wish to post on the weekly post-beta discussion thread that is stickied on the main page.** We are not banning any kind of post, either here or on the main board, but rather we see this as an opportunity for members to continue to share with those who are following their journey, but do so in a way that respects the feelings and wishes of those for whom individual results posts would be burdensome. **You can find this and past results threads indexed in the top ""Read This"" sticky on the main page**
",[],False,,0,False,Weekly Results Thread 09/17 to 09/23,[],r/infertility,False,0,,0,,,False,t3_70mi2c,False,dark,0.87,,public,6,0,{},,,False,,False,False,,{},,False,6,,self,False,,{},,True,,1505668050.0,text,0,,,self.infertility,False,"<!-- SC_OFF --><div class=""md""><p>Welcome to the Infertility Results thread! Here you have the option of posting the outcome of your cycle (be it positive or negative) in a way that is sensitive to the emotional needs of our unique community. <strong>For the sake of members who are struggling with negative results and the difficult feelings that come with them, we request that all pregnancy announcements be shared only in this thread.</strong></p>

<p>For the next stage of your journey, you may be interested in posting your story on <a href=""/r/whatworkedforme"">r/whatworkedforme</a> and we encourage you to continue to share your progress at our sister community, <a href=""/r/InfertilityBabies"">r/InfertilityBabies</a>. Of course, you are always encouraged to share your non-pregnancy-related infertility experiences (and continue to support other community members) here on <a href=""/r/infertility"">r/infertility</a>. <strong>Members with questionable results may wish to post on the weekly post-beta discussion thread that is stickied on the main page.</strong> We are not banning any kind of post, either here or on the main board, but rather we see this as an opportunity for members to continue to share with those who are following their journey, but do so in a way that respects the feelings and wishes of those for whom individual results posts would be burdensome. <strong>You can find this and past results threads indexed in the top &quot;Read This&quot; sticky on the main page</strong></p>
</div><!-- SC_ON -->",,,,,True,False,False,False,False,[],[],False,False,False,False,,[],False,,,moderator,t5_2saej,,,,70mi2c,True,,AutoModerator,,131,False,no_ads,False,[],,/r/infertility/comments/70mi2c/weekly_results_thread_0917_to_0923/,no_ads,False,https://www.reddit.com/r/infertility/comments/70mi2c/weekly_results_thread_0917_to_0923/,25376,1505639250.0,0,,False,False,{},t2_6l4z3,True,[],text,False,,,
179,2048,confidence,<praw.reddit.Reddit object at 0x7f2244aead90>,,infertility,[deleted],[],False,,0,False,Sex life talk?,[],r/infertility,False,0,,0,,,False,t3_70lo42,False,dark,0.5,,public,0,0,{},,,False,,False,False,,{},,False,0,,default,False,,{},,True,,1505652948.0,text,0,,,self.infertility,False,"<!-- SC_OFF --><div class=""md""><p>[deleted]</p>
</div><!-- SC_ON -->",,,,,True,True,False,False,False,[],[],False,False,False,False,,[],False,,,,t5_2saej,,,,70lo42,False,,,,0,True,no_ads,False,[],dark,/r/infertility/comments/70lo42/sex_life_talk/,no_ads,False,https://www.reddit.com/r/infertility/comments/70lo42/sex_life_talk/,25376,1505624148.0,0,,False,False,{},,,,,,,,
180,2048,confidence,<praw.reddit.Reddit object at 0x7f2244aead90>,,infertility,"Hey everyone, I'm a 26-year-old male and I could use your advice. 

I'm not attempting to conceive a baby right now, but I had epididymitis a month or two ago and the doctor recommended a sperm analysis, to ensure there was no scarring/blockages.

The sperm analysis showed that there is no blockage and my sperm volume/motility is normal, but the doctor did note that I had a sperm morthology of 1%, meaning that 99% of my sperm were abnormal.

I don't have a partner at the moment and don't want to conceive a baby any time soon, but it's definitely something that I want in the future. 

I'm wondering if, with lifestyle changes, I could potentially improve my sperm quality? I've seen conflicting info (some sources say you cannot do anything to fix this, others say that you may be able to improve them). 

Some things that I am aiming to change with my life: somewhat-poor diet, low level of activity, some chronic inflammation, poor sleep, somewhat-low testosterone (had this tested a year ago and it was around 400ng/dl). I'm changing these things regardless of the impact on my sperm, but I'm wondering if there's hope I could raise my morthology to something considered normal (even 4%), in 5 to 10 years time. ",[],False,,0,False,Can I improve abnormal sperm/morthology with lifestyle changes?,[],r/infertility,False,0,,0,,,False,t3_70ljd4,False,dark,0.8,,public,6,0,{},,,False,,False,False,,{},,False,6,,self,False,,{},,True,,1505650972.0,text,0,,,self.infertility,False,"<!-- SC_OFF --><div class=""md""><p>Hey everyone, I&#39;m a 26-year-old male and I could use your advice. </p>

<p>I&#39;m not attempting to conceive a baby right now, but I had epididymitis a month or two ago and the doctor recommended a sperm analysis, to ensure there was no scarring/blockages.</p>

<p>The sperm analysis showed that there is no blockage and my sperm volume/motility is normal, but the doctor did note that I had a sperm morthology of 1%, meaning that 99% of my sperm were abnormal.</p>

<p>I don&#39;t have a partner at the moment and don&#39;t want to conceive a baby any time soon, but it&#39;s definitely something that I want in the future. </p>

<p>I&#39;m wondering if, with lifestyle changes, I could potentially improve my sperm quality? I&#39;ve seen conflicting info (some sources say you cannot do anything to fix this, others say that you may be able to improve them). </p>

<p>Some things that I am aiming to change with my life: somewhat-poor diet, low level of activity, some chronic inflammation, poor sleep, somewhat-low testosterone (had this tested a year ago and it was around 400ng/dl). I&#39;m changing these things regardless of the impact on my sperm, but I&#39;m wondering if there&#39;s hope I could raise my morthology to something considered normal (even 4%), in 5 to 10 years time. </p>
</div><!-- SC_ON -->",,,,,True,False,False,False,False,[],[],False,False,False,False,,[],False,,,,t5_2saej,,,,70ljd4,True,,handthro,,22,True,no_ads,False,[],,/r/infertility/comments/70ljd4/can_i_improve_abnormal_spermmorthology_with/,no_ads,False,https://www.reddit.com/r/infertility/comments/70ljd4/can_i_improve_abnormal_spermmorthology_with/,25376,1505622172.0,0,,False,False,{},t2_ef8by,False,[],text,False,,,
181,2048,confidence,<praw.reddit.Reddit object at 0x7f2244aead90>,,infertility,[removed],[],False,,0,False,Am I welcome here?,[],r/infertility,False,0,,0,,,False,t3_70kdvz,False,dark,0.5,,public,0,0,{},,,False,,False,False,,{},,False,0,,default,False,,{},,True,,1505635896.0,text,0,,,self.infertility,False,"<!-- SC_OFF --><div class=""md""><p>[removed]</p>
</div><!-- SC_ON -->",,,,,True,True,False,False,False,[],[],False,False,False,False,,[],False,,,,t5_2saej,,,,70kdvz,False,,playingtricksonme,,4,True,no_ads,False,[],,/r/infertility/comments/70kdvz/am_i_welcome_here/,no_ads,False,https://www.reddit.com/r/infertility/comments/70kdvz/am_i_welcome_here/,25376,1505607096.0,0,,False,False,{},t2_yxm3n,False,[],text,False,,,
182,2048,confidence,<praw.reddit.Reddit object at 0x7f2244aead90>,,infertility,[deleted],[],False,,0,False,The Stork - OTC,[],r/infertility,False,0,,0,,,False,t3_70k3sh,False,dark,0.66,,public,1,0,{},,,False,,False,False,,{},,False,1,,default,False,,{},,True,,1505632612.0,text,0,deleted,,self.infertility,True,"<!-- SC_OFF --><div class=""md""><p>[deleted]</p>
</div><!-- SC_ON -->",,,,,True,True,False,False,False,[],[],False,False,False,False,,[],False,,,,t5_2saej,,,,70k3sh,False,,,,2,True,no_ads,False,[],dark,/r/infertility/comments/70k3sh/the_stork_otc/,no_ads,False,https://www.reddit.com/r/infertility/comments/70k3sh/the_stork_otc/,25376,1505603812.0,0,,False,False,{},,,,,,,,
183,2048,confidence,<praw.reddit.Reddit object at 0x7f2244aead90>,,infertility,"Apologies in advance for this wall of text if it should be posted in one of the dailies. Just looking for advice because we aren't getting it from our clinic!

Background: male and female couple with unexplained infertility, no known health issues.

We are six weeks out from a fresh transfer of a single hatching blastocyst from our first round of IVF that resulted in a negative pregnancy test. We haven't heard from the clinic since the call to confirm the negative test, so we called to book the followup. Our file hasn't been reviewed yet and because of that, they won't book the followup.

It seems a bit odd that the appointment can't even be booked and we live many hours from the clinic so it would be nice to plan... Is this normal practice?

The cycle itself seemed a bit odd as well. The initial FSH dose was basically the same as 2 negative IUI+med cycles that resulted in single follicles to be ready on trigger day (we had asked the nurses that we try for multiple follicles on the second IUI but that didn't seem to be acted on). On day 5 of the IVF cycle, the FSH dose was nearly tripled and we were worried about a cancelled cycle. It seems like our history wasn't considered when setting the initial dose?

After a stim cycle that took a couple of more days than expected, we had what seemed to be a great retrieval and good fertilization and development. On the day before the day 5 transfer, we had 5 high quality morulas and we were told by the embryologist to expect to freeze several blastocysts.

Yayyy!! After years of trying and so many questions, it seemed like things were going well. 

Minutes before the transfer on day 5, we were told that 4 of the morulas had arrested but the remaining blastocyst was good for transfer. Reading various forums... this doesn't seem typical but also isn't unheard of. We asked if they could be monitored for another day and did learn during that time that they hadn't really ""arrested"" but they believed the embryo quality wasn't viable so none were frozen. Had we known this, we may have asked for more than one to be transferred on day 5.

Based on the weirdness booking the WTF and all of our questions, combined with the lack of followup (we haven't talked to a doctor since a few months before the first IUI) and an extra 3 month delay (6 months total) between our initial consult and testing results because of a filing error... we are losing trust in the clinic. Is this warranted or are we expecting too much?

Any advice on how to frame these concerns when we finally get to speak to the doctor to get honest insight?",[],False,,0,False,WTF Booking Weirdness and Clinic Trust Issues,[],r/infertility,False,0,,0,,,False,t3_70iljw,False,dark,0.86,,public,5,0,{},,,False,,False,False,,{},,False,5,,self,False,,{},,True,,1505616203.0,text,0,,,self.infertility,False,"<!-- SC_OFF --><div class=""md""><p>Apologies in advance for this wall of text if it should be posted in one of the dailies. Just looking for advice because we aren&#39;t getting it from our clinic!</p>

<p>Background: male and female couple with unexplained infertility, no known health issues.</p>

<p>We are six weeks out from a fresh transfer of a single hatching blastocyst from our first round of IVF that resulted in a negative pregnancy test. We haven&#39;t heard from the clinic since the call to confirm the negative test, so we called to book the followup. Our file hasn&#39;t been reviewed yet and because of that, they won&#39;t book the followup.</p>

<p>It seems a bit odd that the appointment can&#39;t even be booked and we live many hours from the clinic so it would be nice to plan... Is this normal practice?</p>

<p>The cycle itself seemed a bit odd as well. The initial FSH dose was basically the same as 2 negative IUI+med cycles that resulted in single follicles to be ready on trigger day (we had asked the nurses that we try for multiple follicles on the second IUI but that didn&#39;t seem to be acted on). On day 5 of the IVF cycle, the FSH dose was nearly tripled and we were worried about a cancelled cycle. It seems like our history wasn&#39;t considered when setting the initial dose?</p>

<p>After a stim cycle that took a couple of more days than expected, we had what seemed to be a great retrieval and good fertilization and development. On the day before the day 5 transfer, we had 5 high quality morulas and we were told by the embryologist to expect to freeze several blastocysts.</p>

<p>Yayyy!! After years of trying and so many questions, it seemed like things were going well. </p>

<p>Minutes before the transfer on day 5, we were told that 4 of the morulas had arrested but the remaining blastocyst was good for transfer. Reading various forums... this doesn&#39;t seem typical but also isn&#39;t unheard of. We asked if they could be monitored for another day and did learn during that time that they hadn&#39;t really &quot;arrested&quot; but they believed the embryo quality wasn&#39;t viable so none were frozen. Had we known this, we may have asked for more than one to be transferred on day 5.</p>

<p>Based on the weirdness booking the WTF and all of our questions, combined with the lack of followup (we haven&#39;t talked to a doctor since a few months before the first IUI) and an extra 3 month delay (6 months total) between our initial consult and testing results because of a filing error... we are losing trust in the clinic. Is this warranted or are we expecting too much?</p>

<p>Any advice on how to frame these concerns when we finally get to speak to the doctor to get honest insight?</p>
</div><!-- SC_ON -->",,,,,True,True,False,False,False,[],[],False,False,False,False,,[],False,,,,t5_2saej,,,,70iljw,True,,infertilityguy,,23,True,no_ads,False,[],,/r/infertility/comments/70iljw/wtf_booking_weirdness_and_clinic_trust_issues/,no_ads,False,https://www.reddit.com/r/infertility/comments/70iljw/wtf_booking_weirdness_and_clinic_trust_issues/,25376,1505587403.0,0,,False,False,{},t2_e0rn06p,False,[],text,False,,,
184,2048,confidence,<praw.reddit.Reddit object at 0x7f2244aead90>,,infertility,"Use this thread to share anything not necessarily related to infertility. Rant or rave, bitch, moan, share something funny, anything goes!",[],False,,0,False,Saturday Afternoon Off Topic Thread,[],r/infertility,False,0,,0,,,False,t3_70ijx8,False,dark,1.0,,public,1,0,{},,,False,,False,False,,{},,False,1,,self,False,,{},,True,,1505615749.0,text,0,,,self.infertility,False,"<!-- SC_OFF --><div class=""md""><p>Use this thread to share anything not necessarily related to infertility. Rant or rave, bitch, moan, share something funny, anything goes!</p>
</div><!-- SC_ON -->",,,,,True,True,False,False,False,[],[],False,False,False,False,,[],False,,,moderator,t5_2saej,,,,70ijx8,True,,AutoModerator,,36,False,no_ads,False,[],,/r/infertility/comments/70ijx8/saturday_afternoon_off_topic_thread/,no_ads,False,https://www.reddit.com/r/infertility/comments/70ijx8/saturday_afternoon_off_topic_thread/,25376,1505586949.0,0,,False,False,{},t2_6l4z3,True,[],text,False,,,
185,2048,confidence,<praw.reddit.Reddit object at 0x7f2244aead90>,,infertility,"I started estrace priming,1/2mg 2xday, on the 9th. I have an estimated fresh donor transfer on the 7th of October.

So yesterday at 3am my back seized up and I couldn't do anything but pace. Sitting and laying down had me in tears pain wise. I had to take a family member to the hospital at 5am for day surgery. There was no backup to do it for me and no way I could cancel on them. I took 2 regular strength Aleve (naproxen) 12 hours apart to get through the day. I know naproxen is a no-no, and my nurse said she would rather I take morphine (but hello caring for someone post-op), but wouldn't explain why so I could weigh the risks. 

So how badly did I screw up?",[],False,,0,False,How much did I f*ck up?,[],r/infertility,False,0,,0,,,False,t3_70i3of,False,dark,1.0,,public,3,0,{},,,False,,False,False,,{},,False,3,,self,False,,{},,True,,1505611139.0,text,0,,,self.infertility,False,"<!-- SC_OFF --><div class=""md""><p>I started estrace priming,1/2mg 2xday, on the 9th. I have an estimated fresh donor transfer on the 7th of October.</p>

<p>So yesterday at 3am my back seized up and I couldn&#39;t do anything but pace. Sitting and laying down had me in tears pain wise. I had to take a family member to the hospital at 5am for day surgery. There was no backup to do it for me and no way I could cancel on them. I took 2 regular strength Aleve (naproxen) 12 hours apart to get through the day. I know naproxen is a no-no, and my nurse said she would rather I take morphine (but hello caring for someone post-op), but wouldn&#39;t explain why so I could weigh the risks. </p>

<p>So how badly did I screw up?</p>
</div><!-- SC_ON -->",,,,,True,False,False,False,False,[],[],False,False,False,False,,[],False,,,,t5_2saej,,,,70i3of,True,,MOMofHulk,,18,True,no_ads,False,[],,/r/infertility/comments/70i3of/how_much_did_i_fck_up/,no_ads,False,https://www.reddit.com/r/infertility/comments/70i3of/how_much_did_i_fck_up/,25376,1505582339.0,0,,False,False,{},t2_piyal,False,[],text,False,,,
186,2048,confidence,<praw.reddit.Reddit object at 0x7f2244aead90>,,infertility,[deleted],[],False,,0,False,Six ? Six cycles?,[],r/infertility,False,0,,0,,,False,t3_70h52h,False,dark,0.87,,public,22,0,{},,,False,,False,False,,{},,False,22,,default,1505572216.0,,{},,True,,1505600741.0,text,0,,,self.infertility,False,"<!-- SC_OFF --><div class=""md""><p>[deleted]</p>
</div><!-- SC_ON -->",,,,,True,False,False,False,False,[],[],False,False,False,False,,[],False,,,,t5_2saej,,,,70h52h,False,,,,76,True,no_ads,False,[],dark,/r/infertility/comments/70h52h/six_six_cycles/,no_ads,False,https://www.reddit.com/r/infertility/comments/70h52h/six_six_cycles/,25376,1505571941.0,0,,False,False,{},,,,,,,,
187,2048,confidence,<praw.reddit.Reddit object at 0x7f2244aead90>,,infertility,[deleted],[],False,,0,False,Saturday Relationships Thread,[],r/infertility,False,0,,0,,,False,t3_70h10q,False,dark,0.75,,public,2,0,{},,,False,,False,False,,{},,False,2,,default,False,,{},,True,,1505599376.0,text,0,,,self.infertility,False,"<!-- SC_OFF --><div class=""md""><p>[deleted]</p>
</div><!-- SC_ON -->",,,,,True,False,False,False,False,[],[],False,False,False,False,,[],False,,,,t5_2saej,,,,70h10q,False,,,,6,True,no_ads,False,[],dark,/r/infertility/comments/70h10q/saturday_relationships_thread/,no_ads,False,https://www.reddit.com/r/infertility/comments/70h10q/saturday_relationships_thread/,25376,1505570576.0,0,,False,False,{},,,,,,,,
188,2048,confidence,<praw.reddit.Reddit object at 0x7f2244aead90>,,infertility,[deleted],[],False,,0,False,Saturday ACTIVE treatment thread,[],r/infertility,False,0,,0,,,False,t3_70h0wx,False,dark,0.99,,public,4,0,{},,,False,,False,False,,{},,False,4,,default,False,,{},,True,,1505599345.0,text,0,,,self.infertility,True,"<!-- SC_OFF --><div class=""md""><p>[deleted]</p>
</div><!-- SC_ON -->",,,,,True,False,False,False,False,[],[],False,False,False,False,,[],False,,,,t5_2saej,,,,70h0wx,False,,,,99,True,no_ads,False,[],dark,/r/infertility/comments/70h0wx/saturday_active_treatment_thread/,no_ads,False,https://www.reddit.com/r/infertility/comments/70h0wx/saturday_active_treatment_thread/,25376,1505570545.0,0,,False,False,{},,,,,,,,
