,comment_limit,comment_sort,_reddit,approved_at_utc,subreddit,selftext,author_fullname,saved,mod_reason_title,gilded,clicked,title,link_flair_richtext,subreddit_name_prefixed,hidden,pwls,link_flair_css_class,downs,thumbnail_height,top_awarded_type,hide_score,name,quarantine,link_flair_text_color,upvote_ratio,author_flair_background_color,subreddit_type,ups,total_awards_received,media_embed,thumbnail_width,author_flair_template_id,is_original_content,user_reports,secure_media,is_reddit_media_domain,is_meta,category,secure_media_embed,link_flair_text,can_mod_post,score,approved_by,author_premium,thumbnail,edited,author_flair_css_class,author_flair_richtext,gildings,content_categories,is_self,mod_note,created,link_flair_type,wls,removed_by_category,banned_by,author_flair_type,domain,allow_live_comments,selftext_html,likes,suggested_sort,banned_at_utc,view_count,archived,no_follow,is_crosspostable,pinned,over_18,all_awardings,awarders,media_only,can_gild,spoiler,locked,author_flair_text,treatment_tags,visited,removed_by,num_reports,distinguished,subreddit_id,mod_reason_by,removal_reason,link_flair_background_color,id,is_robot_indexable,report_reasons,author,discussion_type,num_comments,send_replies,whitelist_status,contest_mode,mod_reports,author_patreon_flair,author_flair_text_color,permalink,parent_whitelist_status,stickied,url,subreddit_subscribers,created_utc,num_crossposts,media,is_video,_fetched,_comments_by_id,link_flair_template_id,author_cakeday,post_hint,preview,crosspost_parent_list,url_overridden_by_dest,crosspost_parent,collections
0,2048,confidence,<praw.reddit.Reddit object at 0x7f2244aead90>,,infertility,"How’s everyone doing? Setting any new goals this week?   
For newbies, there’s nothing specific about what type of goals here, it can be IF related, health related, home related or just “don’t kill anyone this week.”      ",t2_cwfgq,False,,0,False,Weekly Goals Thread,[],r/infertility,False,0,,0,,,False,t3_8jbgw6,False,dark,0.63,,public,2,0,{},,d70f54ce-930e-11e4-8710-22000b26873e,False,[],,False,False,,{},,False,2,,False,self,False,,[],{},,True,,1526325775.0,text,0,,,text,self.infertility,True,"<!-- SC_OFF --><div class=""md""><p>How’s everyone doing? Setting any new goals this week?<br/>
For newbies, there’s nothing specific about what type of goals here, it can be IF related, health related, home related or just “don’t kill anyone this week.”      </p>
</div><!-- SC_ON -->",,,,,True,False,False,False,False,[],[],False,False,False,False,"38, DOR, MFI, 4IVF, 1CP",[],False,,,,t5_2saej,,,,8jbgw6,True,,caresaboutstuff,,56,True,no_ads,False,[],False,dark,/r/infertility/comments/8jbgw6/weekly_goals_thread/,no_ads,False,https://www.reddit.com/r/infertility/comments/8jbgw6/weekly_goals_thread/,25376,1526296975.0,0,,False,False,{},,,,,,,,
1,2048,confidence,<praw.reddit.Reddit object at 0x7f2244aead90>,,infertility,[deleted],,False,,0,False,[Intro] My MIL thinks I should fight for an alternative treatment before being forced to have a full hysterectomy.,[],r/infertility,False,0,,0,,,False,t3_8jbg46,False,dark,1.0,,public,3,0,{},,,False,[],,False,False,,{},Advice,False,3,,,default,1526297796.0,,,{},,True,,1526325522.0,text,0,,,,self.infertility,False,"<!-- SC_OFF --><div class=""md""><p>[deleted]</p>
</div><!-- SC_ON -->",,,,,True,False,False,False,False,[],[],False,False,False,False,,[],False,,,,t5_2saej,,,,8jbg46,False,,,,10,True,no_ads,False,[],,dark,/r/infertility/comments/8jbg46/intro_my_mil_thinks_i_should_fight_for_an/,no_ads,False,https://www.reddit.com/r/infertility/comments/8jbg46/intro_my_mil_thinks_i_should_fight_for_an/,25376,1526296722.0,0,,False,False,{},1ae87cfc-92a6-11e4-8e5a-22000b26873e,,,,,,,
2,2048,confidence,<praw.reddit.Reddit object at 0x7f2244aead90>,,infertility,[removed],t2_1d7wv6zi,False,,0,False,Medical vs Surgery : Which is the Best Endometriosis Infertility Treatment ?,[],r/infertility,False,0,,0,,,False,t3_8jb965,False,dark,0.27,,public,0,0,{},,,False,[],,False,False,,{},,False,0,,False,default,False,,[],{},,True,,1526323170.0,text,0,,,text,self.infertility,False,"<!-- SC_OFF --><div class=""md""><p>[removed]</p>
</div><!-- SC_ON -->",,,,,True,True,False,False,False,[],[],False,False,False,False,,[],False,,,,t5_2saej,,,,8jb965,False,,Aymerrr,,1,True,no_ads,False,[],False,,/r/infertility/comments/8jb965/medical_vs_surgery_which_is_the_best/,no_ads,False,https://www.reddit.com/r/infertility/comments/8jb965/medical_vs_surgery_which_is_the_best/,25376,1526294370.0,0,,False,False,{},,,,,,,,
3,2048,confidence,<praw.reddit.Reddit object at 0x7f2244aead90>,,infertility,"This thread is a dedicated space to those of us who are actively pursuing or seeking information on donor infertility treatments. This can be donor egg, sperm or gamete/embryo adoption, same sex couples using donors, donor IUI or IVF, and double donor discussion are all welcome here. 
",t2_6l4z3,False,,0,False,Weekly Donor Treatment Info/ Discussion Thread,[],r/infertility,False,0,,0,,,False,t3_8jaz0a,False,dark,0.77,,public,7,0,{},,,False,[],,False,False,,{},,False,7,,True,self,False,,[],{},,True,,1526319375.0,text,0,,,text,self.infertility,True,"<!-- SC_OFF --><div class=""md""><p>This thread is a dedicated space to those of us who are actively pursuing or seeking information on donor infertility treatments. This can be donor egg, sperm or gamete/embryo adoption, same sex couples using donors, donor IUI or IVF, and double donor discussion are all welcome here. </p>
</div><!-- SC_ON -->",,,,,True,False,False,False,False,[],[],False,False,False,False,,[],False,,,moderator,t5_2saej,,,,8jaz0a,True,,AutoModerator,,25,False,no_ads,False,[],False,,/r/infertility/comments/8jaz0a/weekly_donor_treatment_info_discussion_thread/,no_ads,False,https://www.reddit.com/r/infertility/comments/8jaz0a/weekly_donor_treatment_info_discussion_thread/,25376,1526290575.0,0,,False,False,{},,,,,,,,
4,2048,confidence,<praw.reddit.Reddit object at 0x7f2244aead90>,,infertility,"This thread is for updates and discussion on active treatment 
",t2_6l4z3,False,,0,False,Monday ACTIVE Treatment Thread,[],r/infertility,False,0,,0,,,False,t3_8jayz7,False,dark,0.77,,public,5,0,{},,,False,[],,False,False,,{},,False,5,,True,self,False,,[],{},,True,,1526319369.0,text,0,,,text,self.infertility,True,"<!-- SC_OFF --><div class=""md""><p>This thread is for updates and discussion on active treatment </p>
</div><!-- SC_ON -->",,,,,True,False,False,False,False,[],[],False,False,False,False,,[],False,,,moderator,t5_2saej,,,,8jayz7,True,,AutoModerator,,111,False,no_ads,False,[],False,,/r/infertility/comments/8jayz7/monday_active_treatment_thread/,no_ads,False,https://www.reddit.com/r/infertility/comments/8jayz7/monday_active_treatment_thread/,25376,1526290569.0,0,,False,False,{},,,,,,,,
5,2048,confidence,<praw.reddit.Reddit object at 0x7f2244aead90>,,infertility,"Use this thread to share anything not necessarily related to infertility. Rant or rave, bitch, moan, share something funny, anything goes!
",t2_6l4z3,False,,0,False,Monday Discussion Thread,[],r/infertility,False,0,,0,,,False,t3_8jayys,False,dark,0.57,,public,1,0,{},,,False,[],,False,False,,{},,False,1,,True,self,False,,[],{},,True,,1526319364.0,text,0,,,text,self.infertility,True,"<!-- SC_OFF --><div class=""md""><p>Use this thread to share anything not necessarily related to infertility. Rant or rave, bitch, moan, share something funny, anything goes!</p>
</div><!-- SC_ON -->",,,,,True,False,False,False,False,[],[],False,False,False,False,,[],False,,,moderator,t5_2saej,,,,8jayys,True,,AutoModerator,,70,False,no_ads,False,[],False,,/r/infertility/comments/8jayys/monday_discussion_thread/,no_ads,False,https://www.reddit.com/r/infertility/comments/8jayys/monday_discussion_thread/,25376,1526290564.0,0,,False,False,{},,,,,,,,
6,2048,confidence,<praw.reddit.Reddit object at 0x7f2244aead90>,,infertility,[removed],t2_lxypl8p,False,,0,False,best infertility center in Hyderabad,[],r/infertility,False,0,,0,,,False,t3_8jayvs,False,dark,1.0,,public,1,0,{},,,False,[],,False,False,,{},,False,1,,False,default,False,,[],{},,True,,1526319321.0,text,0,,,text,self.infertility,False,"<!-- SC_OFF --><div class=""md""><p>[removed]</p>
</div><!-- SC_ON -->",,,,,True,True,False,False,False,[],[],False,False,False,False,,[],False,,,,t5_2saej,,,,8jayvs,False,,srilakshmi123,,0,True,no_ads,False,[],False,,/r/infertility/comments/8jayvs/best_infertility_center_in_hyderabad/,no_ads,False,https://www.reddit.com/r/infertility/comments/8jayvs/best_infertility_center_in_hyderabad/,25376,1526290521.0,0,,False,False,{},,,,,,,,
7,2048,confidence,<praw.reddit.Reddit object at 0x7f2244aead90>,,infertility,"**This thread is for those of you who have already posted a positive first beta in the results thread (see the sticky ""Read This"" thread for links) but are having concerns or are in beta-hell/limbo.** Maybe you need to talk about your concerns but you aren't ready to move over to IFbabies yet? Or maybe your betas aren't rising like you were hoping?  This is a safe space for post positive beta discussions, beta hell, beta limbo, or early IF pregnancy concerns. **Note that regular first beta or HPT pregnancy results should be posted in the weekly results thread. Positive resolutions to beta-hell/limbo or other early pregnancy concerns are okay in here** Links to the regular results threads can be found on the main page or linked in the sticky ""Read This"" post.
",t2_6l4z3,False,,0,False,"Weekly Post-Beta Concerns & Discussion - May 14, 2018",[],r/infertility,False,0,,0,,,False,t3_8jauqt,False,dark,0.75,,public,4,0,{},,,False,[],,False,False,,{},,False,4,,True,self,False,,[],{},,True,,1526317750.0,text,0,,,text,self.infertility,True,"<!-- SC_OFF --><div class=""md""><p><strong>This thread is for those of you who have already posted a positive first beta in the results thread (see the sticky &quot;Read This&quot; thread for links) but are having concerns or are in beta-hell/limbo.</strong> Maybe you need to talk about your concerns but you aren&#39;t ready to move over to IFbabies yet? Or maybe your betas aren&#39;t rising like you were hoping?  This is a safe space for post positive beta discussions, beta hell, beta limbo, or early IF pregnancy concerns. <strong>Note that regular first beta or HPT pregnancy results should be posted in the weekly results thread. Positive resolutions to beta-hell/limbo or other early pregnancy concerns are okay in here</strong> Links to the regular results threads can be found on the main page or linked in the sticky &quot;Read This&quot; post.</p>
</div><!-- SC_ON -->",,,,,True,False,False,False,False,[],[],False,False,False,False,,[],False,,,moderator,t5_2saej,,,,8jauqt,True,,AutoModerator,,73,False,no_ads,False,[],False,,/r/infertility/comments/8jauqt/weekly_postbeta_concerns_discussion_may_14_2018/,no_ads,False,https://www.reddit.com/r/infertility/comments/8jauqt/weekly_postbeta_concerns_discussion_may_14_2018/,25376,1526288950.0,0,,False,False,{},,,,,,,,
8,2048,confidence,<praw.reddit.Reddit object at 0x7f2244aead90>,,infertility,[removed],,False,,0,False,"My wife is 5 weeks pregnant (naturally), after trying for 5 years and 4 rounds of iui and our first round of ivf. Never give up.",[],r/infertility,False,0,,0,,,False,t3_8j9lr2,False,dark,0.33,,public,0,0,{},,,False,[],,False,False,,{},,False,0,,,default,False,,,{},,True,,1526300648.0,text,0,,,,self.infertility,False,"<!-- SC_OFF --><div class=""md""><p>[removed]</p>
</div><!-- SC_ON -->",,,,,True,True,False,False,False,[],[],False,False,False,False,,[],False,,,,t5_2saej,,,,8j9lr2,False,,,,14,True,no_ads,False,[],,dark,/r/infertility/comments/8j9lr2/my_wife_is_5_weeks_pregnant_naturally_after/,no_ads,False,https://www.reddit.com/r/infertility/comments/8j9lr2/my_wife_is_5_weeks_pregnant_naturally_after/,25376,1526271848.0,0,,False,False,{},,,,,,,,
9,2048,confidence,<praw.reddit.Reddit object at 0x7f2244aead90>,,infertility,"So I'm not usually very sensitive about Mother's Day, baby showers, etc. I mean, it's a reminder and I feel like I'm missing out, but I can get through it okay.

I have a friend who has 3 children under the age of 6. She was pregnant with her first during the time that my doctors told me I would need fertility treatment to get pregnant. When I first told her back then, she nervous laughed and said ""so do you have like a hostile uterus or something?"" It was a huge barrier in our friendship and I got over her comments thinking maybe she just didn't know how to be there for a friend with infertility while she had gotten pregnant so easily. 

We don't really talk much anymore...occasionally she'll comment on a Facebook post or something. But today on, you know, Mother's Day she texts me and says ""Happy Mother's Day! Miss you!""

?! We've been TTC for 6+ yrs. I've taken so many pills/shots that it just feels like it'll be my life forever. Going through an IVF cycle right now. Like I said, usually I'm not sensitive about this stuff but when someone does something so INsensitive it kind of strikes a nerve. A big medicated hormonal nerve.",t2_8jz7f,False,,0,False,"Not usually this sensitive, but really??",[],r/infertility,False,0,,0,,,False,t3_8j9ja6,False,dark,0.92,,public,22,0,{},,,False,[],,False,False,,{},,False,22,,False,self,False,,[],{},,True,,1526299884.0,text,0,,,text,self.infertility,False,"<!-- SC_OFF --><div class=""md""><p>So I&#39;m not usually very sensitive about Mother&#39;s Day, baby showers, etc. I mean, it&#39;s a reminder and I feel like I&#39;m missing out, but I can get through it okay.</p>

<p>I have a friend who has 3 children under the age of 6. She was pregnant with her first during the time that my doctors told me I would need fertility treatment to get pregnant. When I first told her back then, she nervous laughed and said &quot;so do you have like a hostile uterus or something?&quot; It was a huge barrier in our friendship and I got over her comments thinking maybe she just didn&#39;t know how to be there for a friend with infertility while she had gotten pregnant so easily. </p>

<p>We don&#39;t really talk much anymore...occasionally she&#39;ll comment on a Facebook post or something. But today on, you know, Mother&#39;s Day she texts me and says &quot;Happy Mother&#39;s Day! Miss you!&quot;</p>

<p>?! We&#39;ve been TTC for 6+ yrs. I&#39;ve taken so many pills/shots that it just feels like it&#39;ll be my life forever. Going through an IVF cycle right now. Like I said, usually I&#39;m not sensitive about this stuff but when someone does something so INsensitive it kind of strikes a nerve. A big medicated hormonal nerve.</p>
</div><!-- SC_ON -->",,,,,True,False,False,False,False,[],[],False,False,False,False,,[],False,,,,t5_2saej,,,,8j9ja6,True,,chfm,,19,True,no_ads,False,[],False,,/r/infertility/comments/8j9ja6/not_usually_this_sensitive_but_really/,no_ads,False,https://www.reddit.com/r/infertility/comments/8j9ja6/not_usually_this_sensitive_but_really/,25376,1526271084.0,0,,False,False,{},,,,,,,,
10,2048,confidence,<praw.reddit.Reddit object at 0x7f2244aead90>,,infertility,[deleted],,False,,0,False,So how’d it go for all of you?,[],r/infertility,False,0,,0,,,False,t3_8j97c9,False,dark,0.75,,public,4,0,{},,,False,[],,False,False,,{},,False,4,,,default,False,,,{},,True,,1526296229.0,text,0,deleted,,,self.infertility,False,"<!-- SC_OFF --><div class=""md""><p>[deleted]</p>
</div><!-- SC_ON -->",,,,,True,False,False,False,False,[],[],False,False,False,False,,[],False,,,,t5_2saej,,,,8j97c9,False,,,,7,True,no_ads,False,[],,dark,/r/infertility/comments/8j97c9/so_howd_it_go_for_all_of_you/,no_ads,False,https://www.reddit.com/r/infertility/comments/8j97c9/so_howd_it_go_for_all_of_you/,25376,1526267429.0,0,,False,False,{},,,,,,,,
11,2048,confidence,<praw.reddit.Reddit object at 0x7f2244aead90>,,infertility,[deleted],,False,,0,False,High TPO?,[],r/infertility,False,0,,0,,,False,t3_8j8rw2,False,dark,0.75,,public,2,0,{},,,False,[],,False,False,,{},,False,2,,,default,False,,,{},,True,,1526291818.0,text,0,,,,self.infertility,False,"<!-- SC_OFF --><div class=""md""><p>[deleted]</p>
</div><!-- SC_ON -->",,,,,True,False,False,False,False,[],[],False,False,False,False,,[],False,,,,t5_2saej,,,,8j8rw2,False,,,,2,True,no_ads,False,[],,dark,/r/infertility/comments/8j8rw2/high_tpo/,no_ads,False,https://www.reddit.com/r/infertility/comments/8j8rw2/high_tpo/,25376,1526263018.0,0,,False,False,{},,,,,,,,
12,2048,confidence,<praw.reddit.Reddit object at 0x7f2244aead90>,,infertility,"Short background: started with a new RE in our new state for IUI.  I’m 33, PCOS, secondary infertility.  Husband is 31, and fine.  First IUI we did 2.5 mg letrozole and 50 iu follistim.  I barely responded, so they bumped me to 100 iu and I had once nice follicle.  Triggered, IUI-ed and it was negative.

For this cycle, doctor upped all my meds.  5 mg of letrozole, 100 iu of follistim right off the bag. CD 10 scan (Thursday) showed 4 follicles selecting out, estradiol at 80.  Doctor said to continue with 100 iu follistim through Saturday night and come back Sunday (today) for a rescan and blood work.  Scan showed 1-18mm, 4-15mm and a couple smaller guys.  Estradiol was at 700.  He said it was up to us what we wanted to do regarding IUI, gave us a 20% chance of twins, HOM was 2-3% chance, overall pregnancy of any kind chance was 30%.  He said he was fine doing an IUI with these follicles, and said there’s a big difference between a 15 and an 18.

So far, we’ve triggered and that’s it.  Is going forward the right choice?

",t2_rkirc,False,,0,False,Wondering if we made the right choice,[],r/infertility,False,0,,0,,,False,t3_8j8hyo,False,dark,0.67,,public,1,0,{},,,False,[],,False,False,,{},PCOS,False,1,,False,self,False,,[],{},,True,,1526289043.0,text,0,,,text,self.infertility,False,"<!-- SC_OFF --><div class=""md""><p>Short background: started with a new RE in our new state for IUI.  I’m 33, PCOS, secondary infertility.  Husband is 31, and fine.  First IUI we did 2.5 mg letrozole and 50 iu follistim.  I barely responded, so they bumped me to 100 iu and I had once nice follicle.  Triggered, IUI-ed and it was negative.</p>

<p>For this cycle, doctor upped all my meds.  5 mg of letrozole, 100 iu of follistim right off the bag. CD 10 scan (Thursday) showed 4 follicles selecting out, estradiol at 80.  Doctor said to continue with 100 iu follistim through Saturday night and come back Sunday (today) for a rescan and blood work.  Scan showed 1-18mm, 4-15mm and a couple smaller guys.  Estradiol was at 700.  He said it was up to us what we wanted to do regarding IUI, gave us a 20% chance of twins, HOM was 2-3% chance, overall pregnancy of any kind chance was 30%.  He said he was fine doing an IUI with these follicles, and said there’s a big difference between a 15 and an 18.</p>

<p>So far, we’ve triggered and that’s it.  Is going forward the right choice?</p>
</div><!-- SC_ON -->",,,,,True,True,False,False,False,[],[],False,False,False,False,,[],False,,,,t5_2saej,,,,8j8hyo,True,,DaMeLaVaca,,3,True,no_ads,False,[],False,,/r/infertility/comments/8j8hyo/wondering_if_we_made_the_right_choice/,no_ads,False,https://www.reddit.com/r/infertility/comments/8j8hyo/wondering_if_we_made_the_right_choice/,25376,1526260243.0,0,,False,False,{},581aa492-92a6-11e4-b31e-22000b6d030b,,,,,,,
