85,2048,confidence,<praw.reddit.Reddit object at 0x7f2244aead90>,,infertility,,t2_zxlixtk,False,,0,False,First round fail,[],r/infertility,False,0,,0,140.0,,False,t3_8i8u2s,False,dark,0.63,,public,2,0,{},140.0,,False,[],,False,False,,{},,False,2,,False,default,False,,[],{},,False,,1525923751.0,text,0,,,text,self.IVF,True,,,,,,True,True,False,False,False,[],[],False,False,False,False,,[],False,,,,t5_2saej,,,,8i8u2s,True,,gman1719,,3,True,no_ads,False,[],False,,/r/infertility/comments/8i8u2s/first_round_fail/,no_ads,False,https://www.reddit.com/r/IVF/comments/8i8kmu/first_round_fail/,25376,1525894951.0,0,,False,False,{},,,,,"[{'approved_at_utc': None, 'subreddit': 'IVF', 'selftext': ""Hello, I've been lurking around on Reddit for a while, but never felt the need to contribute or post. I am posting here because my wife and I have been trying to get pregnant for 4 years now. We've done lui, tried many different medications, and this year decided to go further and attempt IVF. We just did the egg retrieval last week, and found out today that none of the the embryos made it. I'm at a bit of a loss Now, wondering what the next step is, or if there even is one, and where do we turn. It's pretty devastating and fresh right now. We can't afford to turn around and do another egg retrieval, at least not for another year. Wanted to post here to vent and see if anyone else had similar stories or advice or anything really. Thanks for reading "", 'author_fullname': 't2_zxlixtk', 'saved': False, 'mod_reason_title': None, 'gilded': 0, 'clicked': False, 'title': 'First round fail', 'link_flair_richtext': [], 'subreddit_name_prefixed': 'r/IVF', 'hidden': False, 'pwls': 0, 'link_flair_css_class': None, 'downs': 0, 'thumbnail_height': None, 'top_awarded_type': None, 'hide_score': False, 'name': 't3_8i8kmu', 'quarantine': False, 'link_flair_text_color': 'dark', 'upvote_ratio': 0.87, 'author_flair_background_color': None, 'subreddit_type': 'public', 'ups': 6, 'total_awards_received': 0, 'media_embed': {}, 'thumbnail_width': None, 'author_flair_template_id': None, 'is_original_content': False, 'user_reports': [], 'secure_media': None, 'is_reddit_media_domain': False, 'is_meta': False, 'category': None, 'secure_media_embed': {}, 'link_flair_text': None, 'can_mod_post': False, 'score': 6, 'approved_by': None, 'author_premium': False, 'thumbnail': 'self', 'edited': False, 'author_flair_css_class': None, 'author_flair_richtext': [], 'gildings': {}, 'content_categories': None, 'is_self': True, 'mod_note': None, 'created': 1525921741.0, 'link_flair_type': 'text', 'wls': 0, 'removed_by_category': None, 'banned_by': None, 'author_flair_type': 'text', 'domain': 'self.IVF', 'allow_live_comments': True, 'selftext_html': '<!-- SC_OFF --><div class=""md""><p>Hello, I&#39;ve been lurking around on Reddit for a while, but never felt the need to contribute or post. I am posting here because my wife and I have been trying to get pregnant for 4 years now. We&#39;ve done lui, tried many different medications, and this year decided to go further and attempt IVF. We just did the egg retrieval last week, and found out today that none of the the embryos made it. I&#39;m at a bit of a loss Now, wondering what the next step is, or if there even is one, and where do we turn. It&#39;s pretty devastating and fresh right now. We can&#39;t afford to turn around and do another egg retrieval, at least not for another year. Wanted to post here to vent and see if anyone else had similar stories or advice or anything really. Thanks for reading </p>\n</div><!-- SC_ON -->', 'likes': None, 'suggested_sort': None, 'banned_at_utc': None, 'view_count': None, 'archived': True, 'no_follow': False, 'is_crosspostable': False, 'pinned': False, 'over_18': False, 'all_awardings': [], 'awarders': [], 'media_only': False, 'can_gild': False, 'spoiler': False, 'locked': False, 'author_flair_text': None, 'treatment_tags': [], 'visited': False, 'removed_by': None, 'num_reports': None, 'distinguished': None, 'subreddit_id': 't5_2tkij', 'mod_reason_by': None, 'removal_reason': None, 'link_flair_background_color': '', 'id': '8i8kmu', 'is_robot_indexable': True, 'report_reasons': None, 'author': 'gman1719', 'discussion_type': None, 'num_comments': 8, 'send_replies': True, 'whitelist_status': 'no_ads', 'contest_mode': False, 'mod_reports': [], 'author_patreon_flair': False, 'author_flair_text_color': None, 'permalink': '/r/IVF/comments/8i8kmu/first_round_fail/', 'parent_whitelist_status': 'no_ads', 'stickied': False, 'url': 'https://www.reddit.com/r/IVF/comments/8i8kmu/first_round_fail/', 'subreddit_subscribers': 8947, 'created_utc': 1525892941.0, 'num_crossposts': 1, 'media': None, 'is_video': False}]",https://www.reddit.com/r/IVF/comments/8i8kmu/first_round_fail/,t3_8i8kmu,
86,2048,confidence,<praw.reddit.Reddit object at 0x7f2244aead90>,,infertility,This thread is for updates and discussion on active treatment ,t2_6l4z3,False,,0,False,Wednesday Afternoon ACTIVE Treatment Thread,[],r/infertility,False,0,,0,,,False,t3_8i8s6l,False,dark,0.75,,public,4,0,{},,,False,[],,False,False,,{},,False,4,,True,self,False,,[],{},,True,,1525923367.0,text,0,,,text,self.infertility,True,"<!-- SC_OFF --><div class=""md""><p>This thread is for updates and discussion on active treatment </p>
</div><!-- SC_ON -->",,,,,True,False,False,False,False,[],[],False,False,False,False,,[],False,,,moderator,t5_2saej,,,,8i8s6l,True,,AutoModerator,,41,False,no_ads,False,[],False,,/r/infertility/comments/8i8s6l/wednesday_afternoon_active_treatment_thread/,no_ads,False,https://www.reddit.com/r/infertility/comments/8i8s6l/wednesday_afternoon_active_treatment_thread/,25376,1525894567.0,0,,False,False,{},,,,,,,,
87,2048,confidence,<praw.reddit.Reddit object at 0x7f2244aead90>,,infertility,"Use this thread to share anything not necessarily related to infertility. Rant or rave, bitch, moan, share something funny, anything goes!
",t2_6l4z3,False,,0,False,Wednesday Afternoon Discussion Thread,[],r/infertility,False,0,,0,,,False,t3_8i8ben,False,dark,0.88,,public,6,0,{},,,False,[],,False,False,,{},,False,6,,True,self,False,,[],{},,True,,1525919768.0,text,0,,,text,self.infertility,True,"<!-- SC_OFF --><div class=""md""><p>Use this thread to share anything not necessarily related to infertility. Rant or rave, bitch, moan, share something funny, anything goes!</p>
</div><!-- SC_ON -->",,,,,True,False,False,False,False,[],[],False,False,False,False,,[],False,,,moderator,t5_2saej,,,,8i8ben,True,,AutoModerator,,49,False,no_ads,False,[],False,,/r/infertility/comments/8i8ben/wednesday_afternoon_discussion_thread/,no_ads,False,https://www.reddit.com/r/infertility/comments/8i8ben/wednesday_afternoon_discussion_thread/,25376,1525890968.0,0,,False,False,{},,,,,,,,
88,2048,confidence,<praw.reddit.Reddit object at 0x7f2244aead90>,,infertility,[deleted],,False,,0,False,First IUI failed,[],r/infertility,False,0,,0,,,False,t3_8i80d4,False,dark,0.71,,public,3,0,{},,,False,[],,False,False,,{},Update,False,3,,,default,False,,,{},,True,,1525917426.0,text,0,,,,self.infertility,False,"<!-- SC_OFF --><div class=""md""><p>[deleted]</p>
</div><!-- SC_ON -->",,,,,True,False,False,False,False,[],[],False,False,False,False,,[],False,,,,t5_2saej,,,,8i80d4,False,,,,25,True,no_ads,False,[],,dark,/r/infertility/comments/8i80d4/first_iui_failed/,no_ads,False,https://www.reddit.com/r/infertility/comments/8i80d4/first_iui_failed/,25376,1525888626.0,0,,False,False,{},83d27dc6-92a6-11e4-a3d9-22000b2284be,,,,,,,
89,2048,confidence,<praw.reddit.Reddit object at 0x7f2244aead90>,,infertility,[deleted],,False,,0,False,MA IVF coverage mandate restrictions,[],r/infertility,False,0,,0,,,False,t3_8i7nvo,False,dark,0.9,,public,8,0,{},,,False,[],,False,False,,{},Advice,False,8,,,default,False,,,{},,True,,1525914751.0,text,0,deleted,,,self.infertility,True,"<!-- SC_OFF --><div class=""md""><p>[deleted]</p>
</div><!-- SC_ON -->",,,,,True,False,False,False,False,[],[],False,False,False,False,,[],False,,,,t5_2saej,,,,8i7nvo,False,,,,21,True,no_ads,False,[],,dark,/r/infertility/comments/8i7nvo/ma_ivf_coverage_mandate_restrictions/,no_ads,False,https://www.reddit.com/r/infertility/comments/8i7nvo/ma_ivf_coverage_mandate_restrictions/,25376,1525885951.0,0,,False,False,{},1ae87cfc-92a6-11e4-8e5a-22000b26873e,,,,,,,
90,2048,confidence,<praw.reddit.Reddit object at 0x7f2244aead90>,,infertility,[deleted],,False,,0,False,SA Results - Does this mean IVF for us?,[],r/infertility,False,0,,0,,,False,t3_8i72rd,False,dark,1.0,,public,1,0,{},,,False,[],,False,False,,{},MFI,False,1,,,default,False,,,{},,True,,1525910116.0,text,0,,,,self.infertility,False,"<!-- SC_OFF --><div class=""md""><p>[deleted]</p>
</div><!-- SC_ON -->",,,,,True,True,False,False,False,[],[],False,False,False,False,,[],False,,,,t5_2saej,,,,8i72rd,False,,,,0,True,no_ads,False,[],,dark,/r/infertility/comments/8i72rd/sa_results_does_this_mean_ivf_for_us/,no_ads,False,https://www.reddit.com/r/infertility/comments/8i72rd/sa_results_does_this_mean_ivf_for_us/,25376,1525881316.0,0,,False,False,{},1e4bf4b4-92a6-11e4-b8e6-22000b6d030b,,,,,,,
91,2048,confidence,<praw.reddit.Reddit object at 0x7f2244aead90>,,infertility,[deleted],,False,,0,False,SA Results : (,[],r/infertility,False,0,,0,,,False,t3_8i6zpw,False,dark,1.0,,public,1,0,{},,,False,[],,False,False,,{},MFI,False,1,,,default,False,,,{},,True,,1525909504.0,text,0,,,,self.infertility,False,"<!-- SC_OFF --><div class=""md""><p>[deleted]</p>
</div><!-- SC_ON -->",,,,,True,True,False,False,False,[],[],False,False,False,False,,[],False,,,,t5_2saej,,,,8i6zpw,False,,,,0,True,no_ads,False,[],,dark,/r/infertility/comments/8i6zpw/sa_results/,no_ads,False,https://www.reddit.com/r/infertility/comments/8i6zpw/sa_results/,25376,1525880704.0,0,,False,False,{},1e4bf4b4-92a6-11e4-b8e6-22000b6d030b,,,,,,,
92,2048,confidence,<praw.reddit.Reddit object at 0x7f2244aead90>,,infertility,"I'm also having mood swings and forgetfulness. Normal?

When this is done I go on clomid, trigger shots, and my first either IUI or timed sexual intercourse. 

I'm new to all of this and exceptionally overwhelmed. ",t2_yi70p,False,,0,False,"Menorrhagia for Four weeks, RE put me on Provera two days in, bleeding seems worse? Is that normal?",[],r/infertility,False,0,,0,,,False,t3_8i6wfk,False,dark,0.75,,public,2,0,{},,,False,[],,False,False,,{},,False,2,,False,self,False,,[],{},,True,,1525908808.0,text,0,,,text,self.infertility,False,"<!-- SC_OFF --><div class=""md""><p>I&#39;m also having mood swings and forgetfulness. Normal?</p>

<p>When this is done I go on clomid, trigger shots, and my first either IUI or timed sexual intercourse. </p>

<p>I&#39;m new to all of this and exceptionally overwhelmed. </p>
</div><!-- SC_ON -->",,,,,True,False,False,False,False,[],[],False,False,False,False,,[],False,,,,t5_2saej,,,,8i6wfk,True,,GambitandRogue,,0,True,no_ads,False,[],False,,/r/infertility/comments/8i6wfk/menorrhagia_for_four_weeks_re_put_me_on_provera/,no_ads,False,https://www.reddit.com/r/infertility/comments/8i6wfk/menorrhagia_for_four_weeks_re_put_me_on_provera/,25376,1525880008.0,0,,False,False,{},,,,,,,,
93,2048,confidence,<praw.reddit.Reddit object at 0x7f2244aead90>,,infertility,"We have confirmed that our first FET \(A/B PGS normal\) is going to be a failure as my beta numbers are in decline. I asked my dr if there was any further diagnostic testing that we could do since this is the 2nd chemical pregnancy and 3rd overall miscarriage. I have DOR due to age, but that's it. Dr brought up an endometrial receptivity analysis but said it was somewhat new and expensive as it's not covered by insurance. I told him I would do some research and get back to him.

What do y'all know about ERA and are there any other tests that you would recommend?

FYI: I have had one pregnancy that ended in missed miscarriage at 7 weeks \(genetically normal\). I had a chemical pregnancy 3 months after my miscarriage and now this chemical pregnancy. I take lovenox and an aspirin a day due to history of DVT and MTHFR and have tested negative for the antibodies. We only have one embryo left from this cycle so I'm open to doing any diagnostic testing that I can to help my chances with embryo #2. Thanks!

Edit: Everything I've read about ERA says it's appropriate for implantation issues, so if I'm having chemical pregnancies and miscarriages, would this test even help?",t2_tjnvn,False,,0,False,ERA - Endometrial Receptivity Analysis,[],r/infertility,False,0,,0,,,False,t3_8i6mn5,False,dark,1.0,,public,4,0,{},,d70f54ce-930e-11e4-8710-22000b26873e,False,[],,False,False,,{},Advice,False,4,,False,self,False,,[],{},,True,,1525906736.0,text,0,,,text,self.infertility,True,"<!-- SC_OFF --><div class=""md""><p>We have confirmed that our first FET (A/B PGS normal) is going to be a failure as my beta numbers are in decline. I asked my dr if there was any further diagnostic testing that we could do since this is the 2nd chemical pregnancy and 3rd overall miscarriage. I have DOR due to age, but that&#39;s it. Dr brought up an endometrial receptivity analysis but said it was somewhat new and expensive as it&#39;s not covered by insurance. I told him I would do some research and get back to him.</p>

<p>What do y&#39;all know about ERA and are there any other tests that you would recommend?</p>

<p>FYI: I have had one pregnancy that ended in missed miscarriage at 7 weeks (genetically normal). I had a chemical pregnancy 3 months after my miscarriage and now this chemical pregnancy. I take lovenox and an aspirin a day due to history of DVT and MTHFR and have tested negative for the antibodies. We only have one embryo left from this cycle so I&#39;m open to doing any diagnostic testing that I can to help my chances with embryo #2. Thanks!</p>

<p>Edit: Everything I&#39;ve read about ERA says it&#39;s appropriate for implantation issues, so if I&#39;m having chemical pregnancies and miscarriages, would this test even help?</p>
</div><!-- SC_ON -->",,,,,True,False,False,False,False,[],[],False,False,False,False,36F | DOR | 1 MMC | 2 Stim | 1 IUI | 1 IVF w/ FET PGS,[],False,,,,t5_2saej,,,,8i6mn5,True,,mshelbym,,5,True,no_ads,False,[],False,dark,/r/infertility/comments/8i6mn5/era_endometrial_receptivity_analysis/,no_ads,False,https://www.reddit.com/r/infertility/comments/8i6mn5/era_endometrial_receptivity_analysis/,25376,1525877936.0,0,,False,False,{},1ae87cfc-92a6-11e4-8e5a-22000b26873e,,,,,,,
94,2048,confidence,<praw.reddit.Reddit object at 0x7f2244aead90>,,infertility,"Has anyone had their dr prescribe parlodel/bromocriptine for after their egg retrieval? They said i must take it for 10 days to keep the swelling down, but the side effects are awful. ",t2_3gcbr5o,False,,0,False,Parlodel/bromocriptine after egg retrieval?,[],r/infertility,False,0,,0,,,False,t3_8i5ths,False,dark,1.0,,public,1,0,{},,d70f54ce-930e-11e4-8710-22000b26873e,False,[],,False,False,,{},Medications,False,1,,False,self,False,,[],{},,True,,1525899985.0,text,0,,,text,self.infertility,True,"<!-- SC_OFF --><div class=""md""><p>Has anyone had their dr prescribe parlodel/bromocriptine for after their egg retrieval? They said i must take it for 10 days to keep the swelling down, but the side effects are awful. </p>
</div><!-- SC_ON -->",,,,,True,True,False,False,False,[],[],False,False,False,False,31F IVF for Balanced Translocation,[],False,,,,t5_2saej,,,,8i5ths,True,,Snookyroo,,6,True,no_ads,False,[],False,dark,/r/infertility/comments/8i5ths/parlodelbromocriptine_after_egg_retrieval/,no_ads,False,https://www.reddit.com/r/infertility/comments/8i5ths/parlodelbromocriptine_after_egg_retrieval/,25376,1525871185.0,0,,False,False,{},5dc2b0d8-92a6-11e4-a538-22000b6d030b,,,,,,,
95,2048,confidence,<praw.reddit.Reddit object at 0x7f2244aead90>,,infertility,"Okay, so Mother’s Day is fast approaching and last year I learned a LOT of things the hard way (and took notes).  I thought I’d start a little guide to Mother’s Day survival and we can crowdsource tips in the comments.

Ready?

Step one is to choose your survival shelter.  Mine is my bathtub (and also my couch).  The important thing here is to make sure it’s comfortable and isolated from the outside world. 

Step two, take care of all your holiday related errands.  If you still need to get your mom a gift, this is not a year to get something super-personal.  Pick something and move on.  

Whatever you do, *avoid the Mother’s Day card aisle at all costs.*  Do yourself a favor and head directly to the boxes of blank notecards and pick a design that will work for all the matriarchs you need to send cards to.  Bonus tip, put a piece of scrap paper in the box and keep track of who you’ve sent this design to.  

Step three is to stock your bunker with survival supplies.  You know those crazy people on disaster prep shows who have a room full of canned tuna, bullets, and wound dressings?  That needs be you, but with bath bombs, prosecco, sheet masks, and chocolate.  You don’t want to be unprepared when the apocalypse begins.  Treat yourself to a copy of a book you’ve been wanting to read or a new video game.  Anything that will get you out of your head a little bit.

Okay, so now you’re prepared for the inevitable destruction.  

On Friday at 5pm, delete all social media apps from your phone.  All of them.  If you choose to keep your Reddit app so you can snark with your fellow barren bitches, unsubscribe from the following subs:  pics, aww, funny, gifs, twoxchromosomes, and anything else likely to draw vomit inducing Mother’s Day posts.  

Lock yourself in your bunker (taping plastic over your windows  is optional) and DO NOT LEAVE YOUR DWELLING FOR ANY REASON.  The outside world will cease to exist for the next 72 hours. 

For those of you who have to work this weekend and can’t shelter in place, WE SALUTE YOU.  You are our heroes, you beautiful brave warriors.  

In Bolivia, Mother’s Day is celebrated on the anniversary of a battle in which the women took up arms to defend the freedom of their people.  Remember them as you enter bravely into battle with your own demons. Then get home as quick as you can for some well deserved self care.  

Do not, under any circumstances, look at social media until *at least* Tuesday morning.  

Practice excellent self-care this weekend friends.  You are not alone and your sisters have your back.  ❤️



*To our friends in other countries for whom this advice comes months too late, forgive me.  Grief  made me self-absorbed, and I forgot to get this up until it personally affected me.  To atone for my sins, I will commit ritual self-flagellation by looking at Instagram on Mother’s Day.  *",t2_yjkcd,False,,0,False,A guide to surviving Mother’s Day,[],r/infertility,False,0,,0,,,False,t3_8i51qn,False,dark,0.99,,public,160,0,{},,d70f54ce-930e-11e4-8710-22000b26873e,False,[],,False,False,,{},,False,160,,False,self,False,,[],{},,True,,1525892253.0,text,0,,,text,self.infertility,True,"<!-- SC_OFF --><div class=""md""><p>Okay, so Mother’s Day is fast approaching and last year I learned a LOT of things the hard way (and took notes).  I thought I’d start a little guide to Mother’s Day survival and we can crowdsource tips in the comments.</p>

<p>Ready?</p>

<p>Step one is to choose your survival shelter.  Mine is my bathtub (and also my couch).  The important thing here is to make sure it’s comfortable and isolated from the outside world. </p>

<p>Step two, take care of all your holiday related errands.  If you still need to get your mom a gift, this is not a year to get something super-personal.  Pick something and move on.  </p>

<p>Whatever you do, <em>avoid the Mother’s Day card aisle at all costs.</em>  Do yourself a favor and head directly to the boxes of blank notecards and pick a design that will work for all the matriarchs you need to send cards to.  Bonus tip, put a piece of scrap paper in the box and keep track of who you’ve sent this design to.  </p>

<p>Step three is to stock your bunker with survival supplies.  You know those crazy people on disaster prep shows who have a room full of canned tuna, bullets, and wound dressings?  That needs be you, but with bath bombs, prosecco, sheet masks, and chocolate.  You don’t want to be unprepared when the apocalypse begins.  Treat yourself to a copy of a book you’ve been wanting to read or a new video game.  Anything that will get you out of your head a little bit.</p>

<p>Okay, so now you’re prepared for the inevitable destruction.  </p>

<p>On Friday at 5pm, delete all social media apps from your phone.  All of them.  If you choose to keep your Reddit app so you can snark with your fellow barren bitches, unsubscribe from the following subs:  pics, aww, funny, gifs, twoxchromosomes, and anything else likely to draw vomit inducing Mother’s Day posts.  </p>

<p>Lock yourself in your bunker (taping plastic over your windows  is optional) and DO NOT LEAVE YOUR DWELLING FOR ANY REASON.  The outside world will cease to exist for the next 72 hours. </p>

<p>For those of you who have to work this weekend and can’t shelter in place, WE SALUTE YOU.  You are our heroes, you beautiful brave warriors.  </p>

<p>In Bolivia, Mother’s Day is celebrated on the anniversary of a battle in which the women took up arms to defend the freedom of their people.  Remember them as you enter bravely into battle with your own demons. Then get home as quick as you can for some well deserved self care.  </p>

<p>Do not, under any circumstances, look at social media until <em>at least</em> Tuesday morning.  </p>

<p>Practice excellent self-care this weekend friends.  You are not alone and your sisters have your back.  ❤️</p>

<p>*To our friends in other countries for whom this advice comes months too late, forgive me.  Grief  made me self-absorbed, and I forgot to get this up until it personally affected me.  To atone for my sins, I will commit ritual self-flagellation by looking at Instagram on Mother’s Day.  *</p>
</div><!-- SC_ON -->",,,,,True,False,False,False,False,[],[],False,False,False,False,"38, POF, Retired",[],False,,,,t5_2saej,,,,8i51qn,True,,PlumLion,,83,True,no_ads,False,[],False,dark,/r/infertility/comments/8i51qn/a_guide_to_surviving_mothers_day/,no_ads,False,https://www.reddit.com/r/infertility/comments/8i51qn/a_guide_to_surviving_mothers_day/,25376,1525863453.0,0,,False,False,{},,,,,,,,
96,2048,confidence,<praw.reddit.Reddit object at 0x7f2244aead90>,,infertility,"This thread is for updates and discussion on active treatment 
",t2_6l4z3,False,,0,False,Wednesday ACTIVE Treatment Thread,[],r/infertility,False,0,,0,,,False,t3_8i4o2b,False,dark,0.83,,public,4,0,{},,,False,[],,False,False,,{},,False,4,,True,self,False,,[],{},,True,,1525887385.0,text,0,,,text,self.infertility,True,"<!-- SC_OFF --><div class=""md""><p>This thread is for updates and discussion on active treatment </p>
</div><!-- SC_ON -->",,,,,True,False,False,False,False,[],[],False,False,False,False,,[],False,,,moderator,t5_2saej,,,,8i4o2b,True,,AutoModerator,,78,False,no_ads,False,[],False,,/r/infertility/comments/8i4o2b/wednesday_active_treatment_thread/,no_ads,False,https://www.reddit.com/r/infertility/comments/8i4o2b/wednesday_active_treatment_thread/,25376,1525858585.0,0,,False,False,{},,,,,,,,
97,2048,confidence,<praw.reddit.Reddit object at 0x7f2244aead90>,,infertility,"Use this thread to share anything not necessarily related to infertility. Rant or rave, bitch, moan, share something funny, anything goes!
",t2_6l4z3,False,,0,False,Wednesday Discussion Thread,[],r/infertility,False,0,,0,,,False,t3_8i4o1r,False,dark,0.75,,public,2,0,{},,,False,[],,False,False,,{},,False,2,,True,self,False,,[],{},,True,,1525887379.0,text,0,,,text,self.infertility,True,"<!-- SC_OFF --><div class=""md""><p>Use this thread to share anything not necessarily related to infertility. Rant or rave, bitch, moan, share something funny, anything goes!</p>
</div><!-- SC_ON -->",,,,,True,False,False,False,False,[],[],False,False,False,False,,[],False,,,moderator,t5_2saej,,,,8i4o1r,True,,AutoModerator,,41,False,no_ads,False,[],False,,/r/infertility/comments/8i4o1r/wednesday_discussion_thread/,no_ads,False,https://www.reddit.com/r/infertility/comments/8i4o1r/wednesday_discussion_thread/,25376,1525858579.0,0,,False,False,{},,,,,,,,
98,2048,confidence,<praw.reddit.Reddit object at 0x7f2244aead90>,,infertility,[deleted],,False,,0,False,User Name Change,[],r/infertility,False,0,,0,,,False,t3_8i3vu2,False,dark,0.99,,public,55,0,{},,,False,[],,False,False,,{},,False,55,,,default,1525853978.0,,,{},,True,,1525876892.0,text,0,,,,self.infertility,True,"<!-- SC_OFF --><div class=""md""><p>[deleted]</p>
</div><!-- SC_ON -->",,,,,True,False,False,False,False,[],[],False,False,False,False,,[],False,,,,t5_2saej,,,,8i3vu2,False,,,,13,True,no_ads,False,[],,dark,/r/infertility/comments/8i3vu2/user_name_change/,no_ads,False,https://www.reddit.com/r/infertility/comments/8i3vu2/user_name_change/,25376,1525848092.0,0,,False,False,{},,,,,,,,
