182,2048,confidence,<praw.reddit.Reddit object at 0x7f2244aead90>,,infertility,"My SO and I have been pursuing multiple fertility options (another ER for me, RIVF, and donor embryos) at this point in an effort to get more data about which one will offer us the best chance for success. We really thought that my SO would have better fertility than I do because of age and family history. It turns out that her situation is far more complex than my ovaries past their prime and a dusty ol' uterus.  

We initially discovered that she had an AFC of 1 as well as a fibroid. This information was complicated when her AMH came back at 2.6. The RE suggested that she pursue a clomid challenge since imaging was difficult with the fibroid blocking the view of her ovary and the clomid challenge would help us learn more about how she might respond to stims. The saline ultrasound showed that she most likely had a unicornuate uterus but the RE couldn't be 100% sure because of the fibroid. She mentioned at that time that she may only have one kidney due to the UU deformity. 

My SO just went in this week to have the initial ultrasound and bloodwork in order to start the clomid challenge. This time, the RE felt that the kidney on the other side was in the wrong place, calling it a ""pelvic kidney."" Because of all of these issues my SO now has to go get a MRI of her abdomen to see what the heck is going on in there. 

In the meantime her labs came back and her calcium level is high. This concerned me immediately because she doesn't take calcium supplements. I googled and the top hit was for hyperparathyroidism. Ok, not good but treatable. Then I started to wonder if her unique anatomy might have something to do with the levels and it turns out that hypercalcemia (high blood calcium) can be associated with kidney defects. Soooooooooo... this is turning out to be quite the rabbit hole, y'all. I'm feeling worried for her because this is a lot of news and given the calcium issues, probably even more poking and prodding is in her future as I'm sure there will be follow ups to figure out why her calcium is high. 

I'm sorta used to the medicalized life after having a chronic illness and now fertility shenanigans. She on the other hand is the type who never goes to the doctor or has health problems. I remember when that was me and how distressing it was when it all changed. This was NOT what we expected when we considered trying reciprocal at ALL (then again, pretty much nothing on this journey has been what we expected). At this point, I think it's pretty clear that reciprocal is probably out at least for a good long while until she sorts out all of these health problems we inadvertently uncovered---not that I even care, I just want her to be ok. I feel sad for her that she has to go through all of this. 


Has anyone here gone through this too? If you have UU did you also have a missing kidney/misplaced kidneys/kidney function problems? ",t2_rlo1n,False,,0,False,"Unicornuate Uterus, Pelvic Kidney, Elevated Calcium Levels-- anyone else?",[],r/infertility,False,0,,0,,,False,t3_8gtt2c,False,dark,0.88,,public,6,0,{},,d70f54ce-930e-11e4-8710-22000b26873e,False,[],,False,False,,{},,False,6,,False,self,1525391033.0,,[],{},,True,,1525410532.0,text,0,,,text,self.infertility,False,"<!-- SC_OFF --><div class=""md""><p>My SO and I have been pursuing multiple fertility options (another ER for me, RIVF, and donor embryos) at this point in an effort to get more data about which one will offer us the best chance for success. We really thought that my SO would have better fertility than I do because of age and family history. It turns out that her situation is far more complex than my ovaries past their prime and a dusty ol&#39; uterus.  </p>

<p>We initially discovered that she had an AFC of 1 as well as a fibroid. This information was complicated when her AMH came back at 2.6. The RE suggested that she pursue a clomid challenge since imaging was difficult with the fibroid blocking the view of her ovary and the clomid challenge would help us learn more about how she might respond to stims. The saline ultrasound showed that she most likely had a unicornuate uterus but the RE couldn&#39;t be 100% sure because of the fibroid. She mentioned at that time that she may only have one kidney due to the UU deformity. </p>

<p>My SO just went in this week to have the initial ultrasound and bloodwork in order to start the clomid challenge. This time, the RE felt that the kidney on the other side was in the wrong place, calling it a &quot;pelvic kidney.&quot; Because of all of these issues my SO now has to go get a MRI of her abdomen to see what the heck is going on in there. </p>

<p>In the meantime her labs came back and her calcium level is high. This concerned me immediately because she doesn&#39;t take calcium supplements. I googled and the top hit was for hyperparathyroidism. Ok, not good but treatable. Then I started to wonder if her unique anatomy might have something to do with the levels and it turns out that hypercalcemia (high blood calcium) can be associated with kidney defects. Soooooooooo... this is turning out to be quite the rabbit hole, y&#39;all. I&#39;m feeling worried for her because this is a lot of news and given the calcium issues, probably even more poking and prodding is in her future as I&#39;m sure there will be follow ups to figure out why her calcium is high. </p>

<p>I&#39;m sorta used to the medicalized life after having a chronic illness and now fertility shenanigans. She on the other hand is the type who never goes to the doctor or has health problems. I remember when that was me and how distressing it was when it all changed. This was NOT what we expected when we considered trying reciprocal at ALL (then again, pretty much nothing on this journey has been what we expected). At this point, I think it&#39;s pretty clear that reciprocal is probably out at least for a good long while until she sorts out all of these health problems we inadvertently uncovered---not that I even care, I just want her to be ok. I feel sad for her that she has to go through all of this. </p>

<p>Has anyone here gone through this too? If you have UU did you also have a missing kidney/misplaced kidneys/kidney function problems? </p>
</div><!-- SC_ON -->",,,,,True,False,False,False,False,[],[],False,False,False,False,38 | LGBT | MS dx | 4th IVF starts 7/2 ,[],False,,,,t5_2saej,,,,8gtt2c,True,,Makingaybies,,8,True,no_ads,False,[],False,dark,/r/infertility/comments/8gtt2c/unicornuate_uterus_pelvic_kidney_elevated_calcium/,no_ads,False,https://www.reddit.com/r/infertility/comments/8gtt2c/unicornuate_uterus_pelvic_kidney_elevated_calcium/,25376,1525381732.0,0,,False,False,{},,,,,,,,
183,2048,confidence,<praw.reddit.Reddit object at 0x7f2244aead90>,,infertility,,t2_17nja8y,False,,0,False,Disappointment and Confused with my IVF Medication Failure,[],r/infertility,False,0,,0,140.0,,False,t3_8gt7bt,False,dark,1.0,,public,1,0,{},140.0,d70f54ce-930e-11e4-8710-22000b26873e,False,[],,False,False,,{},,False,1,,False,default,False,,[],{},,False,,1525405757.0,text,0,,,text,self.stilltrying,False,,,,,,True,True,False,False,False,[],[],False,False,False,False,"29F [-1 tube/anovulation/MFI, TTC 2+ yrs] IVF #1 fail",[],False,,,,t5_2saej,,,,8gt7bt,False,,WillowCat89,,0,True,no_ads,False,[],False,dark,/r/infertility/comments/8gt7bt/disappointment_and_confused_with_my_ivf/,no_ads,False,https://www.reddit.com/r/stilltrying/comments/8gsy2g/disappointment_and_confused_with_my_ivf/,25376,1525376957.0,0,,False,False,{},,,,,"[{'approved_at_utc': None, 'subreddit': 'stilltrying', 'selftext': '[deleted]', 'user_reports': [], 'saved': False, 'mod_reason_title': None, 'gilded': 0, 'clicked': False, 'title': 'Disappointment and Confused with my IVF Medication Failure', 'link_flair_richtext': [], 'subreddit_name_prefixed': 'r/stilltrying', 'hidden': False, 'pwls': 0, 'link_flair_css_class': None, 'downs': 0, 'thumbnail_height': None, 'top_awarded_type': None, 'hide_score': False, 'name': 't3_8gsy2g', 'quarantine': False, 'link_flair_text_color': 'dark', 'upvote_ratio': 1.0, 'author_flair_background_color': '', 'subreddit_type': 'public', 'ups': 2, 'total_awards_received': 0, 'media_embed': {}, 'thumbnail_width': None, 'author_flair_template_id': None, 'is_original_content': False, 'secure_media': None, 'is_reddit_media_domain': False, 'is_meta': False, 'category': None, 'secure_media_embed': {}, 'link_flair_text': None, 'can_mod_post': False, 'score': 2, 'approved_by': None, 'thumbnail': 'default', 'edited': False, 'author_flair_css_class': None, 'gildings': {}, 'content_categories': None, 'is_self': True, 'mod_note': None, 'created': 1525403697.0, 'link_flair_type': 'text', 'wls': 0, 'removed_by_category': None, 'banned_by': None, 'domain': 'self.stilltrying', 'allow_live_comments': True, 'selftext_html': '<!-- SC_OFF --><div class=""md""><p>[deleted]</p>\n</div><!-- SC_ON -->', 'likes': None, 'suggested_sort': None, 'banned_at_utc': None, 'view_count': None, 'archived': True, 'no_follow': False, 'is_crosspostable': False, 'pinned': False, 'over_18': False, 'all_awardings': [], 'awarders': [], 'media_only': False, 'can_gild': False, 'spoiler': False, 'locked': False, 'author_flair_text': None, 'treatment_tags': [], 'visited': False, 'removed_by': None, 'num_reports': None, 'distinguished': None, 'subreddit_id': 't5_32ktv', 'mod_reason_by': None, 'removal_reason': None, 'link_flair_background_color': '', 'id': '8gsy2g', 'is_robot_indexable': False, 'report_reasons': None, 'author': '[deleted]', 'discussion_type': None, 'num_comments': 6, 'send_replies': True, 'whitelist_status': 'no_ads', 'contest_mode': False, 'mod_reports': [], 'author_flair_text_color': 'dark', 'permalink': '/r/stilltrying/comments/8gsy2g/disappointment_and_confused_with_my_ivf/', 'parent_whitelist_status': 'no_ads', 'stickied': False, 'url': 'https://www.reddit.com/r/stilltrying/comments/8gsy2g/disappointment_and_confused_with_my_ivf/', 'subreddit_subscribers': 7185, 'created_utc': 1525374897.0, 'num_crossposts': 1, 'media': None, 'is_video': False}]",https://www.reddit.com/r/stilltrying/comments/8gsy2g/disappointment_and_confused_with_my_ivf/,t3_8gsy2g,
184,2048,confidence,<praw.reddit.Reddit object at 0x7f2244aead90>,,infertility,This thread is for updates and discussion on active treatment ,t2_6l4z3,False,,0,False,Thursday Afternoon ACTIVE Treatment Thread,[],r/infertility,False,0,,0,,,False,t3_8gt3s1,False,dark,0.71,,public,3,0,{},,,False,[],,False,False,,{},,False,3,,True,self,False,,[],{},,True,,1525404966.0,text,0,,,text,self.infertility,True,"<!-- SC_OFF --><div class=""md""><p>This thread is for updates and discussion on active treatment </p>
</div><!-- SC_ON -->",,,,,True,False,False,False,False,[],[],False,False,False,False,,[],False,,,moderator,t5_2saej,,,,8gt3s1,True,,AutoModerator,,47,False,no_ads,False,[],False,,/r/infertility/comments/8gt3s1/thursday_afternoon_active_treatment_thread/,no_ads,False,https://www.reddit.com/r/infertility/comments/8gt3s1/thursday_afternoon_active_treatment_thread/,25376,1525376166.0,0,,False,False,{},,,,,,,,
185,2048,confidence,<praw.reddit.Reddit object at 0x7f2244aead90>,,infertility,"Use this thread to share anything not necessarily related to infertility. Rant or rave, bitch, moan, share something funny, anything goes!
",t2_6l4z3,False,,0,False,Thursday Afternoon Discussion Thread,[],r/infertility,False,0,,0,,,False,t3_8gsnf0,False,dark,0.82,,public,7,0,{},,,False,[],,False,False,,{},,False,7,,True,self,False,,[],{},,True,,1525401373.0,text,0,,,text,self.infertility,True,"<!-- SC_OFF --><div class=""md""><p>Use this thread to share anything not necessarily related to infertility. Rant or rave, bitch, moan, share something funny, anything goes!</p>
</div><!-- SC_ON -->",,,,,True,False,False,False,False,[],[],False,False,False,False,,[],False,,,moderator,t5_2saej,,,,8gsnf0,True,,AutoModerator,,90,False,no_ads,False,[],False,,/r/infertility/comments/8gsnf0/thursday_afternoon_discussion_thread/,no_ads,False,https://www.reddit.com/r/infertility/comments/8gsnf0/thursday_afternoon_discussion_thread/,25376,1525372573.0,0,,False,False,{},,,,,,,,
186,2048,confidence,<praw.reddit.Reddit object at 0x7f2244aead90>,,infertility,"There seems to be a national shortage or something. Does anyone know where to get it or have some to sell/donate?

Thank you.",t2_1idparu,False,,0,False,Progesterone in oil,[],r/infertility,False,0,,0,,,False,t3_8gsiy5,False,dark,0.75,,public,4,0,{},,d70f54ce-930e-11e4-8710-22000b26873e,False,[],,False,False,,{},,False,4,,False,self,False,,[],{},,True,,1525400378.0,text,0,,,text,self.infertility,False,"<!-- SC_OFF --><div class=""md""><p>There seems to be a national shortage or something. Does anyone know where to get it or have some to sell/donate?</p>

<p>Thank you.</p>
</div><!-- SC_ON -->",,,,,True,False,False,False,False,[],[],False,False,False,False,"37, F, long term TTC, unexplained ",[],False,,,,t5_2saej,,,,8gsiy5,True,,RC_2017,,27,True,no_ads,False,[],False,dark,/r/infertility/comments/8gsiy5/progesterone_in_oil/,no_ads,False,https://www.reddit.com/r/infertility/comments/8gsiy5/progesterone_in_oil/,25376,1525371578.0,0,,False,False,{},,,,,,,,
187,2048,confidence,<praw.reddit.Reddit object at 0x7f2244aead90>,,infertility,"My dermatologist says that it should be find to take doxycycline before and during my estrogen priming that's supposed to happen in a few days. Its being prescribed for an infected cyst (gross!).  My RE nurse says they rely on the ordering physician's recommendation.  That doxycycline is contraindicated during pregnancy, but we are just doing egg retrieval.  Can't help but wonder if this antibiotic will cause issues with the egg quality.  As if I needed something else to worry about!  Anyone else out there have experience with this?",t2_10imhm5s,False,,0,False,Safe to take antibiotic before and during estrogen priming?,[],r/infertility,False,0,,0,,,False,t3_8gsbam,False,dark,1.0,,public,3,0,{},,d70f54ce-930e-11e4-8710-22000b26873e,False,[],,False,False,,{},,False,3,,False,self,False,,[],{},,True,,1525398745.0,text,0,,,text,self.infertility,False,"<!-- SC_OFF --><div class=""md""><p>My dermatologist says that it should be find to take doxycycline before and during my estrogen priming that&#39;s supposed to happen in a few days. Its being prescribed for an infected cyst (gross!).  My RE nurse says they rely on the ordering physician&#39;s recommendation.  That doxycycline is contraindicated during pregnancy, but we are just doing egg retrieval.  Can&#39;t help but wonder if this antibiotic will cause issues with the egg quality.  As if I needed something else to worry about!  Anyone else out there have experience with this?</p>
</div><!-- SC_ON -->",,,,,True,False,False,False,False,[],[],False,False,False,False,37F | 2 MC | 4 IVF fails | 2nd FET w/ Donor Embryo 8/25/20,[],False,,,,t5_2saej,,,,8gsbam,True,,dogmom2412,,10,True,no_ads,False,[],False,dark,/r/infertility/comments/8gsbam/safe_to_take_antibiotic_before_and_during/,no_ads,False,https://www.reddit.com/r/infertility/comments/8gsbam/safe_to_take_antibiotic_before_and_during/,25376,1525369945.0,0,,False,False,{},,,,,,,,
188,2048,confidence,<praw.reddit.Reddit object at 0x7f2244aead90>,,infertility,"My fiance and I are young (22 and 23). We JUST started our life together. I just graduated college, he's in the Navy. We had a pretty solid plan that followed what we wanted pretty closely. Of course plans dont work out, we knew some things might change but it feels like we are on plan z instead of A or B (or even C). He was diagnosed with cancer last year. The treatment made him infertile so now we have to do IVF. The cancer MIGHT mean he cant do his job in the Navy anymore (so they will either move him to a different rate or medically discharge him - they keep stringing us along on that one). I haven't been able to get a job because I moved here in August and had to take care of my fiance until October but the navy said they were moving us in December so it wouldnt really look good for my first job out of college to only last 2 months. In december they said ""jk we'll move you n march"" so again I didnt get a job and in march they said ""jk. June. But forreal this time. We cant push it back any more"" (which they actually cant so thats nice) so I still didnt get a job. If he gets medically discharged it takes a while so we will again be put somewhere super temporarily and hopefully he finds a job in that time. Then theres all his cancer screenings and hoping he has insurance to cover them. And now we are trying to plan IVF but we are just starting and I'm afraid of getting pregnant so close to starting at a new job and I want to go to medical school after the kids are older so I don't really want to push it off more because of that.

Anyways. I'm just stressed and had to get that off my chest.",t2_qwq3v9y,False,,0,False,Up in the air (rant),[],r/infertility,False,0,,0,,,False,t3_8gr5zp,False,dark,0.9,,public,7,0,{},,d70f54ce-930e-11e4-8710-22000b26873e,False,[],,False,False,,{},,False,7,,False,self,False,,[],{},,True,,1525389735.0,text,0,,,text,self.infertility,True,"<!-- SC_OFF --><div class=""md""><p>My fiance and I are young (22 and 23). We JUST started our life together. I just graduated college, he&#39;s in the Navy. We had a pretty solid plan that followed what we wanted pretty closely. Of course plans dont work out, we knew some things might change but it feels like we are on plan z instead of A or B (or even C). He was diagnosed with cancer last year. The treatment made him infertile so now we have to do IVF. The cancer MIGHT mean he cant do his job in the Navy anymore (so they will either move him to a different rate or medically discharge him - they keep stringing us along on that one). I haven&#39;t been able to get a job because I moved here in August and had to take care of my fiance until October but the navy said they were moving us in December so it wouldnt really look good for my first job out of college to only last 2 months. In december they said &quot;jk we&#39;ll move you n march&quot; so again I didnt get a job and in march they said &quot;jk. June. But forreal this time. We cant push it back any more&quot; (which they actually cant so thats nice) so I still didnt get a job. If he gets medically discharged it takes a while so we will again be put somewhere super temporarily and hopefully he finds a job in that time. Then theres all his cancer screenings and hoping he has insurance to cover them. And now we are trying to plan IVF but we are just starting and I&#39;m afraid of getting pregnant so close to starting at a new job and I want to go to medical school after the kids are older so I don&#39;t really want to push it off more because of that.</p>

<p>Anyways. I&#39;m just stressed and had to get that off my chest.</p>
</div><!-- SC_ON -->",,,,,True,False,False,False,False,[],[],False,False,False,False,"23F, MFI, 2 ER, 2 transfer, 1MMC",[],False,,,,t5_2saej,,,,8gr5zp,True,,spermbankssavelives,,2,True,no_ads,False,[],False,dark,/r/infertility/comments/8gr5zp/up_in_the_air_rant/,no_ads,False,https://www.reddit.com/r/infertility/comments/8gr5zp/up_in_the_air_rant/,25376,1525360935.0,0,,False,False,{},,True,,,,,,
189,2048,confidence,<praw.reddit.Reddit object at 0x7f2244aead90>,,infertility,"I'm in the middle of a five-day dose of Letrozole (in prep for an IUI next week), and I am feeling super moody/sad. I can't tell if it's related to the drug or just life stress. Has anyone else encountered this while on Letrozole? Feel like I might be going a little crazy.",t2_x4d5a,False,,0,False,Feeling depressed/moody on Letrozole?,[],r/infertility,False,0,,0,,,False,t3_8gqzy8,False,dark,0.5,,public,0,0,{},,d70f54ce-930e-11e4-8710-22000b26873e,False,[],,False,False,,{},,False,0,,False,self,False,,[],{},,True,,1525388378.0,text,0,,,text,self.infertility,True,"<!-- SC_OFF --><div class=""md""><p>I&#39;m in the middle of a five-day dose of Letrozole (in prep for an IUI next week), and I am feeling super moody/sad. I can&#39;t tell if it&#39;s related to the drug or just life stress. Has anyone else encountered this while on Letrozole? Feel like I might be going a little crazy.</p>
</div><!-- SC_ON -->",,,,,True,True,False,False,False,[],[],False,False,False,False,"37F, unexplained, 4 IUI, 1 MC, 1 IVF, FET 11/18",[],False,,,,t5_2saej,,,,8gqzy8,True,,TheThirdBird,,12,True,no_ads,False,[],False,dark,/r/infertility/comments/8gqzy8/feeling_depressedmoody_on_letrozole/,no_ads,False,https://www.reddit.com/r/infertility/comments/8gqzy8/feeling_depressedmoody_on_letrozole/,25376,1525359578.0,0,,False,False,{},,,,,,,,
190,2048,confidence,<praw.reddit.Reddit object at 0x7f2244aead90>,,infertility,"While I have been awaiting a polyp removal a few days ago an ultrasound confirmed that the complex cyst (2.4 x 2.3) and endometrioma (2.2 x 2.0) that I was told was gone 8 months ago is actually still there. That means I'm at least at stage III endo. 

My doctor is suggesting that we go for a lapscropscy with the polyp removal and removal it all (including endometriomas). I was a bit dazed and couldnt process what she said about how to remove it. She said something like using different approaches depending on where the endo is and for cysts a 3 step process that includes draining, removing the wall, and then burning/cauterizing the node? We agreed that at the very least she will look in to stage the endo. I dont have pain concerns with endo, just fertility.

At the same time, I am on the funded IVF wait list with another doctor in about 6 months. What I am concerned about is whether the laparoscopy and removal of the cysts will diminish my ovarian reserve. 8 months ago it was measured at 19.03pmol/l (coverted to 2.6ng/ml by diving by 7.14). That means its already at the lower side of normal and potentially removing the cysts will put me in the DOR category as well.

My options are:
1. Remove all the endo but leave then endometriomas to prevent any injury to my ovarian reserve and proceed with IVF in 6 months. Try NAC for 3 months religiously to see if it decreases the endometriomas.
2. Remove all the endo and the endometrioma cysts and proceed with IVF in 6 months
3. Do not remove the endo, get staged or diagnoses through lapscropscy and proceed to IVF in 6 months.

Please please share your thoughts and recommendations. I need to decide soon as the hospital has to book the appropriate time for May 24th.

If I dont want to remove the cysts, is there a point in removing the endo elsewhere?  
Also has anyone tried NAC (N-Acetylcysteine)? Any opinions, experience would be greatly appreciated.",t2_ylna28y,False,,0,False,Remove cysts during Lap or avoid?,[],r/infertility,False,0,,0,,,False,t3_8gqqx4,False,dark,1.0,,public,6,0,{},,d70f54ce-930e-11e4-8710-22000b26873e,False,[],,False,False,,{},,False,6,,False,self,False,,[],{},,True,,1525386288.0,text,0,,,text,self.infertility,False,"<!-- SC_OFF --><div class=""md""><p>While I have been awaiting a polyp removal a few days ago an ultrasound confirmed that the complex cyst (2.4 x 2.3) and endometrioma (2.2 x 2.0) that I was told was gone 8 months ago is actually still there. That means I&#39;m at least at stage III endo. </p>

<p>My doctor is suggesting that we go for a lapscropscy with the polyp removal and removal it all (including endometriomas). I was a bit dazed and couldnt process what she said about how to remove it. She said something like using different approaches depending on where the endo is and for cysts a 3 step process that includes draining, removing the wall, and then burning/cauterizing the node? We agreed that at the very least she will look in to stage the endo. I dont have pain concerns with endo, just fertility.</p>

<p>At the same time, I am on the funded IVF wait list with another doctor in about 6 months. What I am concerned about is whether the laparoscopy and removal of the cysts will diminish my ovarian reserve. 8 months ago it was measured at 19.03pmol/l (coverted to 2.6ng/ml by diving by 7.14). That means its already at the lower side of normal and potentially removing the cysts will put me in the DOR category as well.</p>

<p>My options are:
1. Remove all the endo but leave then endometriomas to prevent any injury to my ovarian reserve and proceed with IVF in 6 months. Try NAC for 3 months religiously to see if it decreases the endometriomas.
2. Remove all the endo and the endometrioma cysts and proceed with IVF in 6 months
3. Do not remove the endo, get staged or diagnoses through lapscropscy and proceed to IVF in 6 months.</p>

<p>Please please share your thoughts and recommendations. I need to decide soon as the hospital has to book the appropriate time for May 24th.</p>

<p>If I dont want to remove the cysts, is there a point in removing the endo elsewhere?<br/>
Also has anyone tried NAC (N-Acetylcysteine)? Any opinions, experience would be greatly appreciated.</p>
</div><!-- SC_ON -->",,,,,True,False,False,False,False,[],[],False,False,False,False,"31F,  Stage IV Endo, IVF Aug/Sept",[],False,,,,t5_2saej,,,,8gqqx4,True,,flickr044,,10,True,no_ads,False,[],False,dark,/r/infertility/comments/8gqqx4/remove_cysts_during_lap_or_avoid/,no_ads,False,https://www.reddit.com/r/infertility/comments/8gqqx4/remove_cysts_during_lap_or_avoid/,25376,1525357488.0,0,,False,False,{},,,,,,,,
