261,2048,confidence,<praw.reddit.Reddit object at 0x7f2244aead90>,,infertility,"I'm not sure this deserves its own post, but after searching the interwebs for a week I feel more lost. I'm trying to find out if there are differences between primary ovarian insufficiency and endo-caused diminished ovarian reserve.

The story is my FSH just came back at 14, a month after getting an endo/adeno/blocked tube diagnosis. Everything I've read so far says this is the cutoff where doctors start suggesting donor eggs instead of own eggs. My E2 also came back as 21, and lower seemed good at first but then I read this is too low and is the estradiol level of menopausal women. 

My doctor suspected this was the case, that I would have damaged ovarian reserve (she already knew my antral follicle count was low). But I'm not sure if having a high FSH at 30 years old means I'm peri-menopausal (or will be before 40), and all that comes with it (like needing hormone replacement therapy to prevent osteoporosis, and scarily, parkinsons/dementia later on). Or, if because my FSH is caused by endo, it functions differently somehow and I won't need HRT? Maybe a lap would put FSH back to normal?

I've read through protocols of women with DOR and many do mini-IVF or natural-IVF, since they don't respond to meds; if my DOR is endo-caused, does that change the protocol at all or should it be the same, would you think? And is the donor egg recommendation still in place?

Thanks in advance. I've learned so much from this group of beautiful people and I'm really grateful for you all. 
",t2_r96v20u,False,,0,False,high FSH--anything different if caused by endo?,[],r/infertility,False,0,,0,,,False,t3_8ful0i,False,dark,1.0,,public,4,0,{},,d70f54ce-930e-11e4-8710-22000b26873e,False,[],,False,False,,{},,False,4,,False,self,False,,[],{},,True,,1525067196.0,text,0,,,text,self.infertility,True,"<!-- SC_OFF --><div class=""md""><p>I&#39;m not sure this deserves its own post, but after searching the interwebs for a week I feel more lost. I&#39;m trying to find out if there are differences between primary ovarian insufficiency and endo-caused diminished ovarian reserve.</p>

<p>The story is my FSH just came back at 14, a month after getting an endo/adeno/blocked tube diagnosis. Everything I&#39;ve read so far says this is the cutoff where doctors start suggesting donor eggs instead of own eggs. My E2 also came back as 21, and lower seemed good at first but then I read this is too low and is the estradiol level of menopausal women. </p>

<p>My doctor suspected this was the case, that I would have damaged ovarian reserve (she already knew my antral follicle count was low). But I&#39;m not sure if having a high FSH at 30 years old means I&#39;m peri-menopausal (or will be before 40), and all that comes with it (like needing hormone replacement therapy to prevent osteoporosis, and scarily, parkinsons/dementia later on). Or, if because my FSH is caused by endo, it functions differently somehow and I won&#39;t need HRT? Maybe a lap would put FSH back to normal?</p>

<p>I&#39;ve read through protocols of women with DOR and many do mini-IVF or natural-IVF, since they don&#39;t respond to meds; if my DOR is endo-caused, does that change the protocol at all or should it be the same, would you think? And is the donor egg recommendation still in place?</p>

<p>Thanks in advance. I&#39;ve learned so much from this group of beautiful people and I&#39;m really grateful for you all. </p>
</div><!-- SC_ON -->",,,,,True,False,False,False,False,[],[],False,False,False,False,"30, DOR, endo, adeno. Ivf 1 cp, 2 fail. DEivf in June",[],False,,,,t5_2saej,,,,8ful0i,True,,foundthetallesttree,,3,True,no_ads,False,[],False,dark,/r/infertility/comments/8ful0i/high_fshanything_different_if_caused_by_endo/,no_ads,False,https://www.reddit.com/r/infertility/comments/8ful0i/high_fshanything_different_if_caused_by_endo/,25376,1525038396.0,0,,False,False,{},,,,,,,,
262,2048,confidence,<praw.reddit.Reddit object at 0x7f2244aead90>,,infertility,[deleted],,False,,0,False,"I have BRCA 1 and a Very Large Dermoid Cyst, will this affect me negatively and has anyone else dealt with this?",[],r/infertility,False,0,,0,,,False,t3_8fu5gd,False,dark,0.67,,public,1,0,{},,,False,[],,False,False,,{},Advice,False,1,,,default,False,,,{},,True,,1525063383.0,text,0,,,,self.infertility,False,"<!-- SC_OFF --><div class=""md""><p>[deleted]</p>
</div><!-- SC_ON -->",,,,,True,True,False,False,False,[],[],False,False,False,False,,[],False,,,,t5_2saej,,,,8fu5gd,False,,,,1,True,no_ads,False,[],,dark,/r/infertility/comments/8fu5gd/i_have_brca_1_and_a_very_large_dermoid_cyst_will/,no_ads,False,https://www.reddit.com/r/infertility/comments/8fu5gd/i_have_brca_1_and_a_very_large_dermoid_cyst_will/,25376,1525034583.0,0,,False,False,{},1ae87cfc-92a6-11e4-8e5a-22000b26873e,,,,,,,
263,2048,confidence,<praw.reddit.Reddit object at 0x7f2244aead90>,,infertility,"But I got pregnant.  After ten years that was the first ever pregnancy.  That's kind of huge.  Yes, I lost the baby.  It fucking sucks.  But I've got more hope for future attempts.  We've got a protocol that seems to work.  Fingers crossed.  Just gotta keep looking on the bright side.

Still, FUCK MISCARRIAGES!  Spent three weeks in wondrous disbelief.  Guess the disbelief was founded.",t2_794pg,False,,0,False,Got to hang out at infertilitybabies for a few weeks. But I'm back now.,[],r/infertility,False,0,,0,,,False,t3_8ftorc,False,dark,0.99,,public,70,0,{},,d70f54ce-930e-11e4-8710-22000b26873e,False,[],,False,False,,{},,False,70,,False,self,False,,[],{},,True,,1525059385.0,text,0,,,text,self.infertility,True,"<!-- SC_OFF --><div class=""md""><p>But I got pregnant.  After ten years that was the first ever pregnancy.  That&#39;s kind of huge.  Yes, I lost the baby.  It fucking sucks.  But I&#39;ve got more hope for future attempts.  We&#39;ve got a protocol that seems to work.  Fingers crossed.  Just gotta keep looking on the bright side.</p>

<p>Still, FUCK MISCARRIAGES!  Spent three weeks in wondrous disbelief.  Guess the disbelief was founded.</p>
</div><!-- SC_ON -->",,,,,True,False,False,False,False,[],[],False,False,False,False,"36, trying since 07/2008, one miscarriage.  PCOS",[],False,,,,t5_2saej,,,,8ftorc,True,,Celt42,,37,True,no_ads,False,[],False,dark,/r/infertility/comments/8ftorc/got_to_hang_out_at_infertilitybabies_for_a_few/,no_ads,False,https://www.reddit.com/r/infertility/comments/8ftorc/got_to_hang_out_at_infertilitybabies_for_a_few/,25376,1525030585.0,0,,False,False,{},,,,,,,,
264,2048,confidence,<praw.reddit.Reddit object at 0x7f2244aead90>,,infertility,This thread is for updates and discussion on active treatment ,t2_6l4z3,False,,0,False,Sunday Afternoon ACTIVE Treatment Thread,[],r/infertility,False,0,,0,,,False,t3_8ftoqb,False,dark,0.75,,public,2,0,{},,,False,[],,False,False,,{},,False,2,,True,self,False,,[],{},,True,,1525059379.0,text,0,,,text,self.infertility,True,"<!-- SC_OFF --><div class=""md""><p>This thread is for updates and discussion on active treatment </p>
</div><!-- SC_ON -->",,,,,True,False,False,False,False,[],[],False,False,False,False,,[],False,,,moderator,t5_2saej,,,,8ftoqb,True,,AutoModerator,,23,False,no_ads,False,[],False,,/r/infertility/comments/8ftoqb/sunday_afternoon_active_treatment_thread/,no_ads,False,https://www.reddit.com/r/infertility/comments/8ftoqb/sunday_afternoon_active_treatment_thread/,25376,1525030579.0,0,,False,False,{},,,,,,,,
265,2048,confidence,<praw.reddit.Reddit object at 0x7f2244aead90>,,infertility,"Use this thread to share anything not necessarily related to infertility. Rant or rave, bitch, moan, share something funny, anything goes!
",t2_6l4z3,False,,0,False,Sunday Afternoon Discussion Thread,[],r/infertility,False,0,,0,,,False,t3_8ft9ta,False,dark,0.91,,public,9,0,{},,,False,[],,False,False,,{},,False,9,,True,self,False,,[],{},,True,,1525055781.0,text,0,,,text,self.infertility,True,"<!-- SC_OFF --><div class=""md""><p>Use this thread to share anything not necessarily related to infertility. Rant or rave, bitch, moan, share something funny, anything goes!</p>
</div><!-- SC_ON -->",,,,,True,False,False,False,False,[],[],False,False,False,False,,[],False,,,moderator,t5_2saej,,,,8ft9ta,True,,AutoModerator,,47,False,no_ads,False,[],False,,/r/infertility/comments/8ft9ta/sunday_afternoon_discussion_thread/,no_ads,False,https://www.reddit.com/r/infertility/comments/8ft9ta/sunday_afternoon_discussion_thread/,25376,1525026981.0,0,,False,False,{},,,,,,,,
266,2048,confidence,<praw.reddit.Reddit object at 0x7f2244aead90>,,infertility,"I am an egg donor, I took my ganirelix shot 45 minutes after I was supposed to but only an 25 hours after my last injection. Could I have potentially ovulated?",t2_g79yrv0,False,,0,False,Ganirelix question,[],r/infertility,False,0,,0,,,False,t3_8fsjy0,False,dark,0.8,,public,3,0,{},,,False,[],,False,False,,{},Medications,False,3,,False,self,False,,[],{},,True,,1525049460.0,text,0,,,text,self.infertility,True,"<!-- SC_OFF --><div class=""md""><p>I am an egg donor, I took my ganirelix shot 45 minutes after I was supposed to but only an 25 hours after my last injection. Could I have potentially ovulated?</p>
</div><!-- SC_ON -->",,,,,True,False,False,False,False,[],[],False,False,False,False,,[],False,,,,t5_2saej,,,,8fsjy0,True,,PaintedTurtleLady,,4,True,no_ads,False,[],False,,/r/infertility/comments/8fsjy0/ganirelix_question/,no_ads,False,https://www.reddit.com/r/infertility/comments/8fsjy0/ganirelix_question/,25376,1525020660.0,0,,False,False,{},5dc2b0d8-92a6-11e4-a538-22000b6d030b,,,,,,,
267,2048,confidence,<praw.reddit.Reddit object at 0x7f2244aead90>,,infertility,"MY second transfer (first FET) just failed and I am hoping I can get some direction here. If you had a failure how long before your RE see you after the failed FET? My RE hasnt even called me and the nurse said, she will be in touch soon. My guess is that she will just say bad luck. What should be my questions in my WTF meeting - There has been nothing unusual in my fertility check up and last time I checked with her, she was not in favor of ERA and endometrial biopsy",t2_18yliqv2,False,,0,False,PGS tested FET failed. Suggestions on next steps,[],r/infertility,False,0,,0,,,False,t3_8fsb28,False,dark,0.81,,public,3,0,{},,,False,[],,False,False,,{},,False,3,,False,self,False,,[],{},,True,,1525047267.0,text,0,,,text,self.infertility,True,"<!-- SC_OFF --><div class=""md""><p>MY second transfer (first FET) just failed and I am hoping I can get some direction here. If you had a failure how long before your RE see you after the failed FET? My RE hasnt even called me and the nurse said, she will be in touch soon. My guess is that she will just say bad luck. What should be my questions in my WTF meeting - There has been nothing unusual in my fertility check up and last time I checked with her, she was not in favor of ERA and endometrial biopsy</p>
</div><!-- SC_ON -->",,,,,True,False,False,False,False,[],[],False,False,False,False,,[],False,,,,t5_2saej,,,,8fsb28,True,,monkeygonecrazy,,9,True,no_ads,False,[],False,,/r/infertility/comments/8fsb28/pgs_tested_fet_failed_suggestions_on_next_steps/,no_ads,False,https://www.reddit.com/r/infertility/comments/8fsb28/pgs_tested_fet_failed_suggestions_on_next_steps/,25376,1525018467.0,0,,False,False,{},,,,,,,,
268,2048,confidence,<praw.reddit.Reddit object at 0x7f2244aead90>,,infertility,"Hello, have some unopened unused medications (gonalf 900 units) and one ovideral. currently do not have any need for the same. do not want to dispose them. Wanted to see if it is possible to donate it someplace where someone in need or self pay med can utilize it. 

from Boston. The doctor was unwilling to  provide any information. The pharmacy also did not take them back.

Do not want to waste it. Or any medical lockers available that one can rent to keep meds safe (as travelling for next 4-5 months)

Sorry if this is against the rules. Just need some guidance on where to send the meds so someone in need can use rather waste it.

Thanks in advance ",t2_yok0e,False,,0,False,Unused medications,[],r/infertility,False,0,,0,,,False,t3_8fs2p3,False,dark,1.0,,public,9,0,{},,,False,[],,False,False,,{},,False,9,,False,self,False,,[],{},,True,,1525045064.0,text,0,,,text,self.infertility,True,"<!-- SC_OFF --><div class=""md""><p>Hello, have some unopened unused medications (gonalf 900 units) and one ovideral. currently do not have any need for the same. do not want to dispose them. Wanted to see if it is possible to donate it someplace where someone in need or self pay med can utilize it. </p>

<p>from Boston. The doctor was unwilling to  provide any information. The pharmacy also did not take them back.</p>

<p>Do not want to waste it. Or any medical lockers available that one can rent to keep meds safe (as travelling for next 4-5 months)</p>

<p>Sorry if this is against the rules. Just need some guidance on where to send the meds so someone in need can use rather waste it.</p>

<p>Thanks in advance </p>
</div><!-- SC_ON -->",,,,,True,False,False,False,False,[],[],False,False,False,False,,[],False,,,,t5_2saej,,,,8fs2p3,True,,nodonaldplease,,5,True,no_ads,False,[],False,,/r/infertility/comments/8fs2p3/unused_medications/,no_ads,False,https://www.reddit.com/r/infertility/comments/8fs2p3/unused_medications/,25376,1525016264.0,0,,False,False,{},,,,,,,,
269,2048,confidence,<praw.reddit.Reddit object at 0x7f2244aead90>,,infertility,[deleted],,False,,0,False,Infertility on par with cancer diagnosis: Discusd,[],r/infertility,False,0,,0,,,False,t3_8fs0wv,False,dark,0.91,,public,32,0,{},,,False,[],,False,False,,{},,False,32,,,default,False,,,{},,True,,1525044581.0,text,0,,,,self.infertility,True,"<!-- SC_OFF --><div class=""md""><p>[deleted]</p>
</div><!-- SC_ON -->",,,,,True,False,False,False,False,[],[],False,False,False,False,,[],False,,,,t5_2saej,,,,8fs0wv,False,,,,44,True,no_ads,False,[],,dark,/r/infertility/comments/8fs0wv/infertility_on_par_with_cancer_diagnosis_discusd/,no_ads,False,https://www.reddit.com/r/infertility/comments/8fs0wv/infertility_on_par_with_cancer_diagnosis_discusd/,25376,1525015781.0,0,,False,False,{},,,,,,,,
270,2048,confidence,<praw.reddit.Reddit object at 0x7f2244aead90>,,infertility," I posted here about how our two friends recently gave birth and how I don't want to see their newborn. 

These same friends listened to us struggle to conceive for two years, but then failed to tell us that they started trying, then trapped us in their house to tell us they were successfully pregnant and bragged about how they were ""freaking out after trying for only 4 months"". 

Well, the husband messaged my husband. And he said;

""It hurts us that you haven't seen our daughter. My daughter is my biggest achievement.""

OK. Am I nuts? Is that not an incredibly horrifying thing to say to your ttc friends after 2 years? Your daughter is one week old. You conceived naturally. How the Hell is she an achievement? 

It really feels like they want tp flaunt their successful impregnation. Seriously. At first, I was just thinking that wasn't the case. Nobody gets pregnant to show off and compete. Now, I am thinking that partially, he wants to show off how he did it first. 

He then kind of threatened us, saying, ""well, we get your wife is upset, but the more time passes, the more hurt we get. By the time she feels better, it may be too late. We may be too hurt.""

So I pretty much do not want to see their baby for a long time now and am convinced my friends are selfish tools.",t2_ij477,False,,0,False,"It really seems like my ""friend"" is trying to flaunt to me.",[],r/infertility,False,0,,0,,,False,t3_8frs39,False,dark,0.88,,public,29,0,{},,,False,[],,False,False,,{},,False,29,,False,self,False,,[],{},,True,,1525042195.0,text,0,,,text,self.infertility,True,"<!-- SC_OFF --><div class=""md""><p>I posted here about how our two friends recently gave birth and how I don&#39;t want to see their newborn. </p>

<p>These same friends listened to us struggle to conceive for two years, but then failed to tell us that they started trying, then trapped us in their house to tell us they were successfully pregnant and bragged about how they were &quot;freaking out after trying for only 4 months&quot;. </p>

<p>Well, the husband messaged my husband. And he said;</p>

<p>&quot;It hurts us that you haven&#39;t seen our daughter. My daughter is my biggest achievement.&quot;</p>

<p>OK. Am I nuts? Is that not an incredibly horrifying thing to say to your ttc friends after 2 years? Your daughter is one week old. You conceived naturally. How the Hell is she an achievement? </p>

<p>It really feels like they want tp flaunt their successful impregnation. Seriously. At first, I was just thinking that wasn&#39;t the case. Nobody gets pregnant to show off and compete. Now, I am thinking that partially, he wants to show off how he did it first. </p>

<p>He then kind of threatened us, saying, &quot;well, we get your wife is upset, but the more time passes, the more hurt we get. By the time she feels better, it may be too late. We may be too hurt.&quot;</p>

<p>So I pretty much do not want to see their baby for a long time now and am convinced my friends are selfish tools.</p>
</div><!-- SC_ON -->",,,,,True,False,False,False,False,[],[],False,False,False,False,,[],False,,,,t5_2saej,,,,8frs39,True,,bloodrein,,82,True,no_ads,False,[],False,,/r/infertility/comments/8frs39/it_really_seems_like_my_friend_is_trying_to/,no_ads,False,https://www.reddit.com/r/infertility/comments/8frs39/it_really_seems_like_my_friend_is_trying_to/,25376,1525013395.0,0,,False,False,{},,,,,,,,
271,2048,confidence,<praw.reddit.Reddit object at 0x7f2244aead90>,,infertility,"I hope this is okay to post here - I have a question about my chart but I cannot find any answers specific to my situation as it relates to infertility treatments. My RE is closed today, but I will call tomorrow. If anyone has an experience with this, I'd appreciate hearing your thoughts.

I have super irregular periods and PCOS, and I am going to start my first round of Femara next cycle. Just yesterday I started the pill (brand: Apri) to 'reset' my body, give me a period, and then I'll start the Femara.

I track my BBT, and as of this morning my chart is now giving me crosshairs and saying I ovulated 5 days ago... I always have a slow rise so that is normal for me, but the temps/coverline *are* a bit lower than my past cycles, and I have never ovulated so early in my cycle before. [Chart here](https://www.fertilityfriend.com/home/druzymom/)

My questions:

I had a blood draw to check my hormones last weekend (four days before possible ovulation) and my RE said I could start the pill whenever because my cycle is so long usually, over 100-200 days. Would an upcoming ovulation show in the bloodwork, four days out?

Does the pill mess with my BBT so quickly, since I only took it yesterday afternoon? If I have actually ovulated, is it okay to keep taking the pill? Will my temps remain high because of the pill and not because I may have ovulated...?

Thank you for your time.",t2_14tzzr,False,,0,False,"Question re: BBT, bloodwork, and meds?",[],r/infertility,False,0,,0,,,False,t3_8frgdj,False,dark,0.67,,public,2,0,{},,d70f54ce-930e-11e4-8710-22000b26873e,False,[],,False,False,,{},,False,2,,False,self,False,,[],{},,True,,1525038852.0,text,0,,,text,self.infertility,True,"<!-- SC_OFF --><div class=""md""><p>I hope this is okay to post here - I have a question about my chart but I cannot find any answers specific to my situation as it relates to infertility treatments. My RE is closed today, but I will call tomorrow. If anyone has an experience with this, I&#39;d appreciate hearing your thoughts.</p>

<p>I have super irregular periods and PCOS, and I am going to start my first round of Femara next cycle. Just yesterday I started the pill (brand: Apri) to &#39;reset&#39; my body, give me a period, and then I&#39;ll start the Femara.</p>

<p>I track my BBT, and as of this morning my chart is now giving me crosshairs and saying I ovulated 5 days ago... I always have a slow rise so that is normal for me, but the temps/coverline <em>are</em> a bit lower than my past cycles, and I have never ovulated so early in my cycle before. <a href=""https://www.fertilityfriend.com/home/druzymom/"">Chart here</a></p>

<p>My questions:</p>

<p>I had a blood draw to check my hormones last weekend (four days before possible ovulation) and my RE said I could start the pill whenever because my cycle is so long usually, over 100-200 days. Would an upcoming ovulation show in the bloodwork, four days out?</p>

<p>Does the pill mess with my BBT so quickly, since I only took it yesterday afternoon? If I have actually ovulated, is it okay to keep taking the pill? Will my temps remain high because of the pill and not because I may have ovulated...?</p>

<p>Thank you for your time.</p>
</div><!-- SC_ON -->",,,,,True,True,False,False,False,[],[],False,False,False,False,PCOS,[],False,,,,t5_2saej,,,,8frgdj,True,,druzymom,,5,True,no_ads,False,[],False,dark,/r/infertility/comments/8frgdj/question_re_bbt_bloodwork_and_meds/,no_ads,False,https://www.reddit.com/r/infertility/comments/8frgdj/question_re_bbt_bloodwork_and_meds/,25376,1525010052.0,0,,False,False,{},,,self,"{'images': [{'source': {'url': 'https://external-preview.redd.it/s8RXY50klZFGK8IXrwvXx5hUlY_ozgvfI_LCmsZjQf8.jpg?auto=webp&s=770c4c1f07766fe12b32ec2f2c648ad59ab56234', 'width': 1118, 'height': 588}, 'resolutions': [{'url': 'https://external-preview.redd.it/s8RXY50klZFGK8IXrwvXx5hUlY_ozgvfI_LCmsZjQf8.jpg?width=108&crop=smart&auto=webp&s=edde11b94ccff89d2d474011e6f137343af2193a', 'width': 108, 'height': 56}, {'url': 'https://external-preview.redd.it/s8RXY50klZFGK8IXrwvXx5hUlY_ozgvfI_LCmsZjQf8.jpg?width=216&crop=smart&auto=webp&s=5033938a4d78cc0794156382c2337ef6be68826f', 'width': 216, 'height': 113}, {'url': 'https://external-preview.redd.it/s8RXY50klZFGK8IXrwvXx5hUlY_ozgvfI_LCmsZjQf8.jpg?width=320&crop=smart&auto=webp&s=e35fc32777d72b656e4c4f452e67abbd90d05ed7', 'width': 320, 'height': 168}, {'url': 'https://external-preview.redd.it/s8RXY50klZFGK8IXrwvXx5hUlY_ozgvfI_LCmsZjQf8.jpg?width=640&crop=smart&auto=webp&s=77e205335bc621905464e47fa41d316d828703c5', 'width': 640, 'height': 336}, {'url': 'https://external-preview.redd.it/s8RXY50klZFGK8IXrwvXx5hUlY_ozgvfI_LCmsZjQf8.jpg?width=960&crop=smart&auto=webp&s=c37297718c9a4d5f90e5f8d123650bf97513f5c9', 'width': 960, 'height': 504}, {'url': 'https://external-preview.redd.it/s8RXY50klZFGK8IXrwvXx5hUlY_ozgvfI_LCmsZjQf8.jpg?width=1080&crop=smart&auto=webp&s=1b7b4287585792b57ff50e2b5fbb64185a0b241d', 'width': 1080, 'height': 568}], 'variants': {}, 'id': '4VfPtC9xlSYNUbRH8P5Wl2rgwrQG0YOl7q3BNaVtxII'}], 'enabled': False}",,,,
272,2048,confidence,<praw.reddit.Reddit object at 0x7f2244aead90>,,infertility,[deleted],,False,,0,False,A huge thank you to our AMA contributors for NIAW!,[],r/infertility,False,0,,0,,,False,t3_8fra0l,False,dark,1.0,,public,95,0,{},,,False,[],,False,False,,{},,False,95,,,default,False,,,{},,True,,1525036661.0,text,0,deleted,,,self.infertility,True,"<!-- SC_OFF --><div class=""md""><p>[deleted]</p>
</div><!-- SC_ON -->",,,,,True,False,False,False,False,[],[],False,False,False,False,,[],False,,,moderator,t5_2saej,,,,8fra0l,False,,,,17,True,no_ads,False,[],,dark,/r/infertility/comments/8fra0l/a_huge_thank_you_to_our_ama_contributors_for_niaw/,no_ads,False,https://www.reddit.com/r/infertility/comments/8fra0l/a_huge_thank_you_to_our_ama_contributors_for_niaw/,25376,1525007861.0,0,,False,False,{},,,,,,,,
273,2048,confidence,<praw.reddit.Reddit object at 0x7f2244aead90>,,infertility,"My parents are visiting this weekend and I'm just having a very hard time with it. They know everything that's going on, and are so sweet and supportive, but I feel under a microscope. I'm genuinely depressed and ""not okay"" right now, and having to put on pants and go eat meals and have conversations is exhausting. I feel like a terrible daughter for dreading their visit and wanting them gone. They are getting older and won't be around for forever, so I'm trying to remember that, but it just makes me feel guiltier. Anyone else struggle with this?
",t2_q0ndi,False,,0,False,Difficulty being around family,[],r/infertility,False,0,,0,,,False,t3_8fqi27,False,dark,0.96,,public,17,0,{},,d70f54ce-930e-11e4-8710-22000b26873e,False,[],,False,False,,{},,False,17,,False,self,False,,[],{},,True,,1525025394.0,text,0,,,text,self.infertility,True,"<!-- SC_OFF --><div class=""md""><p>My parents are visiting this weekend and I&#39;m just having a very hard time with it. They know everything that&#39;s going on, and are so sweet and supportive, but I feel under a microscope. I&#39;m genuinely depressed and &quot;not okay&quot; right now, and having to put on pants and go eat meals and have conversations is exhausting. I feel like a terrible daughter for dreading their visit and wanting them gone. They are getting older and won&#39;t be around for forever, so I&#39;m trying to remember that, but it just makes me feel guiltier. Anyone else struggle with this?</p>
</div><!-- SC_ON -->",,,,,True,False,False,False,False,[],[],False,False,False,False,"41F, 3 m/c, 3 failed IVFs, 3 failed DE transfers, GC ",[],False,,,,t5_2saej,,,,8fqi27,True,,ladylara19,,10,True,no_ads,False,[],False,dark,/r/infertility/comments/8fqi27/difficulty_being_around_family/,no_ads,False,https://www.reddit.com/r/infertility/comments/8fqi27/difficulty_being_around_family/,25376,1524996594.0,0,,False,False,{},,,,,,,,
