106,2048,confidence,<praw.reddit.Reddit object at 0x7f2244aead90>,,infertility,"In order to keep this thread from getting completely overwhelming:

- Please edit your original post with any updates instead of posting again. If you have multiple updates over several days, you may wish to say “Edit Feb 3: xyz happened. Feb 5: abc happened.”  
- Edit your original post to thank people for their well wishes instead of responding Thank You! to every well wisher.  Use your best discretion as some comments do necessitate a response.

Welcome to the Infertility Results thread and discussion! You can post the outcome of your cycle here (be it positive or negative) in a way that is sensitive to the emotional needs of our unique community. **For the sake of members who are struggling with negative results and the difficult feelings that come with them, we request that all pregnancy announcements be shared only in this thread.** Partners/spouses are welcome to share the news here as well. This thread is for those to discuss early pregnancy, so long as you qualify with primary or secondary infertility, social infertility, pregnancy loss after infertility, and/or recurrent loss, regardless of treatment type or status. Please keep in mind that not everyone posting in this thread will be in the same positive head space, so take the lead of each OP and what he/she needs. 

Maybe you need to talk about your concerns but you aren't ready to move over to IFbabies yet? Or maybe your betas aren't rising like you were hoping? This is a safe space for post positive beta discussions, beta hell, beta limbo, or early IF pregnancy concerns.  Beta hell can be a real bitch, only made worse after infertility and/or previous loss. All results are welcome here, including home pregnancy tests and betas.

**If a doctor has deemed a pregnancy as non-viable, a D&C booked, or medication to induce miscarriage have been prescribed, posts can be moved back to the dailies with a trigger warning.** Any concerns about a potential chemical, miscarriage, bleeding, etc. should stay in here until a physician has confirmed your loss, as sometimes a pregnancy starts out scary and can turn out just fine.

For a comprehensive Beta database, check out http://www.betabase.info/ for more information on beta based on DPO (DPO = days post transfer + 3, 5, or 6 day embryo; DPO = Days post Insemination for IUI).

**You can find this and past results threads indexed in the top ""Read This"" sticky on the main page.** For the next stage of your journey, you may be interested in posting your story on r/whatworkedforme and we encourage you to continue to share your progress at our sister community, r/InfertilityBabies. Of course, you are always encouraged to share your non-pregnancy-related infertility experiences (and continue to support other community members) here on r/infertility.",t2_6l4z3,False,,0,False,Weekly Results Discussion 04/28 to 05/04,[],r/infertility,False,0,,0,,,False,t3_bi9ewt,False,dark,0.91,,public,16,0,{},,,False,[],,False,False,,{},Scheduled,False,16,,True,self,False,,[],{},,True,,1556471248.0,text,0,,,text,self.infertility,True,"<!-- SC_OFF --><div class=""md""><p>In order to keep this thread from getting completely overwhelming:</p>

<ul>
<li>Please edit your original post with any updates instead of posting again. If you have multiple updates over several days, you may wish to say “Edit Feb 3: xyz happened. Feb 5: abc happened.”<br/></li>
<li>Edit your original post to thank people for their well wishes instead of responding Thank You! to every well wisher.  Use your best discretion as some comments do necessitate a response.</li>
</ul>

<p>Welcome to the Infertility Results thread and discussion! You can post the outcome of your cycle here (be it positive or negative) in a way that is sensitive to the emotional needs of our unique community. <strong>For the sake of members who are struggling with negative results and the difficult feelings that come with them, we request that all pregnancy announcements be shared only in this thread.</strong> Partners/spouses are welcome to share the news here as well. This thread is for those to discuss early pregnancy, so long as you qualify with primary or secondary infertility, social infertility, pregnancy loss after infertility, and/or recurrent loss, regardless of treatment type or status. Please keep in mind that not everyone posting in this thread will be in the same positive head space, so take the lead of each OP and what he/she needs. </p>

<p>Maybe you need to talk about your concerns but you aren&#39;t ready to move over to IFbabies yet? Or maybe your betas aren&#39;t rising like you were hoping? This is a safe space for post positive beta discussions, beta hell, beta limbo, or early IF pregnancy concerns.  Beta hell can be a real bitch, only made worse after infertility and/or previous loss. All results are welcome here, including home pregnancy tests and betas.</p>

<p><strong>If a doctor has deemed a pregnancy as non-viable, a D&amp;C booked, or medication to induce miscarriage have been prescribed, posts can be moved back to the dailies with a trigger warning.</strong> Any concerns about a potential chemical, miscarriage, bleeding, etc. should stay in here until a physician has confirmed your loss, as sometimes a pregnancy starts out scary and can turn out just fine.</p>

<p>For a comprehensive Beta database, check out <a href=""http://www.betabase.info/"">http://www.betabase.info/</a> for more information on beta based on DPO (DPO = days post transfer + 3, 5, or 6 day embryo; DPO = Days post Insemination for IUI).</p>

<p><strong>You can find this and past results threads indexed in the top &quot;Read This&quot; sticky on the main page.</strong> For the next stage of your journey, you may be interested in posting your story on <a href=""/r/whatworkedforme"">r/whatworkedforme</a> and we encourage you to continue to share your progress at our sister community, <a href=""/r/InfertilityBabies"">r/InfertilityBabies</a>. Of course, you are always encouraged to share your non-pregnancy-related infertility experiences (and continue to support other community members) here on <a href=""/r/infertility"">r/infertility</a>.</p>
</div><!-- SC_ON -->",,new,,,True,False,False,False,False,[],[],False,False,False,False,,[],False,,,moderator,t5_2saej,,,,bi9ewt,True,,AutoModerator,,205,False,no_ads,False,[],False,,/r/infertility/comments/bi9ewt/weekly_results_discussion_0428_to_0504/,no_ads,False,https://www.reddit.com/r/infertility/comments/bi9ewt/weekly_results_discussion_0428_to_0504/,25378,1556442448.0,0,,False,False,{},,,,,,,,
107,2048,confidence,<praw.reddit.Reddit object at 0x7f2244aead90>,,infertility,"I get it. Sometimes there really is no explanation.

The thing is, that is what he told me at my very first consultation. Before he had done anything more than look at my records. I made an appointment for a consultation when my OB/GYN offered me a Clomid prescription when there was little to no evidence to suggest I was having ovulation issues; I figured an RE would know more and at the very least I could get a second opinion, maybe even do more to reach a specific diagnosis. The OB/GYN had ordered an HSG. It was clear. We also did a semen analysis and everything looked OK. So after a year of peeing on strips to track ovulation, we knew what it wasn't. But the RE didn't seem concerned with finding out what it was. In fact, he specifically discouraged me from looking for an answer and acted like there just wasn't one to be found.

But I doubt that. Because then we went on to do an ultrasound where the guy makes comments on whether my uterine lining looks good. Oh, and then there was the progesterone test I did. And there's the mention he made that IUI could circumvent cervical mucus issues.

So that's at least three fucking things it could be, two of which there are definitely tests for. I thought we were doing science.

But, no. Let's just call it unexplained fertility. Shoulder shrugs are great coming from medical professionals who are draining your bank account of thousands of dollars.

I do realize that, at a certain point, knowing what's ""wrong"" doesn't help if it's not going to change the recommended course of treatment. I'm assuming that's where the doctor was coming from. Apparently, he was bound to get some of the aforementioned data as part of a monitored IUI anyway. If we're looking for expediency, it seems this was the way to go. 

But that priority, that perspective, does nothing to help me, the patient, in dealing with it. It does not make me feel heard to be indirectly told that my reason for seeking treatment is essentially misguided because it's not just about results. In fact, it makes me feel like the doctor assumes I'm too stupid to follow the treatment. It does not make me feel in control of or more comfortable with my body to essentially be asked to have blind hope with every treatment. It makes me feel like my doctor really has no interest in my specific case, and makes me suspect that he's more focused on his numbers or his income than his patients. 

And I can't help but think that if we had found something closer to a cause than ""unexplained infertility"" he would have had an especially angry woman on his hands. 

Also, on a loosely related note: what kind of idiot thinks the best decorations for the waiting room of a clinic completely dedicated to treating infertility are giant pictures of babies and quotes about the joy of motherhood? That isn't hopeful or uplifting or comforting; it's painfully prodding an emotional bruise for every single person who goes in there, because literally no one who isn't having difficulty would be there. Even those who are there after getting a positive result we're at one point staring at the walls in a different context.

I just can't describe the level of cluelessness. I don't feel heard, let alone understood.",t2_j7z7w,False,,0,False,It feels like my RE is WAY too cavalier about unexplained fertility. (Vent),[],r/infertility,False,0,,0,,,False,t3_bi77px,False,dark,0.91,,public,32,0,{},,,False,[],,False,False,,{},,False,32,,False,self,False,,[],{},,True,,1556451692.0,text,0,,,text,self.infertility,False,"<!-- SC_OFF --><div class=""md""><p>I get it. Sometimes there really is no explanation.</p>

<p>The thing is, that is what he told me at my very first consultation. Before he had done anything more than look at my records. I made an appointment for a consultation when my OB/GYN offered me a Clomid prescription when there was little to no evidence to suggest I was having ovulation issues; I figured an RE would know more and at the very least I could get a second opinion, maybe even do more to reach a specific diagnosis. The OB/GYN had ordered an HSG. It was clear. We also did a semen analysis and everything looked OK. So after a year of peeing on strips to track ovulation, we knew what it wasn&#39;t. But the RE didn&#39;t seem concerned with finding out what it was. In fact, he specifically discouraged me from looking for an answer and acted like there just wasn&#39;t one to be found.</p>

<p>But I doubt that. Because then we went on to do an ultrasound where the guy makes comments on whether my uterine lining looks good. Oh, and then there was the progesterone test I did. And there&#39;s the mention he made that IUI could circumvent cervical mucus issues.</p>

<p>So that&#39;s at least three fucking things it could be, two of which there are definitely tests for. I thought we were doing science.</p>

<p>But, no. Let&#39;s just call it unexplained fertility. Shoulder shrugs are great coming from medical professionals who are draining your bank account of thousands of dollars.</p>

<p>I do realize that, at a certain point, knowing what&#39;s &quot;wrong&quot; doesn&#39;t help if it&#39;s not going to change the recommended course of treatment. I&#39;m assuming that&#39;s where the doctor was coming from. Apparently, he was bound to get some of the aforementioned data as part of a monitored IUI anyway. If we&#39;re looking for expediency, it seems this was the way to go. </p>

<p>But that priority, that perspective, does nothing to help me, the patient, in dealing with it. It does not make me feel heard to be indirectly told that my reason for seeking treatment is essentially misguided because it&#39;s not just about results. In fact, it makes me feel like the doctor assumes I&#39;m too stupid to follow the treatment. It does not make me feel in control of or more comfortable with my body to essentially be asked to have blind hope with every treatment. It makes me feel like my doctor really has no interest in my specific case, and makes me suspect that he&#39;s more focused on his numbers or his income than his patients. </p>

<p>And I can&#39;t help but think that if we had found something closer to a cause than &quot;unexplained infertility&quot; he would have had an especially angry woman on his hands. </p>

<p>Also, on a loosely related note: what kind of idiot thinks the best decorations for the waiting room of a clinic completely dedicated to treating infertility are giant pictures of babies and quotes about the joy of motherhood? That isn&#39;t hopeful or uplifting or comforting; it&#39;s painfully prodding an emotional bruise for every single person who goes in there, because literally no one who isn&#39;t having difficulty would be there. Even those who are there after getting a positive result we&#39;re at one point staring at the walls in a different context.</p>

<p>I just can&#39;t describe the level of cluelessness. I don&#39;t feel heard, let alone understood.</p>
</div><!-- SC_ON -->",,,,,True,False,False,False,False,[],[],False,False,False,False,,[],False,,,,t5_2saej,,,,bi77px,True,,SilverSealingWax,,28,True,no_ads,False,[],False,,/r/infertility/comments/bi77px/it_feels_like_my_re_is_way_too_cavalier_about/,no_ads,False,https://www.reddit.com/r/infertility/comments/bi77px/it_feels_like_my_re_is_way_too_cavalier_about/,25378,1556422892.0,0,,False,False,{},,,,,,,,
108,2048,confidence,<praw.reddit.Reddit object at 0x7f2244aead90>,,infertility,"I am so angry right now I just need to vent!! 

Hubby and I have been TTC for over 2 years now with not even a sniff of a positive. I've been very resistant to going for fertility tests as I suffer from bipolar and I have been met with varying opinions on whether or not people with bipolar should have children (a whole other rant I won't go into!!)

I finally decided enough was enough and I booked my first appointment to get the ball rolling yesterday. Unfortunately I work a job where my shifts are never the same each week so it took me and the receptionist a while to find an appointment that coincided with my days off. Appointment booked and confirmed for 9:50am on 8th May. Yay!!

I get my shifts emailed to me and this evening I saw an email so clicked on it. It was for a different store that I have done maybe 3 shifts at to help out in the 14 months I've worked for my company. It showed I was on the Rota for Wednesday 8th from 7:30am to 4pm!!!

Immediately texted my boss to say I can't work this shift due to doctors appointment and that I can work the afternoon part if they need me. Bare in mind that this is NOT my store, I am not obligated to work there as part of my contract and I was not asked to do this shift before being put on the Rota.

I swiftly got a message back telling me that I have other days off I can change my appointment to (nope, receptionist and I went through all days and this was the only one in the next few weeks) and that I need to speak to the boss of the other store but she probably can't change it either. Also my boss does not know when other boss is working so I can talk to her.

So it looks like I'm either going to have to fight my boss and the other boss for this day off or cancel my appointment until I can work out when I'm next free to see the specialist.

ARRRRGGGGHHHH!!!",t2_3isaa0bu,False,,0,False,Rant warning! Finally book a doctor's appointment on a day off... now I have to work?,[],r/infertility,False,0,,0,,,False,t3_bi3byb,False,dark,0.4,,public,0,0,{},,,False,[],,False,False,,{},,False,0,,False,self,1556397716.0,,[],{},,True,,1556426307.0,text,0,,,text,self.infertility,False,"<!-- SC_OFF --><div class=""md""><p>I am so angry right now I just need to vent!! </p>

<p>Hubby and I have been TTC for over 2 years now with not even a sniff of a positive. I&#39;ve been very resistant to going for fertility tests as I suffer from bipolar and I have been met with varying opinions on whether or not people with bipolar should have children (a whole other rant I won&#39;t go into!!)</p>

<p>I finally decided enough was enough and I booked my first appointment to get the ball rolling yesterday. Unfortunately I work a job where my shifts are never the same each week so it took me and the receptionist a while to find an appointment that coincided with my days off. Appointment booked and confirmed for 9:50am on 8th May. Yay!!</p>

<p>I get my shifts emailed to me and this evening I saw an email so clicked on it. It was for a different store that I have done maybe 3 shifts at to help out in the 14 months I&#39;ve worked for my company. It showed I was on the Rota for Wednesday 8th from 7:30am to 4pm!!!</p>

<p>Immediately texted my boss to say I can&#39;t work this shift due to doctors appointment and that I can work the afternoon part if they need me. Bare in mind that this is NOT my store, I am not obligated to work there as part of my contract and I was not asked to do this shift before being put on the Rota.</p>

<p>I swiftly got a message back telling me that I have other days off I can change my appointment to (nope, receptionist and I went through all days and this was the only one in the next few weeks) and that I need to speak to the boss of the other store but she probably can&#39;t change it either. Also my boss does not know when other boss is working so I can talk to her.</p>

<p>So it looks like I&#39;m either going to have to fight my boss and the other boss for this day off or cancel my appointment until I can work out when I&#39;m next free to see the specialist.</p>

<p>ARRRRGGGGHHHH!!!</p>
</div><!-- SC_ON -->",,,,,True,True,False,False,False,[],[],False,False,False,False,,[],False,,,,t5_2saej,,,,bi3byb,True,,creative_anxiety,,12,True,no_ads,False,[],False,,/r/infertility/comments/bi3byb/rant_warning_finally_book_a_doctors_appointment/,no_ads,False,https://www.reddit.com/r/infertility/comments/bi3byb/rant_warning_finally_book_a_doctors_appointment/,25378,1556397507.0,0,,False,False,{},,,,,,,,
109,2048,confidence,<praw.reddit.Reddit object at 0x7f2244aead90>,,infertility,"Hey everyone.  I’m hoping this is the correct place for this, and makes sense... if not I apologize.
Here we go:
I just finished up my second cycle of gonal-f with IC and progesterone and got an hcg of only 5.9 three weeks ago. Then over 48hrs went down to 5.7, and 48hrs after that down to 5.0.   I then got a very heavy, painful period.. We figured chemical pregnancy/early miscarriage, and deemed not viable.   But then this Thursday hcg went up to 24 , which concerned the doctor... today it is down again at 18.  I have no symptoms of pregnancy or pain/bleeding otherwise.

My RE is concerned it could be an ectopic or just hormones messing around.  He wouldn’t lean in one direction 

My problem is that  in late March we had made the decision to take a break after all this miscarriage stuff...  and booked a trip to go to a family wedding in Mexico,  knowing we would discontinue fertility treatments for 3-6 months due to Zika.  The trip is booked and we are supposed to leave Monday morning at 5am.  
However, now RE is advising that unless hcg is 0, we should completely cancel the trip and continue being monitored until hcg is 0.  This seems rather drastic to me considering hcg is going down (slowly) and is very low in the first place

I guess my question is, knowing that hcg is super low, and going lower again after this blip... should I cancel and wait around to watch it go down (which can take months to get to 0, as I’ve experienced in the past) or just go to Mexico and return to be monitored in a week.  Or should I be cautious of the small chance of an ectopic and cancel the trip?  It’s such a low chance! I’m so confused!!!  Is the doctor advising this way just to cover himself and not be liable if something where to happen if I left? 

I should also note I had a previous ectopic (lost a tube) 2yrs ago, and it took over 3wks until it was confirmed and had the surgery, and my hcg was over 13000 at that point. Will one week of monitoring really make a difference if this is what’s happening again?  How likely is it that I am in danger here with hcg this low? Am I being completely stupid wanting to still go on vacation !?!? 

Also, I have a history of 3 chemical/early miscarriages, and an ectopic (lost a tube) over the past 2.5yrs.  

I am devastated. I am exhausted.  I just want to go on this vacation with my family and go to this important wedding. Any advise or support/information would be greatly appreciated. TIA

(Really sorry if this makes no sense and I just verbally threw-up all over you with this rant. Blah! I’m over-the-edge stressed about it all)",t2_27722bi2,False,,0,False,advice/support needed. TRIGGER WARNING: Mcg,[],r/infertility,False,0,,0,,,False,t3_bi2mxo,False,dark,0.85,,public,13,0,{},,d70f54ce-930e-11e4-8710-22000b26873e,False,[],,False,False,,{},TW: Miscarriage/Loss,False,13,,False,self,1556394069.0,,[],{},,True,,1556422135.0,text,0,,,text,self.infertility,False,"<!-- SC_OFF --><div class=""md""><p>Hey everyone.  I’m hoping this is the correct place for this, and makes sense... if not I apologize.
Here we go:
I just finished up my second cycle of gonal-f with IC and progesterone and got an hcg of only 5.9 three weeks ago. Then over 48hrs went down to 5.7, and 48hrs after that down to 5.0.   I then got a very heavy, painful period.. We figured chemical pregnancy/early miscarriage, and deemed not viable.   But then this Thursday hcg went up to 24 , which concerned the doctor... today it is down again at 18.  I have no symptoms of pregnancy or pain/bleeding otherwise.</p>

<p>My RE is concerned it could be an ectopic or just hormones messing around.  He wouldn’t lean in one direction </p>

<p>My problem is that  in late March we had made the decision to take a break after all this miscarriage stuff...  and booked a trip to go to a family wedding in Mexico,  knowing we would discontinue fertility treatments for 3-6 months due to Zika.  The trip is booked and we are supposed to leave Monday morning at 5am.<br/>
However, now RE is advising that unless hcg is 0, we should completely cancel the trip and continue being monitored until hcg is 0.  This seems rather drastic to me considering hcg is going down (slowly) and is very low in the first place</p>

<p>I guess my question is, knowing that hcg is super low, and going lower again after this blip... should I cancel and wait around to watch it go down (which can take months to get to 0, as I’ve experienced in the past) or just go to Mexico and return to be monitored in a week.  Or should I be cautious of the small chance of an ectopic and cancel the trip?  It’s such a low chance! I’m so confused!!!  Is the doctor advising this way just to cover himself and not be liable if something where to happen if I left? </p>

<p>I should also note I had a previous ectopic (lost a tube) 2yrs ago, and it took over 3wks until it was confirmed and had the surgery, and my hcg was over 13000 at that point. Will one week of monitoring really make a difference if this is what’s happening again?  How likely is it that I am in danger here with hcg this low? Am I being completely stupid wanting to still go on vacation !?!? </p>

<p>Also, I have a history of 3 chemical/early miscarriages, and an ectopic (lost a tube) over the past 2.5yrs.  </p>

<p>I am devastated. I am exhausted.  I just want to go on this vacation with my family and go to this important wedding. Any advise or support/information would be greatly appreciated. TIA</p>

<p>(Really sorry if this makes no sense and I just verbally threw-up all over you with this rant. Blah! I’m over-the-edge stressed about it all)</p>
</div><!-- SC_ON -->",,,,,True,False,False,False,False,[],[],False,False,False,False,34F/Idiopathic IF/RPL +1 ectopic/IVF next!,[],False,,,,t5_2saej,,,#dadada,bi2mxo,True,,Daisy_Girl7965,,18,True,no_ads,False,[],False,dark,/r/infertility/comments/bi2mxo/advicesupport_needed_trigger_warning_mcg/,no_ads,False,https://www.reddit.com/r/infertility/comments/bi2mxo/advicesupport_needed_trigger_warning_mcg/,25378,1556393335.0,0,,False,False,{},,,,,,,1939cb0e-1524-11e9-a01e-0e1796ff099a,
