185,2048,confidence,<praw.reddit.Reddit object at 0x7f2244aead90>,,infertility,"The Active treatment thread is for updates on your current cycle, questions about medications, or advice on easier/basic questions.  Find a cycle buddy, commiserate on side effects, or cheer on your peers as they endure the hunger games.  

We suggest trying to sort comments by NEW to help out folks that may not have gotten responses from someone already.  We recognize that the AM/PM disctinction doesn't match up with every time zone in our global community, just pick the most recently posted one where ever you are.

Stand alone posts can be used for more complex topics such as asking for opinions on studies, introducing yourself with your medical history, or asking more complex questions around treatment plans, etc.",t2_6l4z3,False,,0,False,Tuesday AM ACTIVE Treatment Thread,[],r/infertility,False,0,,0,,,False,t3_bgemid,False,dark,0.83,,public,8,0,{},,,False,[],,False,False,,{},Scheduled,False,8,,True,self,False,,[],{},,True,,1556042901.0,text,0,,,text,self.infertility,False,"<!-- SC_OFF --><div class=""md""><p>The Active treatment thread is for updates on your current cycle, questions about medications, or advice on easier/basic questions.  Find a cycle buddy, commiserate on side effects, or cheer on your peers as they endure the hunger games.  </p>

<p>We suggest trying to sort comments by NEW to help out folks that may not have gotten responses from someone already.  We recognize that the AM/PM disctinction doesn&#39;t match up with every time zone in our global community, just pick the most recently posted one where ever you are.</p>

<p>Stand alone posts can be used for more complex topics such as asking for opinions on studies, introducing yourself with your medical history, or asking more complex questions around treatment plans, etc.</p>
</div><!-- SC_ON -->",,new,,,True,False,False,False,False,[],[],False,False,False,False,,[],False,,,moderator,t5_2saej,,,,bgemid,True,,AutoModerator,,86,False,no_ads,False,[],False,,/r/infertility/comments/bgemid/tuesday_am_active_treatment_thread/,no_ads,False,https://www.reddit.com/r/infertility/comments/bgemid/tuesday_am_active_treatment_thread/,25378,1556014101.0,0,,False,False,{},,,,,,,,
186,2048,confidence,<praw.reddit.Reddit object at 0x7f2244aead90>,,infertility,"Use this thread to share anything NOT necessarily related to infertility or treatment. Rant, rave, bitch, moan, share something funny, post a picture of your pet, anything goes!  Nothing is off-topic here.  It is a great place to get to know the parts of people that aren't always consumed with infertility.

If you have questions or updates on treatment, consider the Active Treatment thread instead!",t2_6l4z3,False,,0,False,Tuesday AM Chat Thread,[],r/infertility,False,0,,0,,,False,t3_bgemgv,False,dark,0.81,,public,10,0,{},,,False,[],,False,False,,{},Scheduled,False,10,,True,self,False,,[],{},,True,,1556042893.0,text,0,,,text,self.infertility,False,"<!-- SC_OFF --><div class=""md""><p>Use this thread to share anything NOT necessarily related to infertility or treatment. Rant, rave, bitch, moan, share something funny, post a picture of your pet, anything goes!  Nothing is off-topic here.  It is a great place to get to know the parts of people that aren&#39;t always consumed with infertility.</p>

<p>If you have questions or updates on treatment, consider the Active Treatment thread instead!</p>
</div><!-- SC_ON -->",,new,,,True,False,False,False,False,[],[],False,False,False,False,,[],False,,,moderator,t5_2saej,,,,bgemgv,True,,AutoModerator,,101,False,no_ads,False,[],False,,/r/infertility/comments/bgemgv/tuesday_am_chat_thread/,no_ads,False,https://www.reddit.com/r/infertility/comments/bgemgv/tuesday_am_chat_thread/,25378,1556014093.0,0,,False,False,{},,,,,,,,
187,2048,confidence,<praw.reddit.Reddit object at 0x7f2244aead90>,,infertility," Dallas peeps. This year at the Walk of Hope, one of the sponsoring clinics will be giving away a round of Effortless IVF (Invocell).  If you meet the medical requirements and are interested in entering, you will need to sign up and meet the fundraising requirement of $75.  I am not an organizer for this event so I can't offer more information, but it should be fairly comprehensive on the website provided below. 

https://www.classy.org/event/2019-dallas-walk-of-hope/e207899",t2_ielxg,False,,0,False,Dallas Walk of Hope IVF Giveaway,[],r/infertility,False,0,,0,,,False,t3_bgbklg,False,dark,0.88,,public,13,0,{},,,False,[],,False,False,,{},,False,13,,False,self,False,,[],{},,True,,1556019526.0,text,0,,,text,self.infertility,False,"<!-- SC_OFF --><div class=""md""><p>Dallas peeps. This year at the Walk of Hope, one of the sponsoring clinics will be giving away a round of Effortless IVF (Invocell).  If you meet the medical requirements and are interested in entering, you will need to sign up and meet the fundraising requirement of $75.  I am not an organizer for this event so I can&#39;t offer more information, but it should be fairly comprehensive on the website provided below. </p>

<p><a href=""https://www.classy.org/event/2019-dallas-walk-of-hope/e207899"">https://www.classy.org/event/2019-dallas-walk-of-hope/e207899</a></p>
</div><!-- SC_ON -->",,,,,True,False,False,False,False,[],[],False,False,False,False,MFI+DOR | 1 Failed IVF | Donor embryo FETs,[],False,,,,t5_2saej,,,,bgbklg,True,,GIMME_ALL_THE_BABIES,,0,True,no_ads,False,[],False,dark,/r/infertility/comments/bgbklg/dallas_walk_of_hope_ivf_giveaway/,no_ads,False,https://www.reddit.com/r/infertility/comments/bgbklg/dallas_walk_of_hope_ivf_giveaway/,25378,1555990726.0,0,,False,False,{},,self,"{'images': [{'source': {'url': 'https://external-preview.redd.it/ySmZ83o6P42yw2f9ooxhSrgQpt88zXHTONBc5LZNQD8.jpg?auto=webp&s=6c964c7ab33a15ba0d203ef62930e55f2c01636e', 'width': 550, 'height': 366}, 'resolutions': [{'url': 'https://external-preview.redd.it/ySmZ83o6P42yw2f9ooxhSrgQpt88zXHTONBc5LZNQD8.jpg?width=108&crop=smart&auto=webp&s=2883ff1310d0252f5a79bda614aa86025184d0b1', 'width': 108, 'height': 71}, {'url': 'https://external-preview.redd.it/ySmZ83o6P42yw2f9ooxhSrgQpt88zXHTONBc5LZNQD8.jpg?width=216&crop=smart&auto=webp&s=12373524c15075b0d3f8a40730e622867ee00d3f', 'width': 216, 'height': 143}, {'url': 'https://external-preview.redd.it/ySmZ83o6P42yw2f9ooxhSrgQpt88zXHTONBc5LZNQD8.jpg?width=320&crop=smart&auto=webp&s=e7519a08c2bf422639a60222723e34b6202dbb84', 'width': 320, 'height': 212}], 'variants': {}, 'id': '48XKMelAl7Llu-NoBIboyH9ZSiY-0JqW9lmIgp17RGU'}], 'enabled': False}",,,,,
188,2048,confidence,<praw.reddit.Reddit object at 0x7f2244aead90>,,infertility,"We haven't done any fertility treatments since February.  

It's a blessing and a curse.  Not worrying about meds or timed intercourse or whatever else is relieving..

I think it's hitting me hard lately with people around me having success and seeing things about Niaw. 

I just feel like all these months not in treatment is a waste.  But its also smart not to just dump money into something that probably won't work",t2_li05rou,False,,0,False,Just waiting,[],r/infertility,False,0,,0,,,False,t3_bgbeo7,False,dark,0.29,,public,0,0,{},,d70f54ce-930e-11e4-8710-22000b26873e,False,[],,False,False,,{},,False,0,,False,self,False,,[],{},,True,,1556018536.0,text,0,,,text,self.infertility,False,"<!-- SC_OFF --><div class=""md""><p>We haven&#39;t done any fertility treatments since February.  </p>

<p>It&#39;s a blessing and a curse.  Not worrying about meds or timed intercourse or whatever else is relieving..</p>

<p>I think it&#39;s hitting me hard lately with people around me having success and seeing things about Niaw. </p>

<p>I just feel like all these months not in treatment is a waste.  But its also smart not to just dump money into something that probably won&#39;t work</p>
</div><!-- SC_ON -->",,,,,True,True,False,False,False,[],[],False,False,False,False,28f. 5+iui. Ivf#1 Nov. ,[],False,,,,t5_2saej,,,,bgbeo7,True,,kiki0228,,4,True,no_ads,False,[],False,dark,/r/infertility/comments/bgbeo7/just_waiting/,no_ads,False,https://www.reddit.com/r/infertility/comments/bgbeo7/just_waiting/,25378,1555989736.0,0,,False,False,{},,,,,,,,
189,2048,confidence,<praw.reddit.Reddit object at 0x7f2244aead90>,,infertility,"Retrieval was 1 long cycle ago. Trigger shot had me bleeding in no time. Insurance took a while to approve my transfer which made me wait till my next cycle, which never came. March 15th was my last period. I went in for blood work 2 weeks ago, they told me I haven't ovulated yet. That was days before I was due. (Thought I might have been pregnant. Stupid me).  Started to spot but it feels wrong. No sore boobs. Period just feels off. I don't think I went through this the first time.",t2_11xvem,False,,0,False,Is it normal to wait ~6 weeks for period?,[],r/infertility,False,0,,0,,,False,t3_bga8k1,False,dark,0.67,,public,2,0,{},,d70f54ce-930e-11e4-8710-22000b26873e,False,[],,False,False,,{},,False,2,,False,self,False,,[],{},,True,,1556011587.0,text,0,,,text,self.infertility,False,"<!-- SC_OFF --><div class=""md""><p>Retrieval was 1 long cycle ago. Trigger shot had me bleeding in no time. Insurance took a while to approve my transfer which made me wait till my next cycle, which never came. March 15th was my last period. I went in for blood work 2 weeks ago, they told me I haven&#39;t ovulated yet. That was days before I was due. (Thought I might have been pregnant. Stupid me).  Started to spot but it feels wrong. No sore boobs. Period just feels off. I don&#39;t think I went through this the first time.</p>
</div><!-- SC_ON -->",,,,,True,False,False,False,False,[],[],False,False,False,False,40F/Endo/2mc/IVF #1 mc/IVF#2 2019,[],False,,,,t5_2saej,,,,bga8k1,True,,Sugafree23,,6,True,no_ads,False,[],False,dark,/r/infertility/comments/bga8k1/is_it_normal_to_wait_6_weeks_for_period/,no_ads,False,https://www.reddit.com/r/infertility/comments/bga8k1/is_it_normal_to_wait_6_weeks_for_period/,25378,1555982787.0,0,,False,False,{},,,,,,,,
190,2048,confidence,<praw.reddit.Reddit object at 0x7f2244aead90>,,infertility,"My immediate family knows that my husband and I have been struggling with infertility, and that the last year has been full of tests and doctors appointments and meds and surgeries, etc. Overall they have been kind and supportive but giving lots of space and not asking too many questions, which is great. We are hoping to start IVF soon but our doctors have said that with my fertility and medical issues there are a lot of risks and challenges ahead and we are trying to be realistic and not get our hopes up too high.

My sister is expecting her second child (after dealing with multiple miscarriages) and I’m genuinely thrilled for her and her husband.  This weekend at our big family Easter lunch she made a public announcement about the pregnancy. I knew it was coming and am glad she got to have her moment, but it was still so hard for me. Not long after, her husband started complaining to me and my husband about how hard it’s going to be with two kids- and I didn’t say anything but had to walk away from the conversation.  I’m afraid if I’m not careful I’m going to let my current fears and emotions and grief about my own situation overcloud my happiness for my sister and her husband. My husband has been so supportive with everything but doesn’t seem to understand why I’m upset. Am I being melodramatic?",t2_3n2f66xu,False,,0,False,Holidays and public announcements,[],r/infertility,False,0,,0,,,False,t3_bga887,False,dark,0.9,,public,8,0,{},,d70f54ce-930e-11e4-8710-22000b26873e,False,[],,False,False,,{},,False,8,,False,self,False,,[],{},,True,,1556011533.0,text,0,,,text,self.infertility,True,"<!-- SC_OFF --><div class=""md""><p>My immediate family knows that my husband and I have been struggling with infertility, and that the last year has been full of tests and doctors appointments and meds and surgeries, etc. Overall they have been kind and supportive but giving lots of space and not asking too many questions, which is great. We are hoping to start IVF soon but our doctors have said that with my fertility and medical issues there are a lot of risks and challenges ahead and we are trying to be realistic and not get our hopes up too high.</p>

<p>My sister is expecting her second child (after dealing with multiple miscarriages) and I’m genuinely thrilled for her and her husband.  This weekend at our big family Easter lunch she made a public announcement about the pregnancy. I knew it was coming and am glad she got to have her moment, but it was still so hard for me. Not long after, her husband started complaining to me and my husband about how hard it’s going to be with two kids- and I didn’t say anything but had to walk away from the conversation.  I’m afraid if I’m not careful I’m going to let my current fears and emotions and grief about my own situation overcloud my happiness for my sister and her husband. My husband has been so supportive with everything but doesn’t seem to understand why I’m upset. Am I being melodramatic?</p>
</div><!-- SC_ON -->",,,,,True,False,False,False,False,[],[],False,False,False,False,"38F, 3 ERs; pursuing a GC",[],False,,,,t5_2saej,,,,bga887,True,,graycatbird98,,9,True,no_ads,False,[],False,dark,/r/infertility/comments/bga887/holidays_and_public_announcements/,no_ads,False,https://www.reddit.com/r/infertility/comments/bga887/holidays_and_public_announcements/,25378,1555982733.0,0,,False,False,{},,,,,,,,
191,2048,confidence,<praw.reddit.Reddit object at 0x7f2244aead90>,,infertility," 

Hi Everyone. I'm Dr. Aimee Eyvazzadeh, a Reproductive Endocrinologist in the SF Bay Area. You can read more about me here:  [https://www.draimee.org/about](https://www.draimee.org/about). I'm really looking forward to taking your questions. The information I share with you during this AMA is not in place of advice from your personal physician. I do not have any conflicts of interest. I do a weekly show on [YouTube.com/eggwhisperershow](https://YouTube.com/eggwhisperershow). I'll be back at 5PM PDT to answer your questions.",t2_15vayc,False,,0,False,"2019 NIAW AMA Event Dr Aimee REI, specializing in Personalized Fertility Care, AMA",[],r/infertility,False,0,,0,,,False,t3_bg8ws3,False,dark,0.89,,public,39,0,{},,,False,[],,False,False,,{},AMA Event,False,39,,False,self,False,,[],{},,True,,1556003916.0,text,0,,,text,self.infertility,True,"<!-- SC_OFF --><div class=""md""><p>Hi Everyone. I&#39;m Dr. Aimee Eyvazzadeh, a Reproductive Endocrinologist in the SF Bay Area. You can read more about me here:  <a href=""https://www.draimee.org/about"">https://www.draimee.org/about</a>. I&#39;m really looking forward to taking your questions. The information I share with you during this AMA is not in place of advice from your personal physician. I do not have any conflicts of interest. I do a weekly show on <a href=""https://YouTube.com/eggwhisperershow"">YouTube.com/eggwhisperershow</a>. I&#39;ll be back at 5PM PDT to answer your questions.</p>
</div><!-- SC_ON -->",,,,,True,False,False,False,False,[],[],False,False,False,False,AMA Host ⭐️,[],False,,,,t5_2saej,,,#dadada,bg8ws3,True,,DrAimeeEggWhisperer,,184,True,no_ads,False,[],False,dark,/r/infertility/comments/bg8ws3/2019_niaw_ama_event_dr_aimee_rei_specializing_in/,no_ads,False,https://www.reddit.com/r/infertility/comments/bg8ws3/2019_niaw_ama_event_dr_aimee_rei_specializing_in/,25378,1555975116.0,0,,False,False,{},,self,"{'images': [{'source': {'url': 'https://external-preview.redd.it/X_YR2lNcZ1vTbRtEx-vfc3O21mXmwyj1ghQj3A-vJCI.jpg?auto=webp&s=878ba6c61b41aa39a5d87987e527cdd6335420c1', 'width': 400, 'height': 600}, 'resolutions': [{'url': 'https://external-preview.redd.it/X_YR2lNcZ1vTbRtEx-vfc3O21mXmwyj1ghQj3A-vJCI.jpg?width=108&crop=smart&auto=webp&s=8d61e2dc4cf56a1c19a49f3ff08f42161c960c77', 'width': 108, 'height': 162}, {'url': 'https://external-preview.redd.it/X_YR2lNcZ1vTbRtEx-vfc3O21mXmwyj1ghQj3A-vJCI.jpg?width=216&crop=smart&auto=webp&s=93f4daed9624843b96a385cc541dc7ae6282b4dc', 'width': 216, 'height': 324}, {'url': 'https://external-preview.redd.it/X_YR2lNcZ1vTbRtEx-vfc3O21mXmwyj1ghQj3A-vJCI.jpg?width=320&crop=smart&auto=webp&s=9870d8022203443de419ef9d31dc83c348743192', 'width': 320, 'height': 480}], 'variants': {}, 'id': 'l6fwKR7BNpta-4iN_7JoXzOnKw49gJ4j4YAPDF4xGBM'}], 'enabled': False}",,,,7b980e10-7a28-11e8-ab3a-0eea2e641734,"[{'permalink': 'https://www.reddit.com/r/infertility/collection/1969812f-9da5-4cdf-a907-bc33b7dced50', 'link_ids': ['t3_bgzzcf', 't3_bg8ws3', 't3_bgiiq6', 't3_bggam7', 't3_bhd4iq', 't3_bhazcg'], 'description': '', 'title': '2019 AMA Events', 'created_at_utc': 1558548490.862, 'subreddit_id': 't5_2saej', 'author_name': 'dawndilioso', 'collection_id': '1969812f-9da5-4cdf-a907-bc33b7dced50', 'author_id': 't2_14rwut', 'last_update_utc': 1558548733.536, 'display_layout': None}]"
192,2048,confidence,<praw.reddit.Reddit object at 0x7f2244aead90>,,infertility,"Quick history- DOR and endo (excision lap) 
3 canceled cycles, 1 pregnancy from converted IUI MC@8 weeks. 3 egg retrieval’s with current clinic. All gonal f 225, menopur 150, prednisone, HGH, dual trigger. Cycle 1&2 EPP, natural start cycle 3.

Cycle 1- 6R, 4M, 3F, 3B frozen
Cycle 2- 4R, 2M, 2F, 1B frozen
Cycle 3- 3R, 2M, 2F, 2 day 3 transfer- negative

Went to a consult with CCRM, head spinning a bit, so much information. They would recommend EPP with patches opposed to estradiol which I used in the past. He believes I was getting too much estrogen which was causing my very slow/no response in the canceled cycles- He thinks patches deliver it more evenly. Similar antagonist protocol but with clomid I think (didn’t give me an exact protocol).

Freeze all, pgs test, bcp w/letrozole or orlissa to address endo (I’m anti depot lupron but he would prefer that) one month prior to FET. 

We also did karyotyping for mr beans and myself. His mother had some issues getting pregnant and my father had very low sperm count. My sister also has DOR (but became pregnant cycle one 🙄), so he’s curious to see if there’s any genetic issues. 

My current clinic was willing to try MDL for this upcoming cycle in attempts to switch things up. They generally don’t use estrogen patches or clomid in their protocols. We would do a fresh day 5 transfer because that’s what I would like. CCRM said absolutely no fresh transfer because of the endo, so I would reconsider this.

I basically need to decide tonight which clinic to go with. Financially it’s about a 5,000 difference which is a lot but not a deal breaker. I like my current RE, new RE seemed a little arrogant but given his success rate, rightly so. My only complaint with my current clinic is their use of the same protocol each time, new clinic has a lot of different protocols.

How did you break up with your RE?
Should I email my current RE and tell her that we met with this other RE? I don’t know the specifics of what protocol this RE would use so couldn’t even ask her to try it. I feel bad since I really do like her. I know it’s not personal but it feels it. I hate hate hate confrontation and also know that I may need to go back to them in the future (we could only afford 1 cycle at CCRM). 

Again, sorry for the lengthy stand alone. Thank you ladies for any insight you might have.",t2_1juhyx5x,False,,0,False,Apologize for standard alone but need to feedback on DOR protocols and changing clinics right before start date,[],r/infertility,False,0,,0,,,False,t3_bg7dn9,False,dark,0.72,,public,3,0,{},,d70f54ce-930e-11e4-8710-22000b26873e,False,[],,False,False,,{},,False,3,,False,self,False,,[],{},,True,,1555995853.0,text,0,,,text,self.infertility,True,"<!-- SC_OFF --><div class=""md""><p>Quick history- DOR and endo (excision lap) 
3 canceled cycles, 1 pregnancy from converted IUI MC@8 weeks. 3 egg retrieval’s with current clinic. All gonal f 225, menopur 150, prednisone, HGH, dual trigger. Cycle 1&amp;2 EPP, natural start cycle 3.</p>

<p>Cycle 1- 6R, 4M, 3F, 3B frozen
Cycle 2- 4R, 2M, 2F, 1B frozen
Cycle 3- 3R, 2M, 2F, 2 day 3 transfer- negative</p>

<p>Went to a consult with CCRM, head spinning a bit, so much information. They would recommend EPP with patches opposed to estradiol which I used in the past. He believes I was getting too much estrogen which was causing my very slow/no response in the canceled cycles- He thinks patches deliver it more evenly. Similar antagonist protocol but with clomid I think (didn’t give me an exact protocol).</p>

<p>Freeze all, pgs test, bcp w/letrozole or orlissa to address endo (I’m anti depot lupron but he would prefer that) one month prior to FET. </p>

<p>We also did karyotyping for mr beans and myself. His mother had some issues getting pregnant and my father had very low sperm count. My sister also has DOR (but became pregnant cycle one 🙄), so he’s curious to see if there’s any genetic issues. </p>

<p>My current clinic was willing to try MDL for this upcoming cycle in attempts to switch things up. They generally don’t use estrogen patches or clomid in their protocols. We would do a fresh day 5 transfer because that’s what I would like. CCRM said absolutely no fresh transfer because of the endo, so I would reconsider this.</p>

<p>I basically need to decide tonight which clinic to go with. Financially it’s about a 5,000 difference which is a lot but not a deal breaker. I like my current RE, new RE seemed a little arrogant but given his success rate, rightly so. My only complaint with my current clinic is their use of the same protocol each time, new clinic has a lot of different protocols.</p>

<p>How did you break up with your RE?
Should I email my current RE and tell her that we met with this other RE? I don’t know the specifics of what protocol this RE would use so couldn’t even ask her to try it. I feel bad since I really do like her. I know it’s not personal but it feels it. I hate hate hate confrontation and also know that I may need to go back to them in the future (we could only afford 1 cycle at CCRM). </p>

<p>Again, sorry for the lengthy stand alone. Thank you ladies for any insight you might have.</p>
</div><!-- SC_ON -->",,,,,True,False,False,False,False,[],[],False,False,False,False,"35F, DOR/ENDO, 6IVF, 1MC",[],False,,,,t5_2saej,,,,bg7dn9,True,,beansie111,,11,True,no_ads,False,[],False,dark,/r/infertility/comments/bg7dn9/apologize_for_standard_alone_but_need_to_feedback/,no_ads,False,https://www.reddit.com/r/infertility/comments/bg7dn9/apologize_for_standard_alone_but_need_to_feedback/,25378,1555967053.0,0,,False,False,{},,,,,,,,
