,comment_limit,comment_sort,_reddit,approved_at_utc,subreddit,selftext,author_fullname,saved,mod_reason_title,gilded,clicked,title,link_flair_richtext,subreddit_name_prefixed,hidden,pwls,link_flair_css_class,downs,thumbnail_height,top_awarded_type,hide_score,name,quarantine,link_flair_text_color,upvote_ratio,author_flair_background_color,subreddit_type,ups,total_awards_received,media_embed,thumbnail_width,author_flair_template_id,is_original_content,user_reports,secure_media,is_reddit_media_domain,is_meta,category,secure_media_embed,link_flair_text,can_mod_post,score,approved_by,author_premium,thumbnail,edited,author_flair_css_class,author_flair_richtext,gildings,content_categories,is_self,mod_note,created,link_flair_type,wls,removed_by_category,banned_by,author_flair_type,domain,allow_live_comments,selftext_html,likes,suggested_sort,banned_at_utc,view_count,archived,no_follow,is_crosspostable,pinned,over_18,all_awardings,awarders,media_only,can_gild,spoiler,locked,author_flair_text,treatment_tags,visited,removed_by,num_reports,distinguished,subreddit_id,mod_reason_by,removal_reason,link_flair_background_color,id,is_robot_indexable,report_reasons,author,discussion_type,num_comments,send_replies,whitelist_status,contest_mode,mod_reports,author_patreon_flair,author_flair_text_color,permalink,parent_whitelist_status,stickied,url,subreddit_subscribers,created_utc,num_crossposts,media,is_video,_fetched,_comments_by_id,author_cakeday,post_hint,preview,crosspost_parent_list,url_overridden_by_dest,crosspost_parent,link_flair_template_id,collections
0,2048,confidence,<praw.reddit.Reddit object at 0x7f2244aead90>,,infertility,"Hi all. After 3 failed iui cycles, my husband and I went for ivf. I just found out that my 4 embryos are genetically unsound. What are the odds of this? I’m devastated. I don’t know what to do next. Any advice is welcomed. Thank you.",t2_3pk9a5c5,False,,0,False,Genetically unsound embryos,[],r/infertility,False,0,,0,,,False,t3_bkcoyh,False,dark,0.67,,public,1,0,{},,,False,[],,False,False,,{},,False,1,,False,self,False,,[],{},,True,,1556941950.0,text,0,,,text,self.infertility,False,"<!-- SC_OFF --><div class=""md""><p>Hi all. After 3 failed iui cycles, my husband and I went for ivf. I just found out that my 4 embryos are genetically unsound. What are the odds of this? I’m devastated. I don’t know what to do next. Any advice is welcomed. Thank you.</p>
</div><!-- SC_ON -->",,,,,True,True,False,False,False,[],[],False,False,False,False,,[],False,,,,t5_2saej,,,,bkcoyh,True,,erinchristo,,19,True,no_ads,False,[],False,,/r/infertility/comments/bkcoyh/genetically_unsound_embryos/,no_ads,False,https://www.reddit.com/r/infertility/comments/bkcoyh/genetically_unsound_embryos/,25378,1556913150.0,0,,False,False,{},,,,,,,,
1,2048,confidence,<praw.reddit.Reddit object at 0x7f2244aead90>,,infertility,"Delete if this breaks the rules

My beta is today and will most likely be negative.  I just sat down to watch the news about Venezuela and of course it went to “Royal a Baby Watch”.  I’m just REALLY trying to be extra positive right now and I can’t avoid her!   

End of rant.",t2_bhrls,False,,0,False,Sorry for the standalone post but Megan Markle needs to go kick rocks,[],r/infertility,False,0,,0,,,False,t3_bkc2fr,False,dark,0.64,,public,15,0,{},,d70f54ce-930e-11e4-8710-22000b26873e,False,[],,False,False,,{},,False,15,,False,self,False,,[],{},,True,,1556938560.0,text,0,,,text,self.infertility,True,"<!-- SC_OFF --><div class=""md""><p>Delete if this breaks the rules</p>

<p>My beta is today and will most likely be negative.  I just sat down to watch the news about Venezuela and of course it went to “Royal a Baby Watch”.  I’m just REALLY trying to be extra positive right now and I can’t avoid her!   </p>

<p>End of rant.</p>
</div><!-- SC_ON -->",,,,,True,False,False,False,False,[],[],False,False,False,False,39F•4ER•Unexplained•ERA,[],False,,,,t5_2saej,,,,bkc2fr,True,,HallandOates1,,48,True,no_ads,False,[],False,dark,/r/infertility/comments/bkc2fr/sorry_for_the_standalone_post_but_megan_markle/,no_ads,False,https://www.reddit.com/r/infertility/comments/bkc2fr/sorry_for_the_standalone_post_but_megan_markle/,25378,1556909760.0,0,,False,False,{},True,,,,,,,
2,2048,confidence,<praw.reddit.Reddit object at 0x7f2244aead90>,,infertility,"Hi everyone!

I’m on day 8 of my injections for this IVF cycle. I had my second monitoring ultrasound this morning and only one of my eggs was measurable at 12 something. There were 9 other follicles that seemed to be there, but not measurable. Basically, it looks like we will have to cancel this cycle due to only one egg developing. I’m just so frustrated and confused. Our last cycle we got 8 eggs and ultimately had an 8-week loss. We are doing the exact same protocol and process and I don’t get why the outcome is so different this time. Anyone else experienced this? Ways to prevent this in the future? My re said that this just sometimes happens. I guess I’m looking for something more concrete or something I can do.",t2_2jwnxzx5,False,,0,False,Failed/Incomplete IVF Cycle,[],r/infertility,False,0,,0,,,False,t3_bkbv65,False,dark,1.0,,public,1,0,{},,d70f54ce-930e-11e4-8710-22000b26873e,False,[],,False,False,,{},,False,1,,False,self,False,,[],{},,True,,1556937468.0,text,0,,,text,self.infertility,False,"<!-- SC_OFF --><div class=""md""><p>Hi everyone!</p>

<p>I’m on day 8 of my injections for this IVF cycle. I had my second monitoring ultrasound this morning and only one of my eggs was measurable at 12 something. There were 9 other follicles that seemed to be there, but not measurable. Basically, it looks like we will have to cancel this cycle due to only one egg developing. I’m just so frustrated and confused. Our last cycle we got 8 eggs and ultimately had an 8-week loss. We are doing the exact same protocol and process and I don’t get why the outcome is so different this time. Anyone else experienced this? Ways to prevent this in the future? My re said that this just sometimes happens. I guess I’m looking for something more concrete or something I can do.</p>
</div><!-- SC_ON -->",,,,,True,True,False,False,False,[],[],False,False,False,False,"32/unexplained 8 IUIs, IVF w/ 8 week loss",[],False,,,,t5_2saej,,,,bkbv65,True,,Help75438,,2,True,no_ads,False,[],False,dark,/r/infertility/comments/bkbv65/failedincomplete_ivf_cycle/,no_ads,False,https://www.reddit.com/r/infertility/comments/bkbv65/failedincomplete_ivf_cycle/,25378,1556908668.0,0,,False,False,{},,,,,,,,
3,2048,confidence,<praw.reddit.Reddit object at 0x7f2244aead90>,,infertility,"The Active treatment thread is for updates on your current cycle, questions about medications, or advice on easier/basic questions.  Find a cycle buddy, commiserate on side effects, or cheer on your peers as they endure the hunger games.  

We suggest trying to sort comments by NEW to help out folks that may not have gotten responses from someone already.  We recognize that the AM/PM disctinction doesn't match up with every time zone in our global community, just pick the most recently posted one where ever you are.

Stand alone posts can be used for more complex topics such as asking for opinions on studies, introducing yourself with your medical history, or asking more complex questions around treatment plans, etc.",t2_6l4z3,False,,0,False,Friday PM ACTIVE Treatment Thread,[],r/infertility,False,0,,0,,,False,t3_bkaui3,False,dark,0.85,,public,9,0,{},,,False,[],,False,False,,{},Scheduled,False,9,,True,self,False,,[],{},,True,,1556932011.0,text,0,,,text,self.infertility,False,"<!-- SC_OFF --><div class=""md""><p>The Active treatment thread is for updates on your current cycle, questions about medications, or advice on easier/basic questions.  Find a cycle buddy, commiserate on side effects, or cheer on your peers as they endure the hunger games.  </p>

<p>We suggest trying to sort comments by NEW to help out folks that may not have gotten responses from someone already.  We recognize that the AM/PM disctinction doesn&#39;t match up with every time zone in our global community, just pick the most recently posted one where ever you are.</p>

<p>Stand alone posts can be used for more complex topics such as asking for opinions on studies, introducing yourself with your medical history, or asking more complex questions around treatment plans, etc.</p>
</div><!-- SC_ON -->",,new,,,True,False,False,False,False,[],[],False,False,False,False,,[],False,,,moderator,t5_2saej,,,,bkaui3,True,,AutoModerator,,95,False,no_ads,False,[],False,,/r/infertility/comments/bkaui3/friday_pm_active_treatment_thread/,no_ads,False,https://www.reddit.com/r/infertility/comments/bkaui3/friday_pm_active_treatment_thread/,25378,1556903211.0,0,,False,False,{},,,,,,,,
4,2048,confidence,<praw.reddit.Reddit object at 0x7f2244aead90>,,infertility,"Use this thread to share anything NOT necessarily related to infertility or treatment. Rant, rave, bitch, moan, share something funny, post a picture of your pet, anything goes!  Nothing is off-topic here.  It is a great place to get to know the parts of people that aren't always consumed with infertility.

If you have questions or updates on treatment, consider the Active Treatment thread instead!",t2_6l4z3,False,,0,False,Friday PM Chat Thread,[],r/infertility,False,0,,0,,,False,t3_bkaug7,False,dark,0.85,,public,9,0,{},,,False,[],,False,False,,{},Scheduled,False,9,,True,self,False,,[],{},,True,,1556932004.0,text,0,,,text,self.infertility,False,"<!-- SC_OFF --><div class=""md""><p>Use this thread to share anything NOT necessarily related to infertility or treatment. Rant, rave, bitch, moan, share something funny, post a picture of your pet, anything goes!  Nothing is off-topic here.  It is a great place to get to know the parts of people that aren&#39;t always consumed with infertility.</p>

<p>If you have questions or updates on treatment, consider the Active Treatment thread instead!</p>
</div><!-- SC_ON -->",,new,,,True,False,False,False,False,[],[],False,False,False,False,,[],False,,,moderator,t5_2saej,,,,bkaug7,True,,AutoModerator,,75,False,no_ads,False,[],False,,/r/infertility/comments/bkaug7/friday_pm_chat_thread/,no_ads,False,https://www.reddit.com/r/infertility/comments/bkaug7/friday_pm_chat_thread/,25378,1556903204.0,0,,False,False,{},,,,,,,,
5,2048,confidence,<praw.reddit.Reddit object at 0x7f2244aead90>,,infertility," 

We finally received insurance authorization to begin IVF! We also received information that IVF will be covered 100% after the typical $15 copay for each office visit.

I began taking my first round of medication on 4/29 and will take this until 5/10.

Then I will have pre evaluation blood work on 5/11

As long as all looks good on the blood work, I will start taking Gonadotropins.

When my follicles reach 14mm, I will continue Gonadotropins and begin Ganirelix

Then I should give my self a HCG Trigger on 5/24

Egg retrieval on 5/26

and finally Embryo Transfer on 5/31

As you can see, I am so excited for this! I hope that after 9 years of trying for a baby, our dream might be come a reality. Please keep up in your thoughts as we go through this time. Thank you for all your support",t2_zbrdv,False,,0,False,IVF round 1 is a go!,[],r/infertility,False,0,,0,,,False,t3_bk9zel,False,dark,0.85,,public,59,0,{},,d70f54ce-930e-11e4-8710-22000b26873e,False,[],,False,False,,{},,False,59,,False,self,False,,[],{},,True,,1556927341.0,text,0,,,text,self.infertility,False,"<!-- SC_OFF --><div class=""md""><p>We finally received insurance authorization to begin IVF! We also received information that IVF will be covered 100% after the typical $15 copay for each office visit.</p>

<p>I began taking my first round of medication on 4/29 and will take this until 5/10.</p>

<p>Then I will have pre evaluation blood work on 5/11</p>

<p>As long as all looks good on the blood work, I will start taking Gonadotropins.</p>

<p>When my follicles reach 14mm, I will continue Gonadotropins and begin Ganirelix</p>

<p>Then I should give my self a HCG Trigger on 5/24</p>

<p>Egg retrieval on 5/26</p>

<p>and finally Embryo Transfer on 5/31</p>

<p>As you can see, I am so excited for this! I hope that after 9 years of trying for a baby, our dream might be come a reality. Please keep up in your thoughts as we go through this time. Thank you for all your support</p>
</div><!-- SC_ON -->",,,,,True,False,False,False,False,[],[],False,False,False,False,IVF round 1 coming this month!,[],False,,,,t5_2saej,,,,bk9zel,True,,palmerwife2010,,23,True,no_ads,False,[],False,dark,/r/infertility/comments/bk9zel/ivf_round_1_is_a_go/,no_ads,False,https://www.reddit.com/r/infertility/comments/bk9zel/ivf_round_1_is_a_go/,25378,1556898541.0,0,,False,False,{},,,,,,,,
6,2048,confidence,<praw.reddit.Reddit object at 0x7f2244aead90>,,infertility,"Hey... what have your REs recommended about Vit D? I mean, how much should you be taking? My RE doesn't ever touch on supplements or nutrition and is very dismissive when I bring either subject up. I am soooo jealous of you ladies with REs who include these things in their protocols.",t2_7vr5fiv,False,,0,False,Vitamin D and preparing for a stim cycle in June,[],r/infertility,False,0,,0,,,False,t3_bk8uhn,False,dark,1.0,,public,3,0,{},,,False,[],,False,False,,{},,False,3,,False,self,False,,[],{},,True,,1556921029.0,text,0,,,text,self.infertility,False,"<!-- SC_OFF --><div class=""md""><p>Hey... what have your REs recommended about Vit D? I mean, how much should you be taking? My RE doesn&#39;t ever touch on supplements or nutrition and is very dismissive when I bring either subject up. I am soooo jealous of you ladies with REs who include these things in their protocols.</p>
</div><!-- SC_ON -->",,,,,True,False,False,False,False,[],[],False,False,False,False,"35F, 34M, Vasectomy Reversal 2015, 5 failed IUIs, 1 failed IVF",[],False,,,,t5_2saej,,,,bk8uhn,True,,Thedancingcabbie,,16,True,no_ads,False,[],False,dark,/r/infertility/comments/bk8uhn/vitamin_d_and_preparing_for_a_stim_cycle_in_june/,no_ads,False,https://www.reddit.com/r/infertility/comments/bk8uhn/vitamin_d_and_preparing_for_a_stim_cycle_in_june/,25378,1556892229.0,0,,False,False,{},,,,,,,,
7,2048,confidence,<praw.reddit.Reddit object at 0x7f2244aead90>,,infertility,"The Active treatment thread is for updates on your current cycle, questions about medications, or advice on easier/basic questions.  Find a cycle buddy, commiserate on side effects, or cheer on your peers as they endure the hunger games.  

We suggest trying to sort comments by NEW to help out folks that may not have gotten responses from someone already.  We recognize that the AM/PM disctinction doesn't match up with every time zone in our global community, just pick the most recently posted one where ever you are.

Stand alone posts can be used for more complex topics such as asking for opinions on studies, introducing yourself with your medical history, or asking more complex questions around treatment plans, etc.",t2_6l4z3,False,,0,False,Friday AM ACTIVE Treatment Thread,[],r/infertility,False,0,,0,,,False,t3_bk6r0f,False,dark,0.85,,public,9,0,{},,,False,[],,False,False,,{},Scheduled,False,9,,True,self,False,,[],{},,True,,1556906985.0,text,0,,,text,self.infertility,False,"<!-- SC_OFF --><div class=""md""><p>The Active treatment thread is for updates on your current cycle, questions about medications, or advice on easier/basic questions.  Find a cycle buddy, commiserate on side effects, or cheer on your peers as they endure the hunger games.  </p>

<p>We suggest trying to sort comments by NEW to help out folks that may not have gotten responses from someone already.  We recognize that the AM/PM disctinction doesn&#39;t match up with every time zone in our global community, just pick the most recently posted one where ever you are.</p>

<p>Stand alone posts can be used for more complex topics such as asking for opinions on studies, introducing yourself with your medical history, or asking more complex questions around treatment plans, etc.</p>
</div><!-- SC_ON -->",,new,,,True,False,False,False,False,[],[],False,False,False,False,,[],False,,,moderator,t5_2saej,,,,bk6r0f,True,,AutoModerator,,157,False,no_ads,False,[],False,,/r/infertility/comments/bk6r0f/friday_am_active_treatment_thread/,no_ads,False,https://www.reddit.com/r/infertility/comments/bk6r0f/friday_am_active_treatment_thread/,25378,1556878185.0,0,,False,False,{},,,,,,,,
8,2048,confidence,<praw.reddit.Reddit object at 0x7f2244aead90>,,infertility,"Use this thread to share anything NOT necessarily related to infertility or treatment. Rant, rave, bitch, moan, share something funny, post a picture of your pet, anything goes!  Nothing is off-topic here.  It is a great place to get to know the parts of people that aren't always consumed with infertility.

If you have questions or updates on treatment, consider the Active Treatment thread instead!",t2_6l4z3,False,,0,False,Friday AM Chat Thread,[],r/infertility,False,0,,0,,,False,t3_bk6qz3,False,dark,0.99,,public,11,0,{},,,False,[],,False,False,,{},Scheduled,False,11,,True,self,False,,[],{},,True,,1556906979.0,text,0,,,text,self.infertility,False,"<!-- SC_OFF --><div class=""md""><p>Use this thread to share anything NOT necessarily related to infertility or treatment. Rant, rave, bitch, moan, share something funny, post a picture of your pet, anything goes!  Nothing is off-topic here.  It is a great place to get to know the parts of people that aren&#39;t always consumed with infertility.</p>

<p>If you have questions or updates on treatment, consider the Active Treatment thread instead!</p>
</div><!-- SC_ON -->",,new,,,True,False,False,False,False,[],[],False,False,False,False,,[],False,,,moderator,t5_2saej,,,,bk6qz3,True,,AutoModerator,,70,False,no_ads,False,[],False,,/r/infertility/comments/bk6qz3/friday_am_chat_thread/,no_ads,False,https://www.reddit.com/r/infertility/comments/bk6qz3/friday_am_chat_thread/,25378,1556878179.0,0,,False,False,{},,,,,,,,
9,2048,confidence,<praw.reddit.Reddit object at 0x7f2244aead90>,,infertility,[removed],t2_3hnafahj,False,,0,False,Looking for Best IUI Treatment Centre in Hyderabad|Fertility Specialists,[],r/infertility,False,0,,0,,,False,t3_bk6oxu,False,dark,0.67,,public,1,0,{},,,False,[],,False,False,,{},,False,1,,False,default,False,,[],{},,True,,1556906527.0,text,0,,,text,self.infertility,False,"<!-- SC_OFF --><div class=""md""><p>[removed]</p>
</div><!-- SC_ON -->",,,,,True,True,False,False,False,[],[],False,False,False,False,,[],False,,,,t5_2saej,,,,bk6oxu,False,,sreeivf4,,0,True,no_ads,False,[],False,,/r/infertility/comments/bk6oxu/looking_for_best_iui_treatment_centre_in/,no_ads,False,https://www.reddit.com/r/infertility/comments/bk6oxu/looking_for_best_iui_treatment_centre_in/,25378,1556877727.0,0,,False,False,{},,,,,,,,
