,comment_limit,comment_sort,_reddit,approved_at_utc,subreddit,selftext,author_fullname,saved,mod_reason_title,gilded,clicked,title,link_flair_richtext,subreddit_name_prefixed,hidden,pwls,link_flair_css_class,downs,thumbnail_height,top_awarded_type,hide_score,name,quarantine,link_flair_text_color,upvote_ratio,author_flair_background_color,subreddit_type,ups,total_awards_received,media_embed,thumbnail_width,author_flair_template_id,is_original_content,user_reports,secure_media,is_reddit_media_domain,is_meta,category,secure_media_embed,link_flair_text,can_mod_post,score,approved_by,author_premium,thumbnail,edited,author_flair_css_class,author_flair_richtext,gildings,content_categories,is_self,mod_note,created,link_flair_type,wls,removed_by_category,banned_by,author_flair_type,domain,allow_live_comments,selftext_html,likes,suggested_sort,banned_at_utc,view_count,archived,no_follow,is_crosspostable,pinned,over_18,all_awardings,awarders,media_only,link_flair_template_id,can_gild,spoiler,locked,author_flair_text,treatment_tags,visited,removed_by,num_reports,distinguished,subreddit_id,mod_reason_by,removal_reason,link_flair_background_color,id,is_robot_indexable,report_reasons,author,discussion_type,num_comments,send_replies,whitelist_status,contest_mode,mod_reports,author_patreon_flair,author_flair_text_color,permalink,parent_whitelist_status,stickied,url,subreddit_subscribers,created_utc,num_crossposts,media,is_video,_fetched,_comments_by_id,post_hint,preview,crosspost_parent_list,url_overridden_by_dest,crosspost_parent
0,2048,confidence,<praw.reddit.Reddit object at 0x7f2244aead90>,,infertility,"I am still waiting for my hcg level to drop to negative but it’s super low at 11.1 units at my last blood work. So I am feeling really low. 

Of course at this time, one cousin had a baby, another one is being induced tomorrow, and a coworker is currently experiencing contractions. Plus two friends are close to their 20 week doctor appointment. 

I love all these people, so I’m happy for them yadda yadda... I miss being pregnant. Today I cried because I saw photos from February when I was pregnant and happy. I hate feeling this way. I just want my baby.",t2_13jvlj,False,,0,False,Why are there so many babies all around me?,[],r/infertility,False,0,,0,,,False,t3_fsr48s,False,dark,0.8,,public,22,0,{},,,False,[],,False,False,,{},TW: Mention of Children,False,22,,False,self,False,,[],{},,True,,1585738017.0,text,0,,,text,self.infertility,False,"<!-- SC_OFF --><div class=""md""><p>I am still waiting for my hcg level to drop to negative but it’s super low at 11.1 units at my last blood work. So I am feeling really low. </p>

<p>Of course at this time, one cousin had a baby, another one is being induced tomorrow, and a coworker is currently experiencing contractions. Plus two friends are close to their 20 week doctor appointment. </p>

<p>I love all these people, so I’m happy for them yadda yadda... I miss being pregnant. Today I cried because I saw photos from February when I was pregnant and happy. I hate feeling this way. I just want my baby.</p>
</div><!-- SC_ON -->",,,,,True,False,False,False,False,[],[],False,b1219312-18de-11e9-ac4b-0e7e9b07becc,False,False,False,,[],False,,,,t5_2saej,,,#dadada,fsr48s,True,,siskosisilisko,,3,True,no_ads,False,[],False,,/r/infertility/comments/fsr48s/why_are_there_so_many_babies_all_around_me/,no_ads,False,https://www.reddit.com/r/infertility/comments/fsr48s/why_are_there_so_many_babies_all_around_me/,25378,1585709217.0,0,,False,False,{},,,,,
1,2048,confidence,<praw.reddit.Reddit object at 0x7f2244aead90>,,infertility,[removed],,False,,0,False,MY SURGERY WAS POSTPONED... Is your treatment on or off?,[],r/infertility,False,0,,0,,,False,t3_fsmomn,False,dark,0.33,,public,0,0,{},,,False,[],,False,False,,{},,False,0,,,default,False,,,{},,True,,1585721900.0,text,0,deleted,,,self.infertility,False,"<!-- SC_OFF --><div class=""md""><p>[removed]</p>
</div><!-- SC_ON -->",,,,,True,True,False,False,False,[],[],False,,False,False,False,,[],False,,,,t5_2saej,,,,fsmomn,False,,,,1,True,no_ads,False,[],,dark,/r/infertility/comments/fsmomn/my_surgery_was_postponed_is_your_treatment_on_or/,no_ads,False,https://www.reddit.com/r/infertility/comments/fsmomn/my_surgery_was_postponed_is_your_treatment_on_or/,25378,1585693100.0,0,,False,False,{},,,,,
2,2048,confidence,<praw.reddit.Reddit object at 0x7f2244aead90>,,infertility,"I had an early miscarriage and after 6 months no one thought to check my insulin levels. My A1c is normal so it would be odd to test for insulin resistance (I guess). After going to therapy for several months my therapist thought I may perhaps have some biological factor causing some of my issues and it wasn't till she requested that I have blood work done that I found out I had high insulin after doing a good bit of research I found these articles:
1.)https://www.columbiaobgyn.org/news/study-reports-high-insulin-levels-are-toxic-placenta-cells-potentially-causing-miscarriages
2.)https://www.healthline.com/health-news/elevated-insulin-levels-toxic-to-placenta
In short if you haven't had your insulin tested and you're among the many women like myself wondering why or what you can do to prevent another loss, I would encourage you to ask your doctors to at least check your insulin levels. I am not a health care professional and this is just my personal opinion. From what I've read high insulin levels can be common. I was never given a definitive answer regarding the reason for my miscarriage. I also had low progesterone levels (which were supplemented). In short I just wanted to share in hopes that someone else would be able to prevent having another loss. ❤️♥️",t2_3sio44hr,False,,0,False,Get your insulin checked,[],r/infertility,False,0,,0,,,False,t3_fsibnn,False,dark,0.92,,public,20,0,{},,,False,[],,False,False,,{},,False,20,,False,self,False,,[],{},,True,,1585708181.0,text,0,,,text,self.infertility,False,"<!-- SC_OFF --><div class=""md""><p>I had an early miscarriage and after 6 months no one thought to check my insulin levels. My A1c is normal so it would be odd to test for insulin resistance (I guess). After going to therapy for several months my therapist thought I may perhaps have some biological factor causing some of my issues and it wasn&#39;t till she requested that I have blood work done that I found out I had high insulin after doing a good bit of research I found these articles:
1.)<a href=""https://www.columbiaobgyn.org/news/study-reports-high-insulin-levels-are-toxic-placenta-cells-potentially-causing-miscarriages"">https://www.columbiaobgyn.org/news/study-reports-high-insulin-levels-are-toxic-placenta-cells-potentially-causing-miscarriages</a>
2.)<a href=""https://www.healthline.com/health-news/elevated-insulin-levels-toxic-to-placenta"">https://www.healthline.com/health-news/elevated-insulin-levels-toxic-to-placenta</a>
In short if you haven&#39;t had your insulin tested and you&#39;re among the many women like myself wondering why or what you can do to prevent another loss, I would encourage you to ask your doctors to at least check your insulin levels. I am not a health care professional and this is just my personal opinion. From what I&#39;ve read high insulin levels can be common. I was never given a definitive answer regarding the reason for my miscarriage. I also had low progesterone levels (which were supplemented). In short I just wanted to share in hopes that someone else would be able to prevent having another loss. ❤️♥️</p>
</div><!-- SC_ON -->",,,,,True,False,False,False,False,[],[],False,,False,False,False,,[],False,,,,t5_2saej,,,,fsibnn,True,,mekind19,,18,True,no_ads,False,[],False,,/r/infertility/comments/fsibnn/get_your_insulin_checked/,no_ads,False,https://www.reddit.com/r/infertility/comments/fsibnn/get_your_insulin_checked/,25378,1585679381.0,0,,False,False,{},self,"{'images': [{'source': {'url': 'https://external-preview.redd.it/IWUS-Yo-7FEJf1ziGY5qZP3y0iLb9HO2QTMyyEmiSR4.jpg?auto=webp&s=467d1889681e5289696a8c629c69c1765aa86edf', 'width': 1280, 'height': 720}, 'resolutions': [{'url': 'https://external-preview.redd.it/IWUS-Yo-7FEJf1ziGY5qZP3y0iLb9HO2QTMyyEmiSR4.jpg?width=108&crop=smart&auto=webp&s=e21e0ac89575589cde5450f95a4fd518c0f20b7b', 'width': 108, 'height': 60}, {'url': 'https://external-preview.redd.it/IWUS-Yo-7FEJf1ziGY5qZP3y0iLb9HO2QTMyyEmiSR4.jpg?width=216&crop=smart&auto=webp&s=44318f97df5e12f73048d69f883b2820db319116', 'width': 216, 'height': 121}, {'url': 'https://external-preview.redd.it/IWUS-Yo-7FEJf1ziGY5qZP3y0iLb9HO2QTMyyEmiSR4.jpg?width=320&crop=smart&auto=webp&s=95e31a81148d5ee87d2923d3d7e55b027443d14b', 'width': 320, 'height': 180}, {'url': 'https://external-preview.redd.it/IWUS-Yo-7FEJf1ziGY5qZP3y0iLb9HO2QTMyyEmiSR4.jpg?width=640&crop=smart&auto=webp&s=749cecebdb7567e1d2b53b79f5fd04f54cc67664', 'width': 640, 'height': 360}, {'url': 'https://external-preview.redd.it/IWUS-Yo-7FEJf1ziGY5qZP3y0iLb9HO2QTMyyEmiSR4.jpg?width=960&crop=smart&auto=webp&s=832378541f452b1f0a4e304ae0cdd2fd00848589', 'width': 960, 'height': 540}, {'url': 'https://external-preview.redd.it/IWUS-Yo-7FEJf1ziGY5qZP3y0iLb9HO2QTMyyEmiSR4.jpg?width=1080&crop=smart&auto=webp&s=ae891d4ae87ffe92eddec72c6b4a593d2e91ffa9', 'width': 1080, 'height': 607}], 'variants': {}, 'id': 'hmm5fMtQFmqIX_X2EgD87L4FBfLxUL-QyeJZ_tUE_6U'}], 'enabled': False}",,,
3,2048,confidence,<praw.reddit.Reddit object at 0x7f2244aead90>,,infertility,"The treatment thread is for updates on your current cycle, questions about medications, or advice on easier/basic questions.  Find a cycle buddy, commiserate on side effects, or cheer on your peers as they endure the hunger games.  Positive HPT or Beta Results should only be posted in the Results thread as per the rules: https://www.reddit.com/r/infertility/?f=flair_name%3A%22Results%22.

We recognize that the AM/PM distinction doesn't match up with every time zone in our global community, just pick the most recently posted one where ever you are.

Stand alone posts can be used for more complex topics such as asking for opinions on studies, introducing yourself with your medical history, or asking more complex questions around treatment plans, etc.",t2_6l4z3,False,,0,False,Tuesday PM Treatment Thread,[],r/infertility,False,0,,0,,,False,t3_fsgqm2,False,dark,0.82,,public,7,0,{},,,False,[],,False,False,,{},Daily,False,7,,True,self,False,,[],{},,True,,1585703197.0,text,0,,,text,self.infertility,False,"<!-- SC_OFF --><div class=""md""><p>The treatment thread is for updates on your current cycle, questions about medications, or advice on easier/basic questions.  Find a cycle buddy, commiserate on side effects, or cheer on your peers as they endure the hunger games.  Positive HPT or Beta Results should only be posted in the Results thread as per the rules: <a href=""https://www.reddit.com/r/infertility/?f=flair_name%3A%22Results%22"">https://www.reddit.com/r/infertility/?f=flair_name%3A%22Results%22</a>.</p>

<p>We recognize that the AM/PM distinction doesn&#39;t match up with every time zone in our global community, just pick the most recently posted one where ever you are.</p>

<p>Stand alone posts can be used for more complex topics such as asking for opinions on studies, introducing yourself with your medical history, or asking more complex questions around treatment plans, etc.</p>
</div><!-- SC_ON -->",,new,,,True,False,False,False,False,[],[],False,,False,False,False,,[],False,,,moderator,t5_2saej,,,,fsgqm2,True,,AutoModerator,,69,False,no_ads,False,[],False,,/r/infertility/comments/fsgqm2/tuesday_pm_treatment_thread/,no_ads,False,https://www.reddit.com/r/infertility/comments/fsgqm2/tuesday_pm_treatment_thread/,25378,1585674397.0,0,,False,False,{},,,,,
4,2048,confidence,<praw.reddit.Reddit object at 0x7f2244aead90>,,infertility,"If you have questions or updates on treatment, consider the Daily Treatment thread instead!  Positive HPT or Beta Results should only be posted in the Results thread as per the rules: https://www.reddit.com/r/infertility/?f=flair_name%3A%22Results%22.

Use this thread to share things that are NOT specific to treatment.  Rant, rave, bitch, moan, share something funny, post a picture of your pet, nothing is off-topic here.  It is a great place to get to know people that aren't in the middle of a treatment cycle, are waiting on treatment, or are pursuing non-treatment focused paths.  Infertility related talk is absolutely still allowed in the chat thread.

We recognize that the AM/PM distinction doesn't match up with every time zone in our global community, just pick the most recently posted one where ever you are.",t2_6l4z3,False,,0,False,Tuesday PM Chat Thread,[],r/infertility,False,0,,0,,,False,t3_fsgqi6,False,dark,0.88,,public,6,0,{},,,False,[],,False,False,,{},Daily,False,6,,True,self,False,,[],{},,True,,1585703188.0,text,0,,,text,self.infertility,False,"<!-- SC_OFF --><div class=""md""><p>If you have questions or updates on treatment, consider the Daily Treatment thread instead!  Positive HPT or Beta Results should only be posted in the Results thread as per the rules: <a href=""https://www.reddit.com/r/infertility/?f=flair_name%3A%22Results%22"">https://www.reddit.com/r/infertility/?f=flair_name%3A%22Results%22</a>.</p>

<p>Use this thread to share things that are NOT specific to treatment.  Rant, rave, bitch, moan, share something funny, post a picture of your pet, nothing is off-topic here.  It is a great place to get to know people that aren&#39;t in the middle of a treatment cycle, are waiting on treatment, or are pursuing non-treatment focused paths.  Infertility related talk is absolutely still allowed in the chat thread.</p>

<p>We recognize that the AM/PM distinction doesn&#39;t match up with every time zone in our global community, just pick the most recently posted one where ever you are.</p>
</div><!-- SC_ON -->",,new,,,True,False,False,False,False,[],[],False,,False,False,False,,[],False,,,moderator,t5_2saej,,,,fsgqi6,True,,AutoModerator,,10,False,no_ads,False,[],False,,/r/infertility/comments/fsgqi6/tuesday_pm_chat_thread/,no_ads,False,https://www.reddit.com/r/infertility/comments/fsgqi6/tuesday_pm_chat_thread/,25378,1585674388.0,0,,False,False,{},,,,,
5,2048,confidence,<praw.reddit.Reddit object at 0x7f2244aead90>,,infertility,[deleted],,False,,0,False,"0 Response to Letrozole at 7.5 mg, RE worried about injectables and OSHH - feeling defeated",[],r/infertility,False,0,,0,,,False,t3_fsby7z,False,dark,1.0,,public,1,0,{},,,False,[],,False,False,,{},,False,1,,,default,False,,,{},,True,,1585686074.0,text,0,deleted,,,self.infertility,False,"<!-- SC_OFF --><div class=""md""><p>[deleted]</p>
</div><!-- SC_ON -->",,,,,True,False,False,False,False,[],[],False,,False,False,False,,[],False,,,,t5_2saej,,,,fsby7z,False,,,,3,True,no_ads,False,[],,dark,/r/infertility/comments/fsby7z/0_response_to_letrozole_at_75_mg_re_worried_about/,no_ads,False,https://www.reddit.com/r/infertility/comments/fsby7z/0_response_to_letrozole_at_75_mg_re_worried_about/,25378,1585657274.0,0,,False,False,{},,,,,
6,2048,confidence,<praw.reddit.Reddit object at 0x7f2244aead90>,,infertility,"The treatment thread is for updates on your current cycle, questions about medications, or advice on easier/basic questions.  Find a cycle buddy, commiserate on side effects, or cheer on your peers as they endure the hunger games.  Positive HPT or Beta Results should only be posted in the Results thread as per the rules: https://www.reddit.com/r/infertility/?f=flair_name%3A%22Results%22.

We recognize that the AM/PM distinction doesn't match up with every time zone in our global community, just pick the most recently posted one where ever you are.

Stand alone posts can be used for more complex topics such as asking for opinions on studies, introducing yourself with your medical history, or asking more complex questions around treatment plans, etc.",t2_6l4z3,False,,0,False,Tuesday AM Treatment Thread,[],r/infertility,False,0,,0,,,False,t3_fsabzu,False,dark,0.86,,public,5,0,{},,,False,[],,False,False,,{},Daily,False,5,,True,self,False,,[],{},,True,,1585678084.0,text,0,,,text,self.infertility,False,"<!-- SC_OFF --><div class=""md""><p>The treatment thread is for updates on your current cycle, questions about medications, or advice on easier/basic questions.  Find a cycle buddy, commiserate on side effects, or cheer on your peers as they endure the hunger games.  Positive HPT or Beta Results should only be posted in the Results thread as per the rules: <a href=""https://www.reddit.com/r/infertility/?f=flair_name%3A%22Results%22"">https://www.reddit.com/r/infertility/?f=flair_name%3A%22Results%22</a>.</p>

<p>We recognize that the AM/PM distinction doesn&#39;t match up with every time zone in our global community, just pick the most recently posted one where ever you are.</p>

<p>Stand alone posts can be used for more complex topics such as asking for opinions on studies, introducing yourself with your medical history, or asking more complex questions around treatment plans, etc.</p>
</div><!-- SC_ON -->",,new,,,True,False,False,False,False,[],[],False,,False,False,False,,[],False,,,moderator,t5_2saej,,,,fsabzu,True,,AutoModerator,,26,False,no_ads,False,[],False,,/r/infertility/comments/fsabzu/tuesday_am_treatment_thread/,no_ads,False,https://www.reddit.com/r/infertility/comments/fsabzu/tuesday_am_treatment_thread/,25378,1585649284.0,0,,False,False,{},,,,,
7,2048,confidence,<praw.reddit.Reddit object at 0x7f2244aead90>,,infertility,"If you have questions or updates on treatment, consider the Daily Treatment thread instead!  Positive HPT or Beta Results should only be posted in the Results thread as per the rules: https://www.reddit.com/r/infertility/?f=flair_name%3A%22Results%22.

Use this thread to share things that are NOT specific to treatment.  Rant, rave, bitch, moan, share something funny, post a picture of your pet, nothing is off-topic here.  It is a great place to get to know people that aren't in the middle of a treatment cycle, are waiting on treatment, or are pursuing non-treatment focused paths.  Infertility related talk is absolutely still allowed in the chat thread.

We recognize that the AM/PM distinction doesn't match up with every time zone in our global community, just pick the most recently posted one where ever you are.",t2_6l4z3,False,,0,False,Tuesday AM Chat Thread,[],r/infertility,False,0,,0,,,False,t3_fsabxf,False,dark,0.75,,public,4,0,{},,,False,[],,False,False,,{},Daily,False,4,,True,self,False,,[],{},,True,,1585678075.0,text,0,,,text,self.infertility,False,"<!-- SC_OFF --><div class=""md""><p>If you have questions or updates on treatment, consider the Daily Treatment thread instead!  Positive HPT or Beta Results should only be posted in the Results thread as per the rules: <a href=""https://www.reddit.com/r/infertility/?f=flair_name%3A%22Results%22"">https://www.reddit.com/r/infertility/?f=flair_name%3A%22Results%22</a>.</p>

<p>Use this thread to share things that are NOT specific to treatment.  Rant, rave, bitch, moan, share something funny, post a picture of your pet, nothing is off-topic here.  It is a great place to get to know people that aren&#39;t in the middle of a treatment cycle, are waiting on treatment, or are pursuing non-treatment focused paths.  Infertility related talk is absolutely still allowed in the chat thread.</p>

<p>We recognize that the AM/PM distinction doesn&#39;t match up with every time zone in our global community, just pick the most recently posted one where ever you are.</p>
</div><!-- SC_ON -->",,new,,,True,False,False,False,False,[],[],False,,False,False,False,,[],False,,,moderator,t5_2saej,,,,fsabxf,True,,AutoModerator,,44,False,no_ads,False,[],False,,/r/infertility/comments/fsabxf/tuesday_am_chat_thread/,no_ads,False,https://www.reddit.com/r/infertility/comments/fsabxf/tuesday_am_chat_thread/,25378,1585649275.0,0,,False,False,{},,,,,
8,2048,confidence,<praw.reddit.Reddit object at 0x7f2244aead90>,,infertility,"“Don’t worry about it, you’ll get pregnant when it’s time” 

“Maybe god just doesn’t want you to have kids...”

“Have you tried losing weight?” 

“Have you tried eating red meat?”

“Did you have sex on these days?”

“Have you tried these positions?”

“Maybe you’re just not meat for as family” 

“You know, there’s more to life than just kids”

“Trust me, these ones are HELL... you don’t want kids” 

“Don’t you still have your student loans to pay off before you start thinking about a family?”

“Have you tried reading the bible? You know that god grants joy to those who let him in their hearts!” 

“Maybe it’s a good thing you can’t have kids... I mean, would you REALLY wanna pass on bad genes?” 

Those are just a couple of the pieces of advice I’ve been given over the course of my fertility journey... what are some of the worst pieces of advice you’ve been given?",t2_408fa1ek,False,,0,False,A list of “pieces of advice” that I’m tired of hearing,[],r/infertility,False,0,,0,,,False,t3_fs7acs,False,dark,0.93,,public,52,0,{},,d70f54ce-930e-11e4-8710-22000b26873e,False,[],,False,False,,{},Emotional Support,False,52,,False,self,False,,[],{},,True,,1585661977.0,text,0,,,text,self.infertility,False,"<!-- SC_OFF --><div class=""md""><p>“Don’t worry about it, you’ll get pregnant when it’s time” </p>

<p>“Maybe god just doesn’t want you to have kids...”</p>

<p>“Have you tried losing weight?” </p>

<p>“Have you tried eating red meat?”</p>

<p>“Did you have sex on these days?”</p>

<p>“Have you tried these positions?”</p>

<p>“Maybe you’re just not meat for as family” </p>

<p>“You know, there’s more to life than just kids”</p>

<p>“Trust me, these ones are HELL... you don’t want kids” </p>

<p>“Don’t you still have your student loans to pay off before you start thinking about a family?”</p>

<p>“Have you tried reading the bible? You know that god grants joy to those who let him in their hearts!” </p>

<p>“Maybe it’s a good thing you can’t have kids... I mean, would you REALLY wanna pass on bad genes?” </p>

<p>Those are just a couple of the pieces of advice I’ve been given over the course of my fertility journey... what are some of the worst pieces of advice you’ve been given?</p>
</div><!-- SC_ON -->",,,,,True,False,False,False,False,[],[],False,d01d325e-18e2-11e9-9639-0e9becdb220e,False,False,False,23F|5IUI|1MC|PCOS,[],False,,,,t5_2saej,,,#dadada,fs7acs,True,,FancySocks1989,,51,True,no_ads,False,[],False,dark,/r/infertility/comments/fs7acs/a_list_of_pieces_of_advice_that_im_tired_of/,no_ads,False,https://www.reddit.com/r/infertility/comments/fs7acs/a_list_of_pieces_of_advice_that_im_tired_of/,25378,1585633177.0,0,,False,False,{},,,,,
