127,2048,confidence,<praw.reddit.Reddit object at 0x7f2244aead90>,,infertility,"In light of the news and many side discussions concerning anxiety around COVID, the mod squad has decided to direct all COVID related items to this superthread.

Part of what is so valuable about this sub is our imperative to cultivate healthy spaces that don’t jeopardize the mental health of our members. We recognize that discussions of COVID are saturating the public consciousness, and in an effort to limit anxiety triggers where we can, we need to keep our daily threads and standalones focused on supporting our members dealing with infertility specifically.

We are asking all of our members to honor their commitment to keeping this a safe space. Please kindly direct anything COVID related to the official COVID posts: https://www.reddit.com/r/infertility/search?q=flair_name%3A%22COVID%22&restrict_sr=1  Recurring posts will publish Wednesdays and Saturdays.  Use the report function as needed.

With love, The Mod Squad

Via u/corvidx, a great site to visit for all your questions - http://www.flattenthecurve.com

ASRM Guidelines during COVID link here - https://www.asrm.org/news-and-publications/patient-management-and-clinical-recommendations-during-the-coronavirus-covid-19-pandemic/",t2_6l4z3,False,,0,False,COVID/Coronavirus Mega Thread,[],r/infertility,False,0,,0,,,False,t3_fmch7y,False,dark,0.96,,public,21,0,{},,,False,[],,False,False,,{},COVID,False,21,,True,self,False,,[],{},,True,,1584811972.0,text,0,,,text,self.infertility,True,"<!-- SC_OFF --><div class=""md""><p>In light of the news and many side discussions concerning anxiety around COVID, the mod squad has decided to direct all COVID related items to this superthread.</p>

<p>Part of what is so valuable about this sub is our imperative to cultivate healthy spaces that don’t jeopardize the mental health of our members. We recognize that discussions of COVID are saturating the public consciousness, and in an effort to limit anxiety triggers where we can, we need to keep our daily threads and standalones focused on supporting our members dealing with infertility specifically.</p>

<p>We are asking all of our members to honor their commitment to keeping this a safe space. Please kindly direct anything COVID related to the official COVID posts: <a href=""https://www.reddit.com/r/infertility/search?q=flair_name%3A%22COVID%22&amp;restrict_sr=1"">https://www.reddit.com/r/infertility/search?q=flair_name%3A%22COVID%22&amp;restrict_sr=1</a>  Recurring posts will publish Wednesdays and Saturdays.  Use the report function as needed.</p>

<p>With love, The Mod Squad</p>

<p>Via <a href=""/u/corvidx"">u/corvidx</a>, a great site to visit for all your questions - <a href=""http://www.flattenthecurve.com"">http://www.flattenthecurve.com</a></p>

<p>ASRM Guidelines during COVID link here - <a href=""https://www.asrm.org/news-and-publications/patient-management-and-clinical-recommendations-during-the-coronavirus-covid-19-pandemic/"">https://www.asrm.org/news-and-publications/patient-management-and-clinical-recommendations-during-the-coronavirus-covid-19-pandemic/</a></p>
</div><!-- SC_ON -->",,new,,,True,False,False,False,False,[],[],False,,False,False,False,,[],False,,,moderator,t5_2saej,,,,fmch7y,True,,AutoModerator,,92,False,no_ads,False,[],False,,/r/infertility/comments/fmch7y/covidcoronavirus_mega_thread/,no_ads,False,https://www.reddit.com/r/infertility/comments/fmch7y/covidcoronavirus_mega_thread/,25378,1584783172.0,0,,False,False,{},self,"{'images': [{'source': {'url': 'https://external-preview.redd.it/T1s0a_1ylxJPKrTdWlDedJzNTXSaa1xSpH-hPRcwQxY.jpg?auto=webp&s=b444a6c454ae9825762a75e02822a7e4257990bc', 'width': 1600, 'height': 614}, 'resolutions': [{'url': 'https://external-preview.redd.it/T1s0a_1ylxJPKrTdWlDedJzNTXSaa1xSpH-hPRcwQxY.jpg?width=108&crop=smart&auto=webp&s=c93dbcdd4a4c1a82eeb557d165f277eaa2f6e86f', 'width': 108, 'height': 41}, {'url': 'https://external-preview.redd.it/T1s0a_1ylxJPKrTdWlDedJzNTXSaa1xSpH-hPRcwQxY.jpg?width=216&crop=smart&auto=webp&s=eae42fef0053bd9532c7222a699ecc9536fba8fb', 'width': 216, 'height': 82}, {'url': 'https://external-preview.redd.it/T1s0a_1ylxJPKrTdWlDedJzNTXSaa1xSpH-hPRcwQxY.jpg?width=320&crop=smart&auto=webp&s=bef79643d998f25bef61dc990bd83aeac1589fda', 'width': 320, 'height': 122}, {'url': 'https://external-preview.redd.it/T1s0a_1ylxJPKrTdWlDedJzNTXSaa1xSpH-hPRcwQxY.jpg?width=640&crop=smart&auto=webp&s=d03f2fb843d95f4bd9f4cbab0b82db2ca3a08862', 'width': 640, 'height': 245}, {'url': 'https://external-preview.redd.it/T1s0a_1ylxJPKrTdWlDedJzNTXSaa1xSpH-hPRcwQxY.jpg?width=960&crop=smart&auto=webp&s=bd6773ac3a4867e5d4f8cee686877e58e4f5f7f2', 'width': 960, 'height': 368}, {'url': 'https://external-preview.redd.it/T1s0a_1ylxJPKrTdWlDedJzNTXSaa1xSpH-hPRcwQxY.jpg?width=1080&crop=smart&auto=webp&s=34e338af4cad382b447cf4b390f4de82e9f9d530', 'width': 1080, 'height': 414}], 'variants': {}, 'id': 'XbfSLWQ6j-ELsFqC0l_AjvCO1IKHkKznquevdfelSWU'}], 'enabled': False}",,,
128,2048,confidence,<praw.reddit.Reddit object at 0x7f2244aead90>,,infertility,[deleted],,False,,0,False,Begining Our Sperm Donor Journey,[],r/infertility,False,0,,0,,,False,t3_fm6om6,False,dark,1.0,,public,3,0,{},,,False,[],,False,False,,{},,False,3,,,default,False,,,{},,True,,1584781895.0,text,0,deleted,,,self.infertility,False,"<!-- SC_OFF --><div class=""md""><p>[deleted]</p>
</div><!-- SC_ON -->",,,,,True,False,False,False,False,[],[],False,,False,False,False,,[],False,,,,t5_2saej,,,,fm6om6,False,,,,13,True,no_ads,False,[],,dark,/r/infertility/comments/fm6om6/begining_our_sperm_donor_journey/,no_ads,False,https://www.reddit.com/r/infertility/comments/fm6om6/begining_our_sperm_donor_journey/,25378,1584753095.0,0,,False,False,{},,,,,
129,2048,confidence,<praw.reddit.Reddit object at 0x7f2244aead90>,,infertility,"History: spontaneous conception (living child 2017); MMC@8w 10/18 (no POC tested); possible chemical 06/19; MMC@8w 12/19 (trisomy 9); 3 D&C's, 2 hysteroscopy's, 1 c-section

Just got off the phone with my husband's urologist. He has a varicocele on his left testicle, confirmed via ultrasound. With two semen analysis's, here are his results:

Dates: 2/20/20, 3/12/20

Volume: 3.0/2.5

Sperm(mil/mL): 11.1/16.4

Progressive Motility: 33%/20%

Form: 11%/10%

Total motile count (mil): 10.9/8.2

The doctor recommends surgery to fix the varicocele (which won't happen until summer at least, because COVID19), and a DNA fragmentation test. Insurance doesn't cover it, so I just emailed SCSA Diagnostics to see if they're currently doing them (COVID19). His doc said he would be happy to go over the DNA frag. results if we bring them to him. I want to do it because at first, he recommended IUI, but I'm wondering if the results would sway us in another direction (IVF, or something else I'm unaware of?).

Where do we go from here? Is IVF our best bet, since we can PGS test each embryo before transfer? He said you can test the embryo, but I think he was concerned that every embryo would be defected if his sperm do have DNA frag. He said try not to stress and still keep trying, but I'm afraid of trying naturally because its just like 'rolling the dice.'

At this point, if I were offered IVF, I would do it.

Any help would be appreciated and thank you for reading if you got this far. Reddit infertility subs have helped me tremendously in knowing what to expect from his call today. I was prepared from all of my reading through this sub and knew exactly what he was referring to. And fuck MY infertility doctor, who said my husband got me pregnant so there's no reason to worry its DNA frag from his varicocele, and that it must be my uterus that can't carry a baby because I had asherman's in the past.

Crossposted into r/SecondaryInfertility",t2_fsx3rc6,False,,0,False,Do we have male factor infertility?,[],r/infertility,False,0,,0,,,False,t3_fm4j10,False,dark,0.78,,public,5,0,{},,,False,[],,False,False,,{},TW: Mention of Children,False,5,,False,self,False,,[],{},,True,,1584773603.0,text,0,,,text,self.infertility,False,"<!-- SC_OFF --><div class=""md""><p>History: spontaneous conception (living child 2017); MMC@8w 10/18 (no POC tested); possible chemical 06/19; MMC@8w 12/19 (trisomy 9); 3 D&amp;C&#39;s, 2 hysteroscopy&#39;s, 1 c-section</p>

<p>Just got off the phone with my husband&#39;s urologist. He has a varicocele on his left testicle, confirmed via ultrasound. With two semen analysis&#39;s, here are his results:</p>

<p>Dates: 2/20/20, 3/12/20</p>

<p>Volume: 3.0/2.5</p>

<p>Sperm(mil/mL): 11.1/16.4</p>

<p>Progressive Motility: 33%/20%</p>

<p>Form: 11%/10%</p>

<p>Total motile count (mil): 10.9/8.2</p>

<p>The doctor recommends surgery to fix the varicocele (which won&#39;t happen until summer at least, because COVID19), and a DNA fragmentation test. Insurance doesn&#39;t cover it, so I just emailed SCSA Diagnostics to see if they&#39;re currently doing them (COVID19). His doc said he would be happy to go over the DNA frag. results if we bring them to him. I want to do it because at first, he recommended IUI, but I&#39;m wondering if the results would sway us in another direction (IVF, or something else I&#39;m unaware of?).</p>

<p>Where do we go from here? Is IVF our best bet, since we can PGS test each embryo before transfer? He said you can test the embryo, but I think he was concerned that every embryo would be defected if his sperm do have DNA frag. He said try not to stress and still keep trying, but I&#39;m afraid of trying naturally because its just like &#39;rolling the dice.&#39;</p>

<p>At this point, if I were offered IVF, I would do it.</p>

<p>Any help would be appreciated and thank you for reading if you got this far. Reddit infertility subs have helped me tremendously in knowing what to expect from his call today. I was prepared from all of my reading through this sub and knew exactly what he was referring to. And fuck MY infertility doctor, who said my husband got me pregnant so there&#39;s no reason to worry its DNA frag from his varicocele, and that it must be my uterus that can&#39;t carry a baby because I had asherman&#39;s in the past.</p>

<p>Crossposted into <a href=""/r/SecondaryInfertility"">r/SecondaryInfertility</a></p>
</div><!-- SC_ON -->",,,,,True,False,False,False,False,[],[],False,b1219312-18de-11e9-ac4b-0e7e9b07becc,False,False,False,,[],False,,,,t5_2saej,,,#dadada,fm4j10,True,,mamaonfire,,5,True,no_ads,False,[],False,,/r/infertility/comments/fm4j10/do_we_have_male_factor_infertility/,no_ads,False,https://www.reddit.com/r/infertility/comments/fm4j10/do_we_have_male_factor_infertility/,25378,1584744803.0,0,,False,False,{},,,,,
130,2048,confidence,<praw.reddit.Reddit object at 0x7f2244aead90>,,infertility,"This is a petition to the ASRM to protest the rules put in place now restricting infertility evaluation and treatments. As an emergency doctor and infertility patient, I know we are not all on the same page about this and we don’t have to be. If you want to wait to see how this plays out, that’s great. If you feel sick about missing your chance to move forward, here is where you sign. 

I personally am 43. I just spent thousands out of pocket and flew across four states in January to fix my scarred uterus to prepare for a fresh transfer. My uterus usually rescars in 3-6 months. I am also in the middle of the best stim cycle of my entire 4 years of ivf. My afc is usually 2-4. This time it was 14. I’ve never even been close to that. Women in my position cannot afford to wait and until a ban on all women reproducing occurs, I don’t see why those with infertility are asked to bear the burden. 

This is also a huge step to legitimizing infertility as a MEDICAL condition and not an “elective” issue. If you want insurance to cover ivf in the future, I strongly encourage you to sign. 

If you would like to share why this personally affects you and where you are in your journey, I think personal stories besides your signature would be powerful. 

Thank you for reading. You are not alone. ❤️ And a huge thank you to my REI Dr. Beverly Reed for writing this so eloquently. I feel honored to stand beside women like her and even more so to have her as my doctor.

ETA for clarification- if a clinic is in SART and doesn’t follow ASRM guidelines, they will face sanctions or be kicked out. Their hands are now tied. The point of the petition is to allow them to make their own decisions. 

[Petition for REIs to make decisions for their patients ](https://change.org/WeSupportWomen)",t2_3fo96t9p,False,,0,False,Petition to allow infertility doctors to decide what’s best for their patients,[],r/infertility,False,0,,0,,,False,t3_fm3gni,False,dark,0.71,,public,55,0,{},,,False,[],,False,False,,{},TW: COVID,False,55,,False,self,1584754867.0,,[],{},,True,,1584769703.0,text,0,,,text,self.infertility,True,"<!-- SC_OFF --><div class=""md""><p>This is a petition to the ASRM to protest the rules put in place now restricting infertility evaluation and treatments. As an emergency doctor and infertility patient, I know we are not all on the same page about this and we don’t have to be. If you want to wait to see how this plays out, that’s great. If you feel sick about missing your chance to move forward, here is where you sign. </p>

<p>I personally am 43. I just spent thousands out of pocket and flew across four states in January to fix my scarred uterus to prepare for a fresh transfer. My uterus usually rescars in 3-6 months. I am also in the middle of the best stim cycle of my entire 4 years of ivf. My afc is usually 2-4. This time it was 14. I’ve never even been close to that. Women in my position cannot afford to wait and until a ban on all women reproducing occurs, I don’t see why those with infertility are asked to bear the burden. </p>

<p>This is also a huge step to legitimizing infertility as a MEDICAL condition and not an “elective” issue. If you want insurance to cover ivf in the future, I strongly encourage you to sign. </p>

<p>If you would like to share why this personally affects you and where you are in your journey, I think personal stories besides your signature would be powerful. </p>

<p>Thank you for reading. You are not alone. ❤️ And a huge thank you to my REI Dr. Beverly Reed for writing this so eloquently. I feel honored to stand beside women like her and even more so to have her as my doctor.</p>

<p>ETA for clarification- if a clinic is in SART and doesn’t follow ASRM guidelines, they will face sanctions or be kicked out. Their hands are now tied. The point of the petition is to allow them to make their own decisions. </p>

<p><a href=""https://change.org/WeSupportWomen"">Petition for REIs to make decisions for their patients </a></p>
</div><!-- SC_ON -->",,,,,True,False,False,False,False,[],[],False,fff6f06e-6af8-11ea-80c1-0e54ce403cf5,False,False,False,,[],False,,,,t5_2saej,,,#dadada,fm3gni,True,,ZebraLonghornMom,,155,True,no_ads,False,[],False,,/r/infertility/comments/fm3gni/petition_to_allow_infertility_doctors_to_decide/,no_ads,False,https://www.reddit.com/r/infertility/comments/fm3gni/petition_to_allow_infertility_doctors_to_decide/,25378,1584740903.0,0,,False,False,{},self,"{'images': [{'source': {'url': 'https://external-preview.redd.it/2ZrN4mXoRNM5Wci-EjHRLHJrM1w7L3Bchx6IH1JVJc0.jpg?auto=webp&s=1f6021702122ce7278a449739d67a2c9512302cb', 'width': 1600, 'height': 900}, 'resolutions': [{'url': 'https://external-preview.redd.it/2ZrN4mXoRNM5Wci-EjHRLHJrM1w7L3Bchx6IH1JVJc0.jpg?width=108&crop=smart&auto=webp&s=e2abc9c4e27ae5952f024d619692152035339bb9', 'width': 108, 'height': 60}, {'url': 'https://external-preview.redd.it/2ZrN4mXoRNM5Wci-EjHRLHJrM1w7L3Bchx6IH1JVJc0.jpg?width=216&crop=smart&auto=webp&s=95ecaf8e6a547e4b1860f60afa16d69f0a0aac18', 'width': 216, 'height': 121}, {'url': 'https://external-preview.redd.it/2ZrN4mXoRNM5Wci-EjHRLHJrM1w7L3Bchx6IH1JVJc0.jpg?width=320&crop=smart&auto=webp&s=e7416e538c502e65547f0ccbbf6ede445494c4db', 'width': 320, 'height': 180}, {'url': 'https://external-preview.redd.it/2ZrN4mXoRNM5Wci-EjHRLHJrM1w7L3Bchx6IH1JVJc0.jpg?width=640&crop=smart&auto=webp&s=72f6d1cce9afc694026ea30025a6e4736323b3ba', 'width': 640, 'height': 360}, {'url': 'https://external-preview.redd.it/2ZrN4mXoRNM5Wci-EjHRLHJrM1w7L3Bchx6IH1JVJc0.jpg?width=960&crop=smart&auto=webp&s=961594f848276bf4e2620f8f70901c61434c3ffb', 'width': 960, 'height': 540}, {'url': 'https://external-preview.redd.it/2ZrN4mXoRNM5Wci-EjHRLHJrM1w7L3Bchx6IH1JVJc0.jpg?width=1080&crop=smart&auto=webp&s=ff57a7008ce08bf6e2e5161901e245b572ccef8c', 'width': 1080, 'height': 607}], 'variants': {}, 'id': 'L3hVYs3Lg58axMJ4gG5e08m3dVdtw3gEDIo_LNRCt1M'}], 'enabled': False}",,,
131,2048,confidence,<praw.reddit.Reddit object at 0x7f2244aead90>,,infertility,"It has been one of those weeks! I got my BC out in September to start TTC. I have been diligently attempting to track my cycles since. I was doing BBT (Ava), OPKs, checking CM and on top of varying period lengths **nothing** was adding up. Despite people telling me not to worry, and just relax your cycle will normalize I decided to see my OB. Thinking I was probably overreacting I was shocked that I left that appointment with a PCOS diagnoses, a script for Letrozole and the option of starting my journey with a fertility clinic. Now I am sitting in quarantine, googling this new information to death, and not so patiently waiting for my period to start (on day 42 wtf?!!). 

Looking for any words of advice, information, magic spells to make your period start etc.",t2_4rjnf1n3,False,,0,False,Intro 29/Newly Diagnosed PCOS,[],r/infertility,False,0,,0,,,False,t3_fm3eco,False,dark,0.5,,public,0,0,{},,,False,[],,False,False,,{},Introduction,False,0,,False,self,False,,[],{},,True,,1584769460.0,text,0,,,text,self.infertility,True,"<!-- SC_OFF --><div class=""md""><p>It has been one of those weeks! I got my BC out in September to start TTC. I have been diligently attempting to track my cycles since. I was doing BBT (Ava), OPKs, checking CM and on top of varying period lengths <strong>nothing</strong> was adding up. Despite people telling me not to worry, and just relax your cycle will normalize I decided to see my OB. Thinking I was probably overreacting I was shocked that I left that appointment with a PCOS diagnoses, a script for Letrozole and the option of starting my journey with a fertility clinic. Now I am sitting in quarantine, googling this new information to death, and not so patiently waiting for my period to start (on day 42 wtf?!!). </p>

<p>Looking for any words of advice, information, magic spells to make your period start etc.</p>
</div><!-- SC_ON -->",,,,,True,True,False,False,False,[],[],False,2839f5b6-18df-11e9-8133-0eec4405e856,False,False,False,,[],False,,,,t5_2saej,,,#dadada,fm3eco,True,,dloux0307,,3,True,no_ads,False,[],False,,/r/infertility/comments/fm3eco/intro_29newly_diagnosed_pcos/,no_ads,False,https://www.reddit.com/r/infertility/comments/fm3eco/intro_29newly_diagnosed_pcos/,25378,1584740660.0,0,,False,False,{},,,,,
132,2048,confidence,<praw.reddit.Reddit object at 0x7f2244aead90>,,infertility,"I had Egg Retrieval on Saturday. The hospital was a scary place.. tents set up outside the ER. They counted 4 follicles two days prior, but only got 1 mature. It fertilized. I was postop and decided to push to day 5. This lonely embryo wasn’t too healthy on day 3 then today, day 6, no word. I’m crushed. How can I cycle again?????? HELP!",t2_5z3hq8vf,False,,0,False,Last stim cycle failed. How to cycle again without open clinics?,[],r/infertility,False,0,,0,,,False,t3_fm1q0o,False,dark,0.45,,public,0,0,{},,,False,[],,False,False,,{},,False,0,,False,self,False,,[],{},,True,,1584763533.0,text,0,,,text,self.infertility,True,"<!-- SC_OFF --><div class=""md""><p>I had Egg Retrieval on Saturday. The hospital was a scary place.. tents set up outside the ER. They counted 4 follicles two days prior, but only got 1 mature. It fertilized. I was postop and decided to push to day 5. This lonely embryo wasn’t too healthy on day 3 then today, day 6, no word. I’m crushed. How can I cycle again?????? HELP!</p>
</div><!-- SC_ON -->",,,,,True,True,False,False,False,[],[],False,,False,False,False,,[],False,,,,t5_2saej,,,,fm1q0o,True,,swiftlywrites,,10,True,no_ads,False,[],False,,/r/infertility/comments/fm1q0o/last_stim_cycle_failed_how_to_cycle_again_without/,no_ads,False,https://www.reddit.com/r/infertility/comments/fm1q0o/last_stim_cycle_failed_how_to_cycle_again_without/,25378,1584734733.0,0,,False,False,{},,,,,
133,2048,confidence,<praw.reddit.Reddit object at 0x7f2244aead90>,,infertility,[removed],t2_5z3hq8vf,False,,0,False,Stop the ban on IVF !!! See text for change.org petition and link!,[],r/infertility,False,0,,0,,,False,t3_fm1fqq,False,dark,0.33,,public,0,0,{},,,False,[],,False,False,,{},,False,0,,False,default,False,,[],{},,True,,1584762567.0,text,0,moderator,,text,self.infertility,False,"<!-- SC_OFF --><div class=""md""><p>[removed]</p>
</div><!-- SC_ON -->",,,,,True,True,False,False,False,[],[],False,,False,False,False,,[],False,,,,t5_2saej,,,,fm1fqq,False,,swiftlywrites,,0,True,no_ads,False,[],False,,/r/infertility/comments/fm1fqq/stop_the_ban_on_ivf_see_text_for_changeorg/,no_ads,False,https://www.reddit.com/r/infertility/comments/fm1fqq/stop_the_ban_on_ivf_see_text_for_changeorg/,25378,1584733767.0,0,,False,False,{},,,,,
134,2048,confidence,<praw.reddit.Reddit object at 0x7f2244aead90>,,infertility,"The treatment thread is for updates on your current cycle, questions about medications, or advice on easier/basic questions.  Find a cycle buddy, commiserate on side effects, or cheer on your peers as they endure the hunger games.  Positive HPT or Beta Results should only be posted in the Results thread as per the rules: https://www.reddit.com/r/infertility/?f=flair_name%3A%22Results%22.

We recognize that the AM/PM distinction doesn't match up with every time zone in our global community, just pick the most recently posted one where ever you are.

Stand alone posts can be used for more complex topics such as asking for opinions on studies, introducing yourself with your medical history, or asking more complex questions around treatment plans, etc.",t2_6l4z3,False,,0,False,Friday PM Treatment Thread,[],r/infertility,False,0,,0,,,False,t3_flyl6r,False,dark,0.88,,public,12,0,{},,,False,[],,False,False,,{},Daily,False,12,,True,self,False,,[],{},,True,,1584752816.0,text,0,,,text,self.infertility,False,"<!-- SC_OFF --><div class=""md""><p>The treatment thread is for updates on your current cycle, questions about medications, or advice on easier/basic questions.  Find a cycle buddy, commiserate on side effects, or cheer on your peers as they endure the hunger games.  Positive HPT or Beta Results should only be posted in the Results thread as per the rules: <a href=""https://www.reddit.com/r/infertility/?f=flair_name%3A%22Results%22"">https://www.reddit.com/r/infertility/?f=flair_name%3A%22Results%22</a>.</p>

<p>We recognize that the AM/PM distinction doesn&#39;t match up with every time zone in our global community, just pick the most recently posted one where ever you are.</p>

<p>Stand alone posts can be used for more complex topics such as asking for opinions on studies, introducing yourself with your medical history, or asking more complex questions around treatment plans, etc.</p>
</div><!-- SC_ON -->",,new,,,True,False,False,False,False,[],[],False,,False,False,False,,[],False,,,moderator,t5_2saej,,,,flyl6r,True,,AutoModerator,,60,False,no_ads,False,[],False,,/r/infertility/comments/flyl6r/friday_pm_treatment_thread/,no_ads,False,https://www.reddit.com/r/infertility/comments/flyl6r/friday_pm_treatment_thread/,25378,1584724016.0,0,,False,False,{},,,,,
