57,2048,confidence,<praw.reddit.Reddit object at 0x7f2244aead90>,,infertility,"There. I said it. I have had a miscarriage. It happened so quickly that sometimes i forget that it happened. But it did. I was pregnant and i got to feel the excitement of that for 3 whole days. And then it all ended. And i felt sad. And angry. And defeated. But a tinge of hopefulness crept out and i rode that wave as much as i could. After trying for 1.5 yrs, fertility monitoring, multiple rounds of letrozole, i had my first positive blood test. We estimate that i was only around 4-5 weeks when it ended. But i had done it! But the excitement of it happening has worn off. And now its just the sadness. And anger. Newly sparked by the fact that cycles are being suspended/postponed until the environment is healthier. And the surge of baby boom memes is infuriating. And its going to be so painful seeing all of the babies born in 9 months and i hope so badly that none of my friends are one of those people. Because i don’t think i could be happy for them. 

Just needed to let out some thoughts. 

Thinking of all of you during this really sucky time and i hope you are hanging in there.",t2_u3bhn,False,,0,False,I have had a miscarriage. (PCOS; TTC 1.5 yrs; 28yrs old; first pregnancy; first loss),[],r/infertility,False,0,,0,,,False,t3_fpnbve,False,dark,0.92,,public,22,0,{},,,False,[],,False,False,,{},,False,22,,False,self,False,,[],{},,True,,1585298485.0,text,0,,,text,self.infertility,True,"<!-- SC_OFF --><div class=""md""><p>There. I said it. I have had a miscarriage. It happened so quickly that sometimes i forget that it happened. But it did. I was pregnant and i got to feel the excitement of that for 3 whole days. And then it all ended. And i felt sad. And angry. And defeated. But a tinge of hopefulness crept out and i rode that wave as much as i could. After trying for 1.5 yrs, fertility monitoring, multiple rounds of letrozole, i had my first positive blood test. We estimate that i was only around 4-5 weeks when it ended. But i had done it! But the excitement of it happening has worn off. And now its just the sadness. And anger. Newly sparked by the fact that cycles are being suspended/postponed until the environment is healthier. And the surge of baby boom memes is infuriating. And its going to be so painful seeing all of the babies born in 9 months and i hope so badly that none of my friends are one of those people. Because i don’t think i could be happy for them. </p>

<p>Just needed to let out some thoughts. </p>

<p>Thinking of all of you during this really sucky time and i hope you are hanging in there.</p>
</div><!-- SC_ON -->",,,,,True,False,False,False,False,[],[],False,,False,False,False,,[],False,,,,t5_2saej,,,,fpnbve,True,,OldLadyWithACat,,17,True,no_ads,False,[],False,,/r/infertility/comments/fpnbve/i_have_had_a_miscarriage_pcos_ttc_15_yrs_28yrs/,no_ads,False,https://www.reddit.com/r/infertility/comments/fpnbve/i_have_had_a_miscarriage_pcos_ttc_15_yrs_28yrs/,25378,1585269685.0,0,,False,False,{},,,,,
58,2048,confidence,<praw.reddit.Reddit object at 0x7f2244aead90>,,infertility,"  

Hello, this is my first post here, I read the rules but English is not my first language so if I write something that is not allowed, please let me know and I will delete.

So, I’m 29 YO, married for almost 2 years and in all that time never got pregnant, this month was different, my period never came, I had a little of a pinkish colored fluid (sorry if this gross you out) but nothing else, I thought it might be Implantation bleeding, but after some days waiting I made a test, negative. 

I don’t have kids, I’ve never been pregnant, I don’t know what is this, what to think, I feel really sad right now. I would like to know if someone had any similar experience to know what to expect before going to the doctor because my period is still missing… so that’s that, thank you for giving me the change to take this out of my chest",t2_4wv84f72,False,,0,False,negative test and sad =(,[],r/infertility,False,0,,0,,,False,t3_fpmzia,False,dark,0.42,,public,0,0,{},,,False,[],,False,False,,{},,False,0,,False,self,False,,[],{},,True,,1585297209.0,text,0,,,text,self.infertility,False,"<!-- SC_OFF --><div class=""md""><p>Hello, this is my first post here, I read the rules but English is not my first language so if I write something that is not allowed, please let me know and I will delete.</p>

<p>So, I’m 29 YO, married for almost 2 years and in all that time never got pregnant, this month was different, my period never came, I had a little of a pinkish colored fluid (sorry if this gross you out) but nothing else, I thought it might be Implantation bleeding, but after some days waiting I made a test, negative. </p>

<p>I don’t have kids, I’ve never been pregnant, I don’t know what is this, what to think, I feel really sad right now. I would like to know if someone had any similar experience to know what to expect before going to the doctor because my period is still missing… so that’s that, thank you for giving me the change to take this out of my chest</p>
</div><!-- SC_ON -->",,,,,True,False,False,False,False,[],[],False,,False,False,False,,[],False,,,,t5_2saej,,,,fpmzia,True,,-SugarCookie-,,3,True,no_ads,False,[],False,,/r/infertility/comments/fpmzia/negative_test_and_sad/,no_ads,False,https://www.reddit.com/r/infertility/comments/fpmzia/negative_test_and_sad/,25378,1585268409.0,0,,False,False,{},,,,,
59,2048,confidence,<praw.reddit.Reddit object at 0x7f2244aead90>,,infertility,"1 ganirelix (exp March 2020) and 1 cetrotide (exp April 2020)

Willing to ship if you pay for shipping

Or local pick up from NY - Westchester (I will leave outside in the mail box - social distancing)",t2_ht31b,False,,0,False,Medication donation - NY,[],r/infertility,False,0,,0,,,False,t3_fpl10n,False,dark,0.78,,public,7,0,{},,d70f54ce-930e-11e4-8710-22000b26873e,False,[],,False,False,,{},X,False,7,,False,self,False,,[],{},,True,,1585290097.0,text,0,,,text,self.infertility,False,"<!-- SC_OFF --><div class=""md""><p>1 ganirelix (exp March 2020) and 1 cetrotide (exp April 2020)</p>

<p>Willing to ship if you pay for shipping</p>

<p>Or local pick up from NY - Westchester (I will leave outside in the mail box - social distancing)</p>
</div><!-- SC_ON -->",,,,,True,False,False,False,False,[],[],False,,False,False,False,"39F, DOR/MFI, 3 CP, 1MC, ivf #7 ",[],False,,,,t5_2saej,,,,fpl10n,True,,Jyc97,,1,True,no_ads,False,[],False,dark,/r/infertility/comments/fpl10n/medication_donation_ny/,no_ads,False,https://www.reddit.com/r/infertility/comments/fpl10n/medication_donation_ny/,25378,1585261297.0,0,,False,False,{},,,,,
60,2048,confidence,<praw.reddit.Reddit object at 0x7f2244aead90>,,infertility,"TW: brief mention of loss

Hi y'all. Hope you're keeping sane in this crazy world we are living in! Since my FET failed, I have been trying to take a break from Reddit.. but here I am again!

Since we are on a forced break, I have had too much time to consider everything and I need some help to understand my diagnosis and how it actually affects my fertility.

When I first started to see my RE years ago, my AMH tested at 0.58. He didn't give me an actual diagnosis, just told me that the AMH would indicate that my ovarian reserve was ""probably"" lower than it should be for my age, but that I should have good quality eggs because of my age (I was 29 at the time). All of my other tests were within normal ranges and my husbands SA was excellent. 

Recently, my clinic was taken over by a bigger clinic and lots of changes have happened. I noticed that my chart now says DOR. From being on this subreddit for awhile now, I know that low AMH isn't the only indicator usually. So, I'm curious. How does low AMH prevent me from spontaneously conceiving? I assumed that there was another issue at play, but after a reasonably successful round of IVF, I feel like I know even less. 

Summary of my IVF experience:

7 retrieved, 5 mature, 4 fertilized with ICSI, 1 fertilized with IVF, 4 made it to blast, all Grade 1 (highest quality). Fresh transfer of only IVF embryo resulted in MMC at 10w4d (stopped growing at 8w1d). First FET was complete failure - no implantation.

So, I feel like now we know an egg can fertilize and become a blast, it can implant.. what's left? Is it possible still that my egg quality is poor and none of my embryos are normal? Was my lining never thick enough before doing medicated cycles? Did I not have enough progesterone to supplement after ovulation? So many questions and I can't seem to get answers.. I know a lot of you are in the same ambiguous boat, but if anyone has any insight to help, I would so appreciate it!",t2_3u00klmo,False,,0,False,DOR - help me to understand?,[],r/infertility,False,0,,0,,,False,t3_fpjlbn,False,dark,0.75,,public,4,0,{},,d70f54ce-930e-11e4-8710-22000b26873e,False,[],,False,False,,{},,False,4,,False,self,False,,[],{},,True,,1585285316.0,text,0,,,text,self.infertility,False,"<!-- SC_OFF --><div class=""md""><p>TW: brief mention of loss</p>

<p>Hi y&#39;all. Hope you&#39;re keeping sane in this crazy world we are living in! Since my FET failed, I have been trying to take a break from Reddit.. but here I am again!</p>

<p>Since we are on a forced break, I have had too much time to consider everything and I need some help to understand my diagnosis and how it actually affects my fertility.</p>

<p>When I first started to see my RE years ago, my AMH tested at 0.58. He didn&#39;t give me an actual diagnosis, just told me that the AMH would indicate that my ovarian reserve was &quot;probably&quot; lower than it should be for my age, but that I should have good quality eggs because of my age (I was 29 at the time). All of my other tests were within normal ranges and my husbands SA was excellent. </p>

<p>Recently, my clinic was taken over by a bigger clinic and lots of changes have happened. I noticed that my chart now says DOR. From being on this subreddit for awhile now, I know that low AMH isn&#39;t the only indicator usually. So, I&#39;m curious. How does low AMH prevent me from spontaneously conceiving? I assumed that there was another issue at play, but after a reasonably successful round of IVF, I feel like I know even less. </p>

<p>Summary of my IVF experience:</p>

<p>7 retrieved, 5 mature, 4 fertilized with ICSI, 1 fertilized with IVF, 4 made it to blast, all Grade 1 (highest quality). Fresh transfer of only IVF embryo resulted in MMC at 10w4d (stopped growing at 8w1d). First FET was complete failure - no implantation.</p>

<p>So, I feel like now we know an egg can fertilize and become a blast, it can implant.. what&#39;s left? Is it possible still that my egg quality is poor and none of my embryos are normal? Was my lining never thick enough before doing medicated cycles? Did I not have enough progesterone to supplement after ovulation? So many questions and I can&#39;t seem to get answers.. I know a lot of you are in the same ambiguous boat, but if anyone has any insight to help, I would so appreciate it!</p>
</div><!-- SC_ON -->",,,,,True,False,False,False,False,[],[],False,,False,False,False,"33F | DOR | MMC 12/19 | 1 FR, 2 FET",[],False,,,,t5_2saej,,,,fpjlbn,True,,sherribear11,,10,True,no_ads,False,[],False,dark,/r/infertility/comments/fpjlbn/dor_help_me_to_understand/,no_ads,False,https://www.reddit.com/r/infertility/comments/fpjlbn/dor_help_me_to_understand/,25378,1585256516.0,0,,False,False,{},,,,,
61,2048,confidence,<praw.reddit.Reddit object at 0x7f2244aead90>,,infertility,"My sister and her boyfriend are having a baby and we just found out on March 7. My husband and I have been struggling to get pregnant. We have now ""tried"" 27 times without any success. They are aware, my husband had a vasectomy and in 2018 my mom was terminally ill. Her dying wish was to be a grandma, so we reversed his vasectomy so we could try to fulfill her dream. My whole family knew what was going on, of course, so we have not been able to hide our struggles. At this point, for me, pregnancy and babies has not brought me anything except heartache. I struggle to have conversations with all of my friends who are expecting, because I just do my best to hold back tears. For those who have newborns I just spend as much time with their babies as I can and leave little room for conversation so I do not have to get emotional. I do not want to be this way, I wish it were easy. Yes, we have seen doctors. We have done testing. No one can find anything wrong, we just can't get pregnant. 

My sister and I are very close. She's my best friend. Of course, I am so happy for her. I more than anyone know how incredibly amazing it is to become a parent! To get to bring a new life into this world. It's all I have dreamed of my entire life. But for right now, I am just really crushed. My sister is just one of many people in our lives who have decided ""we want to have a baby"" and within 6 months they are sharing their news. I just need some time for my mental health right now before I can jump in and be there for her and find out what I can do for her to make this a positive experience, but my whole family including my husband is telling me that I should feel happy, excited, and that I should be talking to her right now, and I am overwhelmed. I do not feel ready. 

I sent her flowers after the weekend we all found out saying ""I love you"" since I knew she was aware that I was upset. She thanked me, I said I am excited to have a little niece/nephew, but that I just need   
a little time for me right now, and she told me she understood, but this last week she was over at my house and got upset with me for not supporting her. I am struggling so hard to feel happiness for everyone else. What can I do?",t2_4euvexoz,False,,0,False,"Infertility struggles are making me a miserable person, how can I fix me?",[],r/infertility,False,0,,0,,,False,t3_fphff5,False,dark,0.94,,public,30,0,{},,,False,[],,False,False,,{},,False,30,,False,self,False,,[],{},,True,,1585278135.0,text,0,,,text,self.infertility,True,"<!-- SC_OFF --><div class=""md""><p>My sister and her boyfriend are having a baby and we just found out on March 7. My husband and I have been struggling to get pregnant. We have now &quot;tried&quot; 27 times without any success. They are aware, my husband had a vasectomy and in 2018 my mom was terminally ill. Her dying wish was to be a grandma, so we reversed his vasectomy so we could try to fulfill her dream. My whole family knew what was going on, of course, so we have not been able to hide our struggles. At this point, for me, pregnancy and babies has not brought me anything except heartache. I struggle to have conversations with all of my friends who are expecting, because I just do my best to hold back tears. For those who have newborns I just spend as much time with their babies as I can and leave little room for conversation so I do not have to get emotional. I do not want to be this way, I wish it were easy. Yes, we have seen doctors. We have done testing. No one can find anything wrong, we just can&#39;t get pregnant. </p>

<p>My sister and I are very close. She&#39;s my best friend. Of course, I am so happy for her. I more than anyone know how incredibly amazing it is to become a parent! To get to bring a new life into this world. It&#39;s all I have dreamed of my entire life. But for right now, I am just really crushed. My sister is just one of many people in our lives who have decided &quot;we want to have a baby&quot; and within 6 months they are sharing their news. I just need some time for my mental health right now before I can jump in and be there for her and find out what I can do for her to make this a positive experience, but my whole family including my husband is telling me that I should feel happy, excited, and that I should be talking to her right now, and I am overwhelmed. I do not feel ready. </p>

<p>I sent her flowers after the weekend we all found out saying &quot;I love you&quot; since I knew she was aware that I was upset. She thanked me, I said I am excited to have a little niece/nephew, but that I just need<br/>
a little time for me right now, and she told me she understood, but this last week she was over at my house and got upset with me for not supporting her. I am struggling so hard to feel happiness for everyone else. What can I do?</p>
</div><!-- SC_ON -->",,,,,True,False,False,False,False,[],[],False,,False,False,False,,[],False,,,,t5_2saej,,,,fphff5,True,,bcnorthgirl,,25,True,no_ads,False,[],False,,/r/infertility/comments/fphff5/infertility_struggles_are_making_me_a_miserable/,no_ads,False,https://www.reddit.com/r/infertility/comments/fphff5/infertility_struggles_are_making_me_a_miserable/,25378,1585249335.0,0,,False,False,{},,,,,
62,2048,confidence,<praw.reddit.Reddit object at 0x7f2244aead90>,,infertility,[removed],,False,,0,False,Any one had successful implantation with uterus polyps?,[],r/infertility,False,0,,0,,,False,t3_fphanj,False,dark,1.0,,public,1,0,{},,,False,[],,False,False,,{},,False,1,,,default,False,,,{},,True,,1585277707.0,text,0,deleted,,,self.infertility,False,"<!-- SC_OFF --><div class=""md""><p>[removed]</p>
</div><!-- SC_ON -->",,,,,True,True,False,False,False,[],[],False,,False,False,False,,[],False,,,,t5_2saej,,,,fphanj,False,,,,1,True,no_ads,False,[],,dark,/r/infertility/comments/fphanj/any_one_had_successful_implantation_with_uterus/,no_ads,False,https://www.reddit.com/r/infertility/comments/fphanj/any_one_had_successful_implantation_with_uterus/,25378,1585248907.0,0,,False,False,{},,,,,
63,2048,confidence,<praw.reddit.Reddit object at 0x7f2244aead90>,,infertility,"The treatment thread is for updates on your current cycle, questions about medications, or advice on easier/basic questions.  Find a cycle buddy, commiserate on side effects, or cheer on your peers as they endure the hunger games.  Positive HPT or Beta Results should only be posted in the Results thread as per the rules: https://www.reddit.com/r/infertility/?f=flair_name%3A%22Results%22.

We recognize that the AM/PM distinction doesn't match up with every time zone in our global community, just pick the most recently posted one where ever you are.

Stand alone posts can be used for more complex topics such as asking for opinions on studies, introducing yourself with your medical history, or asking more complex questions around treatment plans, etc.",t2_6l4z3,False,,0,False,Thursday PM Treatment Thread,[],r/infertility,False,0,,0,,,False,t3_fpf83f,False,dark,0.82,,public,7,0,{},,,False,[],,False,False,,{},Daily,False,7,,True,self,False,,[],{},,True,,1585271215.0,text,0,,,text,self.infertility,False,"<!-- SC_OFF --><div class=""md""><p>The treatment thread is for updates on your current cycle, questions about medications, or advice on easier/basic questions.  Find a cycle buddy, commiserate on side effects, or cheer on your peers as they endure the hunger games.  Positive HPT or Beta Results should only be posted in the Results thread as per the rules: <a href=""https://www.reddit.com/r/infertility/?f=flair_name%3A%22Results%22"">https://www.reddit.com/r/infertility/?f=flair_name%3A%22Results%22</a>.</p>

<p>We recognize that the AM/PM distinction doesn&#39;t match up with every time zone in our global community, just pick the most recently posted one where ever you are.</p>

<p>Stand alone posts can be used for more complex topics such as asking for opinions on studies, introducing yourself with your medical history, or asking more complex questions around treatment plans, etc.</p>
</div><!-- SC_ON -->",,new,,,True,False,False,False,False,[],[],False,,False,False,False,,[],False,,,moderator,t5_2saej,,,,fpf83f,True,,AutoModerator,,46,False,no_ads,False,[],False,,/r/infertility/comments/fpf83f/thursday_pm_treatment_thread/,no_ads,False,https://www.reddit.com/r/infertility/comments/fpf83f/thursday_pm_treatment_thread/,25378,1585242415.0,0,,False,False,{},,,,,
64,2048,confidence,<praw.reddit.Reddit object at 0x7f2244aead90>,,infertility,"If you have questions or updates on treatment, consider the Daily Treatment thread instead!  Positive HPT or Beta Results should only be posted in the Results thread as per the rules: https://www.reddit.com/r/infertility/?f=flair_name%3A%22Results%22.

Use this thread to share things that are NOT specific to treatment.  Rant, rave, bitch, moan, share something funny, post a picture of your pet, nothing is off-topic here.  It is a great place to get to know people that aren't in the middle of a treatment cycle, are waiting on treatment, or are pursuing non-treatment focused paths.  Infertility related talk is absolutely still allowed in the chat thread.

We recognize that the AM/PM distinction doesn't match up with every time zone in our global community, just pick the most recently posted one where ever you are.",t2_6l4z3,False,,0,False,Thursday PM Chat Thread,[],r/infertility,False,0,,0,,,False,t3_fpf7zc,False,dark,0.82,,public,7,0,{},,,False,[],,False,False,,{},Daily,False,7,,True,self,False,,[],{},,True,,1585271204.0,text,0,,,text,self.infertility,False,"<!-- SC_OFF --><div class=""md""><p>If you have questions or updates on treatment, consider the Daily Treatment thread instead!  Positive HPT or Beta Results should only be posted in the Results thread as per the rules: <a href=""https://www.reddit.com/r/infertility/?f=flair_name%3A%22Results%22"">https://www.reddit.com/r/infertility/?f=flair_name%3A%22Results%22</a>.</p>

<p>Use this thread to share things that are NOT specific to treatment.  Rant, rave, bitch, moan, share something funny, post a picture of your pet, nothing is off-topic here.  It is a great place to get to know people that aren&#39;t in the middle of a treatment cycle, are waiting on treatment, or are pursuing non-treatment focused paths.  Infertility related talk is absolutely still allowed in the chat thread.</p>

<p>We recognize that the AM/PM distinction doesn&#39;t match up with every time zone in our global community, just pick the most recently posted one where ever you are.</p>
</div><!-- SC_ON -->",,new,,,True,False,False,False,False,[],[],False,,False,False,False,,[],False,,,moderator,t5_2saej,,,,fpf7zc,True,,AutoModerator,,23,False,no_ads,False,[],False,,/r/infertility/comments/fpf7zc/thursday_pm_chat_thread/,no_ads,False,https://www.reddit.com/r/infertility/comments/fpf7zc/thursday_pm_chat_thread/,25378,1585242404.0,0,,False,False,{},,,,,
65,2048,confidence,<praw.reddit.Reddit object at 0x7f2244aead90>,,infertility,[deleted],,False,,0,False,How long have you been trying ?,[],r/infertility,False,0,,0,,,False,t3_fpekcy,False,dark,0.4,,public,0,0,{},,,False,[],,False,False,,{},,False,0,,,default,False,,,{},,True,,1585269104.0,text,0,deleted,,,self.infertility,False,"<!-- SC_OFF --><div class=""md""><p>[deleted]</p>
</div><!-- SC_ON -->",,new,,,True,False,False,False,False,[],[],False,,False,False,False,,[],False,,,,t5_2saej,,,,fpekcy,False,,,,17,True,no_ads,False,[],,dark,/r/infertility/comments/fpekcy/how_long_have_you_been_trying/,no_ads,False,https://www.reddit.com/r/infertility/comments/fpekcy/how_long_have_you_been_trying/,25378,1585240304.0,0,,False,False,{},,,,,
66,2048,confidence,<praw.reddit.Reddit object at 0x7f2244aead90>,,infertility,"My wife and I were a week away from our first embryo transfer with a 3AB blastocyst. Unfortunately, our company, Boston IVF, who are great are putting things on hold until it's les dangerous I guess. 



Does anyone experience this with their company's or no anything about when you'll think they open up. 

Thanks",t2_15apc5,False,,0,False,Company put a hold on our embryo transfer,[],r/infertility,False,0,,0,,,False,t3_fpboyh,False,dark,0.14,,public,0,0,{},,,False,[],,False,False,,{},,False,0,,False,self,False,,[],{},,True,,1585258946.0,text,0,,,text,self.infertility,False,"<!-- SC_OFF --><div class=""md""><p>My wife and I were a week away from our first embryo transfer with a 3AB blastocyst. Unfortunately, our company, Boston IVF, who are great are putting things on hold until it&#39;s les dangerous I guess. </p>

<p>Does anyone experience this with their company&#39;s or no anything about when you&#39;ll think they open up. </p>

<p>Thanks</p>
</div><!-- SC_ON -->",,,,,True,False,False,False,False,[],[],False,,False,False,False,,[],False,,,,t5_2saej,,,,fpboyh,True,,Nottheunicorn,,5,True,no_ads,False,[],False,,/r/infertility/comments/fpboyh/company_put_a_hold_on_our_embryo_transfer/,no_ads,False,https://www.reddit.com/r/infertility/comments/fpboyh/company_put_a_hold_on_our_embryo_transfer/,25378,1585230146.0,0,,False,False,{},,,,,
