,comment_limit,comment_sort,_reddit,approved_at_utc,subreddit,selftext,author_fullname,saved,mod_reason_title,gilded,clicked,title,link_flair_richtext,subreddit_name_prefixed,hidden,pwls,link_flair_css_class,downs,thumbnail_height,top_awarded_type,hide_score,name,quarantine,link_flair_text_color,upvote_ratio,author_flair_background_color,subreddit_type,ups,total_awards_received,media_embed,thumbnail_width,author_flair_template_id,is_original_content,user_reports,secure_media,is_reddit_media_domain,is_meta,category,secure_media_embed,link_flair_text,can_mod_post,score,approved_by,author_premium,thumbnail,edited,author_flair_css_class,author_flair_richtext,gildings,content_categories,is_self,mod_note,created,link_flair_type,wls,removed_by_category,banned_by,author_flair_type,domain,allow_live_comments,selftext_html,likes,suggested_sort,banned_at_utc,view_count,archived,no_follow,is_crosspostable,pinned,over_18,all_awardings,awarders,media_only,link_flair_template_id,can_gild,spoiler,locked,author_flair_text,treatment_tags,visited,removed_by,num_reports,distinguished,subreddit_id,mod_reason_by,removal_reason,link_flair_background_color,id,is_robot_indexable,report_reasons,author,discussion_type,num_comments,send_replies,whitelist_status,contest_mode,mod_reports,author_patreon_flair,author_flair_text_color,permalink,parent_whitelist_status,stickied,url,subreddit_subscribers,created_utc,num_crossposts,media,is_video,_fetched,_comments_by_id,post_hint,preview,author_cakeday,url_overridden_by_dest,crosspost_parent_list,crosspost_parent
0,2048,confidence,<praw.reddit.Reddit object at 0x7f12a630cd90>,,ttcafterloss,"I delivered a stillborn baby at 40+3 on the 23rd, and my milk started coming in on Thursday (25th). Does anyone recall how long it takes for the engorgement to subside? I’m using the typical tactics to help (tight but not too tight yet supportive bra, cabbage leaves, ibuprofen for pain, icing, no warm water in the shower, peppermint oils/teas, etc.).  Thank you all. ",t2_11c54k,False,,0,False,When does breastmilk stop?,[],r/ttcafterloss,False,0,question,0,,,False,t3_9s04to,False,dark,1.0,,public,6,0,{},,ce4ab51a-711f-11e4-826c-12313d148545,False,[],,False,False,,{},Question,False,6,,False,self,False,,[],{},,True,,1540724253.0,text,0,,,text,self.ttcafterloss,True,"<!-- SC_OFF --><div class=""md""><p>I delivered a stillborn baby at 40+3 on the 23rd, and my milk started coming in on Thursday (25th). Does anyone recall how long it takes for the engorgement to subside? I’m using the typical tactics to help (tight but not too tight yet supportive bra, cabbage leaves, ibuprofen for pain, icing, no warm water in the shower, peppermint oils/teas, etc.).  Thank you all. </p>
</div><!-- SC_ON -->",,new,,,True,False,False,False,False,[],[],False,64bc0a4e-a73f-11e4-8d5c-22000bc1c25f,False,False,False,40 wk stillbirth 10/2018,[],False,,,,t5_34scd,,,,9s04to,True,,youmaynotrememberme,,12,True,no_ads,False,[],False,dark,/r/ttcafterloss/comments/9s04to/when_does_breastmilk_stop/,no_ads,False,https://www.reddit.com/r/ttcafterloss/comments/9s04to/when_does_breastmilk_stop/,10027,1540695453.0,0,,False,False,{},,,,,,
1,2048,confidence,<praw.reddit.Reddit object at 0x7f12a630cd90>,,ttcafterloss,"I appreciate the support guys, but I wish I wasn’t back here. 

Currently I am somewhere in my second month of pregnancy and I found out  and it’s ectopic. I had my dose of methotrexate last night and have not moved from the couch all day. I’m devastated again, defeated and just so tired. This is number 4 failed pregnancy. I should feel fortunate I can get pregnant so easy, but the heart break and toll on my body is just excruciating. I’ll go on, but I don’t want to, and I want to just wear it on my shirt so no one asks me how I am or when I’ll start a family, because I’m not ok and I’m trying god damn it but my body keeps failing my babies. Will the sadness ever end? ",t2_yz9fy,False,,0,False,Here Again,[],r/ttcafterloss,False,0,,0,,,False,t3_9rz51a,False,dark,1.0,,public,27,0,{},,8b677c92-711f-11e4-b63c-12313b0b807d,False,[],,False,False,,{},,False,27,,False,self,False,,[],{},,True,,1540714808.0,text,0,,,text,self.ttcafterloss,True,"<!-- SC_OFF --><div class=""md""><p>I appreciate the support guys, but I wish I wasn’t back here. </p>

<p>Currently I am somewhere in my second month of pregnancy and I found out  and it’s ectopic. I had my dose of methotrexate last night and have not moved from the couch all day. I’m devastated again, defeated and just so tired. This is number 4 failed pregnancy. I should feel fortunate I can get pregnant so easy, but the heart break and toll on my body is just excruciating. I’ll go on, but I don’t want to, and I want to just wear it on my shirt so no one asks me how I am or when I’ll start a family, because I’m not ok and I’m trying god damn it but my body keeps failing my babies. Will the sadness ever end? </p>
</div><!-- SC_ON -->",,new,,,True,False,False,False,False,[],[],False,,False,False,False,"TFMR twins 14 week 01/18, MMC 05/18, ruptured ectopic 10/18, 2CP",[],False,,,,t5_34scd,,,,9rz51a,True,,mandingles,,9,True,no_ads,False,[],False,dark,/r/ttcafterloss/comments/9rz51a/here_again/,no_ads,False,https://www.reddit.com/r/ttcafterloss/comments/9rz51a/here_again/,10027,1540686008.0,0,,False,False,{},,,,,,
2,2048,confidence,<praw.reddit.Reddit object at 0x7f12a630cd90>,,ttcafterloss,"I don’t even know how to deal anymore. 

I’m so conflicted because I’ve shared with them my TTC struggles (I’ve been TTC for 2+ years), shared with them when I found out I was pregnant just a few weeks ago and then immediately after that, I had to shared with them my loss (CP). I have felt so defeated since my loss.

These are the only 2 people on my team at work—both women—and in the last week both of them have become pregnant in their first month of trying! I am happy for them, but I can’t help but feel bitter and completely devastated inside.

They’re both due in June. That should have been when I would be due! It’s so unfair! I don’t know what to do, or say... and while I am so happy for them, I feel like giving up. I feel like quitting my job. 

I don’t know if I can deal with DOUBLE the reminder of my loss for the next 8 months in every single meeting I have at work. I consider both of them friends, but I just don’t know if I can listen to them talk about their pregnancies every day. I am so conflicted, I just want to curl up and cry...

Does anyone have any advice? I’m considering getting mental help, but feel like I would be OK to work through this on my own if I didn’t have so many constant reminders/triggers in my life. :(",t2_2e3saake,False,,0,False,"The only 2 women on my team at work are now pregnant, and told me less than 2 weeks after my loss.",[],r/ttcafterloss,False,0,,0,,,False,t3_9ry5bm,False,dark,0.92,,public,9,0,{},,,False,[],,False,False,,{},,False,9,,False,self,1540678134.0,,[],{},,True,,1540706476.0,text,0,,,text,self.ttcafterloss,True,"<!-- SC_OFF --><div class=""md""><p>I don’t even know how to deal anymore. </p>

<p>I’m so conflicted because I’ve shared with them my TTC struggles (I’ve been TTC for 2+ years), shared with them when I found out I was pregnant just a few weeks ago and then immediately after that, I had to shared with them my loss (CP). I have felt so defeated since my loss.</p>

<p>These are the only 2 people on my team at work—both women—and in the last week both of them have become pregnant in their first month of trying! I am happy for them, but I can’t help but feel bitter and completely devastated inside.</p>

<p>They’re both due in June. That should have been when I would be due! It’s so unfair! I don’t know what to do, or say... and while I am so happy for them, I feel like giving up. I feel like quitting my job. </p>

<p>I don’t know if I can deal with DOUBLE the reminder of my loss for the next 8 months in every single meeting I have at work. I consider both of them friends, but I just don’t know if I can listen to them talk about their pregnancies every day. I am so conflicted, I just want to curl up and cry...</p>

<p>Does anyone have any advice? I’m considering getting mental help, but feel like I would be OK to work through this on my own if I didn’t have so many constant reminders/triggers in my life. :(</p>
</div><!-- SC_ON -->",,new,,,True,False,False,False,False,[],[],False,,False,False,False,,[],False,,,,t5_34scd,,,,9ry5bm,True,,ttcsobadly,,4,True,no_ads,False,[],False,,/r/ttcafterloss/comments/9ry5bm/the_only_2_women_on_my_team_at_work_are_now/,no_ads,False,https://www.reddit.com/r/ttcafterloss/comments/9ry5bm/the_only_2_women_on_my_team_at_work_are_now/,10027,1540677676.0,0,,False,False,{},,,,,,
3,2048,confidence,<praw.reddit.Reddit object at 0x7f12a630cd90>,,ttcafterloss,"I love(d) that community so much and really enjoyed being there. I lurked for a long time before pregnancy, just waiting to jump in. Then I found them incredibly helpful and comforting and fun while I was pregnant. Now I keep visiting because it's habit and because I *want* so badly to be there. 

But it hurts, of course. Every time it makes me cry. I wish I belonged there. I wish I was pregnant. I'm jealous of all their joys and aches and pains and plans. You would think that pain would keep me away, but no. I keep torturing myself. Why do I do this?

The one place I *can't* visit anymore is my monthly bumpers sub. It's too specific. I hope to rejoin babybumps someday, but my opportunity to belong in june2019bumpers is gone forever. ",t2_wcrpc,False,,0,False,I can't stay off babybumps,[],r/ttcafterloss,False,0,,0,,,False,t3_9rwt7t,False,dark,1.0,,public,31,0,{},,,False,[],,False,False,,{},,False,31,,False,self,False,,[],{},,True,,1540695862.0,text,0,,,text,self.ttcafterloss,True,"<!-- SC_OFF --><div class=""md""><p>I love(d) that community so much and really enjoyed being there. I lurked for a long time before pregnancy, just waiting to jump in. Then I found them incredibly helpful and comforting and fun while I was pregnant. Now I keep visiting because it&#39;s habit and because I <em>want</em> so badly to be there. </p>

<p>But it hurts, of course. Every time it makes me cry. I wish I belonged there. I wish I was pregnant. I&#39;m jealous of all their joys and aches and pains and plans. You would think that pain would keep me away, but no. I keep torturing myself. Why do I do this?</p>

<p>The one place I <em>can&#39;t</em> visit anymore is my monthly bumpers sub. It&#39;s too specific. I hope to rejoin babybumps someday, but my opportunity to belong in june2019bumpers is gone forever. </p>
</div><!-- SC_ON -->",,new,,,True,False,False,False,False,[],[],False,,False,False,False,,[],False,,,,t5_34scd,,,,9rwt7t,True,,mothstuckinabath,,19,True,no_ads,False,[],False,,/r/ttcafterloss/comments/9rwt7t/i_cant_stay_off_babybumps/,no_ads,False,https://www.reddit.com/r/ttcafterloss/comments/9rwt7t/i_cant_stay_off_babybumps/,10027,1540667062.0,0,,False,False,{},,,,,,
4,2048,confidence,<praw.reddit.Reddit object at 0x7f12a630cd90>,,ttcafterloss,"Hi I just found this sub and rarely post on reddit but here goes...

I just found out yesterday that my babygirl no longer has a heartbeat and will be delivering her tomorrow. Im 26+5 weeks and this is my second pregnancy. 

 I have a healthy 2,5 year old daughter who was looking very forward to being a big sister. She sings to my stomach the first thing every morning and tells me how she will protect and take care of her baby sister. 

The doctor and midwife told us to bring her in to see the baby when she is born. My husband is kind of against it and I'm afraid it will traumatize her. It feels easier just to say that the baby is gone and we can try for a new baby in the future. But the staff told us it would be good for her to say goodbye this way. 

Anyway... I guess im just looking for someone with experience.. Sorry for my bad english - it's not my native language.",t2_pumeh,False,,0,False,Question about siblings,[],r/ttcafterloss,False,0,,0,,,False,t3_9rwe6b,False,dark,1.0,,public,12,0,{},,,False,[],,False,False,,{},,False,12,,False,self,False,,[],{},,True,,1540692632.0,text,0,,,text,self.ttcafterloss,True,"<!-- SC_OFF --><div class=""md""><p>Hi I just found this sub and rarely post on reddit but here goes...</p>

<p>I just found out yesterday that my babygirl no longer has a heartbeat and will be delivering her tomorrow. Im 26+5 weeks and this is my second pregnancy. </p>

<p>I have a healthy 2,5 year old daughter who was looking very forward to being a big sister. She sings to my stomach the first thing every morning and tells me how she will protect and take care of her baby sister. </p>

<p>The doctor and midwife told us to bring her in to see the baby when she is born. My husband is kind of against it and I&#39;m afraid it will traumatize her. It feels easier just to say that the baby is gone and we can try for a new baby in the future. But the staff told us it would be good for her to say goodbye this way. </p>

<p>Anyway... I guess im just looking for someone with experience.. Sorry for my bad english - it&#39;s not my native language.</p>
</div><!-- SC_ON -->",,new,,,True,False,False,False,False,[],[],False,,False,False,False,,[],False,,,,t5_34scd,,,,9rwe6b,True,,Detective_Bob,,14,True,no_ads,False,[],False,,/r/ttcafterloss/comments/9rwe6b/question_about_siblings/,no_ads,False,https://www.reddit.com/r/ttcafterloss/comments/9rwe6b/question_about_siblings/,10027,1540663832.0,0,,False,False,{},,,,,,
5,2048,confidence,<praw.reddit.Reddit object at 0x7f12a630cd90>,,ttcafterloss,"Hi everyone. 

I don't even know where to start... I am currently going through my 3rd chemical pregnancy. This time I made it farther than I ever have. I really felt like this was the one. I had nausea, heightened sense of smell, exhaustion etc...

I've had no luck with the health professionals (I live in the UK) that I've dealt with because none have actually believed I was ever pregnant. By the time my appointment rolled around I have already miscarried. I'm just at a loss. I feel so defeated and like I'll never have my baby. My husband and I want this so badly.

I'm 27 and in good health. My period is always regular and I can get pregnant very easily. I have no idea what to do next.

Does anyone have any advise? I have no clue how to move forward as no Dr. will believe me.

&#x200B;

Thank you in advance.",t2_2hmryj7g,False,,0,False,Recurrant chemical pregnancies,[],r/ttcafterloss,False,0,,0,,,False,t3_9rvpu2,False,dark,1.0,,public,11,0,{},,,False,[],,False,False,,{},,False,11,,False,self,False,,[],{},,True,,1540687767.0,text,0,,,text,self.ttcafterloss,False,"<!-- SC_OFF --><div class=""md""><p>Hi everyone. </p>

<p>I don&#39;t even know where to start... I am currently going through my 3rd chemical pregnancy. This time I made it farther than I ever have. I really felt like this was the one. I had nausea, heightened sense of smell, exhaustion etc...</p>

<p>I&#39;ve had no luck with the health professionals (I live in the UK) that I&#39;ve dealt with because none have actually believed I was ever pregnant. By the time my appointment rolled around I have already miscarried. I&#39;m just at a loss. I feel so defeated and like I&#39;ll never have my baby. My husband and I want this so badly.</p>

<p>I&#39;m 27 and in good health. My period is always regular and I can get pregnant very easily. I have no idea what to do next.</p>

<p>Does anyone have any advise? I have no clue how to move forward as no Dr. will believe me.</p>

<p>&#x200B;</p>

<p>Thank you in advance.</p>
</div><!-- SC_ON -->",,new,,,True,False,False,False,False,[],[],False,,False,False,False,,[],False,,,,t5_34scd,,,,9rvpu2,True,,marpritch,,18,True,no_ads,False,[],False,,/r/ttcafterloss/comments/9rvpu2/recurrant_chemical_pregnancies/,no_ads,False,https://www.reddit.com/r/ttcafterloss/comments/9rvpu2/recurrant_chemical_pregnancies/,10027,1540658967.0,0,,False,False,{},,,,,,
6,2048,confidence,<praw.reddit.Reddit object at 0x7f12a630cd90>,,ttcafterloss,"Unfortunately, I had a CP last cycle. I am currently at CD10 and started taking OPKs at CD5 in case this cycle was wonky. My wondfos have been negative, but darkening slowly. This morning, I got a high reading on my digital advanced OPK. Last cycle I got my first high reading at CD15.   


Is this something to be concerned about? Is it possible to ovulate early the cycle following CP? I've read about anovulatory or late ovulation cycles following CP, but haven't seen anything about early ovulation. ",t2_7cmj1zq,False,,0,False,What was your post-CP cycle like?,[],r/ttcafterloss,False,0,,0,,,False,t3_9rukti,False,dark,1.0,,public,3,0,{},,ce4ab51a-711f-11e4-826c-12313d148545,False,[],,False,False,,{},,False,3,,False,self,False,,[],{},,True,,1540678727.0,text,0,,,text,self.ttcafterloss,False,"<!-- SC_OFF --><div class=""md""><p>Unfortunately, I had a CP last cycle. I am currently at CD10 and started taking OPKs at CD5 in case this cycle was wonky. My wondfos have been negative, but darkening slowly. This morning, I got a high reading on my digital advanced OPK. Last cycle I got my first high reading at CD15.   </p>

<p>Is this something to be concerned about? Is it possible to ovulate early the cycle following CP? I&#39;ve read about anovulatory or late ovulation cycles following CP, but haven&#39;t seen anything about early ovulation. </p>
</div><!-- SC_ON -->",,new,,,True,False,False,False,False,[],[],False,,False,False,False,27 | TTC #1 after miscarriage 🌈,[],False,,,,t5_34scd,,,,9rukti,True,,minniejh,,7,True,no_ads,False,[],False,dark,/r/ttcafterloss/comments/9rukti/what_was_your_postcp_cycle_like/,no_ads,False,https://www.reddit.com/r/ttcafterloss/comments/9rukti/what_was_your_postcp_cycle_like/,10027,1540649927.0,0,,False,False,{},,,,,,
7,2048,confidence,<praw.reddit.Reddit object at 0x7f12a630cd90>,,ttcafterloss,"First, I want to thank you for all of the heartfelt, supportive messages after I shared our experience with our trisomy 18 diagnosis. I was overwhelmed by your stories and experiences, and it meant so much to me to feel less alone.

We received our amnio results on Monday which confirmed the T-18 diagnosis and also found out we were having a little girl. We were booked into the hospital for Thursday to fulfill a legal waiting period. We spent the next few days preparing - our parents arrived, we chose a name for her, I knitted a wee blanket. 

In the Netherlands, where we live, there is no other option at this stage (20 weeks) than to deliver. While I was quite devastated by the idea at first, now that it’s over I am so grateful for the experience.

I was given Mifepristone to take on Tuesday evening. I arrived at the hospital 9:30 on Thursday where they started inserting the Misoprostil tablets, every two hours. I was offered morphine injections or an epidural. They don’t do walking epidurals here so I chose the morphine - it made me a bit woozy and took the edge off the pain but I could still feel everything. Around 9 hours later, the pain became very intense and the contractions were relentless. Before they could give me morphine, I delivered our daughter with 3 pushes. I had my partner on one side and my mom on the other and I am so grateful they were both there. She wasn’t born breathing.

As I had been scared about seeing her, everyone assured me right away that she looked perfect, just very small - she was under a pound. My partner cut the cord and they put her in my arms and I immediately just loved her. We ended up spending about 6 hours with her before we said goodbye. She was surrounded by love.

My placenta wouldn’t come out so they had to do a small operation to remove everything. I was back home by 2am, a little sore (now very sore, 2 days later) and absolutely heartbroken. I had no idea I would feel this overwhelmingly sad and empty. At the same time, I am thankful for the experience - for something so terrible, it went as well as it could have, and we had amazing, empathetic doctors and midwives guide us through. 

We’ve been told we only need to wait one cycle to try again; we will see if we are emotionally ready though. If anyone wants to talk about their experience, or having to deliver, please reach out to me - I don’t have a ‘real life’ support group so this is helping tremendously and talking about it feels healthy.

I’d also be very interested in talking to someone who has also had a trisomy 18 pregnancy, and anyone who has subsequently had a successful pregnancy - we are waiting for our full karyotype results and while the doctors have assured us this was most likely a fluke, I still worry. 

Again, thank you to all you incredibly strong women and men out there ❤️ ",t2_hl3f4v1,False,,0,False,Update: I delivered our little girl on Thursday (TFMR),[],r/ttcafterloss,False,0,,0,,,False,t3_9rsgoe,False,dark,0.98,,public,34,0,{},,,False,[],,False,False,,{},,False,34,,False,self,False,,[],{},,True,,1540653484.0,text,0,,,text,self.ttcafterloss,True,"<!-- SC_OFF --><div class=""md""><p>First, I want to thank you for all of the heartfelt, supportive messages after I shared our experience with our trisomy 18 diagnosis. I was overwhelmed by your stories and experiences, and it meant so much to me to feel less alone.</p>

<p>We received our amnio results on Monday which confirmed the T-18 diagnosis and also found out we were having a little girl. We were booked into the hospital for Thursday to fulfill a legal waiting period. We spent the next few days preparing - our parents arrived, we chose a name for her, I knitted a wee blanket. </p>

<p>In the Netherlands, where we live, there is no other option at this stage (20 weeks) than to deliver. While I was quite devastated by the idea at first, now that it’s over I am so grateful for the experience.</p>

<p>I was given Mifepristone to take on Tuesday evening. I arrived at the hospital 9:30 on Thursday where they started inserting the Misoprostil tablets, every two hours. I was offered morphine injections or an epidural. They don’t do walking epidurals here so I chose the morphine - it made me a bit woozy and took the edge off the pain but I could still feel everything. Around 9 hours later, the pain became very intense and the contractions were relentless. Before they could give me morphine, I delivered our daughter with 3 pushes. I had my partner on one side and my mom on the other and I am so grateful they were both there. She wasn’t born breathing.</p>

<p>As I had been scared about seeing her, everyone assured me right away that she looked perfect, just very small - she was under a pound. My partner cut the cord and they put her in my arms and I immediately just loved her. We ended up spending about 6 hours with her before we said goodbye. She was surrounded by love.</p>

<p>My placenta wouldn’t come out so they had to do a small operation to remove everything. I was back home by 2am, a little sore (now very sore, 2 days later) and absolutely heartbroken. I had no idea I would feel this overwhelmingly sad and empty. At the same time, I am thankful for the experience - for something so terrible, it went as well as it could have, and we had amazing, empathetic doctors and midwives guide us through. </p>

<p>We’ve been told we only need to wait one cycle to try again; we will see if we are emotionally ready though. If anyone wants to talk about their experience, or having to deliver, please reach out to me - I don’t have a ‘real life’ support group so this is helping tremendously and talking about it feels healthy.</p>

<p>I’d also be very interested in talking to someone who has also had a trisomy 18 pregnancy, and anyone who has subsequently had a successful pregnancy - we are waiting for our full karyotype results and while the doctors have assured us this was most likely a fluke, I still worry. </p>

<p>Again, thank you to all you incredibly strong women and men out there ❤️ </p>
</div><!-- SC_ON -->",,new,,,True,False,False,False,False,[],[],False,,False,False,False,,[],False,,,,t5_34scd,,,,9rsgoe,True,,love-pie,,16,True,no_ads,False,[],False,,/r/ttcafterloss/comments/9rsgoe/update_i_delivered_our_little_girl_on_thursday/,no_ads,False,https://www.reddit.com/r/ttcafterloss/comments/9rsgoe/update_i_delivered_our_little_girl_on_thursday/,10027,1540624684.0,0,,False,False,{},,,,,,
