153,2048,confidence,<praw.reddit.Reddit object at 0x7f12a630cd90>,,ttcafterloss,"I was really hoping this would be my rainbow baby, but that didn't work out. I had my first ultrasound at 7+5, and they couldn't find fetal pole. Suspected blighted ovum, but had another scan 2 days later. They found little bean and a heartbeat, but it was only measuring 6+3. They said my dates were probably wrong (I knew they weren't) and to come back in 2 weeks.

Went back today at what should be exactly 10 weeks. Baby was still measuring 6+3 with no heartbeat. I knew as soon as I saw it on the screen that it was over. They said I may start to miscarry naturally soon as there's a SCH right by my cervix, but I haven't had any cramping or spotting yet. I still feel pregnant. Boobs still hurt and I'm still nauseous. Corpus luteum cyst is still being irritating. I decided I'd give my body almost a week to do things naturally, but I scheduled a d&c for next Wednesday. I just can't have this go on forever.

Feelings are... different than they were after my first loss in April at 17 weeks. I never really let myself get too attached this time, although of course I'm still devastated and will mourn this little angel too. But, I'm finding myself thinking about my son more than anything. I should have a 2 week old baby in my arms, not waiting to start bleeding for my 2 miscarriage. I was never really angry before, but I am now. I've had this fear since I was 16 that I would never be a mother, and while I do consider myself a mother now, I still fear I'll never have a living child. I feel like I'm being punished, and I don't know why.

Also my doctor, who I actually really love, told us today that God has a plan, and I wanted to punch her in the face.",t2_xsi5s,False,,0,False,Back again,[],r/ttcafterloss,False,0,,0,,,False,t3_9nenzr,False,dark,1.0,,public,18,0,{},,ce4ab51a-711f-11e4-826c-12313d148545,False,[],,False,False,,{},,False,18,,False,self,False,,[],{},,True,,1539326039.0,text,0,,,text,self.ttcafterloss,True,"<!-- SC_OFF --><div class=""md""><p>I was really hoping this would be my rainbow baby, but that didn&#39;t work out. I had my first ultrasound at 7+5, and they couldn&#39;t find fetal pole. Suspected blighted ovum, but had another scan 2 days later. They found little bean and a heartbeat, but it was only measuring 6+3. They said my dates were probably wrong (I knew they weren&#39;t) and to come back in 2 weeks.</p>

<p>Went back today at what should be exactly 10 weeks. Baby was still measuring 6+3 with no heartbeat. I knew as soon as I saw it on the screen that it was over. They said I may start to miscarry naturally soon as there&#39;s a SCH right by my cervix, but I haven&#39;t had any cramping or spotting yet. I still feel pregnant. Boobs still hurt and I&#39;m still nauseous. Corpus luteum cyst is still being irritating. I decided I&#39;d give my body almost a week to do things naturally, but I scheduled a d&amp;c for next Wednesday. I just can&#39;t have this go on forever.</p>

<p>Feelings are... different than they were after my first loss in April at 17 weeks. I never really let myself get too attached this time, although of course I&#39;m still devastated and will mourn this little angel too. But, I&#39;m finding myself thinking about my son more than anything. I should have a 2 week old baby in my arms, not waiting to start bleeding for my 2 miscarriage. I was never really angry before, but I am now. I&#39;ve had this fear since I was 16 that I would never be a mother, and while I do consider myself a mother now, I still fear I&#39;ll never have a living child. I feel like I&#39;m being punished, and I don&#39;t know why.</p>

<p>Also my doctor, who I actually really love, told us today that God has a plan, and I wanted to punch her in the face.</p>
</div><!-- SC_ON -->",,new,,,True,False,False,False,False,[],[],False,,False,False,False,"MC 17w 4/18, MMC 10w 10/18",[],False,,,,t5_34scd,,,,9nenzr,True,,snickerfy,,7,True,no_ads,False,[],False,dark,/r/ttcafterloss/comments/9nenzr/back_again/,no_ads,False,https://www.reddit.com/r/ttcafterloss/comments/9nenzr/back_again/,10027,1539297239.0,0,,False,False,{},,,,,,
154,2048,confidence,<praw.reddit.Reddit object at 0x7f12a630cd90>,,ttcafterloss,"I heard you guys are great with advice and words and comfort. 

At the end of July, I found out I was pregnant with my surprise ""keto"" baby. This was my first natural pregnancy. My other two boys are from IVF and IUI. I was scared, surprised and excited. My husband was beyond angry with himself and acted like the whole world was going to end. 

A week later, I had an early miscarriage. My first miscarriage. I know that some don't ""count"" it as a legit miscarriage because there wasn't ever a heartbeat, but this hurt more than all my failed IVF cycles combined. 

It still hurts. 

Lately, I have been consumed by thoughts of wanting another baby. We used to have a ""five year plan"" set to talk about having another baby in five years. Two years have gone by. I don't want to wait three more years. My chances of miscarriage go up with every additional age over advanced maternal age. My eggs will go to shit, if they aren't already shit. I don't want to wait. 

But, when I talk to him about it, he literally has a panic attack. His chest gets tight, his eyes water up, he gets angry and upset. He likes the pace of our family right now. He likes that he can stay up until 2am and game on his computer and not have to worry about a baby waking up. He doesn't want to be inconvenienced again. 

He also is afraid of legit things (because I think the above things are entirely selfish), such as me suffering from postpartum depression again, our baby having a CHD like our last kid, our pregnancy being high risk like our last pregnancy, having another high-needs baby like our toy boys, and having a baby who hates him (which, unfortunately, our youngest son legitimately ""hated"" my husband until he was almost one year old, which contributed to my PPD).

Meanwhile, I am over here feeling empty and scared that I will have to live the rest of my life with this emptiness inside of me. My clock is ticking away. My history of infertility is stacked up against me. Every day I think about this baby I might not ever have, and it sucks the joy out of almost everything. 

I don't know what I want from this. I do go to regular therapy (I suffer from MDD and PTSD in the first place), my husband and I are in counseling and have been for many years. We have an appointment next week. 

I just feel so alone in my grief, and it looks like my grief will never have an end in sight.",t2_apavr,False,,0,False,Intro: Chemical MC of surprise baby in August. Husband is dead set against another baby. My heart breaks every day.,[],r/ttcafterloss,False,0,intro,0,,,False,t3_9ndye4,False,dark,0.71,,public,3,0,{},,,False,[],,False,False,,{},Intro,False,3,,False,self,False,,[],{},,True,,1539320861.0,text,0,,,text,self.ttcafterloss,True,"<!-- SC_OFF --><div class=""md""><p>I heard you guys are great with advice and words and comfort. </p>

<p>At the end of July, I found out I was pregnant with my surprise &quot;keto&quot; baby. This was my first natural pregnancy. My other two boys are from IVF and IUI. I was scared, surprised and excited. My husband was beyond angry with himself and acted like the whole world was going to end. </p>

<p>A week later, I had an early miscarriage. My first miscarriage. I know that some don&#39;t &quot;count&quot; it as a legit miscarriage because there wasn&#39;t ever a heartbeat, but this hurt more than all my failed IVF cycles combined. </p>

<p>It still hurts. </p>

<p>Lately, I have been consumed by thoughts of wanting another baby. We used to have a &quot;five year plan&quot; set to talk about having another baby in five years. Two years have gone by. I don&#39;t want to wait three more years. My chances of miscarriage go up with every additional age over advanced maternal age. My eggs will go to shit, if they aren&#39;t already shit. I don&#39;t want to wait. </p>

<p>But, when I talk to him about it, he literally has a panic attack. His chest gets tight, his eyes water up, he gets angry and upset. He likes the pace of our family right now. He likes that he can stay up until 2am and game on his computer and not have to worry about a baby waking up. He doesn&#39;t want to be inconvenienced again. </p>

<p>He also is afraid of legit things (because I think the above things are entirely selfish), such as me suffering from postpartum depression again, our baby having a CHD like our last kid, our pregnancy being high risk like our last pregnancy, having another high-needs baby like our toy boys, and having a baby who hates him (which, unfortunately, our youngest son legitimately &quot;hated&quot; my husband until he was almost one year old, which contributed to my PPD).</p>

<p>Meanwhile, I am over here feeling empty and scared that I will have to live the rest of my life with this emptiness inside of me. My clock is ticking away. My history of infertility is stacked up against me. Every day I think about this baby I might not ever have, and it sucks the joy out of almost everything. </p>

<p>I don&#39;t know what I want from this. I do go to regular therapy (I suffer from MDD and PTSD in the first place), my husband and I are in counseling and have been for many years. We have an appointment next week. </p>

<p>I just feel so alone in my grief, and it looks like my grief will never have an end in sight.</p>
</div><!-- SC_ON -->",,new,,,True,False,False,False,False,[],[],False,,False,False,False,,[],False,,,,t5_34scd,,,,9ndye4,True,,suhayma,,5,True,no_ads,False,[],False,,/r/ttcafterloss/comments/9ndye4/intro_chemical_mc_of_surprise_baby_in_august/,no_ads,False,https://www.reddit.com/r/ttcafterloss/comments/9ndye4/intro_chemical_mc_of_surprise_baby_in_august/,10027,1539292061.0,0,,False,False,{},,,,,,
155,2048,confidence,<praw.reddit.Reddit object at 0x7f12a630cd90>,,ttcafterloss,"Doc says yes. Mayo clinic says 2 weeks is fine. How long did you wait? 

Sub question: is there really data behind waiting at least month to ttc again, or is it that a 'just to be safe but we're not really sure' mentality? Want to try again, but also not trying to be an idiot here. ",t2_ssghl5e,False,,0,False,Do we really have to wait 4-6 weeks to have sex again?,[],r/ttcafterloss,False,0,,0,,,False,t3_9ndoei,False,dark,1.0,,public,5,0,{},,,False,[],,False,False,,{},,False,5,,False,self,False,,[],{},,True,,1539318944.0,text,0,,,text,self.ttcafterloss,False,"<!-- SC_OFF --><div class=""md""><p>Doc says yes. Mayo clinic says 2 weeks is fine. How long did you wait? </p>

<p>Sub question: is there really data behind waiting at least month to ttc again, or is it that a &#39;just to be safe but we&#39;re not really sure&#39; mentality? Want to try again, but also not trying to be an idiot here. </p>
</div><!-- SC_ON -->",,new,,,True,False,False,False,False,[],[],False,,False,False,False,,[],False,,,,t5_34scd,,,,9ndoei,True,,codlatan,,14,True,no_ads,False,[],False,,/r/ttcafterloss/comments/9ndoei/do_we_really_have_to_wait_46_weeks_to_have_sex/,no_ads,False,https://www.reddit.com/r/ttcafterloss/comments/9ndoei/do_we_really_have_to_wait_46_weeks_to_have_sex/,10027,1539290144.0,0,,False,False,{},,,,,,
156,2048,confidence,<praw.reddit.Reddit object at 0x7f12a630cd90>,,ttcafterloss,"
I don’t want to see your fucking pregnancy announcements, or hear about your pregnancy “problems”. I don’t want to go to your fucking baby shower, I don’t want to pick out a card and a gift for you. I don’t want to fucking celebrate for you. I don’t fucking want to see your happy family after your healthy baby is born. And I certainly don’t fucking want your baby announcements. I won’t open them so save your money and spend it on your fucking healthy baby. 

I wish I could throw a tantrum and scream it. I wish I didn’t have to feel it. Don’t fucking tell me my time will come. YOU.DON’T.FUCKING.KNOW.THAT.FOR.SURE!!
And you certainly don’t know what it feels like to be me. 

Why is everyone pregnant or just had a baby around me? Why is the world torturing me? Why can my junkie cousin have a healthy baby and not me? 

Today isn’t an easy day. I came home to a baby announcement in the mail and lost my shit. Some days I think I can take it but today isn’t one of them. 

End rant. ",t2_yz9fy,False,,0,False,Rant I wish I could post on my social media account..,[],r/ttcafterloss,False,0,,0,,,False,t3_9ndj3x,False,dark,0.92,,public,81,0,{},,8b677c92-711f-11e4-b63c-12313b0b807d,False,[],,False,False,,{},,False,81,,False,self,False,,[],{},,True,,1539317952.0,text,0,,,text,self.ttcafterloss,True,"<!-- SC_OFF --><div class=""md""><p>I don’t want to see your fucking pregnancy announcements, or hear about your pregnancy “problems”. I don’t want to go to your fucking baby shower, I don’t want to pick out a card and a gift for you. I don’t want to fucking celebrate for you. I don’t fucking want to see your happy family after your healthy baby is born. And I certainly don’t fucking want your baby announcements. I won’t open them so save your money and spend it on your fucking healthy baby. </p>

<p>I wish I could throw a tantrum and scream it. I wish I didn’t have to feel it. Don’t fucking tell me my time will come. YOU.DON’T.FUCKING.KNOW.THAT.FOR.SURE!!
And you certainly don’t know what it feels like to be me. </p>

<p>Why is everyone pregnant or just had a baby around me? Why is the world torturing me? Why can my junkie cousin have a healthy baby and not me? </p>

<p>Today isn’t an easy day. I came home to a baby announcement in the mail and lost my shit. Some days I think I can take it but today isn’t one of them. </p>

<p>End rant. </p>
</div><!-- SC_ON -->",,new,,,True,False,False,False,False,[],[],False,,False,False,False,"TFMR twins 14 week 01/18, MMC 05/18, ruptured ectopic 10/18, 2CP",[],False,,,,t5_34scd,,,,9ndj3x,True,,mandingles,,42,True,no_ads,False,[],False,dark,/r/ttcafterloss/comments/9ndj3x/rant_i_wish_i_could_post_on_my_social_media/,no_ads,False,https://www.reddit.com/r/ttcafterloss/comments/9ndj3x/rant_i_wish_i_could_post_on_my_social_media/,10027,1539289152.0,0,,False,False,{},,,,,,
157,2048,confidence,<praw.reddit.Reddit object at 0x7f12a630cd90>,,ttcafterloss,"I am new here - it’s been a few months since my miscarriage but I have been struggling a bit lately and have no one I personally talk to who has experienced what I experienced.

I had a missed miscarriage in June (Father’s Day, sorry husband) at 9w. At my 8w appointment the baby had a heartbeat but was too small. At 9w they confirmed that there was no heartbeat and I induced the miscarriage with misoprostol. That was pretty rough, but I am glad I did it that way since it provided some closure (closure by way of harrowing experience, I guess).

In the overall scheme of things, I know that I am really lucky. I got pregnant naturally on our second try, despite being 34 (me) and 40 (husband) and overweight. There weren’t any complications from the miscarriage and my doctor told me there wasn’t anything that I could have done. There’s nothing going on with me physically (besides weight) that can impact my fertility.

But, at the end of the day, even acknowledging all the luck I’ve had, the outcome is the same: I won’t be having a baby in January and I’m starting over. We’ve been trying for two cycles now and my period is a bit chaotic: not as regular as before and 100x more painful. This has made it difficult (so far) to get pregnant again.

After the miscarriage I grieved openly and publicly because I wanted people to know what it was like and that it was a normal part of life that was nothing to be ashamed of. I also “got better” publicly too, and now I think everyone else thinks I am “over it.” 

And, for a little bit, I was. But of my two closest friends, one just announced her second pregnancy and the other gave birth two weeks ago. They both have been very sensitive and supportive, but right now it feels like a big party I didn’t get invited to (or more accurately, got invited to and then my invite was rescinded).

So anyway, that’s me. I lurked around here for a bit and liked the tone better than some other groups out there. I am sorry we’re all here, but it’s nice to admit some of this to others who get it.",t2_2e3qf1ol,False,,0,False,Intro - MMC in mid-June,[],r/ttcafterloss,False,0,intro,0,,,False,t3_9nbyus,False,dark,1.0,,public,10,0,{},,,False,[],,False,False,,{},Intro,False,10,,False,self,False,,[],{},,True,,1539307487.0,text,0,,,text,self.ttcafterloss,False,"<!-- SC_OFF --><div class=""md""><p>I am new here - it’s been a few months since my miscarriage but I have been struggling a bit lately and have no one I personally talk to who has experienced what I experienced.</p>

<p>I had a missed miscarriage in June (Father’s Day, sorry husband) at 9w. At my 8w appointment the baby had a heartbeat but was too small. At 9w they confirmed that there was no heartbeat and I induced the miscarriage with misoprostol. That was pretty rough, but I am glad I did it that way since it provided some closure (closure by way of harrowing experience, I guess).</p>

<p>In the overall scheme of things, I know that I am really lucky. I got pregnant naturally on our second try, despite being 34 (me) and 40 (husband) and overweight. There weren’t any complications from the miscarriage and my doctor told me there wasn’t anything that I could have done. There’s nothing going on with me physically (besides weight) that can impact my fertility.</p>

<p>But, at the end of the day, even acknowledging all the luck I’ve had, the outcome is the same: I won’t be having a baby in January and I’m starting over. We’ve been trying for two cycles now and my period is a bit chaotic: not as regular as before and 100x more painful. This has made it difficult (so far) to get pregnant again.</p>

<p>After the miscarriage I grieved openly and publicly because I wanted people to know what it was like and that it was a normal part of life that was nothing to be ashamed of. I also “got better” publicly too, and now I think everyone else thinks I am “over it.” </p>

<p>And, for a little bit, I was. But of my two closest friends, one just announced her second pregnancy and the other gave birth two weeks ago. They both have been very sensitive and supportive, but right now it feels like a big party I didn’t get invited to (or more accurately, got invited to and then my invite was rescinded).</p>

<p>So anyway, that’s me. I lurked around here for a bit and liked the tone better than some other groups out there. I am sorry we’re all here, but it’s nice to admit some of this to others who get it.</p>
</div><!-- SC_ON -->",,new,,,True,False,False,False,False,[],[],False,a05e5124-7120-11e4-952e-12313d148545,False,False,False,,[],False,,,,t5_34scd,,,,9nbyus,True,,aft1083,,6,True,no_ads,False,[],False,,/r/ttcafterloss/comments/9nbyus/intro_mmc_in_midjune/,no_ads,False,https://www.reddit.com/r/ttcafterloss/comments/9nbyus/intro_mmc_in_midjune/,10027,1539278687.0,0,,False,False,{},,,,,,
158,2048,confidence,<praw.reddit.Reddit object at 0x7f12a630cd90>,,ttcafterloss,I had my first miscarriage and a D&C two days ago. The first ultrasound showed potential adenomyosis :( I want to start TTC-in asap and was wondering if D&C has any impact on the adenomyiosis. Did anyone with adenomyosis tried to conceive shortly after D&C and had a successful pregnancy? Thanks and any advice is welcome! ,t2_d4h2a,False,,0,False,"D&C, adenomyosis positive stories??",[],r/ttcafterloss,False,0,,0,,,False,t3_9nbq5c,False,dark,1.0,,public,2,0,{},,b22615aa-711f-11e4-97ba-12313b0e92a7,False,[],,False,False,,{},,False,2,,False,self,False,,[],{},,True,,1539305861.0,text,0,,,text,self.ttcafterloss,False,"<!-- SC_OFF --><div class=""md""><p>I had my first miscarriage and a D&amp;C two days ago. The first ultrasound showed potential adenomyosis :( I want to start TTC-in asap and was wondering if D&amp;C has any impact on the adenomyiosis. Did anyone with adenomyosis tried to conceive shortly after D&amp;C and had a successful pregnancy? Thanks and any advice is welcome! </p>
</div><!-- SC_ON -->",,new,,,True,False,False,False,False,[],[],False,,False,False,False,MMC@9W _D&C_Oct9th|TTC#2,[],False,,,,t5_34scd,,,,9nbq5c,True,,justttc,,5,True,no_ads,False,[],False,dark,/r/ttcafterloss/comments/9nbq5c/dc_adenomyosis_positive_stories/,no_ads,False,https://www.reddit.com/r/ttcafterloss/comments/9nbq5c/dc_adenomyosis_positive_stories/,10027,1539277061.0,0,,False,False,{},,,,,,
159,2048,confidence,<praw.reddit.Reddit object at 0x7f12a630cd90>,,ttcafterloss,"hi ladies!

I had an mmc and d&c at 9 weeks two months ago. 30 days after I had a week long period and two weeks after that I ovulated. at 8 dpo I got a BFP on a first response early results test. 9 dpo I had more positives not none any darker. 10 dpo (yesterday) I had a very very faint, almost negative test. I had a beta yesterday that confirmed I’m not pregnant (hcg=1).

I learned my lesson about early testing (I early tested successfully in two previous pregnancies but won’t in future months!) but am just wondering what might have given me those BFPs? 

thanks!",t2_egclq2p,False,,0,False,frer false positives?,[],r/ttcafterloss,False,0,,0,,,False,t3_9n8yro,False,dark,1.0,,public,2,0,{},,8b677c92-711f-11e4-b63c-12313b0b807d,False,[],,False,False,,{},,False,2,,False,self,False,,[],{},,True,,1539284827.0,text,0,,,text,self.ttcafterloss,False,"<!-- SC_OFF --><div class=""md""><p>hi ladies!</p>

<p>I had an mmc and d&amp;c at 9 weeks two months ago. 30 days after I had a week long period and two weeks after that I ovulated. at 8 dpo I got a BFP on a first response early results test. 9 dpo I had more positives not none any darker. 10 dpo (yesterday) I had a very very faint, almost negative test. I had a beta yesterday that confirmed I’m not pregnant (hcg=1).</p>

<p>I learned my lesson about early testing (I early tested successfully in two previous pregnancies but won’t in future months!) but am just wondering what might have given me those BFPs? </p>

<p>thanks!</p>
</div><!-- SC_ON -->",,new,,,True,False,False,False,False,[],[],False,,False,False,False,TTC #2 | MMC 8/15,[],False,,,,t5_34scd,,,,9n8yro,True,,lydianicole13,,11,True,no_ads,False,[],False,dark,/r/ttcafterloss/comments/9n8yro/frer_false_positives/,no_ads,False,https://www.reddit.com/r/ttcafterloss/comments/9n8yro/frer_false_positives/,10027,1539256027.0,0,,False,False,{},,,,,,
160,2048,confidence,<praw.reddit.Reddit object at 0x7f12a630cd90>,,ttcafterloss,"**This weekly Thursday thread is for all members to talk about their grief. Looking for support? Just need to share some memories? This is the place for you!**
",t2_6l4z3,False,,0,False,"/ttcafterloss Grief and Memorial - October 11, 2018",[],r/ttcafterloss,False,0,grief,0,,,False,t3_9n7pcc,False,dark,0.81,,public,3,0,{},,,False,[],,False,False,,{},Grief Support,False,3,,True,self,False,,[],{},,True,,1539270676.0,text,0,,,text,self.ttcafterloss,False,"<!-- SC_OFF --><div class=""md""><p><strong>This weekly Thursday thread is for all members to talk about their grief. Looking for support? Just need to share some memories? This is the place for you!</strong></p>
</div><!-- SC_ON -->",,new,,,True,False,False,False,False,[],[],False,,False,False,False,,[],False,,,moderator,t5_34scd,,,,9n7pcc,True,,AutoModerator,,7,False,no_ads,False,[],False,,/r/ttcafterloss/comments/9n7pcc/ttcafterloss_grief_and_memorial_october_11_2018/,no_ads,False,https://www.reddit.com/r/ttcafterloss/comments/9n7pcc/ttcafterloss_grief_and_memorial_october_11_2018/,10027,1539241876.0,0,,False,False,{},,,,,,
161,2048,confidence,<praw.reddit.Reddit object at 0x7f12a630cd90>,,ttcafterloss,"**This thread is for members who are TTC or waiting to try. How are you doing today? What's new?**

Off-topic discussion is allowed :)

**Note**: Please refrain from discussing positive tests (and beyond) in this thread - those topics are better suited for the Weekly Results thread or the new sub for Alumni. Thank you!
",t2_6l4z3,False,,0,False,"/ttcafterloss TTC Daily Discussion Thread - October 11, 2018",[],r/ttcafterloss,False,0,ttc,0,,,False,t3_9n7pbc,False,dark,1.0,,public,2,0,{},,,False,[],,False,False,,{},TTC Thread,False,2,,True,self,False,,[],{},,True,,1539270668.0,text,0,,,text,self.ttcafterloss,False,"<!-- SC_OFF --><div class=""md""><p><strong>This thread is for members who are TTC or waiting to try. How are you doing today? What&#39;s new?</strong></p>

<p>Off-topic discussion is allowed :)</p>

<p><strong>Note</strong>: Please refrain from discussing positive tests (and beyond) in this thread - those topics are better suited for the Weekly Results thread or the new sub for Alumni. Thank you!</p>
</div><!-- SC_ON -->",,new,,,True,False,False,False,False,[],[],False,,False,False,False,,[],False,,,moderator,t5_34scd,,,,9n7pbc,True,,AutoModerator,,34,False,no_ads,False,[],False,,/r/ttcafterloss/comments/9n7pbc/ttcafterloss_ttc_daily_discussion_thread_october/,no_ads,False,https://www.reddit.com/r/ttcafterloss/comments/9n7pbc/ttcafterloss_ttc_daily_discussion_thread_october/,10027,1539241868.0,0,,False,False,{},,,,,,
