105,2048,confidence,<praw.reddit.Reddit object at 0x7f12a630cd90>,,ttcafterloss,"One week ago, at what should have been 9+2 (I was tracking ovulation with OPKs and temps), my first ultrasound revealed no heartbeat & a pregnancy that stopped growing at around 6 weeks. I had a little bit of bleeding during week 6, but was extremely symptomatic with nausea/vomiting daily and figured everything was ok. My HCG at my appointment was higher than any normal limit at 300,000 which raised the concern of a molar pregnancy. Friday I had a D&C with everything sent to pathology & genetics.

Currently we're in the 2-3 week wait to find out the results of testing and it is hell. We won't know until the results come in how long we will have to wait to try again. I was absolutely miserable nearly the entire time I was pregnant, and if you had asked me then I would've told you it would take a long long time for me to want to try again. Now, I can hardly remember how sick I was and can't help but think ""well, those 6 sick weeks weren't that long."" 

Each day that goes by seems to get harder instead of easier. I never realized how much I wanted this until it was taken away from me. We got pregnant the first cycle we actually tried and I can't help but feel like that expended all of our luck and this terrible outcome is an omen on what our future in fertility looks like. I was so excited that my SIL and I were due two months apart, that we'd get to raise little cousins so close in age. Now we're stuck in this limbo hell not knowing when we can get started again. 

This all just fucking sucks.",t2_gup7a,False,,0,False,"Reluctant intro- MMC at a minimum, possible molar pregnancy.",[],r/ttcafterloss,False,0,intro,0,,,False,t3_9oqmap,False,dark,0.92,,public,10,0,{},,ce4ab51a-711f-11e4-826c-12313d148545,False,[],,False,False,,{},Intro,False,10,,False,self,False,,[],{},,True,,1539744976.0,text,0,,,text,self.ttcafterloss,True,"<!-- SC_OFF --><div class=""md""><p>One week ago, at what should have been 9+2 (I was tracking ovulation with OPKs and temps), my first ultrasound revealed no heartbeat &amp; a pregnancy that stopped growing at around 6 weeks. I had a little bit of bleeding during week 6, but was extremely symptomatic with nausea/vomiting daily and figured everything was ok. My HCG at my appointment was higher than any normal limit at 300,000 which raised the concern of a molar pregnancy. Friday I had a D&amp;C with everything sent to pathology &amp; genetics.</p>

<p>Currently we&#39;re in the 2-3 week wait to find out the results of testing and it is hell. We won&#39;t know until the results come in how long we will have to wait to try again. I was absolutely miserable nearly the entire time I was pregnant, and if you had asked me then I would&#39;ve told you it would take a long long time for me to want to try again. Now, I can hardly remember how sick I was and can&#39;t help but think &quot;well, those 6 sick weeks weren&#39;t that long.&quot; </p>

<p>Each day that goes by seems to get harder instead of easier. I never realized how much I wanted this until it was taken away from me. We got pregnant the first cycle we actually tried and I can&#39;t help but feel like that expended all of our luck and this terrible outcome is an omen on what our future in fertility looks like. I was so excited that my SIL and I were due two months apart, that we&#39;d get to raise little cousins so close in age. Now we&#39;re stuck in this limbo hell not knowing when we can get started again. </p>

<p>This all just fucking sucks.</p>
</div><!-- SC_ON -->",,new,,,True,False,False,False,False,[],[],False,,False,False,False,31|6/18|MMC 10/18|Asherman's & Endo,[],False,,,,t5_34scd,,,,9oqmap,True,,arielsjealous,,8,True,no_ads,False,[],False,dark,/r/ttcafterloss/comments/9oqmap/reluctant_intro_mmc_at_a_minimum_possible_molar/,no_ads,False,https://www.reddit.com/r/ttcafterloss/comments/9oqmap/reluctant_intro_mmc_at_a_minimum_possible_molar/,10027,1539716176.0,0,,False,False,{},,,,,,
106,2048,confidence,<praw.reddit.Reddit object at 0x7f12a630cd90>,,ttcafterloss,"My D&C is scheduled tomorrow at 12pm. I can’t eat or drink anything from midnight tonight, not even water. I’m pretty scared to go under and never wake up, or have complications from the procedure and not be able to conceive again. Just looking for people who have been here, done that. Any suggestions, preparation, or just advice in general is appreciated.",t2_fsx3rc6,False,,0,False,Scheduled D&C tomorrow,[],r/ttcafterloss,False,0,,0,,,False,t3_9oq7he,False,dark,1.0,,public,5,0,{},,,False,[],,False,False,,{},,False,5,,False,self,False,,[],{},,True,,1539742364.0,text,0,,,text,self.ttcafterloss,True,"<!-- SC_OFF --><div class=""md""><p>My D&amp;C is scheduled tomorrow at 12pm. I can’t eat or drink anything from midnight tonight, not even water. I’m pretty scared to go under and never wake up, or have complications from the procedure and not be able to conceive again. Just looking for people who have been here, done that. Any suggestions, preparation, or just advice in general is appreciated.</p>
</div><!-- SC_ON -->",,new,,,True,False,False,False,False,[],[],False,,False,False,False,,[],False,,,,t5_34scd,,,,9oq7he,True,,mamaonfire,,50,True,no_ads,False,[],False,,/r/ttcafterloss/comments/9oq7he/scheduled_dc_tomorrow/,no_ads,False,https://www.reddit.com/r/ttcafterloss/comments/9oq7he/scheduled_dc_tomorrow/,10027,1539713564.0,0,,False,False,{},,,,,,
107,2048,confidence,<praw.reddit.Reddit object at 0x7f12a630cd90>,,ttcafterloss,"Approximately a week and a half after finding out I was pregnant, I started bleeding like a stuffed pig. The bleeding has been constant, but varies in amount. I never bleed enough to soak a pad in 2 hours, but it’s still a lot more than usual for me. 
This is my second m/c and I have one daughter (4 years old). 
My hCG levels are only at 932 (I would have been 6 weeks), and I have to go back tomorrow to make sure my levels decrease by half.  If it hasn’t decreased by that much, they’ll do an ultrasound on me. 
I know it’s stupid, but I am still hoping that I’m pregnant, even though I’m not. I keep reading things about “vanishing twin syndrome” and I’m hoping that I’m suffering the same thing. 
I feel like crap honestly.  I just need to vent and for someone to tell me to stop being silly. My sweet husband won’t do it, so I’m hoping that someone else can, lol.",t2_22qgu0xj,False,,0,False,I’m having an early miscarriage,[],r/ttcafterloss,False,0,,0,,,False,t3_9oosz3,False,dark,0.84,,public,4,0,{},,,False,[],,False,False,,{},,False,4,,False,self,False,,[],{},,True,,1539733440.0,text,0,,,text,self.ttcafterloss,True,"<!-- SC_OFF --><div class=""md""><p>Approximately a week and a half after finding out I was pregnant, I started bleeding like a stuffed pig. The bleeding has been constant, but varies in amount. I never bleed enough to soak a pad in 2 hours, but it’s still a lot more than usual for me. 
This is my second m/c and I have one daughter (4 years old). 
My hCG levels are only at 932 (I would have been 6 weeks), and I have to go back tomorrow to make sure my levels decrease by half.  If it hasn’t decreased by that much, they’ll do an ultrasound on me. 
I know it’s stupid, but I am still hoping that I’m pregnant, even though I’m not. I keep reading things about “vanishing twin syndrome” and I’m hoping that I’m suffering the same thing. 
I feel like crap honestly.  I just need to vent and for someone to tell me to stop being silly. My sweet husband won’t do it, so I’m hoping that someone else can, lol.</p>
</div><!-- SC_ON -->",,new,,,True,False,False,False,False,[],[],False,,False,False,False,,[],False,,,,t5_34scd,,,,9oosz3,True,,EvaPurrrron,,2,True,no_ads,False,[],False,,/r/ttcafterloss/comments/9oosz3/im_having_an_early_miscarriage/,no_ads,False,https://www.reddit.com/r/ttcafterloss/comments/9oosz3/im_having_an_early_miscarriage/,10027,1539704640.0,0,,False,False,{},,,,,,
108,2048,confidence,<praw.reddit.Reddit object at 0x7f12a630cd90>,,ttcafterloss,"I wanted to write something. I am in LA for a conference, and yesterday flew by, but I wanted to say something. I know that the Reddits I am subscribed to were blowing up yesterday, and I didn’t really get to read much. So here is what I wrote right before going to bed. 

Today is something that I wish I didn't know about. Today is National Pregnancy and Infant Loss Remembrance Day. I have not have one, but two miscarriages in the last year. I just passed what should have been the due date of my first pregnancy. I didn't even look to see the due date of the second because it was a chemical pregnancy that I technically shouldn't have even noticed. September 30th was my due date. It was hard, but it was okay. I accepted it, I acknowledged it and I did everything I could to get through it. I am the only person (besides Brian of course) in my life who will ever put significance on that day, which is okay. 

I am not the only person I know who has had a miscarriage. Miscarriage or pregnancy loss is not uncommon, it happens A LOT... 1 in 4 women have one. I have researched so much it hurts. Why me? What did I do.. or didn't do? There is no answer. My doctor pulled Brian and I in to her office and the first thing she asked was, ""Are you okay?"" looking at me directly. I wanted to say, ""No... I lost my Mom and I lost two babies.. who in their right mind would be OK?"" but I said, ""I think so... I mean I function...."" She was really seeing if I had  depression. I wouldn't put myself in that category though. We did all the RPL (repeat pregnancy loss) testing we could. Thankfully my doctor took a missed miscarriage and a chemical pregnancy all within 6 months of each other as abnormal. She warned us that there was an 80%-90% of the tests coming out normal. Most doctors wouldn't even acknowledge you until you have had 3 (or more) losses; which lets be honest... thats crap! After all the testing of course Brian and I are perfectly healthy. Nothing is wrong. So we are still left with the why. Which they always say your baby most likely had genetic abnormalities.

This is just a small part of my story. I am not special. I am just speaking up. Out of the 30 years on earth I only knew one couple who had experienced pregnancy loss. So for me... I was alone. Miscarriage comes in many different forms and happens every single day. I have found communities online that have helped me learn so much more about miscarriage, the emotions that come with it and encourage to keep trying. Just remember the next time you want to ask someone who they are having kids or if they started trying yet, that its not the best thing to ask. You never know where someone is on their journey. I myself think its okay to talk about it. I find it helpful to talk and think people need to be aware that you are hurt by this. Pregnancy is easy for some, but others not so much; again... I am not special. ❤️",t2_dt71ses,False,,0,False,FB Post I Wrote Yesterday,[],r/ttcafterloss,False,0,discussion,0,,,False,t3_9ontul,False,dark,0.95,,public,33,0,{},,8b677c92-711f-11e4-b63c-12313b0b807d,False,[],,False,False,,{},Discussion,False,33,,False,self,False,,[],{},,True,,1539726898.0,text,0,,,text,self.ttcafterloss,True,"<!-- SC_OFF --><div class=""md""><p>I wanted to write something. I am in LA for a conference, and yesterday flew by, but I wanted to say something. I know that the Reddits I am subscribed to were blowing up yesterday, and I didn’t really get to read much. So here is what I wrote right before going to bed. </p>

<p>Today is something that I wish I didn&#39;t know about. Today is National Pregnancy and Infant Loss Remembrance Day. I have not have one, but two miscarriages in the last year. I just passed what should have been the due date of my first pregnancy. I didn&#39;t even look to see the due date of the second because it was a chemical pregnancy that I technically shouldn&#39;t have even noticed. September 30th was my due date. It was hard, but it was okay. I accepted it, I acknowledged it and I did everything I could to get through it. I am the only person (besides Brian of course) in my life who will ever put significance on that day, which is okay. </p>

<p>I am not the only person I know who has had a miscarriage. Miscarriage or pregnancy loss is not uncommon, it happens A LOT... 1 in 4 women have one. I have researched so much it hurts. Why me? What did I do.. or didn&#39;t do? There is no answer. My doctor pulled Brian and I in to her office and the first thing she asked was, &quot;Are you okay?&quot; looking at me directly. I wanted to say, &quot;No... I lost my Mom and I lost two babies.. who in their right mind would be OK?&quot; but I said, &quot;I think so... I mean I function....&quot; She was really seeing if I had  depression. I wouldn&#39;t put myself in that category though. We did all the RPL (repeat pregnancy loss) testing we could. Thankfully my doctor took a missed miscarriage and a chemical pregnancy all within 6 months of each other as abnormal. She warned us that there was an 80%-90% of the tests coming out normal. Most doctors wouldn&#39;t even acknowledge you until you have had 3 (or more) losses; which lets be honest... thats crap! After all the testing of course Brian and I are perfectly healthy. Nothing is wrong. So we are still left with the why. Which they always say your baby most likely had genetic abnormalities.</p>

<p>This is just a small part of my story. I am not special. I am just speaking up. Out of the 30 years on earth I only knew one couple who had experienced pregnancy loss. So for me... I was alone. Miscarriage comes in many different forms and happens every single day. I have found communities online that have helped me learn so much more about miscarriage, the emotions that come with it and encourage to keep trying. Just remember the next time you want to ask someone who they are having kids or if they started trying yet, that its not the best thing to ask. You never know where someone is on their journey. I myself think its okay to talk about it. I find it helpful to talk and think people need to be aware that you are hurt by this. Pregnancy is easy for some, but others not so much; again... I am not special. ❤️</p>
</div><!-- SC_ON -->",,new,,,True,False,False,False,False,[],[],False,f180d45e-beec-11e4-89d6-22000b3c8673,False,False,False,30 | TTC #1 | 2 MMC (03/18) (10/18) | CP (06/18) (02/19),[],False,,,,t5_34scd,,,,9ontul,True,,kcbollin,,5,True,no_ads,False,[],False,dark,/r/ttcafterloss/comments/9ontul/fb_post_i_wrote_yesterday/,no_ads,False,https://www.reddit.com/r/ttcafterloss/comments/9ontul/fb_post_i_wrote_yesterday/,10027,1539698098.0,0,,False,False,{},,,,,,
109,2048,confidence,<praw.reddit.Reddit object at 0x7f12a630cd90>,,ttcafterloss,"They say time heals all wounds.... 


But idk if time will ever heal this one....

Feeling pretty alone tonight .... just needed a place to share... ",t2_2dtbhfjx,False,,0,False,Low lows...,[],r/ttcafterloss,False,0,,0,,,False,t3_9onfad,False,dark,1.0,,public,11,0,{},,ce4ab51a-711f-11e4-826c-12313d148545,False,[],,False,False,,{},,False,11,,False,self,False,,[],{},,True,,1539723886.0,text,0,,,text,self.ttcafterloss,True,"<!-- SC_OFF --><div class=""md""><p>They say time heals all wounds.... </p>

<p>But idk if time will ever heal this one....</p>

<p>Feeling pretty alone tonight .... just needed a place to share... </p>
</div><!-- SC_ON -->",,new,,,True,False,False,False,False,[],[],False,,False,False,False,23 | WTT #1 🌈 | LMC 22W MAG 🎀💖👼🏽|,[],False,,,,t5_34scd,,,,9onfad,True,,TiggerLyon,,13,True,no_ads,False,[],False,dark,/r/ttcafterloss/comments/9onfad/low_lows/,no_ads,False,https://www.reddit.com/r/ttcafterloss/comments/9onfad/low_lows/,10027,1539695086.0,0,,False,False,{},,,,,,
110,2048,confidence,<praw.reddit.Reddit object at 0x7f12a630cd90>,,ttcafterloss,[deleted],,False,,0,False,Do I really need to wait a cycle to try again after an ectopic pregnancy?,[],r/ttcafterloss,False,0,question,0,,,False,t3_9on75d,False,dark,1.0,,public,1,0,{},,,False,[],,False,False,,{},Question,False,1,,,default,False,,,{},,True,,1539722093.0,text,0,,,,self.ttcafterloss,True,"<!-- SC_OFF --><div class=""md""><p>[deleted]</p>
</div><!-- SC_ON -->",,new,,,True,True,False,False,False,[],[],False,64bc0a4e-a73f-11e4-8d5c-22000bc1c25f,False,False,False,,[],False,,,,t5_34scd,,,,9on75d,False,,,,3,True,no_ads,False,[],,dark,/r/ttcafterloss/comments/9on75d/do_i_really_need_to_wait_a_cycle_to_try_again/,no_ads,False,https://www.reddit.com/r/ttcafterloss/comments/9on75d/do_i_really_need_to_wait_a_cycle_to_try_again/,10027,1539693293.0,0,,False,False,{},,,,,,
111,2048,confidence,<praw.reddit.Reddit object at 0x7f12a630cd90>,,ttcafterloss,"**This weekly Tuesday thread is for members who have had more than one loss, of any type. How are you feeling? Are you pursuing any testing? Discuss general issues related to repeat loss.**

Relevant mention of current pregnancies is allowed, but please keep your references simple and clinical. ""I had success after trying X."" ""This resulted in a live birth.""
",t2_6l4z3,False,,0,False,"/ttcafterloss Repeat Pregnancy Loss - October 16, 2018",[],r/ttcafterloss,False,0,rpl,0,,,False,t3_9ol9ar,False,dark,0.84,,public,4,0,{},,,False,[],,False,False,,{},Repeat Pregnancy Loss,False,4,,True,self,False,,[],{},,True,,1539702650.0,text,0,,,text,self.ttcafterloss,False,"<!-- SC_OFF --><div class=""md""><p><strong>This weekly Tuesday thread is for members who have had more than one loss, of any type. How are you feeling? Are you pursuing any testing? Discuss general issues related to repeat loss.</strong></p>

<p>Relevant mention of current pregnancies is allowed, but please keep your references simple and clinical. &quot;I had success after trying X.&quot; &quot;This resulted in a live birth.&quot;</p>
</div><!-- SC_ON -->",,new,,,True,False,False,False,False,[],[],False,,False,False,False,,[],False,,,moderator,t5_34scd,,,,9ol9ar,True,,AutoModerator,,7,False,no_ads,False,[],False,,/r/ttcafterloss/comments/9ol9ar/ttcafterloss_repeat_pregnancy_loss_october_16_2018/,no_ads,False,https://www.reddit.com/r/ttcafterloss/comments/9ol9ar/ttcafterloss_repeat_pregnancy_loss_october_16_2018/,10027,1539673850.0,0,,False,False,{},,,,,,
112,2048,confidence,<praw.reddit.Reddit object at 0x7f12a630cd90>,,ttcafterloss,"**This thread is for members who are TTC or waiting to try. How are you doing today? What's new?**

Off-topic discussion is allowed :)

**Note**: Please refrain from discussing positive tests (and beyond) in this thread - those topics are better suited for the Weekly Results thread or the new sub for Alumni. Thank you!
",t2_6l4z3,False,,0,False,"/ttcafterloss TTC Daily Discussion Thread - October 16, 2018",[],r/ttcafterloss,False,0,ttc,0,,,False,t3_9ol99z,False,dark,1.0,,public,3,0,{},,,False,[],,False,False,,{},TTC Thread,False,3,,True,self,False,,[],{},,True,,1539702642.0,text,0,,,text,self.ttcafterloss,False,"<!-- SC_OFF --><div class=""md""><p><strong>This thread is for members who are TTC or waiting to try. How are you doing today? What&#39;s new?</strong></p>

<p>Off-topic discussion is allowed :)</p>

<p><strong>Note</strong>: Please refrain from discussing positive tests (and beyond) in this thread - those topics are better suited for the Weekly Results thread or the new sub for Alumni. Thank you!</p>
</div><!-- SC_ON -->",,new,,,True,False,False,False,False,[],[],False,,False,False,False,,[],False,,,moderator,t5_34scd,,,,9ol99z,True,,AutoModerator,,20,False,no_ads,False,[],False,,/r/ttcafterloss/comments/9ol99z/ttcafterloss_ttc_daily_discussion_thread_october/,no_ads,False,https://www.reddit.com/r/ttcafterloss/comments/9ol99z/ttcafterloss_ttc_daily_discussion_thread_october/,10027,1539673842.0,0,,False,False,{},,,,,,
113,2048,confidence,<praw.reddit.Reddit object at 0x7f12a630cd90>,,ttcafterloss,"Had a really clear positive pregnancy test last week, but started bleeding last night and went to the doctor today.

After the nurse asked a few basic questions, she was messing around with something on the counter, and I asked if it was a pregnancy test. She said, ""Well yeah, we don't have any record of you being pregnant since you just took a test at home, and it's negative so you're not pregnant."" I burst into tears. She immediately asked me about my exercise habits(???) and I had a really hard time responding. After a few more unrelated questions, she handed me a box of tissues and said ""here"" and then left.

The doctor, once she came in, was extremely nice and comforting and helped me process it. But I wish I had heard the news a little more gently.

Also, I'm feeling weird about the whole chemical pregnancy thing. The doctor didn't even call it that, she just said ""possible very early loss,"" but ""chemical pregnancy"" is what my research has turned up. All the sources say that physically, it's more like a cycle in which pregnancy didn't occur, and not like a """"true miscarriage."""" I am certain it hurts way worse if it happens later, but it still hurts now and feels like a terrible loss. I loved that baby already and I can't believe it's gone.

We also did a blood test, and my hcg level was 3, so I asked the doctor if I was actually pregnant at all - can it really drop that fast? She said it could have been a very early loss OR a false positive. So now I'm not sure what to do. Do I still get to grieve even though maybe no baby was lost? I feel so sad and confused.

Added to that, my husband isn't sure he wants to keep trying. I really do but don't want to pressure him. I wish he would make up his mind so I could grieve that at the same time too and get it all over with. ",t2_wcrpc,False,,0,False,Nurse made me feel bad | feeling weird about it being a possible CP,[],r/ttcafterloss,False,0,,0,,,False,t3_9oj31i,False,dark,0.75,,public,4,0,{},,,False,[],,False,False,,{},,False,4,,False,self,False,,[],{},,True,,1539682790.0,text,0,,,text,self.ttcafterloss,True,"<!-- SC_OFF --><div class=""md""><p>Had a really clear positive pregnancy test last week, but started bleeding last night and went to the doctor today.</p>

<p>After the nurse asked a few basic questions, she was messing around with something on the counter, and I asked if it was a pregnancy test. She said, &quot;Well yeah, we don&#39;t have any record of you being pregnant since you just took a test at home, and it&#39;s negative so you&#39;re not pregnant.&quot; I burst into tears. She immediately asked me about my exercise habits(???) and I had a really hard time responding. After a few more unrelated questions, she handed me a box of tissues and said &quot;here&quot; and then left.</p>

<p>The doctor, once she came in, was extremely nice and comforting and helped me process it. But I wish I had heard the news a little more gently.</p>

<p>Also, I&#39;m feeling weird about the whole chemical pregnancy thing. The doctor didn&#39;t even call it that, she just said &quot;possible very early loss,&quot; but &quot;chemical pregnancy&quot; is what my research has turned up. All the sources say that physically, it&#39;s more like a cycle in which pregnancy didn&#39;t occur, and not like a &quot;&quot;true miscarriage.&quot;&quot; I am certain it hurts way worse if it happens later, but it still hurts now and feels like a terrible loss. I loved that baby already and I can&#39;t believe it&#39;s gone.</p>

<p>We also did a blood test, and my hcg level was 3, so I asked the doctor if I was actually pregnant at all - can it really drop that fast? She said it could have been a very early loss OR a false positive. So now I&#39;m not sure what to do. Do I still get to grieve even though maybe no baby was lost? I feel so sad and confused.</p>

<p>Added to that, my husband isn&#39;t sure he wants to keep trying. I really do but don&#39;t want to pressure him. I wish he would make up his mind so I could grieve that at the same time too and get it all over with. </p>
</div><!-- SC_ON -->",,new,,,True,False,False,False,False,[],[],False,,False,False,False,,[],False,,,,t5_34scd,,,,9oj31i,True,,mothstuckinabath,,8,True,no_ads,False,[],False,,/r/ttcafterloss/comments/9oj31i/nurse_made_me_feel_bad_feeling_weird_about_it/,no_ads,False,https://www.reddit.com/r/ttcafterloss/comments/9oj31i/nurse_made_me_feel_bad_feeling_weird_about_it/,10027,1539653990.0,0,,False,False,{},,,,,,
114,2048,confidence,<praw.reddit.Reddit object at 0x7f12a630cd90>,,ttcafterloss,[deleted],,False,,0,False,"Little Rock, Arkansas Wave of Light Ceremony. You live as long as you are remembered.",[],r/ttcafterloss,False,0,,0,140.0,,False,t3_9oiyhd,False,dark,1.0,,public,1,0,{},140.0,,False,[],,True,False,,{},,False,1,,,default,False,,,{},,False,,1539681813.0,text,0,,,,i.redd.it,False,"<!-- SC_OFF --><div class=""md""><p>[deleted]</p>
</div><!-- SC_ON -->",,new,,,True,True,False,False,False,[],[],False,,False,False,False,,[],False,,,,t5_34scd,,,,9oiyhd,False,,,,1,True,no_ads,False,[],,dark,/r/ttcafterloss/comments/9oiyhd/little_rock_arkansas_wave_of_light_ceremony_you/,no_ads,False,https://i.redd.it/cmapv8md9gs11.jpg,10027,1539653013.0,0,,False,False,{},,,,https://i.redd.it/cmapv8md9gs11.jpg,,
