143,2048,confidence,<praw.reddit.Reddit object at 0x7f12a630cd90>,,ttcafterloss,"For alums or anyone who has experience... How long did it take you to get pregnant after a 2nd tri loss?

More info about me:
I delivered my baby at 21 weeks in September. We have started trying again. We have been trying for two cycles and are now in the 3rd cycle. I am SO over trying already. I feel desperate to be pregnant again. 

My periods have been heavy and gnarly compared to before, until this month. I am trying not to get my hopes up, but this last period was more like my prepregnancy normal. Maybe my body is finally healed (I had a long traumatic recovery involving a d&c a month after delivery). 
",t2_za0cs,False,,0,False,How long does it take?,[],r/ttcafterloss,False,0,question,0,,,False,t3_ar4x4s,False,dark,0.92,,public,9,0,{},,b22615aa-711f-11e4-97ba-12313b0e92a7,False,[],,False,False,,{},Question,False,9,,False,self,False,,[],{},,True,,1550317486.0,text,0,,,text,self.ttcafterloss,False,"<!-- SC_OFF --><div class=""md""><p>For alums or anyone who has experience... How long did it take you to get pregnant after a 2nd tri loss?</p>

<p>More info about me:
I delivered my baby at 21 weeks in September. We have started trying again. We have been trying for two cycles and are now in the 3rd cycle. I am SO over trying already. I feel desperate to be pregnant again. </p>

<p>My periods have been heavy and gnarly compared to before, until this month. I am trying not to get my hopes up, but this last period was more like my prepregnancy normal. Maybe my body is finally healed (I had a long traumatic recovery involving a d&amp;c a month after delivery). </p>
</div><!-- SC_ON -->",,new,,,True,False,False,False,False,[],[],False,False,False,False,"21wk loss, 9/15/18",[],False,,,,t5_34scd,,,,ar4x4s,True,,sewbalanced,,9,True,no_ads,False,[],False,dark,/r/ttcafterloss/comments/ar4x4s/how_long_does_it_take/,no_ads,False,https://www.reddit.com/r/ttcafterloss/comments/ar4x4s/how_long_does_it_take/,10027,1550288686.0,0,,False,False,{},64bc0a4e-a73f-11e4-8d5c-22000bc1c25f,,,,,
144,2048,confidence,<praw.reddit.Reddit object at 0x7f12a630cd90>,,ttcafterloss,[deleted],,False,,0,False,I don't want to be here,[],r/ttcafterloss,False,0,,0,,,False,t3_ar26aw,False,dark,1.0,,public,1,0,{},,,False,[],,False,False,,{},,False,1,,,default,False,,,{},,True,,1550298859.0,text,0,,,,self.ttcafterloss,False,"<!-- SC_OFF --><div class=""md""><p>[deleted]</p>
</div><!-- SC_ON -->",,new,,,True,True,False,False,False,[],[],False,False,False,False,,[],False,,,,t5_34scd,,,,ar26aw,False,,,,0,True,no_ads,False,[],,dark,/r/ttcafterloss/comments/ar26aw/i_dont_want_to_be_here/,no_ads,False,https://www.reddit.com/r/ttcafterloss/comments/ar26aw/i_dont_want_to_be_here/,10027,1550270059.0,0,,False,False,{},,,,,,
145,2048,confidence,<praw.reddit.Reddit object at 0x7f12a630cd90>,,ttcafterloss,"I recently had a very early loss (4w,5d) and my regular OBGYN told me to wait until the next cycle before trying again. I’m confused because the on-call OBGYN (same practice as my regular OBGYN) and ER doctor both told me I could start trying again right away. I’ve looked through some of the threads here and see that some people have been told to wait and others were told they could TTC right away. My husband and I are trying to decide what is best for us. Does anyone have a journal article that supports waiting to try or getting pregnant right away? 

Edit:

https://www.ncbi.nlm.nih.gov/pmc/articles/PMC4780347/#!po=1.00000

Thanks to u/arielsjealous for pointing me towards the EAGeR study ",t2_16iuyg,False,,0,False,Evidence for/against waiting to try again,[],r/ttcafterloss,False,0,question,0,,,False,t3_aqzi7m,False,dark,0.94,,public,13,0,{},,,False,[],,False,False,,{},Question,False,13,,False,self,1550263599.0,,[],{},,True,,1550283726.0,text,0,,,text,self.ttcafterloss,False,"<!-- SC_OFF --><div class=""md""><p>I recently had a very early loss (4w,5d) and my regular OBGYN told me to wait until the next cycle before trying again. I’m confused because the on-call OBGYN (same practice as my regular OBGYN) and ER doctor both told me I could start trying again right away. I’ve looked through some of the threads here and see that some people have been told to wait and others were told they could TTC right away. My husband and I are trying to decide what is best for us. Does anyone have a journal article that supports waiting to try or getting pregnant right away? </p>

<p>Edit:</p>

<p><a href=""https://www.ncbi.nlm.nih.gov/pmc/articles/PMC4780347/#!po=1.00000"">https://www.ncbi.nlm.nih.gov/pmc/articles/PMC4780347/#!po=1.00000</a></p>

<p>Thanks to <a href=""/u/arielsjealous"">u/arielsjealous</a> for pointing me towards the EAGeR study </p>
</div><!-- SC_ON -->",,new,,,True,False,False,False,False,[],[],False,False,False,False,,[],False,,,,t5_34scd,,,,aqzi7m,True,,BeachBallLadyNuts,,23,True,no_ads,False,[],False,,/r/ttcafterloss/comments/aqzi7m/evidence_foragainst_waiting_to_try_again/,no_ads,False,https://www.reddit.com/r/ttcafterloss/comments/aqzi7m/evidence_foragainst_waiting_to_try_again/,10027,1550254926.0,0,,False,False,{},64bc0a4e-a73f-11e4-8d5c-22000bc1c25f,self,"{'images': [{'source': {'url': 'https://external-preview.redd.it/ZhyMcLgRmcfLDdpxTMbdAqLpJdpXdgXLYank-HJqGKE.jpg?auto=webp&s=a2f30f8f09624d28dcb0887c0bc2f365b4e2d276', 'width': 1200, 'height': 630}, 'resolutions': [{'url': 'https://external-preview.redd.it/ZhyMcLgRmcfLDdpxTMbdAqLpJdpXdgXLYank-HJqGKE.jpg?width=108&crop=smart&auto=webp&s=462f6955824676ca394ddd834630c1f858825326', 'width': 108, 'height': 56}, {'url': 'https://external-preview.redd.it/ZhyMcLgRmcfLDdpxTMbdAqLpJdpXdgXLYank-HJqGKE.jpg?width=216&crop=smart&auto=webp&s=3f6e5d8e6d249b3b533a7105f75fc1bd1e79923e', 'width': 216, 'height': 113}, {'url': 'https://external-preview.redd.it/ZhyMcLgRmcfLDdpxTMbdAqLpJdpXdgXLYank-HJqGKE.jpg?width=320&crop=smart&auto=webp&s=554d41efc40e2b181f35bf6409eaa5fcb038aafc', 'width': 320, 'height': 168}, {'url': 'https://external-preview.redd.it/ZhyMcLgRmcfLDdpxTMbdAqLpJdpXdgXLYank-HJqGKE.jpg?width=640&crop=smart&auto=webp&s=81c3df28088976b4c5c8540cbf99f8ba2f5d3697', 'width': 640, 'height': 336}, {'url': 'https://external-preview.redd.it/ZhyMcLgRmcfLDdpxTMbdAqLpJdpXdgXLYank-HJqGKE.jpg?width=960&crop=smart&auto=webp&s=d308f439f69593aaa7dbd6034c2ae2ac566009b8', 'width': 960, 'height': 504}, {'url': 'https://external-preview.redd.it/ZhyMcLgRmcfLDdpxTMbdAqLpJdpXdgXLYank-HJqGKE.jpg?width=1080&crop=smart&auto=webp&s=fbb0c6b0ca9381a65cbfde81c84c669afd5906da', 'width': 1080, 'height': 567}], 'variants': {}, 'id': 'DCj74BDkkVzulrO5U31_N1im359t_1og5mHvV41eaVU'}], 'enabled': False}",,,
146,2048,confidence,<praw.reddit.Reddit object at 0x7f12a630cd90>,,ttcafterloss,"**How are you doing today? What's new?**

Off-topic discussion is allowed :)

**Note**: Please refrain from discussing positive tests (and beyond) in this thread - those topics are better suited for the Weekly Results thread or the new sub for Alumni. Thank you!
",t2_6l4z3,False,,0,False,"/ttcafterloss Daily Discussion Thread #2 - February 15, 2019",[],r/ttcafterloss,False,0,ttc,0,,,False,t3_aqzcw7,False,dark,1.0,,public,1,0,{},,,False,[],,False,False,,{},TTC Thread,False,1,,True,self,False,,[],{},,True,,1550282909.0,text,0,,,text,self.ttcafterloss,False,"<!-- SC_OFF --><div class=""md""><p><strong>How are you doing today? What&#39;s new?</strong></p>

<p>Off-topic discussion is allowed :)</p>

<p><strong>Note</strong>: Please refrain from discussing positive tests (and beyond) in this thread - those topics are better suited for the Weekly Results thread or the new sub for Alumni. Thank you!</p>
</div><!-- SC_ON -->",,new,,,True,True,False,False,False,[],[],False,False,False,False,,[],False,,,moderator,t5_34scd,,,,aqzcw7,True,,AutoModerator,,5,False,no_ads,False,[],False,,/r/ttcafterloss/comments/aqzcw7/ttcafterloss_daily_discussion_thread_2_february/,no_ads,False,https://www.reddit.com/r/ttcafterloss/comments/aqzcw7/ttcafterloss_daily_discussion_thread_2_february/,10027,1550254109.0,0,,False,False,{},,,,,,
147,2048,confidence,<praw.reddit.Reddit object at 0x7f12a630cd90>,,ttcafterloss,[deleted],,False,,0,False,AF came early? So what does this mean?,[],r/ttcafterloss,False,0,,0,,,False,t3_aqz3he,False,dark,1.0,,public,5,0,{},,,False,[],,False,False,,{},,False,5,,,default,False,,,{},,True,,1550281445.0,text,0,,,,self.ttcafterloss,False,"<!-- SC_OFF --><div class=""md""><p>[deleted]</p>
</div><!-- SC_ON -->",,new,,,True,False,False,False,False,[],[],False,False,False,False,,[],False,,,,t5_34scd,,,,aqz3he,False,,,,8,True,no_ads,False,[],,dark,/r/ttcafterloss/comments/aqz3he/af_came_early_so_what_does_this_mean/,no_ads,False,https://www.reddit.com/r/ttcafterloss/comments/aqz3he/af_came_early_so_what_does_this_mean/,10027,1550252645.0,0,,False,False,{},,,,,,
148,2048,confidence,<praw.reddit.Reddit object at 0x7f12a630cd90>,,ttcafterloss,"So before my angel I had regular periods, regular birth control periods that is. I had a chemical pregnancy after losing my son in July. That was in October. Fast forward to December AF perfect on time. January AF was 15 days late. Took multiple tests and they were negative. AF for this month is 3 days late. I took a pregnancy test 2 days before missed AF and it was negative but it wasn’t with FMU. I have a package coming with OPK and pregnancy tests so that’s why I haven’t taken another one yet. 


I’m wondering if this has happened to anyone else before? I thought about making an appointment last month but I put it off and said it happens. But after this especially if my test is negative I’m going in to see my OB.  ",,False,,0,False,Cycles,[],r/ttcafterloss,False,0,question,0,,,False,t3_aqyx9b,False,dark,1.0,,public,2,0,{},,,False,[],,False,False,,{},Question,False,2,,,self,False,,,{},,True,,1550280466.0,text,0,,,,self.ttcafterloss,False,"<!-- SC_OFF --><div class=""md""><p>So before my angel I had regular periods, regular birth control periods that is. I had a chemical pregnancy after losing my son in July. That was in October. Fast forward to December AF perfect on time. January AF was 15 days late. Took multiple tests and they were negative. AF for this month is 3 days late. I took a pregnancy test 2 days before missed AF and it was negative but it wasn’t with FMU. I have a package coming with OPK and pregnancy tests so that’s why I haven’t taken another one yet. </p>

<p>I’m wondering if this has happened to anyone else before? I thought about making an appointment last month but I put it off and said it happens. But after this especially if my test is negative I’m going in to see my OB.  </p>
</div><!-- SC_ON -->",,new,,,True,False,False,False,False,[],[],False,False,False,False,,[],False,,,,t5_34scd,,,,aqyx9b,True,,,,4,True,no_ads,False,[],,dark,/r/ttcafterloss/comments/aqyx9b/cycles/,no_ads,False,https://www.reddit.com/r/ttcafterloss/comments/aqyx9b/cycles/,10027,1550251666.0,0,,False,False,{},64bc0a4e-a73f-11e4-8d5c-22000bc1c25f,,,,,
149,2048,confidence,<praw.reddit.Reddit object at 0x7f12a630cd90>,,ttcafterloss,"Cw: loss 

I've posted here once before, but now I'm really at a loss and I'm not sure where to go from here.

This is somewhat of a vent. I'm just not really sure how to feel.

I love my fh. His support is unwavering, he is just all around an incredible man. We discussed kids almost as soon as we got together two years ago.

Last year, we sat down and had a long talk about everything and had a plan. Once we get married, it's free game. We will pull the goalie and whatever happens happens. 

Well, after a 45 cycle that ended with a bfn, we had kind of gotten excited. At this point I had been off hbc for five or six months. We had another long talk, and he decided that he wanted to go ahead and start trying. Said that there was no difference whether it was now or in the next year, and we both agreed that just in case it took a bit, this was a good plan.

We concieved in cycle 5, but it ended with a loss at 6 weeks at the end of January. 

So it's been a few weeks, and I'm ready to face things head on. Let's get back to trying, at least sort of timing sex around my fw. I decided not to start temping again yet. 

We are laying in bed and once I started noticing ewcm, I asked him if he was ready to move forward. Told him if not, that's fine, but I need to know so that way we can use protection. He kind of.. Idk. He answered my question with a question and we moved away so I didn't get an exact answer. I didn't think much of it. 

Well, we didnt use protection and pretty sure we hit O-3, O-2, and O/O+1 (weird time of day lol).

Well, in a turn of events I realize I'm kind of spiraling downward emotionally. He has been working nights this week, and I work 8-5 so I've hardly seen him at all other than sleeping together for a couple of hours. 

I set an alarm for this morning so I could be awake we he got home so we could talk. I just wanted him to tell me that he loves me and reassure me that everything is okay. I miss my best friend.

So, you still love me right?
-Of course.
You still wanna put up with my shit for the next fifty years?
- *shakes head violently and starts laughing*
You still wanna start a family with me, right?

Fucking hesitation. Within about a half second he shakes his head and smiles.

No. 

So I point out that he hesitated and asked him what was up. 

He tells me that basically he is for sure he wants to some day, but ""if I could wait a few more months, I would"". Apparently he now has changed his mind and wants to travel and live his life stress free with me for a while after we get married since he hasn't been on a real vacation since he was 22. He is 30. 

Of course I understand, but I pointed all of this out in the first place. I told him that I didn't want a baby if he didn't, because this is the rest of our lives. I never wanted him to resent me or our kids because he had big dreams that he never brought to reality.

Part of me thinks it's just part of his grieving process. He was really excited when we found out I was pregnant and I think the whole thing kind of hit him like a freight train when I miscarried. 

Regardless, WHY DIDNT YOU TELL ME YOU WERENT SURE. WHY DID I HAVE TO FUCKING PRY TO GET AN ANSWER ABOUT SOMETHING SO IMPORTANT.

He said he was going to tell me, he just didn't want to upset me or disappoint me and that it's only been a couple days since he started feeling this way.

And now, for the first time ever, I just want to see AF.

It's not that I don't want this. God dammit do I want this. But we have some shit to sort out now and since we keep pushing our wedding back, I'm probably looking at waiting until at least 2020 if this isn't just a phase of grief or something that passes. 

I just don't get it. I mean I do. I want to experience things with him too, and I understand its important to do so. I just don't understand how someone who was so excited about being a dad and starting a family can just change his mind, I guess. This is what I thought I was avoiding when I reiterated so many times that if this isn't what he wants, than neither do I. 

I don't know. I told him kids are forever. So if I had carried to term, what then? 

Either way, this is going to be a long process because I'm going to have a hard time trusting him moving forward. He has to decide when traveling is enough, when he has seen and done enough and I can't decide that for him. If he comes back in two months and says he wants to try again, how do I know he means it??

I mean I thought I was pretty fucking clear the first time but whatever.
If you made it this far, thanks for listening. 

If you have any ideas or thoughts feel free to leave them. ",t2_2pn9qfuw,False,,0,False,"One step forward, two steps back. Neat. [long vent]",[],r/ttcafterloss,False,0,vent,0,,,False,t3_aqw787,False,dark,1.0,,public,2,0,{},,8b677c92-711f-11e4-b63c-12313b0b807d,False,[],,False,False,,{},Vent,False,2,,False,self,False,,[],{},,True,,1550263464.0,text,0,,,text,self.ttcafterloss,False,"<!-- SC_OFF --><div class=""md""><p>Cw: loss </p>

<p>I&#39;ve posted here once before, but now I&#39;m really at a loss and I&#39;m not sure where to go from here.</p>

<p>This is somewhat of a vent. I&#39;m just not really sure how to feel.</p>

<p>I love my fh. His support is unwavering, he is just all around an incredible man. We discussed kids almost as soon as we got together two years ago.</p>

<p>Last year, we sat down and had a long talk about everything and had a plan. Once we get married, it&#39;s free game. We will pull the goalie and whatever happens happens. </p>

<p>Well, after a 45 cycle that ended with a bfn, we had kind of gotten excited. At this point I had been off hbc for five or six months. We had another long talk, and he decided that he wanted to go ahead and start trying. Said that there was no difference whether it was now or in the next year, and we both agreed that just in case it took a bit, this was a good plan.</p>

<p>We concieved in cycle 5, but it ended with a loss at 6 weeks at the end of January. </p>

<p>So it&#39;s been a few weeks, and I&#39;m ready to face things head on. Let&#39;s get back to trying, at least sort of timing sex around my fw. I decided not to start temping again yet. </p>

<p>We are laying in bed and once I started noticing ewcm, I asked him if he was ready to move forward. Told him if not, that&#39;s fine, but I need to know so that way we can use protection. He kind of.. Idk. He answered my question with a question and we moved away so I didn&#39;t get an exact answer. I didn&#39;t think much of it. </p>

<p>Well, we didnt use protection and pretty sure we hit O-3, O-2, and O/O+1 (weird time of day lol).</p>

<p>Well, in a turn of events I realize I&#39;m kind of spiraling downward emotionally. He has been working nights this week, and I work 8-5 so I&#39;ve hardly seen him at all other than sleeping together for a couple of hours. </p>

<p>I set an alarm for this morning so I could be awake we he got home so we could talk. I just wanted him to tell me that he loves me and reassure me that everything is okay. I miss my best friend.</p>

<p>So, you still love me right?
-Of course.
You still wanna put up with my shit for the next fifty years?
- <em>shakes head violently and starts laughing</em>
You still wanna start a family with me, right?</p>

<p>Fucking hesitation. Within about a half second he shakes his head and smiles.</p>

<p>No. </p>

<p>So I point out that he hesitated and asked him what was up. </p>

<p>He tells me that basically he is for sure he wants to some day, but &quot;if I could wait a few more months, I would&quot;. Apparently he now has changed his mind and wants to travel and live his life stress free with me for a while after we get married since he hasn&#39;t been on a real vacation since he was 22. He is 30. </p>

<p>Of course I understand, but I pointed all of this out in the first place. I told him that I didn&#39;t want a baby if he didn&#39;t, because this is the rest of our lives. I never wanted him to resent me or our kids because he had big dreams that he never brought to reality.</p>

<p>Part of me thinks it&#39;s just part of his grieving process. He was really excited when we found out I was pregnant and I think the whole thing kind of hit him like a freight train when I miscarried. </p>

<p>Regardless, WHY DIDNT YOU TELL ME YOU WERENT SURE. WHY DID I HAVE TO FUCKING PRY TO GET AN ANSWER ABOUT SOMETHING SO IMPORTANT.</p>

<p>He said he was going to tell me, he just didn&#39;t want to upset me or disappoint me and that it&#39;s only been a couple days since he started feeling this way.</p>

<p>And now, for the first time ever, I just want to see AF.</p>

<p>It&#39;s not that I don&#39;t want this. God dammit do I want this. But we have some shit to sort out now and since we keep pushing our wedding back, I&#39;m probably looking at waiting until at least 2020 if this isn&#39;t just a phase of grief or something that passes. </p>

<p>I just don&#39;t get it. I mean I do. I want to experience things with him too, and I understand its important to do so. I just don&#39;t understand how someone who was so excited about being a dad and starting a family can just change his mind, I guess. This is what I thought I was avoiding when I reiterated so many times that if this isn&#39;t what he wants, than neither do I. </p>

<p>I don&#39;t know. I told him kids are forever. So if I had carried to term, what then? </p>

<p>Either way, this is going to be a long process because I&#39;m going to have a hard time trusting him moving forward. He has to decide when traveling is enough, when he has seen and done enough and I can&#39;t decide that for him. If he comes back in two months and says he wants to try again, how do I know he means it??</p>

<p>I mean I thought I was pretty fucking clear the first time but whatever.
If you made it this far, thanks for listening. </p>

<p>If you have any ideas or thoughts feel free to leave them. </p>
</div><!-- SC_ON -->",,new,,,True,False,False,False,False,[],[],False,False,False,False,"TTC #1, cycle 6, MC 1.23",[],False,,,,t5_34scd,,,,aqw787,True,,savethedragonss,,4,True,no_ads,False,[],False,dark,/r/ttcafterloss/comments/aqw787/one_step_forward_two_steps_back_neat_long_vent/,no_ads,False,https://www.reddit.com/r/ttcafterloss/comments/aqw787/one_step_forward_two_steps_back_neat_long_vent/,10027,1550234664.0,0,,False,False,{},e465bc62-beec-11e4-a607-22000b6b9cb2,,,,,
150,2048,confidence,<praw.reddit.Reddit object at 0x7f12a630cd90>,,ttcafterloss,"**This thread is for members who are currently pregnant, or who have had their babies. Even though we have r/PregnancyAfterLoss and r/Rainbow_Babies now, r/ttcafterloss users still want to know how you're doing! What's new this week?**

 Off-topic discussion is allowed :)
",t2_6l4z3,False,,0,False,"/ttcafterloss Weekly Alumni Check-in! - February 15, 2019",[],r/ttcafterloss,False,0,pregnancy,0,,,False,t3_aqu1yl,False,dark,0.86,,public,5,0,{},,,False,[],,False,False,,{},Pregnancy Thread,False,5,,True,self,False,,[],{},,True,,1550243526.0,text,0,,,text,self.ttcafterloss,False,"<!-- SC_OFF --><div class=""md""><p><strong>This thread is for members who are currently pregnant, or who have had their babies. Even though we have <a href=""/r/PregnancyAfterLoss"">r/PregnancyAfterLoss</a> and <a href=""/r/Rainbow_Babies"">r/Rainbow_Babies</a> now, <a href=""/r/ttcafterloss"">r/ttcafterloss</a> users still want to know how you&#39;re doing! What&#39;s new this week?</strong></p>

<p>Off-topic discussion is allowed :)</p>
</div><!-- SC_ON -->",,new,,,True,False,False,False,False,[],[],False,False,False,False,,[],False,,,moderator,t5_34scd,,,,aqu1yl,True,,AutoModerator,,10,False,no_ads,False,[],False,,/r/ttcafterloss/comments/aqu1yl/ttcafterloss_weekly_alumni_checkin_february_15/,no_ads,False,https://www.reddit.com/r/ttcafterloss/comments/aqu1yl/ttcafterloss_weekly_alumni_checkin_february_15/,10027,1550214726.0,0,,False,False,{},,,,,,
151,2048,confidence,<praw.reddit.Reddit object at 0x7f12a630cd90>,,ttcafterloss,"**This weekly Friday thread is for members to ask questions of Alumni (members who are currently pregnant after loss or who have had a pregnancy after loss that resulted in a living child), without having to venture into the PregnanyAfterLoss sub.

Mention of current pregnancies is allowed, but please keep your references simple and clinical. ""I had success after trying X."" ""This resulted in a live birth."" ""My doctor recommended I do Y during my pregnancy.""
",t2_6l4z3,False,,0,False,"/ttcafterloss Ask an Alumni - February 15, 2019",[],r/ttcafterloss,False,0,,0,,,False,t3_aqu1wy,False,dark,1.0,,public,3,0,{},,,False,[],,False,False,,{},,False,3,,True,self,False,,[],{},,True,,1550243516.0,text,0,,,text,self.ttcafterloss,False,"<!-- SC_OFF --><div class=""md""><p>**This weekly Friday thread is for members to ask questions of Alumni (members who are currently pregnant after loss or who have had a pregnancy after loss that resulted in a living child), without having to venture into the PregnanyAfterLoss sub.</p>

<p>Mention of current pregnancies is allowed, but please keep your references simple and clinical. &quot;I had success after trying X.&quot; &quot;This resulted in a live birth.&quot; &quot;My doctor recommended I do Y during my pregnancy.&quot;</p>
</div><!-- SC_ON -->",,new,,,True,False,False,False,False,[],[],False,False,False,False,,[],False,,,moderator,t5_34scd,,,,aqu1wy,True,,AutoModerator,,33,False,no_ads,False,[],False,,/r/ttcafterloss/comments/aqu1wy/ttcafterloss_ask_an_alumni_february_15_2019/,no_ads,False,https://www.reddit.com/r/ttcafterloss/comments/aqu1wy/ttcafterloss_ask_an_alumni_february_15_2019/,10027,1550214716.0,0,,False,False,{},,,,,,
