,comment_limit,comment_sort,_reddit,approved_at_utc,subreddit,selftext,author_fullname,saved,mod_reason_title,gilded,clicked,title,link_flair_richtext,subreddit_name_prefixed,hidden,pwls,link_flair_css_class,downs,thumbnail_height,top_awarded_type,hide_score,name,quarantine,link_flair_text_color,upvote_ratio,author_flair_background_color,subreddit_type,ups,total_awards_received,media_embed,thumbnail_width,author_flair_template_id,is_original_content,user_reports,secure_media,is_reddit_media_domain,is_meta,category,secure_media_embed,link_flair_text,can_mod_post,score,approved_by,author_premium,thumbnail,edited,author_flair_css_class,author_flair_richtext,gildings,content_categories,is_self,mod_note,created,link_flair_type,wls,removed_by_category,banned_by,author_flair_type,domain,allow_live_comments,selftext_html,likes,suggested_sort,banned_at_utc,view_count,archived,no_follow,is_crosspostable,pinned,over_18,all_awardings,awarders,media_only,can_gild,spoiler,locked,author_flair_text,treatment_tags,visited,removed_by,num_reports,distinguished,subreddit_id,mod_reason_by,removal_reason,link_flair_background_color,id,is_robot_indexable,report_reasons,author,discussion_type,num_comments,send_replies,whitelist_status,contest_mode,mod_reports,author_patreon_flair,author_flair_text_color,permalink,parent_whitelist_status,stickied,url,subreddit_subscribers,created_utc,num_crossposts,media,is_video,_fetched,_comments_by_id,link_flair_template_id,post_hint,preview,url_overridden_by_dest,crosspost_parent_list,crosspost_parent
0,2048,confidence,<praw.reddit.Reddit object at 0x7f12a630cd90>,,ttcafterloss,"**How are you doing today? What's new?**

Off-topic discussion is allowed :)

**Note**: Please refrain from discussing positive tests (and beyond) in this thread - those topics are better suited for the Weekly Results thread or the new sub for Alumni. Thank you!
",t2_6l4z3,False,,0,False,"/ttcafterloss Daily Discussion Thread # 1- March 02, 2019",[],r/ttcafterloss,False,0,ttc,0,,,False,t3_awf51f,False,dark,1.0,,public,1,0,{},,,False,[],,False,False,,{},TTC Thread,False,1,,True,self,False,,[],{},,True,,1551539400.0,text,0,,,text,self.ttcafterloss,False,"<!-- SC_OFF --><div class=""md""><p><strong>How are you doing today? What&#39;s new?</strong></p>

<p>Off-topic discussion is allowed :)</p>

<p><strong>Note</strong>: Please refrain from discussing positive tests (and beyond) in this thread - those topics are better suited for the Weekly Results thread or the new sub for Alumni. Thank you!</p>
</div><!-- SC_ON -->",,new,,,True,True,False,False,False,[],[],False,False,False,False,,[],False,,,moderator,t5_34scd,,,,awf51f,True,,AutoModerator,,14,False,no_ads,False,[],False,,/r/ttcafterloss/comments/awf51f/ttcafterloss_daily_discussion_thread_1_march_02/,no_ads,False,https://www.reddit.com/r/ttcafterloss/comments/awf51f/ttcafterloss_daily_discussion_thread_1_march_02/,10027,1551510600.0,0,,False,False,{},,,,,,
1,2048,confidence,<praw.reddit.Reddit object at 0x7f12a630cd90>,,ttcafterloss,"After a mmc in May and a blighted ovum in November, my insurance will cover all tests for recurrent pregnancy loss. I’ve had 35 vials of blood drawn in the last four months and $10,000 worth of tests (I pay up front then get reimbursed because obviously I have $10k laying around on a writer’s salary.) Now the fertility doctor wants to track my cycle and give me a trigger shot and honestly I don’t know what half this stuff is anymore. Has anyone had a doctor track their cycle and do a bunch of tests throughout the whole thing? ",t2_a3j2sgk,False,,0,False,Doctors tracking cycles,[],r/ttcafterloss,False,0,,0,,,False,t3_awdmsj,False,dark,1.0,,public,3,0,{},,,False,[],,False,False,,{},,False,3,,False,self,False,,[],{},,True,,1551528167.0,text,0,,,text,self.ttcafterloss,False,"<!-- SC_OFF --><div class=""md""><p>After a mmc in May and a blighted ovum in November, my insurance will cover all tests for recurrent pregnancy loss. I’ve had 35 vials of blood drawn in the last four months and $10,000 worth of tests (I pay up front then get reimbursed because obviously I have $10k laying around on a writer’s salary.) Now the fertility doctor wants to track my cycle and give me a trigger shot and honestly I don’t know what half this stuff is anymore. Has anyone had a doctor track their cycle and do a bunch of tests throughout the whole thing? </p>
</div><!-- SC_ON -->",,new,,,True,False,False,False,False,[],[],False,False,False,False,,[],False,,,,t5_34scd,,,,awdmsj,True,,jgh33,,3,True,no_ads,False,[],False,,/r/ttcafterloss/comments/awdmsj/doctors_tracking_cycles/,no_ads,False,https://www.reddit.com/r/ttcafterloss/comments/awdmsj/doctors_tracking_cycles/,10027,1551499367.0,0,,False,False,{},,,,,,
2,2048,confidence,<praw.reddit.Reddit object at 0x7f12a630cd90>,,ttcafterloss,"Well this week was rough.  A close girl friend announced her pregnancy at the beginning of the week, and my period started this morning after our first IUI following our second loss. (There's been some ugly crying happening over here.) On my way home from work today I picked up a bottle of wine and ice cream, and I'm raising a glass to all of you, hoping your weeks have gone better than mine. Cheers!",t2_p8ed5,False,,0,False,Just toasting you all,[],r/ttcafterloss,False,0,,0,,,False,t3_awbk27,False,dark,0.98,,public,31,0,{},,,False,[],,False,False,,{},,False,31,,False,self,False,,[],{},,True,,1551514056.0,text,0,,,text,self.ttcafterloss,False,"<!-- SC_OFF --><div class=""md""><p>Well this week was rough.  A close girl friend announced her pregnancy at the beginning of the week, and my period started this morning after our first IUI following our second loss. (There&#39;s been some ugly crying happening over here.) On my way home from work today I picked up a bottle of wine and ice cream, and I&#39;m raising a glass to all of you, hoping your weeks have gone better than mine. Cheers!</p>
</div><!-- SC_ON -->",,new,,,True,False,False,False,False,[],[],False,False,False,False,,[],False,,,,t5_34scd,,,,awbk27,True,,sipporah7,,2,True,no_ads,False,[],False,,/r/ttcafterloss/comments/awbk27/just_toasting_you_all/,no_ads,False,https://www.reddit.com/r/ttcafterloss/comments/awbk27/just_toasting_you_all/,10027,1551485256.0,0,,False,False,{},,,,,,
3,2048,confidence,<praw.reddit.Reddit object at 0x7f12a630cd90>,,ttcafterloss,[deleted],,False,,0,False,"Ectopic unlikely, still measuring at 6w2d (same as Feb 1) blighted ovum likely... confused and want it to be over. How long until I actually pass?",[],r/ttcafterloss,False,0,question,0,,,False,t3_awbfpf,False,dark,1.0,,public,4,0,{},,,False,[],,False,False,,{},Question,False,4,,,default,False,,,{},,True,,1551513261.0,text,0,,,,self.ttcafterloss,False,"<!-- SC_OFF --><div class=""md""><p>[deleted]</p>
</div><!-- SC_ON -->",,new,,,True,False,False,False,False,[],[],False,False,False,False,,[],False,,,,t5_34scd,,,,awbfpf,False,,,,8,True,no_ads,False,[],,dark,/r/ttcafterloss/comments/awbfpf/ectopic_unlikely_still_measuring_at_6w2d_same_as/,no_ads,False,https://www.reddit.com/r/ttcafterloss/comments/awbfpf/ectopic_unlikely_still_measuring_at_6w2d_same_as/,10027,1551484461.0,0,,False,False,{},64bc0a4e-a73f-11e4-8d5c-22000bc1c25f,,,,,
