,comment_limit,comment_sort,_reddit,approved_at_utc,subreddit,selftext,author_fullname,saved,mod_reason_title,gilded,clicked,title,link_flair_richtext,subreddit_name_prefixed,hidden,pwls,link_flair_css_class,downs,thumbnail_height,top_awarded_type,hide_score,name,quarantine,link_flair_text_color,upvote_ratio,author_flair_background_color,subreddit_type,ups,total_awards_received,media_embed,thumbnail_width,author_flair_template_id,is_original_content,user_reports,secure_media,is_reddit_media_domain,is_meta,category,secure_media_embed,link_flair_text,can_mod_post,score,approved_by,author_premium,thumbnail,edited,author_flair_css_class,author_flair_richtext,gildings,content_categories,is_self,mod_note,created,link_flair_type,wls,removed_by_category,banned_by,author_flair_type,domain,allow_live_comments,selftext_html,likes,suggested_sort,banned_at_utc,view_count,archived,no_follow,is_crosspostable,pinned,over_18,all_awardings,awarders,media_only,can_gild,spoiler,locked,author_flair_text,treatment_tags,visited,removed_by,num_reports,distinguished,subreddit_id,mod_reason_by,removal_reason,link_flair_background_color,id,is_robot_indexable,report_reasons,author,discussion_type,num_comments,send_replies,whitelist_status,contest_mode,mod_reports,author_patreon_flair,author_flair_text_color,permalink,parent_whitelist_status,stickied,url,subreddit_subscribers,created_utc,num_crossposts,media,is_video,_fetched,_comments_by_id,link_flair_template_id,url_overridden_by_dest,post_hint,preview,author_cakeday,crosspost_parent_list,crosspost_parent
0,2048,confidence,<praw.reddit.Reddit object at 0x7f12a630cd90>,,ttcafterloss,"**This weekly Tuesday thread is for members who have had more than one loss, of any type. How are you feeling? Are you pursuing any testing? Discuss general issues related to repeat loss.**

Relevant mention of current pregnancies is allowed, but please keep your references simple and clinical. ""I had success after trying X."" ""This resulted in a live birth.""",t2_6l4z3,False,,0,False,"/ttcafterloss Repeat Pregnancy Loss - July 14, 2020",[],r/ttcafterloss,False,0,rpl,0,,,False,t3_hqwvsg,False,dark,0.5,,public,0,0,{},,,False,[],,False,False,,{},Repeat Pregnancy Loss,False,0,,True,self,False,,[],{},,True,,1594739360.0,text,0,,,text,self.ttcafterloss,False,"<!-- SC_OFF --><div class=""md""><p><strong>This weekly Tuesday thread is for members who have had more than one loss, of any type. How are you feeling? Are you pursuing any testing? Discuss general issues related to repeat loss.</strong></p>

<p>Relevant mention of current pregnancies is allowed, but please keep your references simple and clinical. &quot;I had success after trying X.&quot; &quot;This resulted in a live birth.&quot;</p>
</div><!-- SC_ON -->",,new,,,True,True,False,False,False,[],[],False,False,False,False,,[],False,,,moderator,t5_34scd,,,,hqwvsg,True,,AutoModerator,,12,False,no_ads,False,[],False,,/r/ttcafterloss/comments/hqwvsg/ttcafterloss_repeat_pregnancy_loss_july_14_2020/,no_ads,False,https://www.reddit.com/r/ttcafterloss/comments/hqwvsg/ttcafterloss_repeat_pregnancy_loss_july_14_2020/,10027,1594710560.0,0,,False,False,{},,,,,,,
1,2048,confidence,<praw.reddit.Reddit object at 0x7f12a630cd90>,,ttcafterloss,"**How are you doing today? What's new?**

Off-topic discussion is allowed :)

**Note**: Please refrain from discussing positive tests (and beyond) in this thread - those topics are better suited for the Weekly Results thread or the new sub for Alumni. Thank you!",t2_6l4z3,False,,0,False,"/ttcafterloss Daily Discussion Thread # 1- July 14, 2020",[],r/ttcafterloss,False,0,ttc,0,,,False,t3_hqwvqf,False,dark,1.0,,public,1,0,{},,,False,[],,False,False,,{},TTC Thread,False,1,,True,self,False,,[],{},,True,,1594739352.0,text,0,,,text,self.ttcafterloss,False,"<!-- SC_OFF --><div class=""md""><p><strong>How are you doing today? What&#39;s new?</strong></p>

<p>Off-topic discussion is allowed :)</p>

<p><strong>Note</strong>: Please refrain from discussing positive tests (and beyond) in this thread - those topics are better suited for the Weekly Results thread or the new sub for Alumni. Thank you!</p>
</div><!-- SC_ON -->",,new,,,True,True,False,False,False,[],[],False,False,False,False,,[],False,,,moderator,t5_34scd,,,,hqwvqf,True,,AutoModerator,,16,False,no_ads,False,[],False,,/r/ttcafterloss/comments/hqwvqf/ttcafterloss_daily_discussion_thread_1_july_14/,no_ads,False,https://www.reddit.com/r/ttcafterloss/comments/hqwvqf/ttcafterloss_daily_discussion_thread_1_july_14/,10027,1594710552.0,0,,False,False,{},,,,,,,
2,2048,confidence,<praw.reddit.Reddit object at 0x7f12a630cd90>,,ttcafterloss,"*TL;DR:*

*Have you been able to maintain strong friendships with pregnant friends or friends who have become parents, while you’re struggling to conceive?*

*Have any of you regretted not doing more or trying harder to salvage your friendships with your pregnant friends or friends who are parents?*

*If the different journeys caused distance or a temporary strain on the relationship, were you able to successfully circle back and continue your friendship later on? Did “taking time for yourself to heal” permanently damage or change your relationship with your pregnant friend in the long run (as in their eyes it’s probably abandonment or not being there for them)?*

*Struggling to find a balance between what’s best for me vs. supporting a pregnant friend. Worried that what I’ve been doing temporarily in my best interest is actually doing irreparable damage to a lifelong childhood friendship.*
____
I have suffered multiple miscarriages. I have good days, bad days, and my grief comes in waves.

It’s hard for me when my pregnant best friend reaches out to talk about her pregnancy. I know she’s on a high and just wants to talk about her experience, so I let the attention stay on her and let her have a rambling session. A lot of the time she’s just venting or complaining about what’s uncomfortable or what symptom she’s having to deal with. In my head I’m thinking, at least your baby is alive and you will deliver it. At least you didn’t lose your baby like me over and over. On the other hand, I realize that this is her experience and her feelings are valid (just as mine are with my feelings of my miscarriages) and just because we’re experiencing different things doesn’t mean one is wrong or right or justified or not. Long story short, I always respond with brief positive comments to make her feel better or whatever she’s needing.

This friend knows I’ve been struggling with grief or depression, whatever you want to call it, due to my miscarriages. I spend hours avoiding responding to her texts because it just hurts thinking about what could’ve been - we were pregnant at the same time, I miscarried, she’s due this week. She knows it’s weird for me to not respond immediately, but since my miscarriages this has become the norm. (Side note: She has reminded me a million times that 5 of her other friends are pregnant or have just given birth recently, so how awesome it is that they’re all going through this together and the kids can grow up and play together. Then why not vent to them?! Why not talk about happy stuff with them?! People who can relate. Because I can’t.)

Today she texts me to vent and talking about possibly having to be induced this week if the baby isn’t here by *X* date, then a bunch of other things which I don’t even know how to respond to. It’s basically just talking about herself and the cue is that I need to make her feel better. The cherry on top is that my period started today, when I’ve been secretly thinking for the past week and a half that I’m pregnant and believed that I was experiencing certain pregnancy symptoms. Nope, got my hopes up for nothing. A few days ago, my SIL announced that she’s pregnant. All of these things happening, yet our conversations lately are all about her. Again, I understand where she’s coming from (excited and in your own zone/world) but on the other hand sometimes the one-sidedness is annoying.

I guess I’ve been thinking - my grief made me shut down and be less there for her during her happy time of pregnancy. I could’ve been a better friend, there’s no doubt. I have some guilt there. I wish I could’ve done more. It wasn’t what I imagined due to the pandemic and quarantine, but I could’ve been there for her more emotionally and whatnot. I could’ve reached out more (and initiated more) instead of being overcome with my own grief and depression. I could have sucked it up and just put my own feelings aside, even if it hurt. Maybe I created the wedge in our relationship and it’s my own fault we’re here - I didn’t want to be a downer and be a burden on her with my sadness. Maybe I could’ve initiated the conversation more instead of waiting for her.

Yet at the same time, she could’ve been a better friend to me as well during my miscarriages. She could’ve responded better when I told her my boundaries or sensitivities, actually respected my requests or if she couldn’t have maybe just kept her distance. When I told her I’m feeling literally depressed after the last miscarriage and think I need to talk to a therapist, maybe she could’ve acknowledged it afterward (or at all) or asked how I’m doing weeks later instead of every text being about her and her life only.

But on the other hand, I understand that no one understands miscarriage unless you’ve gone through it yourself. So maybe I’m being too hard on her, and yes when I’m pregnant (hopefully) I’m sure I’ll be self involved as well. These are my thoughts. You can clearly see the back and forth struggle I have in my head about this friendship.

I think we both navigated our experiences poorly, but it is what it is. It’s in the past, and we’re here now. We both could’ve done better, for sure. But, if I don’t change anything now then I think it won’t ever change and it will just get worse (maybe past a point of return).

I’m realizing that my friendship is evolving and is going to change with this friend. I think once her baby is here, she’ll be even more busy and we won’t be like we used to be (even if/when I have a baby later - fingers crossed). I honestly don’t think we’ll even see each other - she wasn’t the best at making time for me in person pre-pregnancy and with a baby it’ll only get worse or non-existent.

But the reason for my post is - have any of you been in a similar situation and *regretted not doing more or trying harder to salvage your friendships with your pregnant friends or friends who are parents*?

She’s one of my longest friendships I’ve ever had (since childhood), so I would be sad if we drifted away from each other now. Yet, on the other hand I understand that life happens and friendships change. And maybe I’ll make even closer friends during this stage of my life (trying to conceive) and the next (hopefully with other parents when I’m pregnant).

I guess I’m curious to hear about your personal experiences to see if I’ll be okay or if it’s the kick in the butt that I need to try to do more (even though it takes effort from both sides).",t2_2i3gu1x7,False,,0,False,Maintaining Strong Friendships with Pregnant Friends,[],r/ttcafterloss,False,0,vent,0,,,False,t3_hqt6s5,False,dark,1.0,,public,4,0,{},,,False,[],,False,False,,{},Vent,False,4,,False,self,1594732973.0,,[],{},,True,,1594722659.0,text,0,,,text,self.ttcafterloss,True,"<!-- SC_OFF --><div class=""md""><p><em>TL;DR:</em></p>

<p><em>Have you been able to maintain strong friendships with pregnant friends or friends who have become parents, while you’re struggling to conceive?</em></p>

<p><em>Have any of you regretted not doing more or trying harder to salvage your friendships with your pregnant friends or friends who are parents?</em></p>

<p><em>If the different journeys caused distance or a temporary strain on the relationship, were you able to successfully circle back and continue your friendship later on? Did “taking time for yourself to heal” permanently damage or change your relationship with your pregnant friend in the long run (as in their eyes it’s probably abandonment or not being there for them)?</em></p>

<p><em>Struggling to find a balance between what’s best for me vs. supporting a pregnant friend. Worried that what I’ve been doing temporarily in my best interest is actually doing irreparable damage to a lifelong childhood friendship.</em></p>

<hr/>

<p>I have suffered multiple miscarriages. I have good days, bad days, and my grief comes in waves.</p>

<p>It’s hard for me when my pregnant best friend reaches out to talk about her pregnancy. I know she’s on a high and just wants to talk about her experience, so I let the attention stay on her and let her have a rambling session. A lot of the time she’s just venting or complaining about what’s uncomfortable or what symptom she’s having to deal with. In my head I’m thinking, at least your baby is alive and you will deliver it. At least you didn’t lose your baby like me over and over. On the other hand, I realize that this is her experience and her feelings are valid (just as mine are with my feelings of my miscarriages) and just because we’re experiencing different things doesn’t mean one is wrong or right or justified or not. Long story short, I always respond with brief positive comments to make her feel better or whatever she’s needing.</p>

<p>This friend knows I’ve been struggling with grief or depression, whatever you want to call it, due to my miscarriages. I spend hours avoiding responding to her texts because it just hurts thinking about what could’ve been - we were pregnant at the same time, I miscarried, she’s due this week. She knows it’s weird for me to not respond immediately, but since my miscarriages this has become the norm. (Side note: She has reminded me a million times that 5 of her other friends are pregnant or have just given birth recently, so how awesome it is that they’re all going through this together and the kids can grow up and play together. Then why not vent to them?! Why not talk about happy stuff with them?! People who can relate. Because I can’t.)</p>

<p>Today she texts me to vent and talking about possibly having to be induced this week if the baby isn’t here by <em>X</em> date, then a bunch of other things which I don’t even know how to respond to. It’s basically just talking about herself and the cue is that I need to make her feel better. The cherry on top is that my period started today, when I’ve been secretly thinking for the past week and a half that I’m pregnant and believed that I was experiencing certain pregnancy symptoms. Nope, got my hopes up for nothing. A few days ago, my SIL announced that she’s pregnant. All of these things happening, yet our conversations lately are all about her. Again, I understand where she’s coming from (excited and in your own zone/world) but on the other hand sometimes the one-sidedness is annoying.</p>

<p>I guess I’ve been thinking - my grief made me shut down and be less there for her during her happy time of pregnancy. I could’ve been a better friend, there’s no doubt. I have some guilt there. I wish I could’ve done more. It wasn’t what I imagined due to the pandemic and quarantine, but I could’ve been there for her more emotionally and whatnot. I could’ve reached out more (and initiated more) instead of being overcome with my own grief and depression. I could have sucked it up and just put my own feelings aside, even if it hurt. Maybe I created the wedge in our relationship and it’s my own fault we’re here - I didn’t want to be a downer and be a burden on her with my sadness. Maybe I could’ve initiated the conversation more instead of waiting for her.</p>

<p>Yet at the same time, she could’ve been a better friend to me as well during my miscarriages. She could’ve responded better when I told her my boundaries or sensitivities, actually respected my requests or if she couldn’t have maybe just kept her distance. When I told her I’m feeling literally depressed after the last miscarriage and think I need to talk to a therapist, maybe she could’ve acknowledged it afterward (or at all) or asked how I’m doing weeks later instead of every text being about her and her life only.</p>

<p>But on the other hand, I understand that no one understands miscarriage unless you’ve gone through it yourself. So maybe I’m being too hard on her, and yes when I’m pregnant (hopefully) I’m sure I’ll be self involved as well. These are my thoughts. You can clearly see the back and forth struggle I have in my head about this friendship.</p>

<p>I think we both navigated our experiences poorly, but it is what it is. It’s in the past, and we’re here now. We both could’ve done better, for sure. But, if I don’t change anything now then I think it won’t ever change and it will just get worse (maybe past a point of return).</p>

<p>I’m realizing that my friendship is evolving and is going to change with this friend. I think once her baby is here, she’ll be even more busy and we won’t be like we used to be (even if/when I have a baby later - fingers crossed). I honestly don’t think we’ll even see each other - she wasn’t the best at making time for me in person pre-pregnancy and with a baby it’ll only get worse or non-existent.</p>

<p>But the reason for my post is - have any of you been in a similar situation and <em>regretted not doing more or trying harder to salvage your friendships with your pregnant friends or friends who are parents</em>?</p>

<p>She’s one of my longest friendships I’ve ever had (since childhood), so I would be sad if we drifted away from each other now. Yet, on the other hand I understand that life happens and friendships change. And maybe I’ll make even closer friends during this stage of my life (trying to conceive) and the next (hopefully with other parents when I’m pregnant).</p>

<p>I guess I’m curious to hear about your personal experiences to see if I’ll be okay or if it’s the kick in the butt that I need to try to do more (even though it takes effort from both sides).</p>
</div><!-- SC_ON -->",,new,,,True,False,False,False,False,[],[],False,False,False,False,,[],False,,,,t5_34scd,,,,hqt6s5,True,,FMLtoOTF,,13,True,no_ads,False,[],False,,/r/ttcafterloss/comments/hqt6s5/maintaining_strong_friendships_with_pregnant/,no_ads,False,https://www.reddit.com/r/ttcafterloss/comments/hqt6s5/maintaining_strong_friendships_with_pregnant/,10027,1594693859.0,0,,False,False,{},e465bc62-beec-11e4-a607-22000b6b9cb2,,,,,,
3,2048,confidence,<praw.reddit.Reddit object at 0x7f12a630cd90>,,ttcafterloss,"Ever since I had a D&C almost a year ago, I’ve been experiencing low grade fevers (never higher than 100.4) and chills exactly one week before my period is expected to start. The fever and chills stick around until the period starts and then everything goes back to “normal”. When I brought it up to my gyno, she gave me her favorite response, a response that makes me want to light myself on fire, “yeah, that’s normal. It can happen.” Which, although it may be true, gives me no explanation as to why it’s happening. 

Everything I’ve read says it’s something called the “Period Flu” but it just seems strange that I’ve never experienced anything like this in my entire almost 20 years of having periods. 

Has anyone ever experienced anything similar to this after having a D&C? Please help me not lose my damn mind.",t2_8koed,False,,0,False,"Low grade fever and chills one week before my expected period, every period...",[],r/ttcafterloss,False,0,support,0,,,False,t3_hqsxxx,False,dark,1.0,,public,1,0,{},,,False,[],,False,False,,{},Support,False,1,,False,self,False,,[],{},,True,,1594721665.0,text,0,,,text,self.ttcafterloss,False,"<!-- SC_OFF --><div class=""md""><p>Ever since I had a D&amp;C almost a year ago, I’ve been experiencing low grade fevers (never higher than 100.4) and chills exactly one week before my period is expected to start. The fever and chills stick around until the period starts and then everything goes back to “normal”. When I brought it up to my gyno, she gave me her favorite response, a response that makes me want to light myself on fire, “yeah, that’s normal. It can happen.” Which, although it may be true, gives me no explanation as to why it’s happening. </p>

<p>Everything I’ve read says it’s something called the “Period Flu” but it just seems strange that I’ve never experienced anything like this in my entire almost 20 years of having periods. </p>

<p>Has anyone ever experienced anything similar to this after having a D&amp;C? Please help me not lose my damn mind.</p>
</div><!-- SC_ON -->",,new,,,True,True,False,False,False,[],[],False,False,False,False,,[],False,,,,t5_34scd,,,,hqsxxx,True,,fannyapplebottom,,20,True,no_ads,False,[],False,,/r/ttcafterloss/comments/hqsxxx/low_grade_fever_and_chills_one_week_before_my/,no_ads,False,https://www.reddit.com/r/ttcafterloss/comments/hqsxxx/low_grade_fever_and_chills_one_week_before_my/,10027,1594692865.0,0,,False,False,{},0b925822-beed-11e4-97e6-22000b3c81cc,,,,,,
4,2048,confidence,<praw.reddit.Reddit object at 0x7f12a630cd90>,,ttcafterloss,"They won’t let my husband back to the room with me because of covid.  I'm either having my fourth miscarriage or another ectopic. I had my third miscarriage just last month after our first cycle with clomid, and I was only like 5 weeks along so my ""period"" came only a week later than scheduled.  Tomorrow is when my app predicted my period would start again,  but it started today.  I was actually feeling grateful to go back on a normal cycle so we can start trying again. But my doctor called about blood work I had done last Thursday, and my HCG was 113. I don't know why in God's name they waited so long to tell me, but now I have to go through the ER again for another ultrasound and more blood work.  I hate this.  I hate that my body isn't working and it's getting rid of pregnancies so soon.  I really don't see how this can be a viable pregnancy because my period flow today is so heavy.",t2_dmyoaf6,False,,0,False,Alone in the ER,[],r/ttcafterloss,False,0,,0,,,False,t3_hqqstr,False,dark,0.96,,public,20,0,{},,,False,[],,False,False,,{},,False,20,,False,self,False,,[],{},,True,,1594713358.0,text,0,,,text,self.ttcafterloss,False,"<!-- SC_OFF --><div class=""md""><p>They won’t let my husband back to the room with me because of covid.  I&#39;m either having my fourth miscarriage or another ectopic. I had my third miscarriage just last month after our first cycle with clomid, and I was only like 5 weeks along so my &quot;period&quot; came only a week later than scheduled.  Tomorrow is when my app predicted my period would start again,  but it started today.  I was actually feeling grateful to go back on a normal cycle so we can start trying again. But my doctor called about blood work I had done last Thursday, and my HCG was 113. I don&#39;t know why in God&#39;s name they waited so long to tell me, but now I have to go through the ER again for another ultrasound and more blood work.  I hate this.  I hate that my body isn&#39;t working and it&#39;s getting rid of pregnancies so soon.  I really don&#39;t see how this can be a viable pregnancy because my period flow today is so heavy.</p>
</div><!-- SC_ON -->",,new,,,True,False,False,False,False,[],[],False,False,False,False,,[],False,,,,t5_34scd,,,,hqqstr,True,,extrafancychicken,,6,True,no_ads,False,[],False,,/r/ttcafterloss/comments/hqqstr/alone_in_the_er/,no_ads,False,https://www.reddit.com/r/ttcafterloss/comments/hqqstr/alone_in_the_er/,10027,1594684558.0,0,,False,False,{},,,,,,,
5,2048,confidence,<praw.reddit.Reddit object at 0x7f12a630cd90>,,ttcafterloss,[deleted],,False,,0,False,FSH and AMH testing after miscarriage. Does 3rd day of the period count if it’s just spotting?,[],r/ttcafterloss,False,0,question,0,,,False,t3_hqpmgn,False,dark,1.0,,public,1,0,{},,,False,[],,False,False,,{},Question,False,1,,,default,False,,,{},,True,,1594709145.0,text,0,deleted,,,self.ttcafterloss,False,"<!-- SC_OFF --><div class=""md""><p>[deleted]</p>
</div><!-- SC_ON -->",,new,,,True,True,False,False,False,[],[],False,False,False,False,,[],False,,,,t5_34scd,,,,hqpmgn,False,,,,1,True,no_ads,False,[],,dark,/r/ttcafterloss/comments/hqpmgn/fsh_and_amh_testing_after_miscarriage_does_3rd/,no_ads,False,https://www.reddit.com/r/ttcafterloss/comments/hqpmgn/fsh_and_amh_testing_after_miscarriage_does_3rd/,10027,1594680345.0,0,,False,False,{},64bc0a4e-a73f-11e4-8d5c-22000bc1c25f,,,,,,
